project_id,id,user_id,name,headline,budget,goal,about_html,permalink,video_embed_url,video_url,category_name,category_id,original_image,thumb_image,small_image,large_image,video_cover_image,progress,pledged,total_contributions,total_contributors,state,mode,state_order,expires_at,zone_expires_at,online_date,zone_online_date,sent_to_analysis_at,is_published,is_expired,open_for_contributions,online_days,remaining_time,elapsed_time,posts_count,address,user,reminder_count,is_owner_or_admin,user_signed_in,in_reminder,total_posts,can_request_transfer,is_admin_role,contributed_by_friends
10154,10154,394961,"Nome - O Filme","Qual é o limite da vaidade jornalística? Você é o que você escreve? Você é onde você trabalha? Você é quem você conhece?","<p>Equipe técnica (cachês, transporte e alimentação) - R$ 1.800,00 (25%)<br>Equipamento (locação, transporte) - R$ 2.200,00 (35%)<br>Elenco (cachês, transporte) - R$ 1.200,00 (17,5%)<br>Arte (figurino, adereços) - R$ 1.200,00 (17,5%)<br>Produção (Cópias jornais, revistas etc.) - R$ 600,00 (5%)<br>Total - R$ 7.000,00 (100%)</p>",7000.0,"<pre>A ideia é apresentar um personagem típico das redações e
embebê-lo no universo realista, violento e trágico do alemão
Michael Haneke, é a referência visual e narrativa para este
projeto. Solidão, vaidade, socialização, jornalismo,
poder, realidade e fantasia são ingredientes desta trama.

Um arco será apresentado nesta história sem nenhum diálogo,
pautado por ações e expressões de corpo e rosto. Neste arco,
vemos uma transformação radical na autoestima do personagem,
que alimenta seu ego com o universo que vive, mas vai
paulatinamente enxergando a realidade. 

No elenco, a presença do ator Germano Pereira (TV Globo,
'Passione', 'Guerra dos Sexos') como protagonista da trama,
o personagem 'Nome'.

Nossa equipe é formada por renomados professores da Academia
Internacional de Cinema, com vasta experiência de mercado
(acesse as biografias em <a href=""http://www.aicinema.com.br/pr"">www.aicinema.com.br/pr</a>ofessores)

O projeto será filmado no final de abril e teremos cinco
meses para finalização, estando pronto por volta de agosto.
Quanto às recompensas oferecidas, nossa produção entrará em
contato com cada um dos apoiadores, para que todos recebem
a recompensa designada, pessoalmente, se morar em São Paulo,
ou via correios, se morar em qualquer parte do Brasil.

Novidades e mais informações do curta na página do Facebook:
<a href=""https://www.facebook.com/pages/Nome-o-filme/348554662012898"">https://www.facebook.com/pages/Nome-o-filme/348554...</a>

EQUIPE
Direção: Franthiesco Ballerini
Roteiro: Franthiesco Ballerini
Direção de Fotografia: Rafael Nobre
Assistência de Direção: Aline Medeiros
Direção de Som: Cláudio Gonçalves
Direção de Produção: Teresinha Cipolotti
Assistência de Produção: Victor Oliveira
Direção de Arte: Teresinha Cipolotti
Montagem: Cláudio Gonçalves
Som Direto: Fábio Bessa Villafranca e Carol Castro
Assistência de Câmera: Luis Gustavo
Foto Still: Thammy Athayde

ELENCO
Germano Pereira
Lia Desjardins
</pre>",nomeofilme,//www.youtube.com/embed/LW86K-1qvVc,http://youtu.be/LW86K-1qvVc,"Cinema e Vídeo",13,https://s3-sa-east-1.amazonaws.com/cdn.br.catarse/uploads/project/uploaded_image/10154/10986866_10206284240412047_4331096013532928866_o__1_.jpg,https://s3-sa-east-1.amazonaws.com/cdn.br.catarse/uploads/project/uploaded_image/10154/project_thumb_thumb_10986866_10206284240412047_4331096013532928866_o__1_.jpg,https://s3-sa-east-1.amazonaws.com/cdn.br.catarse/uploads/project/uploaded_image/10154/project_thumb_small_10986866_10206284240412047_4331096013532928866_o__1_.jpg,https://s3-sa-east-1.amazonaws.com/cdn.br.catarse/uploads/project/uploaded_image/10154/project_thumb_large_10986866_10206284240412047_4331096013532928866_o__1_.jpg,https://s3-sa-east-1.amazonaws.com/cdn.br.catarse/uploads/project/uploaded_image/10154/project_thumb_video_cover_10986866_10206284240412047_4331096013532928866_o__1_.jpg,117.1000000000000000,8197.0,33,31,successful,aon,finished,"2015-05-07 02:59:59","2015-05-06 23:59:59","2015-03-27 13:24:53.498014","2015-03-27 10:24:53.498014",,t,t,f,40,"{""total"" : 0, ""unit"" : ""seconds""}","{""total"" : 40, ""unit"" : ""days""}",12,"{""city"" : ""São Paulo"", ""state_acronym"" : ""SP"", ""state"" : ""São Paulo""}","{""id"" : 394961, ""name"" : ""Franthiesco  Ballerini ""}",0,,f,f,12,f,f,f