project_id,id,user_id,name,headline,budget,goal,about_html,permalink,video_embed_url,video_url,category_name,category_id,original_image,thumb_image,small_image,large_image,video_cover_image,progress,pledged,total_contributions,total_contributors,state,mode,state_order,expires_at,zone_expires_at,online_date,zone_online_date,sent_to_analysis_at,is_published,is_expired,open_for_contributions,online_days,remaining_time,elapsed_time,posts_count,address,user,reminder_count,is_owner_or_admin,user_signed_in,in_reminder,total_posts,can_request_transfer,is_admin_role,contributed_by_friends
1036,1036,97518,"Coletivo da Pista - Forró Urbano","O Coletivo da Pista é um movimento independente de artes integradas.","O orçamento para projetos anteriores a 24/02/2015 normalmente pode ser encontrado na descrição acima.",2800.0,"<p>O Coletivo da Pista é um movimento independente de artes integradas. Jovens artistas uniram-se provendo o que cada um sabe fazer de melhor. Belas vozes, alguns instrumentos, um público empolgado e muita música.
Juntos, formamos uma banda, acompanhados do Palhaço Miro e de um Mestre de Cerimônias super carismático e lindo, pode apostar!
Em todos os nossos eventos contamos com a intervenção de atores; unindo assim música, teatro e público.</p>

<p>O Coletivo da Pista foi crescendo, e o público também. Na próxima edição (17 de Novembro), queremos ter uma estrutura de qualidade que atenda o nosso público.
O equipamento de som que nós temos, mesmo com o que conseguimos emprestado, não é suficiente para fazer um show para mais de 400 pessoas.
Precisamos de ajuda para alcançar nosso objetivo: realizar a 5ª edição do Coletivo da Pista com um som de qualidade!
A quantia que for arrecadada será revertida para o aluguel do som, solução para o piso da área do palco, confecção de flyers e das contrapartidas oferecidas no Catarse.</p>

<p>Nossa 5ª edição, o espetáculo Forró Urbano, será na Pedra do Leme no Rio de Janeiro.
Dia 17 de Novembro, sábado, a partir de 21hs estaremos esperando nosso público fiel, e todos os milhões de novos fãs.</p>

<p>Forró Urbano é a releitura do forró pelas lentes do Coletivo.
Só é possível se emocionar tanto com uma realidade tão distante, interpretando da nossa maneira. Por isso trazemos o forró que fala do sertão, da morena, do baião, do repente e do facão, mas que é feito na beira da saia de uma praia carioca, com o Forrock na mão, sob o abraço do Cristo, na Pedra dos Pescadores do Leme.</p>

<p>O Coletivo convida a todos de todas as idades a vir dançar forró dia 17 de Novembro!</p>

<p>Conheça a nossa página no Facebook: <a class=""alt-link"" href=""https://www.facebook.com/ColetivoDaPista"" target=""_blank"">https://www.facebook.com/ColetivoDaPista</a></p>

<p>Confirme sua presença no Evento! <a class=""alt-link"" href=""https://www.facebook.com/events/286169308169226/"" target=""_blank"">https://www.facebook.com/events/286169308169226/</a></p>

<p><img src=""http://sphotos-g.ak.fbcdn.net/hphotos-ak-prn1/562020_413589405373687_1151492372_n.jpg"" alt=""""/></p>

<p>&quot;Sonho que se sonha só, é só um sonho que se sonha só.
Sonho que se sonha junto, é realidade.&quot; (Raul Seixas)</p>

<p>COLETIVE-SE </p>

<p>JGD</p>
",ColetivoDaPista,//player.vimeo.com/video/51197588,http://vimeo.com/51197588,Artes,1,,https://s3-sa-east-1.amazonaws.com/cdn.br.catarse/uploads/project/video_thumbnail/1036/project_thumb_thumb_open-uri20131125-2-zfcft1,https://s3-sa-east-1.amazonaws.com/cdn.br.catarse/uploads/project/video_thumbnail/1036/project_thumb_small_open-uri20131125-2-zfcft1,https://s3-sa-east-1.amazonaws.com/cdn.br.catarse/uploads/project/video_thumbnail/1036/project_thumb_large_open-uri20131125-2-zfcft1,https://s3-sa-east-1.amazonaws.com/cdn.br.catarse/uploads/project/video_thumbnail/1036/project_thumb_video_cover_open-uri20131125-2-zfcft1,102.1428571428571400,2860.0,39,36,successful,aon,finished,"2012-11-12 01:59:59","2012-11-11 23:59:59","2012-09-13 01:59:59","2012-09-12 22:59:59",,t,t,f,60,"{""total"" : 0, ""unit"" : ""seconds""}","{""total"" : 60, ""unit"" : ""days""}",1,"{""city"" : ""Rio de Janeiro"", ""state_acronym"" : ""RJ"", ""state"" : ""Rio de Janeiro""}","{""id"" : 97518, ""name"" : ""Luiza Baccelli""}",0,,f,f,1,f,f,f