project_id,id,user_id,name,headline,budget,goal,about_html,permalink,video_embed_url,video_url,category_name,category_id,original_image,thumb_image,small_image,large_image,video_cover_image,progress,pledged,total_contributions,total_contributors,state,mode,state_order,expires_at,zone_expires_at,online_date,zone_online_date,sent_to_analysis_at,is_published,is_expired,open_for_contributions,online_days,remaining_time,elapsed_time,posts_count,address,user,reminder_count,is_owner_or_admin,user_signed_in,in_reminder,total_posts,can_request_transfer,is_admin_role,contributed_by_friends
1040,1040,82182,"Curta Até Onde Você Iria da Toscographics - fase 2","O Primeiro Curta com Manipulação de Bonecos da Toscographics!","O orçamento para projetos anteriores a 24/02/2015 normalmente pode ser encontrado na descrição acima.",8000.0,"<p>Oi pessoal! 
 Graças a vocês passamos dos 30%, temos uma segunda chance no Catarse para viabilizar o projeto. Além disso, com os apoios que recebemos de pessoas que querem trabalhar no curta, podemos diminuir bastante nosso orçamento! Wander Wildner, por exemplo, ofereceu seus talentos para a composição da trilha sonora (que
 você pode conferir nos vídeos que postamos nas atualizações do Catarse) e André Dahmer
 ofereceu lindos desenhos para engrossar nossa farta lista de recompensas aos colaboradores.</p>

<p>Então venham! Contribuam! Agora falta pouco!</p>

<p>Allan Sieber trabalha com animação desde 1993 e em 1999 fundou o estúdio Toscographics no Rio de Janeiro. Já fizemos animações para TV, cinema, internet e agora apresentamos nosso mais novo projeto da Tosco para o povo brasileiro:</p>

<p><em>ATÉ ONDE VOCÊ IRIA</em>
 Curta-metragem
 Direção de Allan Sieber</p>

<p>Sinopse: &quot;Até onde você iria&quot; é o gameshow de maior sucesso na TV brasileira de todos os tempos, comandado pelo carismático Porcão de Jesus, ex-PM, ex-pastor e ex-marido. Com a típica truculência carismática(?) de muitos astros da mídia, Porcão submete os competidores as provas mais humilhantes possíveis, para delírio da platéia sedenta por baixaria explícita.</p>

<p>Técnica: Manipulação de bonecos e animação 2 D.</p>

<p>Duração: 09 minutos</p>

<p>O projeto é bem simples, queremos retornar ao estilo Dogma 1,99  -  a animação de guerrilha que a Tosco sempre batalhou, e para isso precisamos do apoio de pessoas de bom gosto como VOCÊ, para a gente levar isso pra sua telinha! Seja nosso Mecenas!</p>

<p>O caro investidor deve estar se perguntando: Ora, mas porque dinheiro se a idéia é retomar o Dogma 1,99?</p>

<p>Economistas como Paul Krugman podem ter uma resposta melhor para a essa pergunta, mas a nossa é: precisamos pagar câmera, vozes, edição e pós produção. E alimentar os bonecos de plástico (pouca gente sabe, mas bonecos de plástico não comem em qualquer buffet a quilo).</p>
",ateonde2,//player.vimeo.com/video/51179046,http://vimeo.com/51179046,"Cinema e Vídeo",13,,https://s3-sa-east-1.amazonaws.com/cdn.br.catarse/uploads/project/video_thumbnail/1040/project_thumb_thumb_open-uri20131125-2-evip25,https://s3-sa-east-1.amazonaws.com/cdn.br.catarse/uploads/project/video_thumbnail/1040/project_thumb_small_open-uri20131125-2-evip25,https://s3-sa-east-1.amazonaws.com/cdn.br.catarse/uploads/project/video_thumbnail/1040/project_thumb_large_open-uri20131125-2-evip25,https://s3-sa-east-1.amazonaws.com/cdn.br.catarse/uploads/project/video_thumbnail/1040/project_thumb_video_cover_open-uri20131125-2-evip25,12.76250000000000000000,1021.0,19,19,failed,aon,finished,"2012-12-13 01:59:59","2012-12-12 23:59:59","2012-10-14 01:59:00","2012-10-13 22:59:00",,t,t,f,60,"{""total"" : 0, ""unit"" : ""seconds""}","{""total"" : 60, ""unit"" : ""days""}",11,"{""city"" : ""Rio de Janeiro"", ""state_acronym"" : ""RJ"", ""state"" : ""Rio de Janeiro""}","{""id"" : 82182, ""name"" : """"}",0,,f,f,11,f,f,f