project_id,id,user_id,name,headline,budget,goal,about_html,permalink,video_embed_url,video_url,category_name,category_id,original_image,thumb_image,small_image,large_image,video_cover_image,progress,pledged,total_contributions,total_contributors,state,mode,state_order,expires_at,zone_expires_at,online_date,zone_online_date,sent_to_analysis_at,is_published,is_expired,open_for_contributions,online_days,remaining_time,elapsed_time,posts_count,address,user,reminder_count,is_owner_or_admin,user_signed_in,in_reminder,total_posts,can_request_transfer,is_admin_role,contributed_by_friends
1043,1043,82661,"ANIKULAPO - DOCUMENTÁRIO SOBRE O MOVIMENTO AFROBEAT","Ajude a equipe a viajar para a Nigéria e terminar ANIKULAPO; o retorno da música e movimento político de Fela Kuti.","O orçamento para projetos anteriores a 24/02/2015 normalmente pode ser encontrado na descrição acima.",27770.0,"<p><em>Project Description in English below:</em></p>

<p>Pedro Rajão - <a class=""alt-link"" href=""mailto:rajonder@gmail.com"" target=""_blank"">rajonder@gmail.com</a></p>

<p>Meu nome é Pedro Rajão, diretor e produtor do documentário ANIKULAPO. Em 2010, deu-se o início da jornada de entrevistas, viagens e pesquisa que resultaram na afro-anarquia audiovisual, intitulada com o sobrenome de Fela.</p>

<p>O projeto está sendo filmado de forma independente há mais de dois anos. No momento, conto com mais de 30 horas de entrevistas e shows gravados, com nomes do afrobeat e da música brasileira como: </p>

<p>Seun Kuti, Femi Kuti, Baba Ani (Egypt 80´s), Gilberto Gil, Ebo Taylor, Tony Allen, Mulatu Astatke, Orquestre PolyRythmo de Cotonou, Dr.Carlos Moore (amigo e biógrafo do Fela), Martín Perna (Antibalas), Mãe Beata de Yemanjá, Zem Audu (Skatalites), Marcelo Yuka, Mr. Catra, Marku Ribas, Lúcio Maia, BNegão, Letieres Leite, Abayomi Afrobeat Orquestra, Bixiga 70, entre outros.</p>

<p>Já sob edição, ANIKULAPO precisa agora de uma ajuda final, para fechar as filmagens de forma genuína e coerente. A convite de Seun Kuti, vamos para Lagos, Nigéria, onde captaremos o principal material para a conclusão do projeto. Além de estar em contato direto com parentes, amigos, músicos e toda a esfera afrodiaspórica que nos levou a esse chão. </p>

<p>Para quem quiser participar da realização desse filme, estamos preparando uma série de recompensas anunciadas aqui ao lado, bem como as recompensas surpresas que divulgarei durante o próximo mês e meio. Vocês podem acompanhar o desenrolar da campanha e do projeto por aqui e na página no Facebook: <a class=""alt-link"" href=""http://www.facebook.com/anikulapo.brasil"" target=""_blank"">http://www.facebook.com/anikulapo.brasil</a></p>

<p>Sobre o documentário:</p>

<p>O documentário retrata a história de Fela Anikulapo Kuti e sua importância, ainda pouco conhecida no Brasil, enquanto figura de liderança política, discurso revolucionário e de valorização das tradições africanas, panafricanista, músico de criação e produção notáveis, sacramentado como criador de um estilo musical de fortíssima expressão cultural e política: o AFROBEAT.</p>

<p>ANIKULAPO trata do legado de sua música e postura política na Nigéria, além de ressonâncias na África e em todo o mundo, destacando a ligação cultural-espiritual-ancestral entre o Brasil e a Nigéria por intermédio dos escravos Yorùbá, etnia da qual Fela pertencia. </p>

<p>Além da questão de herança cultural étnica, o documentário busca discutir as expressões do &#39;&#39;afrobeat&#39;&#39; como gênero músical em constante reformulação e não necessariamente posterior a Fela.</p>

<p>A provocação proposta é abordar as manifestações afrodiaspóricas baseadas no lado de cá do Atlântico como confirmações de que somos irmãos genéticos e espirituais de Fela, conscientes ou não de seu formato musical e discursivo.</p>

<hr>

<p>The documentary offers a portrait of Fela Anikulapo Kuti, delving into his history, his political significance, and his groundbreaking advocacy for the value of African traditions and Pan-Africanist thought.</p>

<p>Aside from his indefatigable prowess as a composer, producer and militant, Fela is recognized as the originator of a unique musical musical genre, foster to an extremely powerful cultural and political expression: AFROBEAT.</p>

<p>ANIKULAPO focuses on Fela’s musical and political legacy and the expanse of his influence across Africa and the world. It pays special attention the spiritual and cultural link between Brasil and Nigeria through the Yoruba, an ethnic group where millions of Brazilians can trace their roots from slavery, the same ethnicity to which Fela himself belonged. To this day, Yoruba practices and cosmology play a strong role in Afro-Brazilian culture and Candomble. Fela’s music has only added another layer of Transatlantic communication.</p>

<p>The documentary discusses afrobeat as a genre in constant reformation, that rises as a mixture of African-American influences and African concepts. We proposes to analyze the Afrodiasporic manifestations across the American continent as statements of genetic and spiritual brotherhood, with or without the awareness of Fela’s impact musically and discursively. </p>
",anikulapo,//player.vimeo.com/video/54061184,http://vimeo.com/54061184,"Cinema e Vídeo",13,,https://s3-sa-east-1.amazonaws.com/cdn.br.catarse/uploads/project/video_thumbnail/1043/project_thumb_thumb_open-uri20131125-2-xscl7p,https://s3-sa-east-1.amazonaws.com/cdn.br.catarse/uploads/project/video_thumbnail/1043/project_thumb_small_open-uri20131125-2-xscl7p,https://s3-sa-east-1.amazonaws.com/cdn.br.catarse/uploads/project/video_thumbnail/1043/project_thumb_large_open-uri20131125-2-xscl7p,https://s3-sa-east-1.amazonaws.com/cdn.br.catarse/uploads/project/video_thumbnail/1043/project_thumb_video_cover_open-uri20131125-2-xscl7p,105.24666906733885487900,29227.0,335,325,successful,aon,finished,"2012-11-28 01:59:59","2012-11-27 23:59:59","2012-09-29 01:59:00","2012-09-28 22:59:00",,t,t,f,60,"{""total"" : 0, ""unit"" : ""seconds""}","{""total"" : 60, ""unit"" : ""days""}",5,"{""city"" : ""Rio de Janeiro"", ""state_acronym"" : ""RJ"", ""state"" : ""Rio de Janeiro""}","{""id"" : 82661, ""name"" : ""Pedro Rajão""}",0,,f,f,5,f,f,f