project_id,id,user_id,name,headline,budget,goal,about_html,permalink,video_embed_url,video_url,category_name,category_id,original_image,thumb_image,small_image,large_image,video_cover_image,progress,pledged,total_contributions,total_contributors,state,mode,state_order,expires_at,zone_expires_at,online_date,zone_online_date,sent_to_analysis_at,is_published,is_expired,open_for_contributions,online_days,remaining_time,elapsed_time,posts_count,address,user,reminder_count,is_owner_or_admin,user_signed_in,in_reminder,total_posts,can_request_transfer,is_admin_role,contributed_by_friends
10446,10446,397537,"Capoeira VEM","CAPOEIRA VEM (Vivências Ensinadas pelos Mestres)","<p>CATARSE  R$ 1.131,00 <br>TRANSPORTES AÉREOS  R$ 1.250,00 <br>CACHÊ DOS MESTRES R$ 3.000,00 <br>MATERIAL DE DIVULGAÇÃO E LOCAÇÃO R$ 1.300,00 <br>RECOMPENSAS  R$ 1.219,00 <br>ALIMENTAÇÃO / HOSPEDAGEM   R$ 800,00 <br> total : R$ 8.700,00<br><img src=""http://i.imgur.com/XEESBGB.png"" alt="""" style=""max-width:600px""></p><p><strong>CONTAMOS COM SEU APOIO</strong></p>",8700.0,"<p><strong>A IDEIA CENTRAL:</strong> “Treino sem roda não tem sentido”</p>

<p><strong>O Problema:</strong> Um Grande problema que visualizamos na nossa postura com a  Capoeira é que, em muitas vezes, estávamos acomodados no formato de eventos que realizamos, buscando sempre da mesma forma realizar os Encontros de final de ano (formaturas e as trocas de graduações).</p>

<p>A Identificação: Talvez neste momento você pode estar pensando. Funcionou até hoje! Porque mudar? Não se mexe em time que está ganhando; quero ver se eu vou ganhar algo com isto? “Meu mestre sempre fez assim.</p>

<p><strong>A Causa:</strong> Muitas vezes ficamos esperando “ACOMODADOS”  por verbas externas para realizar os eventos, com o formato de batizado e troca de graduação. Pois já tem um modelo de realização e contribuição PRATICA E CONFORTÁVEL . “Quando tem”; </p>

<p>Hoje estamos tentando realizar algo <strong>DIFERENTE</strong>  com a perspectiva de alcançar algo que a tempos atrás era impossível, hoje os tempos são outros as pessoas são outras, temos condições de celebrar qualquer união em prol daquilo que mais gostamos e amamos. A CAPOEIRA. </p>

<p>Com todos estes questionamento surge a ideia de realizar o <strong>“CAPOEIRA VEM”</strong><br/><img src=""http://i.imgur.com/kegk7Lj.png"" alt=""""/></p>

<p>O evento <strong>CAPOEIRA VEM (Vivências Ensinadas pelos Mestres)</strong> é uma ação coletiva de praticantes do Grupo Capoeira Angola Brasil e seus parceiros. Nosso objetivo é fomentar o intercâmbio de ideias e ações voltadas para a difusão da Capoeira em nossa região. O “CAPOERIA VEM” tem como característica a valorização, a presença, as oficinas e as palestras com grandes Mestres da Capoeira, apresentando oficinas de temas variados. Além, é claro, de Rodas de capoeira em diversos pontos da cidade de Canoas.</p>

<p><img src=""http://i.imgur.com/KSeO0Pk.png"" alt=""""/></p>

<p><strong>QUEM SOMOS:</strong><br/>O Grupo Angola Brasil é um coletivo de praticantes e simpatizantes da cultura da capoeira angola, que tem por objetivo a difusão da Capoeira como forma de resistência da cultura brasileira. Ao longo de sua história, tem procurado em suas ações colocar a Capoeira como uma atividade artístico-cultural que, além do desenvolvimento físico e motor, está associada a um “movimentar-se” próprio de uma cultura ou, mais acertadamente, próprio da resistência de uma cultura desterrada e que busca se reestruturar nesta terra que compõe a origem.</p>

<p>A trajetória teve início em 1977, quando começou a se organizar a primeira turma de capoeira de Canoas. Em 1983, a convite do Grupo, que neste momento se denominava Casa Grande, chegaram os primeiros representantes do Grupo Palmares da Bahia. Em dois anos houve uma fusão dos grupos tornando–se Casa Grande Palmares. Foi no ano de 1987 que foi constituída a Associação Canoense de Capoeira. Em janeiro de 1997, parte do grupo Palmares do Sul, na busca por sua identidade e identificação com a cidade e a população de Canoas, passou a se denominar Capoeira Angola Brasil.</p>

<p>A partir de 1997 o grupo inicia novos projetos, desenvolvendo a capoeira com característica voltadas a educação, oferecendo a um público diversificado o ensinamento da Capoeira, articulando parceiros em diversas esferas para a realização de atividades públicas e abertas, garantindo à população em geral o direito e o acesso à cultura.</p>

<p><img src=""http://i.imgur.com/MSNwhmY.jpg"" alt=""""/></p>

<p><strong>POR QUE APOIAR</strong><br/>Com seu apoio (que pode ser simplesmente divulgando os links de nosso evento) e financiamento conseguiremos ampliar nossas ações e realizar um evento que fortalece a cultura, integrando diversos movimentos em prol da capoeira. </p>

<p>Os recursos de apoiadores através do financiamento coletivo /catarse serão destinados aos gastos do evento que incluem Cachê dos mestres convidados, despesas de transporte (passagens Aéreas e terrestres), alimentação, materiais de divulgação e Recompensas, além de certificados e locação de equipamentos.<br/><strong>LEMBRANDO que se não atingirmos a nossa meta financeira todos os RECURSOS arrecadados serão devolvidos às pessoas que nos apoiaram.</strong></p>

<p>Com a sua contribuição poderemos aumentar a visibilidade da capoeira; estimulando novos praticantes a pratica de atividades saudáveis. Tirando os estereótipos impostos pelas grandes mídias. Com o apoio a projetos deste tipo podemos construir novos modelos a serem seguidos. Pois as principais referências que crianças e jovens tem acesso hoje, são os de maior evidencia na mídia. </p>

<div class=""video youtube""><iframe width=""600"" height=""403"" src=""//www.youtube.com/embed/I80KvWVbTcc?wmode=opaque"" frameborder=""0"" allowfullscreen></iframe></div>

<p><strong>O QUE ACONTECE SE ARRECADARMOS VALORES ACIMA DA META.</strong><br/>Ao atingirmos valores acima da meta Financeira deste projeto, nos COMPROMETEMOS, em contrapartida ao apoio extra, utilizar os recursos em oficinas e apresentações,, em projetos sociais no município de Canoas. Divulgando estas ações em nossas redes sociais, incluindo os apoiadores deste evento nestas ações.</p>

<p>Qualquer apoio a partir de R$20,00 é bem vindo. Além de apoiar o nosso evento você é reconhecido  como alguém preocupado com a promoção da cultura em nossa Região e ainda recebe <strong>RECOMPENSAS EXCLUSIVAS</strong> de nosso evento. E Claro, quanto maior for seu apoio <strong>MAIOR SERÃO SUAS RECOMPENSAS</strong> </p>

<p><strong>NOSSAS RECOMPENSAS</strong><br/><img src=""http://i.imgur.com/wVk4tnt.png"" alt=""""/></p>

<p><strong>ENVIO DAS RECOMPENSAS</strong></p>

<p>O valor do frete está incluído nas recompensas (com envio para todo BRASIL),  A previsão é que chegue em Maio no Endereço dos Apoiadores. <br/>Quem adquirir as recompensa que contenham camiseta, por favor, envie e-mail com o tamanho escolhido (P,M,G,GG). </p>

<p>Recompensas de Apresentação e Workshop serão realizadas (devido a Custos) na região Metropolitana de Porto Alegre com agendamento Prévio combinado com os apoiadores.</p>

<p><strong>O QUE SIGNIFICAM AS NOMENCLATURAS DE APOIO</strong></p>

<p>Cada cota de apoio tem um nome de movimentos de Capoeira. Que vão do mais simples ao mais complexo. </p>
",capoeiravem,//www.youtube.com/embed/OEFNQLhU68E,https://www.youtube.com/watch?v=OEFNQLhU68E&feature=youtu.be,Eventos,10,https://s3-sa-east-1.amazonaws.com/cdn.br.catarse/uploads/project/uploaded_image/10446/CAPA.png,https://s3-sa-east-1.amazonaws.com/cdn.br.catarse/uploads/project/uploaded_image/10446/project_thumb_thumb_CAPA.png,https://s3-sa-east-1.amazonaws.com/cdn.br.catarse/uploads/project/uploaded_image/10446/project_thumb_small_CAPA.png,https://s3-sa-east-1.amazonaws.com/cdn.br.catarse/uploads/project/uploaded_image/10446/project_thumb_large_CAPA.png,https://s3-sa-east-1.amazonaws.com/cdn.br.catarse/uploads/project/uploaded_image/10446/project_thumb_video_cover_CAPA.png,106.8965517241379300,9300.0,29,20,successful,aon,finished,"2015-04-21 02:59:59","2015-04-20 23:59:59","2015-03-14 15:33:19.408259","2015-03-14 12:33:19.408259",,t,t,f,37,"{""total"" : 0, ""unit"" : ""seconds""}","{""total"" : 37, ""unit"" : ""days""}",5,"{""city"" : ""Canoas"", ""state_acronym"" : ""RS"", ""state"" : ""Rio Grande do Sul""}","{""id"" : 397537, ""name"" : ""Leandro Miranda""}",1,,f,f,5,f,f,f