project_id,id,user_id,name,headline,budget,goal,about_html,permalink,video_embed_url,video_url,category_name,category_id,original_image,thumb_image,small_image,large_image,video_cover_image,progress,pledged,total_contributions,total_contributors,state,mode,state_order,expires_at,zone_expires_at,online_date,zone_online_date,sent_to_analysis_at,is_published,is_expired,open_for_contributions,online_days,remaining_time,elapsed_time,posts_count,address,user,reminder_count,is_owner_or_admin,user_signed_in,in_reminder,total_posts,can_request_transfer,is_admin_role,contributed_by_friends
1046,1046,97505,"D'grand'stilo Convida Especial Mês das Crianças","Dê 1 dia de sorriso a quem tem uma vida de tristezas!","O orçamento para projetos anteriores a 24/02/2015 normalmente pode ser encontrado na descrição acima.",1120.0,"<p>PROJETO D’GRAND’STILO CONVIDA É UMA FORMA DE LEVAR Á 
COMUNIDADE CARENTE: CULTURA, INFORMAÇÃO, ENTRETENIMENTO 
E LAZER. ATRAVÉS DO HIP HOP COM TODOS OS SEUS PILARES QUE SÃO: 
GRAFITE, BREAK (DANÇA), DJ E MC ALÉM DE CONVIDAR A CADA EDIÇÃO 
UMA EQUIPE DE LITERATURA QUE RECITA POESIAS E TRECHOS DE LIVROS. </p>

<p>PARA O ENTRETENIMENTO SÃO CONVIDADOS MÚSICOS DE DIVERSAS 
REGIÕES PARA PROMOVER MUSICALIDADE E INTERAGIR COM RESIDENTES, 
ESTA TAMBÉM É UMA FORMA DE MOSTRAR AS OUTRAS PESSOAS A 
REALIDADE DA COMUNIDADE. </p>

<p>NESTA EDIÇÃO DE OUTUBRO O EVENTO DISTRIBUIRÁ BRINQUEDOS PARA 
AS CRIANÇAS DA COMUNIDADE DOS PILÕES, SENDO ESTES BRINQUEDOS 
PROJETO DE DOAÇÃO DE APOIADORES DESTA CAUSA QUE NÃO TEM FINS 
LUCRATIVOS E É MANTIDA COM AJUDAS E DOAÇÕES CONTAMOS COM SEU 
APOIO PARA COMPRAR ESTES BRINQUEDOS. </p>

<p>NOSSA META É BEM SIMPLES PORÉM DE UMA AÇÃO ENORME, ESPERAMOS 
ARRECADAR R$ 1.000,00</p>
",dgrandstiloconvida,//player.vimeo.com/video/51537241,http://vimeo.com/51537241,Socioambiental,4,,https://s3-sa-east-1.amazonaws.com/cdn.br.catarse/uploads/project/video_thumbnail/1046/project_thumb_thumb_open-uri20131125-2-1c4nwx8,https://s3-sa-east-1.amazonaws.com/cdn.br.catarse/uploads/project/video_thumbnail/1046/project_thumb_small_open-uri20131125-2-1c4nwx8,https://s3-sa-east-1.amazonaws.com/cdn.br.catarse/uploads/project/video_thumbnail/1046/project_thumb_large_open-uri20131125-2-1c4nwx8,https://s3-sa-east-1.amazonaws.com/cdn.br.catarse/uploads/project/video_thumbnail/1046/project_thumb_video_cover_open-uri20131125-2-1c4nwx8,47.32142857142857142900,530.0,12,10,failed,aon,finished,"2012-10-26 01:59:59","2012-10-25 23:59:59","2012-08-27 01:59:59","2012-08-26 22:59:59",,t,t,f,60,"{""total"" : 0, ""unit"" : ""seconds""}","{""total"" : 60, ""unit"" : ""days""}",4,"{""city"" : ""São Paulo"", ""state_acronym"" : ""SP"", ""state"" : ""São Paulo""}","{""id"" : 97505, ""name"" : ""Odilo Ferreira""}",0,,f,f,4,f,f,f