project_id,id,user_id,name,headline,budget,goal,about_html,permalink,video_embed_url,video_url,category_name,category_id,original_image,thumb_image,small_image,large_image,video_cover_image,progress,pledged,total_contributions,total_contributors,state,mode,state_order,expires_at,zone_expires_at,online_date,zone_online_date,sent_to_analysis_at,is_published,is_expired,open_for_contributions,online_days,remaining_time,elapsed_time,posts_count,address,user,reminder_count,is_owner_or_admin,user_signed_in,in_reminder,total_posts,can_request_transfer,is_admin_role,contributed_by_friends
1056,1056,100845,"Os Plagiários – Uma adulteração ficcional sobre Nelson Rodrigues ","Faça parte desta história e apoie a volta dos Plagiários antes que o Cenotécnico venha abaixo!!","O orçamento para projetos anteriores a 24/02/2015 normalmente pode ser encontrado na descrição acima.",2800.0,"<p>Os Plagiários – uma adulteração ficcional sobre Nelson Rodrigues</p>

<p>Os Plagiários é o resultado do projeto Conexão Braskem Em Cena – formação, intercâmbio e montagem, desenvolvido pelo 19° Porto Alegre Em Cena, cujo objetivo era promover a troca de experiências entre os 4 grupos vencedores do Prêmio Braskem 2011: Teatro Sarcáustico, Companhia Santa Estação, Cia. Caixa do Elefante e Grupo Falos &amp;amp; Stercus. Os diretores de cada grupo assumiram a direção coletiva desta empreitada inédita e o resultado pode ser visto em 4 apresentações durante o festival.</p>

<p>O texto foi escrito especialmente para o projeto pelo dramaturgo Diones Camargo, inspirado na vida e obra de Nelson Rodrigues, homenageando assim o grande autor brasileiro que neste ano completaria 100 anos de vida. &quot;Os Plagiários, uma adulteração ficcional sobre Nelson Rodrigues&quot; é ambientado em tempos distintos. No presente, um grupo de teatro representa uma peça. Paralelamente, um repórter vai à procura do dramaturgo Nelson Rodrigues para uma entrevista a respeito da primeira montagem de Vestido de Noiva, mas é surpreendido com a notícia da morte do polêmico escritor.</p>

<p>Enquanto o jovem Nelson Rodrigues divide o seu tempo entre a redação do jornal e as madrugadas insones a fim de concluir a sua nova e mais ambiciosa obra, um reconhecido diretor polonês, Zbigniew Ziembinski, desembarca no Brasil. Em meio a estilhaços de memórias, o público presenciará um desfile de personagens e acontecimentos que se embaralham na mente do atônito repórter.</p>

<p>Mas enfim, terminou o festival e a peça foi sucesso de público e crítica. O grupo então se reuniu novamente com o desejo de realizar uma nova temporada com produção independente e apoio de parceiros, afinal, todo o trabalho e dedicação envolvendo mais de 25 pessoas não pode se acabar em 4 apresentações. E aqui estamos nós tentando arrecadar o necessário para viabilizar as apresentações!</p>

<p>Com a oportunidade proporcionada pelo Catarse, esperamos obter o valor mínimo de 2800 mil reais para auxiliar nas despesas essenciais como montadores de luz e cenário, seguranças, fretes, entre outros.</p>

<p>Além do mais, a curta temporada marcará a despedida do Centro Cenotécnico, que será demolido devido às obras da Copa. Administrado pelo Instituto Estadual de Artes Cênicas – IEACen - SEDAC, o Centro Cenotécnico RS, fundado em março de 1995, é o único centro cenotécnico público da América Latina, referência para as Artes Cênicas do Estado. Com 1300 metros quadrados de área total, lá ocorrem ensaios de teatro, dança e circo, oficinas, apresentações, filmagens de curtas e longas metragens, construção e armazenamento de cenários, entre outras atividades. Novembro é mês acordado entre as autoridades do Estado e do Município para solucionar o destino do local ameaçado de demolição. Ocupar este espaço com o nosso teatro é a melhor forma que encontramos para lutar pela preservação desse local tão importante! Contamos com o seu apoio!</p>

<p>Ficha técnica: 
Direção: Guadalupe Casal, Jezebel De Carli, Mário de Balenti e Marcelo Restori<br>
Texto: Diones Camargo<br>
Coreografia: Larissa Sanguiné<br>
Colaboração cênica: Carolina Garcia<br>
Elenco: Ana Luiza Bergmann, Bia Noy, Carla Cassapo, Cris Bocchi, Camila Vergara,  Carol Martins, Elison Couto, Filippi Mazutti, Fredericco Restori, Frederico Vittola, Gabriela Greco, Larissa Sanguiné, Nátali Caterina Karro, Pedro Nambuco, Rafael Becker, Ricardo Zigomático, Viviana Schames e Valquiria Cardoso 
 Figurino e cenografia: Daniel Lion<br>
Trilha sonora: Arthur De Faria 
Preparação de voz: Francis Padilha<br>
Iluminação: Daniel Fetter e Fabricio Simões 
Técnico de Som: Zé Derly e Veridiana Matias<br>
Fotos: Regina Protskof e Elison Couto 
Apoio: The Cut e Filipe Severo Videojornalismo,  Casa de Teatro, Impacto, Cia. Stravaganza
Parceria: Cia. Caixa de Elefante, Cia. Santa Estação, Grupo Falos &amp;amp; Stercus e Teatro Sarcáustico e IACEN
 Divulgação: BD Divulgação 
Produção: Bia Noy, Carla Cassapo e Nátali Caterina Karro 
Duração: 1h20min</p>

<p><a class=""alt-link"" href=""http://sul21.com.br/jornal/2012/10/impasse-sobre-cenotecnico-continua-e-artistas-pedem-audiencia-com-tarso/"" target=""_blank"">http://sul21.com.br/jornal/2012/10/impasse-sobre-cenotecnico-continua-e-artistas-pedem-audiencia-com-tarso/</a></p>
",osplagiarios,//player.vimeo.com/video/51833470,http://vimeo.com/51833470,"Teatro e Dança",19,,https://s3-sa-east-1.amazonaws.com/cdn.br.catarse/uploads/project/video_thumbnail/1056/project_thumb_thumb_open-uri20131125-2-dqf9vs,https://s3-sa-east-1.amazonaws.com/cdn.br.catarse/uploads/project/video_thumbnail/1056/project_thumb_small_open-uri20131125-2-dqf9vs,https://s3-sa-east-1.amazonaws.com/cdn.br.catarse/uploads/project/video_thumbnail/1056/project_thumb_large_open-uri20131125-2-dqf9vs,https://s3-sa-east-1.amazonaws.com/cdn.br.catarse/uploads/project/video_thumbnail/1056/project_thumb_video_cover_open-uri20131125-2-dqf9vs,105.3571428571428600,2950.0,38,35,successful,aon,finished,"2012-11-01 01:59:59","2012-10-31 23:59:59","2012-09-02 01:59:59","2012-09-01 22:59:59",,t,t,f,60,"{""total"" : 0, ""unit"" : ""seconds""}","{""total"" : 60, ""unit"" : ""days""}",1,"{""city"" : ""Porto Alegre"", ""state_acronym"" : ""RS"", ""state"" : ""Rio Grande do Sul""}","{""id"" : 100845, ""name"" : ""Bia Isabel Noy""}",0,,f,f,1,f,f,f