project_id,id,user_id,name,headline,budget,goal,about_html,permalink,video_embed_url,video_url,category_name,category_id,original_image,thumb_image,small_image,large_image,video_cover_image,progress,pledged,total_contributions,total_contributors,state,mode,state_order,expires_at,zone_expires_at,online_date,zone_online_date,sent_to_analysis_at,is_published,is_expired,open_for_contributions,online_days,remaining_time,elapsed_time,posts_count,address,user,reminder_count,is_owner_or_admin,user_signed_in,in_reminder,total_posts,can_request_transfer,is_admin_role,contributed_by_friends
1077,1077,102613,"Sonho de Natal da Dinamite Joe","Faça parte da história da Dinamite Joe apoie a gravação do novo disco!","O orçamento para projetos anteriores a 24/02/2015 normalmente pode ser encontrado na descrição acima.",20000.0,"<p>Olá !!!!!!
Nós somos da banda Dinamite Joe e queremos um minuto da tua atenção pra poder contar um pouco da banda, sua história, nossos projetos, enfim, tudo o que envolve o nome Dinamite Joe.
Nossa história começou em 2003 e estamos com essa formação desde 2005, nosso principal objetivo sempre foi o trabalho autoral. Em 2006 gravamos nosso primeiro disco ”Paviu Curto”e em 2009 lançamos o Disco “Na estrada” que teve bom reconhecimento, inclusive muitas músicas tocaram nas rádios do Rio Grande do Sul. Em 2009 participamos do programa Astros e fomos finalistas; ...talvez tenha sido momento em que decidimos realmente investir no projeto, já que vimos que poderia sim dar certo, que tínhamos condições e queríamos muito tocar pra todo Brasil.
Procuramos um produtor que tivesse talento, habilidade e lógico muito profissionalismo; alguns nomes apareceram, mandamos material e decidimos trabalhar com o Rodrigo Castanho, que é reconhecido pelos trabalhos de várias bandas de sucesso no cenário nacional. Em 2011 lançamos então nosso EP, com 3 músicas:
*Teu beijo, se destacou nas rádios e o vídeo clipe dessa música foi escolhido pelo público como o melhor vídeo clipe no concurso Minha Banda do “Tele Domingo”da RBS TV, tendo aproximadamente 300 mil votos!
*Passos Certos foi escolhida melhor música, letra e intérprete na etapa gaúcha pelo concurso promovido pelas Rádios Públicas do Brasil (<a class=""alt-link"" href=""http://www.arpub.org.br/"" target=""_blank"">www.arpub.org.br/</a>) e organizado aqui no RS pela rádio da UNIJUÍ/RS;
*Além de “Te Esperar”, música do mais recente clipe.
Aliás, todas as músicas do EP tiveram vídeo clipes. Tudo isto você pode encontrar no nosso site <a class=""alt-link"" href=""http://www.dinamitejoe.com.br"" target=""_blank"">www.dinamitejoe.com.br</a>
Agora estamos dando mais um passo importante na nossa carreira, nossa ideia é gravar um novo disco, desta vez um disco completo; serão nove músicas inéditas e mais as três do EP, com o mesmo produtor e contando ainda com um documentário em vídeo das sessões de estúdio para disponibilização na Internet, e mais um vídeo clipe de uma das novas músicas...
Pra isso precisamos da tua ajuda!
Nós entendemos que este projeto em parceria com o Catarse, seja uma oportunidade de uma relação mais direta tanto por parte do artista como do público;
Você colabora com a banda, financiando o projeto e em troca recebe desde Cds autografados e camisetas, a ingressos, visita ao ensaio, agradecimento especial no encarte do cd, viajar conosco para algum show e até shows na sua casa ou empresa.
É claro que o valor que pedimos não custeia todo projeto, mas acreditamos que sem essa ajuda, sem a tua colaboração, o projeto se torna inviável, porque além das gravações, há custos extras como por exemplo a divulgação do trabalho.</p>

<p>Precisamos muito da tua ajuda!!!
Um forte abraço a todos!!! Valeu, obrigado!!!!!</p>
",dinamitejoe,//player.vimeo.com/video/52078283,http://vimeo.com/52078283,Música,16,,https://s3-sa-east-1.amazonaws.com/cdn.br.catarse/uploads/project/video_thumbnail/1077/project_thumb_thumb_open-uri20131125-2-1u5y9xf,https://s3-sa-east-1.amazonaws.com/cdn.br.catarse/uploads/project/video_thumbnail/1077/project_thumb_small_open-uri20131125-2-1u5y9xf,https://s3-sa-east-1.amazonaws.com/cdn.br.catarse/uploads/project/video_thumbnail/1077/project_thumb_large_open-uri20131125-2-1u5y9xf,https://s3-sa-east-1.amazonaws.com/cdn.br.catarse/uploads/project/video_thumbnail/1077/project_thumb_video_cover_open-uri20131125-2-1u5y9xf,3.97500000000000000000,795.0,12,12,failed,aon,finished,"2012-12-26 01:59:59","2012-12-25 23:59:59","2012-10-27 01:59:59","2012-10-26 23:59:59",,t,t,f,60,"{""total"" : 0, ""unit"" : ""seconds""}","{""total"" : 60, ""unit"" : ""days""}",0,"{""city"" : ""Feliz"", ""state_acronym"" : ""RS"", ""state"" : ""Rio Grande do Sul""}","{""id"" : 102613, ""name"" : ""Andrinei Tomazi""}",0,,f,f,0,f,f,f