project_id,id,user_id,name,headline,budget,goal,about_html,permalink,video_embed_url,video_url,category_name,category_id,original_image,thumb_image,small_image,large_image,video_cover_image,progress,pledged,total_contributions,total_contributors,state,mode,state_order,expires_at,zone_expires_at,online_date,zone_online_date,sent_to_analysis_at,is_published,is_expired,open_for_contributions,online_days,remaining_time,elapsed_time,posts_count,address,user,reminder_count,is_owner_or_admin,user_signed_in,in_reminder,total_posts,can_request_transfer,is_admin_role,contributed_by_friends
1079,1079,101739,"Urucuia Grande Sertão","Venha conhecer o reino do Bom Cascudo, o mais importante folclorista da América Latina! SUCESSOOOO!!!!","O orçamento para projetos anteriores a 24/02/2015 normalmente pode ser encontrado na descrição acima.",6000.0,"<p>“O Bom Cascudo me contou uma história
De um reino tão feliz que eu guardo na memória!”</p>

<p>Com livre adaptação do texto “A Princesa Adivinhona”, versão de um tradicional conto popular coletado por Luís da Câmara Cascudo, o mais importante folclorista da América Latina, o Coletivo Peneira convida você para conhecer URUCUIA GRANDE SERTÃO.</p>

<p>Em um reino distante no sertão brasileiro, um rei solitário, influenciado pelo avançar da idade, determina que seu fiel servo arrume um rapaz para desposar a jovem princesa. Após o anúncio surgem muitos pretendentes e, com isso, o patriarca volta a nutrir um fio de esperança, apesar de toda a resistência da moça, que se julga a mais inteligente do império. Para a nobre, nenhum homem é capaz de satisfazê-la intelectualmente. Inspirado por esta narrativa, o Coletivo Peneira traz à tona algumas questões que merecem evidência, como o preconceito social e o amor.</p>

<p>URUCUIA GRANDE SERTÃO estreou no Festival de Teatro Cidade do Rio de Janeiro e de cara já levou 5 prêmios, melhor direção, melhor iluminação, melhor ator, melhor atriz coadjuvante, e melhor ESPETÁCULO!!!! Como recompensa do prêmio ficamos um mês em cartaz no Teatro Princesa Isabel, e já nos apresentamos na Festa Junina da Comunidade Tavares Bastos, na Arena Carioca Jovelina Pérola Negra, na Pavuna, e no Festival de Queimados!</p>

<p>Agora eis que surge uma grande oportunidade para ficarmos 2 meses em cartaz no SESC CASA DA GÁVEA, de 10 de novembro a 16 de dezembro, com apresentações aos sábados e domingos. Para isso precisamos da sua grande colaboração financeira para cobrir todo custo necessário à produção de um espetáculo, como aluguel do teatro, iluminação, transporte de cenário, dentre outros itens. Para colocar em prática o projeto já contamos com 30% do valor total para temporada. No entanto precisamos arrecadar mais R$6000. Colabore!</p>

<p>O Coletivo Peneira é uma trupe que tem a cultura popular brasileira como fonte de inspiração para criações artísticas. Ele foi criado em 2010 por artistas de diversas localidades do Estado do Rio de Janeiro, que desempenham um importante papel social por meio da ocupação de espaços públicos ociosos, como praças e parques. E tem como lema a palavra SUCESSO! Por isso acreditamos que alcançaremos os 100% do valor arrecadado, quiçá, mais do que isso.</p>

<p><a class=""alt-link"" href=""https://www.facebook.com/pages/Coletivo-Peneira/101176600013299"" target=""_blank"">https://www.facebook.com/pages/Coletivo-Peneira/101176600013299</a></p>

<p>Ficha Técnica</p>

<p>Texto: Eridiana Rosa e Luiz Fernando Pinto
Direção: Marcia do Valle
Elenco: Alex Teixeira, Luiz Fernando Pinto, Michele Lima, Moises Salazar, Pedro Yudi, Rogerio Lisil e Thaiane Leal
Iluminação: Leopoldo Barbato
Figurino: Camila Loren
Cenário e Projeto Gráfico: Karine Drummond
Trilha e música: Thaiane Leal e Rogerio Lisil
Direção Musical: Raoni Costa
Produção executiva: Alex Teixeira, Luiz Fernando Pinto e Taty Maria
Realização: Coletivo Peneira </p>
",urucuiagrandesertao,//player.vimeo.com/video/52196159,http://vimeo.com/52196159,"Teatro e Dança",19,,https://s3-sa-east-1.amazonaws.com/cdn.br.catarse/uploads/project/video_thumbnail/1079/project_thumb_thumb_open-uri20131125-2-1ztae7,https://s3-sa-east-1.amazonaws.com/cdn.br.catarse/uploads/project/video_thumbnail/1079/project_thumb_small_open-uri20131125-2-1ztae7,https://s3-sa-east-1.amazonaws.com/cdn.br.catarse/uploads/project/video_thumbnail/1079/project_thumb_large_open-uri20131125-2-1ztae7,https://s3-sa-east-1.amazonaws.com/cdn.br.catarse/uploads/project/video_thumbnail/1079/project_thumb_video_cover_open-uri20131125-2-1ztae7,100.6666666666666700,6040.0,26,25,successful,aon,finished,"2012-12-07 01:59:59","2012-12-06 23:59:59","2012-10-08 01:59:59","2012-10-07 22:59:59",,t,t,f,60,"{""total"" : 0, ""unit"" : ""seconds""}","{""total"" : 60, ""unit"" : ""days""}",0,"{""city"" : ""São Paulo"", ""state_acronym"" : ""SP"", ""state"" : ""São Paulo""}","{""id"" : 101739, ""name"" : """"}",0,,f,f,0,f,f,f