project_id,id,user_id,name,headline,budget,goal,about_html,permalink,video_embed_url,video_url,category_name,category_id,original_image,thumb_image,small_image,large_image,video_cover_image,progress,pledged,total_contributions,total_contributors,state,mode,state_order,expires_at,zone_expires_at,online_date,zone_online_date,sent_to_analysis_at,is_published,is_expired,open_for_contributions,online_days,remaining_time,elapsed_time,posts_count,address,user,reminder_count,is_owner_or_admin,user_signed_in,in_reminder,total_posts,can_request_transfer,is_admin_role,contributed_by_friends
1084,1084,85870,"Esquentando o forno para o primeiro CD de Luz Marina!","A gente colocou a mão na massa! Agora, lance uma pitada de fermento e receba saborosas recompensas!","O orçamento para projetos anteriores a 24/02/2015 normalmente pode ser encontrado na descrição acima.",10000.0,"<p>QUEM é LUZ MARINA</p>

<p>Nasci no Pantanal, sempre vivi em São Paulo, mas sinto que meu lugar é no mar. A música, pra mim, é um &quot;modo de ser&quot; que dá sentido à minha existência. Acredito que expressão em música é aquele timbre mais interno e universal, feito com sístole e diástole do coração, que cada um carrega dentro de si e coloca pra fora quando tem um outro pra trocar. Vim de uma família de artistas, a maioria é de cantores e compositores. A vida sempre foi de cantar. E tem uma hora que a sua música amadurece. Hora de partilhar. “Os pés vão saber onde mora o momento”, como canto numa canção que fiz com Daniel Viana e minha mãe, Alzira Espíndola. Esse momento chegou. Compus esse e outros sons e gravei em estúdio com amigos-músicos-incríveis (que admiro!). As músicas dizem de espaços-tempos vividos no acaso. Voaram e chegaram aqui, nessa CATARSE!</p>

<p>O QUE PRECISA PARA O CD IR PARA O FORNO</p>

<p>As músicas já foram gravadas em estúdio. Agora, convido você para colocar fermento neste projeto. Seu apoio vai viabilizar os trabalhos de finalização do disco (mixagem, masterização, impressão gráfica e prensagem do CD). O bolo vai crescer e você vai receber a sua fatia quentinha! </p>

<p>PARA SABER MAIS SOBRE O CD </p>

<p>Esse CD nasceu no estúdio do querido e generoso Ney Marques, no bairro da Liberdade. De tanta liberdade que teve, agregou um monte de músicos-amigos-admiráveis: Curumin (bateria e programação), Mau (baixo), Ney Marques (guitarra), Bruno Buarque (bateria), João Taubkin (baixo), Cris Scabello (guitarra), Du Moreira (teclado), Marcelo Dworecki (baixo e guitarra), Charles Tixier (bateria) e ainda a participação do incrível Mauricio Pereira (sax). Os arranjos foram todos fluidos e coletivos! Produzi isso com a imprescindível co-produção de Daniel Viana. E a direção de voz foi de Alzira E. 
As músicas foram compostas com amados-parceiros-do-acaso: Daniel Viana, Alzira E, Lucina, Anelis Assumpção, Thalma de Freitas, Bruno Pt e Marcelo Coutello. Cada um acrescentou um sabor único. Uma receita com recheios delirantes! </p>

<p>Para ouvir um pouco mais: <a class=""alt-link"" href=""http://www.soundcloud.com/luz-marina"" target=""_blank"">www.soundcloud.com/luz-marina</a></p>

<p>E AGORA, VAMOS COLOCAR O FERMENTO?
Escolha uma opção ao lado e receba a sua fatia!</p>
",luz-marina,//player.vimeo.com/video/52503408,http://vimeo.com/52503408,Música,16,,https://s3-sa-east-1.amazonaws.com/cdn.br.catarse/uploads/project/video_thumbnail/1084/project_thumb_thumb_open-uri20131125-2-1v6c1mh,https://s3-sa-east-1.amazonaws.com/cdn.br.catarse/uploads/project/video_thumbnail/1084/project_thumb_small_open-uri20131125-2-1v6c1mh,https://s3-sa-east-1.amazonaws.com/cdn.br.catarse/uploads/project/video_thumbnail/1084/project_thumb_large_open-uri20131125-2-1v6c1mh,https://s3-sa-east-1.amazonaws.com/cdn.br.catarse/uploads/project/video_thumbnail/1084/project_thumb_video_cover_open-uri20131125-2-1v6c1mh,101.90000000000000000000,10190.0,120,109,successful,aon,finished,"2012-12-21 01:59:59","2012-12-20 23:59:59","2012-10-22 01:59:59","2012-10-21 23:59:59",,t,t,f,60,"{""total"" : 0, ""unit"" : ""seconds""}","{""total"" : 60, ""unit"" : ""days""}",4,"{""city"" : ""São Paulo"", ""state_acronym"" : ""SP"", ""state"" : ""São Paulo""}","{""id"" : 85870, ""name"" : ""Luz Marina Espindola""}",0,,f,f,4,f,f,f