project_id,id,user_id,name,headline,budget,goal,about_html,permalink,video_embed_url,video_url,category_name,category_id,original_image,thumb_image,small_image,large_image,video_cover_image,progress,pledged,total_contributions,total_contributors,state,mode,state_order,expires_at,zone_expires_at,online_date,zone_online_date,sent_to_analysis_at,is_published,is_expired,open_for_contributions,online_days,remaining_time,elapsed_time,posts_count,address,user,reminder_count,is_owner_or_admin,user_signed_in,in_reminder,total_posts,can_request_transfer,is_admin_role,contributed_by_friends
1088,1088,104971,"Exposição Celebridade Vira-Lata","Animais são a paixão de muitos, a arte inclui todos. Exposição Celebridade Vira-Lata: por uma sociedade de harmonia entre pessoas e animais.","O orçamento para projetos anteriores a 24/02/2015 normalmente pode ser encontrado na descrição acima.",15000.0,"<p>A questão dos animais não domiciliados ainda é muito pouco discutida oficialmente. A desinformação sobre o tema é o grande vilão, nossa exposição com fotos de carismáticos vira-latas com suas histórias de sucesso contadas dá o exemplo da transformação provocada pela adoção de um animal na vida de adotante e adotado e o gancho para falarmos do tema. Dessa forma, em longo prazo, teremos mais gente informada e informando. Aproveitaremos a ocasião para informar sobre serviços prestados gratuitamente e por valores populares para os animais da cidade.
As fotos foram feitas voluntariamente pelo renomado fotógrafo Ricardo De Vicq e resultaram numa expressão artística de primeira grandeza.
Os recursos arrecadados no catarse cobrirão custos operacionais, impressão do material em alta resolução, estrutura, locação de equipamento, montagem e desmontagem, dessa forma, preservamos nossa atuação social de esterilizações cirúrgicas que as vendas do calendário patrocinam.
Acesse <a class=""alt-link"" href=""http://www.celebridadeviralata.com.br"" target=""_blank"">www.celebridadeviralata.com.br</a> para conhecer melhor o trabalho. Na seção AÇÕES, subseção PRODUÇÃO CULTURAL há fotos da edição anterior da exposição, que teve grande repercussão, prestou serviço à comunidade informando sobre o que é oferecido pelo CCZ de São Paulo, entidades filantrópicas do setor e voluntariado. Além de textos esclarecedores sobre a saúde animal.</p>
",viralata,//player.vimeo.com/video/52899049,http://vimeo.com/52899049,Fotografia,17,,https://s3-sa-east-1.amazonaws.com/cdn.br.catarse/uploads/project/video_thumbnail/1088/project_thumb_thumb_open-uri20131125-2-1jiy46g,https://s3-sa-east-1.amazonaws.com/cdn.br.catarse/uploads/project/video_thumbnail/1088/project_thumb_small_open-uri20131125-2-1jiy46g,https://s3-sa-east-1.amazonaws.com/cdn.br.catarse/uploads/project/video_thumbnail/1088/project_thumb_large_open-uri20131125-2-1jiy46g,https://s3-sa-east-1.amazonaws.com/cdn.br.catarse/uploads/project/video_thumbnail/1088/project_thumb_video_cover_open-uri20131125-2-1jiy46g,14.30000000000000000000,2145.0,33,30,failed,aon,finished,"2012-11-25 01:59:59","2012-11-24 23:59:59","2012-09-26 01:59:59","2012-09-25 22:59:59",,t,t,f,60,"{""total"" : 0, ""unit"" : ""seconds""}","{""total"" : 60, ""unit"" : ""days""}",1,"{""city"" : ""São Paulo"", ""state_acronym"" : ""SP"", ""state"" : ""São Paulo""}","{""id"" : 104971, ""name"" : """"}",0,,f,f,1,f,f,f