project_id,id,user_id,name,headline,budget,goal,about_html,permalink,video_embed_url,video_url,category_name,category_id,original_image,thumb_image,small_image,large_image,video_cover_image,progress,pledged,total_contributions,total_contributors,state,mode,state_order,expires_at,zone_expires_at,online_date,zone_online_date,sent_to_analysis_at,is_published,is_expired,open_for_contributions,online_days,remaining_time,elapsed_time,posts_count,address,user,reminder_count,is_owner_or_admin,user_signed_in,in_reminder,total_posts,can_request_transfer,is_admin_role,contributed_by_friends
1117,1117,107981,"Manguinhos em Cena","""Sintonia Suburbana"" é mais que teatro. É um sonho dos jovens de Manguinhos! E a SUA contribuição é essencial para a realização deste sonho!","O orçamento para projetos anteriores a 24/02/2015 normalmente pode ser encontrado na descrição acima.",4000.0,"<p>No dia 8 de dezembro, o grupo Manguinhos em Cena estréia seu primeiro espetáculo teatral: Sintonia Suburbana. </p>

<p>O grupo é totalmente formado por jovens e adultos do Complexo de Favelas de Manguinhos e sua estréia vai inaugurar o Cine-teatro da Biblioteca Parque de Manguinhos. Toda a arrecadação será destinada aos figurinos e cenários do espetáculo. A temporada será até 16 de dezembro, no Cine-teatro (Av. D. Helder Câmara, 1184) com entrada gratuita. </p>

<p>Antes de qualquer coisa, queremos nos apresentar e contar um pouco da nossa história: nós somos Manguinhos em Cena, um grupo de 17 moradores do Complexo de Manguinhos, no Rio de Janeiro. </p>

<p>Esse mesmo lugar que você ouviu nos noticiários recentes com chegada das forças de segurança (UPP). Provavelmente já ouviu falar ou daqui ou leu matérias jornalísticas sobre drogas, crack, tráfico, violência, refinaria, apartamentos do PAC. O que você talvez não tenha ouvido falar é que por aqui existe um movimento cultural e muitos grupos de expressão de arte urbana: do samba ao hip hop; dança de rua, grafite, poesia, vídeo interferências urbanas, e teatro! </p>

<p>Pois é, tem também um lugar chamado Biblioteca Parque de Manguinhos que concentra e mobiliza jovens, crianças e a comunidade para um movimento de afirmação pela arte e pela cultura. A Biblioteca Parque é a nossa casa, e no dia 8 de dezembro estrearemos nosso primeiro espetáculo, o “Sintonia Suburbana”, inaugurando o Cine-Teatro da Biblioteca Parque de Manguinhos. Uma honra e uma responsabilidade para nosso grupo. </p>

<p>Antes de falarmos da estréia, você precisa saber como isso começou: em março deste ano nós passamos por um processo seletivo com a Companhia do Gesto (<a class=""alt-link"" href=""http://www.companhiadogesto.com.br"" target=""_blank"">www.companhiadogesto.com.br</a>), que coordena o projeto, para integrar o primeiro núcleo de teatro da Biblioteca Parque. </p>

<p>Desde então estudamos, pesquisamos, trabalhamos o fazer teatral em todas as suas áreas: conhecemos as máscaras teatrais, o palhaço, o teatro físico, a dramaturgia e a carpintaria de textos, trabalhamos voz, música, assistimos um monte de espetáculos, aprendemos sobre produção cultural, sobre o trabalho técnico que pouco ou nunca aparecem em cena: a iluminação, contrarregragem, cenografia, figurinos, confecção de máscaras, improviso, melodrama. </p>

<p>Fomos para a rua, para a praça, para o contato direto com o público buscando uma atuação do artista cidadão. </p>

<p>Esse projeto todo de formação foi criado pela Companhia do Gesto e pela produtora Zucca Produções em parceria com a Biblioteca Parque, e teve patrocínio da Petrobras através da Lei Estadual de Incentivo à Cultura – ICMS (aprendemos no curso de produção que os créditos tem que ser divulgados e valorizados!) </p>

<p>Agora, somos nós que temos que enfrentar o desafio, como grupo, de realizar e produzir nosso primeiro espetáculo e seguir em frente, com muita criatividade e garra. Todos os recursos que captarmos - só precisamos de R$ 4.000,00 - será para criarmos e confeccionarmos nossos cenários figurinos e para necessidades técnicas do espetáculo Sintonia Suburbana: algum complemento de equipamento de luz ou som que não tenha na Biblioteca, alguma diária que precisemos pagar para técnicos na montagem no teatro. </p>

<p>A estréia será no Cine-teatro da Biblioteca Parque de Manguinhos (Av. D. Helder Câmara, 1184), no dia 8 de dezembro, às 19h. Nossa temporada será até o dia 16 de dezembro, sempre sábado e domingo, no mesmo horário, com entrada franca para a comunidade e para quem vier nos conhecer! 
Queremos convidar as pessoas a participar dessa história como um apoiadores, contribuindo com doações. </p>

<p>Faremos nossa parte: um espetáculo lindo, forte, divertido! O nome dos apoiadores vai estar no nosso programa, nos nosso vídeos, no nosso coração, no dia da estréia. E esperamos que estejam todos na platéia! </p>

<p>Para saber mais sobre o projeto e o grupo: </p>

<p><a class=""alt-link"" href=""http://www.companhiadogesto.com.br/manguinhosemcena"" target=""_blank"">www.companhiadogesto.com.br/manguinhosemcena</a>; </p>

<p>no Facebook: <a class=""alt-link"" href=""http://www.facebook.com/manguinhosemcena"" target=""_blank"">www.facebook.com/manguinhosemcena</a> </p>
",manguinhosemcena,//player.vimeo.com/video/53363610,http://vimeo.com/53363610,"Teatro e Dança",19,,https://s3-sa-east-1.amazonaws.com/cdn.br.catarse/uploads/project/video_thumbnail/1117/project_thumb_thumb_open-uri20131125-2-5mpxq6,https://s3-sa-east-1.amazonaws.com/cdn.br.catarse/uploads/project/video_thumbnail/1117/project_thumb_small_open-uri20131125-2-5mpxq6,https://s3-sa-east-1.amazonaws.com/cdn.br.catarse/uploads/project/video_thumbnail/1117/project_thumb_large_open-uri20131125-2-5mpxq6,https://s3-sa-east-1.amazonaws.com/cdn.br.catarse/uploads/project/video_thumbnail/1117/project_thumb_video_cover_open-uri20131125-2-5mpxq6,132.0000000000000000,5280.0,47,41,successful,aon,finished,"2012-12-06 01:59:59","2012-12-05 23:59:59","2012-10-07 01:59:59","2012-10-06 22:59:59",,t,t,f,60,"{""total"" : 0, ""unit"" : ""seconds""}","{""total"" : 60, ""unit"" : ""days""}",0,"{""city"" : ""Rio de Janeiro"", ""state_acronym"" : ""RJ"", ""state"" : ""Rio de Janeiro""}","{""id"" : 107981, ""name"" : """"}",0,,f,f,0,f,f,f