project_id,id,user_id,name,headline,budget,goal,about_html,permalink,video_embed_url,video_url,category_name,category_id,original_image,thumb_image,small_image,large_image,video_cover_image,progress,pledged,total_contributions,total_contributors,state,mode,state_order,expires_at,zone_expires_at,online_date,zone_online_date,sent_to_analysis_at,is_published,is_expired,open_for_contributions,online_days,remaining_time,elapsed_time,posts_count,address,user,reminder_count,is_owner_or_admin,user_signed_in,in_reminder,total_posts,can_request_transfer,is_admin_role,contributed_by_friends
1138,1138,99434,"MASCATE - MOTIONCOMIC","Prepare-se para imergir no desconhecido, em uma intensa e assustadora experiência de storytelling.","",12000.0,"<p>MASCATE é um motioncomic - história em quadrinhos que incorpora elementos de animação e audio - produzido por uma equipe de artistas apaixonados por quadrinhos, motion e interatividade. </p>

<p>Sendo um produto digital, a forma de acesso é através de tablets ou pelo browser do computador, numa área de login que estará em breve em nosso site: &quot;draconiancomics.com&quot;. </p>

<p>Embora toda a parte referente à arte do produto esteja pronta, o projeto exige fundos para sanar questões técnicas como programação, hospedagem, desenvolvimento de aplicativo para tablets e licenciamento pelos órgãos responsáveis. Para isso, contamos com a ajuda dos nossos apoiadores (vocês). </p>

<p>MASCATE é um thriller de ficção que conta a história de Marco, um gerente de vendas em uma empresa à beira da falência. Como muitos profissionais do mundo corporativo da cidade de São Paulo, onde se passa a história, o protagonista tem um comportamento egoísta, agressivo, obstinado e pouco interessado nas necessidades daqueles à sua volta. Em meio ao drama pessoal da vida de Marco, uma série de catástrofes começam a acontecer na América do Sul e América Central, são crateras enormes que se abrem em meio à zona rural ou em cidades, exatamente como aconteceu na Guatemala e em outros lugares do mundo. Mas isso é apenas um prenúncio para a verdadeira catástrofe que está por vir. Das mais profundas e obscuras entranhas da Terra, criaturas insecto-humanóides emergem para se satisfazer da fonte mais abundante de alimento presente na superfície: os seres humanos.</p>

<p>Prepare-se para imergir no desconhecido, em uma intensa e assustadora experiência de storytelling.</p>

<p>Ficaremos honrados com sua contribuição. <br/>Muito obrigado </p>

<p>Yves Santaella Briquet - roteirista e coordenador do projeto</p>
",mascate,//player.vimeo.com/video/54209112,http://vimeo.com/54209112,Quadrinhos,7,https://s3-sa-east-1.amazonaws.com/cdn.br.catarse/uploads/project/uploaded_image/1138/WEMAKEACTION_IMG2.jpg,https://s3-sa-east-1.amazonaws.com/cdn.br.catarse/uploads/project/uploaded_image/1138/project_thumb_thumb_WEMAKEACTION_IMG2.jpg,https://s3-sa-east-1.amazonaws.com/cdn.br.catarse/uploads/project/uploaded_image/1138/project_thumb_small_WEMAKEACTION_IMG2.jpg,https://s3-sa-east-1.amazonaws.com/cdn.br.catarse/uploads/project/uploaded_image/1138/project_thumb_large_WEMAKEACTION_IMG2.jpg,https://s3-sa-east-1.amazonaws.com/cdn.br.catarse/uploads/project/uploaded_image/1138/project_thumb_video_cover_WEMAKEACTION_IMG2.jpg,110.54166666666666666700,13265.0,78,71,successful,aon,finished,"2013-01-27 01:59:59","2013-01-26 23:59:59","2012-11-28 01:59:59","2012-11-27 23:59:59",,t,t,f,60,"{""total"" : 0, ""unit"" : ""seconds""}","{""total"" : 60, ""unit"" : ""days""}",15,"{""city"" : ""São Paulo"", ""state_acronym"" : ""SP"", ""state"" : ""São Paulo""}","{""id"" : 99434, ""name"" : ""YVES BRIQUET""}",0,,f,f,15,f,f,f