project_id,id,user_id,name,headline,budget,goal,about_html,permalink,video_embed_url,video_url,category_name,category_id,original_image,thumb_image,small_image,large_image,video_cover_image,progress,pledged,total_contributions,total_contributors,state,mode,state_order,expires_at,zone_expires_at,online_date,zone_online_date,sent_to_analysis_at,is_published,is_expired,open_for_contributions,online_days,remaining_time,elapsed_time,posts_count,address,user,reminder_count,is_owner_or_admin,user_signed_in,in_reminder,total_posts,can_request_transfer,is_admin_role,contributed_by_friends
1146,1146,109307,"Novo Espetáculo: Metáforas","Trabalhando com o Belo para revelar o Eterno! Contamos com sua ajuda para o nosso novo espetáculo.Os brindes são especiais para você!!!!","O orçamento para projetos anteriores a 24/02/2015 normalmente pode ser encontrado na descrição acima.",40000.0,"<p>A Cia. de dança Luminus foi formada em 1996 em Colatina/ES, pela coreógrafa e bailarina Gisela Morandi Kohl Matos, que é especialista em jazz e dança contemporânea e pelo produtor cultural Oziel de Matos. 
A proponente possui em seu repertório sete espetáculos de dança, que mesclam a dança clássica à contemporânea, (Espetáculo Confidências / 2008, Espetáculo A dança e o Criador / 2009, Espetáculo Quadros / 2010, Espetáculo Alabastro / 2011, Espetáculo Arca de Nóe / 2011, Espetáculo Prefixo / 2012, Espetáculo Essencial / 2012) destes quatro filmados e disponíveis em DVD. Além de três livros escritos pela Gisela Matos: Guia prático para equipes de dança, Quando Deus me pediu as sapatilhas e Profetas da dança. Além de quatro DVDs vídeo aula de dança para treinamento.
A cia. está em processo de criação de seu novo espetáculo, que será chamado de Metáfora e será estreado em março de 2013. Possui classificação (etária) livre e duração de aproximadamente 50 minutos.
Este espetáculo foi concebido com o objetivo de apresentar ao público que todos somos iguais perante toda a sociedade.
Somos facilmente envolvidos pelas propostas disponíveis na sociedade, que muitas vezes nos seduzem, nos tiram do nosso caminho do bem.
O mundo clama por paz, por justiça! Mas enquanto nós como seres humanos não pararmos e olharmos para nós mesmos, refletirmos sobre nossas ações diárias, nossos comportamentos, nada irá mudar.
<em>Objetivo</em>
Nosso planejamento é <em>lançar o novo espetáculo denominado METÁFORAS em um teatro com uma boa infraestrutura em Belo Horizonte e nessa mesma data gravá-lo em DVD</em>, como forma de ampliar o alcance do projeto, pois assim pessoas de outros Estados e Países poderão ter acesso à mensagem que preparamos para vocês.
Como funciona isso?
O financiamento coletivo (Crowdfunding) é uma espécie de <em>vaquinha virtual</em> onde pessoas apoiam financeiramente projetos de arte e cultura em troca de recompensas que variam de acordo com o valor contribuído. Se o orçamento total do projeto for atingido, o projeto recebe o dinheiro arrecadado, é posto em prática e cada pessoa recebe em casa sua recompensa. Se o valor não for atingido, as pessoas recebem sua contribuição de volta. Ao contrário de outros tipos de investimento, não há riscos de alguém sair perdendo no fim do processo.
 Escolhemos a plataforma do Catarse que é uma referência quando se fala de iniciativas de financiamento colaborativo. Só no Brasil já são mais de 42 mil apoiadores.</p>

<p>É fácil nos ajudar. Basta clicar em <em>Apoie este projeto</em>, criar um perfil com seus dados pessoais. Este passo é muito importante inclusive para depois entrarmos em contato com você. 
Após escolha o valor e a recompensa.  Você será levado para a página de pagamento, um sítio de conexão segura e muita praticidade para você.
Depois disso, você vai ter um campo pra digitar o valor que irá apoiar e poderá selecionar sua recompensa. Na próxima tela, você tem duas opções: prosseguir o pagamento pelo MoIP ou pelo Paypal.
Se você for usar o Paypal, não precisa preencher aqueles campos de endereço e telefone.
Se você for usar o MoIP, terá que preencher alguns dados básicos que são necessários para realizar os pagamentos. Depois, você será redirecionado ao ambiente do MoIP para escolher a sua forma de pagamento preferida e concretiza-lo.
Quando o projeto é bem-sucedido, alcançando ou superando o montante solicitado, o valor total angariado dos apoiadores é repassado ao proponente, no caso a Cia. Luminus, descontados o percentual devido ao CATARSE e as tarifas cobradas pelo serviço de pagamentos online. Em contrapartida, se um projeto não é bem-sucedido, deixando de alcançar o montante solicitado, os apoiadores recebem de volta o valor de suas contribuições, por meio de crédito no CATARSE ou de estorno das quantias pagas em cartão de crédito, débito em conta bancária ou boleto bancário.
Qualquer dúvida, entrar em contato conosco nos canais que estão aparecendo no seu vídeo.</p>

<p>Tel.: 31 - 3390-1449
Nextel : 55<em>8</em>62123
Skype: cacpfd
E-mail: &quot;<a class=""alt-link"" href=""mailto:contato@cialuminus.com"" target=""_blank"">contato@cialuminus.com</a>&quot;</p>
",metaforas,//player.vimeo.com/video/53795089,http://vimeo.com/53795089,"Teatro e Dança",19,,https://s3-sa-east-1.amazonaws.com/cdn.br.catarse/uploads/project/video_thumbnail/1146/project_thumb_thumb_open-uri20131125-2-19hm9xt,https://s3-sa-east-1.amazonaws.com/cdn.br.catarse/uploads/project/video_thumbnail/1146/project_thumb_small_open-uri20131125-2-19hm9xt,https://s3-sa-east-1.amazonaws.com/cdn.br.catarse/uploads/project/video_thumbnail/1146/project_thumb_large_open-uri20131125-2-19hm9xt,https://s3-sa-east-1.amazonaws.com/cdn.br.catarse/uploads/project/video_thumbnail/1146/project_thumb_video_cover_open-uri20131125-2-19hm9xt,0.37500000000000000000,150.0,5,5,failed,aon,finished,"2013-01-08 01:59:59","2013-01-07 23:59:59","2012-11-09 01:59:59","2012-11-08 23:59:59",,t,t,f,60,"{""total"" : 0, ""unit"" : ""seconds""}","{""total"" : 60, ""unit"" : ""days""}",0,"{""city"" : ""Contagem"", ""state_acronym"" : ""MG"", ""state"" : ""Minas Gerais""}","{""id"" : 109307, ""name"" : ""Oziel de Matos""}",0,,f,f,0,f,f,f