project_id,id,user_id,name,headline,budget,goal,about_html,permalink,video_embed_url,video_url,category_name,category_id,original_image,thumb_image,small_image,large_image,video_cover_image,progress,pledged,total_contributions,total_contributors,state,mode,state_order,expires_at,zone_expires_at,online_date,zone_online_date,sent_to_analysis_at,is_published,is_expired,open_for_contributions,online_days,remaining_time,elapsed_time,posts_count,address,user,reminder_count,is_owner_or_admin,user_signed_in,in_reminder,total_posts,can_request_transfer,is_admin_role,contributed_by_friends
1148,1148,48235,"Expedição Ir e Vir de Bike - Tour d´Afrique","Um jornada épica do primeiro brasileiro a participar do Tour d´Afrique e cruzar o continente africano, de ponta a ponta, em uma bicicleta","O orçamento para projetos anteriores a 24/02/2015 normalmente pode ser encontrado na descrição acima.",15000.0,"<p>Em janeiro de 2013, embarco para aquela que certamente será a grande aventura da minha vida: cruzar o continente africano de ponta a ponta, sobre duas rodas, no <em>Tour d´Afrique</em>, uma das aventuras mais emocionantes do mundo do ciclismo. </p>

<p>Em 10 edições, já reuniu cerca de 400 ciclistas de mais de 20 países. Até hoje, no entanto, nenhum brasileiro participou dessa expedição. Com inscrição confirmada e passagens compradas, serei o primeiro representante da bandeira verde e amarela e o primeiro ciclista latino-americano a fazer parte dessa jornada épica.</p>

<p>Serão 4 meses de pedaladas, aventuras e descobertas. A partida será no dia 11/01/2013 na Cidade do Cairo, Egito, e a chegada prevista para o dia 11/05/2013, na Cidade do Cabo, África do Sul. A Expedição percorrerá 10 países -- Egito, Sudão, Etiópia, Quênia, Tanzânia, Malauí, Moçambique, Zâmbia, Zimbábue, Botsuana, Namíbia e África do Sul – totalizando 12 mil quilômetros.</p>

<p>A jornada percorrerá, de bicicleta, ao longo dos últimos templos antigos do Nilo, atravessando o deserto do Sudão, recortando as paisagens bíblicas da Etiópia e as acidentadas montanhas de Simian. Depois de cruzar a linha do Equador, no Quênia, a pedalada passará pelo lendário Monte Kilimanjaro, pelo o Lago Malauí, nas Victoria Falls e ao longo das bordas do magnífico Kalahari, dos desertos da Namíbia, terminando na magnífica Cidade do Cabo, no extremo Sul do continente.</p>

<p>Além da paisagem, há também a beleza das pessoas. O contato com as comunidades e tribos de diferentes etnias ao longo do trajeto. E a camaradagem com outros cilistas, de diferentes partes do mundo, que também estarão lá pedalando por um sonho. O evento tem como objetivos atravessar a África com uso da energia humana para promover a consciência sobre a bicicleta como um meio alternativo e adequado de transporte. Além disso, o Tour d´Afrique também busca levantar fundos para doações de bicicletas para comunidades na África, com apoio de grupos de desenvolvimento além de ser um evento esportivo único e uma experiência ímpar para ciclistas amadores e profissionais.</p>

<p><em>Cobertura jornalística</em></p>

<p>Toda essa jornada será relatada em textos, fotos e vídeos pelo blog <em>Ir e Vir de Bike</em>, do jornal <em>Gazeta do Povo</em>, do Paraná.
Em uma segunda etapa, a expedição dará origem a um livro-reportagem e vídeo documentário sobre a expedição.</p>

<p><em>Financiamento</em></p>

<p>O financiamento coletivo via Catarse equivale a uma das cotas de patrocínio, no valor de <em>R$ 15 mil</em>, e é uma forma de envolver os amigos, leitores e apaixonados pela bicicleta e torná-los parte dessa grande aventura. Se atingida a meta, a logomarca do projeto <em>Catarse</em> será inserida, em destaque, no uniforme usado na expedição para divulgar essa forma de financiamento coletivo/colaborativo, ajudando a impulsionar novos projeto e sonhos.</p>

<p><em>Sobre o jornalista/ciclista</em></p>

<p><em>Alexandre Costa Nascimento</em> é jornalista, editor da <em>Gazeta do Povo</em> e faz da bicicleta seu meio de transporte, pauta política, de trabalho e de lazer. Como cicloativista, acredita no uso da bicicleta como ferramenta para construção de cidades mais humanas.</p>

<p>Ministrou a oficina “Bicicletas em pauta: mobilidade e cicloativismo nos grandes meios de comunicação”, no 1º Fórum Mundial da Bicicleta, em Porto Alegre, em fevereiro de 2012. Participou como palestrante nos seguintes eventos: 2º Fórum Curitiba de Trânsito (abril 2012); Debate Mobilidade, Meio Ambiente e Sustentabilidade, promovido pela OAB-PR (maio/2012); 1º Fórum Municipal de Bicicletas de Pinhais (junho/2012); Fórum de Bicicletas de Morretes (junho/2012); e, Papo Universitário - Gazeta do Povo (setembro/2012).</p>

<p>Como cicloturista, já pedalou pela Rodovia Transpantaneira (Mato Grosso), Circuito Vale Europeu (Santa Catarina), Berlim (Alemanha), Salt Lake City (EUA),
Deserto do Atacama (Chile) e Colônia de Sacramento (Uruguai).</p>
",tda2013,//player.vimeo.com/video/54940915,http://vimeo.com/54940915,Jornalismo,15,,https://s3-sa-east-1.amazonaws.com/cdn.br.catarse/uploads/project/video_thumbnail/1148/project_thumb_thumb_open-uri20131125-2-lj30hb,https://s3-sa-east-1.amazonaws.com/cdn.br.catarse/uploads/project/video_thumbnail/1148/project_thumb_small_open-uri20131125-2-lj30hb,https://s3-sa-east-1.amazonaws.com/cdn.br.catarse/uploads/project/video_thumbnail/1148/project_thumb_large_open-uri20131125-2-lj30hb,https://s3-sa-east-1.amazonaws.com/cdn.br.catarse/uploads/project/video_thumbnail/1148/project_thumb_video_cover_open-uri20131125-2-lj30hb,116.16666666666666666700,17425.0,48,44,successful,aon,finished,"2013-01-03 01:59:59","2013-01-02 23:59:59","2012-11-04 01:59:59","2012-11-03 23:59:59",,t,t,f,60,"{""total"" : 0, ""unit"" : ""seconds""}","{""total"" : 60, ""unit"" : ""days""}",7,"{""city"" : ""Curitiba"", ""state_acronym"" : ""PR"", ""state"" : ""Paraná""}","{""id"" : 48235, ""name"" : ""Alexandre Costa Nascimento""}",0,,f,f,7,f,f,f