project_id,id,user_id,name,headline,budget,goal,about_html,permalink,video_embed_url,video_url,category_name,category_id,original_image,thumb_image,small_image,large_image,video_cover_image,progress,pledged,total_contributions,total_contributors,state,mode,state_order,expires_at,zone_expires_at,online_date,zone_online_date,sent_to_analysis_at,is_published,is_expired,open_for_contributions,online_days,remaining_time,elapsed_time,posts_count,address,user,reminder_count,is_owner_or_admin,user_signed_in,in_reminder,total_posts,can_request_transfer,is_admin_role,contributed_by_friends
115,115,3472,"Vida Fácil e Baseado em Fatos Reais","Apoiando esse projeto, você estará incentivando duas produções nacionais, realizadas com qualidade e paixão. ","O orçamento para projetos anteriores a 24/02/2015 normalmente pode ser encontrado na descrição acima.",500.0,"<p>Curta-metragem, por definição, é um filme com duração de até 15 minutos. Mas nem por isso, é menos interessante ou divertido que um longa. </p>

<p>Esse projeto é um 2 em 1 e visa a realização de dois curtas, com previsão de lançamento em julho e agosto de 2011. Apoiando esse projeto, você estará incentivando duas produções nacionais, realizadas com qualidade e paixão. </p>

<p>VIDA FÁCIL: 
Manuela é uma menina bonita de classe média, popular no colégio, que decide se virar sozinha e ganhar dinheiro com o que ela sabe fazer, e vira garota de programa. Será que alguém mais tem responsabilidade sobre isso além dela própria? Esta escolha faz dela uma vítima? </p>

<p>BASEADO EM FATOS REAIS: 
Qual é o limite entre realidade e ficção? O que acontece quando uma câmera é ligada? Qual é o nível da manipulação do diretor em um documentário? Essas são algumas questões levantadas nesse curta. Danilo é um diretor e está realizando um documentário, suas ações são questionadas por Lívia, sua assistente. </p>

<p>O orçamento para a realização dos curtas é de R$500,00, e o dinheiro será usado em despesas de produção e divulgação.</p>
",vida-facil-e-baseado-em-fatos-reais,//player.vimeo.com/video/22465520,http://www.vimeo.com/22465520,"Cinema e Vídeo",13,,https://s3-sa-east-1.amazonaws.com/cdn.br.catarse/uploads/project/video_thumbnail/115/project_thumb_thumb_open-uri20131125-2-ht4emo,https://s3-sa-east-1.amazonaws.com/cdn.br.catarse/uploads/project/video_thumbnail/115/project_thumb_small_open-uri20131125-2-ht4emo,https://s3-sa-east-1.amazonaws.com/cdn.br.catarse/uploads/project/video_thumbnail/115/project_thumb_large_open-uri20131125-2-ht4emo,https://s3-sa-east-1.amazonaws.com/cdn.br.catarse/uploads/project/video_thumbnail/115/project_thumb_video_cover_open-uri20131125-2-ht4emo,102.0000000000000000,510.0,14,14,successful,aon,finished,"2011-06-16 02:59:59","2011-06-15 23:59:59","2011-04-17 02:59:59","2011-04-16 23:59:59",,t,t,f,60,"{""total"" : 0, ""unit"" : ""seconds""}","{""total"" : 60, ""unit"" : ""days""}",1,"{""city"" : ""Niterói"", ""state_acronym"" : ""RJ"", ""state"" : ""Rio de Janeiro""}","{""id"" : 3472, ""name"" : """"}",0,,f,f,1,f,f,f