project_id,id,user_id,name,headline,budget,goal,about_html,permalink,video_embed_url,video_url,category_name,category_id,original_image,thumb_image,small_image,large_image,video_cover_image,progress,pledged,total_contributions,total_contributors,state,mode,state_order,expires_at,zone_expires_at,online_date,zone_online_date,sent_to_analysis_at,is_published,is_expired,open_for_contributions,online_days,remaining_time,elapsed_time,posts_count,address,user,reminder_count,is_owner_or_admin,user_signed_in,in_reminder,total_posts,can_request_transfer,is_admin_role,contributed_by_friends
11700,11700,408367,"Invisíveis ","  O visível é passageiro o invisível é eterno. ","<p><img style=""width: 539px; height: 763px;"" src=""https://s3.amazonaws.com/cdn.catarse/uploads/redactor_rails/picture/data/6279/titulos-grafico_grafico_cor.png"" height=""763"" width=""539""><br></p><table> <colgroup><col> <col> <col> <col> </colgroup><tbody><tr> <td colspan=""2""> 2 etapa de filmagem (  equipe, locação, seguro e transporte de equipamentos, alimentação etc. )</td> <td>R$ 22.600,00</td> <td><br></td> </tr> <tr> <td colspan=""2"">Etapa de edição e finalização de imagem ( legendagem, tradução, finalização, 1 cópia para cinema DCP ( Digital Cinema Package )  etc..) </td> <td>R$ 11.580,00</td> <td><br></td> </tr> <tr> <td colspan=""2"">Etapa de finalização e masterização de áudio ( edição, mixagem, composição de trilha etc..) <br></td> <td>R$ 13.000,00</td> <td><br></td> </tr> <tr> <td colspan=""2"">Produção de recompensas e material gráfico aos apoiadores  ( envio das recompensas pelo correio, confecção de camisas, impressão de DVD's, convites, adesivos etc..)</td> <td>R$ 12.620,00</td> <td><br></td> </tr> <tr> <td colspan=""2"">Taxa da plataforma de financiamento -  Catarse ( 13% ) </td> <td>R$ 9.100,00</td> <td><br></td> </tr> <tr> <td> <br></td> <td colspan=""3""> <br></td> </tr> <tr> <td> <br></td> <td><strong>TOTAL PARA SER ARRECADADO </strong></td> <td><strong>R$ 70.000,00</strong></td> <td><br></td> </tr> <tr> <td><br></td> <td><br></td> <td><br></td> <td><br></td> </tr> </tbody></table><p><br></p>",70000.0,"<p><img src=""https://s3.amazonaws.com/cdn.catarse/uploads/redactor_rails/picture/data/4604/invisiveis-final_cinza-60_.png""></p><p style=""text-align: justify;"">Um documentário de longa metragem por meio das iniciativas de inclusão social promovidas por pessoas e projetos anônimos que se reúnem pelo ato do voluntariado na cidade do Rio de Janeiro. O intuito é amparar emocionalmente pessoas em situação de rua. Grupos que agem com a mão, a alma e o coração na ""massa”. </p><p><img style=""width: 185px; height: 50.043630017452px;"" src=""https://s3.amazonaws.com/cdn.catarse/uploads/redactor_rails/picture/data/4599/titulos_motivo.png""></p><p style=""text-align: justify;"">O projeto que nos motivou a filmar estes generosos gestos humanitários foram iniciados pela página do grupo ""Rio Invisível"", ""Rio Mais Visível"" e do ""Espalhamor"". O grupo ""Rio Mais Visível"" e o ""Espalhamor"" são grupos formados por pessoas de diferentes áreas profissionais que tem o ato voluntariado como a cerne do gesto mais valioso na vida ; o amor ao próximo, sem rancores ou quaisquer tipos de comportamentos que condenam ou invalidam o Ser Humano em quaisquer situações. Além de ajudar a retirada de documentos, a recolocação de pessoas no mercado de trabalho, fornecer alimentação, doar carinho e amparo emocional às pessoas em situação de rua, os grupos não tem vínculo político ou partidário com nenhuma instituição e agem de forma totalmente independente.</p><p><img style=""width: 241px; height: 50.0506108202443px;"" src=""https://s3.amazonaws.com/cdn.catarse/uploads/redactor_rails/picture/data/4568/titulos_atea_gora.png""></p><p style=""text-align: justify;""><b> </b>Já filmamos 
20% na primeira etapa do filme. Por meio desta campanha de financiamento
 coletivo, queremos uma ajuda para custear parte da segunda etapa de produção, filmagem e finalização do filme, garantindo o 
envio das recompensas aos apoiadores e colaboradores, bem como, o 
pagamento da porcentagem da plataforma de financiamento coletivo 
""Catarse"". </p><p style=""text-align: justify;"">O filme não tem aporte financeiro de nenhuma instituição pública cinematográfica. Tem 
sido realizado desde dezembro de 2014, de forma autônoma e independente, somente 
com a parceria de amigos e profissionais sérios da área da música e do audiovisual, que ajudaram com um generoso tempo e seu engajamento para realização do filme.</p><p><img style=""width: 160px; height: 49.9825479930192px;"" src=""https://s3.amazonaws.com/cdn.catarse/uploads/redactor_rails/picture/data/4574/titulos_oquequeremos.png""></p><p style=""text-align: justify;"">Colaborando com o filme, ampliaremos essa 
lógica de cidadania filmando outros 
projetos/pessoas, que agem no completo
anonimato, mas que exercem uma atitude fundamental dentro de nosso país.
 Tudo isso, para 
mostrar que a reflexão da possibilidade de se fazer o mínimo de bem na prática é um 
efeito imensurável ao longo prazo. Sobretudo ao olhos dos velhos 
arquétipos da miopia
 do poder público e de uma sociedade baseada apenas no acúmulo de 
riquezas e indiferenças por meio do estilo de vida. </p><p style=""text-align: justify;""><b> </b>Este financiamento coletivo é parte do total de 80% da produção, filmagem e finalização do filme. O objetivo é deixar um legado à sociedade brasileira desses atos - tão escassos nos dias de hoje - perpetuando as ações efetivas de pessoas que estão dispostas a fazer o bem, doando parte de seu tempo em atos permanentes de gentileza cotidiana. Se alcançarmos a meta de financiamento do filme, iniciaremos a segunda etapa de filmagens no início de agosto de 2015.  </p><p style=""text-align: justify;""><img style=""width: 372px; height: 49.9895287958115px;"" src=""https://s3.amazonaws.com/cdn.catarse/uploads/redactor_rails/picture/data/4570/titulos_contrapartida.png""></p><p style=""text-align: justify;""><b> </b>Aos colaboradores e apoiadores deste financiamento coletivo retribuiremos a gentileza,  com camisetas, adesivos, DVD's, cartazes, convites para a pré-estreia e a inserção de nome e logomarca nos créditos iniciais e finais do filme. 20 % da renda do filme em exibição pública será destinada aos projetos documentados.</p><p>Recompensas<br></p><p>1.  Nome nos créditos finais do filme<br></p><p>2. Adesivo ( 11x3cm )<br></p><p><img style=""width: 399px; height: 264px;"" src=""https://s3.amazonaws.com/cdn.catarse/uploads/redactor_rails/picture/data/6382/adesivo-mockup.jpg"" height=""264"" width=""399""></p><p>3. Camisa branca ""Invisíveis"" </p><p><img style=""width: 396px; height: 266px;"" src=""https://s3.amazonaws.com/cdn.catarse/uploads/redactor_rails/picture/data/6383/camisa-mockup.jpg"" height=""266"" width=""396""></p><p>4. Cartaz A3 230g ( Sem moldura ) entregue em seu endereço ( Arte ainda em construção ) </p><p>5. 1 cópia física do filme em formato DVD ( Arte ainda em construção ) </p><p>6. Link e senha para assistir ao documentário na íntegra online antes do lançamento. </p><p>7. Convite para assistir a pré-estreia no Cinema ( ainda a definir local e data ) <br></p><p style=""text-align: justify;"">8. Seu nome ( pessoa ou logomarca )  física ou jurídica, entrará com destaque de 
patrocinador oficial nos créditos iniciais do documentário, nos materiais impressos e digitais, sempre que 
for exibido em salas ou espaços com suporte audiovisual .  <br></p><p><img style=""width: 212px; height: 49.9476439790576px;"" src=""https://s3.amazonaws.com/cdn.catarse/uploads/redactor_rails/picture/data/4572/titulos_distribuicao.png""></p><p style=""text-align: justify;""><b> </b>Cinemas, festivais de cinema nacional e internacional,  exibições gratuitas em instituições culturais ( públicas e privadas ) escolas públicas e privadas e em cineclubes pontuais de todo Brasil que manifestarem interesse pelo filme. <br> </p><p><strong><strong>A Gentileza é universal. </strong><br></strong></p><p style=""text-align: justify;"">Ajudando o filme você faz um pouco para manter o mínimo desses projetos anônimos ativos, e que faz a diferença em nosso país, contribuindo diretamente para que sejam exemplificados para o mundo.</p><p style=""text-align: justify;"">Ajuda também uma equipe de profissionais sérios da cultura brasileira que trabalha para que obras audiovisuais, sejam vistas e devolvidas como legados ao público.  </p><p style=""text-align: justify;"">Vivemos em função de alguém. Temos quer exercitar a compreensão a todos sem distinção. O perdão não é devolver uma ofensa com rancores ou produzir eternamente uma indiferença em nosso cotidiano. Há pessoas precisando de um ouvido, de um carinho e uma compreensão, para também de forma ampla, todos possam ser compreendidos e assim fazerem um auto exame de suas atitudes e devolver um gesto caridoso em favor do amor pelo outro. O amor nos iguala na atitude que nos faz ser melhores e inteiros todos os dias para extinguimos rancores mundanos, que insistem em querer se alojar ao longo de  nossas vidas. A dor dos outros também não pode ser mais um olhar ""batido"", apenas pela vaidade ou prioridade de alguém. Somos responsáveis em todos os sentidos por viver e ajudar o próximo. Seja este próximo, tão próximo de nós, ou aquele que necessita de um amparo físico ou espiritual.  <br></p><em>""O primeiro em pedir desculpas é o mais valente. O primeiro em perdoar de coração é o mais forte. O primeiro em esquecer é o mais feliz"". ( Papa Francisco )</em><em></em><em><strong></strong></em><em></em><p style=""text-align: justify;"">Contamos com a ajuda de vocês para que os exemplos de bem, possam ser repassados e perpetuados para todos. O profeta ""Gentileza"" que já nos sinalizava e nos ensinava com suas letras de intervenção, que gentileza gera gentileza e produz bondades invisíveis aos dos olhos daqueles que só acreditam na ""ambição cega"" e nos valores que excluem o próximo. <br></p><p>Realize este filme com a gente. A gentileza invisível do coração é a que realmente se faz legítima. <br></p><p>Colaborações, apoios institucionais e parcerias com o filme envie um e-mail para : saravahfilmesca@gmail.com <br> <br>Sobre alguns projetos que estão sendo filmados acesse : </p><p> <strong>""Rio Mais Visível"" </strong></p><p><img src=""https://s3.amazonaws.com/cdn.catarse/uploads/redactor_rails/picture/data/6119/rio_mais_visivel_.jpg""></p><p style=""text-align: justify;"">Motivados pela página ""Rio Invisível"" o grupo ""Rio Mais Visível"" presta amparo social e emocional a pessoas em situação de rua na cidade do Rio de Janeiro. Auxilia a retirada de documentos de identificação, tenta localizar familiares, promove bazares para arrecadar doações, ajuda as pessoas a recolocação no mercado de trabalho,  oferece tratamento psicológico, ouve sonhos e oferece abraços.</p><p> <a href=""http://gruporiomaisvisivel.wix.com/gruporiomaisvisivel"" title=""http://gruporiomaisvisivel.wix.com/gruporiomaisvisivel"">http://gruporiomaisvisivel.wix.com/gr...</a><br> facebook.com/riomaisvisivel </p><p><br><strong></strong></p><p><strong>""Espalhamor""<a href=""https://www.facebook.com/pages/Espalhamor""> </a></strong><br></p><p><img style=""width: 647px; height: 432px;"" src=""https://s3.amazonaws.com/cdn.catarse/uploads/redactor_rails/picture/data/5968/10420409_1491156291157230_5097424286342707210_n.jpg"" height=""432"" width=""647""></p><p>Foto Daniel Vides Veras<br></p><p style=""text-align: justify;"">""Espalhamor"" é um movimento de amigos, colegas, agregados, conhecidos e desconhecidos que têm como princípio, o desejo de construir um mundo menos distante e menos indiferente. O objetivo é atender às necessidades daqueles que por qualquer motivo, estão em situação de residência nas ruas do Rio de Janeiro. A semente foi plantada em dezembro de 2013 e de lá pra cá, cresceu a solidariedade. O que movimenta o ""Espalhamor"" é a doação... de amor, de tempo, de atenção de vocacionar o ato da boa vontade. É distribuído comida, sucos, material de higiene, flores e muito amparo emocional pelo ouvido. </p><p><a href=""https://www.facebook.com/pages/Espalhamor""> https://www.facebook.com/pages/Espalhamor</a><br></p><p><br></p>",invisiveis,//player.vimeo.com/video/127856191,https://vimeo.com/127856191,"Cinema e Vídeo",13,https://s3-sa-east-1.amazonaws.com/cdn.br.catarse/uploads/project/uploaded_image/11700/invisiveis-final-final-02.png,https://s3-sa-east-1.amazonaws.com/cdn.br.catarse/uploads/project/uploaded_image/11700/project_thumb_thumb_invisiveis-final-final-02.png,https://s3-sa-east-1.amazonaws.com/cdn.br.catarse/uploads/project/uploaded_image/11700/project_thumb_small_invisiveis-final-final-02.png,https://s3-sa-east-1.amazonaws.com/cdn.br.catarse/uploads/project/uploaded_image/11700/project_thumb_large_invisiveis-final-final-02.png,https://s3-sa-east-1.amazonaws.com/cdn.br.catarse/uploads/project/uploaded_image/11700/project_thumb_video_cover_invisiveis-final-final-02.png,0.38571428571428571400,270.0,6,6,failed,aon,finished,"2015-08-10 02:59:59","2015-08-09 23:59:59","2015-06-10 19:04:22.804805","2015-06-10 16:04:22.804805",,t,t,f,60,"{""total"" : 0, ""unit"" : ""seconds""}","{""total"" : 60, ""unit"" : ""days""}",0,"{""city"" : ""Rio de Janeiro"", ""state_acronym"" : ""RJ"", ""state"" : ""Rio de Janeiro""}","{""id"" : 408367, ""name"" : ""Hélio Rodrigues e Guilherme Machry""}",0,,f,f,0,f,f,f