project_id,id,user_id,name,headline,budget,goal,about_html,permalink,video_embed_url,video_url,category_name,category_id,original_image,thumb_image,small_image,large_image,video_cover_image,progress,pledged,total_contributions,total_contributors,state,mode,state_order,expires_at,zone_expires_at,online_date,zone_online_date,sent_to_analysis_at,is_published,is_expired,open_for_contributions,online_days,remaining_time,elapsed_time,posts_count,address,user,reminder_count,is_owner_or_admin,user_signed_in,in_reminder,total_posts,can_request_transfer,is_admin_role,contributed_by_friends
1170,1170,113697,"Voando em Ipanema!","Ajude-nos a viabilizar a temporada do espetáculo infantil ""Só Voa Quem tenta"" no Teatro Cândido Mendes em Ipanema, e assim alçar novos voos!","O orçamento para projetos anteriores a 24/02/2015 normalmente pode ser encontrado na descrição acima.",3500.0,"<p>Voando em Ipanema visa o apoio financeiro, através do crowdfunding  para viabilizar a temporada do espetáculo “Só Voa quem Tenta” no Teatro Cândido mendes em Ipanema, de 12 de janeiro a 07 de abril de 2013.</p>

<p>“Só Voa Quem Tenta” é um espetáculo infantil, desenvolvido a partir do conto homônimo de Luciana Fontenelle , que conta a história de Pandolfo, Barba Ruiva, Grafite e Nanquim, quatro gatos de rua que têm a difícil tarefa de criar a pequena garça Vitória e ensiná-la a voar.
A montagem do espetáculo foi feita a partir da experiência com crianças da comunidade de Santa Teresa, em oficinas ministradas por Amanda Paiva, professora e diretora do espetáculo, auxiliadas pelos integrantes do elenco. A experiência escolar  e os fundamentos pedagógicos trazidos por Amanda possibilitaram a elaboração de uma peça que fala para crianças, que se integra ao seu universo. Em “Só Voa Quem Tenta” são abordadas questões que permeiam a vida infantil, como morte, aceitação, bullying e adoção; o moderno se incorpora ao lúdico e dialoga com a criança contemporânea.</p>

<p>Com o auxílio financeiro obtido via catarse faremos a manutenção de nosso cenário bem como a compra das peças de divulgação dessa temporada. As recompensas são personalizadas com imagens do espetáculo.
Esta será a nossa primeira temporada em um teatro da zona sul do Rio de Janeiro, sendo de grande importância para a carreira do espetáculo!
Contamos com o seu apoio!!</p>
",voandoemipanema,//player.vimeo.com/video/56079332,http://vimeo.com/56079332,"Teatro e Dança",19,,https://s3-sa-east-1.amazonaws.com/cdn.br.catarse/uploads/project/video_thumbnail/1170/project_thumb_thumb_open-uri20131125-2-1pnzo79,https://s3-sa-east-1.amazonaws.com/cdn.br.catarse/uploads/project/video_thumbnail/1170/project_thumb_small_open-uri20131125-2-1pnzo79,https://s3-sa-east-1.amazonaws.com/cdn.br.catarse/uploads/project/video_thumbnail/1170/project_thumb_large_open-uri20131125-2-1pnzo79,https://s3-sa-east-1.amazonaws.com/cdn.br.catarse/uploads/project/video_thumbnail/1170/project_thumb_video_cover_open-uri20131125-2-1pnzo79,11.71428571428571428600,410.0,11,10,failed,aon,finished,"2013-01-08 01:59:59","2013-01-07 23:59:59","2012-11-09 01:59:00","2012-11-08 23:59:00",,t,t,f,60,"{""total"" : 0, ""unit"" : ""seconds""}","{""total"" : 60, ""unit"" : ""days""}",1,"{""city"" : ""Rio de Janeiro"", ""state_acronym"" : ""RJ"", ""state"" : ""Rio de Janeiro""}","{""id"" : 113697, ""name"" : ""Helena Castro""}",0,,f,f,1,f,f,f