project_id,id,user_id,name,headline,budget,goal,about_html,permalink,video_embed_url,video_url,category_name,category_id,original_image,thumb_image,small_image,large_image,video_cover_image,progress,pledged,total_contributions,total_contributors,state,mode,state_order,expires_at,zone_expires_at,online_date,zone_online_date,sent_to_analysis_at,is_published,is_expired,open_for_contributions,online_days,remaining_time,elapsed_time,posts_count,address,user,reminder_count,is_owner_or_admin,user_signed_in,in_reminder,total_posts,can_request_transfer,is_admin_role,contributed_by_friends
1176,1176,111343,"Designers no carnaval carioca",Transparência,"O orçamento para projetos anteriores a 24/02/2015 normalmente pode ser encontrado na descrição acima.",17000.0,"<p>Já perceberam que no carnaval, os estilistas nunca são citados e geralmente são anônimos? Maravilhosamente aplaudidas, criaturas desfilam na passarela do samba ostentando peças minuciosamente calculadas e realizadas e o  &quot;criador&quot; não é identificado. Alguns estilistas do carnaval do Rio continuam trabalhando no anonimato, ainda sem o reconhecimento da mídia e desconhecidos do grande publico. Dentre eles poucos são os citados  e lembrados nas entrevistas. Coisa rara é saber quem fez. Informação que fica restrita ao meio. Não é compartilhada! Fica sempre aquela pergunta no ar:  quem fez essa roupa? Sistematicamente &quot;passa&quot; uma musa,  uma rainha da bateria, uma celebridade, uma porta bandeira, lá vem a pergunta: Quem fez? Desconhecidos ilustres! 
Dentro do carnaval há alguns anos, tive a iniciativa de realizar esse filme de o olho na identificação desses artistas e buscando como resultado a facilidade de acesso até eles e a valorização de uma classe. 
Esses profissionais dão vida e estilo  ao carnaval e são apaixonados pelo que fazem. A maior parte tem um desempenho social  gerando empregos com ateliers longe do que poderíamos  imaginar em matéria de conforto e praticidade, Um enorme esforço de realização das obras à partir de um desenho protótipo. São meses de trabalho  à fio.Tudo é preparado como para um desfile de alta costura e pret à porter. O grande publico não sabe quem faz . Essas obras de arte publica sao aplaudidas, mas geralmente  não tem o autor identificado.<br>
A iniciativa  desse filme é a  identificação desses artistas, facilitando o acesso até eles.Desvendar quem faz, quem fez e em qual atelier foi feito.
Com uma equipe reduzida pretendemos começar as gravações  no final de dezembro de 2012 .
O apoio financeiro será usado em gastos com equipamentos, montagens, textos e traduções. 
A todo  momento você poderá acompanhar a evolução do projeto, através do site carnaval-de-rio.fr  e pelo  facebook, onde  fotos e pequenos videos do making off serão postados. Seu apoio é fundamental para a realização desse projeto. Apoio financeiro e na divulgação. Vamos compartilhar, jogar na rede. 
Transparência : Designers no carnaval carioca. </p>
",Transparencia,//player.vimeo.com/video/54304203,http://vimeo.com/54304203,Música,16,,https://s3-sa-east-1.amazonaws.com/cdn.br.catarse/uploads/project/video_thumbnail/1176/project_thumb_thumb_open-uri20131125-2-1rji13v,https://s3-sa-east-1.amazonaws.com/cdn.br.catarse/uploads/project/video_thumbnail/1176/project_thumb_small_open-uri20131125-2-1rji13v,https://s3-sa-east-1.amazonaws.com/cdn.br.catarse/uploads/project/video_thumbnail/1176/project_thumb_large_open-uri20131125-2-1rji13v,https://s3-sa-east-1.amazonaws.com/cdn.br.catarse/uploads/project/video_thumbnail/1176/project_thumb_video_cover_open-uri20131125-2-1rji13v,5.02941176470588235300,855.0,11,11,failed,aon,finished,"2013-02-02 01:59:59","2013-02-01 23:59:59","2012-12-04 01:59:00","2012-12-03 23:59:00",,t,t,f,60,"{""total"" : 0, ""unit"" : ""seconds""}","{""total"" : 60, ""unit"" : ""days""}",0,"{""city"" : ""Rio de Janeiro"", ""state_acronym"" : ""RJ"", ""state"" : ""Rio de Janeiro""}","{""id"" : 111343, ""name"" : ""andiara  Macedo ""}",0,,f,f,0,f,f,f