project_id,id,user_id,name,headline,budget,goal,about_html,permalink,video_embed_url,video_url,category_name,category_id,original_image,thumb_image,small_image,large_image,video_cover_image,progress,pledged,total_contributions,total_contributors,state,mode,state_order,expires_at,zone_expires_at,online_date,zone_online_date,sent_to_analysis_at,is_published,is_expired,open_for_contributions,online_days,remaining_time,elapsed_time,posts_count,address,user,reminder_count,is_owner_or_admin,user_signed_in,in_reminder,total_posts,can_request_transfer,is_admin_role,contributed_by_friends
1190,1190,118901,"Carnaval Batukajé 2013","Venha fazer parte desta festa! Contribua e apoie o 02 de fevereiro e o Carnaval Batukajé 2013.","O orçamento para projetos anteriores a 24/02/2015 normalmente pode ser encontrado na descrição acima.",2250.0,"<p>O grupo Batukajé - termo na língua Yorubà que quer dizer “Homens que tocam. Mulheres que dançam” foi criado em 2001 pela dançarina baiana Aldelice Braga, mais conhecida como Nêga, junto com o percussionista francês Nicolas Malhomme. </p>

<p>Há mais de 10 anos o grupo Batukajé leva a cultura afro-brasileira e suas tradições por todos os cantos da cidade de Florianópolis/SC com muita musicalidade, dança e expressão artística. </p>

<p>Todo ano o grupo Batukajé realiza uma linda festa para Iemanjá no dia 02 de fevereiro na praia da Galheta em Floripa, sempre aberta ao público e abre e fecha o Carnaval da Lagoa da Conceição, no primeiro e último dia de Carnaval. </p>

<p>Todos estes eventos são realizados na raça e vontade dos professores e alunos. Nunca houve um patrocínio ou doação ao grupo. Este ano resolvemos inovar, utilizando o crowfunding e nossa rede de contatos, amigos, conhecidos e familiares para nos ajudar a realizar estas duas lindas e já tradicionais festas de Florianópolis/SC.</p>

<p>O valor arrecadado (menos 13% do Catarse) será destinado para cobrir os custos do Batukajé durante o dia de Iemanjá e os dois dias de Carnaval (remuneração dos professores), além da confecção de camisetas para serem distribuídas aos apoiadores nos dias dos eventos.</p>

<p>Venha fazer parte desta festa! Contribua e apoie o 02 de fevereiro e o Carnaval Batukajé 2013.</p>
",batukaje,//player.vimeo.com/video/56634499,http://vimeo.com/56634499,Música,16,,https://s3-sa-east-1.amazonaws.com/cdn.br.catarse/uploads/project/video_thumbnail/1190/project_thumb_thumb_open-uri20131125-2-s4fnzn,https://s3-sa-east-1.amazonaws.com/cdn.br.catarse/uploads/project/video_thumbnail/1190/project_thumb_small_open-uri20131125-2-s4fnzn,https://s3-sa-east-1.amazonaws.com/cdn.br.catarse/uploads/project/video_thumbnail/1190/project_thumb_large_open-uri20131125-2-s4fnzn,https://s3-sa-east-1.amazonaws.com/cdn.br.catarse/uploads/project/video_thumbnail/1190/project_thumb_video_cover_open-uri20131125-2-s4fnzn,100.00000000000000000000,2250.0,9,9,successful,aon,finished,"2013-02-16 01:59:59","2013-02-15 23:59:59","2012-12-18 01:59:00","2012-12-17 23:59:00",,t,t,f,60,"{""total"" : 0, ""unit"" : ""seconds""}","{""total"" : 60, ""unit"" : ""days""}",0,"{""city"" : ""Florianópolis"", ""state_acronym"" : ""SC"", ""state"" : ""Santa Catarina""}","{""id"" : 118901, ""name"" : ""Camila Reis""}",0,,f,f,0,f,f,f