project_id,id,user_id,name,headline,budget,goal,about_html,permalink,video_embed_url,video_url,category_name,category_id,original_image,thumb_image,small_image,large_image,video_cover_image,progress,pledged,total_contributions,total_contributors,state,mode,state_order,expires_at,zone_expires_at,online_date,zone_online_date,sent_to_analysis_at,is_published,is_expired,open_for_contributions,online_days,remaining_time,elapsed_time,posts_count,address,user,reminder_count,is_owner_or_admin,user_signed_in,in_reminder,total_posts,can_request_transfer,is_admin_role,contributed_by_friends
1215,1215,119289,"Abaité: Bandeirantes","Ambientada no Brasil Colônia, a HQ narra as desventuras de uma expedição pelo interior do país. Arrepender-se não é o bastante.","O orçamento para projetos anteriores a 24/02/2015 normalmente pode ser encontrado na descrição acima.",4500.0,"<p><em>O projeto e ...o que é Abaité?</em></p>

<p>“Abaité: Bandeirantes” é uma graphic novel independente que conta a história de um grupo de bandeirantes no interior do Brasil Colônia no século XVI.  Em tupi, abaité significa “gente ruim”, e assim é esse grupo de bandeirantes liderado pelo Capitão Dias, um cara rude, feio e bravo.</p>

<p>A expedição segue com sucesso, claro que sucesso pelo ponto de vista deles, ou seja, capturando índios e acabando com quem oferece resistência. Tudo parece em ordem, mas acontece algo inesperado e sobram apenas 7 bandeirantes, que fogem desesperadamente pela mata.</p>

<p>Bom, se contarmos mais que isso, começamos a entregar a história. Só podemos dizer que Capitão Dias e seus companheiros irão lutar pela sobrevivência, enfrentarão conflitos pessoais, do próprio grupo e conhecerão uma personagem misteriosa.</p>

<p>A trama da HQ é ficcional, porém embasada em uma pesquisa. Historicamente, a intervenção dos Bandeirantes foi violenta, dura, cruel. Em “Abaité: Bandeirantes”, optamos por manter essas características e portanto há cenas de violência.</p>

<p><em>Ganhamos um prêmio, mas precisamos do seu apoio!</em></p>

<p>O projeto ganhou um prêmio do Concurso de Apoio a Projetos Culturais Independentes de Santos e ficamos muito empolgados. Afinal, ganhar um edital mostra que o projeto tem consistência!</p>

<p>O prêmio é uma espécie de chancela de qualidade, mas não é só isso. <em>Há um compromisso legal, registrado em contrato, que nos obriga a concluir o projeto, portanto os apoiadores podem ter certeza de que o livro será publicado.</em></p>

<p>Como o valor do prêmio é muito baixo, o plano era fazer a HQ em um formato pequeno e com apenas 40 páginas. Começamos a produzir o livro, mas então nós, roteirista e ilustrador, pensamos:</p>

<p>-Se eu fosse o leitor, ia querer mais. Só 40 páginas...
-Pode crer. A história é bacana e as ilustrações estão ficando muito boas. Que dó colocar num formatinho.
-A gente tem que bombar essa parada!</p>

<p>Então resolvemos contar a história do jeito que ela merece, desenvolvendo melhor a trama, aumentando o número de páginas, melhorando a qualidade do papel, da impressão, assim como o tamanho do livro, que agora terá 72 páginas de 21×28 cm. É esse custo extra que nos trouxe ao Catarse.</p>

<p><em>Em que pé está o projeto?</em></p>

<p>Todas as ilustrações já foram feitas agora estão na arte final. Já solicitamos o registro da ficha catalográfica e código ISBN para a Fundação Biblioteca Nacional.</p>

<p>A previsão de lançamento do livro, definida no contrato entre o roteirista e a instituição que concedeu o prêmio, é para abril de 2013. Postaremos atualizações sobre o progresso do trabalho.</p>

<p><em>O seu apoio</em></p>

<p>Com maior número de páginas e melhorias técnicas, o orçamento do projeto subiu. O  prêmio que recebemos paga boa parte da produção, mas os custos extras de edição e impressão das 500 cópias do livro nesse novo formato totalizam o valor que aqui pedimos: R$ 4.500,00.</p>

<p>O livro terá uma tiragem de 500 exemplares com 72 páginas,  21×28 cm (com sangria de 3 mm), capa colorida em papel cartão importado e miolo em preto e branco, papel Pólen Bold 80g. </p>

<p>Criamos faixas de apoio de R$10,00 até R$1.000,00, com recompensas proporcionais ao tamanho da força que vocês podem dar. </p>

<p>Como o Brasil é gigantesco, as despesas de postagem podem variar de R$6,00 até mais de R$20,00. Afinal, enviar para o Acre por Sedex custa bem mais caro do que mandar para o bairro vizinho via correio simples. Por isso, as despesas de postagem não estão incluídas.</p>

<p><em>Contamos com vocês!</em></p>

<p>Seu apoio é muito importante para ajudar-nos a realizar esse projeto. Estamos muito empenhados em fazer uma graphic novel realmente bacana, que trate da nossa própria história, e que todos os envolvidos, criadores e apoiadores, fiquem orgulhosos de terem participado.</p>

<p>Aproveite para curtir a fanpage do projeto no facebook.
<a class=""alt-link"" href=""http://www.facebook.com/AbaiteBandeirantes"" target=""_blank"">http://www.facebook.com/AbaiteBandeirantes</a></p>

<p>Obrigado e abraços!</p>
",AbaiteBandeirantes,//player.vimeo.com/video/57672439,https://vimeo.com/57672439,Quadrinhos,7,,https://s3-sa-east-1.amazonaws.com/cdn.br.catarse/uploads/project/video_thumbnail/1215/project_thumb_thumb_open-uri20131125-2-1jv5vt2,https://s3-sa-east-1.amazonaws.com/cdn.br.catarse/uploads/project/video_thumbnail/1215/project_thumb_small_open-uri20131125-2-1jv5vt2,https://s3-sa-east-1.amazonaws.com/cdn.br.catarse/uploads/project/video_thumbnail/1215/project_thumb_large_open-uri20131125-2-1jv5vt2,https://s3-sa-east-1.amazonaws.com/cdn.br.catarse/uploads/project/video_thumbnail/1215/project_thumb_video_cover_open-uri20131125-2-1jv5vt2,122.2000000000000000,5499.0,115,112,successful,aon,finished,"2013-03-22 02:59:59","2013-03-21 23:59:59","2013-02-02 14:16:30","2013-02-02 12:16:30",,t,t,f,47,"{""total"" : 0, ""unit"" : ""seconds""}","{""total"" : 47, ""unit"" : ""days""}",23,"{""city"" : ""São Paulo"", ""state_acronym"" : ""SP"", ""state"" : ""São Paulo""}","{""id"" : 119289, ""name"" : ""Richard Dantas Soares""}",0,,f,f,23,f,f,f