project_id,id,user_id,name,headline,budget,goal,about_html,permalink,video_embed_url,video_url,category_name,category_id,original_image,thumb_image,small_image,large_image,video_cover_image,progress,pledged,total_contributions,total_contributors,state,mode,state_order,expires_at,zone_expires_at,online_date,zone_online_date,sent_to_analysis_at,is_published,is_expired,open_for_contributions,online_days,remaining_time,elapsed_time,posts_count,address,user,reminder_count,is_owner_or_admin,user_signed_in,in_reminder,total_posts,can_request_transfer,is_admin_role,contributed_by_friends
129,129,3479,RONDÔNIA,"O olhar do fotógrafo Ali Karakas é mostrado por um ensaio documental multimídia sobre a região de Porto Velho - RO. Conheça e participe! ","O orçamento para projetos anteriores a 24/02/2015 normalmente pode ser encontrado na descrição acima.",3000.0,"<p>RONDÔNIA - terra da água e do fogo. 
O olhar do fotógrafo Ali Karakas é mostrado por um ensaio documental multimídia sobre a região de Porto Velho–RO. Um convite para observar, refletir e conhecer partes dos espaços íntimos e sociais da cultura rondoniense. Conheça e participe! </p>

<p>DESCREVA SEU PROJETO E QUANTO VC PRECISA </p>

<p>RONDÔNIA - terra da água e do fogo. 
Exposição fotográfica de Ali Karakas 
Fotografias e vídeo de imagens da região Amazônica </p>

<p>Ali Karakas percorreu 10 cidades distritais de Porto Velho – RO (Abunã, Extrema, Fortaleza do Abunã, Jaci Paraná, Nova Califórnia, Nova Mutum Paraná, Porto Velho, Vista Alegre do Abunã, União Bandeirantes) acompanhando o festival itinerante de cinema que acontece anualmente. 
Durante sua passagem por essas cidades, desconhecidas pela maioria dos brasileiros, Ali retratou de forma poética os fortes traços amazônicos das cidades banhadas por grandes rios e a fascinação nos rostos das crianças, adultos e velhos, marcada pelo momentâneo acesso à cultura, tão necessária, mas, ao mesmo tempo, tão abandonada e esquecida. </p>

<p>Essa passagem resultou em uma série de imagens retratadas de forma plástica, que convidam o visitante a observar, refletir e conhecer partes dos espaços íntimos e sociais da cultura rondoniense. </p>

<p>Como memórias e sonhos, a noção de tempo é estendida. Os pensamentos, as lembranças e o silêncio imerso nas sugestões poéticas evocadas pelo olhar particular do fotógrafo propiciam ao observador uma experiência de conexão com uma fração da população brasileira. </p>

<p>Segundo Felipe Milanez, Ali Karakas faz um “Um retrato poético de uma parte do Brasil que está mudando, em transformação, que possui riqueza humana e cultural, em meio a uma natureza deslumbrante, mas que sofre, como toda a fronteira econômica e social, de infraestrutura, direitos e cidadania.” </p>

<p>A exposição no Espaço Galeria do Otto Bistrot, apresentará cerca de 20 fotografias impressas em papel S-Glossy e um vídeo-registro em stop motion, intitulada JACY, de imagens capturadas durante uma revolta na cidade de Jaci Paraná pela constante falta de energia na região. A abertura acontece no dia 27 de maio, das 19h às 23h e pode ser visitada de 28 de maio a 27 de junho 2011. </p>

<p>Como é um sonho do fotógrafo expor suas fotografias e um desejo imenso de propagar essa Rondônia que viu, decidimos realizar através crowdfunding, uma espécie de pré-venda. Podendo assim, completar com R$6 mil, o valor de R$10mil ideias para a realização desta exposição no formato completo (edição do vídeo-registro, impressões, molduras, transporte e material gráfico) </p>

<p>______________# 
Ali Karakas conviveu desde cedo com a arte da fotografia, para a qual decidiu direcionar sua vida profissional. Começou a fotografar como assistente de grandes fotógrafos, trabalhou no cultuado Notícias Populares entre 1999 e 2000, onde frequentou o submundo de São Paulo, e na revista Trip, entre 2002 e 2004, onde desenvolveu o olhar da fotorreportagem. Nos últimos anos, atuou como fotógrafo para diversos sites, agências e dirigiu videoclipes. Ali possui um olhar sobre os lugares esquecidos, inserindo-se no contexto como fosse um personagem, passando despercebido pelas pessoas, fazendo-se objeto de seu trabalho.</p>
",rondonia,,http://vimeo.com/22715876,Fotografia,17,,,,,,102.6666666666666700,3080.0,46,44,successful,aon,finished,"2011-05-27 02:59:59","2011-05-26 23:59:59","2011-03-28 02:59:59","2011-03-27 23:59:59",,t,t,f,60,"{""total"" : 0, ""unit"" : ""seconds""}","{""total"" : 60, ""unit"" : ""days""}",0,"{""city"" : ""Porto Velho"", ""state_acronym"" : ""RO"", ""state"" : ""Rondônia""}","{""id"" : 3479, ""name"" : """"}",0,,f,f,0,f,f,f