project_id,id,user_id,name,headline,budget,goal,about_html,permalink,video_embed_url,video_url,category_name,category_id,original_image,thumb_image,small_image,large_image,video_cover_image,progress,pledged,total_contributions,total_contributors,state,mode,state_order,expires_at,zone_expires_at,online_date,zone_online_date,sent_to_analysis_at,is_published,is_expired,open_for_contributions,online_days,remaining_time,elapsed_time,posts_count,address,user,reminder_count,is_owner_or_admin,user_signed_in,in_reminder,total_posts,can_request_transfer,is_admin_role,contributed_by_friends
1295,1295,125925,"Jambow Jane - Gravação primeiro CD","Jambow Jane - primeiro CD","O orçamento para projetos anteriores a 24/02/2015 normalmente pode ser encontrado na descrição acima.",4000.0,"<p>O grupo Jambow Jane está começando a produzir o seu primeiro CD com musicas inéditas. Na verdade são dez canções de nossa autoria, uma cover e uma adaptação de uma musica tradicional: 12 belas musicas. Estamos muito animados com o projeto. Gostariamos de tê-lo já terminado e pronto, mas temos que confrontar o sonho com a realidade dos custos da produção. Por isso a idéia desse projeto aqui no Catarse.
O dinheiro aqui arrecadado será utilizado para o pagamento dos profissionais e serviços envolvidos na produção.
Para quem não conhece o grupo, nossa pagina Facebook: <a class=""alt-link"" href=""http://www.facebook.com/pages/Jambow-Jane/179162802140135"" target=""_blank"">http://www.facebook.com/pages/Jambow-Jane/179162802140135</a>
Temos ainda pouco material ali, mas em breve iremos postar mais novidades.</p>

<p>Para a gravaçãp do CD nosso quadro de despesas para a gravação é o seguinte:</p>

<p>Tecnico de gravação   R$ 1.400,00
Aluguel do Estudio      R$    168,00
Estudio de Mastering   R$   672,00
Impressão das capas   R$   700,00
Distribuição                 R$   560,00
Custos de gestão         R$   500,00</p>

<p>Total                           R$ 4.000,00</p>

<p>Quanto às recompensas para os apoiadores, serão enviadas via correio. Talvez demorem a chegar mas chegarão. </p>

<p>Em todo caso, agradecemos à quem se dispuser a contribuir para a realização desse projeto. Nós somos Jambow Jane: Marcelo 13, Julio 16, Beatriz 19, Davide 35, Ivan 43, Flavio 52 e Marly 52 anos. </p>
",jambowjane,//player.vimeo.com/video/58825345,https://vimeo.com/58825345,Música,16,,https://s3-sa-east-1.amazonaws.com/cdn.br.catarse/uploads/project/video_thumbnail/1295/project_thumb_thumb_open-uri20131125-2-64q9f5,https://s3-sa-east-1.amazonaws.com/cdn.br.catarse/uploads/project/video_thumbnail/1295/project_thumb_small_open-uri20131125-2-64q9f5,https://s3-sa-east-1.amazonaws.com/cdn.br.catarse/uploads/project/video_thumbnail/1295/project_thumb_large_open-uri20131125-2-64q9f5,https://s3-sa-east-1.amazonaws.com/cdn.br.catarse/uploads/project/video_thumbnail/1295/project_thumb_video_cover_open-uri20131125-2-64q9f5,18.50000000000000000000,740.0,12,12,failed,aon,finished,"2013-04-01 02:59:59","2013-03-31 23:59:59","2013-02-19 16:24:07","2013-02-19 13:24:07",,t,t,f,40,"{""total"" : 0, ""unit"" : ""seconds""}","{""total"" : 40, ""unit"" : ""days""}",0,"{""city"" : ""Limeira"", ""state_acronym"" : ""SP"", ""state"" : ""São Paulo""}","{""id"" : 125925, ""name"" : ""Flavio Antonio Prada""}",0,,f,f,0,f,f,f