project_id,id,user_id,name,headline,budget,goal,about_html,permalink,video_embed_url,video_url,category_name,category_id,original_image,thumb_image,small_image,large_image,video_cover_image,progress,pledged,total_contributions,total_contributors,state,mode,state_order,expires_at,zone_expires_at,online_date,zone_online_date,sent_to_analysis_at,is_published,is_expired,open_for_contributions,online_days,remaining_time,elapsed_time,posts_count,address,user,reminder_count,is_owner_or_admin,user_signed_in,in_reminder,total_posts,can_request_transfer,is_admin_role,contributed_by_friends
13723,13723,426865,"InovaEduca 3.0 - Práticas inovadoras na educação","Educador - imagine apresentar para outros professores seu projeto feito em sala com seus alunos.","<p><strong>Divisão de custos</strong></p><p>Os recursos obtidos serão utilizados da seguinte forma:</p><ul><li>12% - Custos com aluguel do espaço;</li><li>16% - Custos de equipamentos de som e luz - que envolvem microfones, mesas de som, cabos, caixas de som, projetores e telões, aluguel de notebooks e equipe de técnicos para auditórios e salas satélites;</li><li>13% - Credenciamento - equipamentos e equipe de credenciamento no local;</li><li>05% - Mobiliário - que envolve mesas diretoras, mesas de apoio, poltronas para palco, balcões de recepção e credenciamento;</li><li>07% - Comunicação visual e materiais de sinalização do evento;</li><li>04% - Filmagem - câmera e técnico de filmagem;</li><li>10% - Divulgação do evento e do Financiamento Coletivo nas Rdes Sociais, via e-mail e por telefone;</li><li>15% - Equipe de organização e produção;</li><li>05% - Logística de transporte, estadia e alimentação de palestrantes convidados e verba de produção que envolve crachás, pastas e material diverso de apoio;</li><li>13% - Catarse - taxa de intermediação do Financiamento Coletivo.</li></ul><p><img src=""https://s3.amazonaws.com/cdn.catarse/uploads/redactor_rails/picture/data/18302/Gr_fico-custos.jpg"" width=""587"" height=""535"" style=""width: 587px; height: 535px;""></p><p><br></p><p><strong>Planilha com valores estimados</strong></p><p><img src=""https://s3.amazonaws.com/cdn.catarse/uploads/redactor_rails/picture/data/18408/Planilha1.jpg""></p><p><img src=""https://s3.amazonaws.com/cdn.catarse/uploads/redactor_rails/picture/data/18409/Planilha2.jpg""></p><p><br></p><p>Os recursos totais para a realização do evento para 600 participantes é de R$ 107.000,00 conforme planilha de custos detalhada acima. Mas aqui no Catarse estamos requerendo o mínimo de captação de R$ 62.000,00 porque acreditamos que é possível chegar a meta total de financiamento coletivo com a união de todos os educadores, ultrapassando o valor mínimo que está nominado aqui.<br></p><p>Caso a mobilização não alcance o valor total, vamos buscar a complementação na iniciativa privada por meio de patrocínio. Contamos com o seu apoio para não depender das empresas e assim, realizar um evento 100% independente de interesses comerciais.</p><p><br></p><p>Seu apoio é muito importante para a realização do evento, colabore, a Educação brasileira agradece!</p>",62000.0,"<p><img src=""https://s3.amazonaws.com/cdn.catarse/uploads/redactor_rails/picture/data/21345/InovaEduca_01.jpg""></p><p><strong>InovaEduca 3.0 - MIS - Museu da Imagem e do Som - São Paulo</strong></p><p><strong>Serão 3 dias de trocas de experiências e conhecimento, veja a programação e faça sua inscrição para participar gratuitamente no site:</strong></p><p><strong><a href=""http://www.inovaeduca.com.br"">www.inovaeduca.com.br</a></strong></p><p><strong><br></strong></p><p><strong><br></strong></p><p><strong>InovaEduca mudou, agora você é quem faz!</strong><br></p><p>Neste novo formato o EDUCADOR é o PROTAGONISTA. Assim como acreditamos que uma aula tradicional não é tão efetiva como um estudo orientado por projeto, com atividades criadas pelos próprios alunos e possivelmente com apoio das novas tecnologias, também transferimos este desafio para o nosso formato, onde os conteúdos dos debates e palestras vão ser formados pelos próprios participantes. Nosso lema para este ano é:</p><p style=""margin-left: 120px;""><strong>PROFESSOR AUTOR - já imaginou ser um palestrante e apresentar para outros professores o que você faz de melhor?</strong></p><p><span></span>Pretendemos realizar um evento totalmente diferente: de professor para professor, com muita interação e mesas de debates, em uma ambiente propício para cultura e informação. </p><p>Nossa iniciativa vem estimulando o debate sobre novas práticas na Educação deste 2012. Já disponibilizamos mais de 500 ingressos gratuitos para Rede Pública dos Estados de São Paulo, Pernambuco, Rio Grande do Sul e Ceará. Desta vez, queremos ter independência total de interesses comerciais, por isso nada melhor que a própria mobilização de educadores, professores e mestres para realizar o seu próprio meio de expressão, e assim dar a voz e a vez a estes profissionais tão importantes na formação de estudantes cidadãos e protagonistas das suas vidas.</p><p><br></p><hr><p><strong>Formato do evento</strong></p><p>Serão 3 dias no Museu da Imagem e do Som (MIS) em São Paulo, com 2 auditórios, 4 salas de atividades paralelas e mais uma área para exposição e apresentação dos cartazes dos projetos dos PROFESSORES AUTORES.<br></p><p><br></p><hr><p><strong>Exposição de 100 banners de projetos de professores</strong></p><p>Vamos contar com 100 vagas para apresentação de trabalhos em formato de banner na área de exposições. Dos 100 PROFESSORES AUTORES, serão escolhidos 20 para realizarem as palestras contando os casos de boas práticas que realizaram e os resultados alcançados com os alunos.</p><p><br></p><hr><p><strong><img src=""https://s3.amazonaws.com/cdn.catarse/uploads/redactor_rails/picture/data/19403/InovaEduca_02.png"" style=""line-height: 1.6em; font-weight: 400;""></strong></p><p><strong>Professores Autores Palestrantes</strong></p><p>A escolha dos <strong>PROFESSORES AUTORES</strong> que vão preencher as 20 vagas para proferir as palestras, será realizada por um Comitê de Seleção sob a parceria Pedagógica do Instituto Crescer. O Comitê será formado por educadores de destaque no cenário nacional e que entendem profundamente de inovação, do impacto das novas tecnologias na aprendizagem e são experientes selecionadores de projetos:</p><ul><li>Luciana Allan - Diretora do Instituto Crescer</li><li>Mônica Mandaji - Instituto Crescer / PUC-SP</li><li>Bárbara Silva - Instituto Crescer / PUC-SP</li><li>Conheça o currículo completo da equipe: <a href=""https://drive.google.com/file/d/0BwagP3rtQApTY3hNaW90cWZUaUE/view?usp=sharing"" target=""_blank"">https://drive.google.com/file/d/0BwagP3rtQApTY3hNa...</a></li></ul><p><span></span></p><p>Os 20 selecionados receberão orientações e apoio para realizarem suas apresentações de forma clara, objetiva e interessante, com o suporte do corpo pedagógico da InovaEduca.</p><p style=""margin-left: 20px;"" rel=""margin-left: 20px;""><strong>IMPORTANTE:</strong><br></p><ul><li>Só estão elegíveis a participar da seleção os educadores que se
     inscreverem e colaborarem com as Categorias AUTORIA e AUTORIA PLUS.<o:p></o:p></li>
 <li>O relato do projeto deverá ser enviado para o e-mail
     congresso@inovaeduca.com.br até dia 10 de novembro de 2015.</li><li>Para baixar o modelo de relato de projeto, vá em: <a href=""https://drive.google.com/file/d/0BwagP3rtQApTQmF6d0RIS0hKVlU/view?usp=sharing"" target=""_blank"">https://drive.google.com/file/d/0BwagP3rtQApTQmF6d...</a></li></ul><p><br></p><hr><p><strong>Parceria Pedagógica</strong></p><p>O InovaEduca 3.0 vai contar com a importante parceria pedagógica do Instituto Crescer, uma Organização Não Governamental que este ano completa 15 anos de atuação na formação de professores, na abordagem das novas tecnologias para educação e no desenvolvimento de projetos inovadores para comunidades e instituições.</p>  <p>Terá como foco no InovaEduca 3.0 a colaboração nas atividades pedagógicas, que envolvem a escolha dos PROFESSORES AUTORES para as vagas das palestras; orientações aos escolhidos para desenvolverem apresentações interessantes, ajudando a contar a história do projeto educacional e seus resultados; promoção dos conteúdos e organização das mesas de debates sobre os eixos temáticas propostos.<br></p><p><img src=""https://s3.amazonaws.com/cdn.catarse/uploads/redactor_rails/picture/data/18495/IC_logo_colorido_vetorizado_web.png"" width=""208"" height=""131"" style=""width: 208px; height: 131px;""></p><hr><p><img src=""https://s3.amazonaws.com/cdn.catarse/uploads/redactor_rails/picture/data/19456/InovaEduca_05.png""><br></p><p><strong>Temas a serem abordados</strong></p><ul><li>Inovação na EducaçãoNovas metodologias e novos recursos que
vem de encontro a solucionar as grandes questões que se colocam diante da massificação do ensino e as práticas
pedagógicas que vão de encontro a
personalização e protagonismo do aluno.

Outro debate, é o papel do professor
neste novo contexto em que vivemos de revolução tecnológica digital.<ul><li>Tecnologia Educacional</li><li>Gamificação</li><li>Um para um</li><li>Ensino Híbrido</li><li>Flipped Classroom</li><li>Educação personalizada</li></ul></li><li>Pedagogia Ativa</li></ul><p style=""margin-left: 40px;"" rel=""margin-left: 40px;"">Conjunto de práticas pedagógicas que abordam a questão da aprendizagem pelos alunos sob uma perspectiva diferente das técnicas clássicas de aprendizagem.</p><p style=""margin-left: 40px;"">Na aprendizagem ativa, entende-se que o aluno não deve ser meramente um ""recebedor"" de informações, mas deve se engajar de maneira ativa na aquisição do conhecimento, focando seus objetivos e indo atrás do conhecimento de maneira pró-ativa.</p><ul><ul><li>Active Learning</li><li>PBL, Problem-based Learning</li><li>Evidence-based Teaching, Evidence-based Education</li><li>Peer Instruction</li><li>Pseudo-Teaching</li></ul></ul><p><span></span></p><p><img src=""https://s3.amazonaws.com/cdn.catarse/uploads/redactor_rails/picture/data/18336/eixos.jpg""></p><p><br></p><hr><p><strong>A quem o evento é dirigido</strong></p><ul><li>Coordenadores Pedagógicos</li><li>Coordenadores de Tecnologia Educacional</li><li>Professores de Ensino Fundamental e Ensino Médio</li><li>Professores de Universidades</li><li>Diretores de Ensino</li><li>Professores ligados aos Núcleos de Tecnologia Educacional</li><li>Educadores pertencente as Secretarias de Educação</li><li>Diretores de Escolas</li><li>Educadores ligados a ONGs e Instituições</li><li>Educadores ligados a Universidades</li><li>Universitários</li></ul><p><br></p><hr><p><strong>Data e local</strong></p><p>O evento está estimado para ocorrer nos dias 26, 27 e 28 de novembro de 2015, planejado para ser realizado no Museu da Imagem e do Som (MIS), em São Paulo.</p><p>*Como dependemos do sucesso do financiamento para pagamento da reserva do espaço, somente poderemos confirmar este local e data com o encerramento do Financiamento Coletivo.</p><p>Fotos do MIS:<strong> </strong><a href=""http://cat.arq.br/portfolio/mis/"" target=""_blank"">http://cat.arq.br/portfolio/mis/</a></p><p><br></p><hr><p><img src=""https://s3.amazonaws.com/cdn.catarse/uploads/redactor_rails/picture/data/19454/InovaEduca_03.png""><br></p><p><img src=""https://s3.amazonaws.com/cdn.catarse/uploads/redactor_rails/picture/data/19455/InovaEduca_04.png""><br></p><p>Você poderá optar por diferentes recompensas no InovaEduca 3.0:</p><p><img src=""https://s3.amazonaws.com/cdn.catarse/uploads/redactor_rails/picture/data/19453/Particiapacao.png""></p><p>* Convite exclusivo para participação presencial: incluindo os três dias de evento.</p><p><strong><br></strong></p><hr><p><strong>Coquetel de Encerramento</strong></p><p>No último dia do evento vamos realizar um coquetel para confraternizar o sucesso dos projetos dos PROFESSORES AUTORES e também para comemorar os 15 anos do Instituto Crescer com o lançamento do livro comemorativo deste aniversário com autógrafos.</p><p>No livro, a diretora do Instituto Crescer, Luciana Allan, faz uma reflexão sobre as mudanças e desafios que as novas tecnologias trazem para escola, sala de aula e para o professor.</p><p><strong>Será um momento único de celebração e reconhecimento.</strong></p><p><strong><br></strong></p><hr><p><img src=""https://s3.amazonaws.com/cdn.catarse/uploads/redactor_rails/picture/data/19463/InovaEduca_06.png""></p><p>Serão convidados os seguintes palestrantes sob curadoria da InovaEduca para completar o time de especialistas dos três dias de evento:</p><p><strong><img src=""https://s3.amazonaws.com/cdn.catarse/uploads/redactor_rails/picture/data/18313/Eduardo_Chaves.jpg"" width=""124"" height=""125"" style=""width: 124px; height: 125px;""></strong></p><p><strong>Eduardo Chaves</strong><br>PPh.D. em Filosofia, História e Religião pela Universidade de Pittsburgh, é especialista em inovação e tecnologia educacional com diversos artigos publicados. Membro de conselho de Institutos brasileiros, entre eles o Instituto Crescer e Instituto Paramitas; e internacionais, como o Education Fast Foward, o Education Impact e o Salzburg Seminar.<br></p><p><br></p><p><img src=""https://s3.amazonaws.com/cdn.catarse/uploads/redactor_rails/picture/data/18320/rafael.jpg"" width=""131"" height=""131"" style=""width: 131px; height: 131px;""></p><p><strong>Rafael Parente<br></strong>Ex-subsecretário da Secretaria de educação da Cidade do Rio de Janeiro, onde participou da criação de projetos como o Educopédia e GENTE, fundador da AONDÊ e da LABi - Laboratório de Inovação Educacional. Tem mestrado em gestão educacional e é PhD em educação internacional e desenvolvimento pela New York University.</p><p><strong><img src=""https://s3.amazonaws.com/cdn.catarse/uploads/redactor_rails/picture/data/18326/rr.jpg"" width=""126"" height=""134"" style=""width: 126px; height: 134px;""><br><br>Luciano Meira</strong><br>Graduado em Pedagogia pela Faculdade de Filosofia do Recife, Mestre em Psicologia Cognitiva pela Universidade Federal de Pernambuco e Ph.D. em Educação Matemática pela University of California at Berkeley. Professor Adjunto do Departamento de Psicologia da UFPE, realiza pesquisas em cultura e cognição, atuando principalmente nos seguintes temas: processos de produção de sentidos, análise interacional, tecnologias da informação e Internet. É bolsista de Desenvolvimento Tecnológico Industrial do CNPq e apoia projetos em educação e estudos de usabilidade do C.E.S.A.R (Centro de Estudos e Sistemas Avançados do Recife). Atualmente, colabora com a Olimpíada de Jogos Digitais e Educação (OJE), um projeto de inovação baseado em tecnologias educacionais lúdicas.<br><br></p><p><strong><img src=""https://s3.amazonaws.com/cdn.catarse/uploads/redactor_rails/picture/data/18327/romero.jpg"" width=""122"" height=""132"" style=""width: 122px; height: 132px;""></strong><br></p><p><strong>Romero Tori</strong><br>Doutor e livre docente em tecnologias interativas pela USP. Atualmente é professor associado da Escola Politécnica da USP, na área de engenharia de computação, onde coordena o Interlab - Laboratório de Tecnologias Interativas, e professor titular do Centro Universitário Senac, na área de design digital, onde coordena o programa de iniciação científica e o grupo de pesquisa em tecnologia aplicada. Coordenou e tem desenvolvido diversas pesquisas em tecnologias interativas, com ênfase na aplicação em educação, saúde e entretenimento.<br><br></p><p><strong><img src=""https://s3.amazonaws.com/cdn.catarse/uploads/redactor_rails/picture/data/18312/Ana.jpg"" width=""128"" height=""128"" style=""width: 128px; height: 128px;""></strong></p><p><strong>Ana Teresa Ralston</strong><br>Vice Presidente para novos negócios, marketing e Projetos Estratégicos no Centro Universitário Ítalo Brasileiro, ex diretora de Tecnologia Educacional da Abril Educação e da área de educação da Microsoft, fomentadora e profunda conhecedora da tecnologia educacional e de inovação na Educação.<br><br></p><p><img src=""https://s3.amazonaws.com/cdn.catarse/uploads/redactor_rails/picture/data/18311/INSTITUTO_CRESCER_2012_300DPI-153.jpg"" width=""133"" height=""136"" style=""width: 133px; height: 136px;""></p><p><strong>Luciana Alan<br></strong>Doutora em Educação pela Faculdade de Educação/ USP, Mestra em Ciências da Comunicação pela ECA/USP, redatora dos PCNs em Ação e PCNs + Conceitos Estruturantes para o MEC, idealizadora da Avaliação de Práticas Educacionais Inovadoras apoiadas pelas tecnologias digitais, autora do Guia Crescer em Rede, financiado pela Fundação Odebrecht e do curso Melhor Gestão, Melhor Ensino para a Secretaria de Educação do Estado de São Paulo. Diretora técnica do Instituto Crescer onde há mais de 10 anos coordena projetos na área de Educação, muitos deles voltados à formação de professores para adoção de tecnologias digitais nas estratégias de ensino e aprendizagem. Articulista da Revista Profissão Mestre, Blog da Revista Exame e do Portal Educar para Crescer.</p><p><img src=""https://s3.amazonaws.com/cdn.catarse/uploads/redactor_rails/picture/data/18321/Beth.jpg"" width=""133"" height=""134"" style=""width: 133px; height: 134px;""></p><p><strong>Beth Almeida<br></strong>Doutora em Educação pela Pontifícia Universidade católica de São Paulo PUC/SP é coordenadora da pós-educação de Currículo, tendo atuado como consultora em diversos projetos privados e governamentais. É criadora do curso de Gestão e Novas Tecnologias.<br><br></p><p><strong><img src=""https://s3.amazonaws.com/cdn.catarse/uploads/redactor_rails/picture/data/18315/cibele.jpg"" width=""146"" height=""147"" style=""width: 146px; height: 147px;""></strong></p><p><strong>Cybele Meyer<br></strong>Autora do blog Educa Já e palestrante é Pós-graduada em Pisicopedagogia pela Faculdade Internacional de Curitiba e direito pela Universidade Católica de Santos.<br><br></p><p><strong><img src=""https://s3.amazonaws.com/cdn.catarse/uploads/redactor_rails/picture/data/18317/adriana_martinelli.jpg""></strong></p><p><strong>Adriana Martinelli<br></strong>Diretora no LED - Laboratório de Experimentações Didáticas, foi coordenadora da Área de Educação e Tecnologia do Instituto Ayrton Senna - desde 1999. Formada em Fonoaudiologia, pela PUC-SP com especialização em Psicopedagogia - Teoria e Prática e em Novas Tecnologias de Comunicação Aplicadas à Educação pela Escola do Futuro/USP.<br><br></p><p><img src=""https://s3.amazonaws.com/cdn.catarse/uploads/redactor_rails/picture/data/18319/Oficina_Geodin_mica.jpg"" width=""128"" height=""128"" style=""width: 128px; height: 128px;""></p><p><strong>Célia Senna</strong><br>Coordenadora pedagógica do Instituto Lumiar e coordenadora Pedagógica da Geodinâmica Educação. Tem mais de 20 anos de experiência em docência. Credenciada pela SME/SP para trabalhar na implementação do Programa Orientação Curricular e Proposição de Expectativas de Aprendizagem para os Ciclos I e II do Ensino Fundamental. Bacharel e licenciada em Ciências Biológicas, mestre em Ciências Biológicas e doutora em Biologia Molecular pela Universidade de Brasília.</p><p><strong><img src=""https://s3.amazonaws.com/cdn.catarse/uploads/redactor_rails/picture/data/18323/anna.jpg""><br><br>Anna Penido</strong><br>Diretora do Instituto Inspirare. Foi Chefe do Escritório da UNICEF no Brasil, Diretora-Executiva na CIPO-Comunicação Interativa, Gerente de Projetos na Fundação Odebrecht. Formada por Harvard University, Universidade Federal da Bahia e Columbia University na Cidade de Nova York.<br><br></p><p><strong><img src=""https://s3.amazonaws.com/cdn.catarse/uploads/redactor_rails/picture/data/18324/erico.jpg""><br><br>Érico da Silveira</strong><br>Coordenador Geral de Mídias e Conteúdos Digitais - Ministério da Educação (MEC). É pesquisador do Laboratório de Políticas de Comunicação - LAPCOM (UnB - Fundação Ford). Graduado em Comunicação – Publicidade e Propaganda (Universidade de Brasília), Pesquisa em Television Management (City University of New York), Mestrado em Televisão Pública (Universidade de Brasília) e Doutorado em Conteúdos para as Mídias (Universidade de Brasília).<br><br></p><p><img src=""https://s3.amazonaws.com/cdn.catarse/uploads/redactor_rails/picture/data/18325/Edvaldo.jpg""><br><br><strong>Edvaldo Couto</strong><br>Doutor em Educação pela Unicamp, concluiu estágio de pós-doutoramento em Educação na UFRGS. É professor na graduação e pós-graduação em Educação, na Faculdade de Educação, na Universidade Federal da Bahia. Com bolsa de Produtividade em Pesquisa do CNPQ desenvolve a pesquisa ""Cibercultura e Educações: Narrativas de professores nas redes sociais digitais"".</p><p><br></p><hr><p><strong><a href=""http://cat.arq.br/portfolio/mis/""></a>Financiamento Coletivo</strong></p><p>Decidimos não depender mais de empresas patrocinadoras para realizar o evento, por isso a escolha pelo Financiamento Coletivo, onde todos colaboram e todos são beneficiados. Depende só de você!</p><p><br></p><hr><p><strong><img src=""https://s3.amazonaws.com/cdn.catarse/uploads/redactor_rails/picture/data/19404/InovaEduca_03.png""></strong></p><p>A iniciativa de fazer um evento de inovação na educação partiu do empreendedor e idealizador do projeto Fabio Stefanini Jor, após uma experiência de 7 anos na organização do Prêmio Educadores Inovadores, que ocorreu de 2006 a 2012 e promoveu o desvendamento de milhares de casos de boas práticas do uso das novas tecnologias em sala de aula por professores do Brasil todo.<br></p><p>O primeiro movimento InovaEduca aconteceu em outubro de 2012, com o Congresso Internacional InovaEduca 3.0, realizado nos três andares da Fecomercio, na Av. Nove deJulho, em São Paulo. Foi um estrondoso sucesso, com o auditório principal de 500 lugares lotado. O evento contou com 10 palestras e mesas de debates no auditório principal e 6 oficinas em salas satélites. Nesta ocasião a iniciativa InovaEduca foi a primeira a trazer para o Brasil o Professor Jim Lengel - Universidade da Cidade de Nova York - para falar da Educação 3.0. Depois disso foi muito referendado em outros eventos, o que muito orgulha em sermos os precursores.</p><p>Em março do ano seguinte levamos o modelo do Congresso Internacional InovaEduca 3.0 para Recife, com o apoio da Secretaria de Educação de Pernambuco. O local escolhido foi o Centro de Convenções Pernambuco, que recebeu 480 educadores do estado. O evento contou com 10 palestras e mesas de debate no auditório principal, 4 palestras nos auditórios paralelos e 10 oficinas em salas satélites.  </p><p>No mesmo ano de 2013, no mês de outubro, reunimos 40 diretores de escolas particulares no InovaEduca Summit, um evento fechado direcionado para tomadores de decisão das Instituições de Ensino privadas. O evento contou com a palestra de abertura do Sr. Mauro Aguiar, diretor do Colégio Bandeirantes, seguido de mais 8 palestrantes que apresentaram soluções digitais para educação.</p><p>Veja mais:</p><ul><li><a href=""http://www.inovaeduca.com.br"">www.inovaeduca.com.br</a></li><li><a href=""http://www.facebook.com/InovaEduca3"">www.facebook.com/InovaEduca3</a></li></ul><p><br></p><p><strong>Todos os eventos InovaEduca realizados:</strong></p><ul><li>InovaEduca Summit - Secretarias de Educação - <span class=""redactor-invisible-space"" style=""line-height: 1.6em; background-color: initial;""></span><strong>Fortaleza</strong> - 2015</li><li>InovaEduca Summit - Secretarias de Educação - <strong>Porto Alegre</strong> - 2015</li><li>InovaEduca Summit - Secretarias de Educação - <strong>Recife </strong>- 2014</li><li>InovaEduca Summit - Escolas Particulares - <strong>São Paulo</strong> - 2013</li><li>Congresso Internacional InovaEduca 3.0 - <strong>Recife</strong> - 2013</li><li>Congresso Internacional InovaEduca 3.0  - <strong>São Paulo</strong> - 2012</li></ul><p><img src=""https://s3.amazonaws.com/cdn.catarse/uploads/redactor_rails/picture/data/18300/Linha_do_tempo.jpg""></p><p><br></p><p><strong>Fotos</strong></p><ul><li>Congresso Internacional InovaEduca 3.0 - <strong>São Paulo</strong> - 2012</li></ul><p><img src=""https://s3.amazonaws.com/cdn.catarse/uploads/redactor_rails/picture/data/18269/IMG_7736.jpg""></p><p><img src=""https://s3.amazonaws.com/cdn.catarse/uploads/redactor_rails/picture/data/18271/IMG_7720.jpg""></p><p><img src=""https://s3.amazonaws.com/cdn.catarse/uploads/redactor_rails/picture/data/18270/IMG_7750.jpg""></p><p><img src=""https://s3.amazonaws.com/cdn.catarse/uploads/redactor_rails/picture/data/18303/Palestrantes_01.jpg""></p><p><br></p><ul><li>Congresso Internacional InovaEduca 3.0 - <strong>Recife</strong> - 2013</li></ul><p><img src=""https://s3.amazonaws.com/cdn.catarse/uploads/redactor_rails/picture/data/18272/geral.jpg""></p><p><img src=""https://s3.amazonaws.com/cdn.catarse/uploads/redactor_rails/picture/data/18274/GeralIE.jpg""></p><p><img src=""https://s3.amazonaws.com/cdn.catarse/uploads/redactor_rails/picture/data/18305/Palestrantes_02.jpg""></p><p><br></p><ul><li>InovaEduca Summit - Escolas Particulares - <strong>São Paulo</strong> - 2013</li></ul><p><img src=""https://s3.amazonaws.com/cdn.catarse/uploads/redactor_rails/picture/data/18275/0R2A4587.jpg""></p><p><img src=""https://s3.amazonaws.com/cdn.catarse/uploads/redactor_rails/picture/data/18276/0R2A4797.JPG""></p><p><img src=""https://s3.amazonaws.com/cdn.catarse/uploads/redactor_rails/picture/data/18306/Palestrantes_03.jpg""></p><p><br></p><ul><li>InovaEduca Summit - Secretarias de Educação - <strong>Recife </strong>- 2014</li></ul><p><img src=""https://s3.amazonaws.com/cdn.catarse/uploads/redactor_rails/picture/data/18278/Geral_05.jpg""></p><p><img src=""https://s3.amazonaws.com/cdn.catarse/uploads/redactor_rails/picture/data/18301/Geral_02.jpg""></p><p><img src=""https://s3.amazonaws.com/cdn.catarse/uploads/redactor_rails/picture/data/18307/Palestrantes_04.jpg""></p><p><br></p><ul><li>InovaEduca Summit - Secretarias de Educação - <strong>Porto Alegre</strong> - 2015</li></ul><p><img src=""https://s3.amazonaws.com/cdn.catarse/uploads/redactor_rails/picture/data/18279/ADALBERTO_13.jpg""></p><p><img src=""https://s3.amazonaws.com/cdn.catarse/uploads/redactor_rails/picture/data/18280/EventoPalestrante_Rafael_Parente.jpg""></p><p><img src=""https://s3.amazonaws.com/cdn.catarse/uploads/redactor_rails/picture/data/18281/LEILA_16.jpg""></p><p><img src=""https://s3.amazonaws.com/cdn.catarse/uploads/redactor_rails/picture/data/18309/Palestrantes_06.jpg""></p><p><br></p><hr><p><strong>Mensagem final - </strong>assista ao vídeo:</p><iframe style=""width: 500px; height: 281px;"" src=""//www.youtube.com/embed/bmdbivACSZc"" frameborder=""0"" allowfullscreen=""""></iframe><hr>",inovaeduca,//www.youtube.com/embed/oU3vV8Z9rt4,https://youtu.be/oU3vV8Z9rt4,Educação,31,https://s3-sa-east-1.amazonaws.com/cdn.br.catarse/uploads/project/uploaded_image/13723/Card_Catarse_InovaEduca.png,https://s3-sa-east-1.amazonaws.com/cdn.br.catarse/uploads/project/uploaded_image/13723/project_thumb_thumb_Card_Catarse_InovaEduca.png,https://s3-sa-east-1.amazonaws.com/cdn.br.catarse/uploads/project/uploaded_image/13723/project_thumb_small_Card_Catarse_InovaEduca.png,https://s3-sa-east-1.amazonaws.com/cdn.br.catarse/uploads/project/uploaded_image/13723/project_thumb_large_Card_Catarse_InovaEduca.png,https://s3-sa-east-1.amazonaws.com/cdn.br.catarse/uploads/project/uploaded_image/13723/project_thumb_video_cover_Card_Catarse_InovaEduca.png,1.67741935483870967700,1040.0,16,16,failed,aon,finished,"2015-10-24 01:59:59","2015-10-23 23:59:59","2015-08-24 19:13:04.264594","2015-08-24 16:13:04.264594",,t,t,f,60,"{""total"" : 0, ""unit"" : ""seconds""}","{""total"" : 60, ""unit"" : ""days""}",3,"{""city"" : ""São Paulo"", ""state_acronym"" : ""SP"", ""state"" : ""São Paulo""}","{""id"" : 426865, ""name"" : ""InovaEduca""}",1,,f,f,3,f,f,f