project_id,id,user_id,name,headline,budget,goal,about_html,permalink,video_embed_url,video_url,category_name,category_id,original_image,thumb_image,small_image,large_image,video_cover_image,progress,pledged,total_contributions,total_contributors,state,mode,state_order,expires_at,zone_expires_at,online_date,zone_online_date,sent_to_analysis_at,is_published,is_expired,open_for_contributions,online_days,remaining_time,elapsed_time,posts_count,address,user,reminder_count,is_owner_or_admin,user_signed_in,in_reminder,total_posts,can_request_transfer,is_admin_role,contributed_by_friends
1419,1419,123583,"Empreendedorismo e Pequena Empresa","Poesia e prosa: uma forma criativa de falar sobre empreendedorismo e pequenas empresas","O orçamento para projetos anteriores a 24/02/2015 normalmente pode ser encontrado na descrição acima.",6900.0,"<p>Há um ano, publico aquilo que escrevo em um blog (<a class=""alt-link"" href=""http://www.3es2ps.blogspot.com"" target=""_blank"">www.3es2ps.blogspot.com</a>). Nesse espaço escrevo sobre empreendedorismo e administração de pequenas empresas. 
Em 2012, publiquei um livro - Janelas, Escadas e Esculturas e outros escritos - que reuniu alguns textos do blog. Esse livro foi distribuído gratuitamente aos que se interessam pelos assuntos que escrevo. 
Desejo fazer um novo livro esse ano, por isso a ideia desse projeto no Catarse. Apesar desses textos já terem sido publicados no blog, decidi reuni-los nesse formato. Cada texto surgiu de forma independente, mas parecem constituir um conjunto coeso. Retratam minhas impressões sobre diferentes aspectos do empreendedorismo e da administração, em especial, em pequenas empresas. 
O dinheiro será utilizado para a publicação de 1.000 exemplares do livro, bem como sua distribuição aos apoiadores e às bibliotecas de universidade públicas. 
<strong>O livro não será comercializado</strong>. Distribuição gratuita a pessoas que se interessem pelo empreendedorismo e gestão de pequenas empresas, seja como estudantes ou dirigentes de empresas. <strong>Uso uma linguagem não acadêmica, junto com alguma poesia.</strong>
<strong>Meu desejo não é vender livros, mas difundir ideias e informações que podem ser uteis a muitos</strong>.
<strong>Vejas as opções de contribuição e recompensas ao lado</strong></p>
",gimenez2013,//player.vimeo.com/video/61430296,https://vimeo.com/61430296,Literatura,20,,https://s3-sa-east-1.amazonaws.com/cdn.br.catarse/uploads/project/video_thumbnail/1419/project_thumb_thumb_open-uri20131125-2-khzjjr,https://s3-sa-east-1.amazonaws.com/cdn.br.catarse/uploads/project/video_thumbnail/1419/project_thumb_small_open-uri20131125-2-khzjjr,https://s3-sa-east-1.amazonaws.com/cdn.br.catarse/uploads/project/video_thumbnail/1419/project_thumb_large_open-uri20131125-2-khzjjr,https://s3-sa-east-1.amazonaws.com/cdn.br.catarse/uploads/project/video_thumbnail/1419/project_thumb_video_cover_open-uri20131125-2-khzjjr,107.1739130434782600,7395.0,214,209,successful,aon,finished,"2013-05-11 02:59:59","2013-05-10 23:59:59","2013-03-11 15:32:27","2013-03-11 12:32:27",,t,t,f,60,"{""total"" : 0, ""unit"" : ""seconds""}","{""total"" : 60, ""unit"" : ""days""}",12,"{""city"" : ""Curitiba"", ""state_acronym"" : ""PR"", ""state"" : ""Paraná""}","{""id"" : 123583, ""name"" : ""Fernando Antonio Prado Gimenez""}",0,,f,f,12,f,f,f