project_id,id,user_id,name,headline,budget,goal,about_html,permalink,video_embed_url,video_url,category_name,category_id,original_image,thumb_image,small_image,large_image,video_cover_image,progress,pledged,total_contributions,total_contributors,state,mode,state_order,expires_at,zone_expires_at,online_date,zone_online_date,sent_to_analysis_at,is_published,is_expired,open_for_contributions,online_days,remaining_time,elapsed_time,posts_count,address,user,reminder_count,is_owner_or_admin,user_signed_in,in_reminder,total_posts,can_request_transfer,is_admin_role,contributed_by_friends
1431,1431,128190,"COMO POSSO ENTENDER? | Novo CD do MNA","Colabore com esse projeto missionário e seja um Canal de Bênçãos!","O orçamento para projetos anteriores a 24/02/2015 normalmente pode ser encontrado na descrição acima.",7000.0,"<p><strong>O PROJETO</strong>
Fala galera!
Pra quem ainda não conhece, somos um Ministério Missionário Jovem e estamos iniciando o projeto de nosso segundo disco, que tem como objetivo principal, levar a palavra que Deus tem nos dado, através do dom que Ele também nos deu.
Toda nossa equipe tem vivido esse ministério de forma integral e para que possamos custear os gastos desse novo projeto, precisamos do apoio do máximo de pessoas possíveis!</p>

<p><strong>COMO FUNCIONA?</strong>
Você ajuda com a doação que puder e ao mesmo tempo, compra o disco antecipadamente, e ainda ajuda a lançar ele!
O MNA quer iniciar a gravação do novo disco “COMO POSSO ENTENDER?” de forma independente, como já vem trabalhando há 7 anos, e tem muita gente envolvida nesse projeto: Produtor musical, studio, reprodução de cópias, arte gráfica, foto, e muito mais...
O valor de 7.000,00 que está estipulado nesse projeto é especialmente para custear os gastos com studio. O valor total do projeto é de 20.000,00, para que possamos custear desde a pré produção até o CD chegar em nossas mãos. Mas, decidimos não estipular o valor total aqui no projeto, por que se a meta não for alcançada, não podemos receber o dinheiro arrecadado até o momento, de acordo com as regras do Catarse.</p>

<p>Fizemos uma meta de 7.000,00 para custear a gravação, mas, precisamos chegar aos 20.000,00 para que o projeto possa ser realizado 100%.
<strong>Então, se alcançarmos os 7.000,00 e você ainda não tiver ajudado, não se preocupe, ainda precisamos de muita ajuda... COLABORE!</strong></p>

<p><strong>AJUDE ESSE PROJETO E SEJA UM CANAL DE BÊNÇÃOS!</strong>
Gravar um disco é coisa séria e esse projeto tem o objetivo de levar uma mensagem rica e única para muitas pessoas!
Ajude como puder.
A partir de R$ 25,00 já está valendo seu nome nos créditos do disco como um investidor e o disco virtual.
Daí pra cima, todos ganham o disco físico, e outras recompensas muito legais.
Se você está mal de grana, assim como nós, ajude a divulgar o projeto para seus amigos e conhecidos, é muito importante essa ajuda também!
Outra ideia legal é você juntar alguns amigos, por exemplo, fazer uma vaquinha e juntar um valor que tenha uma recompensa maior.</p>

<p><strong>Ajude a esse projeto, que tem o objetivo de abençoar outras vidas!</strong></p>

<p><strong>CONHEÇA MELHOR O MNA!</strong></p>

<p>Site Oficial: <a class=""alt-link"" href=""http://www.mnaonline.com.br"" target=""_blank"">http://www.mnaonline.com.br</a>
Página Oficial no Facebook: <a class=""alt-link"" href=""http://www.facebook.com/MNAOficial"" target=""_blank"">http://www.facebook.com/MNAOficial</a>
Twitter Oficial: <a class=""alt-link"" href=""http://www.twitter.com/mna_online"" target=""_blank"">http://www.twitter.com/mna_online</a>
Canal Oficial no Youtube: <a class=""alt-link"" href=""http://www.youtube.com/MNALivre"" target=""_blank"">http://www.youtube.com/MNALivre</a></p>
",mna,//player.vimeo.com/video/60615465,https://vimeo.com/60615465,Música,16,,https://s3-sa-east-1.amazonaws.com/cdn.br.catarse/uploads/project/video_thumbnail/1431/project_thumb_thumb_open-uri20131125-2-1rkhxfs,https://s3-sa-east-1.amazonaws.com/cdn.br.catarse/uploads/project/video_thumbnail/1431/project_thumb_small_open-uri20131125-2-1rkhxfs,https://s3-sa-east-1.amazonaws.com/cdn.br.catarse/uploads/project/video_thumbnail/1431/project_thumb_large_open-uri20131125-2-1rkhxfs,https://s3-sa-east-1.amazonaws.com/cdn.br.catarse/uploads/project/video_thumbnail/1431/project_thumb_video_cover_open-uri20131125-2-1rkhxfs,0,0,0,0,failed,aon,finished,"2013-05-08 02:59:59","2013-05-07 23:59:59","2013-03-08 18:39:28","2013-03-08 15:39:28",,t,t,f,60,"{""total"" : 0, ""unit"" : ""seconds""}","{""total"" : 60, ""unit"" : ""days""}",0,"{""city"" : ""Vilhena"", ""state_acronym"" : ""RO"", ""state"" : ""Rondônia""}","{""id"" : 128190, ""name"" : ""David Agostinho de Sá""}",0,,f,f,0,f,f,f