project_id,id,user_id,name,headline,budget,goal,about_html,permalink,video_embed_url,video_url,category_name,category_id,original_image,thumb_image,small_image,large_image,video_cover_image,progress,pledged,total_contributions,total_contributors,state,mode,state_order,expires_at,zone_expires_at,online_date,zone_online_date,sent_to_analysis_at,is_published,is_expired,open_for_contributions,online_days,remaining_time,elapsed_time,posts_count,address,user,reminder_count,is_owner_or_admin,user_signed_in,in_reminder,total_posts,can_request_transfer,is_admin_role,contributed_by_friends
147,147,5474,"Fotografia em Transe - Antonina","O projeto Fotografia em Transe pretende ajudar os moradores de Antonina, prejudicados pelas chuvas de março, através de uma exposição.","O orçamento para projetos anteriores a 24/02/2015 normalmente pode ser encontrado na descrição acima.",1800.0,"<p>Fotografia como instrumento de ação social.</p>

<p>A fotografia pode ser utilizada como um grande instrumento de interferência social, mas para isto, tem que sair das gavetas e computadores, tomando seu devido lugar. O workshop ministrado pelo fotógrafo Orlando Azevedo, em parceria com a Portfolio Escola de Fotografia, resultou em um belíssimo conjunto de imagens. As fotografias retratam a situação atual da população de Antonina após os deslizamentos de terra ocorridos no início de março.</p>

<p>A principio, o curso não visava fotografar as áreas atingidas, porém foi inevitável. “Quis fazer o workshop em Antonina, pela minha ligação com o litoral, por coincidência escolhemos a data de abril e nos deparamos com as áreas afetadas”, disse Orlando Azevedo.</p>

<p>Os dois dias de workshop foram bastante intensos e os integrantes se sensibilizaram com a situação dos moradores. As fotos foram feitas durante o Domingo de Ramos (18 de abril), e a cidade foi retratada como um todo. De acordo com Nilo Biazzato Neto, proprietário da Portfolio, “é impressionante a força no olhar dos retratados, mesmo que não tenham sido atingidos de maneira direta, dá pra notar como tudo afetou a cidade”.</p>

<p>“Ao final do curso fizemos uma avaliação das imagens produzidas, e vimos a força apresentada nas imagens e decidimos ajudar as pessoas desabrigadas por meio de uma exposição”, disse Nilo. Para Melanie d’Haese, que participou do workshop,“todo o curso foi muito emocionante, e todos foram capazes de traduzir tal emoção em imagens, cada um com uma linguagem bastante individual, o que trouxe muita riqueza para o material”.</p>

<p>O grupo de 15 fotógrafos está organizando uma exposição na cidade de Antonina com o intuito de ajudar os moradores da cidade. “A idéia é vender as imagens e destinar 50% da venda para quem foi prejudicado pelo deslizamento, além disso a exposição seria uma maneira de agitar o cenário cultural da região, e trazer mais turistas para a cidade”.</p>

<p>Para realizar a exposição o grupo está à procura de parceiros, já que os custos para a realização do evento são bastante elevados. “O evento precisa acontecer, essas imagens têm que ser expostas, precisam levar essa mensagem de solidariedade a diante”, afirma Nilo.</p>

<p>A exposição está marcada para o dia 25 de junho e juntamente com a amostra o grupo pretende fazer uma projeção de imagens, uma vez que ficaria inviável fazer a exposição de todas as imagens em padrões de galerias internacionais.</p>
",fotografia-em-transe-antonina,//player.vimeo.com/video/23508477,http://vimeo.com/23508477,Fotografia,17,,https://s3-sa-east-1.amazonaws.com/cdn.br.catarse/uploads/project/video_thumbnail/147/project_thumb_thumb_open-uri20131125-2-7c2oab,https://s3-sa-east-1.amazonaws.com/cdn.br.catarse/uploads/project/video_thumbnail/147/project_thumb_small_open-uri20131125-2-7c2oab,https://s3-sa-east-1.amazonaws.com/cdn.br.catarse/uploads/project/video_thumbnail/147/project_thumb_large_open-uri20131125-2-7c2oab,https://s3-sa-east-1.amazonaws.com/cdn.br.catarse/uploads/project/video_thumbnail/147/project_thumb_video_cover_open-uri20131125-2-7c2oab,120.2777777777777800,2165.0,63,60,successful,aon,finished,"2011-06-11 02:59:59","2011-06-10 23:59:59","2011-04-12 02:59:59","2011-04-11 23:59:59",,t,t,f,60,"{""total"" : 0, ""unit"" : ""seconds""}","{""total"" : 60, ""unit"" : ""days""}",0,"{""city"" : ""Curitiba"", ""state_acronym"" : ""PR"", ""state"" : ""Paraná""}","{""id"" : 5474, ""name"" : ""Oliver Markus d'Haese""}",0,,f,f,0,f,f,f