project_id,id,user_id,name,headline,budget,goal,about_html,permalink,video_embed_url,video_url,category_name,category_id,original_image,thumb_image,small_image,large_image,video_cover_image,progress,pledged,total_contributions,total_contributors,state,mode,state_order,expires_at,zone_expires_at,online_date,zone_online_date,sent_to_analysis_at,is_published,is_expired,open_for_contributions,online_days,remaining_time,elapsed_time,posts_count,address,user,reminder_count,is_owner_or_admin,user_signed_in,in_reminder,total_posts,can_request_transfer,is_admin_role,contributed_by_friends
165,165,7329,"Boa Pessoa ","vamos fazê-la em estúdio e aproveitar esses amigos compositores pra darem uma “palhinha” no disco. ;)","O orçamento para projetos anteriores a 24/02/2015 normalmente pode ser encontrado na descrição acima.",4000.0,"<p>Escute essa música no youtube:
<div class=""video youtube""><iframe width=""600"" height=""403"" src=""//www.youtube.com/embed/Ad0lGLckrYQ?wmode=opaque"" frameborder=""0"" allowfullscreen></iframe></div></p>

<p>Se você quiser contribuir para que esta música entre no CD d’A Banda Mais Bonita da Cidade, clique ali no canto direito em &quot;Quero apoiar esse projeto&quot;!</p>

<p>Boa Pessoa (Luiz Felipe Leprevost e Thiago Chaves)</p>

<p>se você dormiu bem
se você comeu bem
se você quer o bem
de uma boa pessoa
nessas manhãs de frio
quando a geada pinta a grama
e o azul do céu
é de uma beleza que caçoa
quando nada, nada
te faria tirar o pijama
não fosse o vento que vai lá fora
é a voz do teu amor que chama agora
e você vem
laraiá, laraiá, laraiá</p>
",boa-pessoa,//player.vimeo.com/video/24396486,http://vimeo.com/24396486,Música,16,,https://s3-sa-east-1.amazonaws.com/cdn.br.catarse/uploads/project/video_thumbnail/165/project_thumb_thumb_open-uri20131125-2-bnwwok,https://s3-sa-east-1.amazonaws.com/cdn.br.catarse/uploads/project/video_thumbnail/165/project_thumb_small_open-uri20131125-2-bnwwok,https://s3-sa-east-1.amazonaws.com/cdn.br.catarse/uploads/project/video_thumbnail/165/project_thumb_large_open-uri20131125-2-bnwwok,https://s3-sa-east-1.amazonaws.com/cdn.br.catarse/uploads/project/video_thumbnail/165/project_thumb_video_cover_open-uri20131125-2-bnwwok,125.5250000000000000,5021.0,116,103,successful,aon,finished,"2011-07-02 02:59:59","2011-07-01 23:59:59","2011-05-03 02:59:59","2011-05-02 23:59:59",,t,t,f,60,"{""total"" : 0, ""unit"" : ""seconds""}","{""total"" : 60, ""unit"" : ""days""}",0,"{""city"" : ""Curitiba"", ""state_acronym"" : ""PR"", ""state"" : ""Paraná""}","{""id"" : 7329, ""name"" : ""Joao Caserta""}",0,,f,f,0,f,f,f