project_id,id,user_id,name,headline,budget,goal,about_html,permalink,video_embed_url,video_url,category_name,category_id,original_image,thumb_image,small_image,large_image,video_cover_image,progress,pledged,total_contributions,total_contributors,state,mode,state_order,expires_at,zone_expires_at,online_date,zone_online_date,sent_to_analysis_at,is_published,is_expired,open_for_contributions,online_days,remaining_time,elapsed_time,posts_count,address,user,reminder_count,is_owner_or_admin,user_signed_in,in_reminder,total_posts,can_request_transfer,is_admin_role,contributed_by_friends
1674,1674,130696,"Quem Somos Nós","Quem somos nós? No espelho colhemos aquilo que somos, bem como tudo aquilo que deixamos de ser.","O orçamento para projetos anteriores a 24/02/2015 normalmente pode ser encontrado na descrição acima.",17000.0,"<p>QUEM SOMOS NÓS é o novo espetáculo da Cia de Dança CCC, de Isnard Manso que a trupe estreará em plena Pç Tiradentes no centro da cidade do Rio de Janeiro.</p>

<p>Esta montagem pretender ser uma síntese de um antigo questionamento do artista por um tema recorrente em sua vida e na vida de todo ser humano: Quem somos? Donde viemos? Para onde vamos? Existem respostas físicas, biológicas, antropológicas, sociológicas e históricas cada vez mais precisas sobre estas questões. Para Isnard essas respostas abrem interrogações ainda muito mais vastas do que apenas conclusões.</p>

<p>QUEM SOMOS NÓS é uma criação que envolve todo o elenco em torno de um objetivo comum proposto pelo coreógrafo: tentar definir a identidade e o papel do grupo no mundo enquanto artistas populares, sediados em plena Pç Tiradentes, usando o samba como suporte, em um no momento de redescobrimento da identidade cultural da cidade, que vem acontecendo através da revitalização do centro histórico do Rio de Janeiro.</p>

<p>Isnard buscou as origens destas perguntas no heliocentrismo de Copérnico no séc XVI. “Desde que soubemos que nos encontrávamos num planetinha que gira à roda de uma bolinha de fogo e que essa bolinha é um pigmeu perdido entre milhares de milhões de estrelas, largada na periferia de uma galaxiazinha dos subúrbios, fomos perdendo toda a certeza fundamental sobre a nossa situação, sobre o nosso destino, sobre nosso sentido”.
Isnard baseia sua pesquisa coreográfica nas possibilidades infinitas do devir e pensa o corpo do bailarino como instrumento de criação orgânica e orientada pela mente: “Somos o que pensamos. A nossa realidade é construída com nossos pensamentos. Quero ver no corpo do bailarino a expressão física do seu pensamento”.</p>

<p>O  texto de Frank Outlaw serviu de inspiração para este trabalho.</p>

<p><em>&quot;Cuide de seus pensamentos; eles se tornam palavras.
Cuide de suas palavras; elas se tornam ações.
Cuide de suas ações, elas se tornam hábitos.
Cuide de seus hábitos; eles se tornam caráter. 
Cuide de seu caráter; ele se torna o seu destino.&quot;</em></p>

<p>O espetáculo QUEM SOMOS NÓS contém inúmeras imagens e sensações sobre o contingente e o grande papel das possibilidades em nossas vidas que acreditamos não sermos responsáveis. “Somos o que pensamos e construímos nossas próprias realidades, queiramos ou não”.</p>

<p>A Cia de Dança CCC começou em 2004 com BOTA ABAIXO, teve seu espetáculo Dancing Eldorado selecionado pelo Programa Oi Futuro patrocínios culturais, em 2007, participou do Panorama 2009,  do festival Correios e Movimento e Dança em Trânsito em 2011 e 2012. Isnard coreografou o show de Beth Carvalho em 2011, assinou a direção coreográfica do DVD de Arlindo Cruz e do Estandarte de Ouro em 2012 entre outras realizações.</p>

<p>QUEM SOMOS NÓS estreia na sala de ensaios de sua sede na Pç Tiradentes, entrada pela Rua Sete de Setembro, 237, no dia 8 de junho de 2013. O espetáculo permanece em temporada até o dia  14 de julho de 2013, com apresentações sábados às 21h30 e domingo às 20h.</p>
",quemsomosnos,//player.vimeo.com/video/62799261,http://vimeo.com/62799261,"Teatro e Dança",19,,https://s3-sa-east-1.amazonaws.com/cdn.br.catarse/uploads/project/video_thumbnail/1674/project_thumb_thumb_open-uri20131125-2-7bqitx,https://s3-sa-east-1.amazonaws.com/cdn.br.catarse/uploads/project/video_thumbnail/1674/project_thumb_small_open-uri20131125-2-7bqitx,https://s3-sa-east-1.amazonaws.com/cdn.br.catarse/uploads/project/video_thumbnail/1674/project_thumb_large_open-uri20131125-2-7bqitx,https://s3-sa-east-1.amazonaws.com/cdn.br.catarse/uploads/project/video_thumbnail/1674/project_thumb_video_cover_open-uri20131125-2-7bqitx,112.85294117647058823500,19185.0,199,197,successful,aon,finished,"2013-05-12 02:59:59","2013-05-11 23:59:59","2013-04-11 16:06:57","2013-04-11 13:06:57",,t,t,f,30,"{""total"" : 0, ""unit"" : ""seconds""}","{""total"" : 30, ""unit"" : ""days""}",1,"{""city"" : ""Rio de Janeiro"", ""state_acronym"" : ""RJ"", ""state"" : ""Rio de Janeiro""}","{""id"" : 130696, ""name"" : ""isnard de oliveira manso""}",0,,f,f,1,f,f,f