project_id,id,user_id,name,headline,budget,goal,about_html,permalink,video_embed_url,video_url,category_name,category_id,original_image,thumb_image,small_image,large_image,video_cover_image,progress,pledged,total_contributions,total_contributors,state,mode,state_order,expires_at,zone_expires_at,online_date,zone_online_date,sent_to_analysis_at,is_published,is_expired,open_for_contributions,online_days,remaining_time,elapsed_time,posts_count,address,user,reminder_count,is_owner_or_admin,user_signed_in,in_reminder,total_posts,can_request_transfer,is_admin_role,contributed_by_friends
1729,1729,140476,"Novo espetáculo da Cia Soma","Ajude a criar o mais novo espetáculo da Companhia Soma!","O orçamento para projetos anteriores a 24/02/2015 normalmente pode ser encontrado na descrição acima.",20000.0,"<p>Completados quatro anos de Companhia Soma vimos que até então nosso objetivo sempre foi transcender os limites de cada gênero de dança tradicional brasileira, como o frevo, a capoeira, o cavalo marinho e etc... para assim criar coreografias que revelassem as possíveis formas de releitura e suas infinitas possibilidades corporais.</p>

<p>Hoje, nosso maior desejo é criar um novo espetáculo que propõe um novo desafio: contar uma história. </p>

<p>Como esse corpo incapaz de se despir do ritmo, agilidade, suavidade e brincadeira das danças populares brasileiras consegue adentrar o universo imaginário e dividir com o público uma narrativa.</p>

<p>O resultado será “A Última Estrada”, o primeiro passo para uma nova história da Cia. </p>

<p>Mas para que isso se realize precisamos de parceiros para:
fazer a direção do espetáculo, criar a trilhar sonora, iluminar o nosso palco e desenhar os nossos figurinos. Uma mão de obra especialíssima e cuidadosa. Além dos materiais necessários para tornar tudo isso uma realidade! Essas pessoas já existem e já toparam fazer parte dessa empreitada!
Então é aqui que entra a verba do Catarse! Mão de obra e material!</p>

<p>Para saber mais sobre nossa pesquisa e espetáculos consulte:
<a class=""alt-link"" href=""http://www.ciasoma.com.br/"" target=""_blank"">http://www.ciasoma.com.br/</a></p>
",ciasoma,//player.vimeo.com/video/63273348,http://vimeo.com/63273348,Artes,1,,https://s3-sa-east-1.amazonaws.com/cdn.br.catarse/uploads/project/video_thumbnail/1729/project_thumb_thumb_open-uri20131125-2-2ktdei,https://s3-sa-east-1.amazonaws.com/cdn.br.catarse/uploads/project/video_thumbnail/1729/project_thumb_small_open-uri20131125-2-2ktdei,https://s3-sa-east-1.amazonaws.com/cdn.br.catarse/uploads/project/video_thumbnail/1729/project_thumb_large_open-uri20131125-2-2ktdei,https://s3-sa-east-1.amazonaws.com/cdn.br.catarse/uploads/project/video_thumbnail/1729/project_thumb_video_cover_open-uri20131125-2-2ktdei,101.05000000000000000000,20210.0,166,153,successful,aon,finished,"2013-05-26 02:59:59","2013-05-25 23:59:59","2013-04-15 18:34:33","2013-04-15 15:34:33",,t,t,f,40,"{""total"" : 0, ""unit"" : ""seconds""}","{""total"" : 40, ""unit"" : ""days""}",2,"{""city"" : ""São Paulo"", ""state_acronym"" : ""SP"", ""state"" : ""São Paulo""}","{""id"" : 140476, ""name"" : ""Vera Abib""}",0,,f,f,2,f,f,f