project_id,id,user_id,name,headline,budget,goal,about_html,permalink,video_embed_url,video_url,category_name,category_id,original_image,thumb_image,small_image,large_image,video_cover_image,progress,pledged,total_contributions,total_contributors,state,mode,state_order,expires_at,zone_expires_at,online_date,zone_online_date,sent_to_analysis_at,is_published,is_expired,open_for_contributions,online_days,remaining_time,elapsed_time,posts_count,address,user,reminder_count,is_owner_or_admin,user_signed_in,in_reminder,total_posts,can_request_transfer,is_admin_role,contributed_by_friends
17638,17638,86046,"Olhos Serrados","Eu sei que estou a minha frente. Abro os olhoS e me vejo mundo-gente. / Performance de Luaa Gabanini","<p><strong></strong><strong>Material e produção de Cenário_ </strong>R$1.500,00 <br><strong>Material e produção de Figurino_ </strong>R$1.000,00 <br><strong>Ajuda de Custo para a </strong><strong>Equipe_</strong> R$1.200,00 <br><strong>Material gráfico e programas_</strong> R$800,00 <br><strong>Montagem e operação de Luz e Som_</strong> R$500,00 <br><strong>Porcentagem 13% Catarse_</strong> R$747,00</p><p><strong>Total_</strong> R$5.747,00</p>",5747.0,"<p><img src=""https://s3.amazonaws.com/cdn.catarse/uploads/redactor_rails/picture/data/20593/olhos_serrados_m_os_no_rosto.jpg"" alt="""" style=""display: block; margin: auto;""></p><p><strong>O</strong><span class=""redactor-invisible-space"">lhos <strong>S</strong><span class=""redactor-invisible-space"">errados é uma performance com concepção-geral de Luaa Gabanini, com estreia prevista para outubro no Teatro de Arena Eugênio Kusnet.</span></span></p><p style=""text-align: right;"" rel=""text-align: right;""><img src=""https://s3.amazonaws.com/cdn.catarse/uploads/redactor_rails/picture/data/19250/serra_Serra.png"" alt="""" width=""776"" height=""119"" style=""display: block; margin: auto; width: 776px; height: 119px;""><br></p><p style=""text-align: right;"">“<strong>S</strong>erro* os meus olhos e adentro na <strong>S</strong>erra dos meus pensamentos.</p>  <p style=""text-align: right;"">Começo então a enxergar.  </p>  <p style=""text-align: right;"">E <strong>S</strong>erro pela raiz as doenças da alma. </p>  <p style=""text-align: right;"">E no útero do meu cérebro onde tudo se inicia, pego no colo o broto. </p>  <p style=""text-align: right;"">Começo a <strong>S</strong>onhar antes do despertar com o futuro próximo. </p>  <p style=""text-align: right;"">Começo a tatear com meus passos tímidos seu caminho. </p>  <p style=""text-align: right;"">A aurora do dia vai me contando histórias até o amanhecer para di<strong>S</strong>farçar o escuro. </p>  <p style=""text-align: right;"">Com meus olhos ainda <strong>S</strong>errados chego num abismo. </p>  <p style=""text-align: right;"">Eu <strong>S</strong>ei que estou a minha frente. </p>  <p style=""text-align: right;"">Abro os olho<strong>S</strong> e me vejo mundo-gente. </p>  <p style=""text-align: right;"">Re<strong>S</strong>piro para enxergar ainda mais distante.</p><p style=""text-align: right;"">Podemo<strong>S</strong> começar.”</p><p style=""text-align: right;""><em>poema-inspiração de <strong>O</strong>lhos <strong>S</strong><span class=""redactor-invisible-space"">errados.</span></em></p><p style=""text-align: right;"" rel=""text-align: right;""><em><span class=""redactor-invisible-space"">* Utilizarei muitas vezes o ""<strong>S"" </strong><span class=""redactor-invisible-space""> ao invés do ""C""; primeiro, por uma questão poética de sempre referenciar a ideia de ""serra"". E ainda, como dizia Fernando Pessoa, ao escrever Dança com <strong>""S</strong><span class=""redactor-invisible-space"">"", a letra ""S"" dança mais.</span></span></span></em></p><p><img src=""https://s3.amazonaws.com/cdn.catarse/uploads/redactor_rails/picture/data/19243/serra_Serra.png"" alt="""" width=""770"" height=""119"" style=""display: block; margin: auto; width: 770px; height: 119px;""></p><p style=""text-align: justify;"">A dança sempre me conduziu a narrativas profundas. Comecei a pesquisar a performatividade, utilizando o espaço como campo de improvisação na criação de cena teatral. Como atriz de teatro a 20 anos, em tudo que fiz sempre foquei na experiência do corpo. Em 2008 me deparei, dentro de uma pesquisa da companhia teatral que faço parte, o <a href=""https://www.facebook.com/nucleobartolomeu"" target=""_blank"">Núcleo Bartolomeu de Depoimentos</a>, com a criação de um personagem histórico: Marietta Baderna, bailarina italiana que viveu no Rio de Janeiro no período do Brasil Império, e por conta de seu estilo transgressor e libertário para época, seu sobrenome virou sinônimo de bagunça, confusão e desordem pública.</p><p><br></p><iframe style=""width: 500px; height: 281px;"" src=""//www.youtube.com/embed/1O4PslxGE7w"" frameborder=""0"" allowfullscreen=""""></iframe><p><br></p><p style=""text-align: justify;"">Na época fiz a personagem de forma dramática, contemplando o processo teatral em que estávamos, mas fiquei com o gosto de desenvolver esta figura num outro espaço de encenação. Dentro desta companhia, além de ser atriz e uma das diretoras fundadoras, eu sempre exerci a função de preparadora corporal e coreógrafa dos espetáculos. Mas três anos atrás, inspirada pela Baderna, comecei a focar na ideia de performatividade no espaço, buscando a criação de meu primeiro solo, onde o corpo seria o grande personagem. Foram 3 anos de uma jornada muito bem acompanhada de artistas que foram dialogando comigo neste percurso: Luis Arrieta (meu grande e eterno provocador), Giselle Bellot (me colocou em cima de uma sapatilha de ponta), Cristiano Meirelles (me sacudiu no lundu) e Flip Couto (me lembrou das origens da dança de rua), Além das aulas de pilates e yoga diárias. E foi assim que em 2014 estreei “<a href=""https://www.facebook.com/BadernaBaderna"" target=""_blank"">BadeRna</a>”: uma performance teatral baseada no uso do corpo como instrumento de comunicação áudio e visual; tornada possível, também, com a ajuda do <a href=""http://www.catarse.me/pt/Baderna"" target=""_blank"">Catarse</a>.</p><p><img src=""https://s3.amazonaws.com/cdn.catarse/uploads/redactor_rails/picture/data/19246/serra_BadeRna_dan_a_.png"" alt="""" style=""display: block; margin: auto;""></p><em></em><p style=""margin-left: 180px;""><em>foto - Azul Serra</em></p><p style=""text-align: justify;"">
A “BadeRna” literalmente
movimentou minha cabeça. Bagunçou a ideia que eu tinha até então de cena. E
agora o corpo – que já era um ponto de criação – virou o foco de minha pesquisa
nestes últimos anos, e me lançou a este momento onde busco tatear o espaço e
dançar as imagens. E assim estou em minhas meditações diárias: de olhos <strong>S</strong>errados. 

<br></p><p><img src=""https://s3.amazonaws.com/cdn.catarse/uploads/redactor_rails/picture/data/19251/serra_Serra.png"" alt="""" width=""851"" height=""119"" style=""display: block; margin: auto; width: 851px; height: 119px;""></p><p class=""fontsize-larger fontweight-semibold"" style=""text-align: center;""><strong>O</strong>lhos <strong>S</strong>errados</p><p style=""text-align: right;"">“<strong>S</strong>empre que medito tenho dúvida se fico de olhos abertos ou fechados. </p><p style=""text-align: right;"">Já meditei em muitos lugare<strong>S</strong>: Amazônia, pantanal, Peru, Atacama, França, Portugal, Uruguai...</p><p style=""text-align: right;""><strong>S</strong>ão lugares tão diferentes. </p><p style=""text-align: right;"">      Vale olhar ou o entorno não faz diferença quando quero adentrar em mim?”<br></p><p style=""text-align: right;""><em>poema-inspiração de <strong>O</strong>lhos <strong>S</strong>errados</em></p><p><img src=""https://s3.amazonaws.com/cdn.catarse/uploads/redactor_rails/picture/data/20594/olhos_serrados_perfil_.jpg"" alt="""" style=""display: block; margin: auto;""></p><p style=""text-align: justify;"">Toda a performance acontecerá com a atriz dançarina de olhos fechados. Formar a imagem, para depois ocupar o espaço. Adentrar no espaço escuro da alma, deixar o corpo enxergar novos movimentos. O espetáculo “<strong>O</strong>lhos <strong>S</strong>errados” foi escrito na volta de uma viagem ao deserto do Atacama. No dia 1 de janeiro de 2015, saí da cidade de São Pedro do Atacama e sentei embaixo de uma árvore para meditar. Sempre que medito fecho os meu olhos. Mas a imagem à minha frente era tão profunda quanto fechar os olhos. Fiquei muito tempo neste impasse. Quando, finalmente, decidi fechar os olhos. Era como se meus olhos continuassem abertos e uma <strong>S</strong>erra estivesse na minha frente. A imagem se mantinha de olhos abertos ou fechados. Foi uma das maiores experiências da minha vida, onde a imagem tomou conta de minha ação. Peguei a bicicleta e voltei para o hotel. E assim, escrevi no que tinha a mão, meu celular, este projeto-sonho-em-ação: fechar meus olhos na frente do público durante 1h e dançar-narrando as imagens que vem a minha frente. Aproveitarei ainda para adentrar no movimento de um personagem mítico que de olhos fechados tudo podia ver: Tirésias, um famoso profeta cego de Tebas que desempenhou importante papel na maior parte das lendas do ciclo tebano. Ele era o maior, o mais considerado e um dos mais notáveis adivinhos da mitologia grega.</p><p><img src=""https://s3.amazonaws.com/cdn.catarse/uploads/redactor_rails/picture/data/19296/serra_Luaa_Serrada_2.png"" alt="""" style=""line-height: 1.6em; display: block; margin: auto;""></p><p><strong>FICHA TÉCNICA</strong><br></p><p><strong>Concepção Geral e Direção_</strong> Luaa Gabanini <br><strong>Atriz-dançarina_</strong> Luaa Gabanini <br><strong>Dançarino Guardião_ </strong>Alan Gonçalves<span class=""redactor-invisible-space""> <br><strong>Direção de Arte_</strong> Bianca Turner <br><strong>Poemas de Ação Dramática_</strong> Luaa Gabanini<br><strong>Direção Musical_</strong> Eugênio Lima <br><strong>Treinamento de Spoken Word_</strong> Roberta Estrela D'Alva <br><strong>Assistentes de Direção_</strong> Amilton de Azevedo e Juliana Tedeschi <br><strong>Figurino_</strong> Claudia Schapira <br><strong>Desenho de Luz_</strong> Cibele Forjaz <br></span><strong>Maquiagem_</strong> Maria Fernanda Torrezani <br><strong>Comunicação_ </strong>Maite Freitas <br><strong>Técnico de Som_ </strong><span class=""redactor-invisible-space"" style=""line-height: 1.6em;"">Dr. Aeiuton <br><strong>Programação Visual_ </strong>Samuel Luis Borges<span class=""redactor-invisible-space""> <br><span class=""redactor-invisible-space""><strong>Consultoria de Dança de Rua_ </strong><span class=""redactor-invisible-space"">Flip Couto<span class=""redactor-invisible-space""> <br><strong>Administração Geral e Financeira_ </strong><span class=""redactor-invisible-space"">Mariza Dantas <br><strong>Produção_ </strong><span class=""redactor-invisible-space"">Núcleo Bartolomeu de Depoimentos</span></span></span></span></span></span></span></p>",OlhosSerrados,//player.vimeo.com/video/138479120,https://vimeo.com/138479120,"Teatro e Dança",19,https://s3-sa-east-1.amazonaws.com/cdn.br.catarse/uploads/project/uploaded_image/17638/olhos_serrados_m_os_no_rosto.jpg,https://s3-sa-east-1.amazonaws.com/cdn.br.catarse/uploads/project/uploaded_image/17638/project_thumb_thumb_olhos_serrados_m_os_no_rosto.jpg,https://s3-sa-east-1.amazonaws.com/cdn.br.catarse/uploads/project/uploaded_image/17638/project_thumb_small_olhos_serrados_m_os_no_rosto.jpg,https://s3-sa-east-1.amazonaws.com/cdn.br.catarse/uploads/project/uploaded_image/17638/project_thumb_large_olhos_serrados_m_os_no_rosto.jpg,https://s3-sa-east-1.amazonaws.com/cdn.br.catarse/uploads/project/uploaded_image/17638/project_thumb_video_cover_olhos_serrados_m_os_no_rosto.jpg,14.35531581694797285500,825.0,11,11,failed,aon,finished,"2015-10-01 02:59:59","2015-09-30 23:59:59","2015-09-09 16:35:40.127216","2015-09-09 13:35:40.127216",,t,t,f,21,"{""total"" : 0, ""unit"" : ""seconds""}","{""total"" : 21, ""unit"" : ""days""}",0,"{""city"" : ""São Paulo"", ""state_acronym"" : ""SP"", ""state"" : ""São Paulo""}","{""id"" : 86046, ""name"" : ""Luaa Gabanini""}",1,,f,f,0,f,f,f