project_id,id,user_id,name,headline,budget,goal,about_html,permalink,video_embed_url,video_url,category_name,category_id,original_image,thumb_image,small_image,large_image,video_cover_image,progress,pledged,total_contributions,total_contributors,state,mode,state_order,expires_at,zone_expires_at,online_date,zone_online_date,sent_to_analysis_at,is_published,is_expired,open_for_contributions,online_days,remaining_time,elapsed_time,posts_count,address,user,reminder_count,is_owner_or_admin,user_signed_in,in_reminder,total_posts,can_request_transfer,is_admin_role,contributed_by_friends
178,178,7245,"Por Aí, uma exposição fotográfica","Por Aí: Um jovem cheio de idéias na cabeça, mostrando o mundo desde um ponto de vista único.","O orçamento para projetos anteriores a 24/02/2015 normalmente pode ser encontrado na descrição acima.",3000.0,"<p>Eu, um jovem artista cheio de idéias na cabeça, rodando por aí e registrando este enorme mundo em que vivemos a partir de um ponto de vista bastante único. Isso tudo, misturado com toques surreais, artísticos e simbólicos, apresentado de uma forma surpreendente: <em>Por Aí, uma Exposição Fotográfica de Jaime Scatena.</em></p>

<p>Esta será minha primeira exposição fotográfica em Atibaia, cidade onde morei há 15 anos e pra onde voltei desde dezembro de 2010. </p>

<p>Vou apresentar nesta exposição um pouco daquilo que venho produzindo nos últimos anos, usando como fio condutor uma música do Gonzaguinha, lançada quando eu tinha apenas um ano de idade:</p>

<p><em>Por Aí</em></p>

<p>Muito que andar por aí
Muito que viver por aí
Muito que aprender por aí
Muito que aprontar por aí</p>

<p>E vocês? Querem ver o que eu venho fazendo por aí?</p>

<p>A exposição será aberta no dia 24/Junho, em Atibaia/SP e ficará no Espaço Revelar (Al. Lucas Nogueira Garcez, 3062) até 07/Agosto. Estou avaliando de levar a exposição para outras cidades, mas isso será objeto de outro projeto, ok?</p>

<p>Para produzi-la, estou levantando fundos através do Catarse.me, contando com a ajuda de meus amigos, dos amigos dos meus amigos e também de qualquer pessoa que queira colaborar para o sucesso desta mostra.</p>

<p>Os R$ 3.000 serão usados basicamente para impressão/ampliação das fotos, molduras, vinil adesivo, divulgação e para o coquetel da noite de abertura, além de uma verba para cobrir as despesas administrativas – 12% entre Catarse.me e Operadora financeira – , custos extras e a pintura das paredes da galeria ao final da exposição.</p>

<p>As recompensas são magníficas: <em>Arte</em>. Sim, para cada colaboração, além do meu sorriso e agradecimento eterno, você receberá uma peça de arte, produzida por mim e todas em séries limitadas. Ou seja, é um investimento, pois quando eu for bem famoso (tenho certeza que serei!), esta sua recompensa valerá uma boa grana. Bom né? O legítimo ganha-ganha. Mas aproveitem para ajudar por aqui, pois na exposição e através do meu site, o valores das peças são bem mais altos!</p>

<p>É por isso que as doações não precisam se limitar ao valor total do projeto, já que, enquanto estiverem disponíveis, as peças poderão ser adquiridas. Parte do valor cobre o custo da própria peça (um pôster, uma foto, um cartão postal) e parte cobre a produção da exposição.</p>

<p><em>Por Aí, uma exposição fotográfica de Jaime K. Scatena</em></p>

<p>O prazo para arrecadação vai até o final de semana anterior ao fechamento da exposição –31/07/2011. Conto com a ajuda de vocês e de seus amigos, ok?</p>

<p>PS.:  todos são bem vindos à exposição, de 24/06 a 07/09. O Espaço Revelar é uma galeria fotográfica anexa a uma das melhores doçarias de Atibaia, então venha se deliciar e apreciar minha arte!</p>

<p><em>Jaime K. Scatena</em> é um fotógrafo e jornalista premiado especializado em fotografia de viagens, arquitetura e street photography. Seu trabalho foi publicado em revistas e jornais no Brasil, bem como em séries limitadas de cartões postais e posters. Jaime passou o último ano na Europa estudando e construindo seu portfólio. Ao estudar arte, ele tem se escoberto um artista visual, muito além de fotógrafo, que busca surpreender o observador com imagens interessantes, divertidas e inquietantes.</p>

<p><a class=""alt-link"" target=""_blank"" href=""http://photo.jkscatena.com.br"">Foto site</a>  |  <a class=""alt-link"" target=""_blank"" href=""http://www.jkscatena.com.br"">Website</a>  |  <a class=""alt-link"" target=""_blank"" href=""http://www.flickr.com/jkscatena"">Flicrk</a>  |  <a class=""alt-link"" target=""_blank"" href=""http://www.twitter.com/jkscatena"">Twitter</a></p>
",178-por-ai-uma-exposicao-fotografica,//player.vimeo.com/video/24887455,http://www.vimeo.com/24887455,Fotografia,17,,https://s3-sa-east-1.amazonaws.com/cdn.br.catarse/uploads/project/video_thumbnail/178/project_thumb_thumb_open-uri20131125-2-ur2mb4,https://s3-sa-east-1.amazonaws.com/cdn.br.catarse/uploads/project/video_thumbnail/178/project_thumb_small_open-uri20131125-2-ur2mb4,https://s3-sa-east-1.amazonaws.com/cdn.br.catarse/uploads/project/video_thumbnail/178/project_thumb_large_open-uri20131125-2-ur2mb4,https://s3-sa-east-1.amazonaws.com/cdn.br.catarse/uploads/project/video_thumbnail/178/project_thumb_video_cover_open-uri20131125-2-ur2mb4,30.33333333333333333300,910.0,8,7,failed,aon,finished,"2011-08-01 02:59:59","2011-07-31 23:59:59","2011-06-02 02:59:59","2011-06-01 23:59:59",,t,t,f,60,"{""total"" : 0, ""unit"" : ""seconds""}","{""total"" : 60, ""unit"" : ""days""}",3,"{""city"" : ""Atibaia"", ""state_acronym"" : ""SP"", ""state"" : ""São Paulo""}","{""id"" : 7245, ""name"" : ""Jaime Scatena""}",0,,f,f,3,f,f,f