project_id,id,user_id,name,headline,budget,goal,about_html,permalink,video_embed_url,video_url,category_name,category_id,original_image,thumb_image,small_image,large_image,video_cover_image,progress,pledged,total_contributions,total_contributors,state,mode,state_order,expires_at,zone_expires_at,online_date,zone_online_date,sent_to_analysis_at,is_published,is_expired,open_for_contributions,online_days,remaining_time,elapsed_time,posts_count,address,user,reminder_count,is_owner_or_admin,user_signed_in,in_reminder,total_posts,can_request_transfer,is_admin_role,contributed_by_friends
17971,17971,114716,"Catálogo Retrospectiva Varan no Brasil","Apoie este projeto!","<p>Orçamento / Budget:</p>    <table>  <tbody><tr>   <td>   <p>Projeto
gráfico, diagramação e finalização<o:p></o:p></p><p>Projet graphique,
maquette et finitions<o:p></o:p></p>   </td>   <td>   <p>R$   3.600,00</p>   </td>  </tr>  <tr>   <td>   <p>Impressão</p><p>Impression<br></p>   </td>   <td>   <p>R$   4.977,00</p>   </td>  </tr>  <tr>   <td>   <p>Tradução</p><p>Traduction<br></p>   </td>   <td>   <p>R$   2.000,00</p>   </td>  </tr>  <tr>   <td>   <p>Custos   administrativos e correios</p><p>Frais
administratifs et envoi par la poste<br></p>   </td>   <td>   <p>R$   1.500,00</p>   </td>  </tr>  <tr>   <td>   <p><strong>Sub-Total</strong></p><p><strong>Sous-Total<br></strong></p>   </td>   <td>   <p><strong>R$ 12.077,00</strong></p>   </td>  </tr>  <tr>   <td>   <p>13% Catarse</p>   </td>   <td>   <p>R$ 1.805,00</p>   </td>  </tr>  <tr>   <td>   <p><strong>Total</strong></p>   </td>   <td>   <p><strong>R$ 13.882,00</strong></p>   </td>  </tr></tbody></table>",13882.0,"<p>(Lire la version de ce texte en français ci-dessous, après la version en portugais) <br><strong></strong></p><p><strong>Ajude a Retrospectiva Varan a se espalhar pelo Brasil!!!<br>Apoie a realização de um catálogo com textos inéditos sobre os Ateliers Varan!!!</strong></p><p style=""text-align: justify;"">Os Ateliers Varan, criados em 1981 em Paris, desenvolvem, há mais de 30 anos, ateliers de documentários em diversos países do mundo, tais como a África do Sul, o Vietnã, o Egito, a Colômbia, entre vários outros. Nesses ateliers se formaram inúmeros documentaristas que filmaram de perto a cultura, os conflitos, as transformações por que passavam seus países, seguindo a tônica de um cinema de campo fundado na longa duração e na verdadeira relação com as pessoas filmadas. Mais de mil documentários, testemunhos preciosos da vida cotidiana e de momentos históricos fundamentais, foram realizados nos ateliers, por exemplo, da Bolívia pós-ditadura, da África do Sul do fim do Apartheid, do Afeganistão pós-guerra, do Vietnã da última década em plena mutação social, dentre muitos outros.</p><p style=""text-align: justify;"">A associação <a href=""http://www.balafon.org.br/"" target=""_blank"">BALAFON</a>
 vem promovendo, há sete anos, a difusão e o debate de grandes obras do 
documentário mundial, com projetos que circularam por diversas cidades 
brasileiras. Assim fizemos em 2009-2010, com um projeto sobre o 
documentarista francês <a href=""http://www.balafon.org.br/mostrajeanrouch/index.html"" target=""_blank"">Jean Rouch</a> e, em 2012, com o projeto sobre o documentarista quebequense <a href=""http://www.balafon.org.br/mostrapierreperrault/index.html"" target=""_blank"">Pierre Perrault</a>.</p><p style=""text-align: justify;""><span class=""redactor-invisible-space"">Dessa vez, em março e abril de 2016, a associação <a href=""http://www.balafon.org.br/index.html"" target=""_blank"">Balafon</a> vai rodar o Brasil com uma retrospectiva de filmes documentários produzidos nos <a href=""http://www.ateliersvaran.com/"" target=""_blank"">Ateliers Varan</a>,
 ao lado de filmes de integrantes da associação: documentaristas 
professores desses Ateliers. Acompanhando a retrospectiva, faremos um 
colóquio internacional e ciclos de debates, para discutirmos os filmes, 
os ateliers, sua metodologia, etc – como fizemos antes, sobre <a href=""http://www.balafon.org.br/mostrajeanrouch/index.html"" target=""_blank"">Jean Rouch</a> e <a href=""http://www.balafon.org.br/mostrajeanrouch/index.html"" target=""_blank"">Pierre Perrault</a>.</span></p><p style=""text-align: justify;"">Acompanhe a programação, que será disponibilizada com mais detalhe nos próximos meses, em nosso site: <a href=""http://www.balafon.org.br/varan"" target=""_blank"">www.balafon.org.br/varan</a>.</p><p style=""text-align: justify;""><span class=""redactor-invisible-space"">Esse projeto é pioneiro. É a primeira 
vez que filmes Varan são mostrados sob uma perspectiva de conjunto, 
recobrindo diversos períodos de sua história e variadas experiências. É 
também a primeira vez que Varan será tema de um colóquio internacional. 
Enfim, este projeto será um marco para os estudos sobre Varan, no Brasil
 e no mundo.</span></p><p>Para acompanhar a mostra e o colóquio, 
temos a intenção de produzir um catálogo bilíngue (português-francês), 
com filmografia, fotos, textos sobre os filmes e os ateliers.<br></p><p><strong>Este projeto de financiamento coletivo visa coletar recursos para produzir esse catálogo.</strong></p><p>Data prevista para edição dos catálogos: março de 2016.</p><p style=""text-align: justify;"" rel=""text-align: justify;""><span class=""redactor-invisible-space"">_________________________________________________________________<span class=""redactor-invisible-space""></span></span></p><p style=""text-align: justify;"" rel=""text-align: justify;"">Catalogue de la Rétrospective Varan au Brésil<br></p><p style=""text-align: justify;"">Les Ateliers Varan, crées en 1981 à Paris, développent depuis plus de 30 ans, des ateliers de films documentaires dans divers pays du monde, comme l'Afrique du Sud, le Vietnam, l'Egypte ou la Colombie, entre autres. Dans ces ateliers ont été formés de nombreux documentaristes qui ont filmé de près la culture, les conflits, les transformations par lesquelles ces pays sont passés, selon les principes d'un cinéma de terrain fondé sur la longue durée et une vraie relation avec les personnes filmées. Plus de 1000 documentaires, témoins précieux de la vie quotidienne et de moments historiques fondamentaux ont été réalisés dans ces ateliers, par exemple dans la Bolivie de l'après dictature, en Afrique du Sud à la fin de l'aparthied, en Afghanistan après la guerre, au Vietnam de la dernière décennie en pleine mutation sociale, parmi beaucoup d'autres pays.<br></p><p style=""text-align: justify;""><u></u></p><p style=""text-align: justify;"">L’Association <a href=""http://www.balafon.org.br/index.html"" target=""_blank"">BALAFON</a> organise, depuis sept ans, la diffusion et le débat autour des grands oeuvres documentaires du cinéma mondial, avec des projets qui ont été présentés dans plusieurs villes brésiliennes. Ainsi, en 2009-2010, nous avons présenté une rétrospective et un colloque autour du documentariste français <a href=""http://www.balafon.org.br/mostrajeanrouch/index.html"" target=""_blank"">Jean Rouch</a> et en 2012, une rétrospective et un colloque autour du documentariste québécois <a href=""http://www.balafon.org.br/mostrapierreperrault/index.html"" target=""_blank"">Pierre Perrault</a>.<br></p><p style=""text-align: justify;"">Cette fois, en mars et avril 2016, l'association <a href=""http://www.balafon.org.br/index.html"" target=""_blank"">BALAFON</a> va faire circuler au Brésil une rétrospective de films documentaires produits dans les <a href=""http://www.ateliersvaran.com/"" target=""_blank"">Ateliers Varan</a>, à côté des films de membres de l'association, des films de documentaristes professeurs de ces ateliers. Pour accompagner cette rétrospective, nous organisons un colloque international et des cycles de débats pour discuter des films, des ateliers, de leur méthodologie, etc. - comme nous l'avons fait précédemment pour les rétrospectives et colloques <a href=""http://www.balafon.org.br/mostrajeanrouch/index.html"" target=""_blank"">Jean Rouch</a> et <a href=""http://www.balafon.org.br/mostrapierreperrault/index.html"" target=""_blank"">Pierre Perrault</a>.<br></p><p style=""text-align: justify;"">Vous pourrez suivre la programmation qui sera disponible en détails dans les prochains mois sur notre site <a href=""http://www.balafon.org.br/varan"" target=""_blank"">www.balafon.org.br/varan</a><br></p><p style=""text-align: justify;"">Ce projet est pionnier. C'est la première fois que les films des Ateliers Varan sont montrés selon une perspective d'ensemble, recouvrant diverses périodes de son histoire et des expériences variées. C'est aussi la première fois que les Ateliers Varan seront le thème d'un colloque international. Enfin, ce projet sera une étape décisive pour les études sur les ateliers Varan, au Brésil et dans le monde.<br></p><p style=""text-align: justify;"">Pour accompagner cette rétrospective et ce colloque, nous avons l'intention de publier un catalogue bilingue (portugais-français), avec filmographie, photos, textes sur les films et les Ateliers. </p><p style=""text-align: justify;""><strong>Ce projet de financement collectif a pour but de recueillir des fonds permettant <a href=""https://www.youtube.com/watch?v=kNuGPdjr7pU&feature=youtu.be"">d'éditer ce catalogue</a>.</strong><strong></strong><br></p><p style=""text-align: justify;"">Date prévue pour l’édition des catalogues : mars 2016.<br></p><p style=""text-align: justify;""><br></p>",catalogovaran,//www.youtube.com/embed/BeUJLs6sFec,https://www.youtube.com/watch?v=BeUJLs6sFec,"Cinema e Vídeo",13,https://s3-sa-east-1.amazonaws.com/cdn.br.catarse/uploads/project/uploaded_image/17971/Foto6-A_quem_pertence_a_terra.jpg,https://s3-sa-east-1.amazonaws.com/cdn.br.catarse/uploads/project/uploaded_image/17971/project_thumb_thumb_Foto6-A_quem_pertence_a_terra.jpg,https://s3-sa-east-1.amazonaws.com/cdn.br.catarse/uploads/project/uploaded_image/17971/project_thumb_small_Foto6-A_quem_pertence_a_terra.jpg,https://s3-sa-east-1.amazonaws.com/cdn.br.catarse/uploads/project/uploaded_image/17971/project_thumb_large_Foto6-A_quem_pertence_a_terra.jpg,https://s3-sa-east-1.amazonaws.com/cdn.br.catarse/uploads/project/uploaded_image/17971/project_thumb_video_cover_Foto6-A_quem_pertence_a_terra.jpg,100.99409307016280074900,14020.0,93,84,successful,aon,finished,"2015-12-25 01:59:59.999999","2015-12-24 23:59:59.999999","2015-11-19 18:23:33.404698","2015-11-19 16:23:33.404698",,t,t,f,35,"{""total"" : 0, ""unit"" : ""seconds""}","{""total"" : 35, ""unit"" : ""days""}",0,"{""city"" : ""Belo Horizonte"", ""state_acronym"" : ""MG"", ""state"" : ""Minas Gerais""}","{""id"" : 114716, ""name"" : ""Balafon""}",3,,f,f,0,f,f,f