project_id,id,user_id,name,headline,budget,goal,about_html,permalink,video_embed_url,video_url,category_name,category_id,original_image,thumb_image,small_image,large_image,video_cover_image,progress,pledged,total_contributions,total_contributors,state,mode,state_order,expires_at,zone_expires_at,online_date,zone_online_date,sent_to_analysis_at,is_published,is_expired,open_for_contributions,online_days,remaining_time,elapsed_time,posts_count,address,user,reminder_count,is_owner_or_admin,user_signed_in,in_reminder,total_posts,can_request_transfer,is_admin_role,contributed_by_friends
1850,1850,118442,"Financiamento do 1º CD do Azul Casu ","Todo o processo de gravação no estúdio do CD já foi realizado, para que as etapas restantes sejam concluídas, VOCÊ PODE SER UM INVESTIDOR!!","O orçamento para projetos anteriores a 24/02/2015 normalmente pode ser encontrado na descrição acima.",3200.0,"<p><strong>Introdução</strong></p>

<p>Depois de anos de planejamentos, buscas, sonhos, festivais, e um ótimo retorno do público, chegou a hora do lançamento do 1º CD do Azul Casu
O álbum que terá o titulo de “Azul Casu - Sem forma, de todas as formas”  já está totalmente gravado, e como o próprio nome diz, veremos Azul Casu de todas as formas. É samba rock, é blues, é ska. É soul que vira samba, é rock que vira forró. O artista que é totalmente independente deixou sua arte livre e fez o que sempre quis: MÚSICA. Independente de rótulos ou estilos musicais misturou sua poesia a diferentes ritmos e melodias. </p>

<p><strong>E o que ta faltando para o CD ganhar as ruas?</strong> </p>

<p>Todo processo que se iniciou em 2010, parou em 2011 por falta de recursos e só no inicio de 2013 foi retomado, envolveu muitos investimentos. Horas e horas de estúdio, músicos contratados.  E todo esse processo foi bancado com investimentos próprios do Azul Casu.
Agora o álbum encontram-se em um momento  “pós estúdio”, restando a parte de arte gráfica do CD e a prensagem da primeira leva das cópias, para que o álbum chegue até você. E para que essas duas etapas restantes se realizem que Azul Casu optou pelo Crowdfunding(sistema de financiamento coletivo), e pelo Catarse.(o maior site especializado em Crowdfunding no Brasil)<br>
A arte do CD ficará a cargo do artista plástico, fotografo e designer André Amaral.  André, que nos últimos anos vem sendo um grande parceiro de Azul Casu, será responsável pela primeira impressão que o público terá do trabalho. </p>

<p>E para que finalmente o CD possa ganhar as ruas e assim chegue até você, é necessária uma produção industrial desse disco. Após alguns estudos, indicações e orçamentos, Azul Casu encontrou a solução mais acessível: o Semi Metalic Disc (SMD) </p>

<p>O SMD (Semi Metalic Disc) é uma mídia 100% brasileira, e vem sendo um grande aliado na luta contra a pirataria no Brasil. As embalagens de acrílico foram substituídas por uma mais econômica e moderna – inquebrável, em papel cartão especial, com fechamento que facilita o armazenamento e garante a integridade da mídia. Além disso, o preço do SMD é impresso na capa, possuindo um preço fixo de comercialização, de forma que possa garantir o cunho social de combate à pirataria e acesso à cultura. </p>

<p><strong>Como funciona o Crowdfunding, e o que os investidores ganham com isso?</strong></p>

<p>O sistema de Crowdfunding funciona da seguinte forma: Você escolhe um dos pacotes, com os valores e as recompensas que deseja, e com a somatória desses valores arrecadados o proponente do projeto(Azul Casu) junta os fundos necessários para finalizar o seu CD. </p>

<p>Para prensagem e arte gráfica, como citado acima, Azul Casu necessitará de R$ 2.500,00 .Mas contando  a porcentagem do site, custos com as recompensas e fretes. A somatória chega ao valor de R$: 3.200,00 </p>

<p>O valor arrecado só será repassado para Azul Casu, caso ele atinja a meta. Caso contrário, todos investidores recebem reembolso. </p>

<p>Página de Azul Casu no facebook:</p>

<p><a class=""alt-link"" href=""https://www.facebook.com/azul.casu?ref=tn_tnmn"" target=""_blank"">https://www.facebook.com/azul.casu?ref=tn_tnmn</a></p>

<p>Fan Page de divulgação de Azul Casu:</p>

<p><a class=""alt-link"" href=""https://www.facebook.com/Azulcasupaginaoficial?fref=ts"" target=""_blank"">https://www.facebook.com/Azulcasupaginaoficial?fref=ts</a></p>

<p>Youtube:</p>

<p><a class=""alt-link"" href=""http://www.youtube.com/user/zicoehorei"" target=""_blank"">http://www.youtube.com/user/zicoehorei</a> </p>
",azulcasu,//player.vimeo.com/video/64770312,https://vimeo.com/64770312,Música,16,,https://s3-sa-east-1.amazonaws.com/cdn.br.catarse/uploads/project/video_thumbnail/1850/project_thumb_thumb_open-uri20131125-2-10w6hs3,https://s3-sa-east-1.amazonaws.com/cdn.br.catarse/uploads/project/video_thumbnail/1850/project_thumb_small_open-uri20131125-2-10w6hs3,https://s3-sa-east-1.amazonaws.com/cdn.br.catarse/uploads/project/video_thumbnail/1850/project_thumb_large_open-uri20131125-2-10w6hs3,https://s3-sa-east-1.amazonaws.com/cdn.br.catarse/uploads/project/video_thumbnail/1850/project_thumb_video_cover_open-uri20131125-2-10w6hs3,104.0625000000000000,3330.0,42,33,successful,aon,finished,"2013-06-12 02:59:59","2013-06-11 23:59:59","2013-04-29 20:15:10","2013-04-29 17:15:10",,t,t,f,43,"{""total"" : 0, ""unit"" : ""seconds""}","{""total"" : 43, ""unit"" : ""days""}",1,"{""city"" : ""Cabo Frio"", ""state_acronym"" : ""RJ"", ""state"" : ""Rio de Janeiro""}","{""id"" : 118442, ""name"" : ""Azul Casu ""}",0,,f,f,1,f,f,f