project_id,id,user_id,name,headline,budget,goal,about_html,permalink,video_embed_url,video_url,category_name,category_id,original_image,thumb_image,small_image,large_image,video_cover_image,progress,pledged,total_contributions,total_contributors,state,mode,state_order,expires_at,zone_expires_at,online_date,zone_online_date,sent_to_analysis_at,is_published,is_expired,open_for_contributions,online_days,remaining_time,elapsed_time,posts_count,address,user,reminder_count,is_owner_or_admin,user_signed_in,in_reminder,total_posts,can_request_transfer,is_admin_role,contributed_by_friends
18747,18747,375090,Rapha,"RAPHA - O mundo se depara 
com um cenário devastador onde a sobrevivência está em primeiro plano.","<p>O orçamento esta descrito acima na descrição.</p>",8000.0,"<p><img src=""https://s3.amazonaws.com/cdn.catarse/uploads/redactor_rails/picture/data/21376/O_PROJETO.jpg"" width=""335"" height=""65"" style=""width: 335px; height: 65px;""></p><p>Em
busca da realização de um sonho, reunimos diversos artistas dos
quadrinhos onde cada um tem o seu estilo e traço próprio. A junção
desses artistas proporcionou a criação do projeto RAPHA.
O
maior intuito do projeto além do lançamento da obra é a exibição
de diversos artistas nacionais de vários estados brasileiros.<br><br></p><p style=""text-align: center;""><img src=""https://s3.amazonaws.com/cdn.catarse/uploads/redactor_rails/picture/data/21389/Capa_Rapha_Formato_Americano1.jpg""></p><p><br>O
resultado desse projeto, será uma revista em quadrinhos impressa
contendo uma história autoral com 31 páginas de arte 26cm x 17cm
(formato quadrinho americano) em preto e branco e coloração em tons
de cinza, capa e contracapa colorida, 1 pagina de agradecimentos
selecionados da campanha e 1 página contendo nome de toda a equipe
responsável pela criação do projeto, somando assim uma revista de
36 páginas.<br><br>Para saber mais sobre o projeto e ver as páginas ampliadas acessem:<br><br><a href=""https://www.facebook.com/projetorapha"">https://www.facebook.com/projetorapha</a><br><br>
</p><p><img src=""https://s3.amazonaws.com/cdn.catarse/uploads/redactor_rails/picture/data/21377/RAPHA.jpg"" width=""336"" height=""63"" style=""width: 336px; height: 63px;""><br><br>Com a busca incansável dos seres humanos pela cura de todas as doenças, os cientistas com o passar dos anos vêm desenvolvendo diversas pesquisas e fórmulas para alcançar o êxito. Uma cúpula misteriosa reuniu os melhores geneticistas para criarem a cura para diversas doenças até então incuráveis. Com base em estudos e experimentos com animais, o jovem e talentoso Dr. Alex segue com o legado de seus antepassados, após muito tempo enfurnado em um laboratório ele chega a uma impressionante descoberta.<br></p><p><img src=""https://s3.amazonaws.com/cdn.catarse/uploads/redactor_rails/picture/data/25373/Personagens_Frizz_01_baixa_.jpg"" width=""757"" height=""746"" style=""width: 757px; height: 746px;""></p><p>Os
seres humanos estariam vivendo uma era cujo as doenças não eram
mais problemas, misteriosamente algo começa a dar errado. Uma classe
de pessoas começa a desenvolver uma reação inesperada ao
tratamento, em seguida os órgãos governamentais iniciam manobras de
quarentena em todo o mundo.<br></p><p>Através
de exames é descoberto um vírus provocado pelo próprio tratamento,
cujo a propagação até então era um mistério. Ao descobrir que o
contágio era provocado através do sangue, se estabeleceu um caos
global, gerando-se assim conflitos entre o governo e o povo.</p><p style=""text-align: center;""><img src=""https://s3.amazonaws.com/cdn.catarse/uploads/redactor_rails/picture/data/21390/modelo11.jpg"" width=""774"" height=""496"" style=""width: 774px; height: 496px;""></p><p>As
pessoas que estavam em quarentena começaram a apresentar um
agravamento no quadro e outras pessoas em meio a população
iniciavam os primeiros sintomas. Em primeira instância, devido aos
acontecimentos, os líderes mundiais decidiram criar reservas para
conter os infectados, não demorou muito até que as nações se
desentendessem por diversos motivos, e assim desencadeou-se a
terceira guerra mundial.</p><p>O
resultado dessa guerra fez com que muitas civilizações sofressem,
tendo muitas perdas, até declararem “o cessar fogo”.
Eis
então que o mundo se depara com um cenário devastador onde a
sobrevivência está em primeiro plano.<br><br>
</p><p><img src=""https://s3.amazonaws.com/cdn.catarse/uploads/redactor_rails/picture/data/21378/A_EQUIPE.jpg"" width=""337"" height=""65"" style=""width: 337px; height: 65px;""></p><p>Temos
então uma equipe onde agradecemos a todos os amigos artistas que
colaboraram com as suas criações e que aceitaram o nosso convite
para embarcarem nesse projeto, onde criamos assim o primeiro número.
O projeto RAPHA não se restringe apenas a um número, com a ajuda de
todos estaremos lançando os muitos volumes que estão por vir.</p><p style=""text-align: center;""><img src=""https://s3.amazonaws.com/cdn.catarse/uploads/redactor_rails/picture/data/21391/modelo22.jpg"" width=""762"" height=""517"" style=""width: 762px; height: 517px;""><br><br>
</p><p>A
nossa equipe é composta pelos autores Pablo Salazar e Rodrigo
Chaves, revisor de texto Renato Santos e os nossos artistas criadores
de toda a arte impressa na revista Roberto Jales, Carlos Eduardo
Cunha, Oscar Suyama, Alex Araújo, Marc Oliveira, Alex Pantoja,
Derick Thyago Alves e André Cotinguiba.<br><br></p><p><img src=""https://s3.amazonaws.com/cdn.catarse/uploads/redactor_rails/picture/data/21393/OR_AMENTO.jpg"" width=""336"" height=""62"" style=""width: 336px; height: 62px;""></p><p>Todo o valor arrecadado será usado totalmente para os custos da impressão da revista em quadrinhos, Recompensas, despesa dos correios, pagamento dos nossos artistas e a porcentagem do Catar-se. Para que o projeto aconteça, os seus autores e idealizadores abdicaram de todo e qualquer quantia arrecadada no Catar-se.<br></p><p>Segue abaixo o nosso gráfico:</p><p><img src=""https://s3.amazonaws.com/cdn.catarse/uploads/redactor_rails/picture/data/21392/grafico.fw.png""><br>Todas as recompensas incluem o frete gratuito para todo o Brasil (caso seja necessário enviar para fora do país estará disponível, mas mediante ao contato pelo nosso e-mail). </p><p><br></p><p><img src=""https://s3.amazonaws.com/cdn.catarse/uploads/redactor_rails/picture/data/21381/RECOMPENSAS.jpg"" width=""338"" height=""67"" style=""width: 338px; height: 67px;""></p><p>Segue
a baixo algumas ilustrações de nossas recompensas:<br><span></span><br></p><p style=""text-align: center;"" rel=""text-align: center;""><img src=""https://s3.amazonaws.com/cdn.catarse/uploads/redactor_rails/picture/data/21385/camisas.jpg""><br><br></p><p style=""text-align: center;""><img src=""https://s3.amazonaws.com/cdn.catarse/uploads/redactor_rails/picture/data/21384/a3_emoldurado.jpg"" width=""255"" height=""379"" rel=""width: 255px; height: 379px;"" style=""width: 255px; height: 379px;""></p><p>A todos que
contribuírem com o projeto, não somente com a versão impressa e
sim com as recompensas, desde já estamos agradecidos pela realização
do nosso projeto. Contribuam com a recompensa que mais gostarem e
estaremos enviando ela o mais breve possível. Peço a todos que
ajudem a divulgar o projeto para que não somente esse seja lançado
como todos os artistas que buscam expor as suas obras a fim de
entretenimento e reconhecimento pelo seu trabalho.<br></p><p><img src=""https://s3.amazonaws.com/cdn.catarse/uploads/redactor_rails/picture/data/21968/modelo3.jpg"" width=""773"" height=""522"" style=""width: 773px; height: 522px;""></p><p>Vamos lá pessoal o prazo esta acabando, vamos contribuir. Falta poucos dias! </p><p>Agradecemos a todos os que já apoiaram (PABLO SALAZAR E RODRIGO CHAVES) - Produtores do RAPHA.</p><p> DESDE
JÁ OBRIGADO A TODOS.<br><br>
</p><p><strong>Apoio
e Agradecimentos</strong></p><p><br>Edição
de Vídeo – Everton Luiz<br><br>Para saber mais sobre o projeto acessem:<br><br><a href=""https://www.facebook.com/projetorapha"">https://www.facebook.com/projetorapha</a></p>",rapha,//www.youtube.com/embed/0vBRQG4ASxY,https://youtu.be/0vBRQG4ASxY,Quadrinhos,7,https://s3-sa-east-1.amazonaws.com/cdn.br.catarse/uploads/project/uploaded_image/18747/3.jpg,https://s3-sa-east-1.amazonaws.com/cdn.br.catarse/uploads/project/uploaded_image/18747/project_thumb_thumb_3.jpg,https://s3-sa-east-1.amazonaws.com/cdn.br.catarse/uploads/project/uploaded_image/18747/project_thumb_small_3.jpg,https://s3-sa-east-1.amazonaws.com/cdn.br.catarse/uploads/project/uploaded_image/18747/project_thumb_large_3.jpg,https://s3-sa-east-1.amazonaws.com/cdn.br.catarse/uploads/project/uploaded_image/18747/project_thumb_video_cover_3.jpg,7.25000000000000000000,580.0,22,22,failed,aon,finished,"2015-11-12 01:59:59","2015-11-11 23:59:59","2015-09-12 03:02:12.615075","2015-09-12 00:02:12.615075",,t,t,f,60,"{""total"" : 0, ""unit"" : ""seconds""}","{""total"" : 60, ""unit"" : ""days""}",0,"{""city"" : ""Rio de Janeiro"", ""state_acronym"" : ""RJ"", ""state"" : ""Rio de Janeiro""}","{""id"" : 375090, ""name"" : ""Pablo Salazar""}",12,,f,f,0,f,f,f