project_id,id,user_id,name,headline,budget,goal,about_html,permalink,video_embed_url,video_url,category_name,category_id,original_image,thumb_image,small_image,large_image,video_cover_image,progress,pledged,total_contributions,total_contributors,state,mode,state_order,expires_at,zone_expires_at,online_date,zone_online_date,sent_to_analysis_at,is_published,is_expired,open_for_contributions,online_days,remaining_time,elapsed_time,posts_count,address,user,reminder_count,is_owner_or_admin,user_signed_in,in_reminder,total_posts,can_request_transfer,is_admin_role,contributed_by_friends
19160,19160,352691,"Mulher, o segundo sexo?","Um filme independente sobre uma mulher que quer conquistar o seu espaço. Apoie essa ideia!","<p><strong>R$ 22.523,00 - Total</strong></p><p>R$ 500,00 - pré-produção</p><p>R$ 7.500,00 - produção e filmagens</p><p>R$ 10.500,00 - Finalização, trilha sonora e festivais</p><p>R$ 2.928,00 - Taxa do catarse (13%)</p><p>R$ 1.095,00 - Recompensas</p><p><br></p><table>   <colgroup><col>  <col>  <col>  <col>  </colgroup><tbody><tr>   <td colspan=""13"" style=""text-align: center;""><a name=""RANGE!A5:M11"">CRONOGRAMA - Mulher, o   segundo sexo?<br></a><br></td>  </tr>  <tr>   <td>ATIVIDADES</td>   <td colspan=""4"">NOVEMBRO (2015)</td>   <td colspan=""4"">DEZEMBRO (2015)</td>   <td colspan=""4"">JANEIRO (2016)</td>  </tr>  <tr>   <td>Pré   produção</td>   <td>X</td>   <td>X</td>   <td>X</td>   <td>X</td>   <td> </td>   <td> </td>   <td> </td>   <td> </td>   <td> </td>   <td> </td>   <td> </td>   <td> </td>  </tr>  <tr>   <td>Produção e filmagem</td>   <td> </td>   <td> </td>   <td> </td>   <td> </td>   <td>X</td>   <td> </td>   <td> </td>   <td> </td>   <td> </td>   <td> </td>   <td> </td>   <td> </td>  </tr>  <tr>   <td>Finalização de imagem e som</td>   <td> </td>   <td> </td>   <td> </td>   <td> </td>   <td> </td>   <td>X</td>   <td>X</td>   <td>X</td>   <td> </td>   <td> </td>   <td> </td>   <td> </td>  </tr>  <tr>   <td>Finalização de som, mixagem e trilhas sonoras</td>   <td> </td>   <td> </td>   <td> </td>   <td> </td>   <td> </td>   <td> </td>   <td> </td>   <td> </td>   <td>X</td>   <td>X</td>   <td>X</td>   <td> </td>  </tr>  <tr>   <td>Festivais</td>   <td> </td>   <td> </td>   <td> </td>   <td> </td>   <td> </td>   <td> </td>   <td> </td>   <td> </td>   <td> </td>   <td> </td>   <td> </td>   <td>X</td>  </tr></tbody></table><p><br></p>",22523.0,"<p>Gostaríamos de pedir o seu apoio para a produção e
finalização do curta metragem “Mulher, o segundo sexo?”, com direção de Gabriel Alvim. </p><p><strong>SINOPSE</strong><br></p><p>Bebel, uma atriz talentosa, consegue seu 1º papel em uma telenovela, através de uma indicação do seu namorado e diretor de televisão, Giani.</p><p>A relação do casal não está bem e logo nos primeiros dias de ensaios, Bebel conhece Miguel, um estranho diretor outsider. Tocada com a sensibilidade do rapaz, Bebel pede ajuda com o texto e ele topa.</p><p>Giani fica enciumado e Miguel se envolve em uma briga no último dia de filmagens. Bebel, por sua vez, está determinada a seguir o seu caminho e para isso terá que fazer escolhas delicadas.</p><p><img src=""https://s3.amazonaws.com/cdn.catarse/uploads/redactor_rails/picture/data/23299/mulher_01.jpeg""></p><p><strong>O PROJETO</strong></p><p>A história se passa no glamuroso mundo do show business.  Bebel é a protagonista, uma mulher decidida a conquistar o seu espaço e mostrar o seu talento. </p>    <p>Além do drama vivido pelos personagens, a ideia é retratar as engrenagens de poder, preconceito e gênero; a fim de estimular e dar voz ao debate de questões importantes dentro da nossa sociedade. </p>    <p>O Curta pretende aproximar o espectador do universo feminino, com a sensibilidade necessária para superar a questão de gênero (masculino/feminino), da figura do 'outro', e acessar um arquétipo universal humano: a angustia da pessoa que não conseguiu a realização profissional no mundo moderno. </p><p><strong>APOIOS E CONTRAPARTIDAS</strong><br></p><p>Os recursos reunidos com o presente financiamento coletivo
serão usados com as despesas básicas de produção e finalização do filme: alimentação,
equipamentos, atores, transporte, cenografia, trilha-sonora e mixagem, além da
taxa cobrada pela plataforma catarse de 13%.</p><p>Uma equipe de excelentes
profissionais do mercado audiovisual está apoiando o projeto, garantindo a qualidade técnica e artística. O elenco é formado por atores com experiência no cinema e televisão. O filme participará de mostras
competitivas de festivais, nacionais e internacionais, para divulgar nossa
cultura e promover o diálogo com o público nos seus mais diferentes espaços.</p><p>“<strong>Mulher, o segundo sexo?</strong>"", ficará pronto no 1<sup>o</sup>
semestre de 2016. Atualizamos vocês por e-mail ou facebook.</p><p>O seu apoio é imprescindível para a concretização desse trabalho!! Doar no Catarse é muito fácil e seguro. </p><p>Nosso <strong>muito obrigado </strong>desde já ;)</p><p><strong>ELENCO</strong></p><p>Juliana Schalch (Bebel)</p><p>Adriano Toloza (Giani)</p><p>Dida Andrade (Miguel)<span></span></p><p>Nelson Baskerville (Oscar)</p><p><strong>EQUIPE</strong></p><p><strong>Roteiro e Direção:</strong> Gabriel Alvim, <strong>Produção Executiva:</strong> Maria Isabel Abduch, <strong>Direção de Fotografia:</strong>
Pepe Mendes, <strong>Direção de Arte:</strong> Luisa Doria, <strong>Direção de</strong> <strong>Produção: </strong>Thais Morresi <strong>Som:</strong> Bruno Gomes Augustin, <strong>Assistência de direção:</strong> Paula Sacchetta, <strong>Coordenação de Campanha:</strong> Pedro ""Drera"" Coelho, <strong>Vídeo do Catarse:</strong>
Gabriel Alvim <strong>Artes Gráficas:</strong> Luisa Doria e Rodrigo Levy.</p><p><strong>MAIS INFORMAÇÕES</strong></p><p>Curta! nossa página no facebook <a href=""https://www.facebook.com/mulherosegundo/timeline"">https://www.facebook.com/mulherosegundo</a><br><br></p>",mulher,//player.vimeo.com/video/140442951,https://vimeo.com/140442951,"Cinema e Vídeo",13,https://s3-sa-east-1.amazonaws.com/cdn.br.catarse/uploads/project/uploaded_image/19160/profile_com_letring.jpg,https://s3-sa-east-1.amazonaws.com/cdn.br.catarse/uploads/project/uploaded_image/19160/project_thumb_thumb_profile_com_letring.jpg,https://s3-sa-east-1.amazonaws.com/cdn.br.catarse/uploads/project/uploaded_image/19160/project_thumb_small_profile_com_letring.jpg,https://s3-sa-east-1.amazonaws.com/cdn.br.catarse/uploads/project/uploaded_image/19160/project_thumb_large_profile_com_letring.jpg,https://s3-sa-east-1.amazonaws.com/cdn.br.catarse/uploads/project/uploaded_image/19160/project_thumb_video_cover_profile_com_letring.jpg,103.44092705234649025400,23298.0,124,112,successful,aon,finished,"2015-10-29 01:59:59","2015-10-28 23:59:59","2015-09-21 15:34:57.047661","2015-09-21 12:34:57.047661",,t,t,f,37,"{""total"" : 0, ""unit"" : ""seconds""}","{""total"" : 37, ""unit"" : ""days""}",11,"{""city"" : ""São Paulo"", ""state_acronym"" : ""SP"", ""state"" : ""São Paulo""}","{""id"" : 352691, ""name"" : ""Gabriel Alvim""}",0,,f,f,11,f,f,f