project_id,id,user_id,name,headline,budget,goal,about_html,permalink,video_embed_url,video_url,category_name,category_id,original_image,thumb_image,small_image,large_image,video_cover_image,progress,pledged,total_contributions,total_contributors,state,mode,state_order,expires_at,zone_expires_at,online_date,zone_online_date,sent_to_analysis_at,is_published,is_expired,open_for_contributions,online_days,remaining_time,elapsed_time,posts_count,address,user,reminder_count,is_owner_or_admin,user_signed_in,in_reminder,total_posts,can_request_transfer,is_admin_role,contributed_by_friends
1965,1965,149513,"Bacalhau Regado ao Vinho","Mínimo de 47 gargalhadas garantidas e sem patrocínio","O orçamento para projetos anteriores a 24/02/2015 normalmente pode ser encontrado na descrição acima.",2000.0,"<p>&quot;Fan page do espectáculo&quot;: <a class=""alt-link"" href=""https://www.facebook.com/BacalhauRegadoAoVinho"" target=""_blank"">https://www.facebook.com/BacalhauRegadoAoVinho</a>
<em>Em um momento de crise pessoal, mundial e européia surgiu esse projecto. O director e autor estava de férias no Brasil e pessoas de seu entorno em Florianópolis se juntaram para fazer teatro com humor. Houve uma avant-ptremiére no dia 10 de Março e pela falta de teatros na cidade e a máfia na utilização dos mesmos, ou se buscam apresentações pelos aforas da ilha da magia ou o projecto morrerá.</em></p>

<p><a class=""alt-link"" target=""_blank"" href=""http://www.youtube.com/watch?feature=endscreen&amp"">Vídeo da Avant Premiére</a>;v=9sXXKydwmCo&amp;NR=1</p>

<p><em>Bacalhau Regado ao Vinho é um espectáculo com o &quot;Mínimo de 47 gargalhadas garantidas ou seu ingresso de volta&quot;.</em> Não nos falta material humano, nem artístico, falta dinheiro mesmo.</p>

<p>Viemos aqui buscar apoios para a nossa tournée pelas cidades pólo dos estados do sul e São Paulo. Já desistimos de pedir patrocínios e estamos por começar por fazer dia 30 de Junho nossa estréia fora, na cidade de Joinville, no Galpão de teatro da Ajote.</p>

<p>Necessitamos pagar aluguel de teatro, transporte, material de divulgação, transporte de cenário e maquilhagem.</p>

<p>Companhia Teatral A Tribo da Arte retoma suas actividades sob a direcção de <a class=""alt-link"" target=""_blank"" href=""http://pt.wikipedia.org/wiki/Nando_Schweitzer"">Fernando Schweitzer</a> . Seu último trabalho fora como Alexandre Nardoni em Instinto Assassino do DISCOVERY CHANNEL. O mesmo também firma o texto, neste que é seu 121º espectáculo como actor e 23º como director. Bacalhau mistura tendências da comédia del´arte, Mollier, Bertold Bretch. Priorizando o espectáculo no actor, figura esquecida pelo meio teatral nesta década. </p>

<p>Sobre o espectáculo: Lisboa ao entardecer. Maria de Fátima é uma mera dona de casa portuguesa, que ao descobrir as escapadas de seu marido Augusto Manuel, começa a perceber que a tradicional família portuguesa tem “novos membros”. Recheada de situações inesperadas, a trama, que inicia em típico café da manhã, comum, com irmãos brigando, pais gritando, etc., toma corpo com as boníssimas interpretações. Ambientada e falada em Português Lusitano, nas variantes lisboeta e da Cidade do Porto, além de inovar como proposta cénica, leva ao público o gostinho de estar na terrinha de nossos patrícios. </p>

<p><em>O <em>Catarse é uma ferramenta que possibilita o financiamento de projetos criativos</em>. Aqui artistas, designers, gamers, empreendedores, ativistas, tem uma poderosa ferramenta para conseguirem viabilizar financeiramente seus projetos.</em></p>

<p>SINOPSE - Uma portuguesa histérica casada com um cínico falso-moralista, que tem dois filhos, um gajo pentelho de carteirinha e uma pseudo-intelecto-revoltada. Tendo como vizinha e melhor amiga a também amante de seu esposo, que é casada com um legítimo português e tem um filho um pouco desorientado psicologicamente. Mistura explosiva-mente cómica. Uma comédia portuguesa com certeza!!! Tente controlar a gargalhada, pois o riso é inevitável.</p>

<p>Elenco de actores estelares: Ágatha Fernanda ( A Pessoa Prefere não Comentar ), Alex Pauli Rebello ( A Tribo de Kerodon ), Harrison Reis ( A Gota que Falta ), Emily Teischmann ( O Adestrador Falido ), Jéssica da Rosa ( O Adestrador Falido ), Fernando Villa ( O Poder das Princesas ), Yuri Milano ( O Poder das Princesas )</p>

<p>ROTEIRO e DIRECÇÃO: FERNANDO SCHWEITZER </p>

<ul>
<li>Desde do dia 1° de Fevereiro de 2003 a Companhia Teatral a Tribo da Arte existe sem patrocínio como ato de intervenção social. Fora fundada oficialmente em 2006 (E como foi difícil fazer a papelada sem um tostão e menos conhecimento jurídico para).</li>
</ul>

<p>A estréia em 31/05/2003 de A Tribo de Kerodon, primeiro espetáculo dirigido ao público jovem e adolescente da história comercial do teatro catarinense, no gérmen demonstrou o enfoque arrojado e engajado da Companhia, seguindo em cartaz em 2004 também. Totalizando 25 apresentações em 2003 e 4 em 2004.</p>

<p>&quot;Bastidores da Entrevista para TV COM, Florianópolis&quot;:<div class=""video youtube""><iframe width=""600"" height=""403"" src=""//www.youtube.com/embed/J3XFyLWkLJk?wmode=opaque"" frameborder=""0"" allowfullscreen></iframe></div></p>
",Bacalhau,//player.vimeo.com/video/66533108,https://vimeo.com/66533108,"Teatro e Dança",19,,https://s3-sa-east-1.amazonaws.com/cdn.br.catarse/uploads/project/video_thumbnail/1965/project_thumb_thumb_open-uri20131125-2-1qqr1rn,https://s3-sa-east-1.amazonaws.com/cdn.br.catarse/uploads/project/video_thumbnail/1965/project_thumb_small_open-uri20131125-2-1qqr1rn,https://s3-sa-east-1.amazonaws.com/cdn.br.catarse/uploads/project/video_thumbnail/1965/project_thumb_large_open-uri20131125-2-1qqr1rn,https://s3-sa-east-1.amazonaws.com/cdn.br.catarse/uploads/project/video_thumbnail/1965/project_thumb_video_cover_open-uri20131125-2-1qqr1rn,0,0,0,0,failed,aon,finished,"2013-06-20 02:59:59","2013-06-19 23:59:59","2013-05-20 14:19:04","2013-05-20 11:19:04",,t,t,f,30,"{""total"" : 0, ""unit"" : ""seconds""}","{""total"" : 30, ""unit"" : ""days""}",2,"{""city"" : ""São José"", ""state_acronym"" : ""SC"", ""state"" : ""Santa Catarina""}","{""id"" : 149513, ""name"" : ""Antonio Fernando Mello""}",0,,f,f,2,f,f,f