project_id,id,user_id,name,headline,budget,goal,about_html,permalink,video_embed_url,video_url,category_name,category_id,original_image,thumb_image,small_image,large_image,video_cover_image,progress,pledged,total_contributions,total_contributors,state,mode,state_order,expires_at,zone_expires_at,online_date,zone_online_date,sent_to_analysis_at,is_published,is_expired,open_for_contributions,online_days,remaining_time,elapsed_time,posts_count,address,user,reminder_count,is_owner_or_admin,user_signed_in,in_reminder,total_posts,can_request_transfer,is_admin_role,contributed_by_friends
20131,20131,480488,"Carnaval Bloco do Rock 2016","CARNAVAL 2016 BLOCO DO ROCK! VAMOS BALANÇAR A PÇA TIRADENTES COM MUITA ALEGRIA, SAMBA E ROCK´N ROLL","<p><strong>Veja como vai ser usado o dinheiro do projeto.</strong></p><p><img src=""https://s3.amazonaws.com/cdn.catarse/uploads/redactor_rails/picture/data/33400/pizza-orcamento.png"" style=""line-height: 1.6em;""></p>",4000.0,"<p class=""fontsize-larger fontweight-semibold""><strong>BLOCO DO ROCK</strong></p><p>Somos um bloco carnavalesco temático com alma e espírito 
carioca. Do Carioca zoador, brincalhão que tem em sua essência a 
pluralidade cultural. O Bloco do Rock é bem assim, um bloco autêntico 
que une gêneros considerados antagônicos, porque o Carioca é assim, 
juntos e misturados, sonoros, miscigenados, ousados e vanguarda no jeito
 de ser, ouvir, sentir e curtir.</p><img src=""https://s3.amazonaws.com/cdn.catarse/uploads/redactor_rails/picture/data/25986/Grande_Encontro_dos_Blocos_Cariocas_-_3_Edi__o_-_por_Jonatas_Martin_Puga_-_137.JPG""><p><br>Um bloco onde clássicos do Rock´n Roll são interpretados e executados
 por uma equipe formada por cantores, baixistas e guitarristas que 
seguem a clássica formação das bandas do gênero juntamente com uma 
furiosa bateria de samba de quadra formada por ritmistas criados em 
nosso bloco e ritmistas oriundos da escola de coração do nosso bloco o 
G.R.E.S. União da Ilha do Governador e todos juntos lançados nesse 
panelaço de influências produzem um som único, poderoso, ousado, falando
 de amor, de felicidade, de rock, samba e carnaval.</p><p><img src=""https://s3.amazonaws.com/cdn.catarse/uploads/redactor_rails/picture/data/25987/Grande_Encontro_dos_Blocos_Cariocas_-_3_Edi__o_-_por_Jonatas_Martin_Puga_-_146.JPG""></p><p>A idéia surgiu de um grupo de amigos que curtiam rock, mas não faziam
 samba e de percussionistas que aceitaram o desafio de tocar samba 
dentro de um universo rock. Essa ousadia de ambas as partes resultou na 
criação de uma massa sonora única onde se identifica naturalmente as 
convenções e bossas provenientes de uma bateria autenticamente de escola
 de samba junto à pegada de uma banda de rock clássico. Em nossas 
apresentações tocamos os clássicos dos Rolling Stones, Creedance 
Clearwater Revival, Beatles, Steppenwolf, Ozzy Osbourne, AC/DC, Kiss, 
Iron Maiden, Guns´n Roses, Outfield, Legião Urbana, Pitty, Cazuza, 
Raimundos entre muitas outras influências.</p><iframe src=""https://www.youtube.com/embed/hNmctd0pSzs"" allowfullscreen="""" frameborder=""0"" height=""443"" width=""667""></iframe><iframe src=""https://www.youtube.com/embed/wOcbSxm7gwg"" allowfullscreen="""" frameborder=""0"" height=""443"" width=""667""></iframe><p><br></p><p class=""fontsize-larger fontweight-semibold"">OCUPAÇÃO CULTURAL E SOCIAL</p><p>Participamos e/ou organizamos diversas atividades culturais no Rio de Janeiro:</p><ul><li>ABERTURA NÃO OFICIAL DO CARNAVAL DO RIO DE JANEIRO</li></ul><p><img src=""https://s3.amazonaws.com/cdn.catarse/uploads/redactor_rails/picture/data/33396/abertura-do-carnaval-nao-oficial-cabec3a7alho-2.png""></p><ul><li>ENCONTRO DOS BLOCOS DO RIO DE JANEIRO</li></ul><p><img src=""https://s3.amazonaws.com/cdn.catarse/uploads/redactor_rails/picture/data/33398/encontro.png""></p><ul><li>CALÇADÃO DO VINIL</li><iframe src=""https://www.youtube.com/embed/ZkzUMDQ2dZA"" allowfullscreen="""" frameborder=""0"" height=""443"" width=""667""></iframe><br><br><li>AÇÕES JURÍDICOS SOCIAIS<br><img src=""https://s3.amazonaws.com/cdn.catarse/uploads/redactor_rails/picture/data/25988/assessoria-17-10.png""></li></ul><p><br></p><ul><li>ATIVIDADES NA LONA CULTURAL RENATO RUSSO ILHA DO GOVERNADOR<br><img src=""https://s3.amazonaws.com/cdn.catarse/uploads/redactor_rails/picture/data/25989/novo-oficina.png""></li></ul><p><br></p><ul><li>CARNAVAL CENTRO DO RIO DE JANEIRO 2015<br><img src=""https://s3.amazonaws.com/cdn.catarse/uploads/redactor_rails/picture/data/25992/EDU_9919.jpg""><img src=""https://s3.amazonaws.com/cdn.catarse/uploads/redactor_rails/picture/data/25993/EDU_9883.jpg""><img src=""https://s3.amazonaws.com/cdn.catarse/uploads/redactor_rails/picture/data/25994/EDU_0149.jpg""><img src=""https://s3.amazonaws.com/cdn.catarse/uploads/redactor_rails/picture/data/25995/EDU_9039_c_pia.jpg""></li></ul><p><br></p><p class=""fontsize-larger fontweight-semibold""><strong>e agora... o CARNAVAL 2016 do BLOCO DO ROCK...</strong></p><p class=""fontsize-large""><strong>VAMOS ENCHER A PRAÇA TIRADENTES DE ALEGRIA, <br></strong><strong>SAMBA E ROCK´N ROLL!</strong></p><p>Esse ano nossa proposta de carnaval será o rock´n roll invadindo a <strong>PRAÇA TIRADENTES, CENTRO, RJ</strong>, na terça-feira de carnaval (9/2). A concentração será a partir das 14h, nosso show começa as 15h e encerramos as 18h30. Queremos dar um passo a mais e proporcionar uma festa com mais espaço para o nosso público, com equipamentos de melhor qualidade e para isso trocamos de endereço. Deixamos a Rua Lélio Gama esquina com Av. Chile, Centro, RJ pela charmosíssima Praça Tiradentes, também no Centro da cidade maravilhosa. Tudo isso para ter mais espaço para toda a turma que nos segue. </p><p>Para realizarmos esse sonho precisamos de uma estrutura um pouco mais bacana do que o tradicional carro de som que foi utilizado no ano passado. </p><p><strong>Nosso projeto é simples, nada muito exagerado, mas que demandam de um pouco mais recursos financeiros e por isso pedimos sua colaboração. Você que já curtiu o Bloco do Rock em outros carnavais, você que gosta de atitudes novas, você que ama o carnaval, você que se identifica com o rock, você que ama o samba e suas variações, você que gostaria de ser nosso parceiro nessa empreitada nos contemplando com o apoio de sua empresa, ou você que simplesmente gostou da ideia e quer colaborar, que ver essa estrutura e esse som acontecer!</strong></p><p> Nossa estrutura é composta por:</p><ul><li>COBERTURA COM TENDA(21x11m) e dentro nossos equipamentos de som. Sem palco. Tudo para ficar o mais perto do público e curtimos juntos e misturadíssimos muito samba e rock´n roll.</li></ul><p><img src=""https://s3.amazonaws.com/cdn.catarse/uploads/redactor_rails/picture/data/33390/lona.jpg"" width=""686"" height=""551"" style=""width: 686px; height: 551px;""></p><ul><li>Nossos EQUIPAMENTOS<br><br><img src=""https://s3.amazonaws.com/cdn.catarse/uploads/redactor_rails/picture/data/33394/Rider_de_palco.jpg""></li></ul><ul><li>CAMISA 2016</li></ul><p><br></p><p><img src=""https://s3.amazonaws.com/cdn.catarse/uploads/redactor_rails/picture/data/33401/frente.jpg""></p><p><img src=""https://s3.amazonaws.com/cdn.catarse/uploads/redactor_rails/picture/data/33403/costas.jpg""></p><p><br></p><ul><li>VAN PARA TRANSPORTE DOS INTEGRANTES E EQUIPAMENTOS</li></ul><p><img src=""https://s3.amazonaws.com/cdn.catarse/uploads/redactor_rails/picture/data/33399/van.jpg"" width=""670"" height=""399"" style=""width: 670px; height: 399px;""><br>Imagem meramente ilustrativa.</p><p><br></p><p><img src=""https://s3.amazonaws.com/cdn.catarse/uploads/redactor_rails/picture/data/33857/catarse.png""></p><p><br></p><p class=""fontsize-larger fontweight-semibold""><strong>Além do apoio ao nosso carnaval,  você pode escolher outras recompensas!</strong> <br></p><p class=""fontsize-large"">CAMISA RETRÔ<br><br></p><p><img src=""https://s3.amazonaws.com/cdn.catarse/uploads/redactor_rails/picture/data/33729/amostra.png""></p><ol><li><strong>R$15,00</strong> - 1 CAMISA RETRÔ BLOCO DO ROCK</li><li><strong>R$25,00</strong> - 2 CAMISAS RETRÔS BLOCO DO ROCK</li><li><strong>R$40,00</strong> - 1 CAMISA RETRÔ BLOCO DO ROCK + ACESSO À ÁREA RESTRITA AO BLOCO</li><li><strong>R$60,00</strong> - 2 CAMISAS RETRÔS + ACESSO À ÁREA RESTRITA AO BLOCO COM 1 ACOMPANHANTE</li><li><strong>R$70,00</strong> - 3 CAMISAS RETRÔS + ACESSO À ÁREA RESTRITA AO BLOCO COM 2 ACOMPANHANTES</li><li><strong>R$100,00</strong> - 2 CAMISAS 2016 + 1 CAMISA RETRÔ + ACESSO À ÁREA RESTRITA AO BLOCO COM 2 ACOMPANHANTES</li><li><strong>R$120,00</strong> - 2 CAMISAS 2016 + 2 CAMISAS RETRÔS + ACESSO À ÁREA RESTRITA AO BLOCO COM 3 ACOMPANHANTES</li><li><strong>R$150,00</strong> - 3 CAMISAS 2016 + ACESSO À ÁREA RESTRITA AO BLOCO COM 2 ACOMPANHANTES</li><li><strong>R$4000,00 - Colaborador Master - King of Samba Metal</strong><br><br>a) Exclusividade de
logomarca estampada nas camisas 2016 e banner estampado na lona no dia do show.<br>
b) Anúncios da parceria em todos  nas redes sociais e no carnaval na praça onde
divulgaremos o amigo, parceiro-patrocinador. Logotipo estará estampado em todas as nossas publicações em nosso site, em nossa página do <em>Facebook e Instagram.</em><br>
c) 2 shows exclusivos do bloco para o parceiro-patrocinador a combinar data.<br>d) 50 camisas retrôs.</li><li><strong>R$2000,00 - Colaboradores Intermediários - Mais conhecido como ""Vamos rachar?!""</strong><br><br>a) Exclusividade de logomarca estampada nas camisas 2016 e banner estampado na lona no dia do show.<br>b) Anúncios da parceria em todos  nas redes sociais e no carnaval na praça onde divulgaremos o amigo, parceiro-patrocinador. Logotipo estará estampado em todas as nossas publicações em nosso site, em nossa página do <em>Facebook e Instagram,</em><br>c) 1 show exclusivo
do bloco para cada parceiro-patrocinador, a combinar data.<br>d) 20 camisas retrôs para cada colaborador</li><li><strong>R$1333,00 - Colaboradores level 1: Também conhecidos como ""os 3 mosqueteiros""<br><br></strong>a) Logomarcas estampadas
nas camisas 2016, banner estampado na lona no dia do show.<br>b) Anúncios da parceria em todos  nas redes sociais e no carnaval na praça onde divulgaremos o amigo, parceiro-patrocinador. Logotipo estará estampado em todas as nossas publicações em nosso site, em nossa página do <em>Facebook e Instagram,</em><br><em>c) </em>10 camisas retrôs para cada colaborador</li></ol><p><img src=""https://s3.amazonaws.com/cdn.catarse/uploads/redactor_rails/picture/data/33732/fotos2.jpg"" width=""816"" height=""746"" style=""width: 816px; height: 746px;""></p>",blocodorock2016,//www.youtube.com/embed/Cpr-xyYcrN0,https://youtu.be/Cpr-xyYcrN0,Música,16,https://s3-sa-east-1.amazonaws.com/cdn.br.catarse/uploads/project/uploaded_image/20131/card.png,https://s3-sa-east-1.amazonaws.com/cdn.br.catarse/uploads/project/uploaded_image/20131/project_thumb_thumb_card.png,https://s3-sa-east-1.amazonaws.com/cdn.br.catarse/uploads/project/uploaded_image/20131/project_thumb_small_card.png,https://s3-sa-east-1.amazonaws.com/cdn.br.catarse/uploads/project/uploaded_image/20131/project_thumb_large_card.png,https://s3-sa-east-1.amazonaws.com/cdn.br.catarse/uploads/project/uploaded_image/20131/project_thumb_video_cover_card.png,9.00000000000000000000,360.0,11,10,failed,aon,finished,"2016-01-26 01:59:59.999999","2016-01-25 23:59:59.999999","2015-12-16 16:29:50.052379","2015-12-16 14:29:50.052379",,t,t,f,40,"{""total"" : 0, ""unit"" : ""seconds""}","{""total"" : 40, ""unit"" : ""days""}",0,"{""city"" : ""Rio de Janeiro"", ""state_acronym"" : ""RJ"", ""state"" : ""Rio de Janeiro""}","{""id"" : 480488, ""name"" : ""Fabio Cardoso Lopes""}",0,,f,f,0,f,f,f