project_id,id,user_id,name,headline,budget,goal,about_html,permalink,video_embed_url,video_url,category_name,category_id,original_image,thumb_image,small_image,large_image,video_cover_image,progress,pledged,total_contributions,total_contributors,state,mode,state_order,expires_at,zone_expires_at,online_date,zone_online_date,sent_to_analysis_at,is_published,is_expired,open_for_contributions,online_days,remaining_time,elapsed_time,posts_count,address,user,reminder_count,is_owner_or_admin,user_signed_in,in_reminder,total_posts,can_request_transfer,is_admin_role,contributed_by_friends
205,205,14464,"Documentário Brasileuro","Ajude o Documentário Brasileuro: Músicos Brasileiros na Europa. Os artistas brasileiros precisam de você! Clique aqui e assista ao vídeo.
","O orçamento para projetos anteriores a 24/02/2015 normalmente pode ser encontrado na descrição acima.",38667.0,"<p>Você clicou em nosso link, por isso você já merece o agradecimento de toda a classe artística brasileira!!</p>

<p>Assista ao vídeo e contribua para a produção do documentário “Brasileuro: Músicos Brasileiros na Europa”, que será desenvolvido a partir das situações que vamos vivenciar e das já experimentadas por músicos brasileiros que vivem na Europa.</p>

<p>Precisamos do seu apoio para realizar esse projeto que nasceu de três grandes sonhos: vivenciar, documentar e responder alguns questionamentos frequentes de artistas da música brasileira que depositam seus sonhos de reconhecimento profissional na divulgação e expansão de suas carreiras na Europa.</p>

<p>A dúvida corrói e acompanha o cotidiano dos artistas pois que informações concretas podem fundamentar a tomada de decisão entre manter sua zona de conforto e tentar uma alavancada profissional no escuro?</p>

<p>Veja o vídeo e conheça a equipe que é formada por três grandes amigos e parceiros profissionais: os músicos e produtores musicais Mayron de Carvalho e Ana Jardim e o fotógrafo e videomaker Paulo Pretz. A produção e lançamento do último CD da Banda Caixa Azul (2010/2011) é o trabalho mais recente resultante desta união.
link: <a class=""alt-link"" href=""http://www.myspace.com/bandacaixaazul"" target=""_blank"">www.myspace.com/bandacaixaazul</a></p>

<p>Com o seu investimento, registraremos a aceitação da música brasileira na Europa,na tentativa de realizar apresentações musicais em locais e eventos públicos e privados. Também divulgaremos através do Blog <a class=""alt-link"" href=""http://www.docbrasileuro.blogspot.com"" target=""_blank"">www.docbrasileuro.blogspot.com</a> as informações coletadas em tempo real, tais como: contatos profissionais, remuneração oferecida, repertório executado, satisfação do público, veículos de comunicação receptivos, entrevistas realizadas, entre outras. Estas atividades já integram nosso cotidiano profissional no Brasil, por isso teremos maturidade para conduzir as perguntas e objetividade para buscar as respostas.</p>

<p>Seu apoio na realização do documentário “Brasileuro” fará com que músicos, compositores e intérpretes da música brasileira tenham uma fonte de informações resultante das nossas experiências para se inspirar e também realizar seus sonhos. </p>

<p>Recentemente foi produzido, por amigos e colegas de profissão, um documentário intitulado Profissão: Músico que aborda diversas situações e as dificuldades dos músicos em realizar o que mais sabem fazer, tocar. Segue o link para apreciação: </p>

<p>docprofissaomusico.blogspot.com </p>

<p>Como enfrentamos as mesmas dificuldades de qualquer artista independente, com o seu investimento, nos propomos também a ajudar músicos que estejam passando por dificuldades por lá, seja doando um acessório para seu instrumento ou ajudando na promoção do seu trabalho. </p>

<p>Já possuímos o equipamento de vídeo e áudio de boa qualidade para a captação e edição do material para o documentário, também já temos ótimas e criativas recompensas para lhe oferecer em contrapartida e o valor necessário será destinado aos custos de transporte de ida/volta (passagens aéreas promocionais), hospedagem (albergues e aluguel de quartos), alimentação, transportes internos, e custos operacionais da produção do DVD, por um período de 90 dias.</p>

<p>Acesse a planilha de custos detalhada no blog <a class=""alt-link"" href=""http://www.docbrasileuro.blogspot.com"" target=""_blank"">www.docbrasileuro.blogspot.com</a></p>

<p>As recompensas são cumulativas! Isso mesmo, os maiores apoios acumulam os prêmios dos menores também! As suas recompensas e o seu investimento só acontecerão se o valor total necessário for arrecadado no tempo previsto.</p>

<p>Portanto colabore, acredite, divulgue. OS ARTISTAS BRASILEIROS PRECISAM DE VOCÊ!!!</p>

<p>Agradecemos seu entendimento, apoio e atenção.</p>
",205-documentario-brasileuro,//player.vimeo.com/video/25771276,http://vimeo.com/25771276,"Cinema e Vídeo",13,,https://s3-sa-east-1.amazonaws.com/cdn.br.catarse/uploads/project/video_thumbnail/205/project_thumb_thumb_open-uri20131125-2-1g93bap,https://s3-sa-east-1.amazonaws.com/cdn.br.catarse/uploads/project/video_thumbnail/205/project_thumb_small_open-uri20131125-2-1g93bap,https://s3-sa-east-1.amazonaws.com/cdn.br.catarse/uploads/project/video_thumbnail/205/project_thumb_large_open-uri20131125-2-1g93bap,https://s3-sa-east-1.amazonaws.com/cdn.br.catarse/uploads/project/video_thumbnail/205/project_thumb_video_cover_open-uri20131125-2-1g93bap,0.10344738407427522200,40.0,2,2,failed,aon,finished,"2011-09-06 02:59:59","2011-09-05 23:59:59","2011-07-08 02:59:59","2011-07-07 23:59:59",,t,t,f,60,"{""total"" : 0, ""unit"" : ""seconds""}","{""total"" : 60, ""unit"" : ""days""}",0,"{""city"" : ""São Paulo"", ""state_acronym"" : ""SP"", ""state"" : ""São Paulo""}","{""id"" : 14464, ""name"" : """"}",0,,f,f,0,f,f,f