project_id,id,user_id,name,headline,budget,goal,about_html,permalink,video_embed_url,video_url,category_name,category_id,original_image,thumb_image,small_image,large_image,video_cover_image,progress,pledged,total_contributions,total_contributors,state,mode,state_order,expires_at,zone_expires_at,online_date,zone_online_date,sent_to_analysis_at,is_published,is_expired,open_for_contributions,online_days,remaining_time,elapsed_time,posts_count,address,user,reminder_count,is_owner_or_admin,user_signed_in,in_reminder,total_posts,can_request_transfer,is_admin_role,contributed_by_friends
21065,21065,488489,"Ases de Ouro ""Realizando Sonhos""","""Quem beneficia será sempre o primeiro beneficiado"". Ases de Ouro realizando Sonhos.","<p><del></del></p><p>Os recursos doados através desta plataforma serão destinados para o pagamento da inscrição, estadia e alimentação, num valor total de R$ 5.275,00, despesas com materiais esportivos para treinamento e uniformes no valor total de R$ 15.123,98. O valor adicional R$ 800,00 será destinado para cobrir despesas de confecção e envio das recompensas e R$ 2.755,86 referente a taxa de 13% da plataforma Catarse.</p><p><img src=""https://s3.amazonaws.com/cdn.catarse/uploads/redactor_rails/picture/data/30126/Sem_t_tulo.jpg""></p><br><p><br></p>",24367.0,"<p>A Associação Atlética Ases de Ouro, vem desenvolvendo voluntariamente
um trabalho com adolescentes e jovens da cidade de Campinas/ SP e região, a
dois anos, e configura-se como um projeto de inclusão social e incentivo a
prática do esporte, no caso o futebol de campo, levando os a participarem de
diversas competições no âmbito regional, estadual, nacional e até
internacional, descobrindo novos talentos e oportunizando a realização do sonho
de se tornarem jogador profissional.<br></p><p>A Associação Atlética Ases de Ouro tem disputado vários campeonatos regionais, a Liga Campineira de Futebol Amador, chegando a disputar em maio de 2015 o 12º Torneo Primavera Cittádi Ostuni – Itália, fazendo também amistosos com o A. C. Martina Franca, C. Francavilla e F. C. Bari. Ver <a href=""https://www.facebook.com/ases.deouro"">https://www.facebook.com/ases.deouro</a><span class=""redactor-invisible-space""><br></span></p><p><img src=""https://s3.amazonaws.com/cdn.catarse/uploads/redactor_rails/picture/data/30115/Ostuni.jpg""><br></p><p>Disputa
do 12º Torneo Primavera Cittádi Ostuni – Itália –maio de 2015. </p><p><br></p><p><img src=""file:///C:\\Users\\user\\AppData\\Local\\Temp\\msohtmlclip1\\01\\clip_image002.jpg"" alt=""https://fbcdn-sphotos-d-a.akamaihd.net/hphotos-ak-xat1/v/t1.0-9/11295627_1434373556871199_7674995609992204422_n.jpg?oh=c92c6e77eda87bece484eeea28e6d6f8&oe=5632E25A&__gda__=1441734482_36f44bbaca5a1c1788314661c4fef390""><img src=""file:///C:\\Users\\user\\AppData\\Local\\Temp\\msohtmlclip1\\01\\clip_image002.jpg"" alt=""https://fbcdn-sphotos-d-a.akamaihd.net/hphotos-ak-xat1/v/t1.0-9/11295627_1434373556871199_7674995609992204422_n.jpg?oh=c92c6e77eda87bece484eeea28e6d6f8&oe=5632E25A&__gda__=1441734482_36f44bbaca5a1c1788314661c4fef390""><span class=""redactor-invisible-space""><img src=""https://s3.amazonaws.com/cdn.catarse/uploads/redactor_rails/picture/data/30114/10985357_694389894021802_6871106959559006513_n.jpg""><span class=""redactor-invisible-space""></span></span><br></p><p>Equipe do Ases de Ouro com a equipe do Martina Franca da Itália.</p><p>Vide sobre a homenagem prestada pela Câmara Municipal de Campinas à equipe da Associação Atlética Ases de Ouro.</p><p><iframe width=""500"" height=""281"" src=""//www.youtube.com/embed/Lo7iApoMy4Y"" frameborder=""0"" allowfullscreen=""""></iframe><br></p><p><br></p><p><img src=""https://s3.amazonaws.com/cdn.catarse/uploads/redactor_rails/picture/data/30116/liga.jpg""><br></p><p>Campeão da Categoria Sub 16 da  Liga Campineira de Futebol Amador em 2015.</p><p>A Associação Atlética Ases de Ouro tem na ajuda voluntária, na busca de parcerias e patrocínios, a principal ferramenta para a realização das atividades propostas. Por isso, contamos com a colaboração de todos para a realização do nosso próximo projeto. A participação no <strong> BRAZIL CUP – POÇOS DE CALDAS, </strong>a ser realizado entre os dias 06 e 12 de janeiro de 2016, em Poços de Caldas/ MG, categoria sub-17. </p><p>O principal objetivo da disputa do torneio, é propiciar uma experiência aos nossos atletas e quem sabe a realização de um sonho, o de serem reconhecidos e indicados para algum clube profissional.</p><p>Todo o valor arrecado, será usado para compra de materiais e despesa com inscrição, acomodação, refeição e transporte dos nossos atletas e dirigentes.</p><p>Os responsáveis pelo projeto
são Vlamir Vicente Costa, Fundador e Presidente da Associação, ex-jogador de basquete, Edicelmo Valdeci Costa, Fundador e Secretário da Associação, já trabalhou como educador social e coordenador pedagógico em uma ONG de Campinas, trabalha como voluntário no Projeto Social Basquete IAPI e na LCBR - Liga Campineira de Basquete de Rua, que divulga e realização competições de basquete 3X3, Diego Rodrigo Marques de Oliveira, Técnico da Categoria Sub-17 da Associação, ex-jogador de futebol profissional e Dilglay Marcelo Damião, Diretor de Futebol da Associação, ex-jogador de basquete profissional, jogou 20 anos na Itália, chegando a jogar na seleção Italiana de basquete, conquistando vários títulos, trabalhando também, como voluntário no Projeto Social Basquete IAPI e na LCBR.<br></p>",AsesdeOuro,//www.youtube.com/embed/bMbzzllYJQI,https://youtu.be/bMbzzllYJQI,Esporte,21,https://s3-sa-east-1.amazonaws.com/cdn.br.catarse/uploads/project/uploaded_image/21065/Sem_t_tulo.jpg,https://s3-sa-east-1.amazonaws.com/cdn.br.catarse/uploads/project/uploaded_image/21065/project_thumb_thumb_Sem_t_tulo.jpg,https://s3-sa-east-1.amazonaws.com/cdn.br.catarse/uploads/project/uploaded_image/21065/project_thumb_small_Sem_t_tulo.jpg,https://s3-sa-east-1.amazonaws.com/cdn.br.catarse/uploads/project/uploaded_image/21065/project_thumb_large_Sem_t_tulo.jpg,https://s3-sa-east-1.amazonaws.com/cdn.br.catarse/uploads/project/uploaded_image/21065/project_thumb_video_cover_Sem_t_tulo.jpg,0.04103911027208930100,10.0,1,1,failed,aon,finished,"2016-01-17 01:59:59.999999","2016-01-16 23:59:59.999999","2015-11-17 10:24:33.671922","2015-11-17 08:24:33.671922",,t,t,f,60,"{""total"" : 0, ""unit"" : ""seconds""}","{""total"" : 60, ""unit"" : ""days""}",0,"{""city"" : ""Campinas"", ""state_acronym"" : ""SP"", ""state"" : ""São Paulo""}","{""id"" : 488489, ""name"" : ""Edicelmo V Costa""}",0,,f,f,0,f,f,f