project_id,id,user_id,name,headline,budget,goal,about_html,permalink,video_embed_url,video_url,category_name,category_id,original_image,thumb_image,small_image,large_image,video_cover_image,progress,pledged,total_contributions,total_contributors,state,mode,state_order,expires_at,zone_expires_at,online_date,zone_online_date,sent_to_analysis_at,is_published,is_expired,open_for_contributions,online_days,remaining_time,elapsed_time,posts_count,address,user,reminder_count,is_owner_or_admin,user_signed_in,in_reminder,total_posts,can_request_transfer,is_admin_role,contributed_by_friends
2149,2149,68712,"Montagem Carmin"," Colabore com um projeto cênico que evoca as sensações ","O orçamento para projetos anteriores a 24/02/2015 normalmente pode ser encontrado na descrição acima.",10000.0,"<p>Este ano o Cruor Arte Contemporânea pretende estrear o trabalho Carmin que tem como principal metodologia de criação para a cena a realização de intervenções urbanas desenvolvidas a partir de estudos entorno das obras da artista plática Frida Kahlo e do cineasta Pedro Almodovar, além de pesquisas realizadas em torno de alguns pensadores do teatro e da dança como Antonin Artaud, Anne Bogart, Pina Bausch, entre outros. </p>

<p>Costumamos dizer que nosso trabalho se trata de uma instauração cênica (termo desenvolvido na dissertação de doutorado da coordenadora do projeto) que aporta as mais diversas linguagens artísticas contemporâneas como: artes visuais, dança, música, teatro e perfomance. Carmin não conta uma história, mas provoca sensações naqueles que participam da encenação, fazendo-os “pintarem sua própria obra” a partir de suas percepções pessoais. </p>

<p>&quot;Carmin&quot; consiste na segunda parte da trilogia “Almodovar e Kahlo: Estéticas Constituintes Para Encenações”, coordenada pela Profª.Drª Nara Salles, que teve seu início em Maceió-AL com a encenação “Rojo” realizada pelo “Coletivo Vermelho de Teatro&quot;</p>

<p><strong>Quem faz o Cruor Arte Contemporânea</strong>
  Uma coligação composta por quinze artistas que moram no Rio Grande do Norte e investigam processos de criação, conceitos e procedimentos artísticos ligados às proposições da arte contemporânea, se deslocando desta forma do conceito de arte que esteve veementemente presente durante seis séculos no Ocidente e que era compreendida como uma representação de realidades seja exterior ou interior, nas quais as distorções e ilusões eram apenas reflexos de representações ditas reais. Trabalhamos com as noções de processos criativos colaborativos e de intervenção urbana propondo desta forma uma arte provocativa e catalisadora para novos significados a partir principalmente do olhar e da apropriação de imagens dos filmes de Pedro Almodóvar e da obra de Frida Khalo em interlocução com os cotidianos dos lugares, provocando estranhamentos e questionamentos. As técnicas corpóreo/vocais estudadas são, sobretudo pautadas nos estudos de Antonin Artaud: Teatro da Crueldade; Anne Bogart: Viewpoints, Amilcar Barros: Dramaturgia Corporal, Pina Bausch: Dança Teatro, Hans-Thies Lehmann: Teatro Pós Dramático; Rolando Toro: Biodança; Butho; estudos de performance e técnicas orientais como o Tai Sabaki.</p>

<p><img src=""https://fbcdn-sphotos-d-a.akamaihd.net/hphotos-ak-ash3/421710_326916177404128_869639735_n.jpg"" alt=""""/></p>

<p><strong>Ficha Técnica:</strong>
ENCENAÇÃO, DIREÇÃO E PESQUISA: Nara Salles, Sandro Souza Silva e Mauricio Motta
INTÉRPRETES CRIADORES: Alexandre Américo, Celília Oliveira, Fernanda Estevão, Glênia Freitas, Heloisa Sousa, Josie Pessoa, Nara Salles,  Pablo  Vieira, Pedro Fasano, Sandro Sousa e Silva, Sussa Rodrigues,Yasmin Rodrigues Cabral.
MÚSICA: Fernanda Estevão e Camilo Lemos
DRAMATURGIA: Josie Pessoa, Sandro Sousa Silva e Pablo Vieira.
PREPARAÇÃO CORPÓREO/VOCAL: Nara Salles, Sandro Sousa e Silva, Josie Pessoa, Mauricio Motta, Yasmin Rodrigues Cabral e Sol das Oliveiras Leão (Tai Sabaki)
WEB DESIGN: Josie Pessoa e Marcelo Dantas Lago
DESIGN: Marcelo Dantas Lago
FOTOGRAFIA: Bebel Dantas e Fernando Siviero
CINEMA E VÍDEO: Marcelo Dantas Lago e Johann Jean
ESTUDOS SÓCIOLÓGICOS E ANTROPOLÓGICOS: Nara Salles e Keila Campanelli
ARTES VISUAIS: Sussa Rodrigues
CENOGRAFIA: Nara Salles, Mauricio Motta, Marcelo Dantas Lago
FIGURINOS: Nara Salles, Heloisa Sousa, Sussa Rodrigues e Yasmin Cabral
EXECUÇÃO DE FIGURINOS: Heloisa Sousa, Sussa Rodrigues e Yasmin Cabral
PRODUÇÃO CULTURAL: Heloisa Sousa e Cecília Oliveira
ADMINISTRAÇÃO FINANCEIRA:  Pablo Roberto Vieira Ferreira, Yasmin Rodrigues Cabral
CONSULTORIA DESIGN DE MODA: Carolina Moreira Salles</p>

<p><img src=""https://fbcdn-sphotos-a-a.akamaihd.net/hphotos-ak-ash3/601936_433771706718574_578330779_n.jpg"" alt=""""/></p>

<p><strong>Saiba mais:</strong>
Nosso site: <a class=""alt-link"" href=""http://www.artecruor.com/"" target=""_blank"">http://www.artecruor.com/</a>
Nosso Canal: <a class=""alt-link"" href=""http://www.youtube.com/user/artecruor"" target=""_blank"">http://www.youtube.com/user/artecruor</a>
Nossa fanpage: <a class=""alt-link"" href=""https://www.facebook.com/CruorArteContemporanea"" target=""_blank"">https://www.facebook.com/CruorArteContemporanea</a></p>
",cruor,//player.vimeo.com/video/67152128,http://vimeo.com/67152128,Artes,1,,https://s3-sa-east-1.amazonaws.com/cdn.br.catarse/uploads/project/video_thumbnail/2149/project_thumb_thumb_open-uri20131125-2-5h13vg,https://s3-sa-east-1.amazonaws.com/cdn.br.catarse/uploads/project/video_thumbnail/2149/project_thumb_small_open-uri20131125-2-5h13vg,https://s3-sa-east-1.amazonaws.com/cdn.br.catarse/uploads/project/video_thumbnail/2149/project_thumb_large_open-uri20131125-2-5h13vg,https://s3-sa-east-1.amazonaws.com/cdn.br.catarse/uploads/project/video_thumbnail/2149/project_thumb_video_cover_open-uri20131125-2-5h13vg,13.70000000000000000000,1370.0,35,34,failed,aon,finished,"2013-08-19 02:59:59","2013-08-18 23:59:59","2013-06-19 14:58:34","2013-06-19 11:58:34",,t,t,f,60,"{""total"" : 0, ""unit"" : ""seconds""}","{""total"" : 60, ""unit"" : ""days""}",1,"{""city"" : ""Parnamirim"", ""state_acronym"" : ""RN"", ""state"" : ""Rio Grande do Norte""}","{""id"" : 68712, ""name"" : ""Josie Pontes e Silva Pessoa""}",0,,f,f,1,f,f,f