project_id,id,user_id,name,headline,budget,goal,about_html,permalink,video_embed_url,video_url,category_name,category_id,original_image,thumb_image,small_image,large_image,video_cover_image,progress,pledged,total_contributions,total_contributors,state,mode,state_order,expires_at,zone_expires_at,online_date,zone_online_date,sent_to_analysis_at,is_published,is_expired,open_for_contributions,online_days,remaining_time,elapsed_time,posts_count,address,user,reminder_count,is_owner_or_admin,user_signed_in,in_reminder,total_posts,can_request_transfer,is_admin_role,contributed_by_friends
21764,21764,28714,"Transite @s Brasileir@s e suas Bicicletas ","O fotolivro de retratos sobre o dia-a-dia d@s ciclistas brasileir@s.","<p><img alt="""" src=""http://projetotransite.com.br/wp-content/uploads/2014/11/economia.jpg""></p><p><img src=""https://s3-sa-east-1.amazonaws.com/cdn.br.catarse/uploads/redactor_rails/picture/data/49211/livroprevia.jpg""></p><p>A economia do projeto se baseou em doações através da reserva do livro.<br></p><p>Além
 de ter caráter colaborativo e independente, todo conteúdo gerado pelo 
fotógrafo se transformou num acervo de fotografia com licenças livres. </p><p>Essa é nossa terceira campanha de pré-vendas do livro:</p><p>Além
 do dinheiro das campanhas aqui no Catarse, Felipe contou com a ajuda de
 muitos outros apoiadores Brasil a fora. São vocês que fazem o projeto 
acontecer economicamente. &lt;3 </p><p>Nessa fase
 o orçamento é progressivo e visa captar fundos para a produção e 
impressão da publicação Transite, a cada volta atingida a publicação 
fica mais bonita e relevante.</p><p>VOLTA 1 <strong>R$ 31.000 </strong> <br></p><p> Cobrimos a IMPRESSÃO TIRAGEM DE 1500 <strong></strong>e não pagamos a equipe gráfica.<span class=""redactor-invisible-space""><span class=""redactor-invisible-space""><span class=""redactor-invisible-space""><strong></strong></span></span></span></p><p><span class=""redactor-invisible-space"">VOLTA 2 </span><span class=""redactor-invisible-space""><strong>R$ 33.000</strong></span></p><p><span class=""redactor-invisible-space"">Cobrimos a IMPRESSÃO T1500 + PRODUÇÃO GRÁFICA, o pessoal que vai embelezar e trabalhar na parte gráfica agradece. :)</span></p><p><span class=""redactor-invisible-space"">VOLTA 3 </span><span class=""redactor-invisible-space""><strong>R$ 36.000</strong></span></p><p><span class=""redactor-invisible-space"">OUTRAS RECOMPENSAS PRODUÇÃO E ENVIO, + 1 poster ilustrado (artista convidado[a])</span></p><p>VOLTA 4 <strong>R$ 40.000 </strong></p><p>O PROJETO GRÁFICO T1500 GANHA UMA CAPA MAIS BONITA AINDA.</p><p>VOLTA FINAL <strong>R$100.000</strong></p>PUBLICAMOS 2 VOLUMES AO INVÉS DE UM E MONTAMOS UMA EXPOSIÇÃO DE LANÇAMENTO EM SP.<p>+ as anteriores.<br></p>",31000.0,"<p><br></p><p><img src=""https://s3-sa-east-1.amazonaws.com/cdn.br.catarse/uploads/redactor_rails/picture/data/49214/13429732793_739fecb718_b.jpg""></p><p><img src=""https://s3-sa-east-1.amazonaws.com/cdn.br.catarse/uploads/redactor_rails/picture/data/49212/16201510053_d750df9308_b.jpg""></p><p><img src=""https://s3-sa-east-1.amazonaws.com/cdn.br.catarse/uploads/redactor_rails/picture/data/64047/banner.jpg""></p><p><em>Transite é um livro de fotografias sobre o uso da bicicleta, um documentário com retratos e imagens dos 26 estados do país. Uma publicação densa e artística sobre o povo brasileiro e suas bicicletas. <br></em></p><p><br></p><p><em>O objetivo do projeto é mostrar que existem muitas histórias e significados por trás das 70 milhões de bicicletas apontadas no ultimo censo feito pela ANTP .<br></em></p><p><em> </em><em></em> Para captar o conteúdo o fotógrafo paulistano Felipe Baenninger,  se lançou em uma jornada por todos os estados do Brasil, seu veículos não poderia ser outro usando sua bicicleta o fotografo viajou por mais de 1000 dias percorrendo as estradas brasileiras. </p><p>A principal atividade do projeto foi ouvir os usuários da bicicletas questionando seu significado individual pra cada um deles, ao total foram realizados 523 retratos dos quais 60 entrarão na publicação Transite. </p><p>Um documentário nacional sobre o uso da bicicleta, e agora queremos finalizar esse projeto junto ao publico interessado em entender nuances da bicicleta no Brasil. Uma pesquisa inédita que temos chances juntos de fazer acontecer. <br></p><p>Duas campanhas aqui no Catarse além de investimentos pessoais permitiram o fotógrafo captar o conteúdo, essa campanha visa captar recursos para imprimir e publicar o livro.</p><p> <br></p><p><img alt="""" src=""http://projetotransite.com.br/wp-content/uploads/2013/05/Untitled-1.jpg""><br></p><p>Além dos 60 retratos, o livro contará com histórias da viagem além de um cadernos de textos contextualizando o leitor do panorama do tema no período de 2013 a 2016.<br></p><p><strong>Especificações do Livro</strong>    </p><p>130 paginas</p>  <p>Formato Horizontal <br></p>  <p>Inteiramente colorido</p>  <p>Capa dura, miolo em papel couché. </p><p>Tiragem de 1.000 exemplares. <br></p><strong></strong><p><strong></strong></p><p><strong></strong></p><p><strong></strong><span class=""redactor-invisible-space""></span><br></p><img src=""https://s3-sa-east-1.amazonaws.com/cdn.br.catarse/uploads/redactor_rails/picture/data/49141/CAMPANHAmapa.jpg""><p><br></p><img alt="""" src=""http://projetotransite.com.br/wp-content/uploads/2014/11/recpomensa.jpg""><p><br></p><p>RECOMPENSA<strong> </strong>Adesivo com o Logo<strong> R$ 10 </strong><strong></strong><br></p><p>RECOMPENSA<strong> </strong>Camiseta Algodão  <strong>R$ 50</strong><img src=""https://s3-sa-east-1.amazonaws.com/cdn.br.catarse/uploads/redactor_rails/picture/data/57183/ca.jpg""><br></p><p><br></p><p>RESERVA FOTOLIVRO // Transite: <strong>R$100</strong><img alt="""" src=""http://projetotransite.com.br/wp-content/uploads/2013/05/Untitled-1.jpg""></p><p>Você recebe um exemplar do livro de presente em sua casa. <strong></strong> </p><p>RECOMPENSA<strong>  LIVREIR@  </strong><strong>R$ 350</strong> <br></p><p>5 RESERVAS COM DESCONTO PARA REVENDEDORES DO FOTOLIVRO. </p><p><img src=""https://s3-sa-east-1.amazonaws.com/cdn.br.catarse/uploads/redactor_rails/picture/data/57184/livro_copy.jpg""></p> <p>RECOMPENSAS SURPRESA</p><p>Camise Cuore Veste Bici<br></p><p><a href=""https://s3-sa-east-1.amazonaws.com/cdn.br.catarse/uploads/redactor_rails/picture/data/57728/cuore.jpg"">https://s3-sa-east-1.amazonaws.com/cdn.br.catarse/...</a></p><p>Nosso muito obrigado de coração a todos que deram  suporte até agora a esse livro sonho. </p><p><br></p><p><span class=""st""><strong></strong></span><strong><br></strong></p><p><br></p>",tr3,//www.youtube.com/embed/uivKmUup9F8,https://www.youtube.com/watch?v=uivKmUup9F8,Fotografia,17,https://s3-sa-east-1.amazonaws.com/cdn.br.catarse/uploads/project/uploaded_image/21764/card.jpg,https://s3-sa-east-1.amazonaws.com/cdn.br.catarse/uploads/project/uploaded_image/21764/project_thumb_thumb_card.jpg,https://s3-sa-east-1.amazonaws.com/cdn.br.catarse/uploads/project/uploaded_image/21764/project_thumb_small_card.jpg,https://s3-sa-east-1.amazonaws.com/cdn.br.catarse/uploads/project/uploaded_image/21764/project_thumb_large_card.jpg,https://s3-sa-east-1.amazonaws.com/cdn.br.catarse/uploads/project/uploaded_image/21764/project_thumb_video_cover_card.jpg,25.80645161290322580600,8000.0,79,76,online,flex,published,"2016-10-08 02:59:59.999999","2016-10-07 23:59:59.999999","2016-06-26 19:57:18.662356","2016-06-26 16:57:18.662356",,t,f,t,62,"{""total"" : 12, ""unit"" : ""days""}","{""total"" : 90, ""unit"" : ""days""}",2,"{""city"" : ""São Paulo"", ""state_acronym"" : ""SP"", ""state"" : ""São Paulo""}","{""id"" : 28714, ""name"" : ""Felipe Baenninger""}",10,,f,f,20,f,f,f