project_id,id,user_id,name,headline,budget,goal,about_html,permalink,video_embed_url,video_url,category_name,category_id,original_image,thumb_image,small_image,large_image,video_cover_image,progress,pledged,total_contributions,total_contributors,state,mode,state_order,expires_at,zone_expires_at,online_date,zone_online_date,sent_to_analysis_at,is_published,is_expired,open_for_contributions,online_days,remaining_time,elapsed_time,posts_count,address,user,reminder_count,is_owner_or_admin,user_signed_in,in_reminder,total_posts,can_request_transfer,is_admin_role,contributed_by_friends
22046,22046,491046,Sinais,"Não há obstáculos que possam impedir uma amizade!","<ul><li>67% GRÁFICA</li><li>13% CATARSE</li><li>10% CORREIOS</li><li>10% PREMIAÇÕES</li></ul><p><br></p><p><img src=""https://s3.amazonaws.com/cdn.catarse/uploads/redactor_rails/picture/data/30881/sinais.jpg""></p>",1200.0,"<p><img src=""https://s3-sa-east-1.amazonaws.com/cdn.br.catarse/uploads/redactor_rails/picture/data/36115/sinais_1___1_.gif"" style=""width: 849px; height: 474px;"" width=""849"" height=""474""></p><p><br></p><p>Tem por finalidade a confecção de uma HQ em estilo Mangá com número estimado: 20 a 30 páginas (incluindo extras coloridos).<br></p><p>O projeto ficará pronto em Março/2016.</p><p>Quanto as premiações: O frete será grátis e envio pelos Correios.</p><p>Os responsáveis por este projeto são: Robson Silva (ilustrador)  e Karoline Viana (roteirista).</p><p>Mais informações podem ser obtidas em nossa página no Facebook: Estúdio Sakura ou perfis pessoais: Robson Silva e Karoline Viana.</p><p>Participe de nosso evento no Facebook, convide os amigos:)</p><p> <a href=""https://www.facebook.com/events/534436596731641/"">https://www.facebook.com/events/534436596731641/</a></p><p>Página no Facebook: <a href=""https://www.facebook.com/Sinais-HQ-1485139558459575/"">https://www.facebook.com/Sinais-HQ-148513955845957...</a></p><p><br></p><p><br></p><p><img src=""https://s3.amazonaws.com/cdn.catarse/uploads/redactor_rails/picture/data/30896/2.jpg""></p><p style=""margin-left: 20px;""><br></p><p style=""margin-left: 20px;""><strong><br></strong></p><p><strong>Roteiro:</strong> Karoline Viana</p><p><span class=""text_exposed_show""><strong>Desenho:</strong> Robson Silva</span></p><p style=""margin-left: 20px;"" rel=""margin-left: 20px;""><em>A
trama acontece em uma escola de educação infantil e aborda de forma
divertida, as típicas problemáticas da infância.</em></p><p style=""margin-left: 20px;""><em>Sua
personagem principal, após perceber um desenho que seu colega de
classe fez, faz uso de diferentes artimanhas e traça estratégias
para conseguir falar com ele.</em></p><p style=""margin-left: 20px;""><strong><br></strong></p><p style=""margin-left: 20px;""><strong><br></strong></p><p><img src=""https://s3.amazonaws.com/cdn.catarse/uploads/redactor_rails/picture/data/30897/page__9_.jpg""></p><p><br></p><p><strong>PREMIAÇÕES:</strong></p><p><em><strong>ATÉ R$10,00:</strong> </em>1 PÔSTER A4.</p><p><em><strong>ATÉ R$20,00:</strong> </em>1 PÔSTER A4 + ADESIVOS  + VERSÃO IMPRESSA<span class=""redactor-invisible-space"">.</span></p><p><em><strong>ATÉ R$30,00:</strong> </em>1 POSTER A4 + ADESIVOS + 1 DESENHO A3 (a mão e autografado)  + VERSÃO IMPRESSA<span class=""redactor-invisible-space"">.</span></p><p><em><strong>ATÉ R$40,00:</strong> </em>1 PÔSTER A4 + ADESIVOS + 1 DESENHO A3 (a mão e autografado) + 1 VERSÃO IMPRESSA.</p><p><em><strong>ATÉ R$50,00:</strong> </em>1 PÔSTER A4 + ADESIVOS + 1 DESENHO A3 (a mão e autografado) + 1 VERSÃO IMPRESSA + NOME NOS AGRADECIMENTOS.</p><p><em><strong>R$60,00 OU MAIS:</strong> </em>1 PÔSTER A4 + ADESIVOS + 1 DESENHO A3 (a mão e autografado) + 1 VERSÃO IMPRESSA + NOME NOS AGRADECIMENTOS + 1 CAMISA.</p><p>*FRETE GRÁTIS;</p><p>**ENVIO PELOS CORREIOS.</p><p><br></p><p><img src=""https://s3.amazonaws.com/cdn.catarse/uploads/redactor_rails/picture/data/30898/page__10_.jpg""></p><p><br></p><p><strong>SOBRE OS AUTORES:</strong></p><p><em><strong>KAROLINE VIANA </strong>é professora e escritora, nascida em Rio Bonito. Hoje com 24 anos. Atualmente cursa Pedagogia . Ama animais, livros e inventar histórias. Tem 3 projetos em andamento: o primeiro em poesia, o segundo em prosa e o terceiro em animação.</em></p><p><em><strong>ROBSON SILVA</strong> é ilustrador e animador, nascido em Tanguá. Hoje com 27 anos. Atualmente cursa Tecnologia em Sistemas de Computação. Possui verdadeiro fascínio pelo estilo mangá. Tem vários projetos alguns ainda no forno e prevê ótimas novidades já em 2016.</em></p><p><em><br></em></p><p><em><br></em></p><p><img src=""https://s3.amazonaws.com/cdn.catarse/uploads/redactor_rails/picture/data/30899/page__15_.jpg""></p><p><br></p><p><br></p><p><img src=""https://s3-sa-east-1.amazonaws.com/cdn.br.catarse/uploads/redactor_rails/picture/data/34571/sinais.jpg""></p>",sinais,//player.vimeo.com/video/145791388,https://vimeo.com/145791388,Quadrinhos,7,https://s3-sa-east-1.amazonaws.com/cdn.br.catarse/uploads/project/uploaded_image/22046/page__15_.jpg,https://s3-sa-east-1.amazonaws.com/cdn.br.catarse/uploads/project/uploaded_image/22046/project_thumb_thumb_page__15_.jpg,https://s3-sa-east-1.amazonaws.com/cdn.br.catarse/uploads/project/uploaded_image/22046/project_thumb_small_page__15_.jpg,https://s3-sa-east-1.amazonaws.com/cdn.br.catarse/uploads/project/uploaded_image/22046/project_thumb_large_page__15_.jpg,https://s3-sa-east-1.amazonaws.com/cdn.br.catarse/uploads/project/uploaded_image/22046/project_thumb_video_cover_page__15_.jpg,21.66666666666666666700,260.0,7,7,failed,aon,finished,"2016-02-20 01:59:59.999999","2016-02-19 23:59:59.999999","2015-12-21 19:00:08.421631","2015-12-21 17:00:08.421631",,t,t,f,60,"{""total"" : 0, ""unit"" : ""seconds""}","{""total"" : 60, ""unit"" : ""days""}",0,"{""city"" : ""Rio de Janeiro"", ""state_acronym"" : ""RJ"", ""state"" : ""Rio de Janeiro""}","{""id"" : 491046, ""name"" : ""Robson Silva""}",8,,f,f,0,f,f,f