project_id,id,user_id,name,headline,budget,goal,about_html,permalink,video_embed_url,video_url,category_name,category_id,original_image,thumb_image,small_image,large_image,video_cover_image,progress,pledged,total_contributions,total_contributors,state,mode,state_order,expires_at,zone_expires_at,online_date,zone_online_date,sent_to_analysis_at,is_published,is_expired,open_for_contributions,online_days,remaining_time,elapsed_time,posts_count,address,user,reminder_count,is_owner_or_admin,user_signed_in,in_reminder,total_posts,can_request_transfer,is_admin_role,contributed_by_friends
221,221,8027,"Projeto Abel Contra o Muro","A arte tem o poder da transformação, capaz de ser a ponte para o aprendizado mutuo entre a universidade, o conhecimento e a sociedade.","O orçamento para projetos anteriores a 24/02/2015 normalmente pode ser encontrado na descrição acima.",1700.0,"<p>O projeto teve inicio no ano de 2010 quando os alunos Alexandre B. Borges e João Guilherme Perussi decidiram realizar a produção de um media-metragem como seu ultimo projeto dentro da UNESP-BAURU, o projeto de conclusão de curso (TCC). </p>

<p>Através da participação de Alexandre no Observatório de Educação em Direitos Humanos (OEDH) da Unesp-Bauru o projeto ganhou força, tornando-se, além de uma obra audiovisual, um projeto social. A proposta foi realizar todas as gravações na comunidade periferia bauruense Jardim Nicéia, localizada nas proximidades da Unesp e, em contra partida, fazer com que moradores da comunidade tivessem contato com a produção do filme e pudessem inclusive participar das gravações como figurantes e/ou atores. </p>

<p>A partir daí o projeto ganho força no cenário municipal e passou a contar com as co-poduções da Neurônio Produtora e do Enxame Coletivo; e com as parcerias de distribuição do filme em todo o país através do Clube de Cinema Fora do Eixo e da distribuidora on-line DF5. Além disso o filme terá legenda em 5 idiomas (português, inglês, espanhol, italiano, francês e chinês), podendo assim competir tanto em festivais nacionais como internacionais. </p>

<p>Dessa forma o projeto “Abel contra o muro” busca, através da linguagem cinematográfica, fazer com que uma produção audiovisual seja uma ponte para o aprendizado mutuo entre graduação, extensão universitária e a sociedade. É um projeto ambicioso por sua ousadia em tentar inovar as formas de fazer cinema em Bauru e por propor que a Universidade e a comunidade do Jardim Nicéia trabalhem mais uma vez juntos para que ambas as partes possam crescer.<br>
Já foram gastos mais de R$9.000,00 e no momento com as filmagens já finalizadas estamos em processo de edição/distribuição.</p>

<p>O valor que estamos buscando é de R$1700,00 para a finalização, sonorização e montagem do filme.</p>
",221-projeto-abel-contra-o-muro,//player.vimeo.com/video/25991325,http://vimeo.com/25991325,"Cinema e Vídeo",13,,https://s3-sa-east-1.amazonaws.com/cdn.br.catarse/uploads/project/video_thumbnail/221/project_thumb_thumb_open-uri20131125-2-14wffxj,https://s3-sa-east-1.amazonaws.com/cdn.br.catarse/uploads/project/video_thumbnail/221/project_thumb_small_open-uri20131125-2-14wffxj,https://s3-sa-east-1.amazonaws.com/cdn.br.catarse/uploads/project/video_thumbnail/221/project_thumb_large_open-uri20131125-2-14wffxj,https://s3-sa-east-1.amazonaws.com/cdn.br.catarse/uploads/project/video_thumbnail/221/project_thumb_video_cover_open-uri20131125-2-14wffxj,138.2352941176470600,2350.0,39,35,successful,aon,finished,"2011-08-18 02:59:59","2011-08-17 23:59:59","2011-06-19 02:59:00","2011-06-18 23:59:00",,t,t,f,60,"{""total"" : 0, ""unit"" : ""seconds""}","{""total"" : 60, ""unit"" : ""days""}",0,"{""city"" : ""São Carlos"", ""state_acronym"" : ""SP"", ""state"" : ""São Paulo""}","{""id"" : 8027, ""name"" : ""João Guilherme Perussi""}",0,,f,f,0,f,f,f