project_id,id,user_id,name,headline,budget,goal,about_html,permalink,video_embed_url,video_url,category_name,category_id,original_image,thumb_image,small_image,large_image,video_cover_image,progress,pledged,total_contributions,total_contributors,state,mode,state_order,expires_at,zone_expires_at,online_date,zone_online_date,sent_to_analysis_at,is_published,is_expired,open_for_contributions,online_days,remaining_time,elapsed_time,posts_count,address,user,reminder_count,is_owner_or_admin,user_signed_in,in_reminder,total_posts,can_request_transfer,is_admin_role,contributed_by_friends
22222,22222,499617,"Quero na Escola","Para alunos dizerem o que querem aprender e as pessoas terem um mapa genuíno de como ajudar","<p><br></p><ul><li>Despesas com visitas da equipe Quero na Escola às instituições: <strong>R$ 2.940</strong></li><li>Inserção de mais 100 páginas no site (uma por escola)<span class=""redactor-invisible-space"" style=""line-height: 1.6em;"">:  <strong>R$ 2.760</strong></span></li><li>Atualização do blog e redes sociais para compartilhar informações do projeto<span class=""redactor-invisible-space"" style=""line-height: 1.6em;"">: <strong>R$ 1.500</strong></span></li><li>Investimento em TI para aprimoramento do sistema<span class=""redactor-invisible-space"" style=""line-height: 1.6em;"">: <strong>R$ 3.500</strong></span></li><li>Ligações para voluntários, escolas e alunos<span class=""redactor-invisible-space"" style=""line-height: 1.6em;"">: <strong>R$ 1.700</strong></span></li><li>Brindes<strong>: R$ 3.890</strong></li><li>Apoio à equipe que faz a conexão<span class=""redactor-invisible-space"" style=""line-height: 1.6em;"">: <strong>R$ 4.033</strong></span></li><li>Formalizações e impostos: <strong>R$ 2.030</strong></li><li>Hospedagem do site: <strong>R$ 180</strong></li><li>Comissão do Catarse: <strong>R$ 3.367<br><br></strong></li></ul>",25900.0,"<h3>QUEM SOMOS</h3><p><br>O <a href=""http://www.queronaescola.com.br/"">Quero na Escola!</a> nasceu de uma necessidade social mapeada por Cinthia Rodrigues, Luciana Alvarez, Luísa Pécora e Tatiana Klix durante o Social Good Brasil Lab 2015, em que o projeto foi um dos finalistas. Percebemos que:</p><ul><li>os estudantes têm muitos interesses além do currículo escolar</li><li>a escola já tem muitas demandas e não pode aumentar o atendimento</li><li>as pessoas que querem colaborar com os estudantes não são informadas das oportunidades existentes</li></ul><p><br>Inauguramos
o Quero na Escola! com dois propósitos: dar <span class=""il"">chance</span><span class=""apple-converted-space""> de </span><span class=""il"">protagonismo</span><span class=""apple-converted-space""> aos estudantes de escolas públicas e
fazer um mapa de pedidos para quem quer participar da educação de forma direta.
Em dois meses no ar, mais de 300 alunos foram atendidos presencialmente por voluntários que foram em suas
escolas falar de assuntos que não são parte do currículo, mas eram desejo dos alunos. </span></p><p>Isso tudo ocorreu em São Paulo em apenas quatro
escolas, agora temos pedidos de escolas das cinco regiões do Brasil
para cadastrar, encontrar o voluntário e atender.<strong> PARA ISSO ESTAMOS FAZENDO ESTE FINANCIAMENTO: NOSSA META É TER 100 ESCOLAS COM PÁGINAS PRÓPRIAS E PEDIDOS REGISTRADOS</strong> até o fim do primeiro semestre de 2016.</p><p><br></p><h3>O QUE FAZEMOS</h3><p><strong><br>Incentivamos os alunos a buscar aprendizados além do currículo tradicional</strong> e escolher o que querem aprender. Qualquer estudante de escola pública de qualquer região do País pode entrar no site e registrar seu pedido. Conferimos os dados e colocamos uma página da escola com o pedido no ar. Qualquer pessoa pode acessá-la e, se quiser ensinar, se cadastrar como voluntário.</p><p><strong>Facilitamos a contribuição das pessoas com a educação pública</strong> por meio deste canal direto de divulgação dos interesses dos estudantes. Por último, contatamos a escola e fazemos todo agendamento, poupando ao máximo o tempo do gestor.</p><p>Os encontros ocorrem nas escolas e, muitas vezes, as pessoas criam laços com as instituições ou alunos. Mais que os conteúdos ensinados, <strong>ajudamos a escola a engajar a comunidade.</strong></p><h3><img src=""https://s3.amazonaws.com/cdn.catarse/uploads/redactor_rails/picture/data/31512/IMG_4346.JPG""><br></h3><p><em>oficina de fotografia</em></p><h3><br></h3><h3>O QUE JÁ FIZEMOS</h3><p><br>As oficinas que já ocorreram foram de artesanato, fotografia, contação de história, cerâmica e palestra contra racismo e machismo. A primeira oficina de mágica está agendada para esta semana. Em alguns casos apenas o aluno que fez o pedido recebeu o voluntário, em outros, a atividade acabou sendo estendida para uma turma ou até mesmo para todos os alunos do período.<span></span></p><p><img src=""https://s3.amazonaws.com/cdn.catarse/uploads/redactor_rails/picture/data/31513/cris.jpg""><br><em>uma das três voluntárias de contação de história</em></p><p><img src=""https://s3.amazonaws.com/cdn.catarse/uploads/redactor_rails/picture/data/31514/IMG_6476.JPG""><br><em>palestra contra machismo</em></p><p><img src=""https://s3.amazonaws.com/cdn.catarse/uploads/redactor_rails/picture/data/31515/ceramica_encontro.jpg""><br><em>Oficina sobre cerâmica</em></p><h3><img src=""https://s3-sa-east-1.amazonaws.com/cdn.br.catarse/uploads/redactor_rails/picture/data/34117/magica_para_o_face.jpg""><br></h3><p>oficina-show de truques de mágica</p><h3>REPORTAGENS SOBRE A GENTE:<br><br></h3><p>BBC - Surfe, mágica e feminismo: Alunos de escolas públicas ganham aulas extras dos sonhos<br><a href=""http://www.bbc.com/portuguese/noticias/2015/11/151110_quero_escola_pai.shtml"" target=""_blank"">http://www.bbc.com/portuguese/<wbr>noticias/2015/11/151110_quero_<wbr>escola_pai.shtml</a></p><p>Porvir - Projeto conecta alunos a voluntários e leva novos temas à escola<br><a href=""http://porvir.org/projeto-conecta-alunos-voluntarios-leva-novos-temas-a-escola/"" target=""_blank"">http://porvir.org/projeto-<wbr>conecta-alunos-voluntarios-<wbr>leva-novos-temas-a-escola/</a><br></p><p>O Globo - ""Quero na Escola"":<br><a href=""http://blogs.oglobo.globo.com/antonio-gois/post/protagonistas-e-participativas.html"" target=""_blank"">http://blogs.oglobo.globo.com/<wbr>antonio-gois/post/<wbr>protagonistas-e-<wbr>participativas.html</a><br></p><p>Jornal do Comércio - O que os estudantes de escolas públicas querem aprender<br><a href=""http://jconline.ne10.uol.com.br/canal/cidades/educacao/noticia/2015/11/22/o-que-os-estudantes-de-escolas-publicas-querem-aprender-208874.php"">http://jconline.ne10.uol.com.br/canal/cidades/educ...</a></p><p>Catraca Livre - Site dá voz a estudantes da rede pública e complementa currículo<br><a href=""https://queminova.catracalivre.com.br/instrui/site-da-voz-a-estudantes-da-rede-publica-e-complementa-curriculo/"">https://queminova.catracalivre.com.br/instrui/site...</a></p><p>Uol Educação - 'Tinder' da educação une alunos e voluntários para aulas na rede pública<br><a href=""http://educacao.uol.com.br/noticias/2015/11/30/tinder-da-educacao-une-alunos-e-voluntarios-para-aulas-na-rede-publica.htm"">http://educacao.uol.com.br/noticias/2015/11/30/tin...</a></p><p>Gazeta do Povo - Comunidade ajuda a diversificar ensino nas escolas públicas<br><a href=""http://www.gazetadopovo.com.br/educacao/comunidade-ajuda-a-diversificar-ensino-nas-escolas-publicas-5bxg9y5mhu6mqekdyjeqrm9tz"">http://www.gazetadopovo.com.br/educacao/comunidade...</a></p><p>EBC - Aula de fotografia, feminismo e surf? Plataforma incentiva protagonismo de alunos de escolas públicas<a href=""http://www.ebc.com.br/educacao/2015/12/iniciativa-realiza-pedidos-de-atividades-feitas-por-estudantes-de-escolas-publicas"">http://www.ebc.com.br/educacao/2015/12/iniciativa-...</a><br></p><p>Diário do Grande ABC - Projeto leva ensino não formal às escolas <br><a href=""http://www.dgabc.com.br/Noticia/1676215/projeto-leva-ensino-nao-formal-as-escolas"">http://www.dgabc.com.br/Noticia/1676215/projeto-le...</a></p><p><br><a href=""http://educacao.uol.com.br/noticias/2015/11/30/tinder-da-educacao-une-alunos-e-voluntarios-para-aulas-na-rede-publica.htm""></a></p>",queronaescola,//www.youtube.com/embed/b4vCK6BfkvU,https://youtu.be/b4vCK6BfkvU,Educação,31,https://s3-sa-east-1.amazonaws.com/cdn.br.catarse/uploads/project/uploaded_image/22222/600x340.png,https://s3-sa-east-1.amazonaws.com/cdn.br.catarse/uploads/project/uploaded_image/22222/project_thumb_thumb_600x340.png,https://s3-sa-east-1.amazonaws.com/cdn.br.catarse/uploads/project/uploaded_image/22222/project_thumb_small_600x340.png,https://s3-sa-east-1.amazonaws.com/cdn.br.catarse/uploads/project/uploaded_image/22222/project_thumb_large_600x340.png,https://s3-sa-east-1.amazonaws.com/cdn.br.catarse/uploads/project/uploaded_image/22222/project_thumb_video_cover_600x340.png,108.33976833976833976800,28060.0,360,349,successful,aon,finished,"2015-12-26 01:59:59.999999","2015-12-25 23:59:59.999999","2015-11-24 02:01:31.143872","2015-11-24 00:01:31.143872",,t,t,f,31,"{""total"" : 0, ""unit"" : ""seconds""}","{""total"" : 31, ""unit"" : ""days""}",11,"{""city"" : ""São Paulo"", ""state_acronym"" : ""SP"", ""state"" : ""São Paulo""}","{""id"" : 499617, ""name"" : ""Quero na Escola""}",17,,f,f,187,f,f,f