project_id,id,user_id,name,headline,budget,goal,about_html,permalink,video_embed_url,video_url,category_name,category_id,original_image,thumb_image,small_image,large_image,video_cover_image,progress,pledged,total_contributions,total_contributors,state,mode,state_order,expires_at,zone_expires_at,online_date,zone_online_date,sent_to_analysis_at,is_published,is_expired,open_for_contributions,online_days,remaining_time,elapsed_time,posts_count,address,user,reminder_count,is_owner_or_admin,user_signed_in,in_reminder,total_posts,can_request_transfer,is_admin_role,contributed_by_friends
2243,2243,142596,"Nossos Direitos","Para que a desigualdade entre as pessoas diminuam: por nossos direitos!","O orçamento para projetos anteriores a 24/02/2015 normalmente pode ser encontrado na descrição acima.",30000.0,"<p>Este projeto se vincula à questão dos direitos humanos e sua relação com a comunicação, ou, mais precisamente, com a construção do conhecimento e, por conseguinte, da consciência social a respeito dos direitos que as pessoas têm.</p>

<p>A preocupação que o funda se estabelece na constatação de que a democracia brasileira evoluiu, especialmente depois da Constituição de 1988, para uma afirmação cada vez mais sólida os direitos humanos no Brasil. Na medida em que os atores sociais e políticos, que fizeram a histórica resistência ao regime militar ao longo dos anos 1970, se tornaram os principais governantes do país, a tendência de posicionar o Estado na vanguarda da defesa dos direitos se tornou um fato político e histórico inegável.</p>

<p>Ocorre que há um déficit de informação junto à população em geral a respeito de quais são os direitos que as pessoas de fato têm. Direitos às vezes simples, neste campo, são ignorados e, por isso, descumpridos por pessoas e instituições, em todas as áreas da legislação. Esta é a lacuna que este projeto quer contribuir para cobrir: pretendemos disponibilizar, por diversas formas, físicas e virtuais, um conjunto inicial de 50 direitos em vigor, a fim de que, pela internet e por exibição em escolas publicas e privadas, sobretudo os jovens tomem conhecimento e passem a exercer esses direitos.</p>

<p>Todo o recurso pretendido por este projeto visa custear a produção e a reprodução desse material, que pode ter grande impacto na vida das pessoas que o acessarem. Trata-se, portanto, de um projeto de divulgação social, com alto interesse público.</p>

<p>O valor arrecadado (R$ 30 mil) será utilizado para a produção, finalização e veiculação de 50 vídeos sobre a temática dos Direitos Humanos.</p>

<p>Os primeiros vídeos serão produzidos, finalizados e publicados ainda esse ano, na primeira semana de dezembro.</p>

<p>Entre os parceiros do nosso projeto se destaca o professor Dr. Luiz Signates Professor adjunto da Faculdade de Comunicação e Biblioteconomia da Universidade Federal de Goiás e da Pontifícia Universidade Católica de Goiás, além de consultor empresarial e 
político nas áreas de comunicação política, metodologia da pesquisa e educação. Pós-Doutor em Epistemologias da Comunicação pela Unisinos, Doutor em Ciências da Comunicação pela Universidade de São Paulo, Mestre em Comunicações pela Universidade de Brasília e Especialista em Políticas Públicas pela Universidade Federal de Goiás. Atualmente, é Coordenador do Núcleo de Pesquisas em Comunicação e Política –
NPCP/UFG/CNPq; Membro Fundador das Academias de Letras de Goiânia e de Aparecida de Goiânia; Diretor do Instituto de Comunicação, Cidadania e Educação – Ícone e DiretorPresidente do INSTITUTO SIGNATES – Consultoria, Pesquisa e Editoração Ltda. Seu currilum vitae profissional e docente detalhado encontra-se registrado na Plataforma 
Lattes do CNPq e pode ser acessado pelo link: 
<a class=""alt-link"" href=""http://buscatextual.cnpq.br/buscatextual/visualizacv.do?id=K4794789A4"" target=""_blank"">http://buscatextual.cnpq.br/buscatextual/visualizacv.do?id=K4794789A4</a></p>
",nossosdireitos,//player.vimeo.com/video/68345360,https://vimeo.com/68345360,Educação,31,,https://s3-sa-east-1.amazonaws.com/cdn.br.catarse/uploads/project/video_thumbnail/2243/project_thumb_thumb_open-uri20131125-2-1v7l7vb,https://s3-sa-east-1.amazonaws.com/cdn.br.catarse/uploads/project/video_thumbnail/2243/project_thumb_small_open-uri20131125-2-1v7l7vb,https://s3-sa-east-1.amazonaws.com/cdn.br.catarse/uploads/project/video_thumbnail/2243/project_thumb_large_open-uri20131125-2-1v7l7vb,https://s3-sa-east-1.amazonaws.com/cdn.br.catarse/uploads/project/video_thumbnail/2243/project_thumb_video_cover_open-uri20131125-2-1v7l7vb,0.54333333333333333300,163.0,2,2,failed,aon,finished,"2013-10-07 02:59:59","2013-10-06 23:59:59","2013-08-07 15:26:24","2013-08-07 12:26:24",,t,t,f,60,"{""total"" : 0, ""unit"" : ""seconds""}","{""total"" : 60, ""unit"" : ""days""}",0,"{""city"" : ""Goiânia"", ""state_acronym"" : ""GO"", ""state"" : ""Goiás""}","{""id"" : 142596, ""name"" : ""Jorge Lima""}",0,,f,f,0,f,f,f