project_id,id,user_id,name,headline,budget,goal,about_html,permalink,video_embed_url,video_url,category_name,category_id,original_image,thumb_image,small_image,large_image,video_cover_image,progress,pledged,total_contributions,total_contributors,state,mode,state_order,expires_at,zone_expires_at,online_date,zone_online_date,sent_to_analysis_at,is_published,is_expired,open_for_contributions,online_days,remaining_time,elapsed_time,posts_count,address,user,reminder_count,is_owner_or_admin,user_signed_in,in_reminder,total_posts,can_request_transfer,is_admin_role,contributed_by_friends
2264,2264,163598,"Sapatilhas Ballerini","Sapatilhas incríveis!","O orçamento para projetos anteriores a 24/02/2015 normalmente pode ser encontrado na descrição acima.",16000.0,"<p>Toda mulher tem uma sapatilha no armário. Sapatilhas são fofas, femininas, confortáveis e dão toda a liberdade de que a gente precisa pra trabalhar, passear, brincar e ser feliz.
Nós somos apaixonadas por sapatilhas. Mas não sapatilhas comuns. Sapatilhas incríveis, ricas, lindas, confortáveis, e nada básicas! Daquelas que todo mundo repara, que são amor à primeira vista e à primeira pisada, daquelas difíceis de encontrar!
E por elas serem difíceis de encontrar é que estamos aqui. Porque queremos que elas sejam fáceis de achar. Que estejam disponíveis em qualquer lugar, em grande variedade, e acessível  pra todo mundo. Porque toda mulher merece andar nas nuvens!
A Ballerini vai ser essa marca de sapatilhas! Lindas, super confortáveis e disponíveis em todo território nacional.
As sócias, Cintia e Nat, tem um background forte em grandes empresas de moda e sabem exatamente o que fazer pra levar do Oiapoque ao Chuí toda a qualidade e conforto que só uma sapatilha TOP pode oferecer, a um preço acessível. </p>

<p>E VOCÊ vai ajudar esse sonho a se tornar realidade! Colaborando com qualquer uma das faixas de valor aqui do lado você vai ajudar a gente com a verba que falta para iniciarmos o projeto (registro de marcas, compra de estoque, embalagens, etc).  Essa primeira coleção será vendida em quiosques da Ballerini em São Paulo e depois disso, os modelos vão estar disponíveis no mercado online, nas principais redes calçadistas e nas lojas próprias Ballerini.
Participe deste sonho e apoie o conforto, a liberdade e o empreendedorismo feminino!</p>
",ballerini,//player.vimeo.com/video/69493724,http://vimeo.com/69493724,"Design e Moda",9,,https://s3-sa-east-1.amazonaws.com/cdn.br.catarse/uploads/project/video_thumbnail/2264/project_thumb_thumb_open-uri20131125-2-a8hcfb,https://s3-sa-east-1.amazonaws.com/cdn.br.catarse/uploads/project/video_thumbnail/2264/project_thumb_small_open-uri20131125-2-a8hcfb,https://s3-sa-east-1.amazonaws.com/cdn.br.catarse/uploads/project/video_thumbnail/2264/project_thumb_large_open-uri20131125-2-a8hcfb,https://s3-sa-east-1.amazonaws.com/cdn.br.catarse/uploads/project/video_thumbnail/2264/project_thumb_video_cover_open-uri20131125-2-a8hcfb,110.71875000000000000000,17715.0,80,74,successful,aon,finished,"2013-08-10 02:59:59","2013-08-09 23:59:59","2013-07-10 14:06:17","2013-07-10 11:06:17",,t,t,f,30,"{""total"" : 0, ""unit"" : ""seconds""}","{""total"" : 30, ""unit"" : ""days""}",3,"{""city"" : ""São Paulo"", ""state_acronym"" : ""SP"", ""state"" : ""São Paulo""}","{""id"" : 163598, ""name"" : ""Natalia Peres Rios de Macedo""}",0,,f,f,3,f,f,f