project_id,id,user_id,name,headline,budget,goal,about_html,permalink,video_embed_url,video_url,category_name,category_id,original_image,thumb_image,small_image,large_image,video_cover_image,progress,pledged,total_contributions,total_contributors,state,mode,state_order,expires_at,zone_expires_at,online_date,zone_online_date,sent_to_analysis_at,is_published,is_expired,open_for_contributions,online_days,remaining_time,elapsed_time,posts_count,address,user,reminder_count,is_owner_or_admin,user_signed_in,in_reminder,total_posts,can_request_transfer,is_admin_role,contributed_by_friends
243,243,14553,"Validuaté em Catarse: você faz mais Alegria Girar","Já é tempo de sair do lugar, já é tempo da Alegria Girar. Seja parte desse projeto e faça mais Alegria Girar chegar a todo o país.","O orçamento para projetos anteriores a 24/02/2015 normalmente pode ser encontrado na descrição acima.",5000.0,"<p>Somos a banda Validuaté, de Teresina, Piauí. 7 anos de estrada e dois álbuns lançados: Pelos Pátios Partidos em Festa (2008) e Alegria Girar (2009). A banda é composta por Quaresma (voz), Thiago E (cavaquinho e pandeiros), Júnior Caixão e Vazin (guitarras) Davi Scooby (baixo) e John Well (bateria). </p>

<p>Já tocamos em feiras e festivais em Fortaleza, São Paulo, Brasília e em várias cidades do Piauí, dividindo o palco com grandes artistas como Paralamas do Sucesso, Biquini Cavadão, Bossacucanova, Nação Zumbi, Vanessa da Mata, João Bosco, Jorge Mautner, Zéu Britto, Caetano Veloso dentre outros. </p>

<p>Nosso projeto no exato momento tem como objeto a fabricação de mais 1000 cópias do nosso último álbum, Alegria Girar, disco que fez grande sucesso junto ao público e conta com participações especiais do poeta Ferreira Gullar, do ator, cator e poeta Lirinha, do ator, poeta, cantor e compositor Zéu Britto e do ator, dublador e poeta Isaac Bardavid. </p>

<p>A ideia é fazer um relançamento, com um grande show em Teresina e, dentro das possibilidades, em outras cidades do Brasil. Felizmente o segundo álbum vendeu muito bem, mas infelizmente acabou tudo e muitas pessoas ainda não tem o disco. Mesmo já tendo feito o download, querem muito ter o Alegria Girar, e de preferência autografado. </p>

<p>Nesse projeto vamos juntar nossas vontades: a do público em ter o disco Alegria Girar e a da banda de poder continuar divulgado seu trabalho, para todo o Brasil. O disco deve trazer novos detalhes e provavelmente em outro formato de embalagem. </p>

<p>O valor estimado (atualização da arte + fabricação) é de R$ 5.000,00 </p>

<p>O prazo pensado para a arrecadação é de aproximada mente 30 dias a partir da aprovação do projeto, ou seja até o dia 19 de agosto de 2011.</p>

<p>Contamos com a participação de todos os amigos que nos acompanham e querem muito ter o seu CD Alegria Girar em todo o Brasil.</p>
",validuate-em-catarse-voce-faz-mais-alegria-girar,//player.vimeo.com/video/26787749,http://vimeo.com/26787749,Música,16,,,,,,31.40000000000000000000,1570.0,25,24,failed,aon,finished,"2011-08-30 02:59:59","2011-08-29 23:59:59","2011-07-01 02:59:59","2011-06-30 23:59:59",,t,t,f,60,"{""total"" : 0, ""unit"" : ""seconds""}","{""total"" : 60, ""unit"" : ""days""}",1,"{""city"" : ""Santa Teresinha"", ""state_acronym"" : ""BA"", ""state"" : ""Bahia""}","{""id"" : 14553, ""name"" : """"}",0,,f,f,1,f,f,f