project_id,id,user_id,name,headline,budget,goal,about_html,permalink,video_embed_url,video_url,category_name,category_id,original_image,thumb_image,small_image,large_image,video_cover_image,progress,pledged,total_contributions,total_contributors,state,mode,state_order,expires_at,zone_expires_at,online_date,zone_online_date,sent_to_analysis_at,is_published,is_expired,open_for_contributions,online_days,remaining_time,elapsed_time,posts_count,address,user,reminder_count,is_owner_or_admin,user_signed_in,in_reminder,total_posts,can_request_transfer,is_admin_role,contributed_by_friends
24623,24623,507771,"Lançamento do filme longa-metragem Arinoá ","Patrocine o lançamento desse filme da Amazônia que quer ganhar o mundo...","<ul><li>Autoração e Fabricação de mil DVDs                         R$ 3.450,00</li><li>Layout e impressão de dois banners 240 x 160         R$    300,00</li><li>Impressão de 500 convites formato postal                 R$    350,00</li><li>Cache da atração musical                                             R$    300,00</li><li>Despesas com decoração e Buffet                               R$ 2.100,00</li><li>Equipamento de projeção e som                                  R$ 1.800,00</li><li>Cache da produção                                                        R$ 1.500,00</li><li>Despesas de passagens BelémxGurupáxBelém          R$ 2.200,00</li><li>Comissão do Cartase                                                      R$ 1.560,00</li></ul>",13560.0,"<p><img src=""https://s3-sa-east-1.amazonaws.com/cdn.br.catarse/uploads/redactor_rails/picture/data/35477/arinoa3.jpg""></p><p>UM
FILME QUERENDO GANHAR O MUNDO...</p><p>Um filme só alcança o seu supremo sentido quando se encontra com
o seu público. O filme Arinoá  está pronto, é um bem cultural de Gurupá,
do Pará e do Brasil. Precisa ser exibido-entregue para a comunidade que lhe
originou:  Gurupá, para que depois possa  <em><strong>correr
o mundo</strong></em>, isto é, ser exibido em outras cidades da nossa região
e do Brasil, levando através de sua temática, elenco, paisagens e sons, um
pouco do nosso jeito de ser, de acreditar, de viver.</p><p>A obra foi realizada no ambito do  Projeto Filma Pará que consiste
em realizar filmes longa-metragem, em vídeo digital de alta definição, em
municípios do interior do Estado, mobilizando atores e técnicos capacitados nas
próprias localidades.  Contando com o envolvimento de  quase uma
centena de pessoas entre técnicos, produtores e elenco, Arinoa nasce para o
mundo como uma obra extremamente necessária principalmente nesse momento em que
as matas, ate então preservadas da região de Gurupá, se constituem em alvo
prioritário de grandes madeiros, que  ávidos de lucros, destroem toda vida
que encontram pela frente.</p><p>SINOPSE:</p><p>É a história de uma comunidade que, motivada por alguns
acontecimentos misteriosos, toma consciência da importância da preservação do
seu meio ambiente e se organiza para lutar em defesa da natureza. Arinoá é um
grito de alerta, do coração da Amazônia, contra o desmatamento predatório que
enriquece uns poucos e precariza ainda mais a condição de pobreza em que já
vive grande parte dos amazônidas.</p><p><br>
Roteiro e direção: Paulo Miranda/ Direção de fotografia: Sandro
Miranda/ Direção de Arte: Letícia Thays/ Direção de Produção:
Cristóvão Alho/ Pesquisa: Lino Ramos/ Produção Executiva: Rutinéa
Miranda / Produção: Lux Amazônia  Produções Cinematográficas</p><p> PROGRAMAÇÃO DO EVENTO</p><p>        <strong>Pre-lançamento-coquetel</strong></p><p>        Data: 22/abril/2016
(quinta-feira)</p><p>        Local: Casa da
Cultura de Gurupá</p><p>        Horário: 19:00h</p><p>        Público: Elenco,
equipe técnica/produção, apoiadores</p><p>        Programação:</p><p>A)   Apresentação do
elenco e técnica</p><p>B)   Entrega dos DVDs
para participantes, apoiadores e gestores</p><p>                 
                     
      C) Exibição do trailer </p><p>                 
                     
      D) Apresentação musical/coquetel</p><p><strong>        Lançamento</strong></p><p>        Data: 23/abril/2016
(sábado)</p><p>        Local: Ginásio de
Esportes de Gurupá </p><p>        Horário: 19:00h</p><p>        Público: Comunidade
em geral, Elenco, equipe técnica/produção, apoiadores</p><p>        Programação:</p><p>A)   Apresentação do
elenco e técnica</p><p>B)   Fala do diretor
e Representação da gestão </p><p>                 
                     
       C) Exibição do filme</p><p>  <strong>      Encontro de
avaliação </strong></p><p><strong></strong><span class=""apple-converted-space""><strong> </strong></span>Data: 24/abril/2016     
 </p><p>         Local: Comunidade do rio
Arinoa </p><p>        Hora: 9:00h     
 </p><p>        Publico: Todos os envolvidos na
realização do filme e organização do lançamento,        
    membros diversos da comunidades interessados no assunto.</p><p><br></p><p><img src=""https://s3-sa-east-1.amazonaws.com/cdn.br.catarse/uploads/redactor_rails/picture/data/35478/56641292.jpg""><br></p><p>A cidade de Gurupá está situada as margem do rio Amazonas, aproximadamente a 350 kms distante de Belem, capital do estado do Pará. Conta com 392 anos de fundação  e uma população estimada em  30 mil habitantes.</p><p><img src=""https://s3-sa-east-1.amazonaws.com/cdn.br.catarse/uploads/redactor_rails/picture/data/35479/mapa_gurupa.JPG""></p><br><p><br></p><p><br></p><p><br></p><p><br></p><p><br></p>",project_24623,//www.youtube.com/embed/XbIYHY-OhpQ,https://www.youtube.com/watch?v=XbIYHY-OhpQ,"Cinema e Vídeo",13,https://s3-sa-east-1.amazonaws.com/cdn.br.catarse/uploads/project/uploaded_image/24623/arinoá2.jpg,https://s3-sa-east-1.amazonaws.com/cdn.br.catarse/uploads/project/uploaded_image/24623/project_thumb_thumb_arinoá2.jpg,https://s3-sa-east-1.amazonaws.com/cdn.br.catarse/uploads/project/uploaded_image/24623/project_thumb_small_arinoá2.jpg,https://s3-sa-east-1.amazonaws.com/cdn.br.catarse/uploads/project/uploaded_image/24623/project_thumb_large_arinoá2.jpg,https://s3-sa-east-1.amazonaws.com/cdn.br.catarse/uploads/project/uploaded_image/24623/project_thumb_video_cover_arinoá2.jpg,0,0,0,0,failed,aon,finished,"2016-03-23 02:59:59.999999","2016-03-22 23:59:59.999999","2016-01-22 21:25:00.166925","2016-01-22 19:25:00.166925",,t,t,f,60,"{""total"" : 0, ""unit"" : ""seconds""}","{""total"" : 60, ""unit"" : ""days""}",0,"{""city"" : ""Gurupá"", ""state_acronym"" : ""PA"", ""state"" : ""Pará""}","{""id"" : 507771, ""name"" : ""Lux Amazônia ""}",1,,f,f,0,f,f,f