project_id,id,user_id,name,headline,budget,goal,about_html,permalink,video_embed_url,video_url,category_name,category_id,original_image,thumb_image,small_image,large_image,video_cover_image,progress,pledged,total_contributions,total_contributors,state,mode,state_order,expires_at,zone_expires_at,online_date,zone_online_date,sent_to_analysis_at,is_published,is_expired,open_for_contributions,online_days,remaining_time,elapsed_time,posts_count,address,user,reminder_count,is_owner_or_admin,user_signed_in,in_reminder,total_posts,can_request_transfer,is_admin_role,contributed_by_friends
24678,24678,138969,"Ajude o Mateus!","Me ajude a recuperar o equipamento fotográfico roubado e voltar a trabalhar! Serei sempre grato!","<p>- Câmera Canon 6d = R$ 6.000,00<br></p><p>- Lente Canon 50mm 1.4 = R$ 1.300,00</p><p>- Lente Sigma 15mm 2.8 = R$ 3.000,00</p><p>- Bateria extra = R$ 300,00</p><p>- 2 cartões de memória 64gb = R$ 400,00</p><p>- Mochila = R$ 250,00</p><p>EQUIPAMENTOS = R$ 11.250,00</p><p>Seguro = R$ 1.000,00</p><p>Catarse (13%) = R$ 1.592,50</p><p><br></p><p>TOTAL = R$ 13.842,50<br></p>",13842.5,"<p class=""fontsize-large""><strong>Este projeto está suspenso e não pode mais receber apoios. As 38 pessoas que já efetuaram um apoio serão notificadas até o dia 16/02 e receberão o reembolso integral do valor destinado ao projeto</strong><br></p><hr><p><strong>Olá, meu nome é Mateus Lima e eu preciso de sua ajuda!</strong></p><p>No dia 13/01/2016, em viagem a Porto Alegre, roubaram o carro no qual estava minha
mochila de equipamentos fotográficos.<br>
Nela tinha uma câmera profissional, duas lentes, cartões de memória, baterias e
uma série de fotos impressas, as quais eu vendia em praças e feiras.</p><p>Sou fotógrafo, vivo em São Paulo e meu trabalho depende diretamente desse equipamento.</p><p>Agora, desesperado com essa situação, já que não tenho dinheiro suficiente
para repor o equipamento, peço sua ajuda para levantar o necessário para a
compra dos mesmos itens roubados.</p><p><strong>Mas por que você contribuiria com o meu trabalho?</strong></p><p>Em 2013 eu deixei minha antiga profissão (fonoaudiólogo) para me dedicar à
fotografia. Inicialmente com a crença e a vontade de construir projetos que, de alguma maneira, contribuissem para as transformações sociais que desejo ver no mundo. </p><p>Então, com uma amiga, criei um coletivo chamado ALÉM, através do qual idealizamos e realizamos projetos que se tornaram
conhecidos, dada a importância dos temas, como o PELOS PELOS, ALÉM DO GÊNERO,
AFETO, CASULOS E VIVÊNCIAS COLETIVAS DE NUDEZ. Todos esses projetos aconteceram durante
um ano, um ano e meio. E todos eles financiados do próprio bolso de nós
realizadorxs, exceto em algumas situações nas quais pedimos contribuições dos participantes destas vivências. Buscando sempre uma maneira de garantir a independência.<span></span></p><p><em>* Não consegui inserir imagens do meu trabalho aqui ainda, pois estou em viagem, acessando a internet pelo celular. Então não deixe de clicar no link acima para ver minhas fotografias =)</em><br></p><p>Mas, como viver de arte ou de projetos autorais como esses é praticamente
impossível, minha capacidade financeira para continuá-los diminuiu a ponto de
não dar seguimento.</p><p>Tive então que concentrar em fazer trabalhos comerciais ainda na esperança
de voltar a ter condições de retomar essas ideias e voltar a construir projetos
de transformação social. Estou praticamente há um ano sem
produzir trabalhos autorais, buscando reestabelecer a segurança financeira que desejo, perdida pela dedicação aos projetos citados.</p><p>Mas consegui fazer alguns experimentos novos, agora com video, que você pode ver abaixo:</p><p>[Esses vídeos foram removidos por conta da suspensão do projeto]</p>Conto minha história para contextualizar e explicar o motivo de eu não ter, atualmente,<p>dinheiro suficiente para repor esse material e continuar trabalhando.</p><p>É nesta situação, que, de peito aberto, recorro a vocês, minha rede de contatos, com o intuito de recuperar minha possibilidade de trabalhar.</p><p>Sei que é uma causa bastante individual. Causa esta que sempre teve e sempre terá muita dedicação à coletividade, utilizando o potencial da fotografia como instrumento para transformação social.</p><p>Torço muito para que você entenda o quão importante recuperar este equipamento é para mim.</p><p>Agradeço desde já ao Catarse por abrir as portas para essa campanha e
incluí-la na fase de testes do Catarse Flex.</p>",limamateus,,,Fotografia,17,https://s3-sa-east-1.amazonaws.com/cdn.br.catarse/uploads/project/uploaded_image/24678/Screen_Shot_2016-02-12_at_7.44.00_PM.png,https://s3-sa-east-1.amazonaws.com/cdn.br.catarse/uploads/project/uploaded_image/24678/project_thumb_thumb_Screen_Shot_2016-02-12_at_7.44.00_PM.png,https://s3-sa-east-1.amazonaws.com/cdn.br.catarse/uploads/project/uploaded_image/24678/project_thumb_small_Screen_Shot_2016-02-12_at_7.44.00_PM.png,https://s3-sa-east-1.amazonaws.com/cdn.br.catarse/uploads/project/uploaded_image/24678/project_thumb_large_Screen_Shot_2016-02-12_at_7.44.00_PM.png,https://s3-sa-east-1.amazonaws.com/cdn.br.catarse/uploads/project/uploaded_image/24678/project_thumb_video_cover_Screen_Shot_2016-02-12_at_7.44.00_PM.png,0,0,0,0,failed,aon,finished,"2016-02-15 02:00:00","2016-02-15 00:00:00","2016-02-13 02:00:00","2016-02-13 00:00:00",,t,t,f,2,"{""total"" : 0, ""unit"" : ""seconds""}","{""total"" : 2, ""unit"" : ""days""}",2,"{""city"" : ""São Paulo"", ""state_acronym"" : ""SP"", ""state"" : ""São Paulo""}","{""id"" : 138969, ""name"" : ""Mateus Lima""}",1,,f,f,2,f,f,f