project_id,id,user_id,name,headline,budget,goal,about_html,permalink,video_embed_url,video_url,category_name,category_id,original_image,thumb_image,small_image,large_image,video_cover_image,progress,pledged,total_contributions,total_contributors,state,mode,state_order,expires_at,zone_expires_at,online_date,zone_online_date,sent_to_analysis_at,is_published,is_expired,open_for_contributions,online_days,remaining_time,elapsed_time,posts_count,address,user,reminder_count,is_owner_or_admin,user_signed_in,in_reminder,total_posts,can_request_transfer,is_admin_role,contributed_by_friends
250,250,16872,"Toma Jeito de Gente","""Quando João fala de Maria, conhecemos mais João do que Maria.""","O orçamento para projetos anteriores a 24/02/2015 normalmente pode ser encontrado na descrição acima.",8900.0,"<p>TOMA JEITO DE GENTE
MONÓLOGO DE RICARDO FAGUNDES
RETRATO DA SOLIDÃO DE UM HOMEM</p>

<p>O mês de setembro de 2011 será marcado com a estréia do espetáculo Toma Jeito de Gente: Monólogo do ator Ricardo Fagundes, (O Grande Passeio, Da Ponta da Língua a Ponta do Pé, A Bofetada, Capitães da Areia), com texto e primeira direção de Jarbas Oliver (Siricotico, As aventuras do Maluco Beleza, Galileu). Este espetáculo é fruto da parceria dos dois artistas que trabalham juntos desde o ano 2000.</p>

<p>Toma Jeito de Gente, quem nunca ouviu falar nesta expressão? Muitas vezes usada como ferramenta disciplinar, com crianças, deixando claro que o seu comportamento não se enquadra em um nível “aceitável”. Imaginemos agora uma criança que cresceu ouvindo isso, sem saber o que havia de errado em seu próprio comportamento. Alguém que cresceu sendo tolhido em suas vontades e ações, fazendo com que um grande sentimento de rejeição tomasse conta de si. A personagem é um homem sozinho, que por alguma razão consegue ficar em casa o dia todo, vivendo a vida de todos que moram no mesmo prédio que ele. O conflito interior da personagem revela seus próprios princípios e preconceitos, transformando a solidão na sua única e fiel companhia. </p>

<p>Trata-se de um assunto contemporâneo, onde todos os dias nos batemos, como por exemplo, notícias acerca das diferenças. Sejam estas escolhas religiosas, sejam escolhas afetivas, sejam modos de se apresentar e por aí uma imensidade de situações. Situações que muitas vezes nos levam à violência, à intolerância e no caso aqui à solidão.</p>

<p>Quando uma pessoa vira para outra e diz: “Toma jeito de gente”, ela já coloca a outra num estado de que esta não é gente. Até que ponto somos tolerantes com o outro? Se não somos gente, somos o quê? São alguns dos questionamentos que este espetáculo traz à tona. </p>

<p>Além da direção de Jarbas Oliver, a ficha técnica se completa com a assistência de direção e fotografia de Nilson Rocha, iluminação de Fernanda Paquelet e produção da Quatro Produções Artísticas. </p>

<p>Para fazer esse sonho virar realidade, chegamos a um montante de R$8.900,00 necessários para montagem de cenário, figurino e pauta de teatro do espetáculo.</p>

<p>Acreditamos que a Arte é feita por pessoas! Por isso convidamos todos para fazer parte desse sonho com a gente! &quot;Sonho que sonha junto, é realidade&quot;!!</p>

<p>Venham sonhar com a gente!!</p>

<p>Muitos beijos,</p>

<p>Equipe Toma Jeito de Gente!!</p>
",toma-jeito-de-gente,//player.vimeo.com/video/27103985,http://www.vimeo.com/27103985,"Teatro e Dança",19,,https://s3-sa-east-1.amazonaws.com/cdn.br.catarse/uploads/project/video_thumbnail/250/project_thumb_thumb_open-uri20131125-2-xdmpt3,https://s3-sa-east-1.amazonaws.com/cdn.br.catarse/uploads/project/video_thumbnail/250/project_thumb_small_open-uri20131125-2-xdmpt3,https://s3-sa-east-1.amazonaws.com/cdn.br.catarse/uploads/project/video_thumbnail/250/project_thumb_large_open-uri20131125-2-xdmpt3,https://s3-sa-east-1.amazonaws.com/cdn.br.catarse/uploads/project/video_thumbnail/250/project_thumb_video_cover_open-uri20131125-2-xdmpt3,1.06741573033707865200,95.0,4,4,failed,aon,finished,"2011-09-07 02:59:59","2011-09-06 23:59:59","2011-07-09 02:59:59","2011-07-08 23:59:59",,t,t,f,60,"{""total"" : 0, ""unit"" : ""seconds""}","{""total"" : 60, ""unit"" : ""days""}",0,"{""city"" : ""Salvador"", ""state_acronym"" : ""BA"", ""state"" : ""Bahia""}","{""id"" : 16872, ""name"" : """"}",0,,f,f,0,f,f,f