project_id,id,user_id,name,headline,budget,goal,about_html,permalink,video_embed_url,video_url,category_name,category_id,original_image,thumb_image,small_image,large_image,video_cover_image,progress,pledged,total_contributions,total_contributors,state,mode,state_order,expires_at,zone_expires_at,online_date,zone_online_date,sent_to_analysis_at,is_published,is_expired,open_for_contributions,online_days,remaining_time,elapsed_time,posts_count,address,user,reminder_count,is_owner_or_admin,user_signed_in,in_reminder,total_posts,can_request_transfer,is_admin_role,contributed_by_friends
25026,25026,32694,"Bora pra Cuba!","Financiamento Colaborativo para o Mestrado em Documentário do Rodrigo em Cuba!","<p><strong>47.000</strong> - Valor do Curso (11.500 USD, sendo 4,09 R$ equivalente a 1 USD), </p><p>Os pagamentos devem seguir os seguintes prazos:</p><p>Pre-matrícula: 1.800 USD. A pagar de 12-20 de Janeiro 2016.</p><p>Módulo 1: 3100 USD. Data limite de pagamento 25/01/2016.</p><p>Módulo 2: 3100 USD. Data limite de pagamento 25/04/2016.</p><p>Módulo 3: 3500 USD. Data limite de pagamento 25/06/2016.</p><p>Outros gastos : Estou arcando com os custos do passaporte, visto, passagem, taxas, impostos, traslados e alimentação fora da EICTV. Se a meta inicial for alcançada, cobrirei estes gastos e depois começarei a investir a verba na realização do filme.</p><p><strong>6.000</strong> - Porcentagem Catarse (esse valor já foi arrecadado em uma permuta)<br></p><p>A escola fornece Hospedagem e Alimentação durante todo o curso.</p><p>Como as aulas iniciam em 1 de fevereiro, estou indo na fé com a cara, a coragem e empréstimos solidários, em busca desse sonho.</p><p>Conseguirei resgatar qualquer valor arrecadado, pois o projeto está na categoria Catarse Flex.</p><p><strong>Para apoios diretos:</strong></p><p>Banco do Brasil, Agência 6941-8, Conta Corrente 16766-5, Rodrigo Santos Sousa, ro.edicao@gmail.com</p>",47000.0,"<h3>PRAZO ACABANDO!</h3><h3 style=""text-align: justify;""><p style=""line-height: 27px; color: rgb(121, 128, 139);""><span class=""redactor-invisible-space"">Por meio de um diário em seu perfil no facebook (<a href=""https://www.facebook.com/rodrigo.sousaesousa"" rel=""color: rgb(64, 154, 222);"">https://www.facebook.com/rodrigo.sousaesousa</a>) Rodrigo segue relatando seu dia-a-dia como estudante de cinema, tal como suas aventuras na ilha de Fidel, Cuba. A menos de um mês para o final da Maestría, Rodrigo, depois de empréstimos bancários, pessoais, permutas e parcerias, ainda precisa de dinheiro <strong>(aprox</strong><strong>. U$D 3 mil)</strong> <span class=""redactor-invisible-space"">para finalizar o curso. Colaborando na campanha, você será um dos apoiadores do Rodrigo, do Coletivo Mundo em Foco e do filme ""Gincanas"".</span></span></p></h3><h3 style=""text-align: justify;"" rel=""text-align: justify;"">BORA PRA CUBA!</h3><p style=""text-align: justify;"">#BORAPRACUBA é uma campanha com o Intuito ajudar o Rodrigo Sousa & Sousa em seus estudos em Cuba. Ele, representante do Coletivo Mundo em Foco, inscreveu o <strong>Gincanas </strong>(projeto de documentário sobre a Vila Santa Inês) e foi um dos selecionados na primeira turma da <a class=""profileLink"" href=""http://www.eictv.org/maestrias/desarrollo-de-proyecto-de-documental/"" data-hovercard=""/ajax/hovercard/page.php?id=1147580941935862"" aria-owns=""js_13"" aria-haspopup=""true"" aria-describedby=""js_14"" id=""js_15"">Maestría Desarrollo de Proyecto Documental, EICTV Cuba</a> (Mestrado de desenvolvimento em projeto de Documentário) da Escuela de Internacional de Cine y TV - EICTV (<a href=""http://www.eictv.org/"">http://www.eictv.org/</a><span class=""redactor-invisible-space"">), a renomada escola de cinema de San Antonio de los Baños em Cuba. </span></p><p style=""text-align: justify;"" rel=""text-align: justify;""><span class=""redactor-invisible-space""></span></p><h3>QUEM É RODRIGO?</h3><p style=""text-align: justify;"" rel=""text-align: justify;"">Baiano, 30 anos, reside em São Paulo desde os 9 e já fez de tudo um pouco.<br><span class=""redactor-invisible-space""></span></p><p style=""text-align: justify;"" rel=""text-align: justify;""> Vendeu veneno de rato, planos odontológicos, almofadas termoterapicas e descobriu que não sabia vender. Foi oficce boy, mas desistiu de correr! Nunca deixou de ler, de escrever e de sonhar...<br> A arte o acompanhou desde a infância: O tio, serigrafista, o padrasto artista.<br> Fez inúmeros cursos montado numa ""magrela"" e acabou pedalando pra arte!<br>Acabou mantendo uma relação poligâmica com a fotografia, o cinema e a poesia.<br> Ainda ontem não tem idéia do amanhã, sempre atrasado hoje, faz poesia em violinos. Seu romantismo se estressa na capital que hoje o sufoca. Angustiado, procura qualquer coisa interessante pra fazer por aqui, mesmo que isso seja fugir para outro lugar...</p><p><img src=""https://s3-sa-east-1.amazonaws.com/cdn.br.catarse/uploads/redactor_rails/picture/data/39786/eu.jpg""></p><p style=""text-align: justify;""><span class=""redactor-invisible-space"">
<a href=""https://www.facebook.com/rodrigo.sousaesousa?fref=ts"">Rodrigo Sousa & Sousa (Santos Sousa)</a> nasceu em Itabuna-BA, Brasil, dia 26 de
abril de 1986. É Técnico em Edição
pelo <a href=""http://www.institutocriar.org/"">Instituto Criar de TV e Cinema</a> e em Gestão Pública pela Etec Cepam. É Tecnólogo em Produção Audiovisual pela UNIP e pós-graduado em Cinema Documentário
pela Fundação Getúlio Vargas. Trabalhou em diversas produtoras, entre elas, Lux
Filmes, Farol Filmes e Teleimage, como editor e finalizador de publicidade,
vídeos institucionais e vários longas-metragens. Foi educador de edição nas
Oficinas Tela Brasil e de Imagem e Jornal </span>nas Unidades da Fundação Casa
(ex-Febem). Ministrou aulas de Foto, Vídeo e Educomunicação na Associação Casa do Zezinho, no Instituto
Criar de TV, Cinema e Novas Mídias (Programa Vídeo na Escola) e na Fundação Gol
de Letra. Ministrou e desenvolveu oficinas e projetos em diversos locais, coletivos e projetos como ""Você Repórter da Periferia-SP"", ""Foto na Lata - A História de Perus, Sarau dos Mesquiteiros, Projeto Curumim Sesc Itaquera, Mês da Fotografia Sesc Pinheiros, Sarau na Cozinha, Sarau Ritmo e Poesia (São Paulo) - Feria del Libro de Buenos Aires, Lo primitivo es primordial - MamBA - (Buenos Aires), Quilombo do Cambury - (Ubatuba), ""Click na Grota - (Maceió-AL), Festival Curta 8 - (Curitiba-PR) e Festival OjoAlSancocho - (Bogotá-COL). Desde 2011 é Professor na Etec
Jornalista Roberto Marinho, tendo orientado os curtas  <a href=""https://www.facebook.com/verdetapete/?ref=ts&fref=ts"">""Tapete Verde""</a>, <a href=""https://www.facebook.com/mediametragemoestranho/?ref=ts&fref=ts"">""O Estranho""</a>, <a href=""https://www.facebook.com/O-Som-da-ZS-311476335672196/"">""O Som da Zona Sul""</a>, <a href=""https://www.facebook.com/usrn72/?ref=ts&fref=ts"">""USRN72""</a>, <a href=""https://www.facebook.com/docCicloUrbano/?ref=ts&fref=ts"">""Ciclo Urbano""</a>, <a href=""https://www.facebook.com/diversosfeitos/?ref=ts&fref=ts"">""Diversos Feitos""</a>, <a href=""https://www.youtube.com/watch?v=1FBqccYu_rQ"">""Ruídos Urbanos""</a>, <a href=""https://www.facebook.com/F%C3%AAnix-Produ%C3%A7%C3%B5es-896792420396878/"">""Food Truck e a Gourmetização da comida de rua""</a> e <a href=""https://www.facebook.com/noritmodasobas/?ref=ts&fref=ts"">""No Ritmo das Obás""</a><a href=""https://www.facebook.com/noritmodasobas/?ref=ts&fref=ts""></a>, que estão sendo selecionados em diversos festivais nacionais e internacionais. Em meio a todo caos é poeta, autor do livro e projeto literário <a href=""https://www.facebook.com/poemasemfoco/"">""Poemasemfoco""</a> (2013).</p><p style=""text-align: justify;"" rel=""text-align: justify;""><span class=""redactor-invisible-space""></span></p><p style=""text-align: justify;"" rel=""text-align: justify;""><span class=""redactor-invisible-space""><iframe width=""500"" height=""281"" src=""//www.youtube.com/embed/igi2jrs2ipM"" frameborder=""0"" allowfullscreen=""""></iframe></span></p><p style=""text-align: justify;"" rel=""text-align: justify;""><span class=""redactor-invisible-space""></span>É co-fundador, junto com Ozana Sousa em 2004 do premiado grupo <a href=""http://facebook.com/mundoemfoco"">Mundo em Foco</a>. Do coletivo, destacam-se os projetos
Click na Lata e Cia…, de oficinas de fotografia, o Cineclube Mundo em Foco (Cine Cobertura e Cine Tiquinho), a NUVEM - Núcleo de Vídeos em Movimento, de Oficinas de Audiovisual, o Casas e Cafofos, de projetos de design a preços populares, a autoração de DVDs e a militância junto ao Coletivo de Vídeo Popular- SP, a Bicicloteca, de distribuição e empréstimo de livros, o Jornal Comunitário Lê que eu te conto, A pré-produção do
Festival Entretodos de Cinema sobre Direitos Humanos, a co-realização da Semana por la Soberania Audiovisual no Brasil, A produção independente e a organização do Super
Off, Festival Internacional de Cinema Super 8 de São Paulo.</p><p style=""text-align: justify;"" rel=""text-align: justify;""><iframe width=""500"" height=""281"" src=""//www.youtube.com/embed/CfNCQN8gNes"" frameborder=""0"" allowfullscreen=""""></iframe></p><p style=""text-align: justify;""><span class=""redactor-invisible-space""></span></p><h3 style=""text-align: justify;"" rel=""text-align: justify;"">O QUE É O CURSO?</h3><p style=""text-align: justify;""><img src=""https://s3-sa-east-1.amazonaws.com/cdn.br.catarse/uploads/redactor_rails/picture/data/36476/eictv_doc.jpg""></p><strong>De</strong><strong>sarrollo Proyecto de Documental (Desenvolvimento de projeto de Documentário)</strong><p style=""text-align: justify;"">A Cátedra de Documentário da EICTV forma diretores especializados em documentário há 15 anos. Os filmes feitos, são selecionados celebrados e premiados em festivais de todo o mundo. As obras mais recentes dos alunos egressos tem competido nos festivais de Cannes, Berlim, Rotterdam, IDFA, Visions du Réel, San Sebastián.... além de serem exibidos em centros de arte prestigiados como o MoMA em Nova Iorque e o Centro Georges Pompidou de Paris.<span class=""redactor-invisible-space""></span></p><p style=""text-align: justify;"">Nesse caminho é imprescindível a liderança e a guia de professores e profissionais do panorama cinematográfico internacional, que até hoje só compartilhavam formação para os alunos do Curso Regular da escola na Especialidade de Documentário (3 anos de duração).</p><p style=""text-align: justify;"">A abertura deste programa imersivo e intensivo,é para que estudantes de todo o mundo,possam criar seus projetos de documentário com o apoio de formadores, diretores e produtores de de documentário de grande prestígio, vindos de Universidades do mundo inteiro: HEAD em Genebra, FEMIS em Paris, o Centro de Capacitación Cinematográfica de México DF, o New York State College e a Universidad de York no Canadá.</p><p style=""text-align: justify;""><strong>Duração do Curso: </strong></p><p style=""text-align: justify;"">De 1 de fevereiro até 30 de julho de 2016<br></p><p style=""text-align: justify;""><strong>Valores, Prazos e Conta:</strong></p><p style=""text-align: justify;""><span class=""aspect-name""></span>Pre-matrícula: 1.800 USD. A pagar de 12-20 de Janeiro 2016.</p><p style=""text-align: justify;"" rel=""text-align: justify;"">Módulo 1: 3100 USD. Data limite de pagamento 25/01/2016.</p><p style=""text-align: justify;"">Módulo 2: 3100 USD. Data limite de pagamento 25/04/2016.</p><p style=""text-align: justify;"">Módulo 3: 3500 USD. Data limite de pagamento 25/06/2016.</p><p style=""text-align: justify;""><strong>Banco Bilbao Vizcaya-Argentaria</strong> - Oficina: 2370 / Paseo de Recoletos 10, Ala Sur – PL-1 / Madrid. España / <strong>Titular</strong>: Escuela Internacional de Cine y TV. <span class=""il"" style=""line-height: 1.6em;"">EICTV / </span><strong>Cuenta No</strong>: 01822370490091515995 / <strong>IBAN</strong>: ES 6801822370490091515995 / <strong>SWIFT</strong>: BBVAESMM</p><p style=""text-align: justify;""><span class=""aspect-name""><strong>Professores:</strong> </span></p><p style=""text-align: justify;"" rel=""text-align: justify;""><span class=""aspect-name""></span><a data-toggle=""popover"" data-animation=""true"" data-placement=""left auto"" data-html=""true"" data-trigger=""hover"" data-container=""div.item-talleres"" data-content=""José Luis Guerín (1960), es uno de los máximos representantes del cine de autor europeo, por la capacidad de crear una obra singular, poética, en continua renovación del lenguaje fílmico y de la misma idea de belleza. Tras una serie..."" href=""http://www.eictv.org/profesores/jose-luis-guerin/"" data-original-title="""" title="""">José Luis Guerín</a>, <a data-toggle=""popover"" data-animation=""true"" data-placement=""left auto"" data-html=""true"" data-trigger=""hover"" data-container=""div.item-talleres"" data-content=""Comets es una de las máximas figuras del montaje en Francia. Maestro, conferencista y difusor de los temas vinculados al cine. Desde hace años ha sido el jefe del área de montaje de la Escuela FEMIS de París, una de..."" href=""http://www.eictv.org/profesores/jacques-comets/"" data-original-title="""" title="""">Jacques Comets</a>, <a data-toggle=""popover"" data-animation=""true"" data-placement=""left auto"" data-html=""true"" data-trigger=""hover"" data-container=""div.item-talleres"" data-content=""Profesora de Cine y Estudios Culturales en la Universidad Estatal de Nueva York (SUNY). Su campo de interés incluye el cine de terror y la memoria cultural, el cine cubano, el cine queer y experimental. Entre sus textos publicados recientemente,..."" href=""http://www.eictv.org/profesores/ruth-goldberg/"" data-original-title="""" title="""">Ruth Goldberg</a>, <a data-toggle=""popover"" data-animation=""true"" data-placement=""left auto"" data-html=""true"" data-trigger=""hover"" data-container=""div.item-talleres"" data-content=""Philip Hoffman recibió un título en Medios de la Comunicación masiva en la Universidad de Sheridan en 1979 y una licenciatura en Literatura Inglesa en la Universidad de WilfridLaurier en 1987. Mientras estudiaba en Sheridan fue parte de ese grupo..."" href=""http://www.eictv.org/profesores/philip-hoffman/"" data-original-title="""" title="""">Philip Hoffman</a>, <a data-toggle=""popover"" data-animation=""true"" data-placement=""left auto"" data-html=""true"" data-trigger=""hover"" data-container=""div.item-talleres"" data-content=""Escritora, guionista, productora y documentalista, Lola Mayo (1970) es la coproductora y coguionista de todas las películas de corto y largometraje que ha realizado el cineasta español Javier Rebollo, entre ellos “La Mujer sin Piano” (2009), Concha de Plata en..."" href=""http://www.eictv.org/profesores/lola-mayo/"" data-original-title="""" title="""">Lola Mayo</a>, <a data-toggle=""popover"" data-animation=""true"" data-placement=""left auto"" data-html=""true"" data-trigger=""hover"" data-container=""div.item-talleres"" data-content=""Graduada en Cine Documental en la EICTV y máster en Estudios Sobre Cine (Universidad Rey Juan Carlos). Lleva más de 7 años como docente en diferentes universidades de España, Cuba, Colombia o EEUU. Fue responsable durante tres años del Departamento de Documental..."" href=""http://www.eictv.org/profesores/irene-gutierrez/"" data-original-title="""" title="""">Irene Gutiérrez</a>, <a data-toggle=""popover"" data-animation=""true"" data-placement=""left auto"" data-html=""true"" data-trigger=""hover"" data-container=""div.item-talleres"" data-content=""Ha dirigido, producido y fotografiado cine desde el 2004. Es egresado del Centro Universitario de Estudios Cinematográficos de la UNAM y obtuvo además una Maestría en Bellas Artes y Estudios Interdisciplinarios (MFA) en la Escuela de Arte Contemporáneo de la..."" href=""http://www.eictv.org/profesores/juan-manuel-sepulveda/"" data-original-title="""" title="""">Juan Manuel Sepúlveda</a>, <a data-toggle=""popover"" data-animation=""true"" data-placement=""left auto"" data-html=""true"" data-trigger=""hover"" data-container=""div.item-talleres"" data-content=""Licenciada en Ciencias de la Imagen (UCM) y en Antropología Social y Cultural (UAM). Ha realizado estudios de postgrado en Historia del cine (UAM), de Antropología visual en el Instituto de Investigaciones Antropológicas (UNAM) y Roma III y Documental autobiográfico..."" href=""http://www.eictv.org/profesores/noemi-garcia/"" data-original-title="""" title="""">Noemí García</a> , <a data-toggle=""popover"" data-animation=""true"" data-placement=""left auto"" data-html=""true"" data-trigger=""hover"" data-container=""div.item-talleres"" data-content=""Sonidista y docente español con experiencia de más de 15 años tanto en ficción como en documental. Entre sus trabajos más destacados se encuentran “N.N” de Héctor Galves (Premio a mejor director en el FICCI y nominada para representar a..."" href=""http://www.eictv.org/profesores/juan-manuel-lopez/"" data-original-title="""" title="""">Juan Manuel López</a> , <a data-toggle=""popover"" data-animation=""true"" data-placement=""left auto"" data-html=""true"" data-trigger=""hover"" data-container=""div.item-talleres"" data-content=""Ha dirigido los largometrajes "" el="""" muerto="""" y="""" ser="""" feliz""="""" (2013),="""" ""la="""" mujer="""" sin="""" piano""="""" (2009)="""" ""ce="""" que="""" je="""" sais="""" de="""" lola="""" lo="""" sé="""" lola""="""" (2006),="""" con="""" ellos="""" ha="""" obtenido="""" dos="""" veces="""" premio="""" fipresci="""" la...""="""" href=""http://www.eictv.org/profesores/javier-rebollo/"" data-original-title="""" title="""">Javier Rebollo</a> , <a data-toggle=""popover"" data-animation=""true"" data-placement=""left auto"" data-html=""true"" data-trigger=""hover"" data-container=""div.item-talleres"" data-content=""Su última producción “Allende mi abuelo allende” coproducción Chile-México ganador en Cannes 2015, sus producciones han sido seleccionadas y galardonadas en festivales internacionales. Nominada durante 3 años consecutivos como mejor Documental, por la Academia cinematográfica mexicana. Becada en dos ocasiones por el MEDIA..."" href=""http://www.eictv.org/profesores/martha-orozco/"" data-original-title="""" title="""">Martha Orozco</a> , <a data-toggle=""popover"" data-animation=""true"" data-placement=""left auto"" data-html=""true"" data-trigger=""hover"" data-container=""div.item-talleres"" data-content=""Director de fotografía y operador de camará. Terminó en 1995 la carrera de Comunicación Audiovisual en el Instituto Profesional de Arte y Comunicación Audiovisual en el Instituto Profesional de Arte y Comunicación ARCOS de Santiago de Chile, del que fue después profesor adjunto..."" href=""http://www.eictv.org/profesores/diego-dussuel/"" data-original-title="""" title="""">Diego Dussuel</a>, <a data-toggle=""popover"" data-animation=""true"" data-placement=""left auto"" data-html=""true"" data-trigger=""hover"" data-container=""div.item-talleres"" data-content=""Documentalista formado por la EICTV  con especialización en Cine Documental por la FilmakademieBaden-Wurttemberg, en Alemania. También es graduado en Comunicación Social y Psicología, en Brasil. Sus documentales han recibido 90 premiaciones y fueron exhibidos en importantes festivales, como Cinema du..."" href=""http://www.eictv.org/profesores/marcos-pimentel/"" data-original-title="""" title="""">Marcos Pimentel</a>, <a data-toggle=""popover"" data-animation=""true"" data-placement=""left auto"" data-html=""true"" data-trigger=""hover"" data-container=""div.item-talleres"" data-content=""Nacida en Barcelona el 1975. En 2004 crea Playtime, estudio para la producción de documentales de creación. La terra habitada (2009) de Anna Sanmartí; Cuchillo de palo (2010) de Renate Costa; Salóme (2014) de Yrsa Roca; Oleg (2015) de Andrés Duque son..."" href=""http://www.eictv.org/profesores/marta-andreu/"" data-original-title="""" title="""">Marta Andreu</a> e <a data-toggle=""popover"" data-animation=""true"" data-placement=""left auto"" data-html=""true"" data-trigger=""hover"" data-container=""div.item-talleres"" data-content=""Marcel Łożiński ha sido, junto a Krzysztof Kieślowski, uno de los cineastas más importantes de su generación. Miembro de la Academy of Motion Picture Arts and Sciences (institución que concede los Premios Oscar) y de la European Film Academy, profesor..."" href=""http://www.eictv.org/profesores/marcel-lozinski/"" data-original-title="""" title="""">Marcel Lozinski</a> </p><p style=""text-align: justify;"" rel=""text-align: justify;""><span class=""aspect-name"" style=""line-height: 1.6em;""><strong>Coordenadores:</strong> </span></p><p style=""text-align: justify;""><span class=""aspect-name"" style=""line-height: 1.6em;""></span><a data-toggle=""popover"" data-animation=""true"" data-placement=""left auto"" data-html=""true"" data-trigger=""hover"" data-container=""div.item-talleres"" data-content=""Periodista, realizador y docente cubano. En 1971 comienza a trabajar en el Noticiero nacional de TV donde realiza numerosos documentales. En 1980 ingresa en los Estudios Cinematográficos del Instituto Cubano de Radio y Televisión como director de cortometrajes. Sus documentales han recibido numerosos..."" href=""http://www.eictv.org/profesores/senobio-faget-puri/"" data-original-title="""" title="""">Senobio Faget (Puri)</a>, <a data-toggle=""popover"" data-animation=""true"" data-placement=""left auto"" data-html=""true"" data-trigger=""hover"" data-container=""div.item-talleres"" data-content=""Escritora, guionista, productora y documentalista, Lola Mayo (1970) es la coproductora y coguionista de todas las películas de corto y largometraje que ha realizado el cineasta español Javier Rebollo, entre ellos “La Mujer sin Piano” (2009), Concha de Plata en..."" href=""http://www.eictv.org/profesores/lola-mayo/"" data-original-title="""" title="""">Lola Mayo</a>, <a data-toggle=""popover"" data-animation=""true"" data-placement=""left auto"" data-html=""true"" data-trigger=""hover"" data-container=""div.item-talleres"" data-content=""Graduada en Cine Documental en la EICTV y máster en Estudios Sobre Cine (Universidad Rey Juan Carlos). Lleva más de 7 años como docente en diferentes universidades de España, Cuba, Colombia o EEUU. Fue responsable durante tres años del Departamento de Documental..."" href=""http://www.eictv.org/profesores/irene-gutierrez/"" data-original-title="""" title="""">Irene Gutiérrez</a> e <a data-toggle=""popover"" data-animation=""true"" data-placement=""left auto"" data-html=""true"" data-trigger=""hover"" data-container=""div.item-talleres"" data-content=""Nacida en Barcelona el 1975. En 2004 crea Playtime, estudio para la producción de documentales de creación. La terra habitada (2009) de Anna Sanmartí; Cuchillo de palo (2010) de Renate Costa; Salóme (2014) de Yrsa Roca; Oleg (2015) de Andrés Duque son..."" href=""http://www.eictv.org/profesores/marta-andreu/"" data-original-title="""" title="""">Marta Andreu</a></p><p style=""text-align: justify;"" rel=""text-align: justify;""><a data-toggle=""popover"" data-animation=""true"" data-placement=""left auto"" data-html=""true"" data-trigger=""hover"" data-container=""div.item-talleres"" data-content=""Nacida en Barcelona el 1975. En 2004 crea Playtime, estudio para la producción de documentales de creación. La terra habitada (2009) de Anna Sanmartí; Cuchillo de palo (2010) de Renate Costa; Salóme (2014) de Yrsa Roca; Oleg (2015) de Andrés Duque son..."" href=""http://www.eictv.org/profesores/marta-andreu/"" data-original-title="""" title=""""></a></p><p style=""text-align: justify;"" rel=""text-align: justify;"">Módulo I. 1 de Fevereiro a 13 de Maio<br></p><ol><li>Documentário e Identidade; Apresentação dos Projetos</li><li>Escrita do projeto de Documentário</li><li>O Cinema como esboço</li><li>Documentário e responsabilidade Social</li><li>Cinema Ensaio e Documentário em Primeira Pessoa</li><li>Investigação 1</li><li>Cinema Direto</li><li>Narrativa documental</li><li>Produção executiva no documentário. Desenvolvimento e Financiamento, Produção Criativa e/ou coletiva.</li><li>Escrita e Conformação do projeto 1</li></ol><p style=""text-align: justify;"">Módulo II. De 16 de Maio a 15 de Julho</p><ol><li>Investigação 2</li><li>Mitos no Cinema. A Saga do Herói</li><li>Cinema experimental</li><li>O Documentário a partir da Edição</li><li>O Documentário a partir da Fotografia.</li><li>O Documentário a partir do Som.</li><li>Formas Híbridas; Escrita e Conformação do projeto 2.</li></ol><p style=""text-align: justify;"">Módulo III. De 16 a 30 de Julho.</p><ol><li>Investigação 3.</li><li>Escrita e Conformação do projeto 3.</li><li>Apresentação Final de Projetos.</li></ol><p style=""text-align: justify;"">METODOLOGIA:</p><p style=""text-align: justify;"">Classes em Espanhol, Inglês e Francês, com tradução para Espanhol; Seguimento continuado dos projetos; Orientação personalizada das propostas de cada aluno;  Cada módulo inclui entrega de links com biografia e filmografia.</p><h3 style=""text-align: justify;"" rel=""text-align: justify;"">QUAL É O PROJETO?</h3><h3 style=""text-align: justify;""><img src=""https://s3-sa-east-1.amazonaws.com/cdn.br.catarse/uploads/redactor_rails/picture/data/36466/gincana.png"" alt=""Gincanas""></h3><p style=""text-align: justify;"">Gincanas </p><p style=""text-align: justify;""><em>Gincanas</em> é um longa-metragem no formato documentário que tem como dispositivo a realização de uma Gincana Popular na comunidade das Vilas Nossa Senhora Aparecida e Vila Santa Inês, tendo como referência os registros em vídeo das Gincanas que aconteceram na década de 90. As Gincanas foram organizadas por jovens, que hoje são líderes comunitários na mesma região. O filme busca traçar um paralelo entre as articulações e conquistas populares com mais de 25 anos e as atuais. O Filme-Gincana-Filme será realizado visando reunir essas mesmas pessoas seus filhos e netos, depois dos 25 anos de luta.</p><p style=""text-align: justify;"">Trata-se de um documentário de Modo Participativo. Enquanto desenvolvo o Projeto e Roteiro em Cuba, acontece em São Paulo, uma oficina de audiovisual, a NUVEM (Núcleo de Vídeos em Movimentos) junto com os moradores da comunidade. Outra iniciativa que ocorre é a pré-produção do Doc pela equipe o Mundo em Foco, que está fazendo a pesquisa, buscando fotos que contem essa história e identificando possíveis atores sociais do Doc. A idéia é que no segundo semestre, os jovens, egressos das oficinas participem de todas as etapas de realização do longa. Entendemos que a realização do filme também é parte de uma nova Gincana.</p><p style=""text-align: justify;"">Gincanas - BREVE ARGUMENTO</p><p style=""text-align: justify;"">Vilas Santa Inês e Nossa Senhora Aparecida: Contexto Histórico</p><p style=""text-align: justify;"">Com uma população de dezenove mil pessoas, a maioria vindas do Nordeste do Brasil, a comunidade das Vilas Santa Inês e Nossa Senhora Aparecida está localizada na periferia da Zona Leste de São Paulo, Brasil. Nos anos 80 e 90 a comunidade se mobilizou em lutas populares que defendiam a chegada da luz elétrica, água, esgoto, construção de casas em mutirões e planejamento e pavimentação das ruas.</p><p style=""text-align: justify;"">Foram conselhos populares que decidiram qual rua poderia passar carros e quais seriam vielas e escadarias. </p><p style=""text-align: justify;"">Por ser um bairro novo, a criminalidade era muito grande e as vilas possuíam homens que faziam justiça com suas próprias mãos, os matadores. Paralelo a esse movimento jovens começaram, em parcerias inicialmente com a Igreja Católica, a organizar Gincanas, Festas, Bailes e uma Rádio Comunitária juntamente à comunidade. Esses encontros populares eram os únicos meios de acesso à cultura da região.</p><p style=""text-align: justify;""><em><img src=""https://s3-sa-east-1.amazonaws.com/cdn.br.catarse/uploads/redactor_rails/picture/data/36465/gincana_91..png"" alt=""Aragão - Líder Comunitário""></em></p><p style=""text-align: justify;"">A prática que mais contava com a participação popular eram as Gincanas. Lideradas por jovens, elas aglutinavam pessoas durante todo um fim de semana, com ações em todos os horários para todas as idades. A comunidade se dividia em grupos que disputavam provas entre si. Cada equipe era formada por pelo menos, sessenta pessoas. As provas tinham várias temáticas, como por exemplo, trazer o casal de moradores mais antigos, promover o maior beijo coletivo, plantar o maior número de árvores, desfile de fantasias ecológicas, partidas de futebol, trazer um papagaio que cantasse um trecho do hino nacional, entre outras atividades variadas e complexas que exigiam organização e preenchiam o tempo das equipes, que ao final, ganhavam medalhas, troféus e viagens coletivas para sítios.</p><h3 style=""text-align: justify;"">POR QUE APOIAR</h3><p style=""text-align: justify;"">Fazer audiovisual é uma realização coletiva. Apoiar essa viagem a Cuba é muito mais do que apoiar a formação de uma pessoa física. É investir na multiplicação desse conhecimento através dos processos que envolverão a realização de mais um filme colaborativo feito na periferia, pelos próprios moradores, potencializando o acesso e o registro permanente de histórias de lutas individuais e coletivas.</p><p style=""text-align: justify;"">#BORAPRACUBA é realmente um convite. Pretendo dividir o máximo que conseguir dessa formação, com boletins sobre o que é estudar cinema por lá e como estou fazendo isso. Um registro desse processo de aprendizado, afim de esclarecer dúvidas e instigar novos atores sociais à essa travessia.</p><p style=""text-align: justify;"">Em 2015, fui um dos sete finalistas no curso regular (3 anos) para a Cátedra de Direção de Ficção na EICTV, mas infelizmente não fui selecionado. O interesse continuou e acabei sendo selecionado agora nesse Mestrado.</p><p style=""text-align: justify;"">O interesse pela EICTV, vem dessa incessante busca de aprimoramento dos conhecimentos, tal como novas referências e embasamentos teóricos, que podem ser aliadas a nossa prática diária do fazer e multiplicar, ampliando com nossas ações o olhar das pessoas atingidas na Vila Santa Inês, comunidade que o Mundo em Foco está diretamente inserido, tal como qualquer comunidade que pretendamos atuar/gravar/abordar tanto com oficinas, quanto com a realização audiovisual autoral. </p><p style=""text-align: justify;"">Creio que mais um novo projeto surge de forma coletiva/colaborativa e é isso que me motiva. É por isso que faço, porque acredito que nossas histórias, como as histórias das <strong><em>Gincanas</em></strong> podem ser contadas por nós mesmos. Como diz o parceiro Renan do Inquérito ""Se a história é nossa, deixa que nóis escreve"".</p><h3 style=""text-align: justify;"">FILMOGRAFIA</h3><h3 style=""text-align: justify;""><iframe src=""//player.vimeo.com/video/77615444"" frameborder=""0"" allowfullscreen="""" style=""font-size: 14px; line-height: 1.6em; color: rgb(121, 128, 139); font-weight: 400; width: 500px; height: 281px;""></iframe></h3><p style=""text-align: justify;""><a href=""https://www.facebook.com/1salvedoutor/"">“UM SALVE DOUTOR”</a> (2016) - Longa-Metragem - Direção, Edição e Produção Executiva -Programa VAI (2013) (Desenvolvimento do Roteiro) / VII Prêmio Criando Asas (2013) (Desenvolvimento do Roteiro) / Selecionado na III Mostra Cinema de Quebrada - São Paulo (2013) (work in progress) / Melhor Fotografia – 2º Festival de Cinema da Zona Leste de São Paulo (2014) (work in progress) / Seleção “Cine Comunitário”- VI Festival Pachamama - Cinema de Fronteira (Acre-Brasil) (2015) / Seleção Oficial - Seção Debate - 19º Mostra de Cinema de Tiradentes - MG - Brasil (2016)</p><p style=""text-align: justify;"">""João e Paulo"" (2014) Melhor Roteiro e Melhor Ator - 5ª Mostra Civifilmes (2014). Direção<br></p><p style=""text-align: justify;"">“Venha conhecer o Samba no Asfalto” (2013) - Melhor VideoClipe - 5ª Mostra Civifilmes(2014) - Direção e Produção<br></p><p style=""text-align: justify;"">“Miniatura” (2013) VideoClipe de Victor Rodrigues - Direção - Melhor Adaptação de Obra Literária - V Mostra Civifilmes (2014) / Melhor VideoClipe Festival UniRiter - Porto Alegre (2015)</p><p style=""text-align: justify;"">“Papel de Mulher” (2013) - Selecionado no Festival de Curtas em Direitos Humanos, categoria Cine Infantil (2013). Finalização<br></p><p style=""text-align: justify;"">""De aqui de Dentro da Guerra"" (2013) Selecionado no Festival de Curtas em Direitos Humanos (2013). Direção e Edição<span class=""redactor-invisible-space""><br></span></p><p style=""text-align: justify;"" rel=""text-align: justify;"">""Canto Periférico"" (2013) Selecionado no Festival Entretodos de Curtas em Direitos Humanos (2013). Direção e Edição<span class=""redactor-invisible-space""><br></span></p><p style=""text-align: justify;"" rel=""text-align: justify;"">""Memórias de um chá de Boldo"" (2012) - Prêmio Filme Destaque no Curta 8 Curitiba (2012). Produção e Fotografia<span class=""redactor-invisible-space""><br></span></p><p style=""text-align: justify;"" rel=""text-align: justify;""><span class=""redactor-invisible-space"">""O Barraco e o Menino"" (2011) - Roteiro, Direção e Edição - Selecionado no Festival Internacional de Curtas-Metragens de São Paulo Kinoforum (2011) / Selecionado no Festival Curta 8 de Curitiba (2011). / Selecionado no Primeiro Encontro Escola e Cine - Cinemateca (2012)<span class=""redactor-invisible-space""><br></span></span></p><p style=""text-align: justify;"" rel=""text-align: justify;""><span class=""redactor-invisible-space""><span class=""redactor-invisible-space"">""Temperamental"" (2010) Selecionado no Festival Entretodos de Curtas em Direitos Humanos (2010). Roteiro, Direção e Edição<span class=""redactor-invisible-space""><br></span></span></span></p><p style=""text-align: justify;"" rel=""text-align: justify;""><span class=""redactor-invisible-space""><span class=""redactor-invisible-space"">""Mestres da Gaita"" (2009) - Selecionado para a Mostra Formação do Olhar do Festival Internacional de Curtas de São Paulo Kinoforum (2009). Direção e Edição<span class=""redactor-invisible-space""><br></span></span></span></p><p style=""text-align: justify;"" rel=""text-align: justify;"">“Jovem Mundo Social” (2006/2007) - Programa de TV - I Prêmio Criando Asas (2006) - Elaboração de Projeto, Produção, Roteiro, Direção e Edição<br></p><p style=""text-align: justify;"">“Sambadiferente” (2006) – Videoclipe de Fernando Salém - Melhor Clipe e Melhor Performance no Festival Curta Santos (2006) - Edição<br></p><p style=""text-align: justify;"">“Invisível” (2006) - Melhor Curta-Metragem – Instituto Criar de TV e Cinema (2006) / Selecionado na Mostra Competitiva de Curtas de Diadema (2006) / Selecionado en Mostra da Escola Livre de Cinema e Vídeo de Santo André (2006) - Edição</p><h3 style=""text-align: justify;"">PRÊMIOS - COLETIVO MUNDO EM FOCO</h3><p style=""text-align: justify;"">I Prêmio Criando Asas (2006) - Programa Jovem Mundo Social</p><p style=""text-align: justify;""><img src=""https://s3-sa-east-1.amazonaws.com/cdn.br.catarse/uploads/redactor_rails/picture/data/36470/click_cambury.jpg""></p><p style=""text-align: justify;"">II Prêmio Criando Asas (2007) - Projeto Click na Lata<br></p>    <p style=""text-align: justify;"">III Prêmio Criando Asas (2008) - Projeto Click na Máquina</p>    <p style=""text-align: justify;"">III Prêmio Criando Asas (2008) - Projeto de Cinema Itinerante Perifacine: Fascinante, Itinerante, Nosso…</p>    <p style=""text-align: justify;"">V Progarama VAI - Valorização a Iniciativas Culturais (2008) - Projeto Click na Lata</p>    <p style=""text-align: justify;"">VI Progarama VAI - Valorização a Iniciativas Culturais (2009) - Projeto Click na Lata e Cia...</p>    <p style=""text-align: justify;"">Ponto de Cultura – Programa Cultura Viva (2009) -Ponto de Cultura “Mundo em Foco”</p>    <p style=""text-align: justify;"">VII Progarama VAI - Valorização a Iniciativas Culturais (2010) - Projeto Cine B.O.</p>    <p style=""text-align: justify;"">IV Prêmio Criando Asas (2010) - Filme: ""O Barraco e o Menino""</p><p style=""text-align: justify;"">V Prêmio Criando Asas (2011) - N.U.V.E.M. – Núcleo de Vídeo em Movimentos Sociais (Oficinas)</p><p style=""text-align: justify;""><img src=""https://s3-sa-east-1.amazonaws.com/cdn.br.catarse/uploads/redactor_rails/picture/data/36467/criando_asas_2011.jpg"" alt=""Prêmios 2011""></p><p style=""text-align: justify;"">V Prêmio Criando Asas (2011) - Casas e Cafofos (Design para classes C, D e E)</p><p style=""text-align: justify;"">Prêmio Laureate 2012 - Iniciativa Jovem Anhembi Morumbi - Click na Lata</p><p style=""text-align: justify;"">Hub Fellowship - Empreendedorismo Jovem (2012) - 3º Lugar - Casas e Cafofos</p><p style=""text-align: justify;""><span></span></p><p style=""text-align: justify;"" rel=""text-align: justify;"">VII Prêmio Criando Asas<span class=""redactor-invisible-space""> (2013) - Filme: Um Salve Doutor</span></p>    <p style=""text-align: justify;"" rel=""text-align: justify;"">Programa Vai - Modalidade 2 (2014) - Click</p>    <p style=""text-align: justify;"">Prêmio Cultura Viva - Ponto de Cultura (2014) - (Em parceria com o Centro Nossa Senhora Aparecida) - Ponto de Cultura VILA (Vídeo/Cine, Imagem, Literatura e Arte)</p><p style=""text-align: justify;"">Programa VAI 2015 - Cine Cobertura</p><p style=""text-align: justify;"">Prêmio Redes e Ruas (2014/2015) - (Em parceria com o Centro Nossa Senhora Aparecida) - Jornal Comunitário “Lê que eu te conto”</p><p style=""text-align: justify;""><img src=""https://s3-sa-east-1.amazonaws.com/cdn.br.catarse/uploads/redactor_rails/picture/data/36469/le.jpg""><br></p>",borapracuba,,,"Cinema e Vídeo",13,https://s3-sa-east-1.amazonaws.com/cdn.br.catarse/uploads/project/uploaded_image/25026/bora_card_1.png,https://s3-sa-east-1.amazonaws.com/cdn.br.catarse/uploads/project/uploaded_image/25026/project_thumb_thumb_bora_card_1.png,https://s3-sa-east-1.amazonaws.com/cdn.br.catarse/uploads/project/uploaded_image/25026/project_thumb_small_bora_card_1.png,https://s3-sa-east-1.amazonaws.com/cdn.br.catarse/uploads/project/uploaded_image/25026/project_thumb_large_bora_card_1.png,https://s3-sa-east-1.amazonaws.com/cdn.br.catarse/uploads/project/uploaded_image/25026/project_thumb_video_cover_bora_card_1.png,4.17021276595744680900,1960.0,24,23,successful,flex,finished,"2016-07-16 02:59:59.999999","2016-07-15 23:59:59.999999","2016-02-03 17:56:29.010943","2016-02-03 15:56:29.010943",,t,t,f,21,"{""total"" : 0, ""unit"" : ""seconds""}","{""total"" : 163, ""unit"" : ""days""}",0,"{""city"" : ""São Paulo"", ""state_acronym"" : ""SP"", ""state"" : ""São Paulo""}","{""id"" : 32694, ""name"" : ""Rodrigo Sousa & Sousa""}",3,,f,f,0,t,f,f