project_id,id,user_id,name,headline,budget,goal,about_html,permalink,video_embed_url,video_url,category_name,category_id,original_image,thumb_image,small_image,large_image,video_cover_image,progress,pledged,total_contributions,total_contributors,state,mode,state_order,expires_at,zone_expires_at,online_date,zone_online_date,sent_to_analysis_at,is_published,is_expired,open_for_contributions,online_days,remaining_time,elapsed_time,posts_count,address,user,reminder_count,is_owner_or_admin,user_signed_in,in_reminder,total_posts,can_request_transfer,is_admin_role,contributed_by_friends
25038,25038,519049,"Professor Newton da Costa na UFPR","Um dos maiores nomes da ciência brasileira, aos 86 anos, o professor Newton da Costa virá à UFPR.","<p>A verba será utilizada para o custeio do transporte do professor Newton de Florianópolis a Curitiba - ida e volta, no custo de R$ 1400,00, referente ao motorista que o buscará e o levará de volta. O restante é referente à taxa cobrada pelo site Catarse.me (13%). </p><p>Aos apoiadores será reservado lugar no auditório, bastando identificar-se na entrada. </p>",1580.0,"<hr><p><em><strong>Poucos são os cientistas consagrados brasileiros conhecidos pelo seu próprio povo. </strong></em></p><hr><p style=""margin-left: 20px;"">Com excecção de alguns poucos nomes como Carlos Chagas, Santos Dummont, Oswaldo Cruz, Milton Santos, César Lattes e Artur Avila, pouco se ouve falar  - mesmo nos cursos de graduação - em nomes como Fernando Bunchfat, Francisco Dória, Darcy Ribeiro, Newton Freire Maia  e Newton da Costa, sendo os dois últimos com passagens marcantes pela Universidade Federal do Paraná.</p><p style=""text-align: justify; margin-left: 20px;"">Se Newton Freire Maia realizou grande parte de sua pesquisa inovadora no departamento de genética da UFPR, hoje, ao menos, é homenageado com honrarias como nome de parques e escolas em Curitiba. Já Newton da Costa, curitibano, formado, doutor e professor catedrático pela UFPR, com seu vasto <em>curriculum,</em> recheado de prêmios em diversas categorias por todo o mundo, ainda é pouco reconhecido quando se fala em seu nome e a importância de sua pesquisa nos corredores da universidade.</p><p style=""margin-left: 20px;"">O professor Newton da Costa possui 
trabalhos relevantes em, ao menos, 5 áreas: lógica, fundamentos de 
matemática e física, teoria da computação, filosofia e lógica do 
direito, com mais de 300 trabalhos e 6000 citações, e  com seus 86 anos 
ainda possui produção de alto nível, publicando artigos relevantes com 
frequência em revistas de renome internacional. </p><p style=""margin-left: 20px;"">É tido como o maior lógico brasileiro, e um dos maiores do mundo em atividade. Desenvolveu as <strong>lógicas paraconsistentes</strong>,
 talvez o maior acontecimento na lógica na segunda metade do século XX, 
um campo de crescente interesses por diversos campos do conhecimento.</p><p style=""text-align: justify; margin-left: 20px;""> Algumas premiações e titulações de Newton da Costa:</p><p><strong>Nacionais:</strong><br></p><ul><li>Graduação e Doutoração pela UFPR</li><li>Professor Catedrático da UFPR</li><li>Professor titular de matemática e filosofia da USP, e da UNICAMP</li><li>Membro, Academia de Ciências do Estado de São Paulo.</li><li>Membro Honorário, Centro de Lógica da UNICAMP</li><li>Prêmio Moinho Santista em Ciências Exatas, Fundação Moinho Santista</li><li>Prêmio Jaboti em Ciências Exatas, Câmara Brasileira do Livro</li><li>Medalha da Ordem do Pinheiro, Governo do Estado do Paraná</li><li>Cidadão Benemérito do Estado do Paraná, Assembléia Legislativa do Estado do Paraná.</li><li>Professor Emérito, Unicamp</li><li>Professor Honoris Causa, Universidade Federal de Santa catarina</li><li>Presidente de Honra, Academia Brasileira de Filosofia</li><li>Doutor Honoris Causa, Universidade Federal da Paraíba</li></ul><p><br><strong></strong></p><p><strong>Internacionais:</strong></p><ul><li>Professor visitante e pesquisador nas seguintes universidades:</li><li>Universidade do Chile, Pontifícia Universidade Católica do Chile, 
Universidade de Buenos Aires, Universidade Nacional del Sur (Bahía 
Blanca), Universidade Nacional de Peru (Mayor de San Marcos), 
Universidade Nacional da Colômbia, Universidade Nacional de Uruguai, 
Universidade da California (Berkeley e Los Angeles), Universidade de 
Stanford, Universidade Nacional Autônoma de México, Universidade Nova de
 Lisboa, Universidade de Barcelona, Universidade de Salamanca, 
Universidade de Paris VII, Universidade de Lille, Universidade de 
Clermont-Ferrand, Universidade de Nápoles, Universidade de Siena, Scuola
 Normale Superiore di Pisa, Academia de Ciências da Bulgária, Instituto 
Venezolano de Investigaciones Científicas, Universidade de Torun, 
Universidade de Varsóvia, Universidade Nacional da Austrália.</li></ul><ul><li>Membro Honorário, Instituto de Filosofia do Peru</li><li>Membro Honorário, Academia de Ciências do Chile<span class=""redactor-invisible-space""></span></li><li><span class=""redactor-invisible-space"">Presidente Honorário, Sociedad Uruguaya de Lógica<span class=""redactor-invisible-space""></span></span></li><li><span class=""redactor-invisible-space""><span class=""redactor-invisible-space"">Membro Titular, Institut International de Philosophie de Paris<span class=""redactor-invisible-space""> (primeiro brasileiro aceito nesse instituto)</span></span></span></li><li><span class=""redactor-invisible-space""><span class=""redactor-invisible-space""><span class=""redactor-invisible-space"">Membro Internacional, American Association for the Advancement of Science, EUA<span class=""redactor-invisible-space""></span></span></span></span></li><li>
Medalha do Mérito Científico ""Nicolau Copérnico"", Universidade de Torun, Polônia</li><li>Membro titular, L'Académie Internationale de Philosophie des Sciences (AIPS), Belgique</li></ul><p><em>mais infos em </em><a href=""http://buscatextual.cnpq.br/buscatextual/visualizacv.do?id=K4787165A0""><em>http://buscatextual.cnpq.br/buscatextual/visualiza...</em></a></p><p><br></p><p style=""text-align: justify; margin-left: 20px;"">E é com o intuito de que conheçamos mais o professor Newton, e, inclusive, como forma de homenagem da comunidade acadêmica da UFPR, que o <strong>CEI - Centro de Estudos de Informática</strong> ( a representação estudantil do curso de Ciência da Computação da UFPR) convidou o professor para palestrar durante a semana dos calouros do curso. Prontamente o professor aceitou o convite, sob uma única condição: a de que não houvesse formalidades. E assim será. </p><p style=""text-align: justify; margin-left: 20px;"">O professor escolheu falar sobre a <strong>ciência e seus empecilhos no Brasil,</strong> e irá traçar um paralelo com o desenvolvimento da matemática na Polônia para tecer considerações sobre nossos futuros desafios. <strong>A palestra será</strong> <strong>aberta a toda a comunidade</strong>. Será uma oportunidade ímpar: ouvir sobre ciência de um professor ""da casa"" que rodou o mundo, influenciou centenas de pesquisadores e continua ativo em alto nível. Será um enorme deleite, tanto para os que estão começando como para os que já estão inseridos na academia.</p><p style=""text-align: justify; margin-left: 20px;"">Esse projeto tem por objetivo levantar a verba de transporte do professor, descrita em detalhes abaixo.<br></p><p style=""text-align: justify; margin-left: 20px;"">A palestra será no dia <strong>04 de março (sexta-feira), </strong>às<strong> 15:30h</strong> no campus Jardim Botânico da UFPR de Curitiba, no auditório Professor Ulysses de Campos, no setor de Ciências Sociais Aplicadas. Recomendamos que se chegue antes do horário da palestra para garantir lugar. Entrada gratuita.</p><p style=""text-align: justify; margin-left: 20px;""><em>Ajude na divulgação!</em></p><p style=""text-align: justify; margin-left: 20px;""><em>*fotografia retirada de <a href=""http://www.gazetadopovo.com.br/ra/pequena/Pub/GP/p4/2015/02/22/VidaCidadania/Imagens/Vivo/Newton_Costa_1_22215.jpg"">http://www.gazetadopovo.com.br/ra/pequena/Pub/GP/p...</a></em><br><em></em></p><hr><p><br></p>",NEWTONNAUFPR,,,"Ciência e Tecnologia",18,https://s3-sa-east-1.amazonaws.com/cdn.br.catarse/uploads/project/uploaded_image/25038/Newton_Costa_1_22215.jpg,https://s3-sa-east-1.amazonaws.com/cdn.br.catarse/uploads/project/uploaded_image/25038/project_thumb_thumb_Newton_Costa_1_22215.jpg,https://s3-sa-east-1.amazonaws.com/cdn.br.catarse/uploads/project/uploaded_image/25038/project_thumb_small_Newton_Costa_1_22215.jpg,https://s3-sa-east-1.amazonaws.com/cdn.br.catarse/uploads/project/uploaded_image/25038/project_thumb_large_Newton_Costa_1_22215.jpg,https://s3-sa-east-1.amazonaws.com/cdn.br.catarse/uploads/project/uploaded_image/25038/project_thumb_video_cover_Newton_Costa_1_22215.jpg,105.6962025316455700,1670.0,43,41,successful,flex,finished,"2016-03-03 02:59:59.999999","2016-03-02 23:59:59.999999","2016-01-27 18:52:43.806502","2016-01-27 16:52:43.806502",,t,t,f,5,"{""total"" : 0, ""unit"" : ""seconds""}","{""total"" : 35, ""unit"" : ""days""}",0,"{""city"" : ""Curitiba"", ""state_acronym"" : ""PR"", ""state"" : ""Paraná""}","{""id"" : 519049, ""name"" : ""CEI UFPR""}",6,,f,f,0,f,f,f