project_id,id,user_id,name,headline,budget,goal,about_html,permalink,video_embed_url,video_url,category_name,category_id,original_image,thumb_image,small_image,large_image,video_cover_image,progress,pledged,total_contributions,total_contributors,state,mode,state_order,expires_at,zone_expires_at,online_date,zone_online_date,sent_to_analysis_at,is_published,is_expired,open_for_contributions,online_days,remaining_time,elapsed_time,posts_count,address,user,reminder_count,is_owner_or_admin,user_signed_in,in_reminder,total_posts,can_request_transfer,is_admin_role,contributed_by_friends
25456,25456,521847,"S.U.R.F. - Um Sonho Unindo Realidade e Felicidade","sonho que se sonha só, é um sonho que se sonha só, Mas sonho que se sonha junto, é realidade!","<p>Nosso orçamento prevê a preparação e Manutenção da kombi, custo de gasolina para rodar aproximadamente para 3.800 km com o veiculo realizando em media 8 km por litro, e uma possível emergência com manutenção durante a viagem, Hospedagem para duas pessoas em Camping  ou albergues para ida e volta, Captação de vídeo, fotos e edição de vídeo, custo de mão de obra de parceiros que estão envolvidos na organização do projeto e equipamentos, apos o retorno um evento de lançamento do Vídeo e produção das recompensas Bonés, camisetas e DVD, junto com o percentual do Catarse 13% do valor arrecadado.</p><table>  <colgroup><col>  <col>  </colgroup><tbody><tr>   <td>1.Edição   de imagens,vídeo e equipamentos </td>   <td> R$       3.105,00 </td>  </tr>  <tr>   <td>2.Kombi   (gasolina e manutenção)</td>   <td> R$       4.000,00 </td>  </tr>  <tr>   <td>3.Hospedagem   (camping, albergue para duas pessoas)</td>   <td> R$       2.000,00 </td>  </tr>  <tr>   <td>4.Alimentação   (para duas pessoas 3x ao dia)</td>   <td> R$       1.200,00 </td>  </tr>  <tr>   <td>5.Produção de   recompensas (DVD, Boné, Camiseta)</td>   <td> R$       3.000,00 </td>  </tr>  <tr>   <td>6.Catarse 13%</td>   <td> R$       1.695,00 </td>  </tr>  <tr>   <td>Total R$</td>   <td> R$     15.000,00 </td></tr></tbody></table>",15000.0,"<p><img src=""https://s3-sa-east-1.amazonaws.com/cdn.br.catarse/uploads/redactor_rails/picture/data/38276/JG_cartaz_3.jpg""></p><p><strong>Há 20
anos, Jonatan Grandini Surfboards vem produzindo sonhos em formato de pranchas de
surf, tornando possível às muitas gerações a prática deste esporte magico.</strong></p><p><strong>Dentre tantos possíveis
sonhos, o experiente shaper decidiu dividir esta trajetória de conhecimentos e
conquistas através de uma TRIP, pelo litoral do Brasil, de Sul a Sudeste.</strong></p><p><strong>Em forma de
documentário, Jonatan e sua equipe percorrerão as principais cidades onde a
alma do surf está estampada em quem fez desse esporte um estilo de vida.</strong></p><p><strong>Entregaremos cinco pranchas,  uma em cada estado que passaremos, para escolas de surf, que trabalhem com crianças e jovem, assim formando atletas e cidadão'.</strong></p><p><strong>Nossa equipe irá a bordo de uma Kombi, devidamente equipada, colhendo depoimentos de pessoas
comuns - crianças, adultos e ""masters"", nos remetendo ao mundo do
S.U.R.F - Um Sonho Unindo Realidade e Felicidade, pela visão de cada um. Com
certeza iremos nos deparar com histórias de aventura, tensão, dedicação,
preservação da natureza, superação... e muito amor a um dos esportes mais
intensos da atualidade.</strong></p><p style=""text-align: center;""><strong></strong></p><p style=""text-align: center;""><img src=""https://s3-sa-east-1.amazonaws.com/cdn.br.catarse/uploads/redactor_rails/picture/data/38278/prancha_novinha.jpg""></p><p><strong>O
projeto tem início no Catarse, onde o objetivo é financiar as despesas deste,
que promete ser uma grande experiência.</strong></p><p><strong>Partiremos de Porto
Alegre passando por Viamão/RS,onde fica nossa fábrica de sonhos, tendo como
destino final o litoral do Sudeste Brasileiro. Realizaremos paradas
estratégicas onde, além de conhecermos pessoas, revermos amigos e suas
histórias, faremos manutenção do nosso transporte, descanso e alimentação.</strong></p><p><strong>A quantia arrecadada
será tão-somente para gastos específicos e necessários em uma viagem desse
porte.</strong></p><p><strong>Ao nosso retorno, será
lançado o vídeo-documentário em um DVD e canal on-line para ser de fácil acesso
em um evento de lançamento deste material.</strong></p><p><strong>Embarque nessa TRIP com
a gente, faça se tornar real mais um sonho... Será inesquecível!</strong></p><p><strong>""Um sonho que se
sonha só, é um sonho que se sonha só... Mas sonho que se sonha junto, é
realidade!"" (Raul Seixas)</strong></p><p style=""text-align: center;""><img src=""https://s3-sa-east-1.amazonaws.com/cdn.br.catarse/uploads/redactor_rails/picture/data/38277/Diapositivo1.JPG""></p><p><br></p><p><br></p>",surf,//www.youtube.com/embed/Je6z9I-iEXQ,https://www.youtube.com/watch?v=Je6z9I-iEXQ&feature=youtu.be,"Cinema e Vídeo",13,https://s3-sa-east-1.amazonaws.com/cdn.br.catarse/uploads/project/uploaded_image/25456/JG_cartaz_3.jpg,https://s3-sa-east-1.amazonaws.com/cdn.br.catarse/uploads/project/uploaded_image/25456/project_thumb_thumb_JG_cartaz_3.jpg,https://s3-sa-east-1.amazonaws.com/cdn.br.catarse/uploads/project/uploaded_image/25456/project_thumb_small_JG_cartaz_3.jpg,https://s3-sa-east-1.amazonaws.com/cdn.br.catarse/uploads/project/uploaded_image/25456/project_thumb_large_JG_cartaz_3.jpg,https://s3-sa-east-1.amazonaws.com/cdn.br.catarse/uploads/project/uploaded_image/25456/project_thumb_video_cover_JG_cartaz_3.jpg,3.40000000000000000000,510.0,5,5,failed,aon,finished,"2016-05-02 02:59:59.999999","2016-05-01 23:59:59.999999","2016-03-02 15:54:11.736813","2016-03-02 12:54:11.736813",,t,t,f,60,"{""total"" : 0, ""unit"" : ""seconds""}","{""total"" : 60, ""unit"" : ""days""}",1,"{""city"" : ""Porto Alegre"", ""state_acronym"" : ""RS"", ""state"" : ""Rio Grande do Sul""}","{""id"" : 521847, ""name"" : ""Marley's Burguer Artesanal ""}",0,,f,f,1,f,f,f