project_id,id,user_id,name,headline,budget,goal,about_html,permalink,video_embed_url,video_url,category_name,category_id,original_image,thumb_image,small_image,large_image,video_cover_image,progress,pledged,total_contributions,total_contributors,state,mode,state_order,expires_at,zone_expires_at,online_date,zone_online_date,sent_to_analysis_at,is_published,is_expired,open_for_contributions,online_days,remaining_time,elapsed_time,posts_count,address,user,reminder_count,is_owner_or_admin,user_signed_in,in_reminder,total_posts,can_request_transfer,is_admin_role,contributed_by_friends
255,255,19060,"Gota D'água","Um curta metragem ambientado em um bar. E mostra duas discussões de relacionamento. Dessas que você já passou, ou um dia vai passar.","O orçamento para projetos anteriores a 24/02/2015 normalmente pode ser encontrado na descrição acima.",1700.0,"<p>Sabe aqueles grandes filósofos, músicos, artistas plásticos e toda essa galera que você colocaria a foto na parede? Então, grande parte das suas ideias, ou das conversas que os inspiraram se passaram em um bar. Isso porque  no bar, você não precisa ser polido, ter pudores e falar sério, e talvez justamente por isso as ideias se tornem tão consistentes, porque não precisam ser. </p>

<p>O curta metragem Gota D’água se passa em um bar, obviamente. Nele nós acompanhamos duas conversas, paralelamente, e vemos como as pessoas lidam de maneiras diferentes com seus problemas de relacionamento. Desses que você já passou, ou um dia vai passar. </p>

<p>Nós acreditamos nesse roteiro, e queremos filmá-lo na melhor maneira possível.  E é claro que não vamos nos contentar com o plano/ contra plano. Vamos usar tevelling ( que é quando a câmera se move em um carinho acoplado a um trilho), Grua ( a câmera filmando de cima) e outros movimentos de câmera, além de editar em Full HD.</p>

<p>Para isso, nós precisamos da sua ajuda. O valor que estamos pedindo é  R$ 1.700. Não é uma quantia grande, já que  temos o equipamento, e ninguém da equipe está ganhando para trabalhar nesse projeto. Mas precisamos pagar os atores – que já estão fazendo um preço camarada – e os custos de produção, que não são poucos, além das taxas do catarse e das recompensa. </p>

<p>Contamos com a ajuda de todos, mas principalmente daqueles  que como nós amam o cinema e acreditam na arte como agente transformador da sociedade. Ajude-nos a realizar esse projeto. </p>

<p><em>O que nos motiva?</em></p>

<p>Nossa paixão é a arte através de suas várias formas de expressão. Não pensamos a arte como aquilo que o faz sair deste mundo, como algo que nos possibilite uma fuga, costumamos chamar isso de entretenimento, e ele também é importante, nós acreditamos que arte é aquilo faz com que você olhe para dentro si e para o mundo através de outros olhos, outras perspectivas, acreditamos na  arte  enquanto agente fundamental para transformar o mundo.
Quando uma ideia surge, seja ela para cinema ou literatura, videoclipe ou fotografia, um novo mundo começa a tomar forma, é como se sentíssemos os aromas da infância, o cheirinho do bolo de fubá saindo do forno enquanto uma reprise oitentista passa no cinema que era a TV da sala da mamãe, e debaixo das cobertas escutássemos o barulho da chuva levantar o cheiro de terra e asfalto do chão. É o entusiasmo motivado pela certeza de que uma ideia vai sair do papel.</p>

<p><em>Para conferir nossos trabalhos:</em>
&quot;!<img src=""http://catarse.me/images/social/youtube_32.png?1309926688!%22:http://www.youtube.com/user/onirios"" alt=""""/> &quot;!<img src=""http://catarse.me/images/social/facebook_32.png?1309926688!%22:http://www.facebook.com/onirios"" alt=""""/></p>
",gota-d-agua,//player.vimeo.com/video/27305843,http://vimeo.com/27305843,"Cinema e Vídeo",13,,https://s3-sa-east-1.amazonaws.com/cdn.br.catarse/uploads/project/video_thumbnail/255/project_thumb_thumb_open-uri20131125-2-l5satn,https://s3-sa-east-1.amazonaws.com/cdn.br.catarse/uploads/project/video_thumbnail/255/project_thumb_small_open-uri20131125-2-l5satn,https://s3-sa-east-1.amazonaws.com/cdn.br.catarse/uploads/project/video_thumbnail/255/project_thumb_large_open-uri20131125-2-l5satn,https://s3-sa-east-1.amazonaws.com/cdn.br.catarse/uploads/project/video_thumbnail/255/project_thumb_video_cover_open-uri20131125-2-l5satn,113.2352941176470600,1925.0,32,24,successful,aon,finished,"2011-08-22 02:59:59","2011-08-21 23:59:59","2011-06-23 02:59:59","2011-06-22 23:59:59",,t,t,f,60,"{""total"" : 0, ""unit"" : ""seconds""}","{""total"" : 60, ""unit"" : ""days""}",0,"{""city"" : ""Vitória"", ""state_acronym"" : ""ES"", ""state"" : ""Espírito Santo""}","{""id"" : 19060, ""name"" : ""Ormando Marim Neto""}",0,,f,f,0,f,f,f