project_id,id,user_id,name,headline,budget,goal,about_html,permalink,video_embed_url,video_url,category_name,category_id,original_image,thumb_image,small_image,large_image,video_cover_image,progress,pledged,total_contributions,total_contributors,state,mode,state_order,expires_at,zone_expires_at,online_date,zone_online_date,sent_to_analysis_at,is_published,is_expired,open_for_contributions,online_days,remaining_time,elapsed_time,posts_count,address,user,reminder_count,is_owner_or_admin,user_signed_in,in_reminder,total_posts,can_request_transfer,is_admin_role,contributed_by_friends
2571,2571,172305,"Show de lançamento "" A Superfície da Palavra"" de Itamar Brant","Show de lançamento do CD ""A Superfície da Palavra”","O orçamento para projetos anteriores a 24/02/2015 normalmente pode ser encontrado na descrição acima.",5000.0,"<p>Trata-se do show de lançamento do meu recente trabalho,&quot; A Superfície da Palavra&quot;. As gravações foram iniciadas em 2008 tendo como patrocinadora a CEMIG e somente agora finalizadas.</p>

<p>Com produção musical de Itamar Brant, Robertinho Brant e Tattá Spalla, participam do CD artistas como Toninho Horta, Chico Amaral, Marina Machado, Carla Villar, Silvia Machete, Celio Balona, Rudi Berger,Gabriel Guedes e o grupo vocal Meninas de Sinhá. </p>

<p>O show de lançamento marcado para doze de Outubro de 2013 será no Teatro da Biblioteca Pública Luiz de Bessa,em Belo Horizonte, as 20:30hrs . </p>

<p>Mas para que isso se concretize e fique bonito, conto com o apoio de todos que curtem meu trabalho, seja ajudando a divulgar esse projeto através de sua rede de contatos, seja escolhendo uma das recompensas oferecidas.Precisamos atingir o valor de R$ 5.000,00.</p>

<p>Um abraço no coração de todos e vamos lá !!!</p>

<p>Para ouvir o trabalho em questão acesse 
<a class=""alt-link"" href=""http://www.soundcloud.com/itamar-brant"" target=""_blank"">www.soundcloud.com/itamar-brant</a></p>

<p>E o site de cara nova ! <a class=""alt-link"" href=""http://www.itamarbrant.com.br"" target=""_blank"">www.itamarbrant.com.br</a></p>

<p>It’s the première concert of my recent album “A Superfície da Palavra” that means “The Surface of the Word”. The recordings was started in 2008 being sponsored by CEMIG and finished by now! This album is produced by Robertinho Brant, Tattá Spalla and Itamar Brant. The special guests are Toninho Horta, Chico Amaral, Marina Machado, Carla Villar, Célio Balona, Rudi Berguer, Gabriel Guedes, the regional group Meninas de Sinhá and the “carioca” singer Silvia Machete. The première concert date is in October 12th 2013 at Luiz Bessa Theater (Public Library Theater) in Belo Horizonte – MG – Brasil at 08:30 PM. 
However, this concert needs your help to make it beautiful! I count on you all that likes my music, helping to sharing this on your facebook page or making a donation and choosing the reward that you most like.
We need to shoot the bull eyes and get R$ 5.000 reais (BR cash) in 60 days. 
A big hug on your hearts and let’s go on...</p>

<p>To listen the album visit <a class=""alt-link"" href=""http://www.soundcloud.com/itamar-brant"" target=""_blank"">www.soundcloud.com/itamar-brant</a></p>

<p>P.S.: To make a donation, you need to sign at the Catarse site. Then you go check your e-mail box to confirm. After this, you come back to this page and click in BACK THIS PROJECT box. </p>
",itamarbrant,//player.vimeo.com/video/71635963,http://vimeo.com/71635963,Música,16,,https://s3-sa-east-1.amazonaws.com/cdn.br.catarse/uploads/project/video_thumbnail/2571/project_thumb_thumb_open-uri20131125-2-1obrc2h,https://s3-sa-east-1.amazonaws.com/cdn.br.catarse/uploads/project/video_thumbnail/2571/project_thumb_small_open-uri20131125-2-1obrc2h,https://s3-sa-east-1.amazonaws.com/cdn.br.catarse/uploads/project/video_thumbnail/2571/project_thumb_large_open-uri20131125-2-1obrc2h,https://s3-sa-east-1.amazonaws.com/cdn.br.catarse/uploads/project/video_thumbnail/2571/project_thumb_video_cover_open-uri20131125-2-1obrc2h,106.9000000000000000,5345.0,61,43,successful,aon,finished,"2013-10-09 02:59:59","2013-10-08 23:59:59","2013-08-09 18:08:06","2013-08-09 15:08:06",,t,t,f,60,"{""total"" : 0, ""unit"" : ""seconds""}","{""total"" : 60, ""unit"" : ""days""}",5,"{""city"" : ""Belo Horizonte"", ""state_acronym"" : ""MG"", ""state"" : ""Minas Gerais""}","{""id"" : 172305, ""name"" : ""Itamar Purri Brant""}",0,,f,f,5,f,f,f