project_id,id,user_id,name,headline,budget,goal,about_html,permalink,video_embed_url,video_url,category_name,category_id,original_image,thumb_image,small_image,large_image,video_cover_image,progress,pledged,total_contributions,total_contributors,state,mode,state_order,expires_at,zone_expires_at,online_date,zone_online_date,sent_to_analysis_at,is_published,is_expired,open_for_contributions,online_days,remaining_time,elapsed_time,posts_count,address,user,reminder_count,is_owner_or_admin,user_signed_in,in_reminder,total_posts,can_request_transfer,is_admin_role,contributed_by_friends
25908,25908,525386,"Das cicatrizes que transbordam luta","Para todas as mulheres negras. ","<p>Por ser um projeto independente, a equipe técnica e as atrizes não receberão cachê. O curta metragem será realizado em 3 diárias, e o dinheiro arrecadado será usado para o transporte e para a alimentação de toda a equipe durante o período em set, para o envio das recompensas aos apoiadores e para pós produção do filme.</p>",1000.0,"<p>O curta metragem ""Das cicatrizes que transbordam luta"" faz uma denúncia ao racismo sofrido pela mulher negra. Elas são várias, acessando uma memória coletiva que é de muitas,
percebendo as circunstâncias que, ao longo de suas vidas, as inferiorizaram, rebaixaram
e negaram-lhe um espaço que é seu direito ocupar.
Essas personagens irão reviver situações de racismo (nas cenas que nada mais são do
que as que vivenciamos todos os dias), acessar essa memória coletiva a fim de entender
que a união com suas iguais, a resistência e o fato de se verem na outra, é o que pode
levar a liberdade plena da mulher negra. A equipe do filme será composta, em sua maioria, por mulheres negras, protagonistas de suas vidas, de suas lutas, e de sua arte.</p>",dascicatrizes,,,"Cinema e Vídeo",13,https://s3-sa-east-1.amazonaws.com/cdn.br.catarse/uploads/project/uploaded_image/25908/Cartaz_financiamento_v2.png,https://s3-sa-east-1.amazonaws.com/cdn.br.catarse/uploads/project/uploaded_image/25908/project_thumb_thumb_Cartaz_financiamento_v2.png,https://s3-sa-east-1.amazonaws.com/cdn.br.catarse/uploads/project/uploaded_image/25908/project_thumb_small_Cartaz_financiamento_v2.png,https://s3-sa-east-1.amazonaws.com/cdn.br.catarse/uploads/project/uploaded_image/25908/project_thumb_large_Cartaz_financiamento_v2.png,https://s3-sa-east-1.amazonaws.com/cdn.br.catarse/uploads/project/uploaded_image/25908/project_thumb_video_cover_Cartaz_financiamento_v2.png,17.00000000000000000000,170.0,5,5,failed,aon,finished,"2016-03-14 02:59:59.999999","2016-03-13 23:59:59.999999","2016-02-11 01:52:52.830686","2016-02-10 23:52:52.830686",,t,t,f,32,"{""total"" : 0, ""unit"" : ""seconds""}","{""total"" : 32, ""unit"" : ""days""}",0,"{""city"" : ""Curitiba"", ""state_acronym"" : ""PR"", ""state"" : ""Paraná""}","{""id"" : 525386, ""name"" : ""Beatriz Gerolin""}",0,,f,f,0,f,f,f