project_id,id,user_id,name,headline,budget,goal,about_html,permalink,video_embed_url,video_url,category_name,category_id,original_image,thumb_image,small_image,large_image,video_cover_image,progress,pledged,total_contributions,total_contributors,state,mode,state_order,expires_at,zone_expires_at,online_date,zone_online_date,sent_to_analysis_at,is_published,is_expired,open_for_contributions,online_days,remaining_time,elapsed_time,posts_count,address,user,reminder_count,is_owner_or_admin,user_signed_in,in_reminder,total_posts,can_request_transfer,is_admin_role,contributed_by_friends
264,264,20368,"Catraca Livre Heliópolis","O Catraca Livre Heliópolis nasceu para mostrar um modelo de bairro educador e incentivar as iniciativas culturais da periferia da zona sul.","O orçamento para projetos anteriores a 24/02/2015 normalmente pode ser encontrado na descrição acima.",9000.0,"<p>O Catraca Livre Heliópolis (<a class=""alt-link"" href=""http://www.catracaheliopolis.com.br"" target=""_blank"">www.catracaheliopolis.com.br</a>) nasceu para mostrar um modelo de bairro educador. O site tem como objetivo facilitar o acesso dos moradores – e de quem freqüenta a região – à programação cultural, cursos, lazer e serviços gratuitos ou a preços acessíveis da região de Heliópolis.</p>

<p>Feito a partir da parceria entre a UNAS (Associação de moradores de Heliópolis) e o Catraca Livre, veio para mostrar que a maior comunidade de São Paulo, com cerca de 120 mil habitantes, também é um exemplo de cultura, educação e empreendedorismo!</p>

<p>Acesse <a class=""alt-link"" href=""http://www.catracaheliopolis.com.br"" target=""_blank"">www.catracaheliopolis.com.br</a> e descubra cursos, atendimentos na área da saúde, eventos culturais, lavanderia comunitária, biblioteca, e uma série de outras ações gratuitas e abertas!</p>

<p>O custo total do projeto vai garantir um ano de reportagens sobre a agenda cultural gratuita da região. Sobre os serviços gratuitos oferecidos às crianças, jovens e adultos. Serão produzidas matérias sobre personagens de Heliópolis, os criadores dos principais projetos e sempre com a intenção de valorizarmos a comunidade. </p>

<p>Para que o projeto continue ao longo dos próximos 12 meses, precisamos da sua ajuda!</p>

<p>Veja ao lado quais são as recompensas.</p>
",264-catraca-livre-heliopolis,//player.vimeo.com/video/27625038,http://vimeo.com/27625038,Jornalismo,15,,https://s3-sa-east-1.amazonaws.com/cdn.br.catarse/uploads/project/video_thumbnail/264/project_thumb_thumb_open-uri20131125-2-jna06n,https://s3-sa-east-1.amazonaws.com/cdn.br.catarse/uploads/project/video_thumbnail/264/project_thumb_small_open-uri20131125-2-jna06n,https://s3-sa-east-1.amazonaws.com/cdn.br.catarse/uploads/project/video_thumbnail/264/project_thumb_large_open-uri20131125-2-jna06n,https://s3-sa-east-1.amazonaws.com/cdn.br.catarse/uploads/project/video_thumbnail/264/project_thumb_video_cover_open-uri20131125-2-jna06n,8.16666666666666666700,735.0,9,9,failed,aon,finished,"2011-10-01 02:59:59","2011-09-30 23:59:59","2011-08-02 02:59:00","2011-08-01 23:59:00",,t,t,f,60,"{""total"" : 0, ""unit"" : ""seconds""}","{""total"" : 60, ""unit"" : ""days""}",0,"{""city"" : ""São Paulo"", ""state_acronym"" : ""SP"", ""state"" : ""São Paulo""}","{""id"" : 20368, ""name"" : ""Alexandre De Maio""}",0,,f,f,0,f,f,f