project_id,id,user_id,name,headline,budget,goal,about_html,permalink,video_embed_url,video_url,category_name,category_id,original_image,thumb_image,small_image,large_image,video_cover_image,progress,pledged,total_contributions,total_contributors,state,mode,state_order,expires_at,zone_expires_at,online_date,zone_online_date,sent_to_analysis_at,is_published,is_expired,open_for_contributions,online_days,remaining_time,elapsed_time,posts_count,address,user,reminder_count,is_owner_or_admin,user_signed_in,in_reminder,total_posts,can_request_transfer,is_admin_role,contributed_by_friends
26527,26527,528796,Reprograma,"Reduzir o gap de demanda/oferta no setor tecnológico preparando mulheres a se tornarem programadoras","<p><br></p><p><img src=""https://s3-sa-east-1.amazonaws.com/cdn.br.catarse/uploads/redactor_rails/picture/data/39138/Or%C3%A7amento_reprograma_detalhe.JPG""></p><p><br></p><img src=""https://s3-sa-east-1.amazonaws.com/cdn.br.catarse/uploads/redactor_rails/picture/data/39139/Or%C3%A7amento_reprograma_Catarse.JPG""><br>",80000.0,"<p style=""text-align: center;"" rel=""text-align: center;""><em>Reprogramando a forma como mulheres jovens se percebem como contribuidoras do setor de tecnologia.</em><br></p><hr><p><strong>OBJETIVO</strong></p><p>Inspirar, empoderar e educar mulheres jovens com conhecimentos de computação e ferramentas de capacitação profissional para que elas possam contribuir de maneira exitosa ao setor tecnológico brasileiro, conquistando assim maiores possibilidades para acessar oportunidades profissionais nesse setor. </p><p><br></p><hr><p><strong>OS PROBLEMAS</strong></p><ol><li>O setor tecnológico brasileiro é um setor que cresce rapidamente mas a demanda não está sendo suprida pela oferta atual de desenvolvedores.</li><li><span></span>Existe um grande gap de gênero no setor tecnológico.</li><li><span></span>Possivelmente, o software sendo desenvolvido atualmente não está satisfazendo as necessidades da sociedade como um todo.</li></ol><p><span></span></p><hr><p><strong>A SOLUÇÃO </strong></p><p><strong></strong>Reduzir o gap de demanda/oferta no setor tecnológico Brasileiro, preparando mulheres jovens a se tornarem programadoras.</p><p><br></p><hr><p><strong>O MERCADO E A OPORTUNIDADE</strong></p><p><strong></strong></p><ul><li>US$
165,6Bi - tamanho do sector TI brasileiro, 2015 (International Data
Corporation, <a href=""http://corporate.canaltech.com.br/noticia/profissional-de-ti/Mercado-de-TI-deve-crescer-em-2015/"">http://corporate.canaltech.com.br/noticia/profissional-de-ti/Mercado-de-TI-deve-crescer-em-2015</a><a href=""http://corporate.canaltech.com.br/noticia/profissional-de-ti/Mercado-de-TI-deve-crescer-em-2015/"">/</a>).</li><li>1.3M - numero de pessoas empregadas no setor TI brasileiro, 30% crescimento esperado para 2016 (Brasscom, <a href=""http://corporate.canaltech.com.br/noticia/profissional-de-ti/Mercado-de-TI-deve-crescer-em-2015/"">http://corporate.canaltech.com.br/noticia/profissional-de-ti/Mercado-de-TI-deve-crescer-em-2015</a><a href=""http://corporate.canaltech.com.br/noticia/profissional-de-ti/Mercado-de-TI-deve-crescer-em-2015/"">/</a>).</li><li>140,000 - déficit de profissionais do setor TI, 58% em São Paulo (Brasscom, <a href=""http://www.inova.sc.gov.br/?p=201"">http://www.inova.sc.gov.br/?</a><a href=""http://www.inova.sc.gov.br/?p=201"">p=201#sthash.fNuDFo8U.dpuf</a>).</li><li>R$ 83,000 - média salarial anual professional TI em São Paulo (Brasscom, <a href=""http://www.brasscom.org.br/brasscom/Portugues/detNoticia.php?codArea=3&codCategoria=56&codNoticia=863"">http://</a><a href=""http://www.brasscom.org.br/brasscom/Portugues/detNoticia.php?codArea=3&codCategoria=56&codNoticia=863"">www.brasscom.org.br/brasscom/Portugues/detNoticia.php?codArea=3&codCategoria=56&codNoticia=863</a>).</li><li>7.2 Mi - mulheres no Brasil que nem trabalham nem estudam, 28% do total das mulheres entre 15-29 anos (IBGE, Síntese de Indicadores Sociaois, Uma Análise das Condições da Vida da População Brasileira, 2013  <a href=""http://biblioteca.ibge.gov.br/visualizacao/livros/liv66777.pdf"">ttp</a><a href=""http://biblioteca.ibge.gov.br/visualizacao/livros/liv66777.pdf"">://biblioteca.ibge.gov.br/visualizacao/livros/liv66777.pdf</a>).</li><li>Até 2020 haverá 1.4Mi empregos em computação - as mulheres estão a caminho de obter 3% destes - Reshma Saujani, Fundadora Girls Who Code. </li></ul><p><br></p><hr><p><strong>O PILOTO</strong><br></p><p><strong>3 componentes:</strong></p><ol><li>Programa
intensivo de 6 semanas que
capacite mulheres jovens em ciências da computação.</li><li>Mentoria high-touch liderada
por engenheiros e empreendedores top da indústria  (homens e mulheres).</li><li>Empoderar as formadas para
se tornarem empreendedoras, oferecendo apoio profissional.</li></ol><p>O piloto também visa desenvolver parcerias com empresas dispostas a oferecer experiências profissionais através de estágios e voluntários com experiência em programação serão os professores.</p><p><br></p><hr><p><br></p><p><strong>O CURRÍCULO</strong></p><p>O piloto será um programa intensivo de seis (06) semanas focado em programação front-end:</p><ul><li>Introdução a desenho web</li><li>HTML & CSS</li><li>Programando com JavaScript</li><li>Desenvolvimento do projeto final e preparação para o entrevistas profissionais. </li></ul><p><span></span></p><p><img src=""https://s3-sa-east-1.amazonaws.com/cdn.br.catarse/uploads/redactor_rails/picture/data/39137/timeline_reprograma.JPG""></p><p>Haverão visitas semanais de empreendedores e engenheiros top do setor tecnológico brasileiro para compartilhar suas experiências com as participantes do programa e empoderá-las.</p><p>O componente de empodeeramento focará em: </p><ul><li>Empreendedorismo e estruturação de plano de negócios.</li><li><span></span>Desenvolver habilidades de liderança.</li><li><span></span>Preparação para entrevistas professionais.<span></span></li></ul><hr>",reprograma,,"",Educação,31,https://s3-sa-east-1.amazonaws.com/cdn.br.catarse/uploads/project/uploaded_image/26527/card_reprograma.JPG,https://s3-sa-east-1.amazonaws.com/cdn.br.catarse/uploads/project/uploaded_image/26527/project_thumb_thumb_card_reprograma.JPG,https://s3-sa-east-1.amazonaws.com/cdn.br.catarse/uploads/project/uploaded_image/26527/project_thumb_small_card_reprograma.JPG,https://s3-sa-east-1.amazonaws.com/cdn.br.catarse/uploads/project/uploaded_image/26527/project_thumb_large_card_reprograma.JPG,https://s3-sa-east-1.amazonaws.com/cdn.br.catarse/uploads/project/uploaded_image/26527/project_thumb_video_cover_card_reprograma.JPG,19.87875000000000000000,15903.0,39,37,online,flex,published,,,"2016-03-07 20:49:07.479073","2016-03-07 17:49:07.479073",,t,f,t,,"{""total"" : 0, ""unit"" : ""seconds""}","{""total"" : 201, ""unit"" : ""days""}",0,"{""city"" : ""São Paulo"", ""state_acronym"" : ""SP"", ""state"" : ""São Paulo""}","{""id"" : 528796, ""name"" : ""Mariel Reyes Milk""}",1,,f,f,0,f,f,f