project_id,id,user_id,name,headline,budget,goal,about_html,permalink,video_embed_url,video_url,category_name,category_id,original_image,thumb_image,small_image,large_image,video_cover_image,progress,pledged,total_contributions,total_contributors,state,mode,state_order,expires_at,zone_expires_at,online_date,zone_online_date,sent_to_analysis_at,is_published,is_expired,open_for_contributions,online_days,remaining_time,elapsed_time,posts_count,address,user,reminder_count,is_owner_or_admin,user_signed_in,in_reminder,total_posts,can_request_transfer,is_admin_role,contributed_by_friends
2689,2689,174477,"FAAP Moda 2013","Concurso FAAP Moda - Hayao Miyazaki e a Infância","O orçamento para projetos anteriores a 24/02/2015 normalmente pode ser encontrado na descrição acima.",8000.0,"<p><strong>Como seu dinheiro será investido</strong></p>

<p><img src=""http://i.imgur.com/wXHDkGd.jpg"" alt=""""/></p>

<p><strong>Sobre o concurso</strong></p>

<p>O FAAP Moda é um concurso que acontece anualmente para alunos e recém-formados do curso de Design de Moda da FAAP. No primeiro semestre, o tema do concurso é anunciado. </p>

<p>Os alunos interessados inscrevem seus projetos com subtema, texto conceito, imagens de inspirações, cores, materiais, desenhos técnicos e, claro, croquis com os 6 looks de criação própria. </p>

<p>Apenas 6 alunos são selecionados para a próxima etapa, que começa no segundo semestre do ano. Nessa parte, os alunos finalistas têm que produzir suas criações para que sejam apresentadas em um desfile.</p>

<p>Parece simples, né?</p>

<p>Mas a gente nem imagina o trabalho que dá! Temos que correr contra o tempo, tomar decisões difíceis e equilibrar todos os prazos, já que uma etapa da confecção depende da outra.</p>

<p>A FAAP dá todo o suporte - ajuda de custo, styling do profissional Maurício Ianês, que trabalha com o Alexandre Herchcovitch, modelos, DJ, profissionais de maquiagem, juri composto de inúmeras personalidades de moda, como Reinaldo Lourenço, Lilian Pacce, Maria Prata, Gloria Coelho, etc., além de toda a infra-estrutura do Teatro FAAP e muitas outras coisas.</p>

<p>Porém, os gastos com a confecção em si acabam superando - e muito - nossas expectativas. Os gastos abrangem diversas etapas do processo, como testes, modelagem, costura, estamparia, tingimento, tecidos, aviamentos, acessórios e outras coisas.</p>

<p>O concurso lança seus finalistas como &quot;Novos talentos na moda brasileira&quot;, mas também tem como objetivo nos mostrar todos os imprevistos e recompensas de se trabalhar nesse mercado tão competitivo.</p>

<p>Além disso, ele incentiva a criação de moda de maneira e magnitude que nenhum outro projeto faz: é a partir de novas cabeças que a moda no Brasil se refaz e aos poucos começa a ter uma identidade nacional.</p>

<p>Esta coleção foi projetada para encher os olhos do espectador, por isso utilizará tecidos finos de seda e bordados delicados, que exigem muito carinho e dedicação.
Sua contribuição será essencial para a realização de um projeto diferente, criado essencialmente para a passarela, com objetivos puramente artísticos!</p>

<p>O desfile acontecerá no dia 4 de dezembro, à noite, no Teatro FAAP, na Rua Alagoas, 903, São Paulo.</p>

<p><strong>Conceito de Criação</strong></p>

<pre><code>O misticismo e o mundo espiritual fascinam tanto crianças quanto adultos. Para estes, a ideia de que há algo além do que vemos e conhecemos ajuda a combater o medo da morte e do desconhecido e a acalmar a ansiedade da vida. Acreditar em forças que regem o funcionamento da Terra e mantêm o equilíbrio entre o homem e a natureza diminuem o peso que o homem carrega como ser dominante. 
Já as crianças têm uma relação mais pura com o misticismo. A imaginação fértil transforma as ideias em realidade; um mundo impossivelmente belo e perfeito - de bruxos poderosos, animais falantes e espíritos justos, onde a inocência e o amor puro e verdadeiro podem derrubar qualquer obstáculo - passa a fazer parte delas e habitar seus sonhos e desejos mais profundos.
Esta minicoleção tenta unir a grandiosidade do misticismo e do mundo espiritual à inocência da infância baseando-se nos filmes do consagrado diretor de animação japonês Hayao Miyazaki e a na relação que eles trazem entre o homem e a natureza, seus equilíbrios e desequilíbrios. O amadurecimento, a vaidade exagerada e o descaso do homem com florestas são temas tratados em três de seus principais filmes, e são perfeitamente emoldurados por paisagens detalhadas e ricas de flores e cores vivas cuidadosamente produzidos para atingir esse lado místico que existe dentro de nós.
 Através das modelagens amplas e curtas e dos balonês, a coleção traz o lado infantil que existe dentro de cada um, enquanto as transparências leves quebram um pouco a inocência da infância, mostrando que a transição dessa fase para a maturidade nunca é abrupta e também nunca completa. As mangas e as saias estruturadas e volumosas, inspiradas no filme “A Viagem de Chihiro”, retratam a grandiosidade e a liberdade de criação dos sonhos e da imaginação. 
As maravilhosas paisagens naturais criadas nos filmes de Miyazaki também são um destaque na coleção através dos bordados de flores e cristais e da estampa de hortências. As cores escolhidas, tanto para os bordados quanto para os tecidos, são as que se destacam nas paisagens dos filmes – o azul deslumbrante dos céus, os tons pastel, o amarelo, diversos tons de rosa e, é claro, o branco e o preto, que nos filmes de Miyazaki não estão relacionados ao bem e o mal, mas sim a questões que geram dúvida e sentimentos conflitantes entre os personagens. 
Por fim, sendo a seda um dos materiais mais importantes para a confecção de roupas tipicamente japonesas e para a economia do país - inclusive referenciada em um dos filmes através de um personagem – foi o material indispensável para a coleção. 
</code></pre>

<p><strong>Materiais que serão utilizados</strong></p>

<p>Todos os looks são bordados (alguns muuito mais, outros menos)
Esse é o material que será utilizado para os looks claros:</p>

<p><img src=""http://i.imgur.com/Flx7Lkq.jpg"" alt=""""/></p>

<p>Para eles, o tecido será um cetim bucol, 100% seda, completamente maravilhoso!!</p>

<p><img src=""http://i.imgur.com/ljn9quH.jpg"" alt=""""/></p>

<p><strong>Estampa desenvolvida</strong></p>

<p>Essa é a estampa da coleção, que será feita em chiffon de poliéster para garantir cores fortes e vibrantes</p>

<p><img src=""http://i.imgur.com/rwYBxTa.jpg"" alt=""""/></p>

<p><strong>Recompensas</strong></p>

<p>Ajudando no meu projeto, você pode ganhar essas lindas recompensas feitas exclusivamente para meus apoiadores &lt;3</p>

<p><img src=""http://i.imgur.com/10MD88o.jpg"" alt=""""/></p>
",faapmoda,//player.vimeo.com/video/73397199,https://vimeo.com/73397199,"Design e Moda",9,,https://s3-sa-east-1.amazonaws.com/cdn.br.catarse/uploads/project/video_thumbnail/2689/project_thumb_thumb_open-uri20131125-2-34grdn,https://s3-sa-east-1.amazonaws.com/cdn.br.catarse/uploads/project/video_thumbnail/2689/project_thumb_small_open-uri20131125-2-34grdn,https://s3-sa-east-1.amazonaws.com/cdn.br.catarse/uploads/project/video_thumbnail/2689/project_thumb_large_open-uri20131125-2-34grdn,https://s3-sa-east-1.amazonaws.com/cdn.br.catarse/uploads/project/video_thumbnail/2689/project_thumb_video_cover_open-uri20131125-2-34grdn,33.56250000000000000000,2685.0,21,20,failed,aon,finished,"2013-11-03 01:59:59","2013-11-02 23:59:59","2013-09-03 14:25:35","2013-09-03 11:25:35",,t,t,f,60,"{""total"" : 0, ""unit"" : ""seconds""}","{""total"" : 60, ""unit"" : ""days""}",1,"{""city"" : ""São Paulo"", ""state_acronym"" : ""SP"", ""state"" : ""São Paulo""}","{""id"" : 174477, ""name"" : ""Livia Rett de Moraes""}",0,,f,f,1,f,f,f