project_id,id,user_id,name,headline,budget,goal,about_html,permalink,video_embed_url,video_url,category_name,category_id,original_image,thumb_image,small_image,large_image,video_cover_image,progress,pledged,total_contributions,total_contributors,state,mode,state_order,expires_at,zone_expires_at,online_date,zone_online_date,sent_to_analysis_at,is_published,is_expired,open_for_contributions,online_days,remaining_time,elapsed_time,posts_count,address,user,reminder_count,is_owner_or_admin,user_signed_in,in_reminder,total_posts,can_request_transfer,is_admin_role,contributed_by_friends
27314,27314,532521,"Ocupação no teatro","Precisamos falar sobre isso!","<p>Execução: Cenografia, Figurino, Iluminação, gastos adm­­­­­­­­­_______________5.200<br></p><p>Auxílio de custo Direção____________________________________________________1.100</p><p>Locação de espaço ensaio e apresentação_________________________5.600</p><p>Assessoria de Imprensa e material gráfico _________________________5.000</p><p>Produção do vídeo para o catarse_______________________________2.000</p><p>Contrapartidas______________________________________________1.200</p><p>Taxa CATARSE - 13% do total ___________________________________3.003,52</p>",23104.0,"<p><img src=""https://s3-sa-east-1.amazonaws.com/cdn.br.catarse/uploads/redactor_rails/picture/data/43755/ocup.jpg""></p><p><strong>O projeto</strong></p><p><strong></strong></p>    <p>O projeto tem como objetivo principal a remontagem do espetáculo “Ocupação” com temporada gratuita, por isso o nome Ocupação no Teatro. Mas além da proposta de apresentação visamos também seguir com o projeto, guiado pela linguagem teatral, nas ocupações de moradia presentes em São Paulo. A intenção é trazer uma agenda cultural para as ocupações e apresentar a peça nesses espaços, além de oferecer oficinas culturais aos moradores ou integrantes dos movimentos. Dando assim mais sentido ao nome do projeto.</p>  <hr>    <p><strong>Porque precisamos da sua ajuda no Catarse?</strong></p>  <p>Acreditamos e gostamos muuuuito do projeto. É preciso falar sobre isso!</p>  <p>As últimas apresentações do espetáculo aconteceram no final de 2014, ou seja, mais de um ano. Sempre apresentamos a peça sem lucro nenhum e no Catarse não vai ser diferente. Todo o dinheiro levantado aqui será revertido para a montagem da peça para seguirmos tratando desse assunto e também para darmos um pontapé nessa volta do “Ocupação no teatro”. Mas a intenção é crescermos cada vez mais com o espetáculo.</p>  <p>Reconhecemos a importância de falar sobre o tema, trazer e manter essa questão em pauta. E acreditando no teatro como uma forma de expressão social, coletiva e interativa que pode aproximar as pessoas de um assunto ainda mal retratado ou nem conhecido. Achamos que o projeto tem um baita potencial e é por isso que precisamos da sua ajuda.

</p><hr>

<strong>A montagem</strong>  <p>A montagem Ocupação, já vem de longa data, nossa primeira apresentação foi em 2013. Livremente inspirada na obra “A Invasão”, de Dias Gomes, peça censurada pelo regime militar na década de 60. “Ocupação” aborda a realidade de brasileiros que sofrem com a falta de moradia nas grandes metrópoles.</p>  <p>A mudança de título se deve às inserções contemporâneas feitas no texto original e, principalmente, ao conceito defendido pelos moradores sem teto, onde só se invade um espaço quando ele já é ocupado por outro. A intenção e regra dos movimentos não é invadir e sim habitar espaços desativados, abandonados pelo poder público ou privado. “Ocupação” mantém a potência do texto original de Dias Gomes e convida os espectadores a uma reflexão sobre a atual realidade brasileira.</p>  <p>A ideia da montagem é aproximar o público de uma realidade que poucos conhecem.  </p><hr>

<strong>Sinopse:</strong>  <p>Na trama, um grupo de moradores de uma favela, desalojado por um incêndio de origem duvidosa, ocupa o esqueleto de um edifício abandonado e passa a viver oprimido entre as promessas de políticos demagogos e a exploração de negociantes inescrupulosos. </p>  <p>São apresentados núcleos familiares, que evidenciam a heterogeneidade de objetivos dessa massa que se iguala pela miséria em que vive, pelas violências que sofre e pela sua força de levar a vida. “Ocupação” apresenta com graça e delicadeza, indivíduos em sua humanidade, com sonhos, anseios e dramas pessoais que resistem enquanto lutam por sua dignidade e sobrevivência, frente a uma realidade hostil.</p>  <hr>    <p><strong>Ficha técnica:</strong></p>  <p>- Elenco: Alexandre Galves, Andressa Andreatto, Danilo Rosa, Elaine Alves, Júlia Freire, Luíza Abe, Paulo Sommer, Pedro Conrado, Gui Conceição, Márcio Macedo.</p><p>- Direção: Renato Andrade</p>    <p>- Produção executiva: Bia Zaidan</p>    <p>- Cenografia e Figurinos: Criação Coletiva </p>    <p>- Concepção de luz: Priscila Carla </p><hr>

Previsão de estreia: Agosto<hr>

<strong>Vídeo do catarse:</strong>  <p>- Captação: Felipe Abe</p>  <p>- Edição: Cássio Rothschild</p>  <img src=""https://s3-sa-east-1.amazonaws.com/cdn.br.catarse/uploads/redactor_rails/picture/data/43756/fotoooo.jpg""><img src=""https://s3-sa-east-1.amazonaws.com/cdn.br.catarse/uploads/redactor_rails/picture/data/43757/10375496_594506077320400_124669828090853675_n.jpg""><img src=""https://s3-sa-east-1.amazonaws.com/cdn.br.catarse/uploads/redactor_rails/picture/data/43758/cia2.jpg""><hr>",ocupacaonoteatro,//player.vimeo.com/video/160794130,https://vimeo.com/160794130,"Teatro e Dança",19,https://s3-sa-east-1.amazonaws.com/cdn.br.catarse/uploads/project/uploaded_image/27314/ocupcatarse.jpg,https://s3-sa-east-1.amazonaws.com/cdn.br.catarse/uploads/project/uploaded_image/27314/project_thumb_thumb_ocupcatarse.jpg,https://s3-sa-east-1.amazonaws.com/cdn.br.catarse/uploads/project/uploaded_image/27314/project_thumb_small_ocupcatarse.jpg,https://s3-sa-east-1.amazonaws.com/cdn.br.catarse/uploads/project/uploaded_image/27314/project_thumb_large_ocupcatarse.jpg,https://s3-sa-east-1.amazonaws.com/cdn.br.catarse/uploads/project/uploaded_image/27314/project_thumb_video_cover_ocupcatarse.jpg,22.78393351800554016600,5264.0,64,64,failed,aon,finished,"2016-06-08 02:59:59.999999","2016-06-07 23:59:59.999999","2016-04-08 13:44:38.239976","2016-04-08 10:44:38.239976",,t,t,f,60,"{""total"" : 0, ""unit"" : ""seconds""}","{""total"" : 60, ""unit"" : ""days""}",0,"{""city"" : ""São Paulo"", ""state_acronym"" : ""SP"", ""state"" : ""São Paulo""}","{""id"" : 532521, ""name"" : ""Ocupação""}",0,,f,f,0,f,f,f