project_id,id,user_id,name,headline,budget,goal,about_html,permalink,video_embed_url,video_url,category_name,category_id,original_image,thumb_image,small_image,large_image,video_cover_image,progress,pledged,total_contributions,total_contributors,state,mode,state_order,expires_at,zone_expires_at,online_date,zone_online_date,sent_to_analysis_at,is_published,is_expired,open_for_contributions,online_days,remaining_time,elapsed_time,posts_count,address,user,reminder_count,is_owner_or_admin,user_signed_in,in_reminder,total_posts,can_request_transfer,is_admin_role,contributed_by_friends
282,282,19733,"Gravação do CD Falso Amor - Jribeiro","Projeto de gravação do 2º disco do cantor e compositor Jribeiro. Só MPB da melhor qualidade, com letras e arranjos totalmente autorais!","O orçamento para projetos anteriores a 24/02/2015 normalmente pode ser encontrado na descrição acima.",15000.0,"<p>Projeto de gravação do 2º disco do cantor e compositor Jribeiro. O álbum, intitulado Falso Amor, está sendo gravado de forma totalmente independente e a previsão de lançamento é meados de outubro. O disco será composto por 11 músicas inéditas. Só MPB da melhor qualidade, com letras e arranjos totalmente autorais, compostas por Jribeiro com a parceria de grandes artistas do cenário musical baiano, como Uriel Marques e Ramon Ferreira. A direção musical é de Juninho Sampaio.
Sem perder a sua influência urbana, expressa pela linguagem das ruas e pelas paisagens da capital baiana que povoam suas músicas, este novo trabalho traz canções com harmonias mais suaves que as do primeiro CD, Macumba, e um tom mais intimista. Essa influência urbana se mistura com a cultura popular que pulsa em suas canções, notável na referência a personagens da cultura afro-brasileira e do sertão baiano.
As músicas evidenciam as influências musicais do cantor e compositor: a inspiração em João Bosco e Lenine estão fortemente presentes na batida de seu violão e nos arranjos vocais e melódicos. As canções passeiam por estilos como afoxé, samba, bossa, blues e muita MPB, terreno de destaque do artista.
Jribeiro conta com o apoio de todos para que a produção seja viabilizada e para que logo logo todos possam curtir seu som em casa, nos shows ou nas rádios.</p>

<p>Valor solicitado: R$ 15.000,00 (que será utilizado para gravação, mixagem, masterização e prensagem do Cd &quot;Falso Amor&quot;).</p>

<p>Vamos caminhar juntos! E viva a música popular brasileira!</p>

<p>Se você ainda não conhece o 1º disco de Jribeiro, visite a página dele no Myspace: <a class=""alt-link"" href=""http://www.myspace.com/jribeirompb/music/playlists/macum-ba-2349884"" target=""_blank"">http://www.myspace.com/jribeirompb/music/playlists/macum-ba-2349884</a></p>
",gravacao-do-cd-falso-amor-jribeiro,//player.vimeo.com/video/28024680,http://vimeo.com/28024680,Música,16,,https://s3-sa-east-1.amazonaws.com/cdn.br.catarse/uploads/project/video_thumbnail/282/project_thumb_thumb_open-uri20131125-2-1x9gldb,https://s3-sa-east-1.amazonaws.com/cdn.br.catarse/uploads/project/video_thumbnail/282/project_thumb_small_open-uri20131125-2-1x9gldb,https://s3-sa-east-1.amazonaws.com/cdn.br.catarse/uploads/project/video_thumbnail/282/project_thumb_large_open-uri20131125-2-1x9gldb,https://s3-sa-east-1.amazonaws.com/cdn.br.catarse/uploads/project/video_thumbnail/282/project_thumb_video_cover_open-uri20131125-2-1x9gldb,4.80000000000000000000,720.0,16,14,failed,aon,finished,"2011-10-04 02:59:59","2011-10-03 23:59:59","2011-08-05 02:59:59","2011-08-04 23:59:59",,t,t,f,60,"{""total"" : 0, ""unit"" : ""seconds""}","{""total"" : 60, ""unit"" : ""days""}",1,"{""city"" : ""Salvador"", ""state_acronym"" : ""BA"", ""state"" : ""Bahia""}","{""id"" : 19733, ""name"" : """"}",0,,f,f,1,f,f,f