project_id,id,user_id,name,headline,budget,goal,about_html,permalink,video_embed_url,video_url,category_name,category_id,original_image,thumb_image,small_image,large_image,video_cover_image,progress,pledged,total_contributions,total_contributors,state,mode,state_order,expires_at,zone_expires_at,online_date,zone_online_date,sent_to_analysis_at,is_published,is_expired,open_for_contributions,online_days,remaining_time,elapsed_time,posts_count,address,user,reminder_count,is_owner_or_admin,user_signed_in,in_reminder,total_posts,can_request_transfer,is_admin_role,contributed_by_friends
28567,28567,533005,"SOMBRAS DA LIBERDADE","Literatura: liberdade de locomoção mental. Rumo a nós mesmos e a outros mundos. Aposte.","<ul>  <li><strong>Impressão      40%</strong></li>  <li><strong>Recompensas      28%</strong></li>  <li><strong>Envios      14%</strong></li>  <li><strong>Custos      Adicionais 5%</strong></li>  <li><strong>Catarse      - 13%</strong></li></ul><p><img src=""https://s3-sa-east-1.amazonaws.com/cdn.br.catarse/uploads/redactor_rails/picture/data/44536/GRAFICO.jpg""></p>",6000.0,"<p style=""text-align: justify; margin-left: 20px;"">Muito mais que um livro, a verdade sob a forma de
ficção - assim se apresentaria o livro <em>Sombras da liberdade</em>, sorrindo
de lado, se não teimasse eu em fazê-lo antes. Trata-se de um texto com onze
narrativas curtas (mas só em número de páginas), discorrendo sobre o Brasil,
sobre seus personagens pitorescos e marcantes, sobre superação, sobre o poder
do mito, sobre o próprio ato de escrever, sobre vigilância em favor do atraso,
sobre amizade, amor, vida, morte e renascimento. Sobre o real concreto e duro e
o paralelismo abstracionista em que se insere a criação. Pareceria-lhes então
um texto trivial daí? Com um sorriso, <em>Sombras da liberdade</em>, de novo,
vai assegurar: Não, não sou.</p><p style=""text-align: justify; margin-left: 20px;"">Este livro poderia ter chances de nascer no mundo
editorial conhecido? Nascer e logo a seguir esticar as pernas, pedir um
café-por-favor, talvez com chantili (leite seria imprescindível, àquela
altura), e começar a justificar o fato e o parto, ao contar histórias ao
corpo de médicos espantado, traduzindo o ""ressurgimento do mundo""
numa linguagem fresca, cifrada, brutal, sarcástica, nova, velha, tradicional,
letal e vital? Pode ser. Mas ficaria este livro no coração dos leitores, assim?
Sobreviveria ele, entre capas coloridas aos montes e entre sumidades de pequeno
alcance, ocultado pela quantificação? Não terminaria ocultado pelo
amontoado de papel destinado a ser coberto tão só de poeira, antes mesmo de ser
lido, para gáudio dos vilões que detona ele próprio? É justo o que venho
perguntar a vocês, leitores interessados em literatura, para além das
rotinas do ofício e da seara cultural. Seria justo este livro ser mal
lido?</p><p style=""text-align: justify; margin-left: 20px;"">Acho que não.</p><p style=""text-align: justify; margin-left: 20px;"">Os recursos recebidos serão inteiramente
utilizados, por mim e pela editora Livrus, na produção do livro, da melhor
forma possível. Isto em agradecimento mais que merecido aos patrocinadores, aos
apoiadores deste projeto. Um bem cultural via de regra sustenta valor que
pode ser apenas imaginado - o que depende do nível de imaginação reinante,
lógico. Nossa função é, também, ampliar o imaginário e ridicularizar o que
esteja abaixo deste preceito, pode-se dizer, bombardeando de
verdade o ""ultrarrealismo"" feito de um só enredo, atualmente:
""nós somos roubados no final do espetáculo ruim; e o bilheteiro era da quadrilha
também, logo fugiu"". Restrito, me parece.</p><p style=""text-align: justify; margin-left: 20px;"">Apoiem e conheçam <strong><em>Sombras da liberdade</em></strong>. </p><p style=""text-align: justify; margin-left: 20px;"">Estejam do lado certo, do riso.</p><p style=""text-align: justify; margin-left: 20px;""><br></p><p style=""text-align: justify; margin-left: 20px;""><br></p><p style=""text-align: justify;""><strong>Abaixo, a primeira parte do conto <em>Sombras da liberdade, ou amarelo e branco: cores da criação</em>, terceiro do livro.</strong></p><p style=""margin-left: 20px;""><span class=""redactor-ie-paste""></span></p><p style=""margin-left: 20px;""><span class=""redactor-ie-paste""></span><p style=""text-align: justify; margin-left: 40px;"">Anatólio Pimenta jogava mais uma partida de copas. Debruçado sobre a tela, um braço pendia sobre a lateral larga da poltrona do capitão Kirk, como a chamava. A outra mão servia ao <i>mouse</i>; se bem que as bases, interativas.</p>  <p style=""text-align: justify; margin-left: 40px;"">A vez do próximo texto ainda pedia urgência em sua cabeça. Ele diminuía o tempo disponível para alcançar o efeito, podemos dizer. Tinha de ser alguma coisa... ããã...</p>  <p style=""text-align: justify; margin-left: 40px;"">Claro, já sabia mais ou menos a trilha, disse a si mesmo quase em voz alta.</p>  <p style=""text-align: justify; margin-left: 40px;"">Ia ser mais uma “daquelas” mesmo. É. As suas histórias, cujo ciframento deixava certas dúvidas sobre se a simplicidade, e mesmo a vulgaridade, empregada, a dançar nas entrelinhas da fluência, se ela realmente não escondia o valor que alguns dos amigos jornalistas haviam atribuído ao primeiro, segundo e terceiro textos publicados por ele, Pimenta. Aliás, terem aceitado publicar aquelas drogas foi surpresa só superada por alguém ter visto nelas “ironia quanto à vulgaridade que se fazia a partir do discurso vulgar mesmo”. Um escritor que levava as paródias a sério, isto era decerto um julgamento bastante ambíguo — mas o certo é que a coisa acertava em cheio. Acarinhava as partes pudendas mentais dos leitores — garantiria a eles que não se resumiriam a elas? Também pode ser.</p>  <p style=""text-align: justify; margin-left: 40px;"">Snif, pensou Pimenta, numa onomatopeia resignada, até por estar bem encaixada.</p>  <p style=""text-align: justify; margin-left: 40px;"">Anatólio (Totó é a mãe!), como se observa, era um autocrítico de primeira qualidade, achava. E, já que não lhe cabia nem lhe convinha dar a palavra final sobre seus escritos, contentava-se em dar a melhor, mesmo se muitas vezes fosse impublicável — de maneira que coadunava sua aparente notoriedade, num crescendo, com bom senso e senso de competitividade, para desta fórmula resultar, quase sempre, ter ele chegado antes a péssimas conclusões conclusivas, à quais não chegariam seus comentadores sequiosos dum ídolo jovem decaível-rápido. Ao menos, não antes de Pimenta haver imposto ao contexto um texto realmente de peso, inesquecível. Uma beleza. Um portento. Uma obra-prima! E um fracasso comercial; mas não à honra do literato. Era a sua forma sobrante de ilusão, para não sobrar ele na parada, podemos assim dizer.</p>  <p style=""text-align: justify; margin-left: 40px;"">Pimenta sabia das coisas, era evidente. O seu primeiro livro havia sido<i> Ao norte de Tipiramonquim</i>. O segundo, <i>Ao sul de Tipiramonquim.</i> O terceiro: <i>No centro de Tipiramonquim</i>.</p>  <p style=""text-align: justify; margin-left: 40px;"">Pode?</p>  <p style=""text-align: justify; margin-left: 40px;"">Já que deixavam...!</p>  <p style=""text-align: justify; margin-left: 40px;"">O evidente, o mais lógico e, por que não?, irônico seria continuar na mesma linha geográfica, ampliando ironicamente seu território, se quisesse emplacar outro relativo sucesso de vendas. E aí viriam “a leste”, “a oeste”. Talvez, mais adiante, <i>O céu de Tipiramonquim</i>. Já o fecho <i>Embaixo também</i>, aí seria abuso, seria apelativo e forçado por demais. Era seguro não exagerar na dose, para além do miolo.</p>  <p style=""text-align: justify; margin-left: 40px;"">Trilogia... caía melhor na tradição! Isso. A palavra soava elegante a ele e decerto importante, também. Se bem que poderia agir como bem entendesse, isso era verdade também.</p>  <p style=""text-align: justify; margin-left: 40px;"">Seus livros-até-ali apresentavam uma ótima vantagem residual: uma verdadeira marca fixada, não importava tanto assim a diversidade de títulos ou das situações ou dos personagens — a obra seria sempre a mesma, só que corrigida a pouco e pouco.</p>  <p style=""text-align: justify; margin-left: 40px;"">Com efeito, Pimenta cria: seus livros eram tão previsíveis e racionalizados em linhas gerais, ou seja, tão iguais um ao outro, que suportariam variâncias de superfície, como fatores de deslumbramento, de sedução, para quem se pusesse a lê-los. Desde ao menos o nome do autor ficasse lá na capa, claro. Garantindo continuidade e costume, instituições de rara relevância hoje em dia, levando-se em conta a falta de tantas outras coisas fixas, afora os homens. Havia uma evidente esperteza, uma <em>estratégia</em> propagandística nessa promessa de continuidade — tal esperteza a sustentava e mantinha a brasa da falsa curiosidade acesa. De fato, todos os escritos de Anatólio eram tão tediosos e centrados numa ideia única, enfeitada com certa competência aqui e ali, que os leitores passavam a crer em si: até eles um dia poderiam ser futuros criadores mais competentes do que o próprio Anatólio Pimenta! Pimenta relia-se e reconcordava: não seria difícil. Tsch tsch.</p>  <p style=""text-align: justify; margin-left: 40px;"">A previsibilidade salvava todos da falta de tempo — e ele alugava a sua mãozinha para esta otimização moderna do quotidiano. O segredo para vender muito, mormente em tempos tão modernos, é dar controle ao leitor, todos sabem. E, mais que aquilo: só se fossem contos interativos...! Em que, via de regra, um montão de gente consegue provar, num espaço reduzido... como é difícil...!</p>  <p style=""text-align: justify; margin-left: 40px;"">É, e havia mais defeitos a subirem nos ombros da fama e gerarem qualidades aparentes (e certeiras e muito bem adaptadas ao contexto). O certo charme <i>blasé</i> emprestado, por exemplo, algo que contribuía enormemente para o encantamento geral e da geral, e garantiria a sobrevida no mercado cultural — se nos perdoarem o uso deste termo os antepassados de dez anos atrás. A erudição de almanaque era definitiva na imposição deste aspecto. Era uma enrolação sadia e levava o leitor-peregrino a um... lugar comum, num trem-fantasma que chegaria lá, tanto mais por estar em seu destino desde a partida, certamente. Em bela voz e em belas legendas, era-lhe comunicado, era-lhe, mais, decodificado, desvendado, enquanto você visitava cada estação — que você estava sendo enganando; mas por conta própria, por sua iniciativa, o que se tratava de uma louvação do livre-arbítrio, por outro lado, claro. A cultura era assim.</p>  <p style=""text-align: justify; margin-left: 40px;"">Os seus três livros, vale dizer, a plástica interessante referente a eles, toda confeccionada para causar bem-estar, igual a casas velhas aconchegantes e repletas de curiosidades e das facilidades modernas mais dispensáveis, algo que as enobrecia com o <i>status</i> contrário, entenda-se — esta plástica decorativa demandava algo: ao menos o significado daquela mediocridade toda haveria de poder estar escondido nalgum lugar perdido, perdido entre os verbetes da enciclopédia Britânica, do Google ou da Coleção <i>Os Dinos de outros tempos</i>.</p>  <p style=""text-align: justify; margin-left: 40px;"">Conclusivo: em essência a série Tipiramonquim era feita disso — superfluidades bem remedadas, descrições aqui e ali de paisagens jamais vistas de perto, descrições de interiores de casas coloniais e de espécies de animais escolhidas segundo a falta de prestígio de seus sobrenomes nas conversas comuns<a name=""_ftnref1"" title="""" style=""mso-footnote-id: ftn1;"" href=""file:///C:/Users/reivanil/Desktop/CONTO%20-%20Sombras%20da%20liberdade%2026022016.docx#_ftn1""><sup><strong><sup><u>[1]</u></sup></strong></sup></a>, descrições de vertebrados atuais e descrições vivíssimas e pormenorizadas, aí sim, marcadas por certa profundidade até, dos processos bioquímicos catecolamínicos conducentes à vontade de matar coisas, como a alta cultura, por exemplo, mediante textos longos, ruins, vazios, inférteis e escritos com o orgulho de quem faz a sua parte.</p>  <p style=""text-align: justify; margin-left: 40px;"">Enfeites não menos decisivos eram os próprios personagens dos livros. Todos eram esquemas. Esquemas esquematizados e matizados uma vez só, na primeira aparição, de cara, no máximo dentro de três ou quatro linhas. A partir de então eles eram desenvolvidos segundo uma lógica sem erro, bem fácil. Uma lógica aliás a também apresentar, claro, a vantagem de permitir aos personagens serem atados-sem-remédio às teias da fabulação livre, sem nenhuma sugestão de possibilidade de se alimentarem do acúmulo de eventos sofridos. De maneira que os prodígios dos fatos do enredo, mesmo se não lá essas coisas, fossem experimentados com toda a ingenuidade que um esquema é obrigado a guardar perante os fatos, o acaso. Eram caricaturas mais ou menos a sério. Sua única atitude humana ou imprevisível, de consistência, era poderem se angustiar em face destas suas linhas gerais autômatas e fixas. Era uma tragédia, sabiam, liam o texto — e, snif!, choravam em seu íntimo. Rezando pelo autor, a revezes, quando não por elas mesmas.</p>  <p style=""text-align: justify; margin-left: 40px;"">Baixar a bola geral, para os pequenos traços, os pequenos aspectos persuasivos, de exuberância, técnica e “criatividade de manutenção” poderem ser enobrecidos, bem considerados no contexto fabulatório, em favor da autoaceitação de muitos. Não haveria generosidade nisto? E paga. Haveria algum mal em tal generosidade?</p>    <p style=""text-align: justify; margin-left: 40px;"">Anatólio olha todas aquelas qualidades de cima...! Lamenta muito, mas teria de continuar na... intermediação otimizante do fluxo das normalidades e anormalidades aceitáveis.</p>  <p style=""text-align: justify; margin-left: 40px;"">Era só isso mesmo, continuar a continuação sem fim previsto.</p>  <p style=""text-align: justify; margin-left: 40px;"">Porém Anatólio de repente é estremecido por um estranho autoclamor de variação. Seu próprio inconsciente não aguentava mais e conscientizava-o de que ""lá em cima"", à superfície, provavelmente a concordância quanto a isso, esta premência por mudança era indubitável, para além das esferas mais turronas da linguagem. Hii! Mais uma onda! Eram muitas, àquele trecho de tempo. Hmm, esta era daquelas! Um <i>insight</i>, o <em>insight</em> da noite: Lorin tinha de morrer! Pronto. Simplesmente isso. Lorin... morrer...? Ué? Sim, estava aí a salvação contra o marasmo absoluto. Ao menos poderia estar.</p>  <p style=""text-align: justify; margin-left: 40px;"">Mas quem era Lorin? Lorin era o protagonista da Trilogia Tipiramonquim. Ele morrer, se fosse possível dizer, seria uma sugestão do próprio personagem, tão cansado que devia estar de toda aquela lengalenga fabulatória. Afora que porventura até mesmo o além-vida dos personagens de ficção fosse menos enfadonho. Ademais, não se tratava propriamente de uma inovação — era a decisão de seguir uma alternativa rumo a uma conclusão menos vulnerável, menos frágil, menos porcaria. É que a morte de Lorin, seu desfecho literal ou não, tratava-se de uma questão prevista no próprio esquema, se podemos dizer assim. O esquema segundo Lorin havia sido forjado, já no primeiro parágrafo do primeiro livro, um pedido das concessões. Este esquema estatuía: Lorin podia ser vazio e monótono, certo, mas tinha seu bom senso — e seu bom senso avisava, nem ele se aguentava mais! Usar mais da prescindibilidade seria abusar da fórmula. Logo, Lorin morreria. Igual a Poirot. E depressa. Só que quase por conta própria.</p>  <p style=""text-align: justify; margin-left: 40px;"">Bom, assunto encerrado. Restava agora saber de que rechear o meio, o assunto. Pelo acúmulo, claro. Fatos sem nem uma palavra de relevância. Afinal, Lorin morreria de que jeito? Opção melhor, a primeira das alternativas da questão: tanto fazia! Anatólio sabia, aquilo ali era mais uma vez igual a uma prova de vestibular para uma carreira, pouco séria, que não havia escolhido. Tanto fazia apostar na primeira ou na última alternativa — a correção da prova não era estímulo, não constituía aguilhão pró-resistência, ela não importava. Importava acabar logo o negócio.</p>    <p style=""text-align: justify; margin-left: 40px;"">Bom, sem dúvida, havia umas facilidades a mais no “negócio”. Observemos, Lorin era: arqueólogo; ornitólogo; musicólogo (especialista em música medieval e centrado no tópico de estudo: histórico das variações de tropos sobre uma única passagem melismática da pérola do cantochão: <i>Veni creator spiritus</i>); tocador de fole francês nas horas vagas; biopsicoastrólogo-holístico; físico nuclear; garanhão; procurador incansável da felicidade (segundo ele, orifícios não faltavam para ele procurar, ao modo dum Mandrake fonsequiano); formado detetive particular por correspondência; historiador sobretudo do presente; e, por fim, o que era a sua vocação de verdade: paleontólogo, adepto de Lund, vasculhador dos sítios pleistocênicos de Minas ao Ceará, sempre em busca duma costelinha de um <i>Haplomastodon waringi</i>, de um osso temporal de um <i>Smilodon </i>ou duma coleção de vértebras completa dum megatério, dum gliptodonte, dum toxodonte.<a name=""_ftnref2"" title="""" style=""mso-footnote-id: ftn2;"" href=""file:///C:/Users/reivanil/Desktop/CONTO%20-%20Sombras%20da%20liberdade%2026022016.docx#_ftn2""><sup><strong><sup><u>[2]</u></sup></strong></sup></a></p>  <p style=""text-align: justify; margin-left: 40px;"">Coisas como essas, infiltradas de repente nos textos, o coitado do leitor não avisado antes — elas valiam alguns puxões de orelha a Lorin e seu criador, nesta ordem. Mas eram coisas do Lorin. Davam-lhe de fato um simulacro de cérebro, dado importante no hipnotismo no geral.</p>  <p style=""text-align: justify; margin-left: 40px;"">Bom... o fato é que Lorin era tudo isso e aí ficava... fácil escolher uma vereda onde ele pudesse morrer dignamente. Morrer sem dúvida. Quer dizer, morrer vítima dalgo a não deixar dúvidas de que o próprio Lorin havia, só na sutileza, armado. De maneira a se fazer ele um exemplo cavalheiresco duma trama qualquer, trama na qual estivesse ele metido. Hmm, um heroísmo residual infinito e por certo grande autoconsciência e alto grau de piedade, de clemência. E ainda por cima Pimenta mostraria alguma erudição de almanaque — a perda de Lorin e de tempo poderiam ser então meio que compensadas. É...! Ótima resolução...!</p>  <p style=""text-align: justify; margin-left: 40px;"">Havia, claro, o problema: Lorin morreria e o gancho para erudições, por ele tão bem representado, iria junto. Cadê o próximo livro então? Hmm. Uma pena, não sobrava muita confiança no autor. Anatólio sobreviveria a Lorin? Sobrariam provas de sua existência, quando menos na qualidade de recombinador das peças do quebra-cabeça? Não consistia pequena parte de sua vaidade e expectativa quanto à própria produção o detalhe de todos, afinal, segundo Pimenta, estarem na verdade na sua cola, estarem todos atrás da precisão nos pormenores, de olho em sua “infalibilidade”. Era ele jorrar minudências, cada uma na fila dos nomes técnicos na área musical, por exemplo, e todos os menos seduzíveis (influenciadores dos demais, em muito) iam pedir informes num <i>site</i> qualquer. Ou até desempoeiravam e desestraçavam, num balcão dum sebo, exemplar qualquer, a versar sobre teoria musical na Idade Média. Daí, pronto: fim do mistério. Deciframento rondando pelas... vilas... sem remédio. Em muito o fascínio de Pimenta e seus livros calcava-se no tanto que um e outros prometiam provar, mediante uma incursão realmente não rasa, por algum dos aspectos abordados. Mas ia ser difícil.</p>  <p style=""text-align: justify; margin-left: 40px;"">Pensou Anatólio nas dificuldades da cena agora. Se a história versasse apenas sobre a morte de Lorin, isto jogava a trilogia para o canto de lógica de Dumas, que tinha feito três mosqueteiros e um sobressalente, que por acaso era, se não o principal, o menos pré-formatado, na forma de um estereótipo com voz e provido de certas ideias próprias. Ou seja, se a história versasse apenas sobre a descrição da morte de Lorin, a trilogia seria de quatro livros. Detalhe, o último sendo o único a guardar interesse em todos os níveis. Até pelo fato de findar, graças a Deus!, a trilogia — uns diriam isso.</p>  <p style=""text-align: justify; margin-left: 40px;"">Mas não, exatamente — Pimenta pensava no interesse dos leitores acerca de como a continuidade continuaria, mesmo se aparentemente estivesse prestes a não continuar. Qual a <em>estratégia</em> de Pimenta para Lorin ter substitutos versados em mesmos assuntos e noutros, quiçá mais legaizinhos, só que um por vez?</p>  <p style=""text-align: justify; margin-left: 40px;"">Certo, Lorin teria de morrer, o infeliz. Mas morrer de maneira que:</p>  <p style=""text-align: justify; margin-left: 40px;"">1º. não levasse com ele a dignidade artificial conferida pela erudição de almanaque. Ele tinha de deixar uma amostra, aos crédulos a acompanharem-no, de que o autor, Anatólio Pimenta, sobreviveria à derrocada por ele próprio construída; e</p>  <p style=""text-align: justify; margin-left: 40px;"">2º. não esgotasse, com sua descrição, o conteúdo dramático, já muito ralo, do enredo, para sermos um pouco mais monótonos.</p>    <p style=""text-align: justify; margin-left: 40px;"">Isto conduziu Pimenta ao óbvio. A seguir, aprovou fácil o seguimento do método — continuava o mesmo: muito ainda pela frente. Então era aquilo: Lorin teria de morrer nas primeiras páginas dum livro introdutório de seu sucessor, um novo personagem “a versar” sobre o aspecto de erudição pelo qual Lorin estava interessado no momento da queda, da morte. Se bem que o aspecto não muito, tanto que o descartou. Lorin morreria em busca do conhecimento! Conhecimento que outro... completaria, por assim dizer. Assim, uma sobrevida no seguro. As contas, <i>idem</i>.</p>  <p style=""text-align: justify; margin-left: 40px;"">Além do mais era uma alternativa a guardar plena consonância em relação à pretensão de Pimenta de se livrar do multifacetamento de erudições, nos próximos livros. Os sucessores de Lorin especializariam-se, modernizariam-se. Nada mais de rascunhos de iluminismos ou renascentismos, não! Os caras iam é se ancorar mesmo, tá ligado?, dali em diante, numa só linha de pesquisa. Cada livro seria e conteria um tópico de conhecimento a ser abordado. Tópico extraído do mar de conhecimentos genéricos, de diletante, a preencher cada área. E, muita competência estaria ali, muita objetividade marcada por excelente acabamento significante-de-folga — certos floreios protoeruditos e torneios de frase a se mostrarem emocionantes, às vezes.</p>  <p style=""text-align: justify; margin-left: 40px;"">Isto é, o sonho de Pimenta era a diversidade profissionalizada. Com a complexidade em que cada linha de conhecimento abordada ofereceria a perspectiva de ser superada. Mesmo na modéstia ancorada em instrumentos de alusões e citações enciclopédicas, utilizados de guias e índices de insuficiência. Pimenta sonhava em implodir os limites pouco a pouco, segundo um uso reflexivo de demonstrativos fictícios de sua (dos limites) pequeneza.</p>  <p style=""text-align: justify; margin-left: 40px;"">Em todo caso, era um argumento bonito.</p>  <p style=""text-align: justify; margin-left: 40px;"">Lorin tinha de morrer.</p><p style=""text-align: center; margin-left: 40px;"">***<br></p>  <hr>      <p style=""margin-left: 40px;""><a name=""_ftn1"" title="""" style=""mso-footnote-id: ftn1;"" href=""file:///C:/Users/reivanil/Desktop/CONTO%20-%20Sombras%20da%20liberdade%2026022016.docx#_ftnref1""><sup><sup><u>[1]</u></sup></sup></a><sup> </sup>Anatólio tinha preferência certa por pássaros, o <i>Turdus leucomelas</i>, o grande <i>Saltador coerulescens</i>, o mal-afamado <i>Sclerurus scansor</i>, o adaptável a qualquer coisa <i>Passer domesticus</i>, o chispante <i>Xanthopsar flavus </i>e ele, o reciclador <i>Stercorarius pomarinus</i>, que não poderia faltar.<i> </i><em>E mais:<i> o</i></em> <i>Larus domenicanus</i>, o <i>Phalacrocorax olivaceus</i>, o <i>Morphnus guianensis</i>, o grande <i>Coragyps atratus</i>, o inesquecível<i> Anodorhynchus leari</i>, o arrasante<i> Pyrrhura picta lucianii</i>, o altissonante<i> Procnias nudicollis</i>, o destemido<i> Hylophilus rubrifons</i>.</p>    <p style=""margin-left: 40px;""><a name=""_ftn2"" title="""" style=""mso-footnote-id: ftn2;"" href=""file:///C:/Users/reivanil/Desktop/CONTO%20-%20Sombras%20da%20liberdade%2026022016.docx#_ftnref2""><sup><sup><u>[2]</u></sup></sup></a><sup> </sup>A propósito, um interesse especial pelo <i>Smilodon.</i> Pesquisas por toda a América, coleções de fêmures do bicho, das vértebras caudais, de crânios esburacados e de suas presas preferenciais — destas aqui, fragmentos e algumas até inteirinhas; umas chegando a até 25 centímetros. Um prodígio aliás de que Lorin concluía: a desproporcionalidade de elementos orgânicos ou de características genotípicas, traduzidas em protuberâncias pró-defesa-ataque-manutenção-de-superioridade-dentro-dos-grupos-de-mesma-espécie, foi o recurso diferencial da natura para prover espécies mais frágeis, quanto à envergadura, dum centro específico de concentração de poder para manipular, organizar os demais itens do organismo, ao escondê-los por detrás dum escudo de especialização gênica manifestada fenotipicamente. Isto é, segundo Lorin a especialização de impulsos de defesa e ataque num centro gerador de estímulos sobrecarregou de tal modo este centro que todos os itens (órgãos) do, enfim, organismo, itens secundarizados, tiveram de construir suas estratégias de fundamento gênico, a fim de ficarem o mais possível com um potencial de reserva de retroalimentação, caso falhasse a defesa suprema. Nos tigres foi o dentão do dentes-de-sabre; já nos homens e demais primatas, isto se manifestou na protuberância do frontal a acomodar as revoluções estrategiais ocorrentes ao longo de todo o organismo, organismo a requerer no período como que feudos próprios, com guarnecimento e metodologias de autodomínio próprios: cérebro, cerebelo, bulbo raquidiano, pedúnculo e protuberância são a circunvolução mesma da necessidade de ampliação da área de defesa, condensando-se os dados abstratos, forjados pelos sentidos, num “mapa de ação futura” permitidor de um sem-número de alternativas de ataque e sobretudo fuga, cada uma destas alternativas “sugerida” pelas diversas conformações físicas do fundamento de associação celular, sem perda de “identidade celular”. Os bichinhos que fomos, ainda dissociados, alertam sobre suas rotas de fuga, sem isto implicar propriamente uma dissociação dum centro único de comando pró-preservação orgânica.</p><p><br></p>",sombras_da_liberdade_8e8f,//www.youtube.com/embed/lhzWenoqhI0,https://www.youtube.com/watch?v=lhzWenoqhI0,Literatura,20,https://s3-sa-east-1.amazonaws.com/cdn.br.catarse/uploads/project/uploaded_image/28567/SOMBRAS_DA_LIBERDADE3.jpg,https://s3-sa-east-1.amazonaws.com/cdn.br.catarse/uploads/project/uploaded_image/28567/project_thumb_thumb_SOMBRAS_DA_LIBERDADE3.jpg,https://s3-sa-east-1.amazonaws.com/cdn.br.catarse/uploads/project/uploaded_image/28567/project_thumb_small_SOMBRAS_DA_LIBERDADE3.jpg,https://s3-sa-east-1.amazonaws.com/cdn.br.catarse/uploads/project/uploaded_image/28567/project_thumb_large_SOMBRAS_DA_LIBERDADE3.jpg,https://s3-sa-east-1.amazonaws.com/cdn.br.catarse/uploads/project/uploaded_image/28567/project_thumb_video_cover_SOMBRAS_DA_LIBERDADE3.jpg,1.46666666666666666700,88.0,2,1,failed,aon,finished,"2016-06-18 02:59:59.999999","2016-06-17 23:59:59.999999","2016-04-18 23:14:45.876505","2016-04-18 20:14:45.876505",,t,t,f,60,"{""total"" : 0, ""unit"" : ""seconds""}","{""total"" : 60, ""unit"" : ""days""}",0,"{""city"" : ""Santos"", ""state_acronym"" : ""SP"", ""state"" : ""São Paulo""}","{""id"" : 533005, ""name"" : ""REIVANIL RIBEIRO""}",0,,f,f,0,f,f,f