project_id,id,user_id,name,headline,budget,goal,about_html,permalink,video_embed_url,video_url,category_name,category_id,original_image,thumb_image,small_image,large_image,video_cover_image,progress,pledged,total_contributions,total_contributors,state,mode,state_order,expires_at,zone_expires_at,online_date,zone_online_date,sent_to_analysis_at,is_published,is_expired,open_for_contributions,online_days,remaining_time,elapsed_time,posts_count,address,user,reminder_count,is_owner_or_admin,user_signed_in,in_reminder,total_posts,can_request_transfer,is_admin_role,contributed_by_friends
286,286,15709,"CD Verde Longe","Verde Longe, a paisagem distante e o som do Cravo-da-Terra para a música brasileira.","O orçamento para projetos anteriores a 24/02/2015 normalmente pode ser encontrado na descrição acima.",6365.0,"<p>Verde Longe tem como objetivo a duplicação do terceiro CD do grupo catarinense Cravo-da-Terra. Esse novo trabalho, que dá nome ao projeto, vem sendo construído desde 2009. É fruto de uma trajetória de onze anos e do trabalho de novos e antigos integrantes.
Com um repertório de onze músicas, Verde Longe traz o diálogo entre a sonoridade da música tradicional brasileira e da erudita urbana. Essa conversa acontece principalmente pela mistura dos timbres oferecidos pelos instrumentos, do estudo erudito dos componentes do grupo e de suas origens que remontam a várias regiões do país. Terá a participação do músico Tião Carvalho e do grupo Gira Coro.
O grupo, formado por Ive Luna (voz e flauta transversa), Jorge Linemburg (violino, viola e rabeca), Mateus Costa (contrabaixo acústico), Osvaldo Pomar (percussão) e Pedro Cury (violão), tem na pesquisa da música tradicional do sul, sudeste e nordeste a base de suas composições e de seus arranjos. Possui na bagagem prêmios como Rumos Itaú Cultural e o troféu Cata-Vento de melhor cantora pela Rádio Cultura de São Paulo. Participou de mostras como a Pauta Funarte, o Acorde Brasileiro e a Prata da Casa.
Mas por que investir em um projeto de duplicação de CDS, quando se fala tanto de novas mídias?
Porque os CDS ainda guardam qualidades que o meio virtual ainda não substitui, características reconhecidas pelos apreciadores de música. O CD Verde Longe terá o prazer do objeto, das coleções, da textura na ponta dos dedos, do encarte com as letras pra ser folheado enquanto se ouve o som do Cravo. O trabalho gráfico é da artista visual Marina Moros e pretende criar um objeto único, onde estará latente a paisagem verde não identificada por alguém que vem de longe. Já consegue imaginar?
Gostamos das novas mídias, dos novos jeitos. Nos utilizamos deles para proliferar nosso trabalho. Mas também gostamos de folhear encartes, de mostrar pros amigos, de sentir o cheiro do papel. E se você também aprecia, procure uma recompensa que te agrade e colabore com o projeto. E para a versatilidade da música digital, para ter a oportunidade de ouvir o Cravo em qualquer player, também temos opções.
Por que 6.365,00?
A arrecadação através do Cartase irá bancar primeiramente, a duplicação do CD Verde Longe com acabamento em Digi Pack (embalagem de papel) numa tiragem de 1000 cópias. Nesta verba também estão inclusos os custos das recompensas propostas no projeto, as despesas financeiras e os custos de correio.
Qualquer dúvida é só falar com a gente!
<a class=""alt-link"" href=""mailto:contato@cravodaterra.com.br"" target=""_blank"">contato@cravodaterra.com.br</a> </p>
",cd-verde-longe,//player.vimeo.com/video/28198991,http://vimeo.com/28198991,Música,16,,https://s3-sa-east-1.amazonaws.com/cdn.br.catarse/uploads/project/video_thumbnail/286/project_thumb_thumb_open-uri20131125-2-fsc7nv,https://s3-sa-east-1.amazonaws.com/cdn.br.catarse/uploads/project/video_thumbnail/286/project_thumb_small_open-uri20131125-2-fsc7nv,https://s3-sa-east-1.amazonaws.com/cdn.br.catarse/uploads/project/video_thumbnail/286/project_thumb_large_open-uri20131125-2-fsc7nv,https://s3-sa-east-1.amazonaws.com/cdn.br.catarse/uploads/project/video_thumbnail/286/project_thumb_video_cover_open-uri20131125-2-fsc7nv,37.54909662215239591500,2390.0,44,44,failed,aon,finished,"2011-09-29 02:59:59","2011-09-28 23:59:59","2011-07-31 02:59:59","2011-07-30 23:59:59",,t,t,f,60,"{""total"" : 0, ""unit"" : ""seconds""}","{""total"" : 60, ""unit"" : ""days""}",0,"{""city"" : ""Florianópolis"", ""state_acronym"" : ""SC"", ""state"" : ""Santa Catarina""}","{""id"" : 15709, ""name"" : ""Monique Beneval de Souza""}",0,,f,f,0,f,f,f