project_id,id,user_id,name,headline,budget,goal,about_html,permalink,video_embed_url,video_url,category_name,category_id,original_image,thumb_image,small_image,large_image,video_cover_image,progress,pledged,total_contributions,total_contributors,state,mode,state_order,expires_at,zone_expires_at,online_date,zone_online_date,sent_to_analysis_at,is_published,is_expired,open_for_contributions,online_days,remaining_time,elapsed_time,posts_count,address,user,reminder_count,is_owner_or_admin,user_signed_in,in_reminder,total_posts,can_request_transfer,is_admin_role,contributed_by_friends
288,288,21392,"ALUGO MINHA LÍNGUA","Alugo Minha Língua - um musical erotragicômico
Direção Fernando Guerreiro 
Línguas afiadas em tempos de espetacularização da sexualidade","O orçamento para projetos anteriores a 24/02/2015 normalmente pode ser encontrado na descrição acima.",10000.0,"<p>ALUGO MINHA LÍNGUA</p>

<p>Em setembro de 2011 estreia no Teatro Vila Velha, em Salvador, o espetáculo “Alugo Minha Língua”, a nova montagem de Fernando Guerreiro – consagrado diretor teatral baiano responsável pelos sucessos Pólvora e Poesia, Os Cafajestes, Vixe Maria Deus e o Diabo na Bahia e A Bofetada – a partir do texto inédito de Gil Vicente Tavares (Sargento Getúlio, Os Javalis e Os Amantes II). A empreitada reúne grandes profissionais da cena, a exemplo de Jarbas Bittencourt, que assina a trilha sonora original e Manuela Rodrigues, que faz a preparação vocal do elenco, à novidade do Supernova Teatro, núcleo de criação e produção artística fundado em 2010 pelos jovens atores Ciro Sales, Luisa Proserpio e Will Brandão, e hoje grupo em residência no Teatro Vila Velha.</p>

<p>O espetáculo discute, através de uma encenação marcada pela linguagem da performance e com um viés musical acentuado, as relações entre a perversão humana, a sexualidade e a sociedade de consumo. A peça visa explicitar, à luz do conceito de modernidade líquida do sociólogo polonês Zygmunt Bauman, como a urgência e a espetacularização da sexualidade nas sociedades contemporâneas resultam no esvaziamento das relações humanas e no tédio.</p>

<p>O projeto, que foi contemplado com o Prêmio Myriam Muniz 2010 da FUNARTE/Ministério da Cultura, conta ainda com cenário da premiada Miniusina de Criação e figurino do estilista Solon Diego, destaque na última edição do Rio Moda Hype, no Rio de Janeiro. Essa união entre artistas consagrados e novos talentos foi fundamental para traduzir de forma contemporânea e contundente para a cena a temática perturbadora e intencionalmente atraente do espetáculo.</p>

<p>Assim como a primeira ação do Supernova Teatro – o espetáculo “Os Enamorados”, que obteve grande retorno de público e mídia em suas três temporadas entre o Teatro Vila Velha e a Sala do Coro do Teatro Castro Alves – o objetivo é proporcionar ao público uma experiência artística instigante, que ultrapasse o momento da fruição do espetáculo e se estenda desde comentários na internet a ousadas discussões em mesa de bar. Alugo Minha Língua discute os conceitos e limitações que a vida em sociedade impõe às expressões comportamentais de cada indivíduo. Nos versos de Gil Vicente para o espetáculo:
A língua se aluga pro bem e pro mal / Você é normal? Procure uma fuga / Quer ser depravado? Quer ser moralista? / Pois entre na lista do sempre cansado / Padrão que seguimos como num rebanho / Pois pense “o que eu ganho se só repetimos?” / Palavra bonita não será ouvida / Mas nunca na vida é ela que excita / Nesse cabaré que mais que exótico / Que mais que histriônico / É e-ro-tra-gi-cô-mi-co.</p>

<p>Ao adentrar o erotragicômico cabaré de Alugo Minha Língua, a platéia será convidada a refletir sobre seus anseios, desejos e verdades, e a repensar sua “normalidade”. Quem vai dizer o que é o correto?</p>

<p>&quot;Alugo Minha Língua&quot; foi contemplado com o Prêmio Myriam Muniz de Teatro 2010 da FUNARTE/Ministério da Cultura, entretanto o orçamento do projeto necessita ainda de complementação financeira.</p>

<p>Convidamos você a ser um dos colaboradores deste projeto super ousado e que promete atrair grande público.</p>
",alugo-minha-lingua,//player.vimeo.com/video/27926728,http://www.vimeo.com/27926728,"Teatro e Dança",19,,https://s3-sa-east-1.amazonaws.com/cdn.br.catarse/uploads/project/video_thumbnail/288/project_thumb_thumb_open-uri20131125-2-1pju92a,https://s3-sa-east-1.amazonaws.com/cdn.br.catarse/uploads/project/video_thumbnail/288/project_thumb_small_open-uri20131125-2-1pju92a,https://s3-sa-east-1.amazonaws.com/cdn.br.catarse/uploads/project/video_thumbnail/288/project_thumb_large_open-uri20131125-2-1pju92a,https://s3-sa-east-1.amazonaws.com/cdn.br.catarse/uploads/project/video_thumbnail/288/project_thumb_video_cover_open-uri20131125-2-1pju92a,2.30000000000000000000,230.0,3,3,failed,aon,finished,"2011-10-11 02:59:59","2011-10-10 23:59:59","2011-08-12 02:59:59","2011-08-11 23:59:59",,t,t,f,60,"{""total"" : 0, ""unit"" : ""seconds""}","{""total"" : 60, ""unit"" : ""days""}",0,"{""city"" : ""Salvador"", ""state_acronym"" : ""BA"", ""state"" : ""Bahia""}","{""id"" : 21392, ""name"" : ""Luisa Proserpio Fontes Lima""}",0,,f,f,0,f,f,f