project_id,id,user_id,name,headline,budget,goal,about_html,permalink,video_embed_url,video_url,category_name,category_id,original_image,thumb_image,small_image,large_image,video_cover_image,progress,pledged,total_contributions,total_contributors,state,mode,state_order,expires_at,zone_expires_at,online_date,zone_online_date,sent_to_analysis_at,is_published,is_expired,open_for_contributions,online_days,remaining_time,elapsed_time,posts_count,address,user,reminder_count,is_owner_or_admin,user_signed_in,in_reminder,total_posts,can_request_transfer,is_admin_role,contributed_by_friends
2882,2882,140054,"DVD Assim Vivemos","DVD Assim Vivemos, com dois filmes que tratam da inclusão escolar de crianças com deficiência de forma direta, reflexiva e envolvente.","O orçamento para projetos anteriores a 24/02/2015 normalmente pode ser encontrado na descrição acima.",40900.0,"<p><strong>Estamos comemorando 10 anos do Assim Vivemos - Festival Internacional de Filmes Sobre Deficiência.</strong> Foram sete cidades, 186 filmes, 68 debates, milhares de espectadores e emoções sem tamanho. Idéias, reflexões e grandes encontros tiveram lugar entre as sessões de filmes sobre pessoas com deficiência de todo o mundo. </p>

<p>Sempre na expectativa de distribuir mais amplamente o acervo dos filmes do festival, buscamos de várias maneiras suporte financeiro para isso, mas apenas em 2007 conseguimos editar um DVD com o patrocínio da Petrobras, através da Lei Rouanet. Apesar de o Banco do Brasil ter abraçado o projeto desde sua primeira edição e continuar patrocinando o festival a cada 2 anos em seus centros culturais, o sonho do DVD foi sendo adiado.</p>

<p>Agora encontramos um caminho alternativo: no Catarse, plataforma de financiamento coletivo, poderemos falar diretamente com quem tem interesse nos filmes do festival. Organizamos os tipos de apoios e suas recompensas correspondentes de modo que possamos entregar todos os DVDs solicitados e ainda utilizar o estoque para distribuir comercialmente em alguma loja online das mais populares, na intenção de facilitar o acesso ao produto. </p>

<p>Pelas regras do Catarse, se o total do projeto não for atingido, cada doação será devolvida para quem contribuiu. Por isso, precisamos de muita ajuda para que esta ideia encontre seus interessados rapidamente, pois o prazo para conseguir os apoios tem limite de 60 dias.</p>

<p>Por outro lado, se o valor dos aportes ultrapassar o valor definido para o projeto, utilizaremos o excedente para mandar produzir mais cópias do DVD. Este é o primeiro de uma série, que poderá se tornar realidade se conseguirmos a adesão do público interessado. </p>

<p><strong>Como no festival, aqui também colocaremos as acessibilidades</strong>, desde o menu, autorado com audiodescrição. Além da audiodescrição dos filmes, haverá também legendas Closed Caption e Janela de Interpretação em LIBRAS. </p>

<p>Se você não conhece ainda, visite o site do Festival Assim Vivemos:
<a class=""alt-link"" href=""http://www.assimvivemos.com.br"" target=""_blank"">www.assimvivemos.com.br</a>
e o site da produtora:
<a class=""alt-link"" href=""http://www.lavoroproducoes.com.br"" target=""_blank"">www.lavoroproducoes.com.br</a></p>

<p>Começamos com dois filmes que abordam o tema fundamental da inclusão nas escolas: Segure a minha mão, de J. Parker, V. Paiva, R. Stocking (EUA, 2011, 17 min) e Incluindo Samuel, de Dan Habib (EUA, 2008, 58 min.). Ambos foram muito apreciados pelo público na edição de 2011 do festival, e o segundo foi o vencedor do Prêmio do Público e de um dos Prêmios de Júri. Colocamos trechos dos filmes no vídeo de apresentação.</p>

<p>Sinopses dos filmes:</p>

<p><strong>Incluindo Samuel / Dir. Dan Habib; EUA, 2008. 58’</strong></p>

<p>Antes de seu filho Samuel ter diagnosticada uma paralisia cerebral, o fotógrafo e jornalista Dan Habib raramente pensava sobre a inclusão de pessoas com deficiência. Agora ele pensa nisso todos os dias. Filmado e produzido durante quatro anos, o premiado documentário de Dan Habib é uma crônica dos esforços de sua família para incluir Samuel em todas as facetas de suas vidas. O filme é um retrato fiel das esperanças e lutas da família, assim como das experiências de outras quatro pessoas com deficiência e suas famílias. Incluindo Samuel é um filme pessoal feito com paixão, que captura as barreiras culturais e sistemáticas da inclusão.</p>

<p><strong>Segure a minha mão / Dir. J. Parker, V. Paiva, R. Stocking, B. Moser; EUA, 2011. 17’</strong></p>

<p>Segure minha mão explora o significado da diferença e da igualdade na vida de Eliza Schaaf, uma moça de 20 anos com Síndrome de Down. Tendo crescido com o princípio da inclusão, Eliza sempre for incluída com seus pares. Agora, alcançando uma educação superior, ela precisa encarar a rejeição por causa de sua deficiência. O filme coloca a questão crucial das pessoas com síndrome de Down que foram estimuladas na infância e incluídas na vida escolar: como ter autonomia na vida adulta.</p>

<p><strong>Contribuições e recompensas</strong></p>

<p>A primeira opção é o apoio-amigo; a segunda é uma contribuição que corresponde a uma pré-compra do DVD, incluindo o envio para o endereço indicado. A terceira é a pré-compra de um DVD e doação de outra unidade do DVD para uma instituição ou pessoa indicada. E nas contribuições maiores, a ideia é possibilitar que instituições ou organizações sociais possam ter seus nomes ligados ao projeto, por meio da aplicação de sua logomarca na contracapa do DVD ou no início do filme (no caso do apoio maior). Todas as pessoas e entidades que apoiarem o projeto terão seus nomes listados em um arquivo de texto (com audiodescrição) na autoração do próprio DVD e no site do projeto, com a indicação de quem fez doação para cada instituição. </p>

<p>O custo do nosso projeto se refere aos seguintes serviços, que foram negociados a preços abaixo dos valores de mercado:</p>

<p>Licenciamento dos filmes e taxas legais: R$ 7.500,00
Audiodescrição, legendas e LIBRAS: R$ 6.500,00
Autoração e design: R$ 5.000,00
Organização e produção: R$ 3.000,00
Copiagem, impressão e box (2.000 cópias): R$ 7.200,00
Envio por correio: R$ 7.000,00
Taxa Administração Catarse: R$ 4.700,00
Total: R$ 40.900,00</p>
",assimvivemos,//player.vimeo.com/video/75228334,https://vimeo.com/75228334/,"Cinema e Vídeo",13,,https://s3-sa-east-1.amazonaws.com/cdn.br.catarse/uploads/project/video_thumbnail/2882/project_thumb_thumb_open-uri20131125-2-g7481v,https://s3-sa-east-1.amazonaws.com/cdn.br.catarse/uploads/project/video_thumbnail/2882/project_thumb_small_open-uri20131125-2-g7481v,https://s3-sa-east-1.amazonaws.com/cdn.br.catarse/uploads/project/video_thumbnail/2882/project_thumb_large_open-uri20131125-2-g7481v,https://s3-sa-east-1.amazonaws.com/cdn.br.catarse/uploads/project/video_thumbnail/2882/project_thumb_video_cover_open-uri20131125-2-g7481v,9.97555012224938875300,4080.0,59,58,failed,aon,finished,"2013-11-27 01:59:59","2013-11-26 23:59:59","2013-09-27 14:20:54","2013-09-27 11:20:54",,t,t,f,60,"{""total"" : 0, ""unit"" : ""seconds""}","{""total"" : 60, ""unit"" : ""days""}",0,"{""city"" : ""Rio de Janeiro"", ""state_acronym"" : ""RJ"", ""state"" : ""Rio de Janeiro""}","{""id"" : 140054, ""name"" : ""Lavoro Produções Artísticas LTDA-ME""}",0,,f,f,0,f,f,f