project_id,id,user_id,name,headline,budget,goal,about_html,permalink,video_embed_url,video_url,category_name,category_id,original_image,thumb_image,small_image,large_image,video_cover_image,progress,pledged,total_contributions,total_contributors,state,mode,state_order,expires_at,zone_expires_at,online_date,zone_online_date,sent_to_analysis_at,is_published,is_expired,open_for_contributions,online_days,remaining_time,elapsed_time,posts_count,address,user,reminder_count,is_owner_or_admin,user_signed_in,in_reminder,total_posts,can_request_transfer,is_admin_role,contributed_by_friends
29426,29426,529389,"Gravação do 1º EP da banda ""JUMP in Mission"" ","Com músicas que transformam vidas...
Faça parte desta história e vem ser um JUMPER com a gente!","<p>Metas para o Projeto:</p><ol><li>Gravação das 6 (seis) faixas: R$875,00</li><li>Mixagem: R$975,00</li><li>Masterização: R$675,00</li><li>Produção Final: R$975,00</li></ol>",3500.0,"<p><strong><br></strong></p><p><img src=""https://s3-sa-east-1.amazonaws.com/cdn.br.catarse/uploads/redactor_rails/picture/data/43556/jump5.jpg""></p><p><strong>Sobre o Projeto...</strong><br></p><p><span class=""redactor-invisible-space"">Olá
pessoal, esse é o nosso CATARSE para arrecadar recursos para a gravação de
nosso primeiro EP. Somos a banda do projeto <strong>JUMP
in Mission</strong><span class=""redactor-invisible-space"">, um projeto que existe d</span>esde
janeiro de 2015 realizando atividades em escolas, abrigos e ruas de São José
dos Campos. Todos esses trabalhos são realizados em parcerias com voluntários e
até mesmo com outras entidades, como por exemplo alguns cursos que são
realizados junto ao CAAVI (Centro de Apoio Amor e Vida) em salas de aula
cedidas pela Comunidade Cristã Nova Aliança. </span></p><p>Sendo um <strong>projeto missionário interdenominacional</strong> nossa banda é composta por integrantes de diversos ministérios da cidade, todos com um único foco:<br></p><blockquote class=""fontsize-base quote""> <br> Expandir e estabelecer o Reino de Deus através da manifestação dos seus Filhos!<br><br></blockquote><p>Contamos com sua ajuda para nos apoiar neste primeiro passo! Nosso EP com certeza não terá fins lucrativos, pois o maior lucro que poderíamos ter é ver nossas músicas tocando corações, motivando vidas e transformando mentes!</p><p><strong><br></strong></p><p><img src=""https://s3-sa-east-1.amazonaws.com/cdn.br.catarse/uploads/redactor_rails/picture/data/43557/jump3.jpg""></p><p><strong>O EP...</strong></p><p>Serão o total de 6 (seis) músicas autorais inspiradas no mais <strong>puro e</strong> <strong>simples louvar e adorar ao Senhor.</strong> Músicas que já fazem parte de nossa trajetória no projeto JUMP e que se inspiraram em experiências do mesmo.</p><p>O começo, meio e fim da criação do EP será realizada no Estúdio Ponto diFusão em São José dos Campos, sendo produzido pelo Heraldo Nunes (Shadow of Mercy). Os custos para a realização do EP que incluem gravação, produção, mixagem e masterização, giram em torno de <strong>R$600,00 por faixa + 13% do Catarse.</strong></p><p>Gosto de frisar que este EP <strong>não terá fins lucrativos.</strong> Tudo que recebemos por graça, de graça também daremos. Todos os recursos finais serão destinadas as missões.</p><iframe style=""width: 500px; height: 281px;"" src=""//www.youtube.com/embed/23WnHqQYiJI"" frameborder=""0"" allowfullscreen=""""></iframe><p><strong><br></strong></p><p><strong>Recompensas...</strong></p><p>Não tenha dúvidas que a maior recompensa em ajudar este projeto será ter a certeza da transformação de muitas vidas! No entanto queremos te presentar com alguns itens com a intenção de também te convidar a fazer parte deste projeto juntamente conosco! Adesivos que te lembrarão que perto de você há um projeto que estabelece o Reino de Deus na cidade e camisetas que te farão querer vestir este projeto com o coração, além do download gratuito das músicas que com sua ajuda, com certeza terá uma parte de você!<br><br>O que precisa para ser um JUMPER?</p><p><strong></strong></p><blockquote class=""fontsize-base quote"">""Precisa ter entendido a necessidade de estabelecer o Reino de Deus através de sua vida, fazendo com que todo amor e graça recebida do Senhor seja compartilhada com que realmente necessita.""</blockquote><p><strong><br></strong></p><p><img src=""https://s3-sa-east-1.amazonaws.com/cdn.br.catarse/uploads/redactor_rails/picture/data/43558/jump4.jpg""></p><p><strong><br></strong></p><p><strong>Uma verdade...</strong><br></p><blockquote class=""fontsize-base quote"">“Em nós não há nada que nos permita afirmar que somos capazes de fazer esse trabalho, pois a nossa capacidade <strong>vem de Deus.</strong> É Ele que nos torna capazes de servir a nova aliança, que tem como base não a lei escrita, mas o Espírito de Deus. A lei escrita mata, mas o Espírito de Deus dá a vida.” <strong>2 Cor. 3: 5-6</strong></blockquote><p><img src=""https://s3-sa-east-1.amazonaws.com/cdn.br.catarse/uploads/redactor_rails/picture/data/43560/jump1.jpg""></p><p style=""margin-left: 20px;""><big></big></p><p><strong></strong></p>",projeto_ep_banda_jump_in_mission_dd5e,,,Música,16,https://s3-sa-east-1.amazonaws.com/cdn.br.catarse/uploads/project/uploaded_image/29426/jump6.jpg,https://s3-sa-east-1.amazonaws.com/cdn.br.catarse/uploads/project/uploaded_image/29426/project_thumb_thumb_jump6.jpg,https://s3-sa-east-1.amazonaws.com/cdn.br.catarse/uploads/project/uploaded_image/29426/project_thumb_small_jump6.jpg,https://s3-sa-east-1.amazonaws.com/cdn.br.catarse/uploads/project/uploaded_image/29426/project_thumb_large_jump6.jpg,https://s3-sa-east-1.amazonaws.com/cdn.br.catarse/uploads/project/uploaded_image/29426/project_thumb_video_cover_jump6.jpg,0,0,0,0,failed,flex,finished,"2016-05-19 02:59:59.999999","2016-05-18 23:59:59.999999","2016-04-11 16:55:07.893242","2016-04-11 13:55:07.893242",,t,t,f,2,"{""total"" : 0, ""unit"" : ""seconds""}","{""total"" : 37, ""unit"" : ""days""}",0,"{""city"" : ""São José dos Campos"", ""state_acronym"" : ""SP"", ""state"" : ""São Paulo""}","{""id"" : 529389, ""name"" : ""Gabriel Magaldi (guitarrista JUMPER)""}",0,,f,f,0,f,f,f