project_id,id,user_id,name,headline,budget,goal,about_html,permalink,video_embed_url,video_url,category_name,category_id,original_image,thumb_image,small_image,large_image,video_cover_image,progress,pledged,total_contributions,total_contributors,state,mode,state_order,expires_at,zone_expires_at,online_date,zone_online_date,sent_to_analysis_at,is_published,is_expired,open_for_contributions,online_days,remaining_time,elapsed_time,posts_count,address,user,reminder_count,is_owner_or_admin,user_signed_in,in_reminder,total_posts,can_request_transfer,is_admin_role,contributed_by_friends
2944,2944,192505,"Curta metragem - Ghaya","""A vida de uma menina que observa a vida..."" - Ghaya não é só um curta, é o princípio de duas carreiras... e a realização de um sonho! ","O orçamento para projetos anteriores a 24/02/2015 normalmente pode ser encontrado na descrição acima.",5280.0,"<p><strong>O projeto</strong>
Ghaya é um projeto para um curta metragem <strong>amador</strong> do aspirante Jean Carlos de Oliveira Miranda .
Jean Carlos sou eu, eu sou um desenhista e artista amador, tenho quase uma fobia por cursos de arte, pois sinto que vão matar minha critatividade, e esse é o motivo de eu ter orgulho de ser um amador, <strong>e é a força do cinema amador que queremos mostrar com esse projeto</strong>...</p>

<p>O micro filme mostrará  o cotidiano de Ghaya e suas filosofias sobre o mundo a sua volta...
Ghaya é muito excentrica e especial, e o filme mostrará o mundo de seu ponto de vista, hora entediada, hora eufórica, hora poetiza, e sempre com uma pitada de humor, ou humor negro... essa é Ghaya...</p>

<p><strong>Produção e Orçamento</strong></p>

<p>O roteiro está em produção e o curta não sairá caro pois muitas das cenas serão externas, onde Ghaya observa o mundo, e a produção é programada para ser pequena e independente... o curta deverá ser exibido em festivais de cinema brasileiro, com o nome dos principais colaboradores nos créditos...</p>

<p>A Melhor parte é que com a realização desse projeto, se abrirão portas para vários outros a serem realizados, pois a partir de então já teremos o material com o qual trabalhar...</p>

<p><strong>Equipe</strong>
...uma equipe de dois...
Ghaya nasce de uma longa e própera parceria artistica, dois amadores se metendo no meio cinematrográfico...
A Ghaya da história é muito inspirada na atriz que irá dramatizá-la, e ela em si é um dos principais motivos para esse projeto estar diante de você, espero pegar o melhor lado dela nas câmeras...
O diretor? eu mesmo, com apenas um curta, e vários vídeos não autorais, busco entrar finalmente no meio cinematográfico inteiramente...
Muitos vídeos realmente atingem o objetivo e a mensagem que quero passar, mas por partirem de outro filme, musica, ou inspiração, raramente sinto que fiz algo puramente meu,  essa barreira foi a pouco rompida com o lançamento de “Espírito das Castanheiras” meu primeiro curta metragem surreal e de fato autoral, e quero quebrar mais uma barreira criando meu primeiro filme com diálogos e um enredo mais sólido... que será “Ghaya”</p>
",umdianavidadeGhaya,//player.vimeo.com/video/75014755,https://vimeo.com/75014755,"Cinema e Vídeo",13,,https://s3-sa-east-1.amazonaws.com/cdn.br.catarse/uploads/project/video_thumbnail/2944/project_thumb_thumb_open-uri20131125-2-1c5c313,https://s3-sa-east-1.amazonaws.com/cdn.br.catarse/uploads/project/video_thumbnail/2944/project_thumb_small_open-uri20131125-2-1c5c313,https://s3-sa-east-1.amazonaws.com/cdn.br.catarse/uploads/project/video_thumbnail/2944/project_thumb_large_open-uri20131125-2-1c5c313,https://s3-sa-east-1.amazonaws.com/cdn.br.catarse/uploads/project/video_thumbnail/2944/project_thumb_video_cover_open-uri20131125-2-1c5c313,0.18939393939393939400,10.0,1,1,failed,aon,finished,"2013-11-24 01:59:59","2013-11-23 23:59:59","2013-09-24 18:16:50","2013-09-24 15:16:50",,t,t,f,60,"{""total"" : 0, ""unit"" : ""seconds""}","{""total"" : 60, ""unit"" : ""days""}",1,"{""city"" : ""Guarapari"", ""state_acronym"" : ""ES"", ""state"" : ""Espírito Santo""}","{""id"" : 192505, ""name"" : ""Jean Carlos de Oliveira Miranda""}",0,,f,f,1,f,f,f