project_id,id,user_id,name,headline,budget,goal,about_html,permalink,video_embed_url,video_url,category_name,category_id,original_image,thumb_image,small_image,large_image,video_cover_image,progress,pledged,total_contributions,total_contributors,state,mode,state_order,expires_at,zone_expires_at,online_date,zone_online_date,sent_to_analysis_at,is_published,is_expired,open_for_contributions,online_days,remaining_time,elapsed_time,posts_count,address,user,reminder_count,is_owner_or_admin,user_signed_in,in_reminder,total_posts,can_request_transfer,is_admin_role,contributed_by_friends
29722,29722,543988,"aLagarta impressa - 21 SOLITUDE","Realize sonhos com amor! aLagarta vai se transformar em revista impressa. Faça parte da mudança! ","<p> O gráfico abaixo mostra como vamos usar o valor que estamos propondo para o projeto. A divisão é bem simples.</p><p><br></p><p><img src=""https://s3-sa-east-1.amazonaws.com/cdn.br.catarse/uploads/redactor_rails/picture/data/44104/aL-IMGsCatarse-Orcamento-01.jpg""></p><p><br></p><p>E os valores são os seguintes:<br>67% para impressão: R$20.400,00;<br>13% para o Catarse: R$3.695;<br>10% para entrega das revistas: R$3.135,00;<br>7% para a produção: R$2.500;<br>2% para divulgação online com ads no facebook e Instagram: R$500.</p><p><strong>Quer conhecer melhor a nossa história?</strong><br>Assista ao vídeo abaixo, realizado para a 20ª edição, em comemoração aos 5 anos de revista e aos 150 anos do livro ""Alice no País das Maravilhas"", que inspirou nosso projeto.</p><p><br></p><p><br></p><iframe src=""//player.vimeo.com/video/133602872"" allowfullscreen="""" width=""500"" frameborder=""0"" height=""281""></iframe><p><img src=""https://s3-sa-east-1.amazonaws.com/cdn.br.catarse/uploads/redactor_rails/picture/data/45556/aL-IMGsCatarse-Recompensas-01.jpg""></p><p>NOVIDADE! <strong>A MODA IMITA A VIDA</strong>, de André Carvalhal (<strong>Limitada</strong>!)</p><p style=""text-align: center;""><img src=""https://s3-sa-east-1.amazonaws.com/cdn.br.catarse/uploads/redactor_rails/picture/data/50020/aL21-Solitude-AMIAV-03.jpg""></p><p>Por R$90 ou mais você recebe a edição #21 na sua casa mais o livro ""A MODA IMITA A VIDA"", de André Carvalhal, na cor verde ou amarela. <br></p><p>Carimbos <strong>aLagarta</strong>  - ""Realize sonhos com amor""<br><strong></strong></p><p style=""text-align: center;""><img src=""https://s3-sa-east-1.amazonaws.com/cdn.br.catarse/uploads/redactor_rails/picture/data/48039/aL21-Catarse-Recompensas-Carimbos.jpg""></p><p><strong></strong></p><p>Por R$100 ou mais, você recebe a edição #21 na sua casa junto com 3 carimbos que formam a frase ""Realize sonhos com amor"" (não inclui tinta nem almofada).<br><strong></strong></p><p><strong>aLagarta</strong> + <a target=""_blank"" href=""http://confeitariamag.com/"">CONFEITARIA</a></p><p><img src=""https://s3-sa-east-1.amazonaws.com/cdn.br.catarse/uploads/redactor_rails/picture/data/45588/aL21-Catarse-Recompensas-06-FanzineTempo.jpg""></p><p>Por R$45 ou mais, você recebe a edição #21 na sua casa junto com o Fanzine <a target=""_blank"" href=""http://confeitariamag.com/blog-post/nosso-primeiro-fanzine/"">Tempo: achados e perdidos</a><a target=""_blank""></a>.</p><p><img src=""https://s3-sa-east-1.amazonaws.com/cdn.br.catarse/uploads/redactor_rails/picture/data/46070/aL21-Catarse-Recompensas-08-Artistas.jpg""></p><p>Por R$80 ou mais, você recebe a edição #21 na sua casa junto com um exemplar do livro <a target=""_blank"" href=""http://confeitariamag.com/editora/nao-conheco-ninguem-que-nao-seja-artista-2/"">Não conheço ninguém que não seja artista</a>.</p><p><img src=""https://s3-sa-east-1.amazonaws.com/cdn.br.catarse/uploads/redactor_rails/picture/data/46072/aL21-Catarse-Recompensas-07-Ampr.jpg""></p><p> Por R$90 ou mais, você recebe a edição #21 na sua casa junto com um exemplar do livro <a target=""_blank"" href=""http://confeitariamag.com/editora/amor-pequenas-estorias/"">Amor; pequenas estórias</a>. <strong></strong></p><p><strong>aLagarta</strong> + Carol Lancelloti</p><p><img src=""https://s3-sa-east-1.amazonaws.com/cdn.br.catarse/uploads/redactor_rails/picture/data/45967/aL21-Catarse-Recompensas-06-Carol.jpg""></p><p>Por R$50 ou mais, você recebe a edição #21 mais um print tamanho 30 x 45 cm em papel fotográfico fosco de uma foto de Carol Lancelloti. </p><p><img src=""https://s3-sa-east-1.amazonaws.com/cdn.br.catarse/uploads/redactor_rails/picture/data/45871/aL21-Catarse-Recompensas-05-Carol.jpg"">Por R$400 ou mais, você
 recebe a edição #21 mais um ensaio fotográfico por Carol Lancelloti, 
com 3 horas de duração, clicado em locação externa (a combinar), com 
direito a 15 fotos tratadas entregues digitalizadas e em alta resolução.
 *Válido somente na cidade do Rio de Janeiro. Ensaio pessoal (estilo portrait) válido somente para pessoa física. ;)<br></p><p><strong>aLagarta</strong> + <a href=""http://www.desvioclin.com.br/"" target=""_blank"">CLIN</a></p><p><img src=""https://s3-sa-east-1.amazonaws.com/cdn.br.catarse/uploads/redactor_rails/picture/data/46939/aL-IMGsRecompensasCatarse-10-CLIN.jpg""></p>Você leva a edição #21 mais um vale presente no valor de R$20 para comprar um acessório lindo na loja virtual da <a target=""_blank"" href=""http://www.desvioclin.com.br/"">CLIN</a>.<p><strong>aLagarta</strong> + <a target=""_blank"">Meu Óculos de Madeira</a></p><p><img src=""https://s3-sa-east-1.amazonaws.com/cdn.br.catarse/uploads/redactor_rails/picture/data/45587/aL21-Catarse-Recompensas-05-MeuOculosMadeira.jpg""></p><p><a target=""_blank""></a></p><p><a target=""_blank""></a>Por R$70 ou mais, você recebe a edição #21 na sua casa mais um vale presente de R$50 na loja virtual da marca cearense <a target=""_blank"">Meu Óculos de Madeira</a>.</p><p>aLagarta + <a href=""https://www.facebook.com/alinetercete/?fref=ts"">Alinet</a> e <a target=""_blank"" href=""http://gessicahage.com/"">Géssica Hage</a></p><p><img src=""https://s3-sa-east-1.amazonaws.com/cdn.br.catarse/uploads/redactor_rails/picture/data/46767/aL-IMGsRecompensasCatarse-AlineTHage.jpg""></p>Por R$350, você leva a edição #21 mais um print em papel fotográfico brilhante tamanho 20x30 de uma foto de Géssica Hage bordada pela artista Alinet. Essa colaboração foi feita especialmente para o editorial ""<a target=""_blank"" href=""http://www.alagarta.com/primeiro-ciclo/edicao-15/editoriais-edicao-15/se-o-medo-e#pagina-35"">Se o medo é</a>"", da edição #15 e a fotografia é <strong>original</strong>. <strong>VENDIDO.</strong><p><br><strong></strong></p><p><strong>aLagarta</strong> + <a target=""_blank"">Alinet</a></p><p><img src=""https://s3-sa-east-1.amazonaws.com/cdn.br.catarse/uploads/redactor_rails/picture/data/46769/aL21-Catarse-Recompensas-02-AlinetESGOTADO.jpg""></p><p>1. Por R$180 você recebe a edição #21 na sua casa junto com uma capa de 
livro pintada com tinta acrílica (são apenas dois itens e o primeiro 
apoio poderá escolher sua favorita). <strong>ESGOTADOS</strong><br><a target=""_blank""></a></p><p><img src=""https://s3-sa-east-1.amazonaws.com/cdn.br.catarse/uploads/redactor_rails/picture/data/46770/aL21-Catarse-Recompensas-03-AlinetESGOTADO.jpg""></p><p>2. Por R$140 você recebe a edição #21 na sua casa junto com uma <a target=""_blank"" href=""https://www.facebook.com/alagarta/photos/pcb.1736860833263681/1130525283645489/?type=3&theater"">pintura em aquarela sobre papel reciclado</a>, tamanho A4 (sem moldura). <strong>ESGOTADOS</strong><br></p><p><img src=""https://s3-sa-east-1.amazonaws.com/cdn.br.catarse/uploads/redactor_rails/picture/data/46771/aL21-Catarse-Recompensas-04-AlinetESGOTADO.jpg""></p><p>3. Por R$280 ou mais, você recebe a edição #21 na sua casa mais uma <a target=""_blank"" href=""https://www.facebook.com/alagarta/photos/pcb.1736860833263681/1130525240312160/?type=3&theater"">pintura em tinta acrílica e cola colorida sobre papel reciclado</a>, tamanho A3 (sem moldura). <strong>ESGOTADOS</strong></p><p><strong>aLagarta</strong> + <a target=""_blank"">La Negra de Goya</a> <a href=""https://www.facebook.com/lanegradegoya/?fref=ts""><br></a></p><p><img src=""https://s3-sa-east-1.amazonaws.com/cdn.br.catarse/uploads/redactor_rails/picture/data/45558/aL21-Catarse-Recompensas-01-LNdG.jpg""><a href=""https://www.facebook.com/lanegradegoya/?fref=ts""><br></a></p><p>Por R$80 ou mais, você recebe a edição #21 na sua casa mais um lindo <a target=""_blank"" href=""https://www.facebook.com/lanegradegoya/photos/pb.158523424271662.-2207520000.1461175895./335209583269711/?type=3&theater"">cartaz silk screen</a> da artista La Negra de Goya (Bel Petri). Ou, por R$200 ou mais, recebe a edição #21 mais uma <a target=""_blank"" href=""https://www.facebook.com/lanegradegoya/photos/pb.158523424271662.-2207520000.1461175089./338948772895792/?type=3&theater"">aquarela com nanquin sobre papel especial</a>, original e assinada (15x15cm), sem moldura. <strong>ESGOTADOS</strong></p><p class=""fontsize-large""><br>_________________________________________</p><p class=""fontsize-large""><em>English translation:<br></em></p><p><em><strong>The project</strong></em></p><p><em>aLagarta (the Caterpillar) is a magazine that comes out of restless, creative and pulsing minds. Founded in 2010, it's Brazil's first women's independent and collaborative emag. In a total of 5 years online, we’ve published twenty editions with unique and original content. aLagarta started as a project among friends, but it currently counts with collaboration of many artists from Brazil and abroad. The magazine is an undeniable mutant; it has its own life and it turns into a butterfly every time a new edition comes out.<br><br>This year, our format will significantly change. We will be a printed magazine!<br>Realiizing the influence and relevance of the magazine in the Brazilian creative market, we understand that aLagarta has the potential to serve as research material for students and professionals as well.<br><br>So we started our transformation. We want to bring the world into the heart of every reader, while we open our hearts to the world in the purest connection.<br><br>We believe that we can achieve whatever we dream. In this pressed cycle, our creative freedom is still a priority, as it’s creating everything with love and keep following the independent vein (as we will be our own publisher).<br><br>aLagarta will remain a reference of what is beautiful, feminine, fresh and charming. For us, it’s still very important to be an affordable magazine, as well as a timeless and experimental publication. It is even more special to make this dream possible by many hands, in a collaborative way, with the involvement of each one of you.</em></p><p><em><br><strong>Our theme for this edition</strong></em><em><br><br>Our perception of the human moment is a superficial connection, externally and virtually speaking: people are always online, connected in at least two different social networks. Silence is rarely appreciated.<br><br>The deep, internal and meditative connection is increasingly rare – happening only as luxurious moments . But this inner connection is crucial to creativity.<br><br>We believe that nature is perfect, including human nature. The natural state of the mind is calm, peace and emptiness. And moments in solitude provides us with this state, which is almost an ecstasy with creative purpose. So, in this issue our purpose is to talk about this state. A pre-creative state. The solitude state.<br><br></em><em><strong>Our sections:</strong></em><em><br>Trend and Behaviour; Fashion and Beauty; Arts and Design; Music; Film and Literature; Gastronomy; Free columns; Translation to English.</em></p><p><em><br></em><em><strong>Team and Collaborators:</strong></em><em><br>Our team is formed by artists, photographers, designers, journalists and writers. Creators in essence who are passionate about what they do.</em></p><p><em><br>Team:  Alinet, Ana Raquel Maia, Bel Petri, Carol Lancelloti, Cinthia Pascueto, Crib Tanaka, Fabiane Secches, Fabíola Greco, Fernanda Sala, Fernanda Ventura, José Carlos, Suzuki, Leo Pope, Mari Naccaratti, Paulinha Alves, Tamires Ribeiro, Thiago Tomé, Veronica Fantoni e Viviana Borlido.</em></p><p><em><br>Collaborators:  Carol Aquino, Carol Delgado, Carol Incerti, Bruna Valença, Bruna Venâncio, Géssica Hage, Mariana Ferrari, Tati Ruediger e Vanessa Mello.</em></p><p><em><br><br></em><em><strong>Social cause and Profit sharing: </strong></em></p><p><em>After discounting taxes and other fees, we will use part of the sales revenue to print the next issue (#22), which will be launched in November this year. This way, we will continue our work without a new crowdfunding. Therefore, this crowdfunding does not focus only on completion of the first printed edition, but on a necessary basis to continue in the printed format from now on. After all, we want to be self-sustained.</em></p><p><em>We also want to take the opportunity to help those in need. So we’ll also use 10% to help ViDançar Project, which provides free dance lessons for children and teens in Morro do Alemão community, in Rio de Janeiro.</em></p><p><em>Finally, we will distribute our profit equally among the 18 members of the magazine staff. We made sure to separate a part of the sales profit to remunerate our team, valuing these professionals. This amount will also cover our production costs (which until now, came out of our pockets). aLagarta has always provided a basic allowance for some collaborators, especially photographers and editorial models. In the near future, we plan to cover all of these costs as well.  </em></p><p><em>aLagarta does not believe in the current income distribution model that happens in most part of the planet. We want to change and we know that it is possible, if we start from the inside out, using the magazine as an experimental model.</em></p><p><em>Collaborating with this project means that you will also be an actively participant in this paradigm shift, which will take place in a transparent way. We can change the economy in any company or business model. We chose to make that change now and with a magazine, through our first printed edition. Are you with us? </em></p><p><em><br></em><em><strong>Specifications: </strong></em></p><p><em>aLagarta has unique and visually charming content. The magazine will be a collector's item. </em></p><p><em>112 color pages <br>28x21cm<br>Coated matte paper 115 g / m2 with environmental certification FSC<br>Cover in supreme paper 250g / m2<br></em></p><p><em><br><strong></strong></em></p><p><em><strong>Shipping methods:</strong><strong></strong> We’ll be updating delivery time and cost for orders outside Brazil very soon. <br></em></p><p><em><strong>Release date:</strong> June 21, 2016</em></p><p><em><br><strong>Our costs: </strong><br>67% Print: R $ 20,400.00;<br>13% for Catarse (this crowdfunding platform): R$ 3,695;<br>10% for the delivery of magazines in Brazil: R$ 3,135.00;<br>7% for production: R$ 2,500;<br>2% for marketing: R$ 500.</em><br></p>",30500.0,"<p> (<em>Roll down for english translation</em>)<br><br>Por 5 anos, fomos uma revista virtual que abriu espaço para novos artistas e conquistou um público apaixonado por seu conteúdo singular. Esse ano, nosso formato se transformará de forma bem significativa. Seremos uma revista impressa!<br></p><p>Percebendo a influência e relevância da revista no mercado criativo, entendemos que <strong>aLagarta</strong> tem potencial para servir também como material de pesquisa para estudantes e profissionais.</p><p>Sendo assim, iniciamos um movimento de transformação. Queremos trazer o mundo para dentro do coração de cada leitora de forma leve e acolhedora, ao mesmo tempo que abriremos o nosso coração para o mundo, na mais pura conexão.</p><p>A gente acredita que é possível sonhar e realizar. Nesse ciclo impresso, a liberdade criativa ainda será prioridade, assim como fazer tudo com amor e ainda seguindo a veia independente (pois seremos nossa própria editora).<br></p><p><strong>aLagarta</strong> se manterá como referência daquilo que é bonito, feminino, fresco e encantador. Para nós, ainda é muito importante ser uma revista acessível, atemporal, experimental e que divulga novos talentos brasileiros. Mais importante ainda é ser uma revista feita à muitas mãos e viabilizada de forma colaborativa, com a participação de cada um de vocês.</p><p><strong>Ainda não conhece aLagarta? <a target=""_blank"" href=""http://www.alagarta.com/primeiro-ciclo/"">Clique aqui</a> para conhecer!</strong></p><p><strong><img src=""https://s3-sa-east-1.amazonaws.com/cdn.br.catarse/uploads/redactor_rails/picture/data/44927/aL-IMGsCatarse-CapaContra-02.jpg""></strong></p><p><strong></strong></p><p><img src=""https://s3-sa-east-1.amazonaws.com/cdn.br.catarse/uploads/redactor_rails/picture/data/45475/aL-IMGsCatarse-Lancamento-02.jpg""></p><p><strong></strong></p><p><strong>O tema desta edição:<br></strong></p><p><strong></strong></p><iframe style=""width: 500px; height: 281px;"" src=""//player.vimeo.com/video/156958107"" allowfullscreen="""" frameborder=""0""></iframe><p>Nossa percepção sobre o momento humano é de uma ultra-<em>hyper</em>-mega-conexão superficial, externa e virtual: todos sempre <em>online</em>, ligados e conectados em pelo menos duas redes sociais diferentes. Raramente o silêncio é apreciado.</p><iframe style=""width: 500px; height: 281px;"" src=""//player.vimeo.com/video/166861553"" allowfullscreen="""" frameborder=""0""></iframe><p>A conexão profunda, interna e meditativa é cada vez mais rara — só acontecendo em momentos de luxo. Mas essa conexão é de extrema importância para a criatividade.</p><p>Acreditamos que a natureza é perfeita, inclusive a natureza humana. O estado natural da mente é a calma, a paz e o vazio. Os momentos em solitude nos proporcionam este estado, quase um êxtase com propósito criativo.</p><iframe style=""width: 500px; height: 281px;"" src=""//player.vimeo.com/video/166871152"" allowfullscreen="""" frameborder=""0""></iframe><p>Então, nessa edição a proposta é falar sobre este estado tão necessário. Um estado pré-criativo. O estado de solitude.</p><p><img src=""https://s3-sa-east-1.amazonaws.com/cdn.br.catarse/uploads/redactor_rails/picture/data/44013/aL-IMGsCatarse-LogoEdicao-01.jpg""></p><p><strong>Seções: </strong><br>Tendência e Comportamento; Moda e Beleza; Artes e <em>Design</em>; Música; Cinema e Literatura; Gastronomia; Colunas livres; Tradução para língua inglesa.<br><br></p><p style=""text-align: center;""><em><img src=""https://s3-sa-east-1.amazonaws.com/cdn.br.catarse/uploads/redactor_rails/picture/data/44014/aL-IMGsCatarse-Espelho-01.jpg"">Acima, o espelho da edição que serve como guia de nosso conteúdo.</em></p><p style=""text-align: center;""><em></em><br><em></em></p><p><strong>Equipe e Colaboradoras da edição:</strong><br>Nosso time é formado por artistas plásticos, fotógrafos, designers, jornalistas e escritores. Criadores em essência, que são apaixonados pelo que fazem.<br></p><p><strong>Equipe: </strong><br>Alinet, Ana Raquel Maia, Bel Petri, Carol Lancelloti, Cinthia Pascueto, Crib Tanaka, Fabiane Secches, Fabíola Greco, Fernanda Sala, Fernanda Ventura, José Carlos, Suzuki, Leo Pope, Mari Naccaratti, Paulinha Alves, Tamires Ribeiro, Thiago Tomé, Veronica Fantoni e Viviana Borlido.</p><p><strong>Colaboradoras desta edição:</strong><br>Carol Aquino, Carol Delgado, Carol Incerti, Bruna Valença, Bruna Venâncio, Géssica Hage, Mariana Ferrari, Tati Ruediger e Vanessa Mello.</p><p><br></p><p><br><strong>Causa social e divisão de lucros:</strong><br>Após descontar impostos e outras taxas, usaremos parte do faturamento das vendas para imprimir a próxima edição (#22), que lançará em Novembro desse ano. Assim, daremos continuidade ao nosso trabalho sem precisar de um novo financiamento coletivo. Esse crowdfunding, portanto, não foca somente na realização da primeira 
edição impressa, mas sim em uma base necessária pra continuarmos nesse 
formato daqui pra frente. Afinal, queremos ser  auto-sustentáveis.</p><p>Queremos aproveitar a oportunidade para ajudar quem precisa. Então, também doaremos 7% dos lucros para o <a target=""_blank"" href=""https://www.facebook.com/Projeto-Vidan%C3%A7ar-652356821457044/?fref=ts"">Projeto ViDançar</a>, que proporciona aulas gratuitas de balé e hip hop para crianças e jovens na comunidade do Morro do Alemão, no Rio de Janeiro. <br></p><p>Por fim, vamos distribuir o lucro de forma igual entre os 18 membros da equipe fixa da revista. Fizemos questão de separar uma parte do lucro das vendas para remunerar nossa equipe (que há quase 6 anos trabalha no amor), valorizando esses profissionais. Esse valor também vai cobrir nossos custos de produção (que até hoje, saíram do nosso bolso). aLagarta sempre proporcionou uma ajuda de custo básica para alguns colaboradores, principalmente fotógrafos e modelos de editoriais. Agora, pretendemos cobrir esses custos também com o lucro das vendas. </p><p><strong>aLagarta</strong> não acredita no modelo atual de distribuição de renda que 
acontece na maior parte do planeta. Queremos mudar e sabemos que é 
possível, se começarmos de dentro pra fora, usando a revista como 
modelo. Sendo assim, criamos um sistema de divisão de lucros 
transparente para a nossa equipe, assim como um orçamento transparente 
para vocês, demonstrados no gráfico abaixo: </p><p><br></p><p><img src=""https://s3-sa-east-1.amazonaws.com/cdn.br.catarse/uploads/redactor_rails/picture/data/44106/aL-IMGsCatarse-Divisao-01.jpg""></p><p><img src=""https://s3-sa-east-1.amazonaws.com/cdn.br.catarse/uploads/redactor_rails/picture/data/45476/aL-IMGsCatarse-Paradigma-02.jpg""><strong>Colaborando com este projeto, você participa ativamente dessa mudança de paradigma, que acontece de forma transparente. Podemos mudar a economia em qualquer empresa ou modelo de negócio. Nós escolhemos transformar agora e com uma revista, já desde a nossa primeira edição impressa. Vem com a gente?</strong><br></p><p><br></p><p><strong></strong></p><p><br><strong></strong></p><p><strong></strong><strong>Especificações técnicas da revista:</strong><br>Com conteúdo exclusivo e visualmente encantador, a revista será um item de colecionador.<br>112 páginas coloridas de miolo<br>28x21cm<br>Papel couché fosco 115g/m2 com certificação ambiental FSC<br>Capa em papel supremo 250g/m2<del></del><br><br>Anúncios: segunda, terceira e quarta capa.<br><br></p><p><strong>Formas de envio:</strong><br>Revista e recompensas serão enviadas via transportadora chegando em até 15 dias úteis após o lançamento, ou seja, 15 dias úteis contados a partir do dia 21 de Junho de 2016. O prazo de entrega pode variar, dependendo da região.</p><p><strong>Lançamento:</strong> <br>21 de Junho de 2016<em></em></p><p><em>O valor do frete já está incluso em todos os valores especificados ao lado.</em></p><hr><p><em></em></p>",alagarta_impressa_21_solitude_65b5,//player.vimeo.com/video/162945306,http://vimeo.com/162945306,Artes,1,https://s3-sa-east-1.amazonaws.com/cdn.br.catarse/uploads/project/uploaded_image/29722/aL21-Card-Catarse-1.jpg,https://s3-sa-east-1.amazonaws.com/cdn.br.catarse/uploads/project/uploaded_image/29722/project_thumb_thumb_aL21-Card-Catarse-1.jpg,https://s3-sa-east-1.amazonaws.com/cdn.br.catarse/uploads/project/uploaded_image/29722/project_thumb_small_aL21-Card-Catarse-1.jpg,https://s3-sa-east-1.amazonaws.com/cdn.br.catarse/uploads/project/uploaded_image/29722/project_thumb_large_aL21-Card-Catarse-1.jpg,https://s3-sa-east-1.amazonaws.com/cdn.br.catarse/uploads/project/uploaded_image/29722/project_thumb_video_cover_aL21-Card-Catarse-1.jpg,72.80983606557377049200,22207.0,195,191,failed,aon,finished,"2016-06-09 02:59:59.999999","2016-06-08 23:59:59.999999","2016-04-15 12:26:19.045435","2016-04-15 09:26:19.045435",,t,t,f,54,"{""total"" : 0, ""unit"" : ""seconds""}","{""total"" : 54, ""unit"" : ""days""}",5,"{""city"" : ""Rio de Janeiro"", ""state_acronym"" : ""RJ"", ""state"" : ""Rio de Janeiro""}","{""id"" : 543988, ""name"" : ""aLagarta""}",12,,f,f,60,f,f,f