project_id,id,user_id,name,headline,budget,goal,about_html,permalink,video_embed_url,video_url,category_name,category_id,original_image,thumb_image,small_image,large_image,video_cover_image,progress,pledged,total_contributions,total_contributors,state,mode,state_order,expires_at,zone_expires_at,online_date,zone_online_date,sent_to_analysis_at,is_published,is_expired,open_for_contributions,online_days,remaining_time,elapsed_time,posts_count,address,user,reminder_count,is_owner_or_admin,user_signed_in,in_reminder,total_posts,can_request_transfer,is_admin_role,contributed_by_friends
29765,29765,548972,"Ser + Humano","Reformulando o indivíduo do Sec. XXI
Escola de propósitos","<p>Logo - Identidade visual R$ 4.000,00</p><p>Material impresso (papelaria) R$2.500,00</p><p>Site R$4.000,00</p><p>Papelaria escritório R$500,00</p><p>Verba de produção para 6 meses de trabalho R$2.800,00</p><p>Verba de representação para 6 meses R$3.500,00</p><p>Verba de reembolso de gasolina e taxi (reuniões) 6 meses R$3.000,00</p><p>Verba caixinha R$750,00 6 meses de trabalho</p><p>Escritório aluguel 6 messes  total R$19.800,00</p><p>Salário gestor R$60.000,00  6 meses</p><p>salário assistente executiva R$18.000,00</p><p>Salário atendimento comercial R$18.000,00</p><p>Salário produtor R$15.000,00</p><p>Salário estagiário R$6.000,00</p><p>Verba freela jornalista R$9.500,00</p><p>Verba freela designer R$9.500,00<br></p><p>Verba divulgação : 45.000,00 (6 meses)</p><p>Benefícios </p><p>vale-alimentação 6 meses - 5 pessoas (relativo a 23 reais por dia, 22 dias por mês, 6 meses) total R$15.180,00</p><p>Passagem de ônibus 6 meses - 5 pessoas (relativo a 7 reais por dia, 22 dias por mês, 6 meses) total R$5.544,00</p><p>8 palestras</p><p>- aluguel 4 espaços para eventos R$2.300,00 x 4 = R$9.200,00</p><p>- coffee breaks - R$23.000,00 refeições para 460 pessoas (115 por evento)</p><p>- banner, material de divulgação, vídeo para eventos - R$6.000,00</p><p>- estimativa de preços com brindes para eventos - R$3.600,00</p><p>- estimativa de preços palestrantes - R$32.000,00</p><p>Total: R$307.874,00</p>",347874.0,"<p>Oi eu tenho um sonho. Pena que sonhar não é exatamente de graça...</p><p>Eu não quero salvar as baleias nem transformar o mundo. </p><p>Só queria me entender dentro desse mundo, acarinhá-lo e, assim, deixar que ele me acarinhe. Foi aí que tive uma ideia.</p><p>A gente se pega brigando com a vida porque não trabalha para fazer as pazes com ela.</p><p>Taí, essa é a Andréia, 41 anos, espírita, voluntária disponível*(depois explico melhor esse conceito), mãe de uma filha de coração Bárbara (que roubou meu coração e nem pensa em devolver), esposa do Rodrigo há 15 anos e filha de dois migrantes nordestinos que me ensinaram o que é viver. Eu tenho eplepsia, é bom contar. Porque todos esses elementos me compõem. Amo a vida, amo as pessoas, o verbo amar é transitivo e direto e reto na minha vida.</p><p>E minha proposta de empresa - que também vem ao encontro de valores que pratico - é a seguinte:<br></p><p>Já pensou proporcionar as pessoas a oportunidade de refletir e
aprender sobre si mesmo, dentro de um contexto de sociedade do Século XXI?</p><p>As
pessoas do novo tempo precisam pensar e atuar com coerência sobre temas como
paridade de gêneros, educação das novas gerações, tolerância religiosa,
preconceito, estilo de vida x classes social, lowconsumerism, empoderamento
feminino entre tantos temas que nos cercam e nos reformam ao mesmo tempo.</p><p>A ideia
de nosso espaço é elaborar essas temáticas e dinâmicas sob uma ótica e valores
contemporâneos, convidando as pessoas a experimentarem um pouco desses
conceitos.</p><p>Nossa
sincera vontade é promover algo de bom com nosso trabalho. Propósito: um mundo
melhor, simples e ambicioso assim, mas o que faz um mundo melhor somos nós e
nossas iniciativas.</p><p>Para
colocar esse sonho de pé é preciso montar uma empresa, a empresa seria a
Mind&Feel, responsável pelo projeto Ser+Humano.</p><p>Na
Mind&Feel todas as experiências são pagas da seguinte forma:</p><p>1) a
empresa contará com doadores - que acreditam no propósito e fazem doações para
manutenção da empresa. A empresa reverte 10% dessas doações em novas
doações para gerar uma cadeia do
bem (ONG´s). Os valores das doações (mensais ou em cotas únicas), podem partir
de um valor mínimo.</p><p>2) a
empresa promoverá palestras e experiências onde o cliente PAGA O QUANTO ACHA
QUE VALE. Partimos de um valor mínimo, sem teto máximo.</p><p>3) os
eventos, palestras e vivências serão PATROCINADOS</p><p>4) a
Mind&Feel, também, produzirá projetos autorais de conteúdo incentivados </p><p>5) os
formatos de palestra podem ser ITINERANTES, ou seja, percorrer o Brasil</p><p>6) A
Mind&Feel terá PRODUTOS para venda, com preços fixos, vendidos on-line e,
também, nos eventos. A mensagem vem ao encontro dos propósitos da empresa:
disseminar o bem e a reforma interior.</p><p>7) Contar com 3 eventos abertos de prestação de serviços por ano
gratuitos, sem custo para ninguém</p>",sermaishumano,,,Educação,31,https://s3-sa-east-1.amazonaws.com/cdn.br.catarse/uploads/project/uploaded_image/29765/ser_humano.jpg,https://s3-sa-east-1.amazonaws.com/cdn.br.catarse/uploads/project/uploaded_image/29765/project_thumb_thumb_ser_humano.jpg,https://s3-sa-east-1.amazonaws.com/cdn.br.catarse/uploads/project/uploaded_image/29765/project_thumb_small_ser_humano.jpg,https://s3-sa-east-1.amazonaws.com/cdn.br.catarse/uploads/project/uploaded_image/29765/project_thumb_large_ser_humano.jpg,https://s3-sa-east-1.amazonaws.com/cdn.br.catarse/uploads/project/uploaded_image/29765/project_thumb_video_cover_ser_humano.jpg,0,0,0,0,failed,aon,finished,"2016-06-14 02:59:59.999999","2016-06-13 23:59:59.999999","2016-04-14 18:35:25.409345","2016-04-14 15:35:25.409345",,t,t,f,60,"{""total"" : 0, ""unit"" : ""seconds""}","{""total"" : 60, ""unit"" : ""days""}",0,"{""city"" : ""São Paulo"", ""state_acronym"" : ""SP"", ""state"" : ""São Paulo""}","{""id"" : 548972, ""name"" : ""Andreia Porto""}",0,,f,f,0,f,f,f