project_id,id,user_id,name,headline,budget,goal,about_html,permalink,video_embed_url,video_url,category_name,category_id,original_image,thumb_image,small_image,large_image,video_cover_image,progress,pledged,total_contributions,total_contributors,state,mode,state_order,expires_at,zone_expires_at,online_date,zone_online_date,sent_to_analysis_at,is_published,is_expired,open_for_contributions,online_days,remaining_time,elapsed_time,posts_count,address,user,reminder_count,is_owner_or_admin,user_signed_in,in_reminder,total_posts,can_request_transfer,is_admin_role,contributed_by_friends
29891,29891,494390,"Andarilhos da Noite - Despertar","""Todo mundo guarda um pouco de ocultismo e mistério dentro de si...""","<p><img src=""https://s3-sa-east-1.amazonaws.com/cdn.br.catarse/uploads/redactor_rails/picture/data/45847/Gr%C3%A1fico.png""></p>",3955.0,"<p style=""text-align: justify;"">Andarilhos da Noite - Despertar
surgiu no ano de 2011 e, por muitas vezes, foi quase esquecido. Mas a história
gritou de dentro de uma gaveta até que não se pode adiar a necessidade de
escrevê-la. O Luneverso ― o universo do livro ― é um universo de ficção em que
as noites são mais longas do que os dias e mostra que os terrores contados em
histórias em volta da fogueira podem existir e até te encontrar no lugar
julgado o mais seguro. É um universo para todos. Afinal, todo mundo guarda um
pouco de ocultismo e mistério dentro de si... E aqui é onde a chama do medo nos
une. Não desiste e nem se deixa corromper.</p><p><img src=""https://s3-sa-east-1.amazonaws.com/cdn.br.catarse/uploads/redactor_rails/picture/data/45848/AdN_Title_c%C3%B3pia.jpg"" alt="""" style=""display: block; margin: auto;""></p><p style=""text-align: justify;"" rel=""text-align: justify;"">Quando enviado em uma busca de um caso sem pistas, o caçador Jack Lunewalker descobre uma trama maior do que o do simples caso em que achava estar metido. Além de mistérios de seu passado, ele é atormentado por monstros em sua mente, monstros tão reais quanto os que ele enfrenta nas sombras da noite. Guiado por um padrinho amargurado e ranzinza, com o apoio de amigos que também estão envolvidos com o Mundo Cinza, o jovem caçador terá que aprender a lidar com o que há nele antes de poder resolver os problemas que habitam a escuridão deste mundo.</p><p style=""text-align: justify;"">O primeiro volume da série Andarilhos da Noite traz uma história de fantasia urbana inspirada por aventuras fantásticas e sombrias, além do começo do desenrolar de um mistério que o passado tentou guardar, mas este insiste em trazer do esquecimento.</p><p><img src=""https://s3-sa-east-1.amazonaws.com/cdn.br.catarse/uploads/redactor_rails/picture/data/45849/G%C3%AAnero_c%C3%B3pia.jpg"" alt="""" style=""display: block; margin: auto;""></p><p style=""text-align: justify;"">Andarilhos da Noite ― Despertar é
um romance de fantasia urbana; em terceira pessoa a narrativa conta uma
aventura paranormal no século XXI, com a presença de tecnologia e sua
constante no mundo moderno que conhecemos.<br></p><p style=""text-align: center;""><img src=""https://s3-sa-east-1.amazonaws.com/cdn.br.catarse/uploads/redactor_rails/picture/data/45850/Autor_c%C3%B3pia.jpg""></p><p><img src=""https://s3-sa-east-1.amazonaws.com/cdn.br.catarse/uploads/redactor_rails/picture/data/45853/Profile.jpg"" alt="""" width=""312"" height=""311"" style=""display: block; margin: auto; width: 312px; height: 311px;""></p><p><br></p><p style=""text-align: justify;"">L. J. Lunewalker nasceu em outubro de 1994, no Brasil, por onde encontrou amigos de verdade e faz seu caminho entre as palavras nacionais. Fã de Stephen King, Neil Gaiman, J. R. R. Tolkien, Charles Bukowski, C. S. Lewis e vários outros, ele encontrou suas influências e toma da própria vida os assuntos que o motivam a escrever. Acadêmico de filosofia pela UFMS e escritor freelancer nas horas vagas, passa grande parte de seu tempo estudando suas teorias e ideias para implementação no universo próprio ― que ganhou o apelido carinhoso de Luneverso.<br> Fã assumido de The Ramones e The Cure, ele dança em ruas vazias e escuras em uma batida rápida do punk-gótico que o cativa, vestindo suas costumeiras camisas de flanela e o all-star gasto; a barba por fazer, o cabelo comprido e as olheiras profundas são características que o destacam entre os seus.</p><p style=""text-align: center;""><img src=""https://s3-sa-east-1.amazonaws.com/cdn.br.catarse/uploads/redactor_rails/picture/data/45854/Colabora%C3%A7%C3%A3o_c%C3%B3pia.jpg""></p><p style=""text-align: justify;"">O Catarse é um site de financiamento coletivo que ajuda projetos a saírem do papel com o apoio de gente que acredita neles. Se você acredita nesse projeto, pode ajudar colaborando financeiramente. Em troca, recebe recompensas especiais!</p><p style=""text-align: justify;"">E para contribuir é preciso de um rápido cadastro no site do Catarse ou se conectar pela sua conta do facebook. Você pode doar através de cartão de crédito ou boleto bancário. Se a carteira estiver vazia e você não puder contribuir hoje, o próprio Catarse te ajuda a lembrar. É só selecionar a opção ""lembrar-me"" e receberá um e-mail com aviso nas últimas 48h do projeto.</p><p style=""text-align: center;""><img src=""https://s3-sa-east-1.amazonaws.com/cdn.br.catarse/uploads/redactor_rails/picture/data/45855/Prazos_e_entregas_c%C3%B3pia.jpg""></p><p style=""text-align: justify;"">Aqui é <strong>TUDO ou NADA</strong>, ou seja, se a <i>META FOR ALCANÇADA</i> todo mundo sai feliz, o apoiador ganha suas recompensas e o projeto ganha vida, saindo do papel e indo para a sua casa e livrarias. Mas se a <i>META <strong>NÃO</strong> FOR ALCANÇADA</i>, você recebe seu dinheiro de volta e vou precisar encontrar outras oportunidades para financiar este projeto.</p><p style=""text-align: justify;"">O prazo de entrega é para <strong>agosto</strong> de 2016. Todas as recompensas serão enviadas com frete grátis para todo o Brasil. Para outros países, entrarei em contato no mês de entrega para fechar o valor do envio diretamente com o colaborador estrangeiro.</p><p style=""text-align: center;""><img src=""https://s3-sa-east-1.amazonaws.com/cdn.br.catarse/uploads/redactor_rails/picture/data/45856/Recompensas_c%C3%B3pia.jpg""></p><p style=""text-align: justify;"">• <strong>Agradecimentos:</strong> O nome do apoiador estará em uma área específica da edição como forma de agradecimento pelo apoio ao projeto;</p><p style=""text-align: justify;"">• <strong>Conto:</strong> O apoiador receberá, por e-mail, um conto além do livro. Podendo escolher entre arquivo pdf ou arquivo epub; </p><p style=""text-align: justify;"">• <strong>Conto exclusivo:</strong> O apoiador receberá, por e-mail, um conto exclusivo além do livro e do conto anterior. Podendo escolher entre arquivo pdf ou arquivo epub;</p><p style=""text-align: justify;"">• <strong>Livro digital: </strong>O apoiador receberá, por e-mail, uma edição do livro. Podendo escolher entre arquivo pdf ou arquivo epub;</p><p style=""text-align: justify;"">• <strong>Livro físico: </strong>O apoiador receberá uma edição do livro.</p><p style=""text-align: justify;""><strong>• Livro físico autografado: </strong>O apoiador receberá uma edição do livro autografado e com dedicatória.</p><p style=""text-align: justify;""><strong>• Pôster: </strong>O apoiador receberá um (ou dois) dos dois pôsteres que serão produzidos.</p><p><img src=""https://s3-sa-east-1.amazonaws.com/cdn.br.catarse/uploads/redactor_rails/picture/data/46232/Amostra_c%C3%B3pia.jpg"" alt="""" style=""display: block; margin: auto;""></p><p style=""text-align: center;"">Capítulo um disponível como amostra: <a href=""https://www.wattpad.com/story/70389250-andarilhos-da-noite-despertar"" target=""_blank"">Capítulo um</a></p><p style=""text-align: center;""><img src=""https://s3-sa-east-1.amazonaws.com/cdn.br.catarse/uploads/redactor_rails/picture/data/45857/P%C3%B4ster_c%C3%B3pia.jpg""></p><p><img src=""https://s3-sa-east-1.amazonaws.com/cdn.br.catarse/uploads/redactor_rails/picture/data/45858/P%C3%B4ster-exibi%C3%A7%C3%A3o.jpg"" alt="""" style=""display: block; margin: auto;""></p>",andarilhos_da_noite_despertar_7f17,,"",Literatura,20,https://s3-sa-east-1.amazonaws.com/cdn.br.catarse/uploads/project/uploaded_image/29891/Teste.jpg,https://s3-sa-east-1.amazonaws.com/cdn.br.catarse/uploads/project/uploaded_image/29891/project_thumb_thumb_Teste.jpg,https://s3-sa-east-1.amazonaws.com/cdn.br.catarse/uploads/project/uploaded_image/29891/project_thumb_small_Teste.jpg,https://s3-sa-east-1.amazonaws.com/cdn.br.catarse/uploads/project/uploaded_image/29891/project_thumb_large_Teste.jpg,https://s3-sa-east-1.amazonaws.com/cdn.br.catarse/uploads/project/uploaded_image/29891/project_thumb_video_cover_Teste.jpg,8.59671302149178255400,340.0,11,11,failed,aon,finished,"2016-06-18 02:59:59.999999","2016-06-17 23:59:59.999999","2016-04-18 19:01:56.02497","2016-04-18 16:01:56.02497",,t,t,f,60,"{""total"" : 0, ""unit"" : ""seconds""}","{""total"" : 60, ""unit"" : ""days""}",2,"{""city"" : ""Campo Grande"", ""state_acronym"" : ""MS"", ""state"" : ""Mato Grosso do Sul""}","{""id"" : 494390, ""name"" : ""L. J. Lunewalker""}",2,,f,f,4,f,f,f