project_id,id,user_id,name,headline,budget,goal,about_html,permalink,video_embed_url,video_url,category_name,category_id,original_image,thumb_image,small_image,large_image,video_cover_image,progress,pledged,total_contributions,total_contributors,state,mode,state_order,expires_at,zone_expires_at,online_date,zone_online_date,sent_to_analysis_at,is_published,is_expired,open_for_contributions,online_days,remaining_time,elapsed_time,posts_count,address,user,reminder_count,is_owner_or_admin,user_signed_in,in_reminder,total_posts,can_request_transfer,is_admin_role,contributed_by_friends
300,300,23333,"Ana e o Tenente","Seja um apoiador da temporada carioca de ""Ana e o Tenente"" no Teatro Municipal do Jockey! ","O orçamento para projetos anteriores a 24/02/2015 normalmente pode ser encontrado na descrição acima.",3300.0,"<p>&quot;Ana e o Tenente&quot; de Rafael Camargo é o encontro de artistas experientes e oriundos de grandes companhias teatrais, que tem Isabel Pacheco e Sergio Medeiros – no elenco, Joelson Medeiros – na direção, Ana Paula Cardoso - no cenário, Carla Berri – no figurino, Ricardo Grings - na Luz, Ricco Vianna - na trilha sonora e Daniel Braga - na produção executiva. Profissionais que se estabeleceram em suas carreiras individuais. 
Com um diálogo aparentemente cotidiano a peça investiga de forma bem humorada a ânsia humana por comandar as circunstâncias externas. Desafia e discute a realidade que vemos e debate o conceito de normalidade. A peça trafega por uma sucessão de eventos rotineiros em um ambiente insólito e misterioso. 
Tem a sua reestréia marcada para o dia 15 de outubro de 2011 no Teatro Municipal do Jockey na cidade do Rio de Janeiro. 
Precisamos da sua bem-vinda contribuição para levantar essa produção e somarmos R$ 3.300,00. Ah, tá bem fácil! Vamos todos juntar nossos centavinhos, quebrar nossos porquinhos e ajudar a &quot;Ana e o Tenente&quot;!</p>
",ana-e-o-tenente,,http://www.vimeo.com/28999831,"Teatro e Dança",19,,,,,,100.00000000000000000000,3300.0,40,37,successful,aon,finished,"2011-10-10 02:59:59","2011-10-09 23:59:59","2011-08-11 02:59:59","2011-08-10 23:59:59",,t,t,f,60,"{""total"" : 0, ""unit"" : ""seconds""}","{""total"" : 60, ""unit"" : ""days""}",0,"{""city"" : ""Rio de Contas"", ""state_acronym"" : ""BA"", ""state"" : ""Bahia""}","{""id"" : 23333, ""name"" : """"}",0,,f,f,0,f,f,f