project_id,id,user_id,name,headline,budget,goal,about_html,permalink,video_embed_url,video_url,category_name,category_id,original_image,thumb_image,small_image,large_image,video_cover_image,progress,pledged,total_contributions,total_contributors,state,mode,state_order,expires_at,zone_expires_at,online_date,zone_online_date,sent_to_analysis_at,is_published,is_expired,open_for_contributions,online_days,remaining_time,elapsed_time,posts_count,address,user,reminder_count,is_owner_or_admin,user_signed_in,in_reminder,total_posts,can_request_transfer,is_admin_role,contributed_by_friends
30257,30257,551949,"Poesia Reclamada","""Sonho que se sonha junto é realidade"" 
Vamos tornar? ","<p>Para essa <strong>primeira edição</strong>, serão impressos <strong>2000</strong> exemplares. Para isso, o orçamento demanda uma quantia de <strong>R$ 15.000,00</strong>. No gráfico abaixo, você verá como será utilizado esse dinheiro:</p><p><img src=""https://s3-sa-east-1.amazonaws.com/cdn.br.catarse/uploads/redactor_rails/picture/data/46801/1gr%C3%A1fico.jpg""></p><p>Na impressão, são incluídos valores para a capa, códigos de barra e ISBN, diagramação, etc. </p>",15000.0,"<p><img src=""https://s3-sa-east-1.amazonaws.com/cdn.br.catarse/uploads/redactor_rails/picture/data/46775/capa_2016.jpg""></p><p><br></p><p>“<strong>Poesia Reclamada</strong>” está prestes a nascer como livro e
trazer, pela primeira vez ao mundo físico, o lirismo já conhecido da <em><a href=""https://www.facebook.com/poesiareclamada"">fanpage</a></em> que
o apresentou.  O primeiro do que será uma
série de vários temas, cada um em um livro, traz a temática do <strong>amor</strong> (porque
tudo fica muito melhor quando se começa amor). Assim, selecionamos <strong>cerca de 90
poemas</strong> de variadas estruturas para falar desse sentimento em todas as suas
nuances: alegria, saudade, tristeza, intensidade, depressão e realização amorosas. </p><p><br></p><p>O <strong>título do livro</strong> leva o mesmo da <a href=""https://www.facebook.com/poesiareclamada"">página do Facebook</a>, mas cada edição da série
trará um subtítulo. Qual escolhemos para a primeira? Será surpresa! O que não
será surpresa é o carinho com que cada texto está sendo escolhido para você guardar
consigo, para sempre, como o início dessa inesquecível história literária da
qual você pode fazer parte. </p><p><br></p><p><img src=""https://s3-sa-east-1.amazonaws.com/cdn.br.catarse/uploads/redactor_rails/picture/data/46804/catarse_capa.jpg""><br></p><p>A gente sabe que a maior recompensa é ajudar a <strong>espalhar poesia</strong>, mas, para quem deseja fazer parte dessa jornada, selecionamos alguns regalos, isto é, <strong>lembrancinhas</strong> que lhes serão enviadas para registrar a sua participação neste empreendimento inesquecível. A entrega dos presentes será feita via correio após a produção do livro e seu lançamento.<br></p><p><br></p><p><br></p><hr><p>Eis as <strong>recompensas:</strong></p><p><img src=""https://s3-sa-east-1.amazonaws.com/cdn.br.catarse/uploads/redactor_rails/picture/data/46805/1marcapagina.jpg""><br></p><p style=""margin-left: 160px;""><img src=""https://s3-sa-east-1.amazonaws.com/cdn.br.catarse/uploads/redactor_rails/picture/data/46806/1livro.jpg""></p><p style=""margin-left: 160px;""><br></p><p><img src=""https://s3-sa-east-1.amazonaws.com/cdn.br.catarse/uploads/redactor_rails/picture/data/46807/75.jpg""></p><p><br></p><p style=""margin-left: 200px;""><img src=""https://s3-sa-east-1.amazonaws.com/cdn.br.catarse/uploads/redactor_rails/picture/data/46808/100.jpg""></p><img src=""https://s3-sa-east-1.amazonaws.com/cdn.br.catarse/uploads/redactor_rails/picture/data/46809/300.jpg""><p>* Para o passeio de moto, o colaborador terá de vir pa Campinas. </p><p>O Sorteio do passeio será feito com transmissão ao vivo no dia 13 de junho às 12h00 por meio da página <a href=""https://www.facebook.com/poesiareclamada"" target=""_blank"">Poesia Reclamada</a>. Os passeios do grupo H.O.G. de Campinas são realizados aos sábados e os percursos são variados. A definição do grupo nada tem a ver conosco. Precisaremos verificar os passeios e combinar o sábado que realizaremos.  <strong></strong></p><p><strong>Será sorteado 01 passeio entre todas as doações acima de R$100,00.</strong></p><p><img src=""https://s3-sa-east-1.amazonaws.com/cdn.br.catarse/uploads/redactor_rails/picture/data/46810/1000.jpg""></p><p>** Para o passeio de moto, o colaborador terá de vir para Campinas. </p><p>Quem doar essa quantia ganhará automaticamente o passeio e não precisará participar do sorteio. Os passeios do grupo H.O.G. de Campinas são realizados aos sábados e os percursos são variados. A definição do grupo nada tem a ver conosco. Precisaremos verificar os passeios e combinar o sábado que realizaremos.  </p><p><strong>Todas as doações acima de R$1.000,00 ganharão um passeio</strong></p>",poesiareclamada,//www.youtube.com/embed/ig9cMFHlZp4,https://youtu.be/ig9cMFHlZp4,Literatura,20,https://s3-sa-east-1.amazonaws.com/cdn.br.catarse/uploads/project/uploaded_image/30257/o_livro.jpg,https://s3-sa-east-1.amazonaws.com/cdn.br.catarse/uploads/project/uploaded_image/30257/project_thumb_thumb_o_livro.jpg,https://s3-sa-east-1.amazonaws.com/cdn.br.catarse/uploads/project/uploaded_image/30257/project_thumb_small_o_livro.jpg,https://s3-sa-east-1.amazonaws.com/cdn.br.catarse/uploads/project/uploaded_image/30257/project_thumb_large_o_livro.jpg,https://s3-sa-east-1.amazonaws.com/cdn.br.catarse/uploads/project/uploaded_image/30257/project_thumb_video_cover_o_livro.jpg,110.83846666666666666700,16625.77,237,218,successful,aon,finished,"2016-06-13 02:59:59.999999","2016-06-12 23:59:59.999999","2016-04-28 16:13:20.018208","2016-04-28 13:13:20.018208",,t,t,f,45,"{""total"" : 0, ""unit"" : ""seconds""}","{""total"" : 45, ""unit"" : ""days""}",9,"{""city"" : ""São Paulo"", ""state_acronym"" : ""SP"", ""state"" : ""São Paulo""}","{""id"" : 551949, ""name"" : ""Saulo Pessato""}",12,,f,f,108,t,f,f