project_id,id,user_id,name,headline,budget,goal,about_html,permalink,video_embed_url,video_url,category_name,category_id,original_image,thumb_image,small_image,large_image,video_cover_image,progress,pledged,total_contributions,total_contributors,state,mode,state_order,expires_at,zone_expires_at,online_date,zone_online_date,sent_to_analysis_at,is_published,is_expired,open_for_contributions,online_days,remaining_time,elapsed_time,posts_count,address,user,reminder_count,is_owner_or_admin,user_signed_in,in_reminder,total_posts,can_request_transfer,is_admin_role,contributed_by_friends
308,308,20340,"World of Players - O mundo dos jogadores de MMOs","Documentário sobre jogadores de MMOs e jogos Onlines. Um projeto de jogador para jogadores","O orçamento para projetos anteriores a 24/02/2015 normalmente pode ser encontrado na descrição acima.",6000.0,"<p>World of Players é a produção de um documentário sobre jogadores, fãs de videogames e MMOs; feito por um gamer brasileiro para os jogadores brasileiros. O projeto tem como definição mostrar quem são essas pessoas que passam horas em mundos virtuais, em universos paralelos: quem são os jogadores de games onlines. Mostrar que eles são pessoas normais, comuns e como elas se socializam nos MMOs.</p>

<p>Apesar do sucesso comercial e na mídia, geeks e gamers ainda são retratados por arquétipos negativos e não tem um espaço mostrando quem realmente são: que hoje todos jogam videogames, todos são gamers. World of Players vai apresentar como é o cotidiano dos players, o que elas fazem em suas vidas e o que acontece nos jogos de MMOs. Encontrar e conversar com os desenvolvedores dos videogames, que também são gamers e criam esses mundos explorados por pessoas em todo mundo.</p>

<p>Um documentário feito por cineastas com equipamento de cinema, que vai falar com os jogadores de MMOs. Conversando e conhecendo jogadores brasileiros e estrangeiros na Blizzcon.</p>

<p>Todos os anos acontece nos Estados Unidos o maior evento de videogames: a Blizzcon. Durante dois dias, gamers e geeks de todo mundo se reúnem para confraternizar, conversar e jogar os melhores games do mercado. A procura é tão intensa que os ingressos se esgotam em segundos. Até hoje o Brasil foi isolado do evento, até agora. World of Players vai mostrar o evento, os fãs que se deslocam para ir até Los Angeles e a empresa que cria esses jogos: a Blizzard.</p>

<p>Um documentário de um fã para outros fãs.</p>
",308-world-of-players-o-mundo-dos-jogadores-de-mmos,//player.vimeo.com/video/28696085,http://vimeo.com/28696085,"Cinema e Vídeo",13,,https://s3-sa-east-1.amazonaws.com/cdn.br.catarse/uploads/project/video_thumbnail/308/project_thumb_thumb_open-uri20131125-2-i225zj,https://s3-sa-east-1.amazonaws.com/cdn.br.catarse/uploads/project/video_thumbnail/308/project_thumb_small_open-uri20131125-2-i225zj,https://s3-sa-east-1.amazonaws.com/cdn.br.catarse/uploads/project/video_thumbnail/308/project_thumb_large_open-uri20131125-2-i225zj,https://s3-sa-east-1.amazonaws.com/cdn.br.catarse/uploads/project/video_thumbnail/308/project_thumb_video_cover_open-uri20131125-2-i225zj,4.16666666666666666700,250.0,6,6,failed,aon,finished,"2011-11-01 01:59:59","2011-10-31 23:59:59","2011-09-02 01:59:59","2011-09-01 22:59:59",,t,t,f,60,"{""total"" : 0, ""unit"" : ""seconds""}","{""total"" : 60, ""unit"" : ""days""}",2,"{""city"" : ""São Paulo"", ""state_acronym"" : ""SP"", ""state"" : ""São Paulo""}","{""id"" : 20340, ""name"" : ""Lordmons Codex""}",0,,f,f,2,f,f,f