project_id,id,user_id,name,headline,budget,goal,about_html,permalink,video_embed_url,video_url,category_name,category_id,original_image,thumb_image,small_image,large_image,video_cover_image,progress,pledged,total_contributions,total_contributors,state,mode,state_order,expires_at,zone_expires_at,online_date,zone_online_date,sent_to_analysis_at,is_published,is_expired,open_for_contributions,online_days,remaining_time,elapsed_time,posts_count,address,user,reminder_count,is_owner_or_admin,user_signed_in,in_reminder,total_posts,can_request_transfer,is_admin_role,contributed_by_friends
31204,31204,97647,"Rumo ao Paratíssima Lisboa","""É na arte que o homem se ultrapassa definitivamente."" Simone de Beauvoir","<p><img src=""https://s3-sa-east-1.amazonaws.com/cdn.br.catarse/uploads/redactor_rails/picture/data/49792/or%C3%A7amento.jpg""></p><p><br></p>",19000.0,"<p><strong>Rumo ao Paratissima Lisboa</strong> é um projeto que tem como objetivo levar obras de arte produzidas por <strong>Lizandra Caon</strong> e por 35 artistas da <strong>Associação Riograndense de Artes Plásticas Francisco Lisboa</strong> - a <strong>Chico Lisboa -</strong> Angela Zaffari, André Lima Bianca Santini, Carmen Sansone, Darmeli Araujo, Débora Piva, Edelweiss Bassis, Estelita Branco, Fabriano Rocha, Fátima Pinto, Graça Marques, Gustavo Rigon, Inês Benetti, Isabel Cristina CCarvalho, Jorge Bragança, Karla Santos, Liana Timm, Lizandra Caon, Lu Mena Barreto, Magna Sperb, Marcia De Antoni, Margela Arnold, Mariah de Olivieri, Mauro Beck, Ney Caminha, Ondina Pozoco, Rafael Dambros, Ricardo Giuliani, Sandra Fraga, Selir Straliotto, Suzane Wonghon, Suzel Neubarth, Vera Carlotto, Waldemar Max, Wéllington Damin selecionadas através de edital para o Festival Paratissima Lisboa/Portugal.</p>  <p>Lizandra Caon é artista e fotógrafa que acredita no potencial da criação através da imagem e de sua manipulação para expressar sua visão de mundo. Escolheu a fotografia, sua paixão, como meio de expressar sua arte. Deseja crescer profissionalmente e ter seu trabalho reconhecido nacional e internacionalmente. Acredita que a sua participação no festival poderá ajudar a concretizar seu sonho.  Seu trabalho apresenta as relações entre a imagem e o seu contexto, trazendo o público como parte fundamental, além dos conceitos de identidade e o posicionamento do olhar.</p><p><img src=""https://s3-sa-east-1.amazonaws.com/cdn.br.catarse/uploads/redactor_rails/picture/data/48371/partes-de-mim-9_web_mini.jpg""></p><p>A Associação Chico Lisboa, fundada em 1938, é uma das mais antigas entidades culturais em funcionamento no Estado<i> </i>não possuindo fins lucrativos e tendo como um de seus objetivos divulgar e pr<a name=""_GoBack""></a>omover os trabalhos dos artistas do Rio Grande do Sul. Presidida pela artista visual Kátia Costa, a Associação acredita que o festival será uma ótima oportunidade para projetar a arte e os seus associados.</p><p><img src=""https://s3-sa-east-1.amazonaws.com/cdn.br.catarse/uploads/redactor_rails/picture/data/48367/unnamed.jpg""></p><p style=""margin-left: 20px;""><br></p><p style=""margin-left: 20px;"" rel=""margin-left: 20px;"">Paratissima Lisboa é um projeto expositivo público, colaborativo, inclusivo e democrático de arte contemporânea no espaço urbano destinado a artistas emergentes, promovido pela Junta de Freguesia de Santa Maria Maior, criado e organizado pelo EBANOCollective.</p><p><img src=""https://s3-sa-east-1.amazonaws.com/cdn.br.catarse/uploads/redactor_rails/picture/data/48372/2.jpg""></p><p><br></p>  <p>Nossos recursos são escassos, pois a associação não tem fins
lucrativos com trabalho voluntário e colaborativo de seus sócios e desenvolvo
projetos culturais. Como a proposta do festival Paratissima Lisboa é realizar
uma intervenção a céu aberto, se faz necessária a presença de representantes no
local, para definir locais e instalar os trabalhos de acordo com os conceitos
propostos, além de ser uma exigência do próprio evento. Este Festival, além de
expor os trabalhos dos artistas, também tem como objetivo ser um evento de
encontro de profissionais do mercado da arte proporcionando aos artistas a
possibilidade de ampliar suas redes de relacionamentos e colaborar para seu
crescimento profissional.</p><p>Em razão da dificuldade em somente três pessoas realizarem e executarem as duas propostas dentro do Festival, precisamos de  recursos para que possamos levar a nossa arte e fazer uma boa representação do que temos de melhor:a nossa cultura.</p><p><br></p><p><img src=""https://s3-sa-east-1.amazonaws.com/cdn.br.catarse/uploads/redactor_rails/picture/data/49779/metas.jpg""></p><p>AQUI ABAIXO VOCÊ PODE VER IMAGENS DAS RECOMPENSAS</p><p>E AO FINALIZAR AS IMAGENS DAS RECOMPENSAS VOCÊ CONFERE UM TUTORIAL DE COMO REALIZAR A COLABORAÇÃO.</p><img src=""https://s3-sa-east-1.amazonaws.com/cdn.br.catarse/uploads/redactor_rails/picture/data/49475/Untitled-2.png""><p>R$ 15,00 ou mais<br></p><p><img src=""https://s3-sa-east-1.amazonaws.com/cdn.br.catarse/uploads/redactor_rails/picture/data/48564/m%C3%A3o.png"" width=""187"" height=""98"" style=""width: 187px; height: 98px;""><img src=""https://s3-sa-east-1.amazonaws.com/cdn.br.catarse/uploads/redactor_rails/picture/data/48567/agradecimentos.jpg"" width=""168"" height=""128"" style=""width: 168px; height: 128px;"" rel=""width: 168px; height: 128px;""><img src=""https://s3-sa-east-1.amazonaws.com/cdn.br.catarse/uploads/redactor_rails/picture/data/48569/download.jpg"" width=""100"" height=""100"" style=""width: 100px; height: 100px;""></p><p><br></p><p>R$ 35,00 ou mais</p><p><img src=""https://s3-sa-east-1.amazonaws.com/cdn.br.catarse/uploads/redactor_rails/picture/data/48838/Catalogo_marcadores.jpg"" width=""251"" height=""280"" style=""width: 251px; height: 280px;"">           <a href=""https://issuu.com/lizandra2/docs/cat__logo_marcadores"" target=""_blank"">CONFIRA AS OBRAS DE ARTE 20X5 AQUI</a></p><p>$ 50,00 ou mais<br></p><p><img src=""https://s3-sa-east-1.amazonaws.com/cdn.br.catarse/uploads/redactor_rails/picture/data/49781/Cat%C3%A1logo_postal_Lisboa_2.jpg"" width=""522"" height=""392"" alt="""" style=""width: 522px; height: 392px;""></p><p>R$ 70,00 ou mais</p><p><img src=""https://s3-sa-east-1.amazonaws.com/cdn.br.catarse/uploads/redactor_rails/picture/data/48846/postal1.jpg"" width=""326"" height=""282"" style=""width: 326px; height: 282px;""><a href=""https://issuu.com/lizandra2/docs/cat__logo_postais/1"" target=""_blank"">CONFIRA AS OBRAS DE ARTE 10x15 AQUI</a></p><p>R$ 100,00 ou mais</p><p><img src=""https://s3-sa-east-1.amazonaws.com/cdn.br.catarse/uploads/redactor_rails/picture/data/49947/Cat%C3%A1logo_livro_pdf_Lisboa_2.jpg"" width=""449"" height=""463"" style=""width: 449px; height: 463px;""></p><p><br></p><p>R$ 150,00 ou mais<br></p><p><img src=""https://s3-sa-east-1.amazonaws.com/cdn.br.catarse/uploads/redactor_rails/picture/data/49783/Catalogo_20x20_1.jpg"" width=""397"" height=""175"" style=""width: 397px; height: 175px;""></p><p>   <a href=""https://issuu.com/lizandra2/docs/cat__logo_obra_20x20/1"" target=""_blank"">CONFIRA AS OBRAS DE ARTE 20x20 AQUI</a></p><p><br></p><p>R$ 200,00 ou mais</p><p><img src=""https://s3-sa-east-1.amazonaws.com/cdn.br.catarse/uploads/redactor_rails/picture/data/49785/Catalogo_maiores_20x20.jpg""></p><p>   <a href=""https://issuu.com/lizandra2/docs/cat__logo_obra_maiores_30x30"" target=""_blank"">CONFIRA AS OBRAS DE ARTE EM 3 FORMATOS DIFERENTES AQUI</a></p><p><br></p><p>R$ 300,00 ou mais</p><p><img src=""https://s3-sa-east-1.amazonaws.com/cdn.br.catarse/uploads/redactor_rails/picture/data/49784/tridimensionais.jpg"" width=""425"" height=""226"" style=""width: 425px; height: 226px;""></p><p>    <a href=""https://issuu.com/lizandra2/docs/cat__logo_obra_tri_dimensionais/1"" target=""_blank"">CONFIRA AS OBRAS DE ARTE TRIDIMENSIONAIS  AQUI</a></p><p><span class=""redactor-invisible-space""><br></span></p><p><span class=""redactor-invisible-space"">R$ 500,00 ou mais</span></p><p><span class=""redactor-invisible-space""></span></p><p><img src=""https://s3-sa-east-1.amazonaws.com/cdn.br.catarse/uploads/redactor_rails/picture/data/49488/500_obra.jpg""></p><p>                                                                                                <img src=""https://s3-sa-east-1.amazonaws.com/cdn.br.catarse/uploads/redactor_rails/picture/data/49145/mais.jpg"" data-pin-nopin=""true""><br></p><p><img src=""https://s3-sa-east-1.amazonaws.com/cdn.br.catarse/uploads/redactor_rails/picture/data/49787/Cat%C3%A1logo_postal_Lisboa_2.jpg"" width=""264"" height=""198"" style=""width: 264px; height: 198px;""></p><p><span class=""redactor-invisible-space""><br></span></p><p><span class=""redactor-invisible-space"">$ 1000,00 ou mais</span></p><p><span class=""redactor-invisible-space""><img src=""https://s3-sa-east-1.amazonaws.com/cdn.br.catarse/uploads/redactor_rails/picture/data/49788/Cat%C3%A1logo_postal_Lisboa_2.jpg"" width=""342"" height=""257"" style=""width: 342px; height: 257px;""><span class=""redactor-invisible-space""></span></span></p><p><span class=""redactor-invisible-space"">                                          <img src=""https://s3-sa-east-1.amazonaws.com/cdn.br.catarse/uploads/redactor_rails/picture/data/49151/mais.jpg"" data-pin-nopin=""true""><span class=""redactor-invisible-space""><br></span></span></p><p><span class=""redactor-invisible-space""><span class=""redactor-invisible-space""><img src=""https://s3-sa-east-1.amazonaws.com/cdn.br.catarse/uploads/redactor_rails/picture/data/49152/Cat%C3%A1logo_livro_pdf_Lisboa.jpg"" width=""356"" height=""315"" style=""width: 356px; height: 315px;""><span class=""redactor-invisible-space""><br></span></span></span></p><p><span class=""redactor-invisible-space""><span class=""redactor-invisible-space""><span class=""redactor-invisible-space"">                                              <img src=""https://s3-sa-east-1.amazonaws.com/cdn.br.catarse/uploads/redactor_rails/picture/data/49153/mais.jpg"" data-pin-nopin=""true""><span class=""redactor-invisible-space""><br></span></span></span></span></p><p><span class=""redactor-invisible-space"">                                             <span class=""redactor-invisible-space""><br></span></span></p><p><span class=""redactor-invisible-space""><span class=""redactor-invisible-space""><span class=""redactor-invisible-space""> </span></span></span> <img src=""https://s3-sa-east-1.amazonaws.com/cdn.br.catarse/uploads/redactor_rails/picture/data/48595/1000.jpg"" width=""359"" height=""91"" data-pin-nopin=""true"" style=""width: 359px; height: 91px;""></p><p><img src=""https://s3-sa-east-1.amazonaws.com/cdn.br.catarse/uploads/redactor_rails/picture/data/50106/passo_a_passo-1.jpg""><br></p><p><img src=""https://s3-sa-east-1.amazonaws.com/cdn.br.catarse/uploads/redactor_rails/picture/data/50111/passo_a_passo-2.jpg""></p><p><img src=""https://s3-sa-east-1.amazonaws.com/cdn.br.catarse/uploads/redactor_rails/picture/data/50112/passo_a_passo-3.jpg""></p><p><br></p><p><br></p>",rumo_ao_paratissima_lisboa_df4b,//www.youtube.com/embed/JaozQg8482Y,https://www.youtube.com/watch?v=JaozQg8482Y,Artes,1,https://s3-sa-east-1.amazonaws.com/cdn.br.catarse/uploads/project/uploaded_image/31204/600x340.jpg,https://s3-sa-east-1.amazonaws.com/cdn.br.catarse/uploads/project/uploaded_image/31204/project_thumb_thumb_600x340.jpg,https://s3-sa-east-1.amazonaws.com/cdn.br.catarse/uploads/project/uploaded_image/31204/project_thumb_small_600x340.jpg,https://s3-sa-east-1.amazonaws.com/cdn.br.catarse/uploads/project/uploaded_image/31204/project_thumb_large_600x340.jpg,https://s3-sa-east-1.amazonaws.com/cdn.br.catarse/uploads/project/uploaded_image/31204/project_thumb_video_cover_600x340.jpg,54.10526315789473684200,10280.0,124,110,successful,flex,finished,"2016-07-23 02:59:59.999999","2016-07-22 23:59:59.999999","2016-05-23 10:55:39.225187","2016-05-23 07:55:39.225187",,t,t,f,60,"{""total"" : 0, ""unit"" : ""seconds""}","{""total"" : 60, ""unit"" : ""days""}",12,"{""city"" : ""Porto Alegre"", ""state_acronym"" : ""RS"", ""state"" : ""Rio Grande do Sul""}","{""id"" : 97647, ""name"" : ""Lizandra Caon""}",1,,f,f,12,t,f,f