project_id,id,user_id,name,headline,budget,goal,about_html,permalink,video_embed_url,video_url,category_name,category_id,original_image,thumb_image,small_image,large_image,video_cover_image,progress,pledged,total_contributions,total_contributors,state,mode,state_order,expires_at,zone_expires_at,online_date,zone_online_date,sent_to_analysis_at,is_published,is_expired,open_for_contributions,online_days,remaining_time,elapsed_time,posts_count,address,user,reminder_count,is_owner_or_admin,user_signed_in,in_reminder,total_posts,can_request_transfer,is_admin_role,contributed_by_friends
3153,3153,14253,"Exposição Auto Retrato Falado","Exposição de desenhos de rostos de meninos em prisão provisória (que estavam ""em medida sócio-educativa provisória"") durante o ano de 2012. ","O orçamento para projetos anteriores a 24/02/2015 normalmente pode ser encontrado na descrição acima.",1200.0,"<p>O projeto <strong>Auto Retrato Falado</strong> nasceu depois de um trabalho realizado dentro da Fundação Casa, durante oficina de artes realizada com os meninos de uma unidade provisória (SP), através de um projeto de oficinas culturais de uma Ong de São Paulo. </p>

<p>Este trabalho é a criação de desenhos de rostos de cada um dos meninos que participaram da oficina. A ideia foi que eu desenhasse o lado direito dos rostos e eles desenhariam o lado esquerdo deles mesmos. O formato inicial foi criar uma iniciativa mais simples de aprender a desenhar, observando em formato de <strong>espelho</strong>. Depois, percebi que esta iniciativa iria muito além de aprender a desenhar: eles se auto desenhariam através da ideia de <strong>reflexo</strong> e, ao mesmo tempo, o formato dos desenhos remetiam visualmente o formato de desenho de retrato falado. Assim, surgiu a ideia do <strong>Auto Retrato Falado</strong>. </p>

<p>Assim, o projeto consiste em realizar a <strong>exposição</strong> dos registros das imagens (em formato de Banner) sobre desenhos de <strong>rostos de jovens</strong> em medida sócio educativa, criados durante oficina de artes ministrada por mim, G.P., em unidade de prisão provisória durante o ano de 2012. </p>

<p>Serão expostos <strong>5 imagens</strong> de desenhos de rostos registradas nestas oficinas, no espaço subterrâneo da <strong>Passagem Literária da Consolação</strong>, durante o mês de dezembro de 2013, até início de janeiro de 2014. </p>

<p>Além da exposição, irei realizar uma <strong>performance</strong>, propondo um dia para que, tanto a artista quanto o público, desenhe um lado do rosto de cada um. </p>

<p>Para o projeto dar certo, é necessária a impressão de 5 imagens em formato banner (R$700,00) + identidade visual (letreiros e cartazes= R$300,00). </p>

<p>Auto Retrato Falado faz parte do meu projeto maior, a <strong>Companhia Nônima</strong>, que faz parte da minha pesquisa relacionada ao anonimato. </p>

<p><strong>A ideia principal do projeto é a troca da ideia de denúncia pela HUMANIZAÇÃO.</strong> </p>

<p>Link para as imagens e projeto: <a class=""alt-link"" href=""https://docs.google.com/file/d/0B1Snai10QYuBOEphRGhfemVGdWs/edit?usp=sharing"" target=""_blank"">https://docs.google.com/file/d/0B1Snai10QYuBOEphRGhfemVGdWs/edit?usp=sharing</a></p>

<p>*Agradecimentos especiais: Raphael Pugliesi e Cláudio Poiccard pelos registros audiovisuais feitos para a divulgação do projeto em video. :) </p>
",autoretratofalado,//player.vimeo.com/video/77004439,https://vimeo.com/77004439,Artes,1,https://s3-sa-east-1.amazonaws.com/cdn.br.catarse/uploads/project/uploaded_image/3153/1378871_10200288343085105_404497640_n.jpg,https://s3-sa-east-1.amazonaws.com/cdn.br.catarse/uploads/project/uploaded_image/3153/project_thumb_thumb_1378871_10200288343085105_404497640_n.jpg,https://s3-sa-east-1.amazonaws.com/cdn.br.catarse/uploads/project/uploaded_image/3153/project_thumb_small_1378871_10200288343085105_404497640_n.jpg,https://s3-sa-east-1.amazonaws.com/cdn.br.catarse/uploads/project/uploaded_image/3153/project_thumb_large_1378871_10200288343085105_404497640_n.jpg,https://s3-sa-east-1.amazonaws.com/cdn.br.catarse/uploads/project/uploaded_image/3153/project_thumb_video_cover_1378871_10200288343085105_404497640_n.jpg,110.8333333333333300,1330.0,19,19,successful,aon,finished,"2013-11-26 01:59:59","2013-11-25 23:59:59","2013-10-16 18:35:02","2013-10-16 15:35:02",,t,t,f,40,"{""total"" : 0, ""unit"" : ""seconds""}","{""total"" : 40, ""unit"" : ""days""}",5,"{""city"" : ""Santo André"", ""state_acronym"" : ""SP"", ""state"" : ""São Paulo""}","{""id"" : 14253, ""name"" : ""Gabriela Passos Alves dos Santos""}",0,,f,f,5,f,f,f