project_id,id,user_id,name,headline,budget,goal,about_html,permalink,video_embed_url,video_url,category_name,category_id,original_image,thumb_image,small_image,large_image,video_cover_image,progress,pledged,total_contributions,total_contributors,state,mode,state_order,expires_at,zone_expires_at,online_date,zone_online_date,sent_to_analysis_at,is_published,is_expired,open_for_contributions,online_days,remaining_time,elapsed_time,posts_count,address,user,reminder_count,is_owner_or_admin,user_signed_in,in_reminder,total_posts,can_request_transfer,is_admin_role,contributed_by_friends
3171,3171,188471,"PROJETO BLUES NA PRAÇA","A música é o grande vôo que liberta","O orçamento para projetos anteriores a 24/02/2015 normalmente pode ser encontrado na descrição acima.",7200.0,"<p>Dudé Blues Band é o projeto capitaneado pelo músico Dudé, vocalista com mais de vinte anos experiência no cenário musical paulistano participando de várias bandas e projetos envolvendo estilos tais como Classic Rock, Blues, MPB, etc.
Possuindo algumas aparições na mídia, entre elas a participação no programa Raul Gil em 2005, atuante no teatro musical por quatro anos, Dudé também trabalha como produtor e professor de Canto Popular em seu próprio home studio ( <a class=""alt-link"" href=""https://soundcloud.com/dudehomestudio"" target=""_blank"">https://soundcloud.com/dudehomestudio</a> )
Em 2013, se deu inicio à sua carreira-solo baseando-se no Blues em um formato mais moderno, tanto nas composições autorais como nas releituras dos grandes clássicos.</p>

<div class=""video youtube""><iframe width=""600"" height=""403"" src=""//www.youtube.com/embed/8mvpk9f7ksQ?wmode=opaque"" frameborder=""0"" allowfullscreen></iframe></div>

<p>O batismo de fogo dessa nova empreitada se deu no lançamento da exposição Passos Alados, da fotógrafa Daniela Gama e da modelo Daiane Lopes, onde a Dudé Blues Band teve grande honra de ser a primeira banda a tocar dentro do Memorial Da Inclusão, pertencente à Secretaria Estadual da Pessoa com Deficiência do estado de São Paulo, prédio que faz parte do grande complexo da América Latina, em julho de 2013.</p>

<div class=""video youtube""><iframe width=""600"" height=""403"" src=""//www.youtube.com/embed/9gQh_5dmvRM?wmode=opaque"" frameborder=""0"" allowfullscreen></iframe></div>

<p>Em agosto do mesmo ano surgiu o convite para tocar no tradicional festival Blues Pela Vida, em sua quinta edição, evento esse que reúne anualmente nomes do Blues paulistano para um grande show beneficente.
Contando sempre com músicos experientes da cena Blues de São Paulo, a Dudé Blues Band está pronta para dar mais um passo à frente na sua breve, mas consistente história.
O objetivo agora é obter recursos suficientes para quatro shows destinados a divulgar o nome da banda e difundir o Blues na cidade de São Paulo, no intuito de se fazer essas apresentações em local público para aqueles que quiserem apreciar sua música. 
Esses shows serão realizados entre final de 2013 para começo de 2014 e o recurso obtido terá como objetivo custear as despesas que não serão pequenas.
A infraestrutura para os shows contará com o suporte e a parceria da Secretaria Estadual da Pessoa com Deficiência do estado de São Paulo.</p>

<div class=""video youtube""><iframe width=""600"" height=""403"" src=""//www.youtube.com/embed/CB2Tg1RAX6o?wmode=opaque"" frameborder=""0"" allowfullscreen></iframe></div>

<p>Dudé Blues Band acredita no envolvimento desses shows em locais como praças e parques como um forte instrumento de divulgação cultural. Porém, as despesas com o projeto não serão pequenas, mesmo que seja na forma de uma ajuda de custo, é imprescindível para a continuidade de qualquer projeto que não possua grande apoio da mídia. Um suporte para seguirmos com nosso trabalho adiante.
Isso sem falar na abertura de uma importante discussão sobre possíveis rumos a serem tomados pela música independente, através de novas opções diferentes das fórmulas atuais que já demonstraram o seu desgaste quanto às questões como divulgação e suporte de trabalhos que sobrevivem com poucos recursos.
O Blues, e a Cultura no seu geral, agradecem. </p>

<div class=""video youtube""><iframe width=""600"" height=""403"" src=""//www.youtube.com/embed/IJk1hGMRK0E?wmode=opaque"" frameborder=""0"" allowfullscreen></iframe></div>
",bluesnapraca,//player.vimeo.com/video/77523263,https://vimeo.com/77523263,Música,16,https://s3-sa-east-1.amazonaws.com/cdn.br.catarse/uploads/project/uploaded_image/3171/Blues-guitar.jpg,https://s3-sa-east-1.amazonaws.com/cdn.br.catarse/uploads/project/uploaded_image/3171/project_thumb_thumb_Blues-guitar.jpg,https://s3-sa-east-1.amazonaws.com/cdn.br.catarse/uploads/project/uploaded_image/3171/project_thumb_small_Blues-guitar.jpg,https://s3-sa-east-1.amazonaws.com/cdn.br.catarse/uploads/project/uploaded_image/3171/project_thumb_large_Blues-guitar.jpg,https://s3-sa-east-1.amazonaws.com/cdn.br.catarse/uploads/project/uploaded_image/3171/project_thumb_video_cover_Blues-guitar.jpg,17.36111111111111111100,1250.0,22,22,failed,aon,finished,"2013-12-24 01:59:59","2013-12-23 23:59:59","2013-10-24 12:12:56","2013-10-24 10:12:56",,t,t,f,60,"{""total"" : 0, ""unit"" : ""seconds""}","{""total"" : 60, ""unit"" : ""days""}",1,"{""city"" : ""São Paulo"", ""state_acronym"" : ""SP"", ""state"" : ""São Paulo""}","{""id"" : 188471, ""name"" : ""Eduardo José Magalhães Martins junior""}",0,,f,f,1,f,f,f