project_id,id,user_id,name,headline,budget,goal,about_html,permalink,video_embed_url,video_url,category_name,category_id,original_image,thumb_image,small_image,large_image,video_cover_image,progress,pledged,total_contributions,total_contributors,state,mode,state_order,expires_at,zone_expires_at,online_date,zone_online_date,sent_to_analysis_at,is_published,is_expired,open_for_contributions,online_days,remaining_time,elapsed_time,posts_count,address,user,reminder_count,is_owner_or_admin,user_signed_in,in_reminder,total_posts,can_request_transfer,is_admin_role,contributed_by_friends
3216,3216,202854,"RETRATOS DE AMOR","  UM OLHAR SOBRE O LADO BOM.","O orçamento para projetos anteriores a 24/02/2015 normalmente pode ser encontrado na descrição acima.",6200.0,"<p>Neste momento me veio a mente uma frase que li há algum tempo atrás e que retrata bastante a essência deste projeto.
&quot;Dois homens olharam através das grades da prisão;
um viu a lama, 
... o outro as estrelas . &quot;
Santo Agostinho.</p>

<p>É exatamente isso.  Em meio a tanta escuridão, em meio há tanta sujeira e decepção,  queremos focar o nosso olhar nas coisas boas que estão acontecendo em algum cantinho,  queremos ver essas atitudes, fotografá-las  e mostrar que todo mundo é capaz de fazer o bem.</p>

<p>Eu , fotógrafa Fernanda Franco e a nossa equipe fotográfica Intensity Fotografia com os fotógrafos Pedro Lacerda e Mel Torres queremos através do nosso projeto, fotografar todas as ONGS  - organizações não governamentais  ( a princípio da Região Sul Fluminense)e suas atividades.
 Além de estar fazendo o que a gente ama : FOTOGRAFAR, queremos motivar,  mostrar as atividades dessas intituições , divulgá-las e  o principal : queremos contaminar a todos com esses retratos de AMOR.</p>

<p>Chega de poluição sonora, poluição visual , chega de notícia ruim. 
Alguém tem motivação para mudar de atitude assistindo o aglomerado de notícias ruins que chegam até as nossas casas todos os dias ?  Pelo menos, a maioria das pessoas que eu conheço, só  sabem dizer o que o Brasil e o mundo está perdido.
Eu me recuso a acreditar nisso.
Precisamos   nos motivar , ver coisas boas e acreditar que somos capazes de amar. 
E para que esse projeto entre em ação precisamos da sua colaboração.</p>

<p>O nosso projeto a princípio seria fotografar as ONGS de todo o Brasil. Mas devido a quantidade de instituições , vamos primeiramente nos limitar as cidades da Região Sul Fluminense : Resende, Itatiaia, Porto Real, Quatis, Barra Mansa, Volta Redonda, Pinheiral, Piraí, Barra do Piraí, Vassouras, Valença, Rio das Flores, Três Rios, Rio Claro, Angra dos Reis e Paraty.</p>

<p>Os valores arrecadados para o projeto serão destinados ao nosso transporte  e ajuda de custo para realizarmos as viagens, catarse, divulgação das imagens, recompensas e  manutenção dos equipamentos.</p>
",retratosdeamor,//www.youtube.com/embed/hAuVq1mwdEM,http://www.youtube.com/watch?v=hAuVq1mwdEM&feature=youtu.be,Fotografia,17,,https://s3-sa-east-1.amazonaws.com/cdn.br.catarse/uploads/project/video_thumbnail/3216/project_thumb_thumb_open-uri20140317-2-oq7ob4,https://s3-sa-east-1.amazonaws.com/cdn.br.catarse/uploads/project/video_thumbnail/3216/project_thumb_small_open-uri20140317-2-oq7ob4,https://s3-sa-east-1.amazonaws.com/cdn.br.catarse/uploads/project/video_thumbnail/3216/project_thumb_large_open-uri20140317-2-oq7ob4,https://s3-sa-east-1.amazonaws.com/cdn.br.catarse/uploads/project/video_thumbnail/3216/project_thumb_video_cover_open-uri20140317-2-oq7ob4,0,0,0,0,failed,aon,finished,"2014-04-27 02:59:59","2014-04-26 23:59:59","2014-03-17 13:11:57.339628","2014-03-17 10:11:57.339628",,t,t,f,40,"{""total"" : 0, ""unit"" : ""seconds""}","{""total"" : 40, ""unit"" : ""days""}",0,"{""city"" : ""Volta Redonda"", ""state_acronym"" : ""RJ"", ""state"" : ""Rio de Janeiro""}","{""id"" : 202854, ""name"" : ""Intensity Fotografia""}",0,,f,f,0,f,f,f