project_id,id,user_id,name,headline,budget,goal,about_html,permalink,video_embed_url,video_url,category_name,category_id,original_image,thumb_image,small_image,large_image,video_cover_image,progress,pledged,total_contributions,total_contributors,state,mode,state_order,expires_at,zone_expires_at,online_date,zone_online_date,sent_to_analysis_at,is_published,is_expired,open_for_contributions,online_days,remaining_time,elapsed_time,posts_count,address,user,reminder_count,is_owner_or_admin,user_signed_in,in_reminder,total_posts,can_request_transfer,is_admin_role,contributed_by_friends
32339,32339,565525,"Expansão do canal ""amanda's gameplay""","Construindo um espaço de sucesso com os fãs, esteja junto da novidade e receba diversão ao extremo!","<p><img src=""https://s3-sa-east-1.amazonaws.com/cdn.br.catarse/uploads/redactor_rails/picture/data/49390/Google-Adwords.png""></p><p><strong>Por que necessita de arrecadações?</strong> Na realidade, 
utilizarei todo o dinheiro para investimento em publicidade, ou seja, o 
rascunho virará pintura, crescerá e se sustentará sozinho. As campanhas 
serão realizadas por meio da ferramenta do próprio site do canal, pois oferece 
confiabilidade e segurança, chamada de Google Adwords. Qualquer ajuda 
que vier, nem que seja um real, já é extremamente válida para contribuir
 com o avanço do projeto. O lucro do empreendimento é totalmente voltado
 para os inscritos, com a abertura de eventos próprios, aprimoramento 
dos equipamentos, aquisição de novos jogos, criação de acessórios com o 
logo, doações para instituições carentes do país, sorteios de 
eletrônicos, ou até mesmo propostas vindas dos fãs a respeito da 
utilização do capital.</p><p><strong>E se eu não puder colaborar com moeda?</strong> Sem problemas! Você pode ajudar compartilhando o link do meu espaço (<a href=""https://www.youtube.com/c/amandasgameplayofficial"" rel=""nofollow"">https://www.youtube.com/c/amandasgameplayofficial</a>) em suas redes sociais, pois, dessa forma, também estará participando efetivamente e me auxiliando pra valer!</p>",4000.0,"<p><img src=""https://s3-sa-east-1.amazonaws.com/cdn.br.catarse/uploads/redactor_rails/picture/data/49381/Banner.JPG""></p><h2><strong>Início</strong></h2><p>Olá, eu me chamo Amanda Finatti, sou uma garota meio maluquinha, 
descendente de italianos, falante de inglês, apaixonada pelo francês e 
com uma queda no espanhol. Fora os diversos idiomas que eu compreendo, 
também possuo o sonho de fazer sucesso com o que eu gosto. Sempre tive 
uma mente extremamente criativa, desde pequena, fato que não permitia 
com que eu dormisse tranquilamente, pois a vontade de expor as minhas 
ideias para o planeta é muito intensa. Com a internet dominando o globo 
terrestre, pude aproveitar a grande oportunidade de abrir um espaço na 
maior rede de vídeos da web para mostrar um pouco sobre mim. Mas, o que 
eu poderia colocar ali de interessante?</p><p>É aí que vem a parte boa. Percebi recentemente que há várias pessoas
 conseguindo uma espécie de carreira com a plataforma do YouTube, apenas
 jogando e demonstrando as habilidades para os inscritos. Nunca havia 
pensado nessa possibilidade e, depois de assistir alguns conteúdos e 
juntar as melhores ideias na cabeça, tive uma excelente descoberta para 
inovar e entrar com tudo no local. Trata-se de jogar os games mais famosos de todos os tempos e, além disso, protagonizar os personagens 
principais da trama. Você provavelmente está se perguntando... como 
assim?</p><p>Ao mesmo tempo em que eu estarei apresentando e me divertindo com o 
jogo escolhido, também vou atuar como a heroína, incluindo cenas 
capturadas pela câmera e editadas com altíssima qualidade. Será bem 
semelhante a um filme,  tanto que  me vestirei exatamente como o indivíduo
 do game e colocarei acessórios idênticos aos dele(a), unindo ficção e 
realidade, com efeitos especiais abrangendo o material. Ou seja, algo que não é comum e, inclusive, bem difícil de se
 encontrar por aí.</p><p>O jogo inaugural que postarei no meu cantinho é o conhecido Medal of 
Honor: Underground. Ele conta a história de uma jovem francesa que 
batalhou na Segunda Guerra Mundial para a liberação da cidade de Paris. 
Um dos pioneiros no quesito de tiro em primeira pessoa, sendo inspiração
 para outros populares do gênero. Clássico do console PS1, os acontecimentos são narrados em formato de falas e imagens. A minha proposta é 
inserir novas ações em formato de vídeo para complementar o enredo. Eu 
interpretarei a fictícia Manon Batiste, que foi baseada na 
original Hélène Deschamps Adams, mulher que viveu a época do conflito e 
passou por todos os desafios de verdade.</p><p><strong></strong>Com relação à língua predominante nos conteúdos, posso dizer que, em parte, o inglês será bastante usado, pois a meta é atingir o
 mercado exterior. Porém, o nosso idioma padrão também terá grande 
abordagem. O objetivo é ser uma das primeiras jogadoras a alcançar os 
campos internacionais, mas sem deixar de homenagear o belo português, 
que é uma linguagem romântica e extremamente complexa. Sendo assim, 
haverá diversas gravações abrasileiradas.</p><h2><strong>Finalização</strong></h2><p>Só digo uma coisa: não espere o óbvio, pois somente há surpresas! A 
intenção é fazer algo completamente diferente e moderno. Tenho certeza 
de que você poderá estar nessa!</p><h2><strong>Dúvidas ou sugestões?</strong></h2><p>Escreva-me por meio da campanha com as suas perguntas ou mande-me um e-mail explicando todos os detalhes aqui: <a href=""mailto:amandafinatti@hotmail.com"" rel=""nofollow"">amandafinatti@hotmail.com</a></p>",amandafinatti,//www.youtube.com/embed/0BVLr5TQMAo,https://www.youtube.com/watch?v=0BVLr5TQMAo,Jogos,14,https://s3-sa-east-1.amazonaws.com/cdn.br.catarse/uploads/project/uploaded_image/32339/Canal_do_YouTube.png,https://s3-sa-east-1.amazonaws.com/cdn.br.catarse/uploads/project/uploaded_image/32339/project_thumb_thumb_Canal_do_YouTube.png,https://s3-sa-east-1.amazonaws.com/cdn.br.catarse/uploads/project/uploaded_image/32339/project_thumb_small_Canal_do_YouTube.png,https://s3-sa-east-1.amazonaws.com/cdn.br.catarse/uploads/project/uploaded_image/32339/project_thumb_large_Canal_do_YouTube.png,https://s3-sa-east-1.amazonaws.com/cdn.br.catarse/uploads/project/uploaded_image/32339/project_thumb_video_cover_Canal_do_YouTube.png,0,0,0,0,online,flex,published,,,"2016-05-28 01:28:40.210802","2016-05-27 22:28:40.210802",,t,f,t,,"{""total"" : 0, ""unit"" : ""seconds""}","{""total"" : 120, ""unit"" : ""days""}",0,"{""city"" : ""São Paulo"", ""state_acronym"" : ""SP"", ""state"" : ""São Paulo""}","{""id"" : 565525, ""name"" : ""Amanda Finatti""}",0,,f,f,0,f,f,f