project_id,id,user_id,name,headline,budget,goal,about_html,permalink,video_embed_url,video_url,category_name,category_id,original_image,thumb_image,small_image,large_image,video_cover_image,progress,pledged,total_contributions,total_contributors,state,mode,state_order,expires_at,zone_expires_at,online_date,zone_online_date,sent_to_analysis_at,is_published,is_expired,open_for_contributions,online_days,remaining_time,elapsed_time,posts_count,address,user,reminder_count,is_owner_or_admin,user_signed_in,in_reminder,total_posts,can_request_transfer,is_admin_role,contributed_by_friends
32628,32628,567127,"um cantinho um violão ","Viver com música é viver em constante transformação e alegria. ","<ul><li>capitação de recurso : R$ 8.000,00 (Oito mil reais).</li><li>compra dos instrumentos:  R$ 6.600,00 (Seis mil e seiscentos). </li><li>Porcentagem do catarse: R$ 1.004  (Mil e quatro reais).</li></ul><p><img src=""https://s3-sa-east-1.amazonaws.com/cdn.br.catarse/uploads/redactor_rails/picture/data/49857/catarse.png""></p>",8000.0,"<p><br></p><p>objetivo:</p><p>O projeto tem por finalidade
possibilitar educação musical contribuindo na formação de  cidadãos com caráter e responsabilidade social
que possam na medida de seu crescimento obter melhor inserção no meio
profissional, mas, além disso, tirar crianças e adolescentes da ociosidade e
constante contato com a criminalidade presente em bairros de periferia como
este em que o nosso projeto se situa. </p><p>Meta:</p><p>- Comprar 20 violões (cordas de náilon para
estudo).<br></p><p>Justificativa: </p><p>Esses instrumentos serão para uso dos alunos de prática instrumental em violão popular, melhorando assim a aprendizagem dos mesmos, pois devido a grande demanda de alunos inscritos, não possuímos instrumentos suficientes para atender a todos os alunos no decorrer das aulas que funcionam duas vezes por semana, nos períodos matutino e diurno.<span class=""redactor-invisible-space""><br></span></p>",um_cantinho_um_violao_5aa5,//www.youtube.com/embed/WDwmxmXtzYQ,https://www.youtube.com/watch?v=WDwmxmXtzYQ,Música,16,https://s3-sa-east-1.amazonaws.com/cdn.br.catarse/uploads/project/uploaded_image/32628/IMG-20160523-WA0022.jpg,https://s3-sa-east-1.amazonaws.com/cdn.br.catarse/uploads/project/uploaded_image/32628/project_thumb_thumb_IMG-20160523-WA0022.jpg,https://s3-sa-east-1.amazonaws.com/cdn.br.catarse/uploads/project/uploaded_image/32628/project_thumb_small_IMG-20160523-WA0022.jpg,https://s3-sa-east-1.amazonaws.com/cdn.br.catarse/uploads/project/uploaded_image/32628/project_thumb_large_IMG-20160523-WA0022.jpg,https://s3-sa-east-1.amazonaws.com/cdn.br.catarse/uploads/project/uploaded_image/32628/project_thumb_video_cover_IMG-20160523-WA0022.jpg,0,0,0,0,online,flex,published,"2016-09-25 02:59:59.999999","2016-09-24 23:59:59.999999","2016-05-27 18:44:01.597089","2016-05-27 15:44:01.597089",,t,t,f,120,"{""total"" : 0, ""unit"" : ""seconds""}","{""total"" : 120, ""unit"" : ""days""}",0,"{""city"" : ""Belém"", ""state_acronym"" : ""PA"", ""state"" : ""Pará""}","{""id"" : 567127, ""name"" : ""#músicaévida""}",0,,f,f,0,f,f,f