project_id,id,user_id,name,headline,budget,goal,about_html,permalink,video_embed_url,video_url,category_name,category_id,original_image,thumb_image,small_image,large_image,video_cover_image,progress,pledged,total_contributions,total_contributors,state,mode,state_order,expires_at,zone_expires_at,online_date,zone_online_date,sent_to_analysis_at,is_published,is_expired,open_for_contributions,online_days,remaining_time,elapsed_time,posts_count,address,user,reminder_count,is_owner_or_admin,user_signed_in,in_reminder,total_posts,can_request_transfer,is_admin_role,contributed_by_friends
33041,33041,550243,"Dragonium vol.I- A cruzada dos cegos","Ajude um escritor brasileiro a publicar um livro de fantasia épica que acontece na mitologia nórdica","<p>Orçamento da publicação:</p><p><strong>""Plano prata"": R$ 3.118,00</strong> (para a editora) +<strong> </strong><strong>R$ 405,34</strong><span class=""redactor-invisible-space""></span> (taxa do Catarse de 13% ) </p><p><strong>TOTAL: R$ 3.523,34</strong><span class=""redactor-invisible-space""><strong> </strong>(deixei 3.525,00 aqui na campanha)</span></p><p><span class=""redactor-invisible-space"">Eu havia enviado um e mail para a editora, perguntando se eles poderiam publicar o livro primeiro, e depois eu pagasse-usando a minha parte($) das vendas. E inicialmente eles haviam me cobrado um valor superior ao atual. Aqui está o PRINT do e mail que eles me responderam:</span></p><p><span class=""redactor-invisible-space""><img src=""https://s3-sa-east-1.amazonaws.com/cdn.br.catarse/uploads/redactor_rails/picture/data/50562/Drago.jpg""><span class=""redactor-invisible-space""><br></span></span></p><p><strong>Por que eu desejo o plano prata, e não o bronze?</strong><br></p><p><span class=""redactor-invisible-space""><span class=""redactor-invisible-space"">Pois este plano, me concede 50 exemplares do livro. E eu os daria para os que colaborassem financeiramente com a campanha. Ou seja, seriam usados como recompensas! Estamos falando de uma campanha, no qual eu recompenso os que ajudam. É claro que vou precisar de mais exemplares para recompensar o restante dos colaboradores, que vou precisar adquirir por conta própria($) após a publicação da obra. Por isso peço paciência, para que eu consiga recompensar a todos, assim como prometido!<br></span></span></p>",3525.0,"<p>Saudações caro viajante!</p><p> Meu nome é <strong>Grégori Gabriel</strong>. Sou o autor da ""<em><strong>Cruzada dos cegos</strong></em>"", que é o primeiro volume da ""<em><strong>Saga Dragonium</strong></em>"". Eu recebi em Abril deste ano, a aprovação de duas editoras, que querem então publicar minha obra. Uma delas me despertou o interesse. Mas para que a publicação aconteça, é necessário que eu, o autor, pague um valor para cobrir os custos iniciais. Infelizmente eu não tenho o dinheiro, e venho aqui pedir humildemente sua ajuda! Se você não pode colaborar financeiramente, ok sem problemas! Tu ainda pode compartilhar o link dessa campanha, e assim já estará ajudando através de sua divulgação. Deixo claro que irei recompensar os que doarem a partir de R$ 35,00! </p><p>Vamos falar sobre o livro...</p><p><strong>O que é a Saga Dragonium?</strong></p><p>É uma história de fantasia épica, que acontece dentro do contexto da mitologia nórdica, porém com sua originalidade. A história dos livros é caracterizada por ter um lado épico junto a um lado trágico, o que gera um enredo imprevisível, e assim oferecendo mistério ao leitor. Tudo fica complexo devido acontecer inúmeras histórias simultaneamente, que vão se ligando aos poucos. Tal Saga será integrada por 7 livros. </p><p><strong>Dragonium</strong> tem grandes chances de ser do agrado dos que gostam desse tipo de história. Desde o volume 1, é notável que foram adaptados inúmeros conteúdos de RPG em geral, e que tudo vai funcionar de modo direto, mas ao mesmo tempo o leitor vai entender detalhadamente como funciona os reinos que irão aparecer. Garanto que essas páginas estarão recheadas com batalhas de exércitos, guerreiros, magos, dragões, criaturas místicas, drama e muitas aventuras!</p><p>A seguir: <strong>Sinopse + um trecho do livro + mapa do reino Bherkem + capa(esboço)</strong></p><p><strong>""</strong> <strong>Sinopse do volume 1 - A cruzada dos cegos</strong></p><p> O deus Odin criou um planeta e o deu de presente
para seu filho- Thor, para que ele o administrasse. Este mundo recebeu
o nome de Erathor, e foi composto por inúmeras raças, que foram
povoando o local e evoluindo com o tempo. O deus Loki, foi responsável
pela realização de um difícil e longo teste, destinado ao administrador
de Erathor. Tal evento foi palco de inúmeras e épicas batalhas entre
os povos desse novo mundo, contra os poderosos dragões deuses.
Após a morte desses seres, a vida continuou junto a ausência de
qualquer deus. <br>
</p><p>Atualmente, depois de 25 mil anos, entre a calmaria
que domina ambos os reinos do planeta, surge um exército misto que usa
vestes negras. Ninguém sabe realmente o motivo do aparecimento de tal
armada. Indivíduos de reinos diferentes,
vão se encontrar em meio a uma cruzada inesperada e misteriosa,
composta por muita coragem e irmandade. <strong> ""</strong><br></p><p><br></p><p><strong>Trecho de um dos capítulos:</strong></p><p><strong>""</strong> Alguma coisa fez Órthur ficar com um olhar de temor,
ele ficou paralisado por alguns instantes, como se estivesse esperando
uma resposta. O arqueiro ao lado, o encarou tentando entender o que
estava acontecendo, então se ouviu algumas pequenas pedras rolando
sobre a montanha. Todos olharam, e viram alguns metros acima: um dragão
selvagem, posicionado em cima de uma pedra. Seus olhos estavam
brilhando com o desejo de caçar, suas patas se fecharam sobre a pedra,
e seus dentes ficaram expostos sobre uma expressão de raiva. Um baixo
rugido saiu de sua boca, alertando que ele não tinha boas intenções.
Ouviu se então o barulho de algo pousando no chão, e asas se batendo no
ar. O grupo olhou para os outros lados e percebeu que estavam cercados
por cinco dragões selvagens, que formavam o perímetro de um triângulo.</p><p>- Invadimos o seu território. Não adianta fugir...- alertou Órthur, em voz baixa<br>
</p><p>Todos posicionaram suas armas com o medo exposto em seus rostos.<strong> ""</strong><br></p><p><strong><br></strong></p><p><strong>Mapa do reino Bherkem (cenário do primeiro livro)</strong><img src=""https://s3-sa-east-1.amazonaws.com/cdn.br.catarse/uploads/redactor_rails/picture/data/50894/Reino_Bherkem_S%C3%A9pia_03.jpg""></p><p><strong><br></strong></p><p><strong>Arte da capa, que esbocei a mão e editei de modo amador no computador:</strong></p><p><img src=""https://s3-sa-east-1.amazonaws.com/cdn.br.catarse/uploads/redactor_rails/picture/data/50559/capa_com_relevo.jpg""></p><p><strong>Página do Facebook:</strong></p><p><a href=""https://www.facebook.com/DragoniumAcruzadadoscegos"">https://www.facebook.com/DragoniumAcruzadadoscegos</a><br></p>",dragonium_vol1_a_cruzada_dos_cegos,//www.youtube.com/embed/SjS7W765El0,https://youtu.be/SjS7W765El0,Literatura,20,https://s3-sa-east-1.amazonaws.com/cdn.br.catarse/uploads/project/uploaded_image/33041/capa_com_relevo.jpg,https://s3-sa-east-1.amazonaws.com/cdn.br.catarse/uploads/project/uploaded_image/33041/project_thumb_thumb_capa_com_relevo.jpg,https://s3-sa-east-1.amazonaws.com/cdn.br.catarse/uploads/project/uploaded_image/33041/project_thumb_small_capa_com_relevo.jpg,https://s3-sa-east-1.amazonaws.com/cdn.br.catarse/uploads/project/uploaded_image/33041/project_thumb_large_capa_com_relevo.jpg,https://s3-sa-east-1.amazonaws.com/cdn.br.catarse/uploads/project/uploaded_image/33041/project_thumb_video_cover_capa_com_relevo.jpg,6.80851063829787234000,240.0,7,7,failed,aon,finished,"2016-08-03 02:59:59.999999","2016-08-02 23:59:59.999999","2016-06-03 13:55:32.989298","2016-06-03 10:55:32.989298",,t,t,f,60,"{""total"" : 0, ""unit"" : ""seconds""}","{""total"" : 60, ""unit"" : ""days""}",0,"{""city"" : ""Paranavaí"", ""state_acronym"" : ""PR"", ""state"" : ""Paraná""}","{""id"" : 550243, ""name"" : ""Grégori Gabriel(Gnomo)""}",5,,f,f,0,f,f,f