project_id,id,user_id,name,headline,budget,goal,about_html,permalink,video_embed_url,video_url,category_name,category_id,original_image,thumb_image,small_image,large_image,video_cover_image,progress,pledged,total_contributions,total_contributors,state,mode,state_order,expires_at,zone_expires_at,online_date,zone_online_date,sent_to_analysis_at,is_published,is_expired,open_for_contributions,online_days,remaining_time,elapsed_time,posts_count,address,user,reminder_count,is_owner_or_admin,user_signed_in,in_reminder,total_posts,can_request_transfer,is_admin_role,contributed_by_friends
33210,33210,570998,"Acolhendo a Sombra para dar à Luz ","""O melhor presente que podemos dar ao mundo é a nossa transformação!""","<p>Valor total a arrecadar (aproximadamente): R$18500,00<br></p><p>$13.000,00 - Editora Madras (edição do livro, impressão/publicação,  noite de autógrafos, publicidade, distribuição nas livrarias a nível nacional e 2000 exemplares)</p><p>$2.500,00 - Catarse</p><p>$3000,00 - Recompensas (aproximadamente - o que inclui os gastos com CD´s, Correios e sublocação de sala para as sessões de Cura e PR)</p>",18500.0,"<p><em><strong></strong></em>O autoconhecimento verdadeiro leva à verdadeira espiritualidade. E é através dessa conexão com quem somos no espírito, que a cura é possível.  As pessoas hoje estão precisando de <strong><em>Cura</em></strong>.
 Precisam ir além do medo, quebrar tabus. Não podemos acreditar, num momento de 
crise, que somente remédios tarja preta sejam a solução. 
Tampouco devemos nos tornar <em>dependentes</em> de psicólogos e psiquiatras. 
Precisamos aproveitar o Caos para olharmos para as verdadeiras questões 
internas e encontrarmos <strong><i>soluções definitivas </i></strong>para os nossos problemas existenciais. Para isso, certamente é necessário saber pedir ajuda. Precisamos recorrer a <strong><em>ferramentas alternativas,</em></strong> que aliadas a muita força de vontade e disciplina, facilitarão a conexão. Não estamos falando em mágica, é um <em>processo de </em><strong><em>despertar</em></strong>. Esse livro visa trazer abertura para as nossas consciências.</p><p>Nesse mundo cheio de 
rótulos e patologias, como não ser enquadrado? É possível atingir equilíbrio pleno? O que envolve o processo de Cura? O que nos traz de positivo 
esse momento de Transição Planetária? Por quê a Psiquiatria e a 
Psicologia não falam em Cura? Qual a importância da espiritualidade no processo de 
Cura e Libertação? É 
preciso Religião para adentrar as esferas espirituais? Como se dão os processos da Mente e da Consciência? Como se dá a influência de energias externas no nosso mental? Qual o poder 
das crenças e intenções dos pensamentos? O que é magia? Como a magia está presente nas 
nossas vidas sem que tenhamos consciência? Como se libertar de padrões 
cristalizados que só causam sofrimento e dor? É possível ser autossuficiente
 e encontrar a Cura dentro de si mesmo? O que é verdadeiramente o AMOR, e
 qual a sua importância no processo de Cura? Como limpar o coração e 
liberar a mente? Como vencer o medo? Temos somente o corpo físico? Como 
funcionam os centros energéticos do corpo (Chakras)? Como se dá o processo de desencarne e o período inter vidas?</p><p><span class=""redactor-invisible-space"">Todas essas questões serão abordadas nesse livro.</span><br></p><p>Se você se sentiu tocado pelos pontos abordados aqui, colabore para que esse projeto se concretize! Não se trata somente da publicação e divulgação do livro, mas do SEU acesso e vivência de duas ferramentas terapêuticas transformadoras e curativas.</p><p>* As recompensas poderão ser entregues e/ou realizadas antes do prazo estipulado. A campanha irá até 2017, assim sendo as recompensas se darão ao longo desse período.</p><p>Para maiores esclarecimentos a respeito do projeto e/ou de dúvidas sobre as recompensas, por favor entre em contato comigo no email: daphineg@gmail.com ou no meu celular (21)98346-0299 (TIM e Whatsapp).<br></p>",acolhendoasombra,//www.youtube.com/embed/VfsKVVEf9XE,https://youtu.be/VfsKVVEf9XE,Literatura,20,https://s3-sa-east-1.amazonaws.com/cdn.br.catarse/uploads/project/uploaded_image/33210/FB_IMG_1466688375404.jpg,https://s3-sa-east-1.amazonaws.com/cdn.br.catarse/uploads/project/uploaded_image/33210/project_thumb_thumb_FB_IMG_1466688375404.jpg,https://s3-sa-east-1.amazonaws.com/cdn.br.catarse/uploads/project/uploaded_image/33210/project_thumb_small_FB_IMG_1466688375404.jpg,https://s3-sa-east-1.amazonaws.com/cdn.br.catarse/uploads/project/uploaded_image/33210/project_thumb_large_FB_IMG_1466688375404.jpg,https://s3-sa-east-1.amazonaws.com/cdn.br.catarse/uploads/project/uploaded_image/33210/project_thumb_video_cover_FB_IMG_1466688375404.jpg,6.64864864864864864900,1230.0,13,13,online,flex,published,,,"2016-06-30 11:14:50.961838","2016-06-30 08:14:50.961838",,t,f,t,,"{""total"" : 0, ""unit"" : ""seconds""}","{""total"" : 86, ""unit"" : ""days""}",0,"{""city"" : ""Rio de Janeiro"", ""state_acronym"" : ""RJ"", ""state"" : ""Rio de Janeiro""}","{""id"" : 570998, ""name"" : ""Daphine Grimaud""}",0,,f,f,0,f,f,f