project_id,id,user_id,name,headline,budget,goal,about_html,permalink,video_embed_url,video_url,category_name,category_id,original_image,thumb_image,small_image,large_image,video_cover_image,progress,pledged,total_contributions,total_contributors,state,mode,state_order,expires_at,zone_expires_at,online_date,zone_online_date,sent_to_analysis_at,is_published,is_expired,open_for_contributions,online_days,remaining_time,elapsed_time,posts_count,address,user,reminder_count,is_owner_or_admin,user_signed_in,in_reminder,total_posts,can_request_transfer,is_admin_role,contributed_by_friends
33505,33505,573566,"Demasiado Pouco Amor - livro digital, romance","Meu romance precisa de sua ajuda para ser publicado. Ele merece ser publicado.","<p><img src=""https://s3-sa-east-1.amazonaws.com/cdn.br.catarse/uploads/redactor_rails/picture/data/52387/vinheta_or%C3%A7amento.JPG""></p><hr><p>O meu romance, além de ser disponibilizado para os leitores em português, terá também uma tradução para o inglês. Desta
forma, pretendo alcançar o maior público possível.<br></p><p><strong>Orçamento:</strong></p><p>Revisão do texto em português: R$489,00</p><p>Tradução para inglês: R$930,00</p><p>Diagramação e conversão em e-book para as duas versões: R$500,00</p><p>Licença do uso da imagem da capa capa: R$500,00</p><p>Design da capa nas duas versões: R$600,00</p><p>Catarse: R$451,00</p><p>Total: R$3.470,00</p>",3470.0,"<p><img src=""https://s3-sa-east-1.amazonaws.com/cdn.br.catarse/uploads/redactor_rails/picture/data/54597/vinheta_descri%C3%A7%C3%A3o.do.projeto.JPG""></p><hr><p style=""text-align: justify;"">Numa ensolarada manhã de um domingo do mês de março, eu estava na Praça São Salvador, no Rio de Janeiro, ouvindo um grupo de músicos que tocavam chorinho. Meus olhos curiosos escrutinavam a pequena plateia que se reunia em volta da banda, quando me chamou a atenção uma linda moça miúda de aparência frágil e olhar sisudo e inteligente que prestava atenção à música. Eu logo me encantei dela e me aproximei devagarinho puxando uma conversa mole, ao que fui bem recebido. E assim nasceu Amaranta, a personagem central de Demasiado Pouco Amor. A personagem foi criada antes da história! Então, o meu problema era encontrar uma história para aquela personagem!<br></p>  <p style=""text-align: justify;"">Eu estava no Rio à procura de um assunto para um livro e o breve e agradável momento que passei conversando com aquela moça de leve sotaque do interior paulista foi o suficiente para eu montar toda uma história de amor inspirada naquela jovem. E nos meses que se seguiram mantivemos comunicação por e-mail e mensagens de texto, enquanto eu, apaixonado – eu estava apaixonado por dois, pois ela apenas me respondia educadamente e de forma desinteressada – fui construindo minha história de amor sem tirar aquela moça da minha cabeça, embora a minha personagem talvez não guarde nem de perto qualquer semelhança com ela além da descrição física. Eu estava apaixonado irremediavelmente pelas duas, uma que eu mal conhecia e a outra que eu ia conhecendo à medida que a sua história ia se pondo de pé.</p>  <p style=""text-align: justify;"">A história de Amaranta talvez soe como um clichê. Uma jovem batalhadora que ganha a vida com um trabalho curioso e alternativo, vive um romance conturbado com um famoso artista plástico, um homem mais velho de personalidade cativante e controversa. Mas não há compromisso entre os dois e, por isso, ambos estão livres para viverem romances paralelos. Certo dia, Amaranta conhece outro homem, no entanto este leva um estilo de vida convencional e previsível, mas que conquista o seu coração. Então ela vai viver um jogo delicado da vida ao ter que se decidir por um dos dois ou pelos dois. O final da história surpreende porque Amaranta responde às suas próprias indagações como uma mulher forte e livre.</p>  <p style=""text-align: justify;"">Amaranta consegue cativar o leitor e fazê-lo se apaixonar por ela deste o primeiro capitulo da história. Ela cuida da mãe doente com amor e muita dedicação e se preocupa com outras pessoas, ao mesmo tempo em que tem defeitos e muitas dúvidas sobre a sua vida. Ela adora ler, organizar e arrumar coisas e fez disso uma forma de sobrevivência, entrando na intimidade das pessoas e se interessando por elas. As suas qualidades e os seus defeitos a tornam uma personagem crível que encanta o leitor, e a sua força e independência como mulher trabalhadora fazem dela parecer com qualquer mulher dos dias atuais que não deixa de perseguir o amor verdadeiro e de desejar ter filhos e de formar algum dia uma família.</p><hr>  <p style=""text-align: justify;"">A ideia de publicar o meu romance
inicialmente no formato digital segue uma tendência atual para autores
iniciantes como eu. Muitos livros impressos em papel que têm sido lançados no
mercado com sucesso por editoras tradicionais, foram descobertos por estas
editoras fazendo sucesso inicialmente como livros de digitais, em edições independentes, em
plataformas de auto publicação. Para quem desconhece, as livrarias Saraiva e
Amazon, por exemplo, oferecem sistemas de auto publicação para autores
iniciantes. Este sistema se caracteriza pelo fato de o autor poder publicar livremente
o seu livro em formato digital sem precisar contar com o apoio de uma editora. Muitas
destas editoras até rejeitaras os manuscritos quando estes lhes foram enviados
pelo autor  e só quando estes passaram a
fazer sucesso no formato digital é que estas sucumbiram aos fatos e resolveram fechar
um contrato de publicação com o autor para imprimir o livro em papel. Creio que
ao publicar o meu romance no sistema de auto publicação e em duas línguas eu
estarei alcançando uma quantidade maior de leitores no Brasil e no exterior e,
quem sabe, cair nas graças de uma editora! <br></p><p style=""text-align: justify;""><img src=""https://s3-sa-east-1.amazonaws.com/cdn.br.catarse/uploads/redactor_rails/picture/data/52442/Vinheta_avalia%C3%A7%C3%A3o.de.quem.leu.JPG""></p><hr><p class=""fontsize-large"" style=""text-align: justify;"">Coloquei Demasiado Pouco Amor experimentalmente numa plataforma de leitura e escrita para sentir a reação do público. Leiam algumas opiniões encorajadoras de leitores:</p><blockquote class=""fontsize-base quote"">“Amigos, que livro incrivelmente bom. Pra começar, a personagem Amaranta é apaixonante. Conquista o leitor logo nas primeiras linhas e faz com que ele queria saber mais sobre ela. Os demais personagens aparecem aos poucos e cada um tem uma personalidade bem definida.  A narração é deliciosa de ler, e eu gostei deste livro porque tem muitas e muitas referências a livros clássicos e antigos.” Gabriel Bertella</blockquote><hr><p>“Nossa Cristiano, preciso começar dizendo que grata surpresa foi ler o seu livro! Caramba, eu já até tinha visto algumas vezes no grupo Wattpad Brasil, mas a capa me trazia uma ideia completamente equivocada da obra. E que bom que eu tive a chance de ler, porque assim revi os meus conceitos. Você está de parabéns! Apesar de ler apenas os cinco primeiros capítulos, estou completamente apaixonada por tudo.  Seus personagens são muito bem construídos. A Amaranta, por exemplo, é impossível de não se apaixonar! É tão complexa e cheia de camadas que é quase como se estivéssemos falando de uma pessoa real. Confesso que chorei quando descobri que ela visitava a mãe duas vezes por dia, também. Muito legal o grau de aproximação como personagem.Até onde li não existem muitos diálogos, mas são muito bem trabalhados – assim como todos os outros aspectos da obra. Adorei a Dona Carminha contando um pouco do passado dela, foi como estar ali sentada com as duas comendo um pedaço de bolo. Maravilhoso! Consegui visualizar exatamente cada cenário tão bem que foi quase como uma viagem lá para dentro. Eu particularmente adoro quando um livro me causa isso, e o seu fez muito bem. Livro super maduro, bem construído e instigante. Quero continuar lendo para conhecer um pouco mais dessa personagem que em poucos capítulos já conseguiu me cativar! Aliás, adorei o tamanho dos capítulos. São curtinhos e te prendem de um jeito que, quando para pra notar, já até foi! Hhehe Muito bom! Com certeza ganhou uma leitora! Parabéns!!!” Camile Etwas<br></p><hr><blockquote class=""fontsize-base quote"">""Bom, vou fazer minha singela crítica. Não é o gênero que costumo ler, mas me agradou muito, sério. <strong>Geral:</strong> Cristiano, seu livro é de uma maturidade e excelência literária, que fique abismada. Mas vou falar aqui, e no fim faço as considerações. <strong>Desenvolvimento:</strong> A história se passa devagar, apreciando cada pedacinho com calma. Me lembrou muito os livros de literatura que lia na escola. Vi o Gabriel dizendo que a história mesmo começa no 11, então entendo que as coisas estejam devagar até onde li. Mas isso não é  algo ruim. A delicadeza na sua narrativa e tudo mais é bem gostoso de apreciar. <strong>Escrita:</strong> Como eu disse acima, sua escrita é delicada, suave e quase poética. Amo suas descrições e como você nos leva através da mente da Amaranta. Não percebi erros gritantes, apesar de te recomendar a passar o olho no capítulo antes de postar, pois o wattpad sempre buga e tem uns carácteres estranhos no fim de alguns capítulos. <strong>Personagens:</strong> O que dizer da Amaranta? Ela é uma personagem incrível.  Diagnostiquei seu TOC lá no início, e isso me apaixonou nela ♥ Ela é forte, trabalhadora e amável! Parece uma pessoa real. Parabéns pela construção dela. Além dos demais personagens, é claro. <strong>Criatividade:</strong> Você tem de sobra. Isso é inegável. Sua descrição do hotel, foi incrível., o que cai no próximo item. <strong>Cenários:</strong> todos os cenários são muito bem construídos. A casa dela, com o piso de madeira antigo. O hotel muito bem construído. O apartamento do namorado, bagunçado que foi limpo durante a madrugada... Você manda bem. <strong>Comentário final:</strong> Seu livro é incrível, muito delicioso de ler. É bem diferente do que tenho lido atualmente, tem um ar maduro e clássico, e eu me peguei gostando muito. Espero que você tenha muito sucesso, pq você merece. Acho que não tenho mais nada a acrescentar, exceto que seu eu falei bobeira, me ignora kkkk"" - Nathalia Ferraz</blockquote><hr><p>“Ah não :( Eu tenho tanta identificação pelos personagens dessa história, que chega dói ler o final dela. E ainda sem caso de amor verdadeiramente concluído, ai. O desfecho do relacionamento da Amaranta e do Juarez soa como uma facada pra mim, que to vivendo um caso com uma pessoa de personalidade parecida com a dele... Enfim, cara, esse livro merecia estar na prateleira! Você escreve tão bem, o jeito que você descreve as situações e personagens é tão cativante.  Já tem em minha pessoa uma fã! Continue o ótimo trabalho e parabéns pela história” – Caroline Von Klein</p><p><br></p><p><img src=""https://s3-sa-east-1.amazonaws.com/cdn.br.catarse/uploads/redactor_rails/picture/data/52386/vinheta_capitulo.para.degusta%C3%A7%C3%A3o.JPG""><br></p><hr><p class=""fontsize-large"">Nota: convém lembrar que o texto ainda não passou por uma revisão.</p><p class=""fontsize-large"">Capítulo 3 - Bolo de Petrópolis com Chá</p><p style=""text-align: justify;"">Amaranta gostava de caminhar. Foi andando até o destino seguinte, apenas a poucas quadras do prédio de onde acabara de sair. Ao passar em frente a uma padaria e ver em sua vitrine todo tipo de salgado e doce, fez uma careta, preferiu ir mais adiante para tomar apenas um suco de frutas numa lanchonete próxima à Raul Pompéia. Entretanto, ao aproximar-se de seu destino, desistiu do suco, ficaria para mais tarde. Seguiu até o final da Sá Ferreira e entrou no primeiro prédio da Bulhões de Carvalho, um edifício pequeno e charmoso com a faixada em granito e um grande portão de ferro fundido com detalhes em latão que de tão bem polidos reluziam feito ouro. Não precisou nem ser anunciada pelo porteiro que tinha ordens para deixá-la subir. Foi direto para o segundo andar e bateu na porta de número 204. Não demorou muito para que uma mulher de meia idade de aparência forte, metida num vestido azul apertado, abrisse a porta e, sem meias palavras, fosse direto ao assunto, como se tivesse urgência em retornar ao que fazia antes de ser interrompida pela campainha.</p><p>            — Boa tarde... A dona Carminha está na outra sala... – disse com um meio sorriso sem tirar a mão da maçaneta.</p><p>            — Olá, Diva! Já estou quase atrasada. </p><p style=""text-align: justify;"">Amaranta entrou no apartamento e atravessou a primeira sala em direção a uma porta larga de correr que ficava sempre aberta como esta não tivesse outra utilidade além de servir de divisória entre as duas salas. Diva, por sua vez, voltou apressada para a cozinha resmungando. </p><p style=""text-align: justify;"">O lugar rescendia a um agradável e suave cheiro de cera de polir, isto porque o assoalho de madeira tinha sido lustrado naquela manhã e brilhava como se fosse novo em folha. Mas o aroma que chamou a atenção de Amaranta foi um adocicado perfume de rosa combinado com outra fragrância desconhecida e que vinha da direção da sala para a qual ela se encaminhava. Ao passar pela porta divisória, ela encontrou, à sua esperava, uma mulher idosa, sentada confortavelmente numa poltrona Berger, cujo forro era de um tecido de estampa florida azulada gasto pelo tempo. Ao ver a idosa, Amaranta logo associou-a à fragrância que tanto lhe agradara, a qual ela já estava começando a se habituar. A velha tinha a aparência fresca e empoada de quem tivesse recém-saído do banho e arrumara-se para ir encontrar amigas para o chá da tarde. Seus cabelos, que eram cheios e tinham o corte acima dos ombros, pareciam feitos de pérolas e eram realçados por um lenço azul turquesa colocado delicadamente em volta do pescoço. Vestia-se elegantemente com uma fina blusa de organdi estampado com rosas amarelas e uma saia longa de linho branca, entretanto o conjunto todo destoava com o par de velhas pantufas que ela tinha nos pés. Aquele chamativo detalhe, certamente, indicava a sua intenção de não ir a lugar algum além dos domínios daquele amplo apartamento. O toque final era uma fina camada de pó que conferia à sua aparência uma cor saudável ao seu rosto de pele pálida pela falta de banho sol que dona Carminha, prudentemente, mantinha-se longe para evitar manchas. Na mão esquerda, um par de alianças colocadas no mesmo dedo indicava os últimos anos de solitude que eram abrandados com visitas dos filhos e netos para o almoço dominical e pela vinda de Amaranta três dias por semana, já quase no final da tarde.</p><p>— Entre aqui, minha querida. – disse dona Carminha. Sua a voz ainda era firme e clara.</p><p>— Olá! – respondeu Amaranta com um sorriso.</p><p>— Acabei de sentar aqui para lhe esperar. Logo mais a menina vai nos trazer uma fatia de um delicioso bolo de laranja que minha neta trouxe de Petrópolis e duas xícaras de chá.</p><p style=""text-align: justify;"">A menina a que ela se referia era ninguém mais que Diva, sua empregada há vinte e cinco anos e cujos cabelos já começavam a ficar perolados como os de dona Carminha.</p><p>— Que maravilha! Estou mesmo com fome. Quase parava na padaria para fazer um lanche... mas estou de dieta.</p><p>— Há! Este bolo é bem levinho e não vai pesar nada em você, eu te garanto. – riu – Além do mais, estas comidas de padaria são sempre gordurosas.</p><p style=""text-align: justify;"">Amaranta sentou- se em outra poltrona que ficava de frente da qual dona Carminha estava e deixou o seu corpo relaxar por alguns instantes antes de prosseguir. Gostou de sentir aquele conforto e descansar as pernas. Pousou os olhos sobre o livro que estava sobre uma pequena mesa ao seu lado e fez uma expressão de entusiasmo.</p><p>— Eu estou curiosa pra ver qual é o mistério desse hotel, passei o dia pensando nisso... – disse pegando o livro e colocando sobre o colo.</p><p style=""text-align: justify;"">Dona Carminha fez uma pausa como se refletisse por um instante, deu um sorriso agradável e, em seguida, começou a falar pausadamente, recordando-se de uma lembrança do passado.</p><p style=""text-align: justify;"">— Quando eu era mocinha, eu ia com mamãe a Londres pelo menos uma vez ao ano. Íamos assistir à temporada de teatro e musicais que eram produções maravilhosas naquela época, sabe. Foi assim que eu tomei conhecimento de Agatha Christie, quando fomos assistir à primeira montagem de “A Ratoeira” que, segundo dizem, continua em cartaz há mais de 50 anos! Isto é uma maravilha, não é mesmo? Enfim, eu e mamãe costumávamos ficar no The Palace, um hotel pequeno, mas muito luxuoso e com uma clientela exclusiva como a do livro. Lembro-me muito bem como se fosse hoje. No salão principal havia um enorme lustre de cristal italiano, a coisa mais linda do mundo! O hotel era um verdadeiro requinte, até nos mínimos detalhes, sabe, roupas de cama de algodão egípcio, sais de banho ao lado da banheira, sabonetes deliciosamente perfumados, roupão macio. No restaurante principal, um café da manhã maravilhoso era servido com tudo de mais fino que você imaginasse. A toalha de mesa e guardanapos eram de linho, não esta coisa horrível sintética e descartável que usa hoje em dia. Os talheres eram de prata, a porcelana era inglesa da melhor qualidade, copos eram de cristal, enfim, um luxo como não encontramos em nossa própria casa. Bem, pelo preço que pagávamos pela diária, pelo amor de Deus, era o mínimo que eles podiam oferecer!</p><p style=""text-align: justify;"">Amaranta prestava atenção calada e fazia uma ensaiada expressão de surpresa para agradar dona Carminha.</p><p>— Eu nunca estive num hotel assim, mas jamais recusaria um convite para me hospedar lá de graça!</p><p>— Com certeza eles adorariam ter uma moça bonita como você como hóspede, minha querida. – disse dona Carminha.</p><p style=""text-align: justify;"">Em seguida, ela fez uma breve pausa seguida de um pigarro que era como um sinal entre a duas e cujo significado Amaranta já aprendera a interpretar. Houve um breve momento de silencio no qual Amaranta aproveitou para abrir o livro na página marcada por um pedaço de fita vermelha e, então, ela começou a ler em voz alta, mas não tão alta assim.</p><p><i>Richard Egerton tornou a olhar para o cartão oficial que estava à sua frente, depois levantou os olhos para o rosto do inspetor-chefe e disse:</i></p><p><i>— Caso curioso.</i></p><p><i>— Sim senhor – o inspetor-chefe concordou. – Um caso muito curioso.</i></p><p><i>— O hotel Bertram – continuou Egerton – no nevoeiro. Sim a terrível neblina ontem à noite. Creio que os senhores têm de<a href=""file:///C:/Users/Cristiano/OneDrive/Documentos/Book%20-%20Demasiado%20Pouco%20Amor/Cap.03.docx#_ftn1"" name=""_ftnref1"" title=""""><strong>[1]</strong></a>...</i></p><p style=""text-align: justify;"">Sua voz era suave e firme como os acordes de um instrumento musical. Também, vívida e agradável de se ouvir como o canto de um pássaro. Amaranta pronunciava cada palavra de maneira clara e limpa, nem de maneira muito alta e nem muito baixa. Nem rápida e nem devagar, de modo que era fácil de acompanhá-la sem perder o fio da meada, o que mantinha o ouvinte em silêncio e interessado. Não fazia dramatizações, imitações de vozes ou afetações de qualquer tipo ao ler, apenas seguia a cadência e ritmo do texto, acompanhando a sua intuição e pontuação. Ela tinha realmente o dom de encantar ao ler em voz alta, era capaz de fazer parecer até a leitura de uma bula de remédio em um texto literário interessante. Dona Carminha foi se deixando envolver pelo som de sua voz e transportando sua imaginação para o universo da leitura como alguém que senta numa banheira de espuma com água morna e deixa-se relaxar no conforto da temperatura. Recostou a cabeça branca no espaldar macio da cadeira com os olhos semicerrados e atenta àquela voz agradável e melodiosa. Alguns conseguiam chegar àquele nível de relaxamento com uma boa meditação ou com um copo de vinho de uma boa safra, mas Amaranta conseguia provocar o mesmo efeito com sua agradável voz e a leitura de um texto.</p><p style=""text-align: justify;"">Ela emprestava os seus olhos para outros que não conseguiam mais dar conta da tarefa. Na verdade, era muito mais que isto, ela fazia as pessoas idosas que perdiam a visão sentirem vontade de continuar vivendo. E esta era a outra maneira pela qual ela ganhava o seu pão.</p><p><br>  </p><hr><p><a href=""file:///C:/Users/Cristiano/OneDrive/Documentos/Book%20-%20Demasiado%20Pouco%20Amor/Cap.03.docx#_ftnref1"" name=""_ftn1"" title="""">[1]</a> O Caso do Hotel Bertram, Agatha Christie, capítulo 23, 1965.</p><p><br></p><p><img src=""https://s3-sa-east-1.amazonaws.com/cdn.br.catarse/uploads/redactor_rails/picture/data/52748/vinheta_recompensa.JPG""></p><hr><p style=""text-align: justify;"">Estas são as duas opções de recompensas concretas para quem doar R$350,00. Impressão em papel de algodão de pH neutro de 300gr. O financiador pode escolher apenas uma das duas opções abaixo.<br></p><p style=""text-align: justify;""><strong></strong></p><p><img src=""https://s3-sa-east-1.amazonaws.com/cdn.br.catarse/uploads/redactor_rails/picture/data/52430/desenho_op%C3%A7%C3%A3o.1.jpg"" alt="""" style=""display: block; margin: auto;""></p><p><img src=""https://s3-sa-east-1.amazonaws.com/cdn.br.catarse/uploads/redactor_rails/picture/data/52431/desenho_op%C3%A7%C3%A3o.2.jpg"" alt="""" style=""display: block; margin: auto;""></p><hr><p style=""text-align: justify;"" rel=""text-align: justify;"">Estas são as duas opções de recompensa para quem doar R$650,00. Impressão em papel de algodão de pH neutro de 300gr. O doador pode escolher apenas uma das duas opções abaixo.</p><p><img src=""https://s3-sa-east-1.amazonaws.com/cdn.br.catarse/uploads/redactor_rails/picture/data/53937/pintura_op%C3%A7%C3%A3o.1.jpg"" alt="""" style=""display: block; margin: auto;""></p><p><br></p><p><img src=""https://s3-sa-east-1.amazonaws.com/cdn.br.catarse/uploads/redactor_rails/picture/data/53938/pintura_op%C3%A7%C3%A3o.2.jpg"" alt="""" style=""display: block; margin: auto;""></p><p><br></p><p><br></p><p><img src=""https://s3-sa-east-1.amazonaws.com/cdn.br.catarse/uploads/redactor_rails/picture/data/53942/vinheta_sobre.o.autor.JPG""><br></p><hr><p style=""text-align: justify;"">Nasci em Fortaleza e aos 2 anos de idade vim com minha família morar em Salvador. Meu pai era um artista plástico por profissão e, por isso, cresci e convivi em meio a artistas plásticos, escritores e poetas, amigos e colegas do papai. E desta convivência e de meu gosto pela leitura nasceu o desejo de me tornar um escritor. Estudei letras e literatura inglesa na Universidade Federal da Bahia, fui professor e microempresário. Certo dia, joguei tudo para o alto para dedicar-me a escrever em tempo integral. “Demasiado Pouco Amor” é o meu primeiro romance. Entretanto, escrevi e publiquei a biografia do meu pai e ""Valentina e os Diabos Verdes"", o primeiro volume da trilogia infanto juvenil Imagine, disponível para venda na Amazon. Escrevo regularmente para o meu blog de crônicas e histórias ""Cartas do Meu Moinho” (http://cristiano-cartasdomeumoinho.blogspot.com/). Eu sou este aí da foto.<br></p><p><img src=""https://s3-sa-east-1.amazonaws.com/cdn.br.catarse/uploads/redactor_rails/picture/data/54595/catarse.jpg""></p><p><br></p>",demasiadopoucoamor-digital,,,Literatura,20,https://s3-sa-east-1.amazonaws.com/cdn.br.catarse/uploads/project/uploaded_image/33505/card.do.projeto-romance.jpg,https://s3-sa-east-1.amazonaws.com/cdn.br.catarse/uploads/project/uploaded_image/33505/project_thumb_thumb_card.do.projeto-romance.jpg,https://s3-sa-east-1.amazonaws.com/cdn.br.catarse/uploads/project/uploaded_image/33505/project_thumb_small_card.do.projeto-romance.jpg,https://s3-sa-east-1.amazonaws.com/cdn.br.catarse/uploads/project/uploaded_image/33505/project_thumb_large_card.do.projeto-romance.jpg,https://s3-sa-east-1.amazonaws.com/cdn.br.catarse/uploads/project/uploaded_image/33505/project_thumb_video_cover_card.do.projeto-romance.jpg,81.55619596541786743500,2830.0,38,38,online,flex,published,,,"2016-07-01 01:38:03.973733","2016-06-30 22:38:03.973733",,t,f,t,,"{""total"" : 0, ""unit"" : ""seconds""}","{""total"" : 86, ""unit"" : ""days""}",4,"{""city"" : ""Salvador"", ""state_acronym"" : ""BA"", ""state"" : ""Bahia""}","{""id"" : 573566, ""name"" : ""Cristiano Teixeira, escritor""}",1,,f,f,4,f,f,f