project_id,id,user_id,name,headline,budget,goal,about_html,permalink,video_embed_url,video_url,category_name,category_id,original_image,thumb_image,small_image,large_image,video_cover_image,progress,pledged,total_contributions,total_contributors,state,mode,state_order,expires_at,zone_expires_at,online_date,zone_online_date,sent_to_analysis_at,is_published,is_expired,open_for_contributions,online_days,remaining_time,elapsed_time,posts_count,address,user,reminder_count,is_owner_or_admin,user_signed_in,in_reminder,total_posts,can_request_transfer,is_admin_role,contributed_by_friends
33637,33637,574608,"Projeto Olhar Inclusivo ","Fotografia inclusiva para portadores de Deficiencia Intelectual","<p>12 cameras Fotograficas Nikon 5200 +Lente +Cartao de Memoria 2358,00 cada uma no Mercado Livre</p><p>200 Livros de Fotografia com os trabalhos dos alunos Valor 49,80 cada livro</p><p>24 mulduras em madeira valor 55 Reais cada </p><p>500 Apliacões 10x4 durante o curso</p><p>Apliacões para a expocição valor 32,00 reais cada total de 24 fotografia</p><p>Ajuda de custo para Participantes </p><p>aluguel de vam para saidas Fotograficas</p><p>Lanches</p>",47000.0,"<p>O Instituto Olhar Inclusivo Realiza um Trabalho de Inclusão
Social no Centro Cultural Monte azul, Zona Sul de São Paulo que ensina
Fotografia á Jovens e Adultos com Deficiência Intelectual. Onde os alunos tem
aula de Fotografia diretamente com professores bem conceituados no Brasil... O
curso tem como finalidade realizar uma exposição no Céu casa Blanca zona sul de
São Paulo para apresentar a sociedade o desenvolvimento desses alunos. Todo
esse projeto será documentado em um livro da turma.</p><p>O curso acontece às sextas feiras com duração de uma hora para
cada turma com seis alunos (No momento estamos com mais 40 alunos na lista de
espera.). São realizados com câmeras profissionais com todo equipamento
utilizado por um profissional. O intuito do projeto é capacitar os alunos
por meio da inclusão que realizem suas próprias exposições e consiga ajudar
suas famílias com a venda dos quadros. Para isso precisamos de verba para completar
a quantidade de equipamento para cada aluno.</p><p>Sabemos do alto custo dos equipamentos, das saídas fotográficas
e estrutura para exposição como moldura, buffet de apresentação e ajuda de
custo para os profissionais que são voluntários. </p><p>Por isso contamos com sua ajuda e contribuição </p><p>Maiores
informações pagina no facebook instituto olhar inclusivo</p><p>whatsapp
11 981153925</p><p>Não
recebemos patrocínio de órgãos do governo ou empresas privadas. Acreditamos no
proposito do projeto e contamos com a sua participação.</p><p>att</p><p>Instituto
Olhar Inclusivo</p>",projeto_olhar_inclusivo_fotografia_para_deficientes_intelectuais_f684,,,Fotografia,17,https://s3-sa-east-1.amazonaws.com/cdn.br.catarse/uploads/project/uploaded_image/33637/IMG_7960.JPG,https://s3-sa-east-1.amazonaws.com/cdn.br.catarse/uploads/project/uploaded_image/33637/project_thumb_thumb_IMG_7960.JPG,https://s3-sa-east-1.amazonaws.com/cdn.br.catarse/uploads/project/uploaded_image/33637/project_thumb_small_IMG_7960.JPG,https://s3-sa-east-1.amazonaws.com/cdn.br.catarse/uploads/project/uploaded_image/33637/project_thumb_large_IMG_7960.JPG,https://s3-sa-east-1.amazonaws.com/cdn.br.catarse/uploads/project/uploaded_image/33637/project_thumb_video_cover_IMG_7960.JPG,0.10638297872340425500,50.0,1,1,online,flex,published,,,"2016-06-17 14:42:37.06605","2016-06-17 11:42:37.06605",,t,f,t,,"{""total"" : 0, ""unit"" : ""seconds""}","{""total"" : 99, ""unit"" : ""days""}",0,"{""city"" : ""São Paulo"", ""state_acronym"" : ""SP"", ""state"" : ""São Paulo""}","{""id"" : 574608, ""name"" : ""Marcos Caires Casa Grande Fotografo ganhador de varios Premios no Brasil e exterior""}",0,,f,f,0,f,f,f