project_id,id,user_id,name,headline,budget,goal,about_html,permalink,video_embed_url,video_url,category_name,category_id,original_image,thumb_image,small_image,large_image,video_cover_image,progress,pledged,total_contributions,total_contributors,state,mode,state_order,expires_at,zone_expires_at,online_date,zone_online_date,sent_to_analysis_at,is_published,is_expired,open_for_contributions,online_days,remaining_time,elapsed_time,posts_count,address,user,reminder_count,is_owner_or_admin,user_signed_in,in_reminder,total_posts,can_request_transfer,is_admin_role,contributed_by_friends
33643,33643,201671,"Necromorfus - Volumes 1 e 2","Douglas pode ser qualquer pessoa que morreu, só não pode ser ele mesmo.","<ul><li><strong>Gráfica: </strong>50%</li><li><strong>Correios: </strong>22%</li><li><strong>Recompensas: </strong>15%</li><li><strong>Taxa do </strong><strong>Catarse:</strong> 13%</li></ul><p><span style=""color: rgb(121, 128, 139); font-family: Arial, sans-serif; font-size: 18px; line-height: 27px;""><br></span></p><p><span style=""color: rgb(121, 128, 139); font-family: Arial, sans-serif; font-size: 18px; line-height: 27px;"">Para esse projeto se tornar realidade, contamos com o seu apoio, seja adquirindo algum pacote de recompensas ou divulgando esta campanha. Caso a meta não seja atingida, o Catarse devolve integralmente o seu dinheiro.</span><img src=""https://s3-sa-east-1.amazonaws.com/cdn.br.catarse/uploads/redactor_rails/picture/data/66164/1473045206__1_.gif""></p><p><strong><br></strong></p><p><strong>SE PUDESSE SER ALGUÉM QUE JÁ MORREU, </strong><strong>QUEM VOCÊ SERIA?</strong></p>",4900.0,"<p><strong>Se você chegou até aqui é por que talvez se interesse por histórias surpreendentes...</strong><em></em></p><p><strong>Já imaginou conseguir se transformar em alguém que já morreu? </strong>Necromorfus, personagem criado por <strong>Gabriel Arrais</strong>, conta a história de Douglas, um adolescente que pode assumir a forma e ter as recordações de qualquer pessoa morta, bastando para isso apenas tocar em qualquer resto mortal desta pessoa. Porém, tudo tem o seu preço... Após adquirir esse dom, ele só consegue sentir algum prazer ou emoção sendo outra pessoa. E pra piorar, ele está eternamente preso em seu corpo de 16 anos, sem poder envelhecer jamais.<br></p><p><strong></strong></p><p><img src=""https://s3-sa-east-1.amazonaws.com/cdn.br.catarse/uploads/redactor_rails/picture/data/65652/capas_aplicadas.jpg""><strong>Necromorfus nº1 - <em>Ossos do Rei</em></strong></p><p>A primeira edição lançada de forma independente
foi desenhada por<strong> Magenta King</strong>, que recentemente teve o projeto <strong><a href=""https://www.catarse.me/9horas"">9 Horas</a></strong> financiado
aqui no Catarse. A HQ foi um grande sucesso de vendas e por isso ganhou uma
nova reimpressão. Confira no vídeo abaixo o making of:<br></p><iframe style=""width: 500px; height: 281px;"" rel=""width: 500px; height: 281px;"" src=""//www.youtube.com/embed/vawtv-QtCzo"" frameborder=""0"" allowfullscreen=""""></iframe><p><img src=""https://s3-sa-east-1.amazonaws.com/cdn.br.catarse/uploads/redactor_rails/picture/data/65708/necromorfus_pag1.jpg""><br></p><p><strong>Necromorfus nº2 –</strong><span class=""apple-converted-space""><strong> </strong></span><em><strong>Poeta Interior                   </strong></em></p><p class=""fontsize-large""><strong>""E maldito (seja) o que incomodar os meus
restos mortais."" </strong><br>
Após Douglas ignorar esse aviso no túmulo de um famoso
poeta e profanar seus ossos, algo dá errado. O poeta começa a assumir o
controle do corpo de Necromorfus sem que ele queira e Douglas vai precisar da
ajuda de outro poeta desencarnado. Essa edição é desenhada por <strong><a href=""http://abeloverdrive.com.br/"">Abel</a></strong> (Rafael Vasconcellos), artista que já trabalhou nos títulos Almanaque Gótico, Solar e foi<strong> vencedor do Troféu HQ Mix 2016</strong> pela minissérie <strong><a href=""https://www.facebook.com/ContraversaoGibis"">Ditadura no Ar.</a><br></strong>
<iframe width=""500"" height=""281"" src=""//www.youtube.com/embed/R2ydL1qqe6M"" frameborder=""0"" allowfullscreen=""""></iframe><strong><img src=""https://s3-sa-east-1.amazonaws.com/cdn.br.catarse/uploads/redactor_rails/picture/data/65710/NecroM2-pg03.jpg""></strong><strong><img src=""https://s3-sa-east-1.amazonaws.com/cdn.br.catarse/uploads/redactor_rails/picture/data/65711/NecroM2-pg014.jpg""></strong><br></p><p><strong>Edição 1 <strong>–</strong> Ossos do Rei</strong></p><ul><li>36 páginas</li><li>Formato Americano (17 x 26 cm)</li><li>Capa em Triplex 250gr com laminação Brilho</li><li>Miolo preto e branco em Couché Brilho LD 115gr</li><li>Lombada canoa</li></ul><p><strong><br></strong></p><p><strong>Edição 2 – Poeta Interior</strong></p><ul><li>40 páginas</li><li>Formato Americano (17 x 26 cm)</li><li>Capa em Triplex 250gr com laminação Brilho</li><li>Miolo preto e branco em Couché Brilho LD 115gr</li><li>Lombada canoa</li></ul><p class=""fontsize-large""><span style=""font-size: 13.5pt; font-family: Arial, sans-serif;""><strong><br></strong></span></p><p><span style=""font-size: 13.5pt; font-family: Arial, sans-serif;"">                        <strong>Metas Estendidas </strong></span></p><p><span style=""font-size: 13.5pt; font-family: Arial, sans-serif;""><strong><span style=""font-size: 13.5pt; font-family: Arial, sans-serif;""><strong>7.000,00</strong></span> <span style=""font-size: 13.5pt; font-family: Arial, sans-serif;"">- Caso a campanha atinja esse valor, a edição número 2 ganhará uma história extra de oito páginas revelando um pouco mais sobre o passado do personagem.</span></strong></span></p><p><span style=""font-size: 13.5pt; font-family: Arial, sans-serif;""><strong><br></strong></span></p>",necromorfus,//www.youtube.com/embed/-senzibIZLE,https://youtu.be/-senzibIZLE,Quadrinhos,7,https://s3-sa-east-1.amazonaws.com/cdn.br.catarse/uploads/project/uploaded_image/33643/capa_do_projeto.jpg,https://s3-sa-east-1.amazonaws.com/cdn.br.catarse/uploads/project/uploaded_image/33643/project_thumb_thumb_capa_do_projeto.jpg,https://s3-sa-east-1.amazonaws.com/cdn.br.catarse/uploads/project/uploaded_image/33643/project_thumb_small_capa_do_projeto.jpg,https://s3-sa-east-1.amazonaws.com/cdn.br.catarse/uploads/project/uploaded_image/33643/project_thumb_large_capa_do_projeto.jpg,https://s3-sa-east-1.amazonaws.com/cdn.br.catarse/uploads/project/uploaded_image/33643/project_thumb_video_cover_capa_do_projeto.jpg,32.87755102040816326500,1611.0,53,53,online,aon,published,"2016-11-07 01:59:59.999999","2016-11-06 23:59:59.999999","2016-09-07 04:18:50.082485","2016-09-07 01:18:50.082485",,t,f,t,60,"{""total"" : 42, ""unit"" : ""days""}","{""total"" : 18, ""unit"" : ""days""}",1,"{""city"" : ""São Paulo"", ""state_acronym"" : ""SP"", ""state"" : ""São Paulo""}","{""id"" : 201671, ""name"" : ""Gabriel Arrais""}",33,,f,f,33,f,f,f