project_id,id,user_id,name,headline,budget,goal,about_html,permalink,video_embed_url,video_url,category_name,category_id,original_image,thumb_image,small_image,large_image,video_cover_image,progress,pledged,total_contributions,total_contributors,state,mode,state_order,expires_at,zone_expires_at,online_date,zone_online_date,sent_to_analysis_at,is_published,is_expired,open_for_contributions,online_days,remaining_time,elapsed_time,posts_count,address,user,reminder_count,is_owner_or_admin,user_signed_in,in_reminder,total_posts,can_request_transfer,is_admin_role,contributed_by_friends
33740,33740,575543,"Porto Negro","Rompendo barreiras e desfazendo estereótipos.","<p style=""text-align: justify;""><strong>1. </strong>A contrapartida que nosso espaço expositivo, o Centro Cultural CEEE Erico Verissimo pede, é uma lata de tinta após após o término da exposição. Como haverá um trabalho que o artista pintará na parede, foi solicitado mais uma lata. </p><p style=""text-align: justify; margin-left: 20px;"">Cada lata custa em torno de R$300,00 - precisaremos de 2 latas, portanto:</p><p style=""margin-left: 20px;"">R$ 600,00   =  7,6%      </p><p style=""margin-left: 20px;""><br></p><p><strong>2.</strong> Materiais para montagem da exposição como buchas e parafusos, pregos, fios de nyllon e fitas de silicone.</p><p style=""margin-left: 20px;"">R$ 100,00    =  1,2%<br></p><p><br></p><p><strong>3. </strong>Boa parte das obras vão exigir moldura e vidro. Para tal prevemos:</p><p style=""margin-left: 20px;""> R$ 2.000,00  =  26%</p><p><br></p><p><strong>4. </strong>Banner para divulgação, colocado na vitrine do Centro Cultural CEEE e texto impresso da exposição fixado na parede: </p><p style=""margin-left: 20px;"">R$ 150,00    =  1,7%</p><p><br></p><p style=""text-align: justify;""><strong>5.</strong> Ajuda de custo para que os artistas transportem suas obras (lembrando que existe o deslocamento de ida, e de vinda após o término da exposição. Alguns trabalhos são mais delicados, outros maiores e acabam exigindo transporte mais adequado que gera custos. </p><p style=""text-align: justify;"">Se a obra do artista não exigir grandes gastos com transporte, a ajuda de custo fica para que cada artista utilize naquilo que ele julgar necessário para a montagem ou execução de seu trabalho, como por exemplo tinta, tela, materiais em geral para a composição das obras. </p><p style=""text-align: justify; margin-left: 20px;"">R$ 111,00 por artista x  27 artistas =  R$3.000,00   =  39%</p><p style=""text-align: justify; margin-left: 20px;""><br></p><p style=""text-align: justify;""><strong>6.</strong> Passagem e estadia para o artista convidado vir de São Paulo para Porto Alegre.</p><p style=""text-align: justify;"">Entendemos que a vinda de Moisés Patrício só agrega valor a exposição, pois o artista trará consigo suas vivências artísticas e culturais do centro do país e as colocará em diálogo com o sul.</p><p style=""text-align: justify; margin-left: 20px;"">R$ 900,00   =  11,5%</p><p style=""text-align: justify; margin-left: 20px;""><br></p><p style=""text-align: justify;""><strong>7. </strong>Pagamento do Catarse </p><p style=""text-align: justify; margin-left: 20px;"">R$ 994,00    =  13%<br></p><strong> </strong><p><br></p><p><br></p><p><img src=""https://s3-sa-east-1.amazonaws.com/cdn.br.catarse/uploads/redactor_rails/picture/data/54314/Orcamento.jpg""></p><p style=""text-align: justify;""><br></p><p><br></p><p><br></p>",7644.0,"<p style=""text-align: justify;""><span class=""4n-jfsl"">A
 exposição mostrará a diversidade da produção dos artistas negros de 
Porto Alegre e região metropolitana, e também criações que 
tenham sido inspiradas pelas culturas de matriz africana.</span><br></p><p style=""text-align: justify;"">Porto Negro, além de ser uma exposição de artes visuais, é um projeto que abre espaço para reflexões, troca de ideias e debates. Durante a mostra haverão rodas de conversa com os artistas e convidados, momentos em que o público poderá  participar, expor suas opiniões e questionamentos. A mostra contará também com a participação do artista convidado Moisés Patrício, que  trará suas vivências artísticas e culturais do centro do país e as colocará em diálogo com Porto Alegre, e para a mostra apresentará um trabalho que será  realizado em nossa cidade.</p><p style=""text-align: justify;""><br></p><p>ARTISTAS<br></p><p style=""text-align: justify;"">Alejandro Ruiz<strong></strong>, Estêvão da Fontoura, Gilberto Souza, Giuliano Lucas, Guaraci Feijó, Irene Santos, Jonas Fernando, kelvin Koubik, Leandro Machado, Luid, Luisa Grabriela, Luiz Flávio Trampo, Luís Pedro Fraga, Marcelo Monteiro, Marcos Porto, Mariana Patrício, Paulo Chimendes, Paulo Correa, Paulo Limmah, Pelópidas Thebano, Rafa Eis, Rafael Souza, Renato Capoeira, Sandra Simões, Sobral, Waldemar Max. Participação: Silvana Rodrigues (performer)<br>Artista convidado: Moisés Patrício</p><p>Identidade Visual: Marcos Porto e Waldemar Max<br>Coordenação de montagem: Marcelo Monteiro<br>Produção: Ingrid Noal e Waldemar Max<br>Assessoria cultural: Cássio Henrique        <br>Projeto e organização: Ingrid Noal</p><hr><p>SEJA  UM APOIADOR  E  AJUDE  O  PROJETO  A  ACONTECER!</p><p>Ao término do período de arrecadação dos apoios, será feita uma prestação de contas, para que todos possam conferir o uso do dinheiro arrecadado, que será usado exclusivamente em prol do coletivo para a realização do evento.<br></p><p>RECOMPENSAS:</p><br><p><br></p><p><img src=""https://s3-sa-east-1.amazonaws.com/cdn.br.catarse/uploads/redactor_rails/picture/data/55565/ANCORADOURO__P.jpg""></p>Foto(c): Waldemar Max, Ancoradouro <p>Disponíveis:</p><p>- tamanho 20 x 25 cm  - referente ao apoio de R$ 100,00<br></p><p> - tamanho 30 x 40 cm (3 unidades) - referente ao apoio de R$<span class=""redactor-invisible-space""> 500,00<span class=""redactor-invisible-space""></span></span></p><p>- tamanho 50 x 65 cm ( 1 unidade disponível) - referente ao apoio de R$ 1.000,00</p><p><br></p><p><br></p><p><img src=""https://s3-sa-east-1.amazonaws.com/cdn.br.catarse/uploads/redactor_rails/picture/data/55566/Estev%C3%A3o_papel_do_artista_2_foto_Giiuliano_part_Mich.jpg""></p><p>Obra ""O Papel do Artista"" de Estevão Fontoura     fotos (c) Giuliano Lucas</p><p> A ação que consistiu em ir a um supermercado de Porto Alegre, 
adesivar algumas embalagens de papel higiênico e deixá-las nas 
prateleiras para que fossem compradas pelos clientes da loja. Referente ao apoio de R$ 95,00</p><p><br></p><p><br></p><p><img src=""https://s3-sa-east-1.amazonaws.com/cdn.br.catarse/uploads/redactor_rails/picture/data/55572/Catalogo_Porto_Negro.jpg""></p><p>CATÁLOGO  PORTO  NEGRO</p><p>versão pocket - referente ao apoio de R$ 75,00</p><p>versão completa - referente ao apoio de R$ 300,00<br></p><p><br></p><hr><p><br></p>",portonegro,,,Artes,1,https://s3-sa-east-1.amazonaws.com/cdn.br.catarse/uploads/project/uploaded_image/33740/Porto_Negro_convite_versao_red_Cat2.jpg,https://s3-sa-east-1.amazonaws.com/cdn.br.catarse/uploads/project/uploaded_image/33740/project_thumb_thumb_Porto_Negro_convite_versao_red_Cat2.jpg,https://s3-sa-east-1.amazonaws.com/cdn.br.catarse/uploads/project/uploaded_image/33740/project_thumb_small_Porto_Negro_convite_versao_red_Cat2.jpg,https://s3-sa-east-1.amazonaws.com/cdn.br.catarse/uploads/project/uploaded_image/33740/project_thumb_large_Porto_Negro_convite_versao_red_Cat2.jpg,https://s3-sa-east-1.amazonaws.com/cdn.br.catarse/uploads/project/uploaded_image/33740/project_thumb_video_cover_Porto_Negro_convite_versao_red_Cat2.jpg,0.78492935635792778600,60.0,2,2,successful,flex,finished,"2016-08-07 02:59:59.999999","2016-08-06 23:59:59.999999","2016-06-29 05:48:08.19178","2016-06-29 02:48:08.19178",,t,t,f,1,"{""total"" : 0, ""unit"" : ""seconds""}","{""total"" : 38, ""unit"" : ""days""}",0,"{""city"" : ""Porto Alegre"", ""state_acronym"" : ""RS"", ""state"" : ""Rio Grande do Sul""}","{""id"" : 575543, ""name"" : ""Porto Negro""}",0,,f,f,0,t,f,f