project_id,id,user_id,name,headline,budget,goal,about_html,permalink,video_embed_url,video_url,category_name,category_id,original_image,thumb_image,small_image,large_image,video_cover_image,progress,pledged,total_contributions,total_contributors,state,mode,state_order,expires_at,zone_expires_at,online_date,zone_online_date,sent_to_analysis_at,is_published,is_expired,open_for_contributions,online_days,remaining_time,elapsed_time,posts_count,address,user,reminder_count,is_owner_or_admin,user_signed_in,in_reminder,total_posts,can_request_transfer,is_admin_role,contributed_by_friends
34487,34487,580682,DoMax,"Ajude-nos a dar uma nova moradia para um deficiente visual.","<p class=""fontsize-larger fontweight-semibold""><strong><del></del>Sua ajuda dará início à um novo modo de vida<br></strong></p><hr><p>Uma boa parte das contribuições será utilizada para o desenvolvimento do primeiro protótipo do DoMax, que será utilizado para realizar os testes iniciais. Desenvolvido totalmente utilizando a plataforma Arduino, 35% dos gastos serão destinados aos shields (módulos externos, como o reconhecedor de voz, por exemplo). </p><p>O projeto inicial necessitará de residências aptas para os mais diversos testes. Serão analisados diversos modelos residenciais para que o sistema ofereça o maior conforto ao usuário. Grande parte dos custos destinados à essa parte serão originados pelos testes nos circuitos elétricos, que demandam tempo e aparelhos de segurança específicos. Daqui sairão 40% do total arrecadado.</p><p><br></p><p class=""fontsize-large""><strong>Vamos sentir na pele?</strong><br></p><p>Seu financiamento terá uma importância gigantesca na continuação das pesquisas, as quais serão ampliadas. Já os 25% restantes das arrecadações totais serão destinados aos testes de campo e entrevistas com pessoas com deficiência. Nossos planos agora são de expandi-las para o mundo real, analisando de perto todas as dificuldades enfrentadas por aqueles que possuem deficiência. Serão realizados testes mais precisos com deficientes reais, assim, será possível entender o que deverá ser implantado  futuramente no <em>DoMax</em>.</p><p><strong><br></strong></p><p class=""fontsize-large""><strong>Rumo ao mundo real</strong><br></p><p><img src=""https://s3-sa-east-1.amazonaws.com/cdn.br.catarse/uploads/redactor_rails/picture/data/59757/posterbrasil.png""></p><p>Após a finalização dos testes, nossa meta é levar o DoMax para casas reais de deficientes reais, que farão o uso do sistema, nos ajudando a dar continuidade em nosso trabalho, comercializando-o sempre pelo menor preço possível. Dentro de alguns meses, é esperado que diversas residências já possuam nosso sistema.</p><p><br><br></p>",2000.0,"<p class=""fontsize-larger fontweight-semibold"">Os deficientes visuais no Brasil</p><hr><p>Segundo dados do Instituto Brasileiro de Geografia e estatística (IBGE), a deficiência visual é a mais comum entre os brasileiros e atinge aproximadamente 3,6% da população. Parte destas pessoas se tornam incapazes de trabalhar, estudar ou realizar outras atividades habituais. </p><p><img src=""https://s3-sa-east-1.amazonaws.com/cdn.br.catarse/uploads/redactor_rails/picture/data/60391/graf.png""><br><br>O grande número de deficientes contrasta com a falta de infraestrutura adequada para atendê-lo. Tanto em ruas, hospitais, prédios ou até mesmo em suas residências, estas pessoas enfrentam enorme dificuldades para se locomover e realizar tarefas básicas. O problema se torna ainda maior em suas residências, onde, na maioria, não existem as necessárias adaptações para enfrentar esses problemas.</p><hr><p class=""fontsize-larger fontweight-semibold""><br>Eles têm um problema...<br></p><p>Como visto, o Brasil possui uma quantidade surpreendente de deficientes visuais, que, como todas as pessoas, possuem problemas. As coisas se complicam a partir do momento em que não são encontradas soluções eficientes.<br><br>Faça o teste: coloque-se no lugar de um deficiente por um dia. Não demorará até que você perceba algumas das barreiras enfrentadas. Até ações simples, como encontrar um controle remoto da TV, por exemplo, se tornam complexas. As dificuldades não param por aí. Controlar um aparelho de ar condicionado pode se tornar uma tarefa quase impossível. Continue pensando: como você descobrirá o horário sem enxergar um relógio? E não para por aí. Morar sozinho quando se é um deficiente torna a vida muito mais difícil: O conforto é muitas vezes deixado de lado, o risco de acidentes é iminente e a residência muitas vezes não possui a segurança necessária.</p><p class=""fontsize-larger fontweight-semibold""><br><strong><strong>...Nós temos a solução</strong></strong><br></p><p>Você já assistiu a animação ""Os Jetsons""? Se a resposta for sim, uma 
ideia deve estar passando em sua cabeça. Nosso projeto consiste em uma 
central de controle residencial. Não entendeu? Bem, com o<em> DoMax</em>, o 
morador poderá controlar sua casa sentado no sofá. Não precisando se 
locomover frequentemente, muitas vezes subindo em escadas ou bancos, os 
acidentes diminuirão em 84%. Ou seja, com o <em>DoMax</em>, não será mais necessário gastar um longo tempo procurando um controle remoto ou andando até um local. O deficiente poderá controlar tudo através da sua própria voz. Isso mesmo: será possível controlar a iluminação, temperatura, segurança, multimídia e diversas outras funções simplesmente dizendo uma palavra como ""ligar"". <br></p><p><img src=""https://s3-sa-east-1.amazonaws.com/cdn.br.catarse/uploads/redactor_rails/picture/data/60317/Smarthouse.png""></p><p><br></p><p>Não existem soluções prontas que sejam comercializadas, portanto, aqueles que não conseguem enxergar não encontraram uma saída para os seus problemas, <strong>até agora. </strong>O <em>DoMax </em><span class=""redactor-invisible-space"">é um sistema pioneiro na área de automação residencial assistiva para deficientes visuais. <br><br>Resumindo, nosso projeto é um sistema que permitirá ao residente possuir total controle sobre as funções de sua casa simplesmente utilizando a voz.<br></span></p><hr><p><br></p><p><br></p>",domax,,,"Ciência e Tecnologia",18,https://s3-sa-east-1.amazonaws.com/cdn.br.catarse/uploads/project/uploaded_image/34487/Smarthouse.png,https://s3-sa-east-1.amazonaws.com/cdn.br.catarse/uploads/project/uploaded_image/34487/project_thumb_thumb_Smarthouse.png,https://s3-sa-east-1.amazonaws.com/cdn.br.catarse/uploads/project/uploaded_image/34487/project_thumb_small_Smarthouse.png,https://s3-sa-east-1.amazonaws.com/cdn.br.catarse/uploads/project/uploaded_image/34487/project_thumb_large_Smarthouse.png,https://s3-sa-east-1.amazonaws.com/cdn.br.catarse/uploads/project/uploaded_image/34487/project_thumb_video_cover_Smarthouse.png,0,0,0,0,online,flex,published,"2016-10-03 02:59:59.999999","2016-10-02 23:59:59.999999","2016-08-03 14:02:22.909393","2016-08-03 11:02:22.909393",,t,f,t,60,"{""total"" : 7, ""unit"" : ""days""}","{""total"" : 52, ""unit"" : ""days""}",0,"{""city"" : ""São Paulo"", ""state_acronym"" : ""SP"", ""state"" : ""São Paulo""}","{""id"" : 580682, ""name"" : ""Gabriel Novaes""}",0,,f,f,0,f,f,f