project_id,id,user_id,name,headline,budget,goal,about_html,permalink,video_embed_url,video_url,category_name,category_id,original_image,thumb_image,small_image,large_image,video_cover_image,progress,pledged,total_contributions,total_contributors,state,mode,state_order,expires_at,zone_expires_at,online_date,zone_online_date,sent_to_analysis_at,is_published,is_expired,open_for_contributions,online_days,remaining_time,elapsed_time,posts_count,address,user,reminder_count,is_owner_or_admin,user_signed_in,in_reminder,total_posts,can_request_transfer,is_admin_role,contributed_by_friends
34770,34770,582568,"Alças Para Transporte de Sacolas Plásticas","Alças para Transporte de Sacolas Plásticas com Pegador Anatômico.","<p>Com o dinheiro arrecadado irei comprar uma máquina injetora de plásticos usada(o custo está em torno de R$15.000,00) e em pleno funcionamento e, também mandarei fabricar o molde das alças(R$10.000,00), que serão utilizadas na injetora para a produção das alças. Como investimento pessoal estou vendendo o meu carro, que está valendo em torno de R$42.000,00, no qual venderei abaixo do valor de tabela, e investirei R$25.000,00 do total do veículo para arcar com despesas como aluguel, aquisição de matérias-primas que serão usados na produção das alças, dentre outros custos fixos e variáveis que porventura forem surgindo.</p>",25000.0,"<p>Quando fazemos nossas
compras nos supermercados, farmácias, feiras, transportamos as mercadorias em
diversas sacolas plásticas, o que causa uma certa dificuldade para
pegarmos as diversas alças das referidas sacolas, fora o desconforto do peso das
mercadorias, que acaba causando uma certa dor em nossos dedos.
Quando a pessoa tem que liberar as sacolas plásticas para pegar as chaves do
carro, por exemplo, novamente tem que soltar todas as alças dessas sacolas
plásticas e depois, novamente, catar todas essas alças novamente. Foi
pensando nessa dificuldade vivida diariamente pelas
pessoas que idealizamos a <strong>ALÇA
PARA TRANSPORTAR SACOLAS PLÁSTICAS COM PEGADOR ANATÔMICO</strong>, que receberá todas as alças das sacolas
plásticas a serem transportadas, pois além de não machucar os dedos, facilitará a mobilidade da
pessoa quando for pegar a chave do carro, a carteira de dinheiro para pagar o
ônibus, a chave de casa ou até mesmo atender o celular.</p>",alcas,,,"Ciência e Tecnologia",18,https://s3-sa-east-1.amazonaws.com/cdn.br.catarse/uploads/project/uploaded_image/34770/IMG_20160623_152110929_HDR.jpg,https://s3-sa-east-1.amazonaws.com/cdn.br.catarse/uploads/project/uploaded_image/34770/project_thumb_thumb_IMG_20160623_152110929_HDR.jpg,https://s3-sa-east-1.amazonaws.com/cdn.br.catarse/uploads/project/uploaded_image/34770/project_thumb_small_IMG_20160623_152110929_HDR.jpg,https://s3-sa-east-1.amazonaws.com/cdn.br.catarse/uploads/project/uploaded_image/34770/project_thumb_large_IMG_20160623_152110929_HDR.jpg,https://s3-sa-east-1.amazonaws.com/cdn.br.catarse/uploads/project/uploaded_image/34770/project_thumb_video_cover_IMG_20160623_152110929_HDR.jpg,0,0,0,0,failed,aon,finished,"2016-08-21 02:59:59.999999","2016-08-20 23:59:59.999999","2016-07-01 11:33:10.058557","2016-07-01 08:33:10.058557",,t,t,f,50,"{""total"" : 0, ""unit"" : ""seconds""}","{""total"" : 50, ""unit"" : ""days""}",0,"{""city"" : ""Vitória"", ""state_acronym"" : ""ES"", ""state"" : ""Espírito Santo""}","{""id"" : 582568, ""name"" : ""Charles Stefenoni Queiroz""}",0,,f,f,0,f,f,f