project_id,id,user_id,name,headline,budget,goal,about_html,permalink,video_embed_url,video_url,category_name,category_id,original_image,thumb_image,small_image,large_image,video_cover_image,progress,pledged,total_contributions,total_contributors,state,mode,state_order,expires_at,zone_expires_at,online_date,zone_online_date,sent_to_analysis_at,is_published,is_expired,open_for_contributions,online_days,remaining_time,elapsed_time,posts_count,address,user,reminder_count,is_owner_or_admin,user_signed_in,in_reminder,total_posts,can_request_transfer,is_admin_role,contributed_by_friends
3492,3492,46871,"Gravação do EP da Banda Hollywood Cowboys","Apoie o rock do meio do Brasil, apoie o rock sul-matogrossense!","O orçamento para projetos anteriores a 24/02/2015 normalmente pode ser encontrado na descrição acima.",2500.0,"<p>A banda de hard rock do Mato Grosso do Sul, Hollywood Cowboys, vai gravar seu primeiro EP autoral e precisa da sua ajuda.</p>

<p>Para custear parte da produção contamos com a ajuda de amigos, amantes do hard rock e quem mais quiser ajudar, e optamos por usar o crowdfunding, ou financiamento coletivo, que é o financiamento de algo ou alguém através de um grupo de pessoas que querem o sucesso de um projeto!</p>

<p><img src=""http://i.imgur.com/EGLF9kB.jpg"" alt=""""/></p>

<p>Fundada em 2008 a banda iniciou seus trabalhos decidindo tocar Hard Rock, principalmente de grandes bandas dos anos 80 como Kiss, Skid Row, Van Halen, Guns n’Roses e Whitesnake e Bon Jovi.
O ano de 2009 e 2010 foram marcantes para a banda. Tocando em várias cidades do Estado e fora dele, a banda pode mostrar seu trabalho, além de dividir o palco com bandas como Rhevan (MS), Motorocker (SP), Dirty Deeds AC/DC Cover (SP) e tocando em eventos como Tribute Night I e II, e Só Rock No Horto - este último em duas edições, uma em 2009 e outra em 2010 - e ficando em 3º lugar na escolha de Melhor Banda do Estado de Mato Grosso do Sul de 2010, segundo site whiplash.net.</p>

<div class=""video youtube""><iframe width=""600"" height=""403"" src=""//www.youtube.com/embed/lI46FRMvQxE?wmode=opaque"" frameborder=""0"" allowfullscreen></iframe></div>

<p>Peraí, mas só isso pra gravar um EP?</p>

<p>Então galera, esse financiamento coletivo é para parte da produção do ep, é uma das ações que realizaremos por esse sonho, esse valor seria para pagar os custos com a gravação das músicas em estúdio.</p>

<p>É por isso que precisamos da ajuda de vocês, para decolar, gravar nosso cd autoral e deixar nosso nome marcado na história da música! Ajude a música, ajude o rock!</p>
",ephc,//player.vimeo.com/video/80792293,https://vimeo.com/80792293,Música,16,https://s3-sa-east-1.amazonaws.com/cdn.br.catarse/uploads/project/uploaded_image/3492/logo__1_.jpg,https://s3-sa-east-1.amazonaws.com/cdn.br.catarse/uploads/project/uploaded_image/3492/project_thumb_thumb_logo__1_.jpg,https://s3-sa-east-1.amazonaws.com/cdn.br.catarse/uploads/project/uploaded_image/3492/project_thumb_small_logo__1_.jpg,https://s3-sa-east-1.amazonaws.com/cdn.br.catarse/uploads/project/uploaded_image/3492/project_thumb_large_logo__1_.jpg,https://s3-sa-east-1.amazonaws.com/cdn.br.catarse/uploads/project/uploaded_image/3492/project_thumb_video_cover_logo__1_.jpg,101.6000000000000000,2540.0,15,14,successful,aon,finished,"2014-01-16 01:59:59","2014-01-15 23:59:59","2013-12-06 13:57:27.271356","2013-12-06 11:57:27.271356",,t,t,f,40,"{""total"" : 0, ""unit"" : ""seconds""}","{""total"" : 40, ""unit"" : ""days""}",0,"{""city"" : ""Campo Grande"", ""state_acronym"" : ""MS"", ""state"" : ""Mato Grosso do Sul""}","{""id"" : 46871, ""name"" : ""Ana Paula Ostapenco de Souza""}",0,,f,f,0,f,f,f