project_id,id,user_id,name,headline,budget,goal,about_html,permalink,video_embed_url,video_url,category_name,category_id,original_image,thumb_image,small_image,large_image,video_cover_image,progress,pledged,total_contributions,total_contributors,state,mode,state_order,expires_at,zone_expires_at,online_date,zone_online_date,sent_to_analysis_at,is_published,is_expired,open_for_contributions,online_days,remaining_time,elapsed_time,posts_count,address,user,reminder_count,is_owner_or_admin,user_signed_in,in_reminder,total_posts,can_request_transfer,is_admin_role,contributed_by_friends
35290,35290,589563,"Viva Galo","tem como objetivo preservar e combater o abuso de autoridade contra as aves de combate em nosso país","<p>vamos usar o dinheiro  para manutenção de advogados,para viagens a encontros galísticos em todo mundo,somos grandes,hoje por preconceito a maioria não bota a cara a cessar na justiça,mais vamos provar que somos fortes, represente seu  amor ao galo </p>",10000.0,"<p><strong><em>As brigas de galo são muito mais antigas do que mesmo os 
que criam galos o sabem, se  é ou não um esporte correto o fato é que 
ele existe a muito tempo e se sobrevive  por tanto tempo assim é porque 
tem a sua razão em nossa evolução, e como tudo na vida tem a sua razão 
pois Deus não criaria os galos de briga por nada, não daria ao homem o 
livre arbítrio de gostar ou não de galos de briga e de brigas de galo a 
toa, tudo  na vida tem uma razão muito mais ampla do que conseguimos 
entender e essa falta de evolução do ser humano para que todos tenham um
 mesmo pensamento é que deve ser respeitada, para assim cada um ter o 
direito de ser livre para gostar daquilo que acha melhor pra si.</em></strong><strong><em><br>
<em>Criar galo de briga, colocar galos pra brigar não é nenhum mal para o
 ser humano diretamente falando, ninguém morre porque um vizinho colocou
 dois galos pra brigar, ninguém fica doente porque galos brigaram, mas 
pessoas morrem no transito, pessoas morrem afogadas , pessoas morrem 
alcoolizadas, drogadas…..e o pior, assassinadas pelos próprios 
semelhantes.</em><br>
<em>Só quem cria ou já criou um galo de briga ou galinha seja o que for 
sabe do instinto que essa espécie tem dentro de si e se essas belas aves
 ( que dão origem a quase todas as aves ornamentais e comerciais que 
existem) que ainda existem na face da terra é ao fato de existirem 
galistas, como chamamos os criadores de galos de briga, pois sem nós 
eles não mais existiriam pois para que serve um galo de briga a não ser 
para brigar?</em><br>
<em>Proibir as brigas de galo é condenar à extinção  essa espécie de ave
 nobre e ai pergunto, o que é certo? Por favor me respondam, o que é 
certo? preservar uma espécie de sua extinção ou condenar ela a 
lembranças e fotografias?</em><br>
<em>“Sei que muita gente ira falar:” mas num precisa colocar pra brigar 
os galos para preservar  a raça”!, mas é engano de quem pensa assim… é 
importante para o galo de briga brigar , como os cavalos de corrida 
correr, como as vacas parir , como os cães latirem, pássaros cantarem e 
assim por diante…pois a briga é seu instinto acreditem .</em><br>
<em>Dai poderão dizer mas então que briguem livres na natureza e eu lhes pergunto que natureza?</em><br>
<em>pois não existem mais os habitares naturais para as aves combatentes
 pois o homem destruiu quase tudo explorou quase toda a terra, ou seja 
interferiu na sua  trajetória e por isso que somos importantes e 
responsáveis na preservação de muitas espécies  viventes, deveríamos e 
nos preocupar muito mais com a defesa da natureza, pois ela esta a cada 
dia mais violentada e não nos preocupar com brigas de galo pois eles, os
 galos combatentes, graças a nós ainda existem e em quantidade 
suficiente para não serem extintas, ainda.</em><br>
<em>Prefiro lutar pela legalização das criações e brigas de galo , pelo 
meu direito de gostar ou não  do que lutar pela extinção de uma espécie 
 e pela difamação de pessoas  de bem que as criam e prefiro mais ainda 
oferecer aos contrários as brigas a oportunidade de lutarem ao nosso 
lado por uma coisa muito mais importante que é a natureza que  a cada 
dia esta sendo destruída e acho que logo mais nós é que seremos a 
espécie em extinção .</em><br>
<em>Se é para lutar lutemos pela liberdade de cada um, lutemos pela 
nossa natureza que nos dá a vida, lutemos pela honestidade, pelo amor, 
pela fé  no ser humano que um dia conseguirá evoluir  em igualdade em 
todos os níveis e assim voltaremos a discutir nosso futuro, quem sabe 
nos seremos extintos pois ficamos aqui perdendo tempo  com coisas 
pequenas.</em><br>
<em>Hoje seria muito melhor a liberação das brigas de galos com normas 
bem pensadas para os combates do que ficar perdendo nosso tempo e o 
tempo de policiais, de juristas etc. etc. em querer extinguir essa 
espécie nobre de ave, os galos de briga.</em><br>
<em>Sou a favor das brigas de galo e uma apaixonado pelas aves 
combatentes e sempre lutarei pelo direito de contribuir com a sua 
preservação e aperfeiçoamento genético.</em><br>
<em>Espero ter sido claro entre as linhas do que escrevi , tentando 
respeitar o direito de quem é contra mas ao mesmo tempo defendendo o meu
 direito de ser a favor.</em></em></strong></p>",viva_galo_acf9,//www.youtube.com/embed/DehzxcepKbU,https://www.youtube.com/watch?v=DehzxcepKbU,Esporte,21,https://s3-sa-east-1.amazonaws.com/cdn.br.catarse/uploads/project/uploaded_image/35290/viva.png,https://s3-sa-east-1.amazonaws.com/cdn.br.catarse/uploads/project/uploaded_image/35290/project_thumb_thumb_viva.png,https://s3-sa-east-1.amazonaws.com/cdn.br.catarse/uploads/project/uploaded_image/35290/project_thumb_small_viva.png,https://s3-sa-east-1.amazonaws.com/cdn.br.catarse/uploads/project/uploaded_image/35290/project_thumb_large_viva.png,https://s3-sa-east-1.amazonaws.com/cdn.br.catarse/uploads/project/uploaded_image/35290/project_thumb_video_cover_viva.png,0,0,0,0,online,flex,published,,,"2016-06-30 12:23:05.812174","2016-06-30 09:23:05.812174",,t,f,t,,"{""total"" : 0, ""unit"" : ""seconds""}","{""total"" : 86, ""unit"" : ""days""}",0,"{""city"" : ""Brasília"", ""state_acronym"" : ""DF"", ""state"" : ""Distrito Federal""}","{""id"" : 589563, ""name"" : ""Studio AmaGalo""}",0,,f,f,0,f,f,f