project_id,id,user_id,name,headline,budget,goal,about_html,permalink,video_embed_url,video_url,category_name,category_id,original_image,thumb_image,small_image,large_image,video_cover_image,progress,pledged,total_contributions,total_contributors,state,mode,state_order,expires_at,zone_expires_at,online_date,zone_online_date,sent_to_analysis_at,is_published,is_expired,open_for_contributions,online_days,remaining_time,elapsed_time,posts_count,address,user,reminder_count,is_owner_or_admin,user_signed_in,in_reminder,total_posts,can_request_transfer,is_admin_role,contributed_by_friends
353,353,21617,Invasão,"Uma chácara isolada era o lugar perfeito para um grupo de amigos passar o feriado...infelizmente, era...","O orçamento para projetos anteriores a 24/02/2015 normalmente pode ser encontrado na descrição acima.",15000.0,"<p>O novo cinema brasileiro cresce a cada ano, porém ainda não temos uma grande variedade de gêneros. Este projeto busca além de contar uma boa estória, mostrar que o cinema brasileiro pode ir muito além dos dramas sociais e, deste modo poderemos diversificar os temas abordados, sejam eles dramas, comédias, ficção científica, assim como diversos outros gêneros que ainda não foram explorados pelo cinema nacional. O Brasil tem muitas histórias para contar e nosso cinema pode contribuir muito para cultura, por meio das mais diversas e criativas histórias do nosso povo.</p>

<p>O projeto do filme “Invasão” conta a estória de um grupo de universitários de São Paulo que decide passar o feriado de carnaval em uma chácara isolada no interior. Neste período, naves alienígenas invadem o planeta. Isolados e sem comunicação, o grupo de amigos precisa decidir se retornam para cidade ou se ficam escondidos na chácara. O filme é uma ficção cientifica com grandes doses de suspense.</p>

<p>Este longa-metragem é uma produção independente que quer explorar novos temas para o cinema nacional e busca colaboradores para sua realização. Para pessoas físicas é uma oportunidade de fazer parte de um projeto inovador tanto na concepção artística proposta, como pelas recompensas oferecidas, além de contribuir para a cultura, você também estará ajudando novos profissionais de diferentes áreas do audiovisual a ter sua primeira oportunidade em um projeto de longa metragem. Para investidores é uma forma barata de divulgar sua empresa. No cinema, sua marca ficará atrelada a obra para sempre, toda vez que ela for vista e em qualquer mídia que for reproduzida.</p>

<p>Isto remete ainda a outro ponto importante: a distribuição. O projeto final terá uma distribuição inovadora, o que permitirá atingir o grande público. Isto será produtivo, tanto para nós, profissionais e criadores do projeto, como também para os colaboradores que terão a oportunidade de fazer parte de algo inovador e ter acesso, em primeira mão, ao produto final.</p>

<p>Veja detalhes no quadro detalhado de recompensas nesta página e detalhes sobre o projeto em <a class=""alt-link"" href=""http://www.novosdiretores.com/projetoatual.html"" target=""_blank"">www.novosdiretores.com/projetoatual.html</a></p>

<p>Nossa meta financeira mínima para concepção do projeto é de 15.000 (quinze mil reais). Com este montante conseguiremos realizar toda a captação do filme. Valores obtidos acima do valor mencionado, agilizarão as etapas de pós-produção para finalização do filme.</p>

<p>Todo o dinheiro arrecadado será utilizado no filme e as contas e gastos serão divulgados no site: <a class=""alt-link"" href=""http://www.novosdiretores.com"" target=""_blank"">www.novosdiretores.com</a> e no site Catarse.</p>

<p>Transparência e profissionalismo estão garantidos durante todo o processo.
Contamos com você e caso tenha dúvidas, mande uma mensagem para o endereço: <a class=""alt-link"" href=""mailto:contato@novosdiretores.com"" target=""_blank"">contato@novosdiretores.com</a></p>
",invasao,//player.vimeo.com/video/29409017,http://www.vimeo.com/29409017,"Cinema e Vídeo",13,,https://s3-sa-east-1.amazonaws.com/cdn.br.catarse/uploads/project/video_thumbnail/353/project_thumb_thumb_open-uri20131125-2-1u1nofo,https://s3-sa-east-1.amazonaws.com/cdn.br.catarse/uploads/project/video_thumbnail/353/project_thumb_small_open-uri20131125-2-1u1nofo,https://s3-sa-east-1.amazonaws.com/cdn.br.catarse/uploads/project/video_thumbnail/353/project_thumb_large_open-uri20131125-2-1u1nofo,https://s3-sa-east-1.amazonaws.com/cdn.br.catarse/uploads/project/video_thumbnail/353/project_thumb_video_cover_open-uri20131125-2-1u1nofo,3.00000000000000000000,450.0,9,5,failed,aon,finished,"2011-12-25 01:59:59","2011-12-24 23:59:59","2011-10-26 01:59:59","2011-10-25 23:59:59",,t,t,f,60,"{""total"" : 0, ""unit"" : ""seconds""}","{""total"" : 60, ""unit"" : ""days""}",0,"{""city"" : ""São Paulo"", ""state_acronym"" : ""SP"", ""state"" : ""São Paulo""}","{""id"" : 21617, ""name"" : ""Helio C. Martins Jr.""}",0,,f,f,0,f,f,f