project_id,id,user_id,name,headline,budget,goal,about_html,permalink,video_embed_url,video_url,category_name,category_id,original_image,thumb_image,small_image,large_image,video_cover_image,progress,pledged,total_contributions,total_contributors,state,mode,state_order,expires_at,zone_expires_at,online_date,zone_online_date,sent_to_analysis_at,is_published,is_expired,open_for_contributions,online_days,remaining_time,elapsed_time,posts_count,address,user,reminder_count,is_owner_or_admin,user_signed_in,in_reminder,total_posts,can_request_transfer,is_admin_role,contributed_by_friends
3560,3560,221266,"Livin Garden - USA Tour 2014","O Livin Garden conta com você para cair na estrada!","O orçamento para projetos anteriores a 24/02/2015 normalmente pode ser encontrado na descrição acima.",8000.0,"<p>Olá! Nós somos o Livin Garden, banda de Rock N’ Roll formada em Curitiba/PR no ano de 2006.</p>

<p>Poderíamos escrever um Press-release aqui descrevendo e destacando várias realizações como o lançamento do 1º disco em 2009, ou nossa primeira turnê internacional em 2011, ou ainda dividir o palco com bandas renomadas mundialmente como Black Label Society e Blind Guardian, mas isso vocês conseguem ver em nosso site oficial. A ideia aqui é outra.</p>

<p>Desde o primeiro dia como banda, demos nosso suor, nosso sangue, nossas vidas pelo Livin Garden e pela música que nós quatro criamos juntos, ultrapassando todos os obstáculos e vencendo-os, pois nunca tivemos preguiça de lutar e trabalhar pelo que queremos e acreditamos.</p>

<p>Através deste trabalho conquistamos muito, claro, mas a principal conquista foi quando percebemos que o Livin Garden já não era mais formado somente por quatro pessoas, mas sim por todos que acreditam em nosso trabalho, vão aos shows, curtem as músicas, compram o material e nos ajudam a divulgar e levar essa banda adiante, e temos orgulho de termos conquistado essa interação e comunicação com nossos fãs e amigos através dos nossos shows e nossa música.</p>

<div class=""video youtube""><iframe width=""600"" height=""403"" src=""//www.youtube.com/embed/DxAnQA1kVzc?wmode=opaque"" frameborder=""0"" allowfullscreen></iframe></div>
",livingarden,//www.youtube.com/embed/RXf7IYaRcY0,http://youtu.be/RXf7IYaRcY0,Música,16,https://s3-sa-east-1.amazonaws.com/cdn.br.catarse/uploads/project/uploaded_image/3560/Livin_Garden_Symbol_3.jpg,https://s3-sa-east-1.amazonaws.com/cdn.br.catarse/uploads/project/uploaded_image/3560/project_thumb_thumb_Livin_Garden_Symbol_3.jpg,https://s3-sa-east-1.amazonaws.com/cdn.br.catarse/uploads/project/uploaded_image/3560/project_thumb_small_Livin_Garden_Symbol_3.jpg,https://s3-sa-east-1.amazonaws.com/cdn.br.catarse/uploads/project/uploaded_image/3560/project_thumb_large_Livin_Garden_Symbol_3.jpg,https://s3-sa-east-1.amazonaws.com/cdn.br.catarse/uploads/project/uploaded_image/3560/project_thumb_video_cover_Livin_Garden_Symbol_3.jpg,115.7000000000000000,9256.0,108,97,successful,aon,finished,"2014-02-08 01:59:59","2014-02-07 23:59:59","2013-12-09 18:23:59.690682","2013-12-09 16:23:59.690682",,t,t,f,60,"{""total"" : 0, ""unit"" : ""seconds""}","{""total"" : 60, ""unit"" : ""days""}",5,"{""city"" : ""Curitiba"", ""state_acronym"" : ""PR"", ""state"" : ""Paraná""}","{""id"" : 221266, ""name"" : ""Gabriel Canoro""}",0,,f,f,5,f,f,f