project_id,id,user_id,name,headline,budget,goal,about_html,permalink,video_embed_url,video_url,category_name,category_id,original_image,thumb_image,small_image,large_image,video_cover_image,progress,pledged,total_contributions,total_contributors,state,mode,state_order,expires_at,zone_expires_at,online_date,zone_online_date,sent_to_analysis_at,is_published,is_expired,open_for_contributions,online_days,remaining_time,elapsed_time,posts_count,address,user,reminder_count,is_owner_or_admin,user_signed_in,in_reminder,total_posts,can_request_transfer,is_admin_role,contributed_by_friends
35899,35899,596425,"Projeto - O Colchão Ideal","Mude a qualidade de vida de milhares de pessoas que sofrem com problemas relacionados ao sono. ","<p>Nosso orçamento geral, é de R$ 75.000,00. </p><p>Com as taxas Catarse e impostos, esse valor vai para R$ 90.500,00.<br></p><p>Nesse orçamento, está incluído:</p><p>- Custo para desenvolvimento de site / blog responsivo em plataforma e hospedagem de qualidade. </p><p>( R$ 15.000,00 )</p><p>- Custo para criação de canal no YouTube, edição de vídeos e publicação.</p><p>( R$ 5.000,00 )<br></p><p>- Custo para desenvolvimento de aplicativo para celular para diversas plataformas.</p><p>( R$ 5.000,00 )<br></p><p>- Todo o custo para publicação do livro. Que inclui todo o processo de editoração como: revisão, edição, preparação, diagramação, impressão e publicação.</p><p>( R$ 20.000,00 )<br></p><p>- Custo de envio por correios das recompensas dos colaboradores do projeto.<br>(Livro impresso)</p><p>( R$ 10.000,00 )</p><p>- Custos de estrutura física e equipamentos</p><p>( R$ 10.000,00)</p><p>- Custos de divulgação, taxas e demais impostos</p><p>( R$ 10.000,00 )<br></p><p><br></p>",90500.0,"<p><strong>CONHEÇA NOSSO PROJETO - O COLCHÃO IDEAL</strong></p><p>Nosso projeto inclui a criação de 5 meios de acesso a todas as informações disponíveis sobre colchões, onde iremos abordar características técnicas, dicas, informações, estudos e pesquisas de diversos especialistas de todo o mundo.</p><p>Além de apresentarmos um passo a passo completo, que irá lhe guiar na escolha do colchão ideal para você de acordo com seu biotipo, e suas necessidades individuais.<br></p><p>Você terá acesso a informações completas sobre todos os tipos de colchões existentes no mercado. </p><p><span class=""redactor-invisible-space"">Também terá acesso a profissionais que irão lhe auxiliar na escolha do colchão ideal</span>.<br></p><p>Além de nosso aplicativo, que irá lhe informar qual o tipo de colchão é indicado para você.</p><p>Você terá acessos a vídeos com dicas, informações e passo a passo para a escolha do colchão ideal, através de um canal no YouTube.<br></p><hr><p><br></p><p>Nosso projeto é baseado em um Guia Exclusivo, que é o resultado de anos de pesquisas dedicados ao segmento de colchões e estudos do sono. </p><p>Nosso
guia foi desenvolvido por profissionais que possuem ampla experiência, e atuam
a decadas nesse segmento.</p><p>
Acompanhamos trabalhos e pesquisas de diversos
órgãos e especialistas em sono, ortopedia, psicologia, e mais uma infinidade de
profissionais de diversas áreas, além de empresas de colchões, revistas
especializadas, e centenas de comentários de satisfação de clientes.</p><hr><p>NOSSO GUIA É O MAIS COMPLETO, E SERÁ O MAIOR SITE VOLTADO AO SEGMENTO DE COLCHÕES E QUALIDADE DE SONO DO MUNDO!</p><p>POIS NÃO VENDEMOS COLCHÕES, QUEREMOS PROPORCIONAR QUALIDADE DE VIDA A TODOS, DE FORMA HONESTA E IMPARCIAL!</p><hr><p><br>Dessa
 forma, você poderá saber por exemplo, para que e para quem é indicado cada 
tipo de colchão, quais os benefícios, qual o suporte de peso, nível de 
firmeza, nível de  conforto e para qual tipo de tratamento determinado 
tipo de colchão é indicado.</p><p>Tudo isso de forma imparcial, visando lhe direcionar para o colchão realmente adequado a você e suas necessidades, mudando sua qualidade de vida!</p><p>Nossa missão é eliminar de uma vez por todas os problemas de dores nas costas, cansaço, estresse e insônia, gerados pelo uso de um colchão inadequado.</p><hr><p>Nosso projeto inclui a criação de 5 meios de acesso a todo o nosso conteúdo:</p><p> - SITE/BLOG RESPONSIVO </p><p>- CANAL NO YOUTUBE<br></p><p>- APLICATIVO PARA CELULAR </p><p>- GUIA / LIVRO IMPRESSO</p><p>- GUIA / LIVRO DIGITAL (E-BOOK)</p><hr><br><p>Com esse projeto, buscamos auxiliar milhares 
de brasileiros que vivem reféns de seu próprio sono, e acabam recorrendo
 a especialistas, gastando centenas de Reais com remédios e tratamentos,
 tentando solucionar problemas como cansaço, dores na coluna, estresse 
ou insônia. </p><p>Quando na realidade a simples troca do colchão ruim, por um colchão adequado, mudaria sua vida.</p><strong></strong><hr><strong><strong></strong></strong><p><strong></strong></p><p><strong><font>De acordo com pesquisa da Sociedade Brasileira do Sono, 43% das pessoas já acordam cansadas pela dificuldade em atingir a
fase do sono reparador e 53% não dormem
o quanto gostariam</font></strong></p><p><font>Esses
números se tornam mais alarmantes quando comparados aos dados da OMS
(Organização Mundial de Saúde) que apontam que distúrbios no sono, como a insônia, <strong>afetam de 15 a 30% da
população mundial. </strong></font></p><p><font>Várias pesquisas realizadas apontam
que 90% dos problemas de dores de cabeça, torcicolos, dores na nuca, dores
lombares e musculares, são decorrentes de noites mal dormidas em colchões
inadequados.</font></p><hr><p><font>Na
 maioria dos casos, essas pessoas sequer sabem que esses problemas são 
provenientes do uso de um colchão inadequado, e se auto diagnosticam 
como sendo vítimas de estresse excessivo, ou insônia, e se enchem dos 
famosos ""remedinhos"" para dormir.<br></font></p><hr><p><font><font>Dormir
bem representa mais vida, pois mantém as defesas de nosso organismo mais
fortes. 
</font></font></p><p><font><font>Nosso
sono interfere diretamente na qualidade de nossa vida, e consequentemente na
quantidade de anos que teremos a mais pela frente.</font></font></p><p><font><font>Dormir
bem influencia fisicamente e psicologicamente nossa vida, trazendo um bem-estar
físico, emocional e mental.</font></font></p><p><font><font><font>Melhorando
a maneira como pensamos, recordamos, planejamos, agimos e sentimos durante o
período em que estamos acordados. <br><br>Consequentemente, dormir bem representa
diretamente mais qualidade de vida em nosso dia a dia.<br><br>Nosso projeto não se trata de apenas mais um projeto qualquer, mas de algo que irá mudar a vida de milhares de 
pessoas que sofrem com problemas de cansaço, dores nas costas, estresse 
ou insônia.<br><br>Nos ajude a mudar a qualidade de vida de milhares de pessoas!</font></font></font></p>",ocolchaoideal,,,Pessoais,35,https://s3-sa-east-1.amazonaws.com/cdn.br.catarse/uploads/project/uploaded_image/35899/CAPA_PROJETO_600X340.png,https://s3-sa-east-1.amazonaws.com/cdn.br.catarse/uploads/project/uploaded_image/35899/project_thumb_thumb_CAPA_PROJETO_600X340.png,https://s3-sa-east-1.amazonaws.com/cdn.br.catarse/uploads/project/uploaded_image/35899/project_thumb_small_CAPA_PROJETO_600X340.png,https://s3-sa-east-1.amazonaws.com/cdn.br.catarse/uploads/project/uploaded_image/35899/project_thumb_large_CAPA_PROJETO_600X340.png,https://s3-sa-east-1.amazonaws.com/cdn.br.catarse/uploads/project/uploaded_image/35899/project_thumb_video_cover_CAPA_PROJETO_600X340.png,0,0,0,0,failed,aon,finished,"2016-09-04 02:59:59.999999","2016-09-03 23:59:59.999999","2016-07-05 17:02:07.035559","2016-07-05 14:02:07.035559",,t,t,f,60,"{""total"" : 0, ""unit"" : ""seconds""}","{""total"" : 60, ""unit"" : ""days""}",0,"{""city"" : ""São Paulo"", ""state_acronym"" : ""SP"", ""state"" : ""São Paulo""}","{""id"" : 596425, ""name"" : ""Optima Sleep""}",0,,f,f,0,f,f,f