project_id,id,user_id,name,headline,budget,goal,about_html,permalink,video_embed_url,video_url,category_name,category_id,original_image,thumb_image,small_image,large_image,video_cover_image,progress,pledged,total_contributions,total_contributors,state,mode,state_order,expires_at,zone_expires_at,online_date,zone_online_date,sent_to_analysis_at,is_published,is_expired,open_for_contributions,online_days,remaining_time,elapsed_time,posts_count,address,user,reminder_count,is_owner_or_admin,user_signed_in,in_reminder,total_posts,can_request_transfer,is_admin_role,contributed_by_friends
35970,35970,596789,"Atacar a violência - revide pela paz ","Vamos mudar a vida Humana","<p>Objetivo de produzir 10 mil cartazes com as referências </p><table class=""tablepress tablepress-id-47""><tbody><tr><td>42 x 30 cm</td><td>Couché 115g</td><td><br></td><td>valor de </td><td>R$ 3.000,00<br><br><br><br><br></td></tr></tbody></table><p>Objetivo de produzir 100 mil Folhetos com as referências</p><table class=""tablepress tablepress-id-47""><tbody><tr><td>100 x 150 cm</td><td>Couché 90grs</td><td><br></td><td>valor de</td><td>R$ 4.000,00</td></tr></tbody></table><p><br></p>",7000.0,"<p>A campanha é contra o roubo e a violência ao trabalhador e a ser
humano, identificamos a necessidade de dar ênfase ao tema, chamando atenção à
necessidade de sensibilização do individuo contra o crime. Um importante passo
para efetivar a valorização e respeito à vida humana.</p><p>A ação consiste na distribuição de folhetos e cartazes, Os
folhetos serão distribuídos na rede de transportes urbanos e cartazes nas estações do metro.</p>",atacar_a_violencia_revide_pela_paz_cce4,,"",Pessoais,35,https://s3-sa-east-1.amazonaws.com/cdn.br.catarse/uploads/project/uploaded_image/35970/Sem_título.jpg,https://s3-sa-east-1.amazonaws.com/cdn.br.catarse/uploads/project/uploaded_image/35970/project_thumb_thumb_Sem_título.jpg,https://s3-sa-east-1.amazonaws.com/cdn.br.catarse/uploads/project/uploaded_image/35970/project_thumb_small_Sem_título.jpg,https://s3-sa-east-1.amazonaws.com/cdn.br.catarse/uploads/project/uploaded_image/35970/project_thumb_large_Sem_título.jpg,https://s3-sa-east-1.amazonaws.com/cdn.br.catarse/uploads/project/uploaded_image/35970/project_thumb_video_cover_Sem_título.jpg,0,0,0,0,online,flex,published,,,"2016-07-02 14:33:30.889212","2016-07-02 11:33:30.889212",,t,f,t,,"{""total"" : 0, ""unit"" : ""seconds""}","{""total"" : 84, ""unit"" : ""days""}",0,"{""city"" : ""São Paulo"", ""state_acronym"" : ""SP"", ""state"" : ""São Paulo""}","{""id"" : 596789, ""name"" : ""Gleberson Nunes""}",1,,f,f,0,f,f,f