project_id,id,user_id,name,headline,budget,goal,about_html,permalink,video_embed_url,video_url,category_name,category_id,original_image,thumb_image,small_image,large_image,video_cover_image,progress,pledged,total_contributions,total_contributors,state,mode,state_order,expires_at,zone_expires_at,online_date,zone_online_date,sent_to_analysis_at,is_published,is_expired,open_for_contributions,online_days,remaining_time,elapsed_time,posts_count,address,user,reminder_count,is_owner_or_admin,user_signed_in,in_reminder,total_posts,can_request_transfer,is_admin_role,contributed_by_friends
36052,36052,597169,"PONTO DA LEITURA","Olá amigo do bem! Contribua para este projeto de sala de estudos e leitura, apoie essa ideia.","<p>Locação de imóvel, (só preciso de um mês de locação): R$ 2.500,00</p><p>Aquisição de 30 (trinta) baias individuais de estudos (em MDF): R$ 10.000,00</p><p>Aquisição de 30 (trinta) cadeiras R$ 7.500,00</p><p>4 Conjuntos de mesas e cadeiras (para copa): 1.600,00</p><p>01 Bebedouro: R$ 300,00</p><p>01 micro-ondas: R$ 350,00</p><p>Despesas extras (abertura de empresa, alvarás, material de expediente, etc): aprox.: R$ 2.750,00<br></p><p>Total: 28.250,00</p><p>Taxa do Catarse </p><p><br></p>",28250.0,"<p>Olá amigos do bem!, tenho um projeto de abrir um ponto de
leitura/estudos em Arapiraca/AL. Os usuários contarão com uma infraestrutura como cabines
individuais de estudo com mesa e luminária, ambiente climatizado, copa, livros
digitais, O objetivo do projeto e proporcionar um local silencioso, tranquilo e
confortável, em Arapiraca/AL, pra quem quiser estudar ou ler um livro a hora
que quiser, maximizando a concentração, o foco e o aproveitamento dos estudos
ou da leitura. Tudo isso por um precinho módico que cada usuário pagará, na
medida de suas condições. Porém, estou sem grana pra bancar os custos iniciais
do projeto (ponta-pé inicial), como locação do ponto, aquisição dos
equipamentos de climatização, aquisição das bancadas de estudo. Ajudem a
realizar esse projeto, pois é de grande relevo social, uma vez que os
estudantes e leitores de Arapiraca/AL poderão ter um espaço onde possam melhor
aproveitar seus estudos, ajudando-os assim a alcançar seus objetivos, seja
passar em um concurso público, seja melhorar o rendimento no colégio ou
na faculdade, seja para melhor apreciar um livro. Conto com vocês!</p>",ponto_da_leitura_4b5b,,,Educação,31,https://s3-sa-east-1.amazonaws.com/cdn.br.catarse/uploads/project/uploaded_image/36052/ESSA.jpg,https://s3-sa-east-1.amazonaws.com/cdn.br.catarse/uploads/project/uploaded_image/36052/project_thumb_thumb_ESSA.jpg,https://s3-sa-east-1.amazonaws.com/cdn.br.catarse/uploads/project/uploaded_image/36052/project_thumb_small_ESSA.jpg,https://s3-sa-east-1.amazonaws.com/cdn.br.catarse/uploads/project/uploaded_image/36052/project_thumb_large_ESSA.jpg,https://s3-sa-east-1.amazonaws.com/cdn.br.catarse/uploads/project/uploaded_image/36052/project_thumb_video_cover_ESSA.jpg,0,0,0,0,online,flex,published,,,"2016-07-02 19:07:35.639487","2016-07-02 16:07:35.639487",,t,f,t,,"{""total"" : 0, ""unit"" : ""seconds""}","{""total"" : 84, ""unit"" : ""days""}",0,"{""city"" : ""Arapiraca"", ""state_acronym"" : ""AL"", ""state"" : ""Alagoas""}","{""id"" : 597169, ""name"" : ""Reginaldo de Sousa Moura""}",0,,f,f,0,f,f,f