project_id,id,user_id,name,headline,budget,goal,about_html,permalink,video_embed_url,video_url,category_name,category_id,original_image,thumb_image,small_image,large_image,video_cover_image,progress,pledged,total_contributions,total_contributors,state,mode,state_order,expires_at,zone_expires_at,online_date,zone_online_date,sent_to_analysis_at,is_published,is_expired,open_for_contributions,online_days,remaining_time,elapsed_time,posts_count,address,user,reminder_count,is_owner_or_admin,user_signed_in,in_reminder,total_posts,can_request_transfer,is_admin_role,contributed_by_friends
362,362,24595,"Banca de Quadrinhos no FIQ","Ajude a levar o programa de tv Banca de Quadrinhos aos Festival Internacional de Quadrinhos de Belo Horizonte","O orçamento para projetos anteriores a 24/02/2015 normalmente pode ser encontrado na descrição acima.",3000.0,"<p>O programa Banca de Quadrinhos (TVA: Canal 18 - São Paulo) é o único da televisão a dar grande foco à divulgação das Histórias em Quadrinhos e de seus autores, trabalho este reconhecido por uma indicação ao Troféu HQMix, o &quot;oscar&quot; dos quadrinhos brasileiros, na categoria &quot;Melhor Mídia sobre Quadrinhos&quot;. Paradoxalmente, é um dos veículos que menos recebe apoio dos eventos e organizações da área, muitas vezes cobrindo encontros em diferentes regiões do Brasil com recursos próprios e escassos.</p>

<p>O projeto <a class=""alt-link"" target=""_blank"" href=""http://programabancadequadrinhos.com"">Banca de Quadrinhos no FIQ&quot; tem por objetivo levar o apresentador Rodrigo Febrônio e equipe para a sétima edição do FIQ - Festival Internacional de Quadrinhos de Belo Horizonte -, que acontecerá entre 09 e 13 de novembro deste ano. As entrevistas e reportagens realizadas durante o evento resultarão em duas edições especiais do programa, além de drops diários e notas rápidas ao longo do encontro, publicados no &quot;nosso site</a>, em nosso canal no Youtube e nos perfis da Banca dos Quadrinhos em diferentes redes sociais. Vamos também preparar uma reportagem mostrando todo o processo por trás da cobertura, incluindo a arrecadação via Catarse e as pessoas que nos ajudaram a chegar lá!</p>

<p>Essa será, na verdade, a segunda visita do programa ao festival. A primeira foi em 2009, quando conversamos com artistas nacionais e internacionais, incluindo nomes como Guy Delisle, Craig Thompson, Ben Templesmith, Gustavo Duarte, e os gêmeos Fábio Moon e Gabriel Bá, entre muitos outros. Confira algumas dessas entrevistas no <a class=""alt-link"" target=""_blank"" href=""http://programabancadequadrinhos.com/tag/fiq/."">aqui</a></p>

<p>Para a realização do projeto, estabelecemos uma meta de R$3.000,00, que cobrirá os custos de passagens aéreas, hospedagem e alimentação de uma equipe de três profissionais, sem luxo algum (hospedagem em hostel, passagens pela companhia mais barata e alimentação no primeiro PF que aparecer). Dada a proximidade do evento, o objetivo é levantarmos essa quantia em 30 dias.</p>

<p>Além da viagem, com o eventual sucesso do projeto, produziremos três atividades bacanudas pra quem estiver em São Paulo (ou tiver facilidade de se locomover para cá). As duas primeiras delas são as oficinas “Quadrinho Colaborativo”, ministrada pelo publicitário e quadrinista Felipe Meyer, e “Jornalismo de Quadrinhos”, com o apresentador Rodrigo Febrônio, que acontecerão na Casa de Cultura Digital, um espaço colaborativo no centro de São Paulo montado no meio de uma vila italiana lindona! E, pra fechar com chave de ouro, comemoraremos o retorno do FIQ com uma baladinha das boas, daquelas que o público da Banca já está acostumado nos últimos quatro anos. Local e data serão anunciados mais pra frente, e algumas das recompensas garantem entrada VIP pra quem colaborar com o projeto.</p>

<p>Se você tem uma empresa ligada à área dos quadrinhos, como loja, escola de artes ou mesmo um bom e velho sebo (ninguém deve apreciar tanto aqueles corredores de páginas amareladas quanto nós, fãs de quadrinhos), pensamos em recompensas pra você também, que permitirão uma superexposição da sua marca. E você ainda leva as recompensas dos valores menores, pra guardar ou pra sortear entre seus clientes.</p>

<p>Mas, seja você empresa ou pessoa física, a maior recompensa é poder ver no conforto da sua casa a Banca de Quadrinhos com entrevistas com os melhores artistas do quadrinho nacional e vários estrangeiros talentosos!</p>

<p>&quot;!<img src=""http://catarse.me/images/social/youtube_32.png?1316635290!%22:http://www.youtube.com/user/bancadequadrinhos"" alt=""""/> &quot;!<img src=""http://catarse.me/images/social/facebook_32.png?1316635290!%22:https://www.facebook.com/pages/Programa-Banca-de-Quadrinhos/135608779839318"" alt=""""/> &quot;!<img src=""http://catarse.me/images/social/twitter_32.png?1316635290!%22:http://twitter.com/bancaquadrinhos"" alt=""""/></p>
",banca-de-quadrinhos-no-fiq,//player.vimeo.com/video/29590206,http://vimeo.com/29590206,Quadrinhos,7,,https://s3-sa-east-1.amazonaws.com/cdn.br.catarse/uploads/project/video_thumbnail/362/project_thumb_thumb_open-uri20131125-2-te99u6,https://s3-sa-east-1.amazonaws.com/cdn.br.catarse/uploads/project/video_thumbnail/362/project_thumb_small_open-uri20131125-2-te99u6,https://s3-sa-east-1.amazonaws.com/cdn.br.catarse/uploads/project/video_thumbnail/362/project_thumb_large_open-uri20131125-2-te99u6,https://s3-sa-east-1.amazonaws.com/cdn.br.catarse/uploads/project/video_thumbnail/362/project_thumb_video_cover_open-uri20131125-2-te99u6,60.00000000000000000000,1800.0,24,24,failed,aon,finished,"2011-10-28 01:59:59","2011-10-27 23:59:59","2011-08-29 01:59:59","2011-08-28 22:59:59",,t,t,f,60,"{""total"" : 0, ""unit"" : ""seconds""}","{""total"" : 60, ""unit"" : ""days""}",2,"{""city"" : ""Florianópolis"", ""state_acronym"" : ""SC"", ""state"" : ""Santa Catarina""}","{""id"" : 24595, ""name"" : ""Felipe Meyer de Souza""}",0,,f,f,2,f,f,f