project_id,id,user_id,name,headline,budget,goal,about_html,permalink,video_embed_url,video_url,category_name,category_id,original_image,thumb_image,small_image,large_image,video_cover_image,progress,pledged,total_contributions,total_contributors,state,mode,state_order,expires_at,zone_expires_at,online_date,zone_online_date,sent_to_analysis_at,is_published,is_expired,open_for_contributions,online_days,remaining_time,elapsed_time,posts_count,address,user,reminder_count,is_owner_or_admin,user_signed_in,in_reminder,total_posts,can_request_transfer,is_admin_role,contributed_by_friends
36343,36343,465060,"Yonel e Jaqueline são nossos irmãos","Uma campanha para trazer os filhos de Yonel e Jaqueline para o Brasil!","<p>Taxa do Catarse: 13% (R$ 1.950)</p><p>Passagens Yonel e seus dois filhos: R$ 13.000</p><p>Somando assim R$ 15.000</p><p>Se o valor ultrapassar o solicitado, será  repassado para a família, para ajudar nas despesas e adaptação dos filhos aqui no Brasil.</p>",15000.0,"<p><strong>Yonel é um homem negro, pobre e estrangeiro. Ou seja, o protótipo da exclusão social .</strong> Após a devastação do Haiti pelo terremoto de 2010, ele imigrou para o Brasil junto com a esposa e o filho mais velho, deixando lá, na companhia de um tio, os filhos menores, hoje com idades de 8 e 15 anos. Aqui, a família que mora no interior do Rio Grande do Sul trabalha para juntar dinheiro e trazer o casal de filhos, mas as dificuldades financeiras são grandes, inclusive porque é preciso mandar dinheiro para a subsistência dos filhos no Haiti. <strong>Nossa campanha por meio de financiamento coletivo e outras alternativas empenha-se em um plano de solidariedade para  Yonel e família, para que consigam trazer os dois filhos para o Brasil.</strong></p><p><strong>Como chegamos até Yonel e Jaqueline?</strong><br></p><p>Tudo começou com a intenção de pesquisar sobre a condição
de refugiados e/ou imigrantes, a partir da temática da diversidade étnica e
cultural que  foi proposta como plano de estudo para uma disciplina do curso de Psicologia da UNISC (Universidade de Santa Cruz do Sul) no Rio Grande do Sul. </p><p><strong>O plano em questão envolve uma campanha de
arrecadação de fundos suficientes à aquisição de passagens aéreas para que os
filhos do casal haitiano possam reunir-se à família no Brasil. </strong></p><p><strong>Mas por que eu deveria apoiar essa campanha?</strong></p><p>Dito assim, pode
parecer algo ingênuo e quase irrealizável, especialmente em razão da verdadeira
crise sócio-político-econômica que assola nosso país. Ocorre que, além dos
sentimentos de solidariedade e amor ao próximo que nos inspiram, os quais temos
a pretensão – ou mesmo a ousadia – de acreditar que, por si sós, configuram,
justamente, uma espécie de “contraveneno” para situações de crise e
desesperança como a que vivemos presentemente, cremos existir uma outra
motivação especial a contribuir para o sucesso dessa empreitada. Trata-se
da  da corrupção que hoje sabemos entranhada no tecido social, institucionalizada
por governos, partidos políticos e empresas, num relacionamento mais do que
promíscuo, o que está pondo em cheque, a nosso ver, a própria democracia. </p><p><strong>Temos
assistido acalorados debates e defesas de ideias tanto de
direita quanto de esquerda em relação ao espectro ideológico, mas o que poucos
se dão conta, ou reconhecem, é que a corrupção hoje no Brasil – repetimos –
qual uma chaga que se alastra pelo tecido social, não possui ideologia.
</strong>Trata-se de um mal em si (o mal verdadeiro), tanto que institucionalizada.
Desse modo, nossa campanha também se traduz em um convite aberto para que
caminhemos juntos na contramão do egoísmo e da ganância desmedidas,
pois a verdade é que algo precisa ser feito, além do inócuo confronto de ideias
ou de simples manifestações de indignação, ainda que esse algo, a princípio, se
veja revestido mais de simbolismo do que de concretude imediata.</p><p><strong>Unir uma família separada há 5 anos!</strong></p><p> Se você confia
em nós e em nosso propósito, de algum modo, e acha que vale a pena levar adiante
essa ideia – a ideia de se “vingar” dos políticos corruptos ou de dar um tapa
de luva em suas faces, como disse uma querida colega – ajude-nos a
multiplicá-la. Ajude-nos, estudantes de psicologia, comunidade em geral, ainda que de forma simbólica – por exemplo, com 10 reais – a reunir essa família. Nós acreditamos!!<strong> </strong></p><p><strong>Por isso, buscamos arrecadar o
valor de R$ 15.000,00, valor aproximado das passagens, uma de ida e volta ao
Yonel e a passagem destes para o Brasil. Todo o valor arrecadado será
encaminhado à família, bem como todo o valor que surgir através das demais
formas de arrecadação.</strong><br></p><p><strong>Recompensas</strong><br></p><p>A colaboração de todas e todos é muito bem-vinda, independentemente do valor. Por isso, a recompensa será virtual e igual para todas as faixas. Cada apoiador do <strong>Yonel e Jaqueline são nossos irmãos</strong> estará ajudando a unir uma família separada há 5 anos.<br></p><p>Confira no vídeo o passo-a-passo para quem quer contribuir para a campanha <strong>Yonel e Jaqueline são nossos irmãos</strong><span class=""redactor-invisible-space""></span><br></p><iframe style=""width: 500px; height: 281px;"" rel=""width: 500px; height: 281px;"" src=""//www.youtube.com/embed/IthuNnmsvsk"" frameborder=""0"" allowfullscreen=""""></iframe>",yonel_e_jaqueline_sao_nossos_irmaos_5462,//www.youtube.com/embed/urDtSzP-H1Y,https://www.youtube.com/watch?v=urDtSzP-H1Y&feature=youtu.be,Pessoais,35,https://s3-sa-east-1.amazonaws.com/cdn.br.catarse/uploads/project/uploaded_image/36343/13575522_1145319925525195_349710374_o.jpg,https://s3-sa-east-1.amazonaws.com/cdn.br.catarse/uploads/project/uploaded_image/36343/project_thumb_thumb_13575522_1145319925525195_349710374_o.jpg,https://s3-sa-east-1.amazonaws.com/cdn.br.catarse/uploads/project/uploaded_image/36343/project_thumb_small_13575522_1145319925525195_349710374_o.jpg,https://s3-sa-east-1.amazonaws.com/cdn.br.catarse/uploads/project/uploaded_image/36343/project_thumb_large_13575522_1145319925525195_349710374_o.jpg,https://s3-sa-east-1.amazonaws.com/cdn.br.catarse/uploads/project/uploaded_image/36343/project_thumb_video_cover_13575522_1145319925525195_349710374_o.jpg,5.60000000000000000000,840.0,37,37,successful,flex,finished,"2016-09-10 02:59:59.999999","2016-09-09 23:59:59.999999","2016-07-06 12:11:25.866302","2016-07-06 09:11:25.866302",,t,t,f,65,"{""total"" : 0, ""unit"" : ""seconds""}","{""total"" : 65, ""unit"" : ""days""}",1,"{""city"" : ""Santa Cruz do Sul"", ""state_acronym"" : ""RS"", ""state"" : ""Rio Grande do Sul""}","{""id"" : 465060, ""name"" : ""Angélica Weise""}",1,,f,f,1,t,f,f