project_id,id,user_id,name,headline,budget,goal,about_html,permalink,video_embed_url,video_url,category_name,category_id,original_image,thumb_image,small_image,large_image,video_cover_image,progress,pledged,total_contributions,total_contributors,state,mode,state_order,expires_at,zone_expires_at,online_date,zone_online_date,sent_to_analysis_at,is_published,is_expired,open_for_contributions,online_days,remaining_time,elapsed_time,posts_count,address,user,reminder_count,is_owner_or_admin,user_signed_in,in_reminder,total_posts,can_request_transfer,is_admin_role,contributed_by_friends
36512,36512,411038,"Mobile Grafia - Oficina de Fotografia","Móbile Grafia  - Universo fotográfico, e tudo  mais que a imaginação permitir.","<p><strong>4.3. Objetivos Específicos</strong></p><p><strong>• Proporcionar aos moradores uma
apropriação de mecanismos:</strong></p><p><strong>1.</strong>      <strong>Inclusão Visual: inclusão
no processo de produção de imagens a partir da compreensão dos fundamentos da
fotografia digital (no caso com celulares) e do seu papel legitimador e
formador de memórias e identidades, de modo a capacitar os aprendizes a
produzir uma representação visual de si mesmo, de sua comunidade, da relação
com o outro e o mundo.</strong></p><p><strong>2.</strong>      <strong>Valorização da Memória,
Identidade, Cultura e Economia Comunitária, cuja imagem foi sistematicamente
associada ao estigma e às imagens de pobreza e degradação.</strong></p><p><strong>3.</strong>      <strong>Formação de agentes de
transformação da comunidade (formação de produtores de fotografia para
registrar a cultura do bairro, agentes culturais da comunidade para o núcleo de
mídia colaborativa comunitária e produção cultural comunitária).</strong></p><p><strong>4.</strong>      <strong>Qualificação profissional e
desenvolvimento pessoal.</strong></p><p><strong>5.</strong>      <strong>Capacitação de aprendizes
para implementar outras ações do programa, como por exemplo, detecção de áreas
de risco entre outros.</strong></p><p><strong>6.</strong>      <strong>Promover práticas que
coloca em contato direto a comunidade com artistas que atuam na cidade;</strong></p><p><strong>7.</strong>      <strong>Desenvolver competências e
habilidades para Leitura e Olhar:</strong></p><p><strong>8.</strong>      <strong>Ler: Analisar e compreender
o processo de produção de imagens na fotografia e no olhar, desenvolvendo outra
relação com a imagem.</strong></p><p><strong>9.</strong>      <strong>Olhar: Renovar o olhar
sobre o próprio cotidiano, seu entorno e a cidade.</strong></p><p><strong>10.</strong>  <strong>Através das narrativas e reflexões sobre a produção
visual dos aprendizes, promover questionamentos e mecanismos de enfrentamento
das barreiras impostas por relações sociais hegemônicas sobre o espaço urbano
da cidade e seus moradores.</strong></p><p><strong>11.</strong>  <strong>Produção de documentário sobre a história da
comunidade feita pela equipe técnica em conjunto com o grupo de aprendizes.</strong></p>",41355.1,"<p><strong>Principal Linguagem do Projeto:</strong></p>  <p><strong>Projeto de inclusão social em comunidade de baixa renda.</strong></p>    <p><strong>Proponente: João J.C Correia</strong></p>  <p><strong>Nome do Projeto: <u>Móbile Grafia </u></strong></p>  <p><strong>Oficina de Fotografia</strong></p>  <p><strong>Resumo:</strong></p>  <p><strong>Oficina de fotografia com celulares tem como ferramenta a inclusão visual da comunidade de baixa renda, através de tecnologias acessíveis, percepção do território, construções de narrativas de moradores sobre a história do bairro serão aplicadas ainda conceitos de fotografia e maquinas analógicas, digitais, visando uma introdução como aprendizes ao universo fotográfico. Colocamo-nos a disposição de outros grupos no que for necessário e estiver ao nosso alcance.</strong></p>    <p><strong>1.</strong>                <strong>Tempo de duração: Seis meses</strong></p>  <p><strong>2.</strong>                <strong>Valor Total: R$ 41.355,10</strong></p>  <p><strong>(Quarenta e um mil trezentos e cinquenta e cinco reais e dez centavos)</strong></p>  <p><strong></strong></p>  <p><strong>Locais:</strong></p>  <p><strong>1.</strong>     <strong>Centros Culturais - Escolas - Igrejas </strong></p>    <p><strong>HISTORICO DO GRUPO</strong></p>  <p><strong>Tudo teve inicio em meu serviço militar obrigatório (1983), por iniciativa própria comecei a auxiliar a equipe do laboratório fotográfico em minhas horas vagas, deste dia em diante tornou-se meu hobby.</strong></p>  <p><strong>Em 1989 teve inicio meus estudos no mundo da fotografia através do SENAC, desde então ou estava clicando por hobby ou como freelance.</strong></p>    <p><strong>IDENTIFICAÇÃO DO PROJETO</strong></p>  <p><strong>1.1.</strong>            <strong>Nome: <u>Móbile Grafia</u> - Oficina de Fotografia</strong></p>  <p><strong>Oficina de fotografia com celulares como ferramenta de inclusão visual através de tecnologias acessíveis, percepção do território, construção de narrativas de moradores para execução de documentário sobre a história do bairro.</strong></p>  <p><strong>1.2. Tipo: Projeto de inclusão visual em comunidade de baixa renda.</strong></p>  <p><strong>1.3. Área de Concentração: Fotografia.</strong></p>  <p><strong>1.4. Palavras Chave: Inclusão Visual, Fotografia, Documentário, Celulares, Protagonismo, Fotojornalismo Comunitário, Acessibilidade.</strong></p>  <p><strong>1.5. Público Alvo: Jovens e Adultos de baixa renda do município de São Paulo desprovidos de recursos e equipamentos culturais e adjacências.</strong></p>  <p><strong>1.6. Proponente e Coordenador de execução: João JC Correia</strong></p>  <p><strong>1.7. Participação</strong></p>  <p><strong>• João JC Correia – Oficineiro - Fotojornalista</strong></p>  <p><strong>1.8. Apoio e Parcerias locais:</strong></p>  <p><strong>Centros Culturais da Cidade de São Paulo</strong></p>  <p><strong>1.9. Período de Execução do Projeto: Seis Meses</strong></p>  <p><strong>1.10. Carga Horária Total da Oficina por módulo: 10 horas</strong></p>    <p><strong>2. APRESENTAÇÃO/ JUSTIFICATIVA</strong></p>  <p><strong>Como missão contribuir para a construção de uma sociedade mais justa, identificando, propondo e implementando soluções integradas para problemas sociais, econômicos. Projeto que visa promover o desenvolvimento social.</strong></p>  <p><strong>Dentre as várias fases do projeto, ocorrera um diagnóstico participativo de ativos culturais da comunidade, mapeando tanto moradores e organizações que produzem ações culturais, da memória da comunidade. Identificara na comunidade laços de solidariedade, espírito colaborativo e resiliência, e um conjunto de organizações culturais (samba, samba de roda, capoeira) e desportivas (futebol, boxe, hap-kido), dentre outros na comunidade, relevantes para o fortalecimento da identidade e autoestima do bairro, e que, entretanto tem grandes dificuldades de visibilidade, infraestrutura, que manifestam talento e/ou interesse nas artes visuais.</strong></p>  <p><strong>O investimento na elevação da autoestima através da valorização dos ativos e vocações culturais locais e através da construção de uma economia da cultura no bairro.</strong></p>  <p><strong>Portanto, o fortalecimento da cultura local deve ser realizado de modo a promover inclusão digital, inclusão visual, qualificação profissional e desenvolvimento pessoal.</strong></p>  <p><strong>Para além da sua dimensão pedagógica explícita, as oficinas de inclusão visual são uma estratégia de interação, desdobrando intensos intercâmbios culturais e processos colaborativos entre instituições culturais, artistas (locais e não locais) e a comunidade.</strong></p>  <p><strong>Representam a oportunidade de percepção e transformação do espaço através do olhar e da ação dos próprios moradores. São a partir desta imersão, deste processo colaborativo, que serão realizadas transformações estéticas no bairro visando dinamizar áreas degradadas e explorar o espaço urbano como veículo de expressão da cultura local, promoção da autoestima, convívio ativo e questionador.</strong></p>    <p><strong><u>Móbile Grafia</u></strong><strong>  - Oficina de Fotografia: é um projeto de oficinas de fotografia como ferramenta de inclusão visual e construção de narrativas tendo como tema a percepção do território, a valorização da memória, cultura e identidade comunitária.</strong></p>  <p><strong>Nesta, a simplicidade das técnicas e as possibilidades de intervenção criativa e lúdica ao longo de todo o processo de produção da imagem permitem, de um modo que nenhuma outra metodologia permitiria desmistificar, analisar, compreender e vivenciar o processo de produção de imagens de modo a propiciar aos aprendizes:</strong></p>  <p><strong>1.</strong>      <strong>Um desenvolvimento todo especial do olhar, da sensibilidade estética, do potencial expressivo, da criatividade e da capacidade de experimentação,</strong></p>  <p><strong>2.</strong>      <strong>Uma apropriação dos conceitos e do passo a passo, subvertendo as relações de tempo e espaço da fotografia tradicional,</strong></p>  <p><strong>3.</strong>      <strong>Um desenvolvimento de outra relação com o aparato fotográfico e com as novas tecnologias convencionalmente impostas pela indústria fotográfica,</strong></p>  <p><strong>4.</strong>      <strong>Uma pratica transdisciplinar na construção de conhecimentos.</strong></p>  <p><strong>5.</strong>      <strong>Um diálogo com o universo fotográfico, e tudo o mais que a imaginação permitir.</strong></p>    <p><strong><u>Móbile Grafia</u></strong><strong>  - Oficina de Fotografia: tem como objetivo capacitar o público alvo para que os mesmos sejam protagonistas no processo de execução de documentário sobre a história do bairro.</strong></p>    <p><strong> 3. PERFIL DO PÚBLICO ALVO</strong></p>  <p><strong>Moradores Da Cidade de São Paulo. O perfil deste público está descrito a seguir:</strong></p>  <p><strong>a) Jovens e Adultos de baixa renda do município de São Paulo desprovidos de recursos e equipamentos culturais. Adjacências da comunidade com vocação e interesse para se tornar agentes culturais e fotógrafos da comunidade</strong></p>    <p><strong>4. PROJEÇÃO DE FINALIDADES</strong></p>  <p><strong>4.1. Metas</strong></p>    <p><strong>1.</strong>      <strong>Proporcionar oficina de fotografia com celulares a moradores do bairro, num prazo de oito meses.</strong></p>  <p><strong>2.</strong>      <strong>Fortalecer a comunidade de conhecimentos e técnicas fotográficas.</strong></p>  <p><strong>4.2. Objetivo Geral</strong></p>  <p><strong>Utilizar técnicas de produção fotográfica com celulares para proporcionar aos moradores, oportunidades para constituir um acervo comunitário de narrativas visuais, orais, sobre o território e sua importância para a cidade, sobre a história, o cotidiano e a cultura local para realização de documentário sobre a história da comunidade.</strong></p>    <p><strong>4.3. Objetivos Específicos</strong></p>    <p><strong>• Proporcionar aos moradores uma apropriação de mecanismos:</strong></p>  <p><strong>1.</strong>      <strong>Inclusão Visual: inclusão no processo de produção de imagens a partir da compreensão dos fundamentos da fotografia digital (no caso com celulares) e do seu papel legitimador e formador de memórias e identidades, de modo a capacitar os aprendizes a produzir uma representação visual de si mesmo, de sua comunidade, da relação com o outro e o mundo.</strong></p>  <p><strong>2.</strong>      <strong>Valorização da Memória, Identidade, Cultura e Economia Comunitária, cuja imagem foi sistematicamente associada ao estigma e às imagens de pobreza e degradação.</strong></p>  <p><strong>3.</strong>      <strong>Formação de agentes de transformação da comunidade (formação de produtores de fotografia para registrar a cultura do bairro, agentes culturais da comunidade para o núcleo de mídia colaborativa comunitária e produção cultural comunitária).</strong></p>  <p><strong>4.</strong>      <strong>Qualificação profissional e desenvolvimento pessoal.</strong></p>  <p><strong>5.</strong>      <strong>Capacitação de aprendizes para implementar outras ações do programa, como por exemplo, detecção de áreas de risco entre outros.</strong></p>  <p><strong>6.</strong>      <strong>Promover práticas que coloca em contato direto a comunidade com artistas que atuam na cidade;</strong></p>  <p><strong>7.</strong>      <strong>Desenvolver competências e habilidades para Leitura e Olhar:</strong></p>  <p><strong>8.</strong>      <strong>Ler: Analisar e compreender o processo de produção de imagens na fotografia e no olhar, desenvolvendo outra relação com a imagem.</strong></p>  <p><strong>9.</strong>      <strong>Olhar: Renovar o olhar sobre o próprio cotidiano, seu entorno e a cidade.</strong></p>  <p><strong>10.</strong>  <strong>Através das narrativas e reflexões sobre a produção visual dos aprendizes, promover questionamentos e mecanismos de enfrentamento das barreiras impostas por relações sociais hegemônicas sobre o espaço urbano da cidade e seus moradores.</strong></p>  <p><strong>11.</strong>  <strong>Produção de documentário sobre a história da comunidade feita pela equipe técnica em conjunto com o grupo de aprendizes.</strong></p>    <p><strong>5. MEDIAÇÃO</strong></p>  <p><strong>5.1. Conteúdos (teóricos e práticos)</strong></p>    <p><strong>1.</strong>      <strong>Dinâmica sobre “redes” (a importância de se articular em redes na sociedade contemporânea);</strong></p>  <p><strong>2.</strong>      <strong>Apresentação de projetos similares; Exposição de trabalhos de fotógrafos reconhecidos internacionalmente e reconhecido; Projeção de documentários, filme de ficção e curtas metragens; Tópicos de história da fotografia; Composição da imagem;</strong></p>  <p><strong>3.</strong>      <strong>Edição de fotografia; Produção audiovisual (aspectos e fundamentos presentes em uma produção);</strong></p>  <p><strong>4.</strong>      <strong>Técnicas de produção com celular; Mapeamento no processo visual; Elaboração do roteiro a ser executado em conjunto com aprendizes.</strong></p>    <p><strong>5.2. Metodologia</strong></p>    <p><strong>1.</strong>      <strong>Debates e a partir de dinâmicas, e projeções de imagens e vídeos sobre temas como história da fotografia e sua relação com a cidade; o processo de construção do olhar, alguns aspectos técnicos, históricos e sociais da fotografia e vídeo.</strong></p>  <p><strong>2.</strong>      <strong>Oficinas práticas de fotografia com celular e máquinas fotográficas.</strong></p>  <p><strong>3.</strong>      <strong>Percursos e passeios fotográficos e visuais (narrativas visuais) no bairro.</strong></p>  <p><strong>4.</strong>      <strong>Visitas guiadas a instituições.</strong></p>  <p><strong>5.</strong>      <strong>Produção de narrativas visuais sobre a experiência dos participantes.</strong></p>  <p><strong>6.</strong>      <strong>Registro de narrativas orais.</strong></p>    <p><strong>5.3. Avaliação</strong></p>    <p><strong>1.</strong>      <strong>Estabelecimento de um diálogo contínuo, promovendo uma interação entre o novo conhecimento adquirido e o já existente.</strong></p>  <p><strong>2.</strong>      <strong>Participação no processo de produção de narrativas visuais.</strong></p>  <p><strong>3.</strong>      <strong>Participação no processo de elaboração do roteiro documentário a ser produzido.</strong></p>    <p><strong>5.4. Quantidade horas do curso:</strong></p>  <p><strong>Curso formação composto de 10 horas</strong></p>    <p><strong>HORAS/AULA 10</strong></p>  <p><strong>HORAS AULA POR ALUNO 10</strong></p>  <p><strong>(Aprovação 75% de Frequência)</strong></p>  <p><strong>FREQUÊNCIA: Semanal</strong></p>    <p><strong>5.5. Resultados</strong></p>    <p><strong>A Oficina de Fotografia ocorrera do ponto de vista teórico-pedagógico dentro do programado.</strong></p>  <p><strong>A parte prática, ou seja, produto final da oficina. Será um documentário sobre a história do Bairro e seu cotidiano.</strong></p>    <p><strong>6.  Plano de Trabalho:</strong></p>  <p><strong>6.1 Compras:</strong></p>    <ul><li><strong>Atendendo a aquisição dos equipamentos necessários para a execução das atividades, tais como notebook para ministrar os cursos, celular e maquina fotográfica para que os alunos tenham contato e aprendam além dos celulares como utilizar fisicamente, máquina profissional, material de escritório e apostila do curso.</strong></li></ul>    <p><strong>6.2 Oficinas:</strong></p>    <p><strong>Acontecerão em seis meses, onde estaremos ministrando as oficinas, efetuando compras e entregando relatório final.</strong></p>  <p><strong>Cotação e aquisição de equipamentos</strong></p>  <p><strong>Seis meses – Oficinas de fotografia</strong></p>  <p><strong>Apresentação do resultado das oficinas e verbas administradas.</strong></p>    <p><strong>6.2 Divulgação</strong></p>    <p><strong>Divulgação: na comunidade entorno ao local das oficinas, através de contato pessoal, telefônico, mailing, redes sociais e outras formas de comunicação local, panfletos.</strong></p>        <p><strong>João JC Correia</strong></p>  <p><strong>Proponente</strong></p>",mobile_grafia_oficina_de_fotografia_36e2,,,Fotografia,17,https://s3-sa-east-1.amazonaws.com/cdn.br.catarse/uploads/project/uploaded_image/36512/Mobile_Grafia.jpg,https://s3-sa-east-1.amazonaws.com/cdn.br.catarse/uploads/project/uploaded_image/36512/project_thumb_thumb_Mobile_Grafia.jpg,https://s3-sa-east-1.amazonaws.com/cdn.br.catarse/uploads/project/uploaded_image/36512/project_thumb_small_Mobile_Grafia.jpg,https://s3-sa-east-1.amazonaws.com/cdn.br.catarse/uploads/project/uploaded_image/36512/project_thumb_large_Mobile_Grafia.jpg,https://s3-sa-east-1.amazonaws.com/cdn.br.catarse/uploads/project/uploaded_image/36512/project_thumb_video_cover_Mobile_Grafia.jpg,0,0,0,0,failed,flex,finished,"2016-09-04 02:59:59.999999","2016-09-03 23:59:59.999999","2016-07-06 00:34:46.266236","2016-07-05 21:34:46.266236",,t,t,f,60,"{""total"" : 0, ""unit"" : ""seconds""}","{""total"" : 60, ""unit"" : ""days""}",0,"{""city"" : ""São Paulo"", ""state_acronym"" : ""SP"", ""state"" : ""São Paulo""}","{""id"" : 411038, ""name"" : ""João JC Correia""}",0,,f,f,0,f,f,f