project_id,id,user_id,name,headline,budget,goal,about_html,permalink,video_embed_url,video_url,category_name,category_id,original_image,thumb_image,small_image,large_image,video_cover_image,progress,pledged,total_contributions,total_contributors,state,mode,state_order,expires_at,zone_expires_at,online_date,zone_online_date,sent_to_analysis_at,is_published,is_expired,open_for_contributions,online_days,remaining_time,elapsed_time,posts_count,address,user,reminder_count,is_owner_or_admin,user_signed_in,in_reminder,total_posts,can_request_transfer,is_admin_role,contributed_by_friends
36697,36697,601251,"Espetáculo O Capote","O CAPOTE no TEATRO DOS 4 - Compre antecipado aqui e faça parte desse projeto com a gente! ","<p><strong>Todo valor arrecadado será destinado para o pagamento do aluguel do Teatro!</strong></p><p><strong></strong></p><p><img src=""https://s3-sa-east-1.amazonaws.com/cdn.br.catarse/uploads/redactor_rails/picture/data/56988/or%C3%A7amento_ne.jpg""></p>",27000.0,"<p><strong></strong></p><p><img src=""https://s3-sa-east-1.amazonaws.com/cdn.br.catarse/uploads/redactor_rails/picture/data/64740/capa_fb_o_capote.jpg""></p><p><strong>O PROJETO</strong><br></p><p>Para escolher o texto a ser montado em nosso espetáculo de
formatura, como alunos da turma BT7 da Faculdade Casa de Artes de Laranjeiras
(CAL), reunimos um vasto material literário, debatendo muito, ao longo de
inúmeros encontros presenciais e virtuais. </p><p>Acabamos optando pelo conto <strong><i>O Capote</i></strong>, de Nikolai
Gogol, por ter-se revelado como um território repleto de possibilidades para a
viagem que desejávamos empreender coletivamente.</p><p>Escrito em 1842, o texto de Gogol é uma das obras-primas da
literatura universal exerceu grande influência sobre os escritores russos no
século XIX, por seu forte cunho social. ""Todos nós descendemos de <em>O Capote</em>"", afirmava o célebre
escritor e filósofo Fiódor Dostoiévski, a respeito do conto que ele considerava
como um dos pilares do realismo russo.Para Dostoiéviski, seu contemporâneo
Gogol foi o criador de uma linhagem.</p><p><i>O Capote</i> de Gogol tornou-se um marco também
na trajetória destes jovens atores do século XXI, no Rio de Janeiro.</p><p>""Em nossa temporada no Teatro Ipanema, pela CAL, tivemos um
retorno muito positivo e acolhedor por parte do público. Nesta primeira
experiência, que nos fez acreditar em nossa potência como grupo de teatro, uma
animadora certeza ficou: <strong>precisamos continuar.""</strong></p><p><strong>DESCRIÇÃO DO PROJETO</strong><br></p><p>O espetáculo <em>O Capote</em> é uma criação colaborativa do grupo de formandos da CAL, com base na obra homônima de Nikolai Gogol, que levanta questionamentos pertinentes a situações ainda visíveis em nossa sociedade, colocando em xeque a exiguidade do ser humano diante da burocracia, do preconceito e da falta de solidariedade.</p><p><strong></strong></p><p>Fruto de uma intensa pesquisa sobre o universo do realismo fantástico, a montagem que criamos para o nosso espetáculo transita entre o cômico e o trágico, com a intenção de levar ao público significativas referências sociais,às vezes desconcertantes e profundamente humanas, ricas em impressões poéticas, musicais e visuais.</p><p><strong>MONTAGEM E TEMPORADA NO RIO DE JANEIRO</strong><br></p><p>O objetivo desta campanha é financiar uma nova temporada do
nosso espetáculo.</p><p>Tentamos diversos teatros públicos, mas todos estão com suas
pautas comprometida nos próximos meses, então resolvemos arriscar a realização
do espetáculo em um teatro particular.Conseguimos pauta no Teatro dos Quatro, no
Shopping da Gávea, local de grande visibilidade para o nosso grupo. </p><p><em>O Capote </em>permanecerá dois meses em cartaz no Teatro dos Quatro, na
Gávea, Rio de Janeiro, totalizando 18 apresentações, às terças e quartas, no
período de 6 de setembro a 2 de novembro de 2016</p><p>Optamos pelo risco, por acreditar muito no valor estético e
cultural do espetáculo, e queremos construir o nosso espaço no meio teatral.</p><p>Não temos como conseguir patrocínio nesse momento tão
conturbado da sociedade brasileira, mas acreditamos muito na história que
queremos contar e não podemos esperar.Somos jovens! Amamos o que fazemos! E
temos um espetáculo maravilhoso para oferecer ao público! </p><p style=""text-align: center;"">Precisamos muito do apoio e da colaboração de vocês, para o
pagamento do valor mínimo de aluguel/dia que é cobrado pelo teatro. <strong>Contamos com
vocês</strong>! Vai dar certo!</p><p><strong>A HISTÓRIA</strong><br></p><p><img src=""https://s3-sa-east-1.amazonaws.com/cdn.br.catarse/uploads/redactor_rails/picture/data/56212/Historia_o_Capote.png"" width=""582"" height=""452"" alt="""" style=""width: 582px; height: 452px; display: block; margin: auto;""><br></p><p>Com uma narrativa reflexiva e filosófica, <em>O Capote</em> conta
a história das desventuras de Akaki Akakiévich, que trabalha como copista em
""um certo departamento de São Petersburgo"". O copista sofre bullying
de seus colegas de repartição, mas não se defende. Permanece em silêncio,
concentrado nas suas funções.E, quando já não suporta mais, apenas exclama:<br></p><p style=""text-align: center;""><em>""Deixem-me em paz! Os senhores não veem que estão me
magoando?""</em></p><p>Porém, em certo momento ele percebe que não aguentará passar
por mais um impiedoso inverno com o seu capote velho, e por isso precisa comprar
um novo capote. Mas como fazer isto, se o seu mísero salário mal atende às
necessidades básicas de sobrevivência?</p><p>A partir da busca de Akaki Akakiévich por um capote novo, a
história surpreende o público, com reviravoltas reais e oníricas, em boas doses
de humor e poesia.</p><p><br></p><p style=""margin-left: 280px;""><strong>FICHA TÉCNICA</strong><br></p><p>Texto original: Nikolai Gogol</p><p>Adaptação: Anna Paula Borges, Eduardo Vaccari e Leonardo da Selva</p><p>Direção: Eduardo Vaccari</p><p>Assistente de direção: Rodrigo Viegas</p><p>Produção: Desirée Della Volpe, Luana Leal e Yndara Barbosa</p><p>Direção musical: Charles Khan</p><p>Assistente de direção musical: Lucas Gonçalves</p><p>Direção vocal: Rose Gonçalves</p><p>Direção de movimento: Sueli Guerra</p><p>Iluminação: Wilson Reiz</p><p>Cenário e Figurino: Nívea Faso</p><p>Assistente de Figurino: Desirée Della Volpe, Luana Leal e Yndara Barbosa.</p><p>Assistentes de cenografia:  Desirée Della Volpe, Luana Leal e Yndara Barbosa.</p><p><img src=""https://s3-sa-east-1.amazonaws.com/cdn.br.catarse/uploads/redactor_rails/picture/data/64138/calendario_certo.png""></p><hr><p class=""fontsize-larger fontweight-semibold""><strong>Realização:</strong><br></p><p class=""fontsize-larger fontweight-semibold""><strong><br></strong></p><p class=""fontsize-larger fontweight-semibold""><strong></strong></p><p style=""text-align: center;"">                                                                    <img src=""https://s3-sa-east-1.amazonaws.com/cdn.br.catarse/uploads/redactor_rails/picture/data/63293/LOGO_BETESSETES_280_carimbo.jpg""></p><p><br></p>",espetaculo_o_capote_a49b,//player.vimeo.com/video/162626764,https://vimeo.com/162626764,"Teatro e Dança",19,https://s3-sa-east-1.amazonaws.com/cdn.br.catarse/uploads/project/uploaded_image/36697/capa_fb_o_capote.jpg,https://s3-sa-east-1.amazonaws.com/cdn.br.catarse/uploads/project/uploaded_image/36697/project_thumb_thumb_capa_fb_o_capote.jpg,https://s3-sa-east-1.amazonaws.com/cdn.br.catarse/uploads/project/uploaded_image/36697/project_thumb_small_capa_fb_o_capote.jpg,https://s3-sa-east-1.amazonaws.com/cdn.br.catarse/uploads/project/uploaded_image/36697/project_thumb_large_capa_fb_o_capote.jpg,https://s3-sa-east-1.amazonaws.com/cdn.br.catarse/uploads/project/uploaded_image/36697/project_thumb_video_cover_capa_fb_o_capote.jpg,10.01851851851851851900,2705.0,20,20,online,flex,published,,,"2016-07-12 19:09:18.659524","2016-07-12 16:09:18.659524",,t,f,t,,"{""total"" : 0, ""unit"" : ""seconds""}","{""total"" : 74, ""unit"" : ""days""}",1,"{""city"" : ""Rio de Janeiro"", ""state_acronym"" : ""RJ"", ""state"" : ""Rio de Janeiro""}","{""id"" : 601251, ""name"" : ""Os Betessetes""}",0,,f,f,1,f,f,f