project_id,id,user_id,name,headline,budget,goal,about_html,permalink,video_embed_url,video_url,category_name,category_id,original_image,thumb_image,small_image,large_image,video_cover_image,progress,pledged,total_contributions,total_contributors,state,mode,state_order,expires_at,zone_expires_at,online_date,zone_online_date,sent_to_analysis_at,is_published,is_expired,open_for_contributions,online_days,remaining_time,elapsed_time,posts_count,address,user,reminder_count,is_owner_or_admin,user_signed_in,in_reminder,total_posts,can_request_transfer,is_admin_role,contributed_by_friends
368,368,24389,Málabar,"Quem sabe não sejamos donos do nosso destino?","O orçamento para projetos anteriores a 24/02/2015 normalmente pode ser encontrado na descrição acima.",3300.0,"<p>“Málabar” é um curta-metragem independente de aproximadamente 15 minutos idealizado por alunos do curso de Comunicação Social –Rádio e TV da UFRJ.</p>

<p>O curta apresenta a história de dois artistas de rua que possuem em comum a paixão pela música. A solidão desses personagens é o ponto de partida para uma narrativa, na qual uma série de acontecimentos regidos pela inusitada figura de um misterioso mímico evidenciará as crises e limites de cada um.</p>

<p>O filme busca retratar os crescentes conflitos nas vidas desses personagens que têm a música, não só como forma de sustento, mas, principalmente, como identidade e válvula de escape.</p>

<p>O processo de produção inclui um intenso trabalho musical, com assinaturas sonoras particulares para os personagens, tal como uma cuidadosa caracterização desses personagens e, por fim, a construção de uma atmosfera ideal para o desenvolvimento da narrativa audiovisual proposta.</p>

<p>Toda a equipe está super animada e empenhada em tirar esse projeto do papel, mas só isso não basta. Já contamos com muitos amigos interessados em alavancar nossa idéia, nos emprestando equipamentos e trabalhando voluntariamente. Mas ainda precisamos de mais ajuda.</p>

<p>“Málabar” possui um caráter estritamente educacional e cultural, fazendo parte da formação acadêmica dos estudantes envolvidos. Por isso, muitos são os desafios e as necessidades da nossa produção. Então, todo dinheiro arrecadado através do “Catarse” será utilizado para cobrir os gastos com transporte e alimentação de toda a equipe, objetos de cena, figurino, locação de equipamentos e gravação da trilha sonora.</p>

<p>Lembrem-se que estamos participando de um financiamento coletivo, só conseguiremos colocar nosso idéia em prática, se alcançarmos a nossa meta. Nosso tempo é curto. Então, toda ajuda será muito bem-vinda!</p>

<p>Claro que com essa ajuda enorme, não poderíamos deixar de oferecer recompensas incríveis para quem acredita na nossa idéia.</p>

<p>O financiamento coletivo é uma forma bem-sucedida e viável de arrecadação para nós, estudantes, colocarmos a mão na massa e produzirmos algo com qualidade profissional.</p>

<p>Toda forma de contribuição é super válida e contamos com a ajuda de todos para viabilizar esse projeto. </p>

<p>Se você se interessou pela nossa idéia e quer saber mais sobre o projeto, equipe e personagens, acesse o nosso site : <a class=""alt-link"" href=""http://www.malabarfilme.com"" target=""_blank"">www.malabarfilme.com</a> e nossa página no facebook: &quot;!<img src=""http://catarse.me/images/social/facebook_32.png?1316635290!%22:http://www.facebook.com/profile.php?id=100002983477761"" alt=""""/>
Muito Obrigado!
Equipe Málabar</p>
",malabar,//player.vimeo.com/video/29773421,http://vimeo.com/29773421,"Cinema e Vídeo",13,,https://s3-sa-east-1.amazonaws.com/cdn.br.catarse/uploads/project/video_thumbnail/368/project_thumb_thumb_open-uri20131125-2-yuxupt,https://s3-sa-east-1.amazonaws.com/cdn.br.catarse/uploads/project/video_thumbnail/368/project_thumb_small_open-uri20131125-2-yuxupt,https://s3-sa-east-1.amazonaws.com/cdn.br.catarse/uploads/project/video_thumbnail/368/project_thumb_large_open-uri20131125-2-yuxupt,https://s3-sa-east-1.amazonaws.com/cdn.br.catarse/uploads/project/video_thumbnail/368/project_thumb_video_cover_open-uri20131125-2-yuxupt,103.1818181818181800,3405.0,58,54,successful,aon,finished,"2011-11-01 01:59:59","2011-10-31 23:59:59","2011-09-02 01:59:59","2011-09-01 22:59:59",,t,t,f,60,"{""total"" : 0, ""unit"" : ""seconds""}","{""total"" : 60, ""unit"" : ""days""}",0,"{""city"" : ""Rio de Janeiro"", ""state_acronym"" : ""RJ"", ""state"" : ""Rio de Janeiro""}","{""id"" : 24389, ""name"" : ""Almir Chiaratti""}",0,,f,f,0,f,f,f