project_id,id,user_id,name,headline,budget,goal,about_html,permalink,video_embed_url,video_url,category_name,category_id,original_image,thumb_image,small_image,large_image,video_cover_image,progress,pledged,total_contributions,total_contributors,state,mode,state_order,expires_at,zone_expires_at,online_date,zone_online_date,sent_to_analysis_at,is_published,is_expired,open_for_contributions,online_days,remaining_time,elapsed_time,posts_count,address,user,reminder_count,is_owner_or_admin,user_signed_in,in_reminder,total_posts,can_request_transfer,is_admin_role,contributed_by_friends
37009,37009,603720,"marcara music",marcara,"<p>O DINHEIRO SERÁ USADO PARA GRAVAÇÃO DO CD E DO VÍDEO CLIPE E PAGAMENTO DE PASSAGENS PARA SE DESLOCAR AO STUDIO</p>",60000.0,"<p><strong>Querem conhecer o novo fenômeno musical destas pernas, chega de
decotes toda natural sonhe com estas pernas toda noite. Agora só pernas
publique e compartilha, Breve seu CD por enquanto não irá
aparecer o rosto</strong><strong> (deixaremos um suspense todos irão ficar curiosos para saber
quem esconde por trás daquela mascara)</strong><strong> estará sempre de mascara
mostrando sempre as belas pernas</strong><strong> USARÁ VÁRIOS MODELOS MAIOS,
RENDAS, MAIOS COM FRANJAS ETC </strong><strong> chega de mostras bundas e
seios temos outras partes importantes e lindas para se ver como as pernas,
vamos lançar o novo fenômeno musical.  MARCARA MUSIC ENTRE EM MINHAS
APRESENTAÇÕES SLIDES NO YOUTUBE E ASSISTA O VÍDEO Aguardo retorno</strong></p>",marcara_music_25c8,,https://www.google.com.br/url?sa=t&rct=j&q=&esrc=s&source=web&cd=3&cad=rja&uact=8&ved=0ahUKEwjq0fGmrOrNAhUHgJAKHdxRBgQQtwIIJDAC&url=https%3A%2F%2Fwww.youtube.com%2Fwatch%3Fv%3DDjw9yPsJ9o8&usg=AFQjCNH1ZyWm5lov0MHIeKdCOoQsE-lvIQ,Música,16,https://s3-sa-east-1.amazonaws.com/cdn.br.catarse/uploads/project/uploaded_image/37009/MASCARA_BRANCA.jpg,https://s3-sa-east-1.amazonaws.com/cdn.br.catarse/uploads/project/uploaded_image/37009/project_thumb_thumb_MASCARA_BRANCA.jpg,https://s3-sa-east-1.amazonaws.com/cdn.br.catarse/uploads/project/uploaded_image/37009/project_thumb_small_MASCARA_BRANCA.jpg,https://s3-sa-east-1.amazonaws.com/cdn.br.catarse/uploads/project/uploaded_image/37009/project_thumb_large_MASCARA_BRANCA.jpg,https://s3-sa-east-1.amazonaws.com/cdn.br.catarse/uploads/project/uploaded_image/37009/project_thumb_video_cover_MASCARA_BRANCA.jpg,0,0,0,0,failed,flex,finished,"2016-09-10 02:59:59.999999","2016-09-09 23:59:59.999999","2016-07-11 02:51:59.090857","2016-07-10 23:51:59.090857",,t,t,f,60,"{""total"" : 0, ""unit"" : ""seconds""}","{""total"" : 61, ""unit"" : ""days""}",0,"{""city"" : ""Pouso Alegre"", ""state_acronym"" : ""MG"", ""state"" : ""Minas Gerais""}","{""id"" : 603720, ""name"" : ""MARCARA""}",1,,f,f,0,f,f,f