project_id,id,user_id,name,headline,budget,goal,about_html,permalink,video_embed_url,video_url,category_name,category_id,original_image,thumb_image,small_image,large_image,video_cover_image,progress,pledged,total_contributions,total_contributors,state,mode,state_order,expires_at,zone_expires_at,online_date,zone_online_date,sent_to_analysis_at,is_published,is_expired,open_for_contributions,online_days,remaining_time,elapsed_time,posts_count,address,user,reminder_count,is_owner_or_admin,user_signed_in,in_reminder,total_posts,can_request_transfer,is_admin_role,contributed_by_friends
37677,37677,607369,"Projeto social e ambiental no facebook ","E enquanto houver sonho, amor e fantasia, haverá esperança.","<p>PARA MEU PROJETO PRECISO DE 50.000 PARA DESEMPENHAR O
TRABALHO PARA COM QUEM PRECISA. </p>",50000.0,"<p>A PÁGINA INSS PERITO MEDICO É PARA MOSTRA, DENUNCIAR MÉDICOS PERITOS QUE MALTRATA ASA PESSOAS QUE PRECISAM DE UM ATENDIMENTO ADEQUADO.</p><p><a href=""https://www.facebook.com/medicoperitodoinss/videos/vl.1202673979796841/232350103825106/?type=1"">https://www.facebook.com/medicoperitodoinss/videos...</a><br></p><p><a href=""https://www.facebook.com/medicoperitodoinss/"">https://www.facebook.com/medicoperitodoinss/</a></p><p>As perícias do INSS historicamente têm-se caracterizado como verdadeiros campos de concentração, mantendo segurados reféns numa via sacra de humilhação e desgostos até a resposta administrativa sobre os benefícios requeridos.</p><p>Imaginem um cenário onde segurados doentes, acidentados, endividados e desesperados são confinados as dezenas e durantes horas, previamente fiscalizados por detectores de metais e vigiados por seguranças armados e truculentos, maltratados com ofensas por servidores no atendimento, enquanto agonizam a espera do perito pronto para humilhá-los e desenganá-los quanto as suas pretensões e direitos. Essa é a realidade da maioria das perícias médicas realizadas no INSS, que se assemelham aos piores campos de concentração existentes ao longo da história da humanidade.</p><p>Neste campo de extermínio social, os segurados são tratados como números e a perícia afigura-se como um ritual estressante no momento mais vulnerável do trabalhador. O INSS condena e mata pela via econômica os segurados, quando nega o benefício a que têm direito, porquanto os benefícios negados destinam-se ao principal responsável pela renda da família.</p><p>Os usuários do sistema chegam a esperar durante horas por atendimento tamanho é o descaso dentro das agências, sendo que em determinado momento a tolerância e paciência chegam ao fim. A frieza no atendimento revolta e indigna, por se tratar de um ser humano doente e necessitado de auxílio financeiro.</p><p>A PÁGINA ZÉ ODAIR DENÚNCIA MAUS TRATOS DE ANIMAIS E MOSTRA
QUEM AMA A NATUREZA E OS ANIMAIS.</p><p><a href=""https://www.facebook.com/zeodairoficial/"">https://www.facebook.com/zeodairoficial/</a></p><p><a href=""https://www.facebook.com/zeodairoficial/videos/1058320987521939/"">https://www.facebook.com/zeodairoficial/videos/105...</a><br></p><p>Pássaros e animais, devem viver em seu habitat natural pois correm risco de extinção, preserve a natureza. Cuide das plantas e das árvores, cuide hoje do seu futuro do amanhã!<br></p><p><span class=""redactor-invisible-space"">PARA RESPONDER TODAS AS DENÚNCIAS TEM QUE TER TEMPO POIS TEM
PESSOAS QUE NÃO SABE QUE SETORES OU SECRETARIAS PROCURAREM, E TAMBÉM ORIENTAR
PARA OS SETORES CERTO ALÉM DE VÍDEOS DE DENUNCIA QUE EU TENHO QUE POSTAR PARA
MOSTRAR A VERDADE, CUSTA TEMPO POR ISSO PEÇO A COLABORAÇÃO DE TODOS SE POSSÍVEL
E ASSIM CONSTRUIREMOS UM BRASIL MELHOR OBRIGADO CONTO COM VOCÊ. <br></span></p><p><br></p><p><br></p>",projeto_social_e_ambiental_no_facebook,,,Socioambiental,4,https://s3-sa-east-1.amazonaws.com/cdn.br.catarse/uploads/project/uploaded_image/37677/justice-balance-icon.png,https://s3-sa-east-1.amazonaws.com/cdn.br.catarse/uploads/project/uploaded_image/37677/project_thumb_thumb_justice-balance-icon.png,https://s3-sa-east-1.amazonaws.com/cdn.br.catarse/uploads/project/uploaded_image/37677/project_thumb_small_justice-balance-icon.png,https://s3-sa-east-1.amazonaws.com/cdn.br.catarse/uploads/project/uploaded_image/37677/project_thumb_large_justice-balance-icon.png,https://s3-sa-east-1.amazonaws.com/cdn.br.catarse/uploads/project/uploaded_image/37677/project_thumb_video_cover_justice-balance-icon.png,0,0,0,0,failed,aon,finished,"2016-09-15 02:59:59.999999","2016-09-14 23:59:59.999999","2016-07-16 20:44:36.669705","2016-07-16 17:44:36.669705",,t,t,f,60,"{""total"" : 0, ""unit"" : ""seconds""}","{""total"" : 60, ""unit"" : ""days""}",0,"{""city"" : ""Campo Grande"", ""state_acronym"" : ""MS"", ""state"" : ""Mato Grosso do Sul""}","{""id"" : 607369, ""name"" : ""Zé Odair""}",0,,f,f,0,f,f,f