project_id,id,user_id,name,headline,budget,goal,about_html,permalink,video_embed_url,video_url,category_name,category_id,original_image,thumb_image,small_image,large_image,video_cover_image,progress,pledged,total_contributions,total_contributors,state,mode,state_order,expires_at,zone_expires_at,online_date,zone_online_date,sent_to_analysis_at,is_published,is_expired,open_for_contributions,online_days,remaining_time,elapsed_time,posts_count,address,user,reminder_count,is_owner_or_admin,user_signed_in,in_reminder,total_posts,can_request_transfer,is_admin_role,contributed_by_friends
37697,37697,607440,Computasseia,"Jogue e conheça a História da Computação!","<p class=""fontsize-larger fontweight-semibold"">Nosso orçamento </p><ul><li>13% para o Catarse.</li><li>60% para confecção das recompensas.</li><li>10% para postagem e rastreio dos materiais.</li><li>17% para a produção do projeto.</li></ul><p><img src=""https://s3-sa-east-1.amazonaws.com/cdn.br.catarse/uploads/redactor_rails/picture/data/58750/orcamento.png""></p><p><strong>Funcionamento da Campanha:</strong></p><p>A nossa campanha no Catarse estará ativa até 31/12/2016, recebendo apoios por troca de recompensas. Utilizaremos o período de janeiro de 2017 para produção das recompensas e iniciaremos a postagem das mesmas para os nossos apoiadores em fevereiro de 2017.</p>",3000.0,"<p><strong>O que é o Computasseia?</strong></p><p><strong></strong></p><p style=""text-align: center;""><img src=""http://gameinclass.ic.ufmt.br/computassy/content/images/logo.png"" alt=""Logo do Computasseia, consiste na palavra 'Computasseia' com uma representação abstrata das engrenagens da Máquina de Anticítera, uma das cartas do jogo."" width=""354"" height=""185"" style=""width: 354px; height: 185px;""></p><p><a href=""http://gameinclass.ic.ufmt.br/computassy/"" target=""_blank"">Computasseia</a> é um jogo de cartas de estratégia sobre a História da 
Computação.  Com o <a href=""http://gameinclass.ic.ufmt.br/computassy/"">Computasseia</a> você é convidado a viajar no tempo, por 
meio de cartas que representam Eventos, Personalidades e Instituições 
importantes da História da Computação. Seu objetivo é organizar uma 
Linha do Tempo com todos os acontecimentos e mostrar que ninguém entende
 mais do passado, presente e quem sabe até do futuro da Computação do 
que você!</p><p style=""text-align: center;""><img src=""http://gameinclass.ic.ufmt.br/computassy/content/images/leque.png"" alt=""Imagem de cinco cartas dispostas em forma de leque, umas sobre as outras"" width=""394"" height=""225"" style=""width: 394px; height: 225px;""></p><p style=""text-align: center;""><strong><em>Saiba mais sobre o jogo e como ele funciona <a href=""http://gameinclass.ic.ufmt.br/computassy/"">aqui</a> & <a href=""http://www.facebook.com/computasseia"">aqui</a>!</em></strong></p><p><strong>O que significa esse nome?</strong></p><p>
		O nome “Computasseia” é uma referência ao poema grego clássico 
“Odisseia” de Homero que narra a jornada do herói Odisseu (ou Ulisses 
para os romanos) na ilha de Ítaca, durante o final da guerra de Tróia. O
 nome foi escolhido não só pela importância histórica da obra 
para a Literatura Ocidental, mas também pelo seu conteúdo, mostrando a 
longa e desafiadora jornada do herói, aludindo assim ao caminho da 
Computação para firmar-se como Ciência e da trajetória do Jogador 
explorando este caminho. O símbolo do jogo Computasseia foi inspirado na 
 <a target=""_blank"" href=""https://pt.wikipedia.org/wiki/M%C3%A1quina_de_Antic%C3%ADtera"">Máquina de Anticítera</a>, um computador analógico para prever posições 
astronômicas e eclipses (e uma das cartas do 
jogo).</p><p><strong>O que nós queremos?</strong></p><p>Difundir o conhecimento sobre a História da Computação, popularizando acontecimentos, descobertas importantes, personalidades e instituições que contribuíram para a Computação como ela é hoje. Acreditamos no potencial dos jogos ""analógicos"", como os jogos de cartas, que são capazes de reunir pessoas em um mesmo espaço físico para se divertirem e aprenderem juntas.</p><p><strong>Por que História da Computação?</strong></p><ol><li>O ensino de História da Computação é fundamental para compreender que os eventos não estão individualizados, que por muitas vezes são complexos e que influenciam significativamente o saber atual. É preciso possuir um quadro que os reúna para ter-se uma ideia geral, coerente e significativa.</li><li>O estudo da História da Computação sob a ótica das ideias e conceitos que formaram a base do desenvolvimento da Computação pode contribuir para sensibilizar e entusiasmar sobre a importância dos fundamentos teóricos, e o desenvolvimento de software e tecnologia de qualidade.</li><li>É possível compreender a História da Computação como uma forma de olhar para trás com o intuito de descobrir paralelismos e analogias com a tecnologia moderna e assim, proporcionar uma base potencial para uma atividade futura ou atual.</li><li>O resgate humano e o destaque da História da Computação tem sido valorizados por instituições governamentais e iniciativas privadas em todo o mundo, por meio de homenagens, criação de museus, etc.</li><li>Toda tecnologia disponível foi desenvolvida por pessoas reais, cada uma acrescentando sua pequena ou grande contribuição. Sem a compreensão do fator humano da Computação, não é possível entender a trajetória histórica da área, nem o seu possível desenrolar futuro.</li></ol><p><strong></strong></p><p>É possível ainda, acrescentar a possibilidade de atração de novos talentos para a Computação, motivados pelo fator inspirador que o ensino das histórias dos grandes feitos computacionais e personalidades podem promover.</p><p><img src=""https://s3-sa-east-1.amazonaws.com/cdn.br.catarse/uploads/redactor_rails/picture/data/62405/Sem-T%C3%ADtulo-1.png""></p><p><strong><br></strong></p><p><strong>Quem criou o jogo?</strong></p><p>			O Computasseia é um jogo desenvolvido no <a href=""http://www.ic.ufmt.br/laborat%C3%B3rio-de-ambientes-virtuais-interativos-lavi"" title=""Link externo para o site do LAVI"" target=""_blank"">Laboratório de Ambientes Virtuais Interativos (LAVI)</a> na <a href=""http://www.ufmt.br/ufmt/site/"" title=""Link externo para o site da UFMT"" target=""_blank"">Universidade Federal de Mato Grosso (UFMT)</a>. O jogo foi concebido em 2016 pela professora Karen Figueiredo e elaborado em conjunto com o estudante voluntário de Iniciação Científica Jean Carlos.</p><p style=""text-align: center;""><img src=""https://s3-sa-east-1.amazonaws.com/cdn.br.catarse/uploads/redactor_rails/picture/data/62407/DSC04516.JPG"" width=""388"" height=""263""></p><p><strong>Por que apoiar?</strong></p><p>O Computasseia é um projeto criado e desenvolvido no ambiente universitário, sem fins lucrativos, mas com um grande objetivo educacional e cultural. Contamos com o seu apoio para propagar a nossa ideia e para que mais pessoas possam ter acesso ao jogo.</p>",jogocomputasseia,,,Educação,31,https://s3-sa-east-1.amazonaws.com/cdn.br.catarse/uploads/project/uploaded_image/37697/bbbbbbbbbbbb.png,https://s3-sa-east-1.amazonaws.com/cdn.br.catarse/uploads/project/uploaded_image/37697/project_thumb_thumb_bbbbbbbbbbbb.png,https://s3-sa-east-1.amazonaws.com/cdn.br.catarse/uploads/project/uploaded_image/37697/project_thumb_small_bbbbbbbbbbbb.png,https://s3-sa-east-1.amazonaws.com/cdn.br.catarse/uploads/project/uploaded_image/37697/project_thumb_large_bbbbbbbbbbbb.png,https://s3-sa-east-1.amazonaws.com/cdn.br.catarse/uploads/project/uploaded_image/37697/project_thumb_video_cover_bbbbbbbbbbbb.png,0,0,0,0,online,flex,published,"2017-01-02 01:59:59.999999","2017-01-01 23:59:59.999999","2016-09-22 17:13:56.697902","2016-09-22 14:13:56.697902",,t,f,t,101,"{""total"" : 98, ""unit"" : ""days""}","{""total"" : 2, ""unit"" : ""days""}",0,"{""city"" : ""Cuiabá"", ""state_acronym"" : ""MT"", ""state"" : ""Mato Grosso""}","{""id"" : 607440, ""name"" : ""Computasseia""}",0,,f,f,0,f,f,f