project_id,id,user_id,name,headline,budget,goal,about_html,permalink,video_embed_url,video_url,category_name,category_id,original_image,thumb_image,small_image,large_image,video_cover_image,progress,pledged,total_contributions,total_contributors,state,mode,state_order,expires_at,zone_expires_at,online_date,zone_online_date,sent_to_analysis_at,is_published,is_expired,open_for_contributions,online_days,remaining_time,elapsed_time,posts_count,address,user,reminder_count,is_owner_or_admin,user_signed_in,in_reminder,total_posts,can_request_transfer,is_admin_role,contributed_by_friends
37837,37837,608105,"Energia para África","Por uma chama de esperança | For a flame of hope","<p><img src=""https://s3-sa-east-1.amazonaws.com/cdn.br.catarse/uploads/redactor_rails/picture/data/58629/05.png""></p><p>O curso será oferecido na modalidade EaD, em português e inglês, em uma carga horária de 110h (aproximadamente 3 meses), distribuídas em 3 unidades. Em cada unidade serão adotadas estratégias de ensino como fóruns, estudos de caso articulados à situações práticas, produções compartilhadas e individuais. Ao final do curso, o aluno será capaz de:</p><ul><li>Compreender o conceito de Energias Renováveis e sua relevância no contexto atual.</li><li>Identificar as principais fontes de energia renovável.</li><li>Compreender e aplicar o processo de produção de biogás e bioconversão.</li><li>Compreender e aplicar o processo de conversão de energia.</li><li>Demonstrar as formas de utilização do biogás em território africano.</li><li>Entender as demandas técnicas, administrativas e econômicas para a gestão de projetos de biogás.</li><li>Realizar a gestão de projetos de biogás.</li></ul><p><img src=""https://s3-sa-east-1.amazonaws.com/cdn.br.catarse/uploads/redactor_rails/picture/data/58631/06.png""></p><p>Após arrecadação, as inscrições serão abertas e divulgadas nos meios de comunicação criados pelo projeto. Os critérios para inscrição serão: domínio da língua inglesa ou portuguesa, ser nativo de um país africano em desenvolvimento, preencher o questionário socioeconômico que será disponibilizado e escrever uma carta de intenção que deve constar o porquê o candidato deseja ganhar a bolsa.</p><p>Todo material será avaliada por uma comissão julgadora, de acordo com critérios claramente divulgados.</p><hr><hr><p><img src=""https://s3-sa-east-1.amazonaws.com/cdn.br.catarse/uploads/redactor_rails/picture/data/60227/05-.png""></p><p>The course will be offered in the ODL (Open and Distance Learning) modality, in Portuguese and English, with an educational training load of 110 hours (approximately three months), distributed into three units. In each unit, the educational strategies involving forums, case studies correlated to practical situations, and shared and individual productions will be adopted. At course conclusion, students will be able to:<br></p><ul><li>Understand the Renewable Energy concept and its significance in the contemporary context.</li><li>Identify the main sources of renewable energy.</li><li>Understand and apply the process involved in biogas production and bioconversion.</li><li>Understand and apply the energy conversion process.</li><li>Demonstrate ways for biogas utilization in the African territory.</li><li>Understand the technical, administrative and economic demands involved in the management of biogas projects.</li><li>Conduct the management of biogas projects.</li></ul><p><img src=""https://s3-sa-east-1.amazonaws.com/cdn.br.catarse/uploads/redactor_rails/picture/data/60228/06-.png""></p><p>After collection, enrollment will be opened and publicized on the Project media. For course enrollment, candidates are required to: be proficient in the English or Portuguese language, be a native born citizen of a developing country in Africa, fill in the social-economic questionnaire that will be made available, and write a letter of intent in which the candidate explains why he/she wants to be granted a scholarship.</p><p>The submitted material will be evaluated by a Judging Commission in accordance with clearly diffused criteria.</p>",20000.0,"<p><img src=""https://s3-sa-east-1.amazonaws.com/cdn.br.catarse/uploads/redactor_rails/picture/data/58612/01.png""></p><p><strong>Ajude-nos
a levar conhecimento sobre biogás a africanos e fazer com que eles
gerem a própria energia, tenham biofertilizante e saneamento básico.</strong><strong></strong><br></p><p><strong><img src=""https://s3-sa-east-1.amazonaws.com/cdn.br.catarse/uploads/redactor_rails/picture/data/58613/02.png""><span class=""redactor-invisible-space""><br></span></strong></p><p>
O
brilho nos olhos de quem nunca viu funcionar um fogão a gás. A
força de quem corre o risco de ser atacado por animais para buscar
lenha. Problemas respiratórios causados pela queima da lenha dentro
das residências. Não é apenas um, são muitos que passam por isso
- todos os dias - no segundo continente mais populoso do mundo: a
África.Levar
conhecimento - por meio de um curso de Educação a Distância, em
português e inglês, onde 50 líderes comunitários poderão
aprender a gerar sua própria energia com dejetos de animais,
produzir biofertilizante para utilização em pequenas plantações
e, ainda, fomentar o saneamento básico em suas comunidades.</p><p>Isso
poderá mudar vidas em um local onde dos trinta países com mais
problemas de subnutrição, analfabetismo e baixa expectativa de
vida, 21 deles são africanos.</p><p>E
por isso precisamos – muito – de você, para seguir no desafio de
disseminar conhecimento e mudar a realidade de tantos por meio das
energias geradas pelo biogás.</p><p><strong>Conhecimento é mais que poder. Ele muda vidas.</strong></p><p><strong>E você pode contribuir para essa mudança.</strong></p><p><strong><em><img src=""https://s3-sa-east-1.amazonaws.com/cdn.br.catarse/uploads/redactor_rails/picture/data/58616/03.png""></em></strong><br></p><p>Mais
importante que modificar realidades a qualquer custo é dar condições
para que as pessoas possam ser protagonistas de todo
esse processo, transformando vidas, sabendo exatamente os anseios e
as necessidades de suas comunidades.</p><p>O
curso Energias do Biogás será ofertado na modalidade Ensino à
Distância - EaD, com arquivos mais leves que podem ser baixados e
lidos offline, para precaver de possíveis problemas causados pela
internet ruim. As atividades avaliativas serão totalmente
instrucionais e intuitivas, também para otimizar todo o tempo
possível.<br></p><p>O
objetivo é que o conhecimento produzido aqui seja compartilhado e
adaptado para a realidade africana.<br></p><p><img src=""https://s3-sa-east-1.amazonaws.com/cdn.br.catarse/uploads/redactor_rails/picture/data/58617/04.png""><br></p><p>Seu
nome é <strong>Bachir Afonso</strong>. Ele vive no Parque Nacional das Quirimbas, em
Moçambique, com 135 mil habitantes, onde 95% da população não tem
acesso à energia térmica e muito menos elétrica. “Viver sem
energia é uma pedra no sapato, que você nem consegue andar porque
lhe incomoda. E isso nos incomoda muito, porque sabemos que assim,
sem energia, nunca vamos conseguir melhorar a nossa vida”, desabafa
Bachir.</p><p><img src=""https://s3-sa-east-1.amazonaws.com/cdn.br.catarse/uploads/redactor_rails/picture/data/58651/08.png""></p><p>O
líder comunitário esteve no Brasil no ano passado e levou na
bagagem uma série de conhecimentos adquiridos no CIBiogás (Centro
Internacional de Energias Renováveis-Biogás), em Foz do Iguaçu
(PR). Ele passou um mês recebendo treinamentos e visitando pequenas
e grandes propriedades rurais que geram energia elétrica, térmica e
veicular por meio do biogás.</p><iframe style=""width: 500px; height: 281px;"" src=""//www.youtube.com/embed/Q0JX2W03fs0"" frameborder=""0"" allowfullscreen=""""></iframe><p>Quando
voltou para casa, conseguiu transformar todas as expectativas em
realidade e – aos poucos – está mudando a vida e a paisagem do
Parque das Quirimbas. Hoje, ele produz biogás, por meio de um
pequeno biodigestor, que utiliza para o cozimento de alimentos,
aproveitando o biofertilizante para adubar hortas comunitárias, que
antes eram muito pouco produtivas. “O biogás resolveu vários de
nossos problemas, porque é uma energia limpa e ambientalmente
amigável. Mudou muita coisa a nosso redor e para muito melhor”,
ressalta.</p><p><img src=""https://s3-sa-east-1.amazonaws.com/cdn.br.catarse/uploads/redactor_rails/picture/data/58640/09.png""><br></p><p>Para
ele o biogás é a solução perfeita, pois além de gerar energia
elétrica e gás de cozinha, o uso de resíduos de pescados, dejetos
e o esgoto para sua geração permite sanar outros grandes problemas,
como a redução de odores, infestação de insetos e roedores
causadores de doenças como a cólera e a malária.</p><p>O
biodigestor construído por ele, hoje, desempenha o papel de
demonstrar para outras comunidades as possibilidades do biogás.
“Tenho seis mil pessoas que trabalham diretamente comigo. Eu os
convidei para virem até a minha aldeia e conhecer a iniciativa.
Assim podem replicar este conhecimento para toda a província”,
finaliza com um largo sorriso no rosto.</p><iframe style=""width: 500px; height: 281px;"" src=""//www.youtube.com/embed/tfCLdA4fvnU"" frameborder=""0"" allowfullscreen=""""></iframe><p>A ideia é que os líderes comunitários contemplados pelos cursos tenham o compromisso de replicar esse conhecimento para outras pessoas, de outros lugares. Assim, cada vez mais gente será beneficiada por essa tecnologia.</p><p><img src=""https://s3-sa-east-1.amazonaws.com/cdn.br.catarse/uploads/redactor_rails/picture/data/58633/07.png""><br></p><p>O
biogás é uma mistura de gases composta principalmente por metano e
dióxido de carbono, obtida normalmente através do tratamento de
resíduos domésticos, agropecuários e industriais, por meio de
processo de biodegradação anaeróbia, ou seja, na ausência de
oxigênio.</p><p>Em
uma comunidade, como as que pretendemos alcançar no continente
africano, o processo de formação do biogás reduziria a poluição
do ambiente e consequentemente as doenças transmitidas pela falta de
saneamento e esgoto adequados (tratamento de biomassa), produziria
adubo orgânico (resíduos não utilizados na produção de biogás)
e biogás, que poderia ser utilizado para a utilização térmica
(que reduziria a queima de florestas) ou elétrica, ambas com grande
deficit de produção no continente africano.<br></p><hr><hr><p><strong><strong>Help us bring African people
knowledge about biogas so they can then produce their own energy, use
their fertilizer and be provided with basic sanitation.</strong></strong><br></p><p><strong><img src=""https://s3-sa-east-1.amazonaws.com/cdn.br.catarse/uploads/redactor_rails/picture/data/58652/02-.png""><br></strong></p><p><strong></strong>The glittering eyes of one who had never seen a cookng stove. The strength behind the face of one who undergoes the daily risk of being attacked by wild animals on the way in search of firewood. Not only one, but many are those who undergo the same routine – each and every day – in the second most populous continent on Earth: Africa.</p><p>The provision of knowledge – An Open and Distance Learning – ODL course, in Portuguese and English, in which 50 community leaders can learn on how to generate one’s own energy with the utilization of animal manure, produce biofertilizer for utilization in small crops and promote basic sanitation in their communities.</p><p>Such initiative can change lives in communities of 30 countries with the highest amount of problems related to undernourishment, illiteracy and low life expectancy in the world, 21 of which in Africa.   </p><p>Therefore, we really need you. Together we can face the challenge of going forwards with knowledge diffusion and the promotion of a new reality to many ones on the basis of biogas energy generation. </p><p><strong>Knowledge surpasses power. It changes life... and you can contribute to it. </strong></p><p><strong></strong></p><p><img src=""https://s3-sa-east-1.amazonaws.com/cdn.br.catarse/uploads/redactor_rails/picture/data/58653/03-.png""></p><p>More important than changing realities
at any cost is to provide conditions for eople to be, themselves,
the protagonists of the whole changing process, thus transforming
lives with a broader and clearer perception of the aspirations and
needs of their communities. 
</p><p>The Biogas Energies course will be
offered in the Open and Distance Learning – ODL modality so as to
avoid problems with limited interned connection. Evaluation
activities will be conducted in a totally instructional and intuitive
manner for the additional benefit of time optimization.<br></p><p>The core objective is that the
knowledge produced can be shared and adapted to the African reality.<br></p><p><img src=""https://s3-sa-east-1.amazonaws.com/cdn.br.catarse/uploads/redactor_rails/picture/data/58655/04-.png""></p><p>
<font>His
name is <strong>Bachir Afonso</strong>. He lives at Quirimbas National Park, in
Mozambique, an area with 135 thousand inhabitants, where 95% of the
population has no access to thermal energy. In fact, the percentage
is even higher in relation to electric power. “To live without
energy provision is like having a little stone in shoe that won’t
let you move forwards because it hurts. And this reality hurts us a
lot because we know that this way, without energy, we will never
succeed in improving our lives”, Bachir says, as if getting that
off his chest.</font></p><p><font>This
community leader was in Brazil last year and finally brought home
significant pieces of knowledge acquired at CIBiogás (International
Center on Renewable Energies – Biogas), in the Paraná State city
of Foz do Iguaçu. His one month course period involved training and
visits to small and large rural properties that generate their own
electric, thermal and vehicle energy by means of biogas.</font></p><p><font>
<font>After
coming back home, he could transform each aspiration into reality
and, step by step, they have been changing lives and landscapes on
Quirimbas Park. By means of a small biodigester, he now produces
biogas, which is used for cooking purposes, whereas the resulting
biofertilizer is utilized in the community crops, which had been
previously very little productive.. “Biogas came to solve several
of our problems, since it is a clean and environmentally friendly
energy. Many things around us have changed, and for much better”,
he highlights.</font></font></p><p><font><font>
For
him, biogas is the perfect solution. In fact, besides generating
electric energy and cooking gas, its demand for fish residues, manure
and sewage as raw materials allows for the solution to other big
problems, such as the reduction of odors and infestation by insects
and rodents, responsible for the transmission of illnesses such as
cholera and malaria.</font></font></p><p><font><font>Currently,
the biodigester he constructed plays the role of a demonstration unit
to allow for the people of other communities to perceive biogas
possibilities. I have a close work relationship with six thousand
people. I invited them to come over, visit my community, and get to
know the initiative. So, in this way they can replicate this
knowledge throughout the whole Province”, he concludes with a smile
on his face.</font></font></p><p><font><font>The
idea is that community leaders awarded with a course commit
themselves towards replicating this acquired knowledge with other
people, from various other places. Consequently, more and more people
will benefit from this technology.</font></font></p><p><font><font>Biogas is a gas mixture, basically
composed of methane and carbon dioxide, which is usually obtained
through the treatment of domestic, agricultural and industry wastes
by means of a process called anaerobic biodegradation, that is, a
process occurring in the absence of oxygen.</font></font></p><p><font><font>In the communities we intend to reach,
such as those located in the African continent, the biogas formation
process would reduce environment pollution and, consequently, the
presence of illnesses transmitted in places without adequate sanitary
treatment and sewage system (biomass treatment). It would also
produce organic fertilizer (residues not utilized in biogas
production) in addition to the biogas production, which could be
directed for thermal utilization (thus reducing forest burning) or
electric power generation, two aspects in which there is an
expressive production deficit in the African continent.<br></font></font></p>",energytoafrica,//www.youtube.com/embed/9iXIIfX3K3Y,https://www.youtube.com/watch?v=9iXIIfX3K3Y&index=1&list=PL1iXSGbxwErClhJtoUyez3iYpaMz2UJUE,Educação,31,https://s3-sa-east-1.amazonaws.com/cdn.br.catarse/uploads/project/uploaded_image/37837/card-financiamento-1000.png,https://s3-sa-east-1.amazonaws.com/cdn.br.catarse/uploads/project/uploaded_image/37837/project_thumb_thumb_card-financiamento-1000.png,https://s3-sa-east-1.amazonaws.com/cdn.br.catarse/uploads/project/uploaded_image/37837/project_thumb_small_card-financiamento-1000.png,https://s3-sa-east-1.amazonaws.com/cdn.br.catarse/uploads/project/uploaded_image/37837/project_thumb_large_card-financiamento-1000.png,https://s3-sa-east-1.amazonaws.com/cdn.br.catarse/uploads/project/uploaded_image/37837/project_thumb_video_cover_card-financiamento-1000.png,23.45000000000000000000,4690.0,49,45,online,aon,published,"2016-10-01 02:59:59.999999","2016-09-30 23:59:59.999999","2016-08-01 14:13:55.484886","2016-08-01 11:13:55.484886",,t,f,t,60,"{""total"" : 5, ""unit"" : ""days""}","{""total"" : 54, ""unit"" : ""days""}",3,"{""city"" : ""Foz do Iguaçu"", ""state_acronym"" : ""PR"", ""state"" : ""Paraná""}","{""id"" : 608105, ""name"" : ""CIBiogás""}",1,,f,f,3,f,f,f