project_id,id,user_id,name,headline,budget,goal,about_html,permalink,video_embed_url,video_url,category_name,category_id,original_image,thumb_image,small_image,large_image,video_cover_image,progress,pledged,total_contributions,total_contributors,state,mode,state_order,expires_at,zone_expires_at,online_date,zone_online_date,sent_to_analysis_at,is_published,is_expired,open_for_contributions,online_days,remaining_time,elapsed_time,posts_count,address,user,reminder_count,is_owner_or_admin,user_signed_in,in_reminder,total_posts,can_request_transfer,is_admin_role,contributed_by_friends
3815,3815,85747,"Microssérie Aventura na Escola","Ele fez da prisão uma escola. Microssérie brasileira de ficção científica e drama, em 3 capítulos.","O orçamento para projetos anteriores a 24/02/2015 normalmente pode ser encontrado na descrição acima.",4825.0,"<p>Aventura na Escola contará a história de Breno, pacato rapaz mineiro que cresce em sua cidade sem muita perspectiva de futuro. Subestimado pelos parentes e ridicularizado por suas relações de amizade, surpreende a todos com a entrada na universidade mais importante de seu país.</p>

<p>Alguém que não é aceito, que se sente diferente desde criança, nem sempre se torna uma vítima. Mas pode se transformar em algoz. Na capital Belo Horizonte, o protagonista se torna um bad boy, mas logo percebe que quem machuca, é o maior machucado. Em BH Breno encara seus demônios, aponta o dedo, paga suas dívidas e, enquanto enche seu copo, admite que não é tão inocente. Ao olhar no espelho, ele lhe diz a verdade: é necessário crescer.</p>

<p>Porque essas lições precisam ser aprendidas de uma maneira difícil? São necessários dois lados para cada história? Qual a saída? Aventura na Escola responde a essas perguntas através de um belíssimo roteiro, imagens viscerais, e fotografia madura. Aventure-se nessas palavras. Breno não poderá mais continuar ignorando os ensinamentos de vida.</p>

<p>Gênero: Ficção científica/Drama
Censura: 14 anos, por conter insinuação sexual
Apresentando: Breno Custódio</p>

<hr>

<p>Com o objetivo de desenvolver com a sociedade habilidades expressivas, criativas e críticas, num diálogo com a cultura contemporânea; e exercitar dinâmicas criativas que envolvam pesquisa, elaboração conceitual, produção e análise psicológica de exercícios propostos, foi criada a microssérie Aventura na Escola. A série, em três capítulos oferecerá fundamentos para a compreensão e elaboração do sentido da vida através da conceituação e referenciação cultural, especialmente nos fluxos entre design, arte contemporânea e as dinâmicas de amor.</p>

<p>Em apenas dois meses (que já está rolando), você pode contribuir para esse projeto e pode acreditar: não esqueceremos jamais daqueles que foram responsáveis pelo pontapé inicial desse veículo. E isso não é só no futuro! Existem recompensas dedicadas a você que investirá em nós. Apoie, divulgue, comente: quanto mais gente souber do projeto, maior sua chance de receber a recompensa que escolher. O link do nosso projeto no site de colaboração Catarse é <a class=""alt-link"" href=""http://www.catarse.me/aventuranaescola"" target=""_blank"">www.catarse.me/aventuranaescola</a>.</p>

<p>Catarse é um &quot;chapéu moderno&quot;, um modo de fazer com que se realizem projetos voltados para a cultura, por meio de um financiamento coletivo: cada um dá o pouquinho que estiver ao seu alcance, divulga aos amigos e torna realidade projetos culturais de amplo alcance, que não aconteceriam sem o engajamento dos que se interessam pela arte. Caso a meta de arrecadação não seja alcançada, quem contribuiu recebe o dinheiro de volta.</p>

<p>Os idealizadores são recém-formados do curso de Design Gráfico da Universidade do Estado de Minas Gerais que trabalham com estratégia, design e marketing para negócios (EV Management), imagem ou evento, tendo já atingindo públicos segmentados de mais de 2.000.000 pessoas através de um forte planejamento concebido com uma metodologia própria, que incorpora conhecimentos das áreas de design, estratégia, marketing, gestão corporativa e branding. Um dos nossos agenciados é o ator principal da produção, Breno Custódio, e cede espaço em todas as suas mídias para divulgação espontânea das cotas de patrocínio:</p>

<p><a class=""alt-link"" href=""http://facebook.com/brenocustodio"" target=""_blank"">http://facebook.com/brenocustodio</a>
<a class=""alt-link"" href=""http://twitter.com/brenocustodio"" target=""_blank"">http://twitter.com/brenocustodio</a>
<a class=""alt-link"" href=""http://instagram.com/brenocustodio"" target=""_blank"">http://instagram.com/brenocustodio</a>
<a class=""alt-link"" href=""http://gplus.to/brenocustodio"" target=""_blank"">http://gplus.to/brenocustodio</a>
<a class=""alt-link"" href=""http://brenocustodio.blogspot.com"" target=""_blank"">http://brenocustodio.blogspot.com</a></p>

<p>Esse processo de trabalho com as estruturas institucionais de compartilhamento renderam alguns clientes, outras dedicatórias e o resultado prático foi uma rede de proliferação, relações de organizações e infra-estrutura de arquitetura de informação. Nesse contexto nasceu a vontade de investir em <em>crowdfunding</em>, para dar vazão à ideia de conceber um registro audiovisual para falar sobre a vida, que conta com sua colaboração para ganhar vida.</p>

<p>A série é um projeto promissor digital que terá a periodicidade inicialmente de uma temporada em três capítulos. O tema será a vida. Sim, esse vasto campo de conhecimento, que, será reunido sob um determinado tema a cada edição, reunindo conhecimento psicológico sobre aquela especificidade no mundo inteiro e então, tornar acessível a produção audiovisual à humanidade e transmiti-la às próximas gerações em forma de legado. A microssérie já tem um domínio na internet, e perfis nas redes sociais - um voto de confiança daqueles que acreditam em nosso projeto quando ele ainda está no papel (<a class=""alt-link"" href=""http://www.twitter.com/aventuraescola"" target=""_blank"">http://www.twitter.com/aventuraescola</a> e <a class=""alt-link"" href=""http://www.facebook.com/aventuranaescola"" target=""_blank"">http://www.facebook.com/aventuranaescola</a>) e tem tudo para crescer e dar certo!</p>

<p>O ORÇAMENTO (VOLTADO EM SUA TOTALIDADE PARA A PÓS PRODUÇÃO)
A ideia é reunir conhecimento completo sobre uma esfera da vida a cada temporada e fazer esse conhecimento acessível ao mundo através de uma websérie digital, com uma dedicação e precisão digna no design, edição e computação gráfica. Nessa primeira temporada, por exemplo, que pedimos sua ajuda para sua realização, haverá um momento de ficção científica entre a trama. Iremos explorar o tema da temporada, &quot;aprendizados da vida&quot; até a última instância - quanto mais específico (<strong>carecemos do orçamento dado, de R$4825,00</strong>), conseguiremos falar de detalhes, aumentar o foco. Observaremos, analisaremos, desmontaremos, descontruiremos. Incluiremos e mencionaremos nas matérias cada detalhe que, em nossa opinião, tornará o centro da história com uma trama interessante e madura; observaremos perspectivas no roteiro com especificidade, foco e precisão.</p>

<p>Os resultados se transformarão numa microssérie em três capítulos (que juntas formam um curta-metragem), reunindo imagens em movimento e textos compilados das gravações em uma ordem lógica que reforce sua maneira de descrever o objeto da temporada. Desenvolveremos uma linguagem para apresentar cada cena, como visualizar e tornar claro para todos os públicos, explicar aos potenciais fãs a maneira da microssérie ver as coisas e abrir o interesse dos mesmos para participarem ativamente enviando sugestões acerca do próximo tema a ser retratado, numa futura temporada talvez. Usaremos imagens e textos, considerando como eles se relacionam e o balanço e predomínio das informações. Técnicas, definições, navegação pelo conteúdo e referências farão parte da metodologia da Microssérie AE.</p>

<p>&quot;Aventura na Escola&quot; será uma ferramenta de pesquisa profissional para todos, inclusive pra próxima geração de profissionais da psicologia, das artes cênicas e da informação. Além dos nossos perfis pessoais, a série/filme (à priore, em formato digital), será divulgada num poderosíssimo mailing e network! Todas as páginas que estão no portfolio de nosso escritório estão dispostas a divulgarem o link para a produção em cada período.</p>

<p><strong>Você pode contribuir clicando em QUERO APOIAR ESSE PROJETO, através de Paypal ou MoiP (boleto, cartão de crédito e pagamento por celular). O legal é que o Catarse exige que CADA VALOR DE DOAÇÃO TENHA UMA RECOMPENSA ESPECÍFICA. E nada melhor que honrar aqueles que apoiarem essa &quot;Aventura na Escola&quot; antes dela tomar gás e vida própria, com publicidade na própria produção e também no nosso portal (redes).</strong></p>

<p><strong>Sua ajuda é certa e segura: Caso o valor total não seja atingido, o Catarse devolve para sua conta bancária o que você doou. Ou seja, é tudo ou nada! Precisamos de você. Caso as contribuições passem do requisitado, iremos investir numa versão com um segundo idioma (inglês provavelmente) da produção. Investiremos o necessário para que nosso projeto ganhe força.</strong></p>

<p>De hoje, até a duas semanas (25 de maio), você tem a oportunidade de investimento nessa promissora série. Nossa retribuição será comunicar e veicular seu nome internamente, junto à equipe de parceiros e colaboradores, e externamente, junto à fãs, clientes e ao mercado através de nossas produções.</p>
",aventuranaescola,//www.youtube.com/embed/UuiMnty4-mI,http://www.youtube.com/watch?v=UuiMnty4-mI,"Cinema e Vídeo",13,https://s3-sa-east-1.amazonaws.com/cdn.br.catarse/uploads/project/uploaded_image/3815/aventuranaescola_film.jpg,https://s3-sa-east-1.amazonaws.com/cdn.br.catarse/uploads/project/uploaded_image/3815/project_thumb_thumb_aventuranaescola_film.jpg,https://s3-sa-east-1.amazonaws.com/cdn.br.catarse/uploads/project/uploaded_image/3815/project_thumb_small_aventuranaescola_film.jpg,https://s3-sa-east-1.amazonaws.com/cdn.br.catarse/uploads/project/uploaded_image/3815/project_thumb_large_aventuranaescola_film.jpg,https://s3-sa-east-1.amazonaws.com/cdn.br.catarse/uploads/project/uploaded_image/3815/project_thumb_video_cover_aventuranaescola_film.jpg,3.31606217616580310900,160.0,2,2,failed,aon,finished,"2014-07-30 02:59:59","2014-07-29 23:59:59","2014-05-30 18:27:12.284353","2014-05-30 15:27:12.284353",,t,t,f,60,"{""total"" : 0, ""unit"" : ""seconds""}","{""total"" : 60, ""unit"" : ""days""}",0,"{""city"" : ""Belo Horizonte"", ""state_acronym"" : ""MG"", ""state"" : ""Minas Gerais""}","{""id"" : 85747, ""name"" : ""Breno C. Martins""}",0,,f,f,0,f,f,f