project_id,id,user_id,name,headline,budget,goal,about_html,permalink,video_embed_url,video_url,category_name,category_id,original_image,thumb_image,small_image,large_image,video_cover_image,progress,pledged,total_contributions,total_contributors,state,mode,state_order,expires_at,zone_expires_at,online_date,zone_online_date,sent_to_analysis_at,is_published,is_expired,open_for_contributions,online_days,remaining_time,elapsed_time,posts_count,address,user,reminder_count,is_owner_or_admin,user_signed_in,in_reminder,total_posts,can_request_transfer,is_admin_role,contributed_by_friends
38208,38208,608669,"Cruzada Farroupilha","Cruzada Farroupilha
No rastro dos heróis de 35
","<p>No primeiro
momento serão lançados 1000 (mil) exemplares do livro com 130 páginas, e
1000 (mil) DVDs com uma hora e vinte minutos de duração, com imagens,
fotos e registros que tornaram o projeto de caráter oficial. Sendo que os
primeiros 100 cem comercializados, o valor será revertido a Santa Casa de Caridade
de Alegrete de forma integral. Do restante, 50% serão distribuídos para as
escolas Estaduais, municipais, bibliotecas e entidades afins, como escolas
privadas, universidades, museus, e entidades filantrópicas.</p>",12000.0,"<p><strong>JUSTIFICATIVA:</strong></p>  <p>Desde os tempos imemoriais, as Cruzadas tiveram sempre a intenção de chamar a atenção para determinadas causas políticas, religiosas, étnicas e outras com propósitos de ampliar fronteiras quando os territórios da Europa, Oriente Médio e parte da Ásia estavam sendo delimitados. Foi inspirado nas Cruzadas mais nobres da humanidade que o historiador, poeta, intérprete e radialista João Fontoura (o Cabo João), idealizou essa inédita iniciativa histórica e cultural que denominou de “Cruzada Farroupilha”. O simbolismo do gesto vai muito além do percurso que liga os três municípios que, no passado, foram capitais de um sonho que mobilizou a então Província de São Pedro e que, até os nossos dias, é reverenciado como uma atitude de extrema coragem, ousadia e determinação de um povo. Reviver essa trilha demarcada pelos Farrapos no mês de setembro, não é uma mera coincidência... é, exatamente neste período do ano que o sentimento de reverência à epopeia farrapa, faz o povo demonstrar seu orgulho gaúcho, que o nosso solitário cavaleiro  percorreu os 523 quilômetros que ligam os históricos municípios de Piratini, Caçapava do Sul e Alegrete.</p>  <p><strong>OBJETIVOS DO PROJETO:</strong></p>  <p>Do ponto de vista histórico, cultural e turístico, a Cruzada será ( em livro e DVD), um eficaz instrumento de divulgação desses municípios no contexto da mais importante revolução da nossa história. A repercussão da iniciativa junto à mídia estadual, regional e em âmbito dos municípios localizados ao longo do percurso, proporcionaram naturalmente a abordagem de muitos dos valores defendidos pelos farroupilhas. A Cruzada Farroupilha, pelo seu formato incomum e por observar um trajeto que ilustra geograficamente o início da Proclamação da República Rio-grandense, nos campos dos Menezes, hoje município de Hulha Negra, passando por Piratini, Caçapava e Alegrete, as três capitais da República Farroupilha, reúne elementos de forte apelo histórico e cultural para firmar-se como um evento que poderá figurar no calendário turístico do Estado. São Gabriel, defendem algumas correntes de pesquisadores, embora não apareça na condição de capital, teria sediado de forma interina e itinerante as deliberações do governo, que eram despachadas sobre uma carreta. Outros aspectos importantes da revolução abordados pelo autor do projeto que, na condição de pesquisador e com formação acadêmica em História, realizou, em parceria com as Secretarias de Educação, todas as cidades que estiveram na rota da Cruzada, foram contempladas com a palestra, “a influência da Revolução Farroupilha na cultura do povo gaúcho”. Esse evento foi aberto a todas as comunidades, mas, principalmente, aos estudantes. </p>  <p><strong>OBJETIVOS ESPECIFICOS:</strong></p>  <p>Para que este significativo projeto seja conhecido e reconhecido de forma plena, estão sendo produzidos um Livro e um DVD, com relatos do próprio autor e vários depoimentos de profundos conhecedores de nossa história. O livro Cruzada Farroupilha, é uma síntese de tudo o que aconteceu durante os 20 dias de cavalgada. Onde o autor na condição de historiador, traz dados de fatos importantes que aconteceram no decênio Farroupilha, atualizando e trazendo novos questionamentos sobre estes fatos. O DVD, contém além de imagens dos eventos durante a trajetória do cavaleiro solitário, como palestras, shows, reinstalação das Capitais e alguns trechos do trajeto percorrido sobre o lombo de dois cavalos, muitas fotos e relatos manifestados, por jornalistas, repórteres, ( programa da RBS como Jornal do Almoço e outros) e tradicionalistas, que só ratificam a importância da Cruzada Farroupilha.</p>",cruzadafarroupilha,,,Literatura,20,https://s3-sa-east-1.amazonaws.com/cdn.br.catarse/uploads/project/uploaded_image/38208/Sem_título.jpg,https://s3-sa-east-1.amazonaws.com/cdn.br.catarse/uploads/project/uploaded_image/38208/project_thumb_thumb_Sem_título.jpg,https://s3-sa-east-1.amazonaws.com/cdn.br.catarse/uploads/project/uploaded_image/38208/project_thumb_small_Sem_título.jpg,https://s3-sa-east-1.amazonaws.com/cdn.br.catarse/uploads/project/uploaded_image/38208/project_thumb_large_Sem_título.jpg,https://s3-sa-east-1.amazonaws.com/cdn.br.catarse/uploads/project/uploaded_image/38208/project_thumb_video_cover_Sem_título.jpg,0.08333333333333333300,10.0,1,1,failed,aon,finished,"2016-09-21 02:59:59.999999","2016-09-20 23:59:59.999999","2016-07-22 20:42:28.019497","2016-07-22 17:42:28.019497",,t,t,f,60,"{""total"" : 0, ""unit"" : ""seconds""}","{""total"" : 60, ""unit"" : ""days""}",0,"{""city"" : ""Alegrete"", ""state_acronym"" : ""RS"", ""state"" : ""Rio Grande do Sul""}","{""id"" : 608669, ""name"" : ""Cruzada Farroupilha""}",0,,f,f,0,f,f,f