project_id,id,user_id,name,headline,budget,goal,about_html,permalink,video_embed_url,video_url,category_name,category_id,original_image,thumb_image,small_image,large_image,video_cover_image,progress,pledged,total_contributions,total_contributors,state,mode,state_order,expires_at,zone_expires_at,online_date,zone_online_date,sent_to_analysis_at,is_published,is_expired,open_for_contributions,online_days,remaining_time,elapsed_time,posts_count,address,user,reminder_count,is_owner_or_admin,user_signed_in,in_reminder,total_posts,can_request_transfer,is_admin_role,contributed_by_friends
38212,38212,147771,"1ª Edição impressa da Diversifica","Ajude a materializar o trabalho de diversos artistas e pesquisadores. Representatividade importa!","<p><img src=""https://s3-sa-east-1.amazonaws.com/cdn.br.catarse/uploads/redactor_rails/picture/data/59053/13838546_1341716049190268_1070657575_o.jpg""></p>",5000.0,"<p><img src=""https://s3-sa-east-1.amazonaws.com/cdn.br.catarse/uploads/redactor_rails/picture/data/58891/_MadeInFavela_-_2.jpg""><br></p><p style=""margin-left: 180px;"">(Modelos: Lucas Souza e Mychel Beckhtold. Foto: Lane Silva)<br></p><blockquote class=""fontsize-base quote"" style=""text-align: justify; margin-left: 180px;""></blockquote><hr><blockquote class=""fontsize-base quote"" style=""text-align: justify; margin-left: 180px;""><br></blockquote><p>Esta campanha pretende criar a primeira edição impressa da revista Diversifica. Somos um meio de informação científico, político e artístico que tange, de forma democrática e inclusiva, questões de gêneros e diversidades sexuais.<br></p><p>Visando consolidar a prática da produção crítica e o
intercâmbio de ideias criativas e propostas edificadoras, criamos a revista
Diversifica esperando assim estabelecer um canal de divulgação artística e de
formação social, tendo como bases a cidadania e a inclusão sob a óptica da
diversidade.<br></p><p>A Diversifica é uma construção colaborativa. Ela é feita por
diversas pessoas que com muita boa vontade nos enviam materiais, são pessoas
que muitas vezes estão anônimas, estão em seus quartos gritando para serem
ouvidas.  Somos assim esta ponte entre o autor
e o leitor.<br></p><p>Nós já estamos em nossa 6ª edição online e sentimos que é hora de construirmos também um material impresso. Nesta primeira edição impressa, além de utilizar o material
das edições anteriores, enaltecendo o trabalho dos tantos artistas e
pesquisadores que já contribuíram com a nossa revista, pretendemos abrir uma
chamada para recebermos novos trabalhos, dando a oportunidade para outros
colaboradores participarem. <br></p><p>Todas as seis edições online da Diversifica estão disponíveis em:</p><p><a href=""http://www.diversifica.com.br/"">http://www.diversifica.com.br/</a></p><p><img src=""https://s3-sa-east-1.amazonaws.com/cdn.br.catarse/uploads/redactor_rails/picture/data/58889/o_projeto__4_.png""></p><p><br></p><p><img src=""https://s3-sa-east-1.amazonaws.com/cdn.br.catarse/uploads/redactor_rails/picture/data/58944/13177075_1129123790451647_1504264607286204481_n.jpg""><br></p><p>Além da primeira edição impressa da revista Diversifica, será possível receber várias outras recompensas, todas elas contendo materiais do acervo da Diversifica, feitas a partir de trabalhos de diversos artistas.</p><p><img src=""https://s3-sa-east-1.amazonaws.com/cdn.br.catarse/uploads/redactor_rails/picture/data/58947/13652581_1341596799202193_915453917_n.jpg""></p><p><br></p><p>Para o caso das recompensas do tipo publicidade, entraremos em contato.</p><p><br></p><p style=""text-align: center;""><strong><img src=""https://s3-sa-east-1.amazonaws.com/cdn.br.catarse/uploads/redactor_rails/picture/data/58946/o_projeto__6_.png""><br></strong></p><p>Confira abaixo alguns exemplos retirados da versão online da Diversifica:</p><p><img src=""https://s3-sa-east-1.amazonaws.com/cdn.br.catarse/uploads/redactor_rails/picture/data/58886/Parada_16.jpg""></p><p><br></p><p><img src=""https://s3-sa-east-1.amazonaws.com/cdn.br.catarse/uploads/redactor_rails/picture/data/58885/Ninfa.jpg""><br></p><p><br></p><p><img src=""https://s3-sa-east-1.amazonaws.com/cdn.br.catarse/uploads/redactor_rails/picture/data/58887/Passibilidade_N%C3%A3o-bin%C3%A1ria.jpg""></p><p><br></p><p><img src=""https://s3-sa-east-1.amazonaws.com/cdn.br.catarse/uploads/redactor_rails/picture/data/58892/o_projeto__5_.png""></p><p>A equipe da Diversifica é formada principalmente por estudantes de graduação, de diversas áreas e diversos locais. A maior parte da equipe encontra-se na cidade de Sorocaba, interior de São Paulo. </p><p>Além da revista, a Diversifica procura realizar outras atividades como palestras, intervenções e exposições. sempre em busca de divulgar cada vez mais os materiais de seus colaboradores e também o de colocar no dia-a-dia das pessoas conteúdos relacionados com diversidade. </p><p>Para conhecer mais do trabalho da Diversifica curta a nossa página no facebook:</p><p><a href=""https://www.facebook.com/diversificaa/"">https://www.facebook.com/diversificaa/</a><br></p>",diversifica,//www.youtube.com/embed/uaEGyNA_axY,https://www.youtube.com/watch?v=uaEGyNA_axY,Artes,1,https://s3-sa-east-1.amazonaws.com/cdn.br.catarse/uploads/project/uploaded_image/38212/WhatsApp_Image_2016-08-18_at_12.30.15.jpeg,https://s3-sa-east-1.amazonaws.com/cdn.br.catarse/uploads/project/uploaded_image/38212/project_thumb_thumb_WhatsApp_Image_2016-08-18_at_12.30.15.jpeg,https://s3-sa-east-1.amazonaws.com/cdn.br.catarse/uploads/project/uploaded_image/38212/project_thumb_small_WhatsApp_Image_2016-08-18_at_12.30.15.jpeg,https://s3-sa-east-1.amazonaws.com/cdn.br.catarse/uploads/project/uploaded_image/38212/project_thumb_large_WhatsApp_Image_2016-08-18_at_12.30.15.jpeg,https://s3-sa-east-1.amazonaws.com/cdn.br.catarse/uploads/project/uploaded_image/38212/project_thumb_video_cover_WhatsApp_Image_2016-08-18_at_12.30.15.jpeg,6.10000000000000000000,305.0,11,11,online,flex,published,,,"2016-08-11 03:08:18.381618","2016-08-11 00:08:18.381618",,t,f,t,,"{""total"" : 0, ""unit"" : ""seconds""}","{""total"" : 45, ""unit"" : ""days""}",0,"{""city"" : ""Sorocaba"", ""state_acronym"" : ""SP"", ""state"" : ""São Paulo""}","{""id"" : 147771, ""name"" : ""Paco Sousa""}",0,,f,f,0,f,f,f