project_id,id,user_id,name,headline,budget,goal,about_html,permalink,video_embed_url,video_url,category_name,category_id,original_image,thumb_image,small_image,large_image,video_cover_image,progress,pledged,total_contributions,total_contributors,state,mode,state_order,expires_at,zone_expires_at,online_date,zone_online_date,sent_to_analysis_at,is_published,is_expired,open_for_contributions,online_days,remaining_time,elapsed_time,posts_count,address,user,reminder_count,is_owner_or_admin,user_signed_in,in_reminder,total_posts,can_request_transfer,is_admin_role,contributed_by_friends
38383,38383,611228,"""Um"", CD de lançamento de Ana Luísa Ramos","Ana Luísa Ramos lança seu primeiro CD solo! 
E você consegue comprar o seu aqui <3","<p>Os custos do projeto são:</p><li>arte gráfica</li><li>músicos para gravação</li><li>arranjo</li><li>mixagem</li><li>masterização</li><li>divulgação</li><li>direito autoral</li><li>frete de envio</li><li>impostos</li><li>prensagem do CD</li>",18000.0,"<p><img src=""https://s3-sa-east-1.amazonaws.com/cdn.br.catarse/uploads/redactor_rails/picture/data/68076/AnaLuisa_003_08_2016.jpg""><br></p><p>Esse CD contém apenas o que mais amo cantar. São músicas inéditas e 
releituras da música brasileira que tem em sua formação os instrumentos 
que mais gosto: violão, piano, contrabaixo, quarteto de cordas, flauta e
 percussão, além da voz.</p><p>São músicas que falam de momentos, 
refletindo sobre o passar dos dias e como a vida acontece, e como ela 
acontece, além do amor.</p><p>Tenho comigo os melhores parceiros para esse sonho acontecer e está ficando apaixonante. Cada detalhe é feito com muito carinho e muita dedicação.</p><p><br></p><p><iframe src=""//www.youtube.com/embed/hljG38rtjvs"" allowfullscreen="""" frameborder=""0"" height=""281"" width=""500""></iframe></p><p><iframe style=""width: 500px; height: 281px;"" src=""//www.youtube.com/embed/Zmz3aT5OTHM"" allowfullscreen="""" frameborder=""0""></iframe></p><p class=""fontsize-larger fontweight-semibold""><strong>Sobre Ana Luísa Ramos</strong><br></p><p>Após participar de diversos CDs e DVDs de diferentes músicos, enfim lanço meu primeiro álbum!</p><p>É um sonho se tornando realidade! São tantos anos cantando! Na realidade, esse ano faço 20 anos de carreira. E lançar esse CD é a melhor forma de comemorar esse aniversário de muitas cantorias e muita música.</p><p>Apesar
 de ter iniciado  meus estudos com música erudita, cantei em Corais por 
anos (profissionais e amadores) fiz Óperas, Concertos com Orquestra, sempre foi a música brasileira que mais amei. Poder cantar 
músicas em português e feitas pelos compositores que mais amo, não tem 
preço e é de fato um sonho se tornando realidade. </p><p>Agradeço 
imensamente ao Eric, Beto Grangeia, Daniel Bondaczuk, Adriano M. 
Franchini, Job Vinci Photo, Reverendo Aldo e tantos amigos e familiares 
que me apoiam nessa empreitada &lt;3</p><p>Vocês são demais!</p>",analuisaramos,//www.youtube.com/embed/zXw7tPgt1Tw,https://www.youtube.com/watch?v=zXw7tPgt1Tw,Música,16,https://s3-sa-east-1.amazonaws.com/cdn.br.catarse/uploads/project/uploaded_image/38383/AnaLuisa_016_08_2016.jpg,https://s3-sa-east-1.amazonaws.com/cdn.br.catarse/uploads/project/uploaded_image/38383/project_thumb_thumb_AnaLuisa_016_08_2016.jpg,https://s3-sa-east-1.amazonaws.com/cdn.br.catarse/uploads/project/uploaded_image/38383/project_thumb_small_AnaLuisa_016_08_2016.jpg,https://s3-sa-east-1.amazonaws.com/cdn.br.catarse/uploads/project/uploaded_image/38383/project_thumb_large_AnaLuisa_016_08_2016.jpg,https://s3-sa-east-1.amazonaws.com/cdn.br.catarse/uploads/project/uploaded_image/38383/project_thumb_video_cover_AnaLuisa_016_08_2016.jpg,2.55555555555555555600,460.0,11,11,online,flex,published,"2016-10-31 01:59:59.999999","2016-10-30 23:59:59.999999","2016-09-20 19:28:10.128912","2016-09-20 16:28:10.128912",,t,f,t,40,"{""total"" : 35, ""unit"" : ""days""}","{""total"" : 4, ""unit"" : ""days""}",0,"{""city"" : ""São Paulo"", ""state_acronym"" : ""SP"", ""state"" : ""São Paulo""}","{""id"" : 611228, ""name"" : ""Ana Luísa Ramos""}",4,,f,f,0,f,f,f