project_id,id,user_id,name,headline,budget,goal,about_html,permalink,video_embed_url,video_url,category_name,category_id,original_image,thumb_image,small_image,large_image,video_cover_image,progress,pledged,total_contributions,total_contributors,state,mode,state_order,expires_at,zone_expires_at,online_date,zone_online_date,sent_to_analysis_at,is_published,is_expired,open_for_contributions,online_days,remaining_time,elapsed_time,posts_count,address,user,reminder_count,is_owner_or_admin,user_signed_in,in_reminder,total_posts,can_request_transfer,is_admin_role,contributed_by_friends
38475,38475,611902,"Leve Educação Ambiental a uma Escola Pública!","Criança é natureza e se nutre dela, vamos facilitar esse encontro no CEI Jamir Dagir?","<p><strong>^ veja as informações acima </strong><strong>^</strong></p>",14300.0,"<p style=""text-align: justify;"">Queremos oferecer oficinas de educação ambiental e criar um sistema de reciclagem dos resíduos orgânicos com professores e crianças de 3 meses a 4 anos de uma escola pública para ensinar a importância do contato com a natureza.</p><p style=""text-align: justify;"">O coletivo Organicidade e a Morada da Floresta foram procurados pelo Centro de Educação Infantil - CEI Diret Jamir Dagir, em busca de apoio técnico para se tornar uma escola exemplar em práticas sustentáveis. Surge, deste encontro, a oportunidade de implementar uma proposta pedagógica que inclua a questão ambiental e que contribua para mudar atitudes e hábitos rumo a uma cultura de maior sustentabilidade. Isto quer dizer: possibilitar que as crianças se desenvolvam plenamente por meio do contato livre e direto com a natureza, criar espaços educadores sustentáveis, implementar boas práticas como a compostagem de 100% dos resíduos orgânicos da escola e disseminar estas iniciativas à toda comunidade escolar por meio de parcerias.<br></p><p style=""text-align: justify;""><img src=""https://s3-sa-east-1.amazonaws.com/cdn.br.catarse/uploads/redactor_rails/picture/data/59301/DSC04059.JPG"">Parquinho do CEI Jamir Dagir</p>  <p style=""text-align: justify;"">Iniciar este projeto possibilita concretizar um sonho, unindo o desejo da comunidade escolar ao conhecimento técnico da equipe de educadores que fará formação de professores e vivências com as crianças. Significa reconhecer e honrar a escola como polo irradiador de uma cultura de sustentabilidade. Honrar a criança que, por viver no mar de concreto que é São Paulo, acaba se distanciando de sua essência; criança é natureza. Entender que as crianças podem e devem ser protagonistas das mudanças que desejam ver no mundo.</p><p style=""text-align: justify;"">Acreditamos muito nas ações de impacto local que se conectam com temáticas globais. As transformações mais profundas são mais duradouras, tecidas pela relação direta entre as pessoas e destas com o local a que pertencem e no qual se sentem transformadoras. Empoderar crianças, educadores, pais e vizinhança é uma ferramenta poderosa de transformação de uma comunidade.</p><p><img src=""https://s3-sa-east-1.amazonaws.com/cdn.br.catarse/uploads/redactor_rails/picture/data/59979/IMG_1031.JPG"">Foto de criança na horta pedagógica da EMEI Dona Leopoldina</p><p style=""text-align: justify;""><strong></strong><strong>Como realizar esta transformação</strong></p><p>Nossa proposta é realizar 16 encontros de formação para professores, 168 oficinas com as crianças e instalar um sistema de compostagem para tratar 100% dos resíduos orgânicos no CEI Jamir Dagir. A compostagem é o processo de decomposição ou reciclagem dos resíduos orgânicos realizado por micro organismos, fungos e outros seres vivos, produzindo composto (adubo sólido) e biofertilizante (adubo líquido). Para isso, será instalada uma composteira termofílica, cuja estrutura consiste em dois cilindros com as paredes feitas de tela de arame e sombrite (conforme foto abaixo). A estrutura também conta com um sistema de drenagem para a coleta do biofertilizante.</p><p>Este espaço se tornará um cantinho de aprendizado para toda comunidade escolar que participará de sua construção, será envolvida na separação dos resíduos, na retirada do composto e na sua utilização e/ou doação para parceiros.</p><p style=""text-align: justify;""><strong></strong></p><p><img src=""https://s3-sa-east-1.amazonaws.com/cdn.br.catarse/uploads/redactor_rails/picture/data/59697/Cilindros_4.jpg"">Foto dos cilindros instalados na EMEF Vinícius de Morais<br></p><p style=""text-align: justify;"">A formação dos professores atenderá à totalidade dos docentes, divididos em dois grupos. Os encontros terão duração de 1 hora e ocorrerão durante as reuniões do Projeto Especial de Ação (PEA) de forma intercalada a cada quinze dias. Os encontros perpassarão pelos seguintes momentos: sensibilização; oficinas práticas e rodas de conversa inspiradoras; diagnóstico socioambiental participativo; co-criação de um projeto coletivo; mutirões; uso e manutenção do espaço educador de sustentabilidade. Para isto, serão utilizadas diversas estratégias, dentre elas: vivências com a natureza (Joseph Cornell), métodos de facilitação de diálogos significativos (Art of Hosting), além de jogos cooperativos, dinâmicas, rodas de conversa, oficinas práticas e vídeos. </p><p style=""text-align: justify;"">As oficinas com as crianças terão duração de 30 minutos cada e serão quinzenais, ocorrendo de forma intercalada, sendo 6 turmas atendidas em uma semana e as outras 6 turmas na semana seguinte.</p><p style=""text-align: justify;"">As atividades com as crianças trarão uma abordagem lúdica que buscará facilitar o aprendizado vivencial a partir do contato direto com a natureza propiciado pelos espaços externos da escola. A partir de observações atentas, da escuta ativa das professoras e das próprias crianças, pretendemos envolver as demandas das crianças no uso dos espaços externos da escola e no planejamento e manejo do espaço educador de sustentabilidade. Aproveitando a curiosidade, a intuição investigativa e a criatividade que as crianças já possuem e, a partir do repertório que elas trazem, buscaremos facilitar sua vivência nos espaços como um dos caminhos possíveis de expressão e criação da cultura infantil. As atividades serão realizadas em parceria com as educadoras das salas.</p><p style=""text-align: justify;"">Permitindo também através de trocas entender e potencializar as parcerias ao redor, sendo eles  o Centro Desportivo Comunitário Lapa (CDC Lapa), a Biblioteca Clarice Lispector e a
Escola Municipal de Educação Infantil Profa. Ana Maria Popovic. <br></p><p style=""text-align: justify;""><strong></strong></p><p style=""text-align: justify;""><strong>Importância do projeto</strong></p><p style=""text-align: justify;"">Ter uma escola
pública que tenha como pilar a educação ambiental permite irradiar a cultura da
sustentabilidade para toda a comunidade escolar, seja pela influência que as
crianças passam a exercer sobre suas famílias, pressionando para mudanças de
atitude, seja impactando a vizinhança ao difundir boas práticas. </p><p style=""text-align: justify;""><em></em><em></em></p><p style=""text-align: justify;"">Lembrando que o CEI trabalha com crianças de 0 a 3 anos e 11 meses, ou seja, a primeira fase da primeira infância do qual a criança   desenvolve valores, limites e “caráter”. As relações de vida nessa época serão rememoradas para sempre, ações para edificar questões de autonomia, direito cidadão, importância da água como bem, importância da floresta e das relações humanas.</p><p style=""text-align: justify;""><strong>Como posso ajudar?</strong></p><p style=""text-align: justify;"" rel=""text-align: justify;"">Por meio do seu apoio, poderemos implementar este projeto. Os colaboradores poderão ter as recompensas abaixo:</p><p style=""text-align: justify;""><strong>Para doadores de R$15,00:<br></strong>Receberá nosso agradecimento por e-mail.<br><img src=""https://s3-sa-east-1.amazonaws.com/cdn.br.catarse/uploads/redactor_rails/picture/data/60310/Rec1.png""><br><strong>Para doadores de R$30,00:</strong></p><p style=""text-align: justify;"">Pôster A3 de desenho de uma criança da EMEI Leopoldina: A EMEI Dona Leopoldina (São Paulo-SP) é uma escola modelo em seu projeto de sustentabilidade. Os desenhos feitos pelas crianças ilustram a horta orgânica em formato de mandala que é mantida por toda a comunidade escolar + Adesivo Coleta Seletiva do Instituto 5 Elementos</p><p><img src=""https://s3-sa-east-1.amazonaws.com/cdn.br.catarse/uploads/redactor_rails/picture/data/60111/Rec1.png"" height=""206"" width=""537"" style=""width: 537px; height: 206px;""><br><br><strong>Para doadores de R$50,00:</strong><br></p><p>Pôster A3 de desenhos de uma criança da EMEI Leopoldina + Adesivo Coleta Seletiva do Instituto 5 Elementos + Calendário Socioambiental do Instituto 5 Elementos + Desconto de 10% nos produtos da <a href=""https://loja.moradadafloresta.eco.br/"">Loja Virtual</a> da Morada da Floresta</p><p><img src=""https://s3-sa-east-1.amazonaws.com/cdn.br.catarse/uploads/redactor_rails/picture/data/60112/Rec2.png""><br><strong><strong>Para doadores de R$100,00</strong></strong></p><p>Pôster A3 de desenhos de uma criança da EMEI Leopoldina + Adesivo Coleta Seletiva do Instituto 5 Elementos + Calendário Socioambiental do Instituto 5 Elementos + Desconto de 10% nos produtos da Loja Virtual da Morada da Floresta + Composto Liquido 500 ml + Bolinhas de Sementes - Kit com 5 bolinhas</p><p><img src=""https://s3-sa-east-1.amazonaws.com/cdn.br.catarse/uploads/redactor_rails/picture/data/60115/Rec3.png""><br><strong><strong>Para doadores de R$150,00</strong></strong></p><p><strong></strong></p><p>Pôster A3 de desenhos de uma criança da EMEI Leopoldina + Adesivo Coleta Seletiva do Instituto 5 Elementos + Calendário Socioambiental do Instituto 5 Elementos + Desconto de 10% nos produtos da Loja Virtual da Morada da Floresta + Composto Liquido 500 ml + Bolinhas de Sementes - Kit com 5 bolinhas + Camiseta da Minhoca</p><p><img src=""https://s3-sa-east-1.amazonaws.com/cdn.br.catarse/uploads/redactor_rails/picture/data/60260/Rec4.png""></p><p><strong>Para doadores de R$250,00<br></strong>(Limite a 10 apoiadores)</p><p>Poster A3 de desenhos de uma criança da EMEI Leopoldina + Adesivo Coleta Seletiva do Instituto 5 Elementos + Calendário Socioambiental + Desconto de 10% na loja virtual da Morada da Floresta + Composto Liquido 500 ml + Bolinhas de Sementes - Kit com 5 bolinhas + Camiseta com desenho da Minhoca + Publicação Coletas Seletivas em Movimento do Instituto 5 Elementos.</p><p><strong></strong></p><p><img src=""https://s3-sa-east-1.amazonaws.com/cdn.br.catarse/uploads/redactor_rails/picture/data/60291/Rec5.png"" width=""603"" height=""196"" style=""width: 603px; height: 196px;""></p><p><strong><strong>Para doadores de R$300,00</strong></strong></p><p>Poster A3 de desenhos de uma criança da EMEI Leopoldina + Adesivo Coleta Seletiva do Instituto 5 Elementos + Calendário Socioambiental do Instituto 5 Elementos + Desconto de 10% na loja virtual da Morada da Floresta + Composto Liquido 500 ml + Bolinhas de Sementes - Kit com 5 bolinhas + Composteira de Baldes Cadico<br></p><p><img src=""https://s3-sa-east-1.amazonaws.com/cdn.br.catarse/uploads/redactor_rails/picture/data/60290/Rec7.png""></p><p><strong>Para doadores de R$500,00</strong></p><p>Poster A3 de desenhos de uma criança da EMEI Leopoldina + Adesivo Coleta Seletiva do Instituto 5 Elementos + Calendário Socioambiental do Instituto 5 Elementos + Desconto de 10% na loja virtual da Morada da Floresta + Composto Liquido 500 ml + Bolinhas de Sementes - Kit com 5 bolinhas + Composteira Ecopedagógica</p><p><img src=""https://s3-sa-east-1.amazonaws.com/cdn.br.catarse/uploads/redactor_rails/picture/data/60122/Rec7.png""></p><p><strong>Para doadores de R$800,00</strong><br></p><p>Poster A3 de desenhos de uma criança da EMEI Leopoldina + Adesivo Coleta Seletiva do Instituto 5 Elementos + Calendário Socioambiental do Instituto 5 Elementos + Desconto de 10% na loja virtual da Morada da Floresta + Composto Liquido 500 ml + Bolinhas de Sementes - Kit com 5 bolinhas + Composteira Ecopedagógica + Participação de 1 dia de formação na escola junto com professores e equipe Organicidade + Morada da Floresta</p><p><img src=""https://s3-sa-east-1.amazonaws.com/cdn.br.catarse/uploads/redactor_rails/picture/data/60140/Rec8.png"" height=""470"" width=""570"" style=""width: 570px; height: 470px;""></p><p><strong>Novas Recompensas para escolas (São Paulo - Capital)</strong></p><p><strong>Acreditamos na replicabilidade do projeto, por isso criamos estas recompensas voltadas para escolas que desejam implementar o modelo proposto.</strong></p><p><strong>Para doadores de R$600,00</strong><br></p><p><strong></strong></p><p>Prioridade para a Escola que escolher esta recompensa no próximo financiamento coletivo a ser lançado + Consultoria de 4 horas para implementação do projeto Educação Ambiental e Compostagem<br></p><p><strong><strong>Para doadores de R$600,00</strong></strong></p><p>Prioridade para a Escola que escolher esta recompensa no próximo financiamento coletivo a ser lançado + Visita com diagnóstico para implementação de compostagem na escola + ação direcionada para estimulo as famílias praticarem compostagem doméstica<span class=""redactor-invisible-space""><br></span></p><p><strong><strong></strong><strong><strong>Para doadores de R$1.000,00</strong></strong></strong></p><p>Prioridade para a Escola que escolher esta recompensa no próximo financiamento coletivo a ser lançado + Consultoria de 4 horas para implementação do projeto Educação Ambiental e Compostagem + Visita com diagnóstico para implementação de compostagem na escola + ação direcionada para estimulo as famílias praticarem compostagem doméstica</p><p><strong>Vídeo de lançamento da Campanha !</strong></p><p><strong><strong><a href=""https://www.youtube.com/watch?v=66jKj-WwUWQ"" target=""_blank""><img src=""https://s3-sa-east-1.amazonaws.com/cdn.br.catarse/uploads/redactor_rails/picture/data/66023/Captura_de_Tela_2016-09-06_a%CC%80s_10.01.14.png"" alt=""Acesse o Vídeo de Lançamento da Campanha !""></a></strong></strong></p><p><strong><strong>Por ser uma campanha flex, quais são as metas ?</strong><br></strong></p><p style=""text-align: justify;"">Apesar do senso de urgência do projeto, estipulamos 3 metas para podermos iniciar este processo.</p><p style=""text-align: justify;""><strong>META 1 - 3.590,00</strong></p><p style=""text-align: justify;"">Iremos desenvolver 8 encontros de formação para professores e atividades com as crianças de 0 a 3 anos do CEI Jamir Dagir.</p><p style=""text-align: justify;""><strong>META 2 - 12.090,00</strong></p><p style=""text-align: justify;"">Iremos desenvolver 8 encontros de formação para professores e atividades com as crianças de 0 a 3 anos do CEI Jamir Dagir + 2 Cilindros de Compostagem Termofílica (ou seja, 100% dos resíduos orgânicos da escola reciclados)</p><p style=""text-align: justify;""><strong>META 3 - 14.300,00</strong></p><p>Serão 16 encontros de formação para as professoras e atividades com as crianças de 0 a 3 anos do CEI Jamir Dagir + 2 Cilindros de Compostagem Termofílica (ou seja, 100% dos resíduos orgânicos da escola reciclados)</p><p><strong>Orçamento</strong>:<br></p><p><img src=""https://s3-sa-east-1.amazonaws.com/cdn.br.catarse/uploads/redactor_rails/picture/data/60153/Grafico.png""></p><p style=""text-align: justify;""><strong>Quem somos</strong><br></p><p>O projeto <a target=""_blank"" href=""https://www.facebook.com/groups/153538531670496/?fref=ts"">Escolas mais Orgânicas</a>, possibilitou o encontro entre o <a href=""http://www.organicidade.org/"" target=""_blank"">Coletivo Organicidade</a> e a <a href=""http://www.moradadafloresta.org.br/"" target=""_blank"">Morada da Floresta</a>. Com grande afinidade entre suas ideologias, metodologias e atividades que rumam para um mesmo foco, o de trazer a educação ambiental para as escolas, seja através de compostagem ou através de atividades de sensibilização e formação de professores, ocorreu o convite para unir os sonhos.</p><p>Juntos, lançamos essa campanha que visa apoiar as ações de educação ambiental e reciclar 100% dos resíduos orgânicos do CEI Jamir Dagir - Lapa, São Paulo. Contamos com sua ajuda!</p><p><strong>Agradecimentos</strong></p><p>Para que esta campanha viesse ao ar, contamos com o apoio de uma rede de parceiros que abraçaram a ideia e ajudaram a viabilizá-la. Gratidão à:</p><p>Comunidade escolar do CEI Jamir Dagir</p><p>Antônio Charlone e Antônio Hamburger - Filmagem e edição do vídeo</p><p>Márcia Covelo Harmbach / EMEI Dona Leopoldina (<a target=""_blank"" href=""http://bit.ly/2aJrDfX"">http://bit.ly/2aJrDfX</a>) - Articuladora e entusiasta</p><p>Raul Paulino Torres / ISPIS (<a target=""_blank"" href=""http://www.ispis.org.br/"">http://www.ispis.org.br/</a><span class=""redactor-invisible-space"">)</span> - Gestão financeira</p><p>Mônica Pilz Borba / Instituto 5 Elementos (<a target=""_blank"" href=""http://www.5elementos.org.br/site/"">http://www.5elementos.org.br/site/</a>) - Doação de materiais para recompensas</p><p>Ricardo Thaler Beck / Cadico Minhocas - Doação de materiais para recompensas</p><p><strong>Contato</strong></p><p>Se quiser saber mais sobre o a campanha e o projeto, entre em contato conosco:</p><p><strong>coletivoorganicidade@gmail.com</strong></p><p style=""text-align: justify;"" rel=""text-align: justify;""><br></p><p><em></em></p>",ceijamirdagir,//www.youtube.com/embed/PRSkTxw8kFE,https://www.youtube.com/watch?v=PRSkTxw8kFE,Educação,31,https://s3-sa-east-1.amazonaws.com/cdn.br.catarse/uploads/project/uploaded_image/38475/Capa_Facebook_2.jpg,https://s3-sa-east-1.amazonaws.com/cdn.br.catarse/uploads/project/uploaded_image/38475/project_thumb_thumb_Capa_Facebook_2.jpg,https://s3-sa-east-1.amazonaws.com/cdn.br.catarse/uploads/project/uploaded_image/38475/project_thumb_small_Capa_Facebook_2.jpg,https://s3-sa-east-1.amazonaws.com/cdn.br.catarse/uploads/project/uploaded_image/38475/project_thumb_large_Capa_Facebook_2.jpg,https://s3-sa-east-1.amazonaws.com/cdn.br.catarse/uploads/project/uploaded_image/38475/project_thumb_video_cover_Capa_Facebook_2.jpg,103.51748251748251748300,14803.0,163,132,successful,flex,finished,"2016-09-11 02:59:59.999999","2016-09-10 23:59:59.999999","2016-08-01 15:09:14.037933","2016-08-01 12:09:14.037933",,t,t,f,40,"{""total"" : 0, ""unit"" : ""seconds""}","{""total"" : 40, ""unit"" : ""days""}",7,"{""city"" : ""São Paulo"", ""state_acronym"" : ""SP"", ""state"" : ""São Paulo""}","{""id"" : 611902, ""name"" : ""Coletivo Organicidade + Morada da Floresta""}",6,,f,f,42,t,f,f