project_id,id,user_id,name,headline,budget,goal,about_html,permalink,video_embed_url,video_url,category_name,category_id,original_image,thumb_image,small_image,large_image,video_cover_image,progress,pledged,total_contributions,total_contributors,state,mode,state_order,expires_at,zone_expires_at,online_date,zone_online_date,sent_to_analysis_at,is_published,is_expired,open_for_contributions,online_days,remaining_time,elapsed_time,posts_count,address,user,reminder_count,is_owner_or_admin,user_signed_in,in_reminder,total_posts,can_request_transfer,is_admin_role,contributed_by_friends
38831,38831,614368,"Desenho Animado - FRIVIN","Quando a zueira HUEBR transcende realidades,
venha fazer parte desta fantástica aventura!","<p><strong>ORÇAMENTO:</strong></p><p>• Pré-produção - 6 meses ($5.000,00)</p><p>Etapas: Pesquisa, Biblioteca de referencias, Roughs, Storyboard, Concept, Animatic;<br></p><p>• Produção - 12 meses ($45.000,00)</p><p>Etapas: Cenários 2D, Modelagem de personagens e elementos, Textura, Animação, Produção de Áudio e Render)<br></p><p>• Pós-produção - 6 meses ($10.000,00)</p><p>Etapas: Composição, Montagem, Efeitos de pós, Render e Finalização de arquivo para enviar para a produtora responsável por soltar o arquivo na especificação da emissora.</p><p><strong>OBS:</strong> Cronograma de produção e formas de pagamento serão definidos na preparação do contrato de prestação de serviços<br></p>",60000.0,"<p> <strong>APRESENTAÇÃO</strong> <br></p><p> A atualidade científica
atualmente está tratando sobre as realidades alternativas. O multiverso de uma
maneira simples. Assim, o desenho animado Frivin trata a respeito de um Guarda
Municipal chamado Frivin e sua companheira canina Arcana, que num conflito
dentro do mundo atual teletransportam-se para outra realidade fantasia
medieval, onde Arcana acaba mudando de forma, assumindo uma forma humana.
Explorando o mundo descobrem que, dentro de um vilarejo próximo, Nanda (a
terceira personagem do grupo) está prestes a ser apedrejada pelos camponeses
locais. A princesa Nanda também foi transportada da sua realidade, destruída
por uma entidade conhecida como Mardukk. Notando a semelhança de histórias,
Frivin e Arcana acompanham Nanda para o retorno a sua realidade, na intenção de
extirpar de uma vez por todas o mal do multiverso. Ao longo do desenrolar da
história, encontram o quarto personagem principal, Sammyr, um Halfling nativo
que passa a vida procurando por fama e fortuna.<br></p><p>Em cada episódio o público vai poder dividir com o grupo, as sensações e experiências vividas por eles, as missões mais escabrosas, os diálogos mais engraçados e as trapalhadas mais espalhafatosas, bem como o conhecimento das criaturas mais fantásticas existentes nesta realidade. Assim, o Desenho Animado Frivin pretende colocar em discussão o aspecto humano, o valor de amizade, valor de família, de espiritualidade, como colocações neutras divinas, seus princípios de convivência, bem como sua relação existencial no multiverso, tendo como base o argumento explicativo de todas as vertentes e diretrizes do bom convívio físico na biosfera.</p><p><strong>CRONOGRAMA DE PRODUÇÃO</strong></p><p>Pré-produção: Pesquisa, biblioteca de referências, Roughs, Storyboard, Concept, Animatic;</p><p>Produção:   Cenários, Modelagem de personagens e elementos, Textura, Animação , Produção de Áudio e Render;</p><p>Pós-produção: Composição, Montagem, Efeitos de pós, Render e Finalização de arquivo para enviar para a produtora responsável por soltar o arquivo na especificação da emissora.<br></p><p><strong>QUEM É FLÁVIO/FRIVIN?</strong><br>Flávio Machado, vulgo Frivin, é desenhista/roteirista, criador do projeto em questão. Não é apenas o futebol brasileiro que anda em alta no mercado internacional. O conteúdo audiovisual brasileiro tem sido cada vez mais procurado por canais estrangeiros. Esse sucesso se justifica pelos eventos que acontecem nos próximos anos (Copa e Olimpíadas), destaque no cenário político e econômico e aumento da qualidade dos filmes brasileiros (especialmente em função dos novos mecanismos de fomento). Já do lado internacional, com a crise financeira, a produção diminui e faz aumentar os licenciamentos de títulos importados. Um dos atuais grandes compradores de filmes e séries brasileiros são os nossos vizinhos sul-americanos. Em Julho, aconteceu a estreia do longa-metragem “Desenrola” (de Rosane Svartman) nos cinemas no Chile. Nos canais de televisão, as séries infantis Cocoricó (da TV Cultura) e Mansão Maluca (Tortuga) estão previstas em canais no Equador, Venezuela e Argentina, enquanto os longasmetragens Embargo (Persona Non Grata Filmes), A Hora da Estrela (Raiz Produções) e Natimorto (RT Features) já fecharam contrato com uma televisão colombiana. Um pouco mais distante, países como Irã, Rússia, China, Japão, Escandinávia, Coréia do Sul e Singapura também têm se interessado por longas e curtas-metragens brasileiros.<br>Para o Brazilian TV Producers, projeto internacional da ABPITV, o momento é favorável em todos os aspectos, tanto para o licenciamento de conteúdos prontos quanto para efetivação de coproduções internacionais. “Os mecanismos de financiamento brasileiro estão muito favoráveis para quem quer produzir conteúdos audiovisuais competitivos e de caráter internacional. Isso facilita todo o processo de negociações com coprodutores e com canais internacionais, pois gera confiança no produto e na relação entre as partes”, ressalta Rachel do Vale, gerente do projeto.<br>A expectativa é que a demanda por conteúdo brasileiro continue em alta. Com produções de qualidade internacional – como o Brasil tem toda a capacidade e recursos para produzir – a tendência é que isto seja apenas o início de uma longa e lucrativa história.</p><p>Assim sendo, espero que curtam meu projeto, e terão seus nomes escritos na história cinematográfica brasileira.<br></p>",desenho_animado_frivin_22bc,//www.youtube.com/embed/mS6Q3UGZvMo,https://www.youtube.com/watch?v=mS6Q3UGZvMo,Artes,1,https://s3-sa-east-1.amazonaws.com/cdn.br.catarse/uploads/project/uploaded_image/38831/FRIVIN_TEAM.png,https://s3-sa-east-1.amazonaws.com/cdn.br.catarse/uploads/project/uploaded_image/38831/project_thumb_thumb_FRIVIN_TEAM.png,https://s3-sa-east-1.amazonaws.com/cdn.br.catarse/uploads/project/uploaded_image/38831/project_thumb_small_FRIVIN_TEAM.png,https://s3-sa-east-1.amazonaws.com/cdn.br.catarse/uploads/project/uploaded_image/38831/project_thumb_large_FRIVIN_TEAM.png,https://s3-sa-east-1.amazonaws.com/cdn.br.catarse/uploads/project/uploaded_image/38831/project_thumb_video_cover_FRIVIN_TEAM.png,0,0,0,0,online,aon,published,"2016-10-01 02:59:59.999999","2016-09-30 23:59:59.999999","2016-08-01 15:53:35.627911","2016-08-01 12:53:35.627911",,t,f,t,60,"{""total"" : 5, ""unit"" : ""days""}","{""total"" : 54, ""unit"" : ""days""}",0,"{""city"" : ""Paulínia"", ""state_acronym"" : ""SP"", ""state"" : ""São Paulo""}","{""id"" : 614368, ""name"" : ""Flávio Machado""}",0,,f,f,0,f,f,f