project_id,id,user_id,name,headline,budget,goal,about_html,permalink,video_embed_url,video_url,category_name,category_id,original_image,thumb_image,small_image,large_image,video_cover_image,progress,pledged,total_contributions,total_contributors,state,mode,state_order,expires_at,zone_expires_at,online_date,zone_online_date,sent_to_analysis_at,is_published,is_expired,open_for_contributions,online_days,remaining_time,elapsed_time,posts_count,address,user,reminder_count,is_owner_or_admin,user_signed_in,in_reminder,total_posts,can_request_transfer,is_admin_role,contributed_by_friends
39007,39007,479579,"O Último Maranishi #02","Direto de Hoxor para a Terra, a jornada de Hanzo para salvar o último Maranishi continua.","<p>O dim-dim arrecadado será distribuído da seguinte forma: </p><p><img src=""https://s3-sa-east-1.amazonaws.com/cdn.br.catarse/uploads/redactor_rails/picture/data/60767/GRAFICO2.jpg""></p><p>Gráfica: 77%<br>Catarse: 13%<br>Recompensas e Correio: 10%<br></p><p><br></p><p><img src=""https://s3-sa-east-1.amazonaws.com/cdn.br.catarse/uploads/redactor_rails/picture/data/60768/titulo_SOBREASRECOMPENSAS.jpg""></p><p>Para ajudar é só escolher o valor que considerar mais adequado ou as recompensas que preferir. </p><p>Todos os apoiadores terão seu nome nos agradecimentos.</p><p>Importante lembrar que o Catarse também funciona como uma pré-venda. Por isso, <strong>ao contribuir com o valor mínimo nessa campanha você JÁ ESTARÁ garantindo a sua revista impressa entregue na sua casa.</strong> </p><p>Caso queira ajudar com um valor maior, preparei alguns mimos especiais, incluindo o número 01 da HQ, postais e prints dos personagens da história, artes exclusivas e até a possibilidade de incluir um personagem figurante em uma cena dos próximos capítulos com o seu nome e a sua cara. Também há a opção de patrocínio. Confira a lista completa das opções ali do lado!</p><p><img src=""https://s3-sa-east-1.amazonaws.com/cdn.br.catarse/uploads/redactor_rails/picture/data/60769/prints.jpg"" style=""width: 617px; height: 417px;"" width=""617"" height=""417""></p><p style=""text-align: center;""><em>Prints A4</em></p><p>        A previsão é que o envio das HQs e recompensas pelo correio seja feito ao longo do mês de outubro de 2016 e os valores já incluem o frete para todo o Brasil. Para envios internacionais, combine o frete comigo por <span class=""apple-converted-space"">e-mail (<a href=""mailto:mailto:cccontato@gmail.com"">cccontato@gmail.com</a>).</span><br></p><br>",2600.0,"<p><strong>O Último Maranishi""</strong> é uma minissérie em dez capítulos que comecei a publicar semanalmente na web em setembro de 2015. A ideia surgiu em 2013, quando finalmente resolvi retomar a produção de quadrinhos para valer. E surgiu essa história inspirada em alguns temas que adoro: monstros gigantes, dragões e teorias da conspiração sobre aliens.<br></p><p style=""text-align: center;"" rel=""text-align: center;""><img src=""https://s3-sa-east-1.amazonaws.com/cdn.br.catarse/uploads/redactor_rails/picture/data/60739/capa.jpg""></p><p style=""text-align: center;""><em>Capa do número 01</em></p><p>O primeiro número impresso foi publicado em maio de 2016, bancado do próprio bolso, e lançado no 22º Fest Comix. Minha ideia é lançar cada capítulo em versão impressa logo assim que o mesmo for inteiramente publicado online. </p><p><img src=""https://s3-sa-east-1.amazonaws.com/cdn.br.catarse/uploads/redactor_rails/picture/data/60738/img_pagina.jpg"" width=""618"" height=""836"" style=""width: 618px; height: 836px;""></p><p style=""text-align: center;""><em>Página do número 02</em></p><p>Caso você ainda não conheça, pode ler a HQ em andamento <a href=""http://www.oultimomaranishi.com.br"" target=""_blank"">aqui</a> e também acompanhar as novidades pela <a href=""http://www.facebook.com/maranishi"" target=""_blank"">fanpage no Facebook</a>.     </p><p><br></p><p><img src=""https://s3-sa-east-1.amazonaws.com/cdn.br.catarse/uploads/redactor_rails/picture/data/60713/titulo_sinopse.jpg""></p><p>Depois de fugir
do seu planeta natal para salvar o último filhote de dragão Maranishi, Hanzo
chega à Terra. Porém, as coisas não saíram como planejado: sua nave se
espatifou, foi capturado pela agência espacial do governo e o Maranishi
desapareceu misteriosamente... </p><p style=""text-align: center;""><img src=""https://s3-sa-east-1.amazonaws.com/cdn.br.catarse/uploads/redactor_rails/picture/data/60734/img1.jpg"" width=""602"" height=""404"" style=""width: 602px; height: 404px;""></p><p>Agora, em nosso planeta, sua jornada vai se cruzar
com a de Sara Schneiders, cientista da Agência Espacial Nacional especialista
em alienígenas. </p><p><img src=""https://s3-sa-east-1.amazonaws.com/cdn.br.catarse/uploads/redactor_rails/picture/data/60737/img4.jpg"" width=""621"" height=""285"" style=""width: 621px; height: 285px;""></p><p>E enquanto Hanzo tenta descobrir o que aconteceu com o
Maranishi, Sara vai ajudá-lo a se adaptar à vida na Terra.  <br></p><p><br></p><p><img src=""https://s3-sa-east-1.amazonaws.com/cdn.br.catarse/uploads/redactor_rails/picture/data/60714/titulo_AREVISTA.jpg""></p><p>""O Último Maranishi #02"" terá as mesmas especificações técnicas que o número 01:</p><p>- Formato: 15 x 21<br> - 32 páginas P&B em papel Off Set LD 90g.<br> - Capa colorida em Couche Brilho LD 170g.<br> - Tiragem: mil cópias.</p><p><br></p><p><img src=""https://s3-sa-east-1.amazonaws.com/cdn.br.catarse/uploads/redactor_rails/picture/data/60715/titulo_AAUTORA.jpg""></p><p>Cris Camargo
- esta criatura que pede vossa colaboração - é comunicóloga, editora e
produtora de conteúdo digital. Desenha desde que se conhece por gente.
Participou de algumas edições do Salão Internacional de Desenho para Imprensa
em Porto Alegre na década de 90, quando também fazia fanzines, mas interrompeu
a produção de quadrinhos por 20 anos diante da ausência de maiores perspectivas
editoriais em uma época que ainda não existia internet. Incentivada por amigos
e pelo cenário independente dos anos 2010, resolveu voltar ao que sempre amou
fazer: desenhar e contar histórias.<br></p><p style=""text-align: center;""><img src=""https://s3-sa-east-1.amazonaws.com/cdn.br.catarse/uploads/redactor_rails/picture/data/60765/sketch3.jpg"" width=""599"" height=""268"" style=""width: 599px; height: 268px;""></p><p style=""text-align: center;""><img src=""https://s3-sa-east-1.amazonaws.com/cdn.br.catarse/uploads/redactor_rails/picture/data/60766/producao1.jpg"" width=""596"" height=""283"" style=""width: 596px; height: 283px;""></p><p style=""text-align: center;""><img src=""https://s3-sa-east-1.amazonaws.com/cdn.br.catarse/uploads/redactor_rails/picture/data/60741/arte2.jpg"" width=""598"" height=""446"" style=""width: 598px; height: 446px;""></p><p style=""text-align: center;""><em>Fases de produção da HQ</em></p><p style=""text-align: center;""><em><br></em></p><p style=""text-align: center;""><img src=""https://s3-sa-east-1.amazonaws.com/cdn.br.catarse/uploads/redactor_rails/picture/data/60770/titulo_OOR%C3%87AMENTO.jpg""></p>",maranishi2,,,Quadrinhos,7,https://s3-sa-east-1.amazonaws.com/cdn.br.catarse/uploads/project/uploaded_image/39007/maranishi2.jpg,https://s3-sa-east-1.amazonaws.com/cdn.br.catarse/uploads/project/uploaded_image/39007/project_thumb_thumb_maranishi2.jpg,https://s3-sa-east-1.amazonaws.com/cdn.br.catarse/uploads/project/uploaded_image/39007/project_thumb_small_maranishi2.jpg,https://s3-sa-east-1.amazonaws.com/cdn.br.catarse/uploads/project/uploaded_image/39007/project_thumb_large_maranishi2.jpg,https://s3-sa-east-1.amazonaws.com/cdn.br.catarse/uploads/project/uploaded_image/39007/project_thumb_video_cover_maranishi2.jpg,51.92307692307692307700,1350.0,37,34,successful,flex,finished,"2016-09-03 02:59:59.999999","2016-09-02 23:59:59.999999","2016-08-03 22:21:20.228441","2016-08-03 19:21:20.228441",,t,t,f,30,"{""total"" : 0, ""unit"" : ""seconds""}","{""total"" : 30, ""unit"" : ""days""}",2,"{""city"" : ""São Paulo"", ""state_acronym"" : ""SP"", ""state"" : ""São Paulo""}","{""id"" : 479579, ""name"" : ""Cris Camargo""}",2,,f,f,4,t,f,f