project_id,id,user_id,name,headline,budget,goal,about_html,permalink,video_embed_url,video_url,category_name,category_id,original_image,thumb_image,small_image,large_image,video_cover_image,progress,pledged,total_contributions,total_contributors,state,mode,state_order,expires_at,zone_expires_at,online_date,zone_online_date,sent_to_analysis_at,is_published,is_expired,open_for_contributions,online_days,remaining_time,elapsed_time,posts_count,address,user,reminder_count,is_owner_or_admin,user_signed_in,in_reminder,total_posts,can_request_transfer,is_admin_role,contributed_by_friends
3945,3945,229256,"CD ""A Imensidão Azul"" - Zoe Lilly","Músicas de alguém que tenta caminhar com Deus todos os dias.","O orçamento para projetos anteriores a 24/02/2015 normalmente pode ser encontrado na descrição acima.",10000.0,"<p>Creio que uma das maiores realizações é fazer algo que é SEU, algo que não foi outro que escolheu, mas algo que carregue VOCÊ. “A Imensidão Azul” será o meu primeiro album completo (10 faixas) que posso dizer que será meu – porém compartilhado com todos. </p>

<p>Não será um “cover” nem uma  “versão brasileira” das bandas de adoração, mas um resultado de histórias de amor, dor, alegria, perdão e amizade. Se pudesse resumir, é simplesmente um pedaço do meu coração.</p>

<p>Creio no poder transformador da música e para minha surpresa, me vejo vivendo esse sonho de poder colorir um pouco mais esse mundo cinza.</p>

<p>Todo dinheiro arrecadado será totalmente direcionado para os gastos de produção, gravação, prensagem e lançamento. Conto com sua ajuda para desenvolver esse projeto de lançamento. Pode ser uma pequena quantia, e se for grande, claro que não irei reclamar ☺</p>

<p>Obrigado por se interessar e participar deste projeto. Vocês são parte deste sonho! </p>
",zoelilly,//www.youtube.com/embed/rlbAhCyNPdA,http://www.youtube.com/watch?v=rlbAhCyNPdA,Música,16,https://s3-sa-east-1.amazonaws.com/cdn.br.catarse/uploads/project/uploaded_image/3945/THUMB_CATARSE.jpg,https://s3-sa-east-1.amazonaws.com/cdn.br.catarse/uploads/project/uploaded_image/3945/project_thumb_thumb_THUMB_CATARSE.jpg,https://s3-sa-east-1.amazonaws.com/cdn.br.catarse/uploads/project/uploaded_image/3945/project_thumb_small_THUMB_CATARSE.jpg,https://s3-sa-east-1.amazonaws.com/cdn.br.catarse/uploads/project/uploaded_image/3945/project_thumb_large_THUMB_CATARSE.jpg,https://s3-sa-east-1.amazonaws.com/cdn.br.catarse/uploads/project/uploaded_image/3945/project_thumb_video_cover_THUMB_CATARSE.jpg,146.05000000000000000000,14605.0,157,145,successful,aon,finished,"2014-03-12 02:59:59","2014-03-11 23:59:59","2014-01-31 17:04:12.04811","2014-01-31 15:04:12.04811",,t,t,f,39,"{""total"" : 0, ""unit"" : ""seconds""}","{""total"" : 39, ""unit"" : ""days""}",5,"{""city"" : ""São Paulo"", ""state_acronym"" : ""SP"", ""state"" : ""São Paulo""}","{""id"" : 229256, ""name"" : ""Zoe Miyuri Hayashi Marcelino""}",0,,f,f,5,f,f,f