project_id,id,user_id,name,headline,budget,goal,about_html,permalink,video_embed_url,video_url,category_name,category_id,original_image,thumb_image,small_image,large_image,video_cover_image,progress,pledged,total_contributions,total_contributors,state,mode,state_order,expires_at,zone_expires_at,online_date,zone_online_date,sent_to_analysis_at,is_published,is_expired,open_for_contributions,online_days,remaining_time,elapsed_time,posts_count,address,user,reminder_count,is_owner_or_admin,user_signed_in,in_reminder,total_posts,can_request_transfer,is_admin_role,contributed_by_friends
39772,39772,620372,Paranapuã,"Documentário que visa tratar da situação dos índios de etnia guarani m'bya da Aldeia de Paranapuã.","<p>O dinheiro arrecadado será utilizado para nos auxiliar em despesas como:</p><ul><li>TRANSPORTE: como moramos em São Paulo e faremos nossa gravação em São Vicente, parte deste orçamento está voltado para despesas com gasolina, pedágios e passagens.</li></ul><ul><li>ALIMENTAÇÃO: nossas diárias serão extensas, portanto é importante pensarmos nisso!</li></ul><ul><li>AJUDA DE CUSTO: acordamos que parte deste dinheiro será destinado à Aldeia tendo em vista suas carências com alimentação e saúde. </li></ul><ul><li>DESPESAS ACADÊMICAS: como Trabalho de Conclusão de Curso, precisamos entregar a parte teórica deste projeto em forma de livro impresso além de gravá-la em DVD.</li></ul><ul><li>DIVULGAÇÃO: com tudo pronto, é importante que a gente consiga levar este filme a público. Parte da arrecadação está voltada para confecção de cartazes, gravação de DVDs e Bluray.</li></ul>",3000.0,"<p style=""text-align: justify;"">Na cidade de São Vicente no litoral de São Paulo, indígenas da etnia guarani m’bya ocuparam uma reserva florestal estadual, transformando-a numa aldeia. A reserva florestal tem como papel preservar a fauna e a flora, de tal forma que é proibido plantar, pescar e caçar dentro da reserva. Dado essa condição, os moradores da aldeia passaram a comprar mandioca, tabaco e outros elementos de sua cultura nos mercados de São Vicente, ao invés de cultivá-los. Transformando, assim, a dinâmica deles em relação à terra e ao meio em que vivem, onde acarreta numa necessária relação com o meio urbano. </p><p style=""text-align: justify;"">O projeto e o
 contato com esta aldeia se dá muito pelas memórias do realizador, 
Leonardo, que cresceu na rua onde a reserva florestal se encontra e 
nesta época tinha pouca noção sobre a realidade e vivencia dos m’byas 
dentro da reserva. Hoje, Leo e a equipe passam pelo processo final do 
curso de Audiovisual e como Trabalho de Conclusão de Curso (TCC) buscam 
realizar um documentário com os m’byas de Paranapuã. <br></p><p style=""text-align: justify;""><span class=""redactor-invisible-space"">Esta região que envolve Paranapuã e a cidade de São Vicente carregam um 
peso histórico e foram habitadas por índios tupis e guaranis, antes do 
contato dos colonos. Após a chegada dos portugueses, foi fundada a vila 
de São Vicente e daí pra diante tomou seu processo de transformações, 
como todo o pa´s colonizado. O que se pretende é documentar sobre a 
vivência dos guaranis de Paranapuã, mas também criar possibilidades para
 intervir na história, questionar as circunscrições, registrar a 
percepção m’bya sobre esta região e assim criar uma estória.</span><br></p><p style=""text-align: justify;""><img src=""https://s3-sa-east-1.amazonaws.com/cdn.br.catarse/uploads/redactor_rails/picture/data/62694/Captura_de_Tela_2016-08-17_a%CC%80s_08.36.37.png""><br></p><p><img src=""https://s3-sa-east-1.amazonaws.com/cdn.br.catarse/uploads/redactor_rails/picture/data/62691/Captura_de_Tela_2016-08-17_a%CC%80s_08.39.55.png""></p>      <p style=""text-align: justify;""><br></p><p style=""text-align: justify;"">Equipe:  Leonardo Coffani Sabanay, Marih Herrera, Felipe Gonzalez, Mateus Bravin e Vitor Gracia.<br></p><p style=""text-align: justify;""><br></p><p style=""text-align: justify;""><br><br></p>",paranapua,//www.youtube.com/embed/rszZXfBSezQ,https://youtu.be/rszZXfBSezQ,"Cinema e Vídeo",13,https://s3-sa-east-1.amazonaws.com/cdn.br.catarse/uploads/project/uploaded_image/39772/Captura_de_Tela_2016-08-17_às_08.36.37.png,https://s3-sa-east-1.amazonaws.com/cdn.br.catarse/uploads/project/uploaded_image/39772/project_thumb_thumb_Captura_de_Tela_2016-08-17_às_08.36.37.png,https://s3-sa-east-1.amazonaws.com/cdn.br.catarse/uploads/project/uploaded_image/39772/project_thumb_small_Captura_de_Tela_2016-08-17_às_08.36.37.png,https://s3-sa-east-1.amazonaws.com/cdn.br.catarse/uploads/project/uploaded_image/39772/project_thumb_large_Captura_de_Tela_2016-08-17_às_08.36.37.png,https://s3-sa-east-1.amazonaws.com/cdn.br.catarse/uploads/project/uploaded_image/39772/project_thumb_video_cover_Captura_de_Tela_2016-08-17_às_08.36.37.png,56.83333333333333333300,1705.0,22,18,successful,flex,finished,"2016-09-07 02:59:59.999999","2016-09-06 23:59:59.999999","2016-08-17 20:26:45.174279","2016-08-17 17:26:45.174279",,t,t,f,6,"{""total"" : 0, ""unit"" : ""seconds""}","{""total"" : 20, ""unit"" : ""days""}",0,"{""city"" : ""São Paulo"", ""state_acronym"" : ""SP"", ""state"" : ""São Paulo""}","{""id"" : 620372, ""name"" : ""Marih Herrera""}",1,,f,f,0,t,f,f