project_id,id,user_id,name,headline,budget,goal,about_html,permalink,video_embed_url,video_url,category_name,category_id,original_image,thumb_image,small_image,large_image,video_cover_image,progress,pledged,total_contributions,total_contributors,state,mode,state_order,expires_at,zone_expires_at,online_date,zone_online_date,sent_to_analysis_at,is_published,is_expired,open_for_contributions,online_days,remaining_time,elapsed_time,posts_count,address,user,reminder_count,is_owner_or_admin,user_signed_in,in_reminder,total_posts,can_request_transfer,is_admin_role,contributed_by_friends
39935,39935,622629,"Marina Cantelli no Mundial de Jiu-Jitsu","Gostou de torcer pelos atletas nas olimpíadas?  que tal apoiar um atleta proximo de voce? ","<p><strong>Periodo: </strong>07/06/2017 à 12/06/2017</p><p><strong>Passagem: </strong>R$ 1.150,00</p><p><strong>Hospedagem:</strong><span class=""redactor-invisible-space""> R$ 600,00</span></p><p><span class=""redactor-invisible-space""><strong>Alimentação: </strong><span class=""redactor-invisible-space"">R$ 250,00<br></span></span></p><p><span class=""redactor-invisible-space""><span class=""redactor-invisible-space""><strong>Transporte: </strong><span class=""redactor-invisible-space"">R$ 60,00<br></span></span></span></p><p><span class=""redactor-invisible-space""><span class=""redactor-invisible-space""><span class=""redactor-invisible-space""><strong>Inscrição: </strong><span class=""redactor-invisible-space"">R$ 200,00<br></span></span></span></span></p><p><span class=""redactor-invisible-space""><span class=""redactor-invisible-space""><span class=""redactor-invisible-space""><span class=""redactor-invisible-space""><strong>Taxa Catarse:</strong> R$ 293,80  </span></span></span></span></p><p><strong></strong><strong> </strong></p>",2553.8,"<p style=""text-align: center;""><img src=""https://s3-sa-east-1.amazonaws.com/cdn.br.catarse/uploads/redactor_rails/picture/data/62823/Captura_de_Tela_2016-08-18_a%CC%80s_11.23.56.png""><br></p><p><br></p><p><strong>A Equipe </strong></p><p>Liderada pelo Mestre Pedro Martinez, a Pedro Martinez Team, com 12 anos de existência hoje é o
nicho da Equipe Tetris BJJ com maior número de atletas. <br></p><p>Sua linhagem conta hoje com mais de 200 alunos ativos divididos entre a Matriz, situada na Estrada de
Itapecerica da Serra, 3285 – São Paulo – SP, e junto ao Projeto da Prefeitura de Embú das Artes no Ginásio
Hermino Esposito, Alameda Fernando Batista Medina, 120, ao qual o Mestre Pedro Martinez também coordena. </p><p>Com alunos entre 5 e 55 anos, a equipe é comporta desde crianças até adultos da terceira idade que
dentro do Jiu Jitsu buscam bem estar, qualidade de vida, equilíbrio mental, disciplina, prática esportiva, além
de treinamento para competições.</p><p>
 A equipe Pedro Martinez conta com atletas de ponta que
 estão sempre presentes nas principais competições
 regionais, nacionais e mundiais do mundo do
 Jiu Jistu, sendo campeões em sua maioria. </p><p><img src=""https://s3-sa-east-1.amazonaws.com/cdn.br.catarse/uploads/redactor_rails/picture/data/62824/Captura_de_Tela_2016-08-18_a%CC%80s_11.24.06.png""></p><br><p> 
<strong>Campeonatos Internacionais </strong></p><p>Atualmente realizado pela IBJJF (International Brazilian Jiu Jitsu Federation. Entidade mundial que
rege o esporte) o Europeu, Pan-Americano e Mundial de Jiu Jtisu são as principais competições do calendário
anual do esporte. Disputados desde 1995, estas tradicionais e importantes competições contam com os
principais atletas do cenário mundial do Jiu Jitsu. </p><p>Europeu de Jiu-Jitsu: Geralmente realizado no mês de Janeiro, na cidade de Odivelas - Portugal. </p><p>Pan-Americano de Jiu-Jitsu: Geralmente realizado no mês de Março, na cidade de Irvine - EUA. </p><p>Mundial de Jiu-Jitsu: Geralmente realizado no mês de Junho, na cidade de Los Angeles - EUA. </p><p>Os principais atletas do esporte treinam arduamente para estes grandes eventos que contam com
transmissão ao vivo via livestream, cobertura em tempo real das principais mídias esportivas voltadas à luta,
como TATAME e GRACIEMAG através de seu site, twitter, facebook, instagram e revista de tiragem internacional,
além de canais de tv como SPORTV e COMBATE que cobrem o evento com matérias em seus programas. </p><p><br></p><p>
<strong>O Projeto </strong></p><p>Com a tradição de estar presente nas principais competições do calendário do esporte, a equipe Pedro
Martinez Team planeja entrar com atletas nas próximas edições dos Campeonatos Internacionais de Jiu - Jitsu. </p><p>Para isso ela busca recursos, dentre eles da iniciativa privada, através de patrocínio e apoio. </p><p>Hoje viemos até você com uma atleta que teve grande destaque ao decorrer dos últimos anos, estando
presente e vencendo os principais campeonatos do calendário. </p><p>Gostariamos de apresenta-la a seguir:</p><p>
<strong>Marina Cantelli</strong></p><p><strong> </strong><img src=""https://s3-sa-east-1.amazonaws.com/cdn.br.catarse/uploads/redactor_rails/picture/data/62825/Captura_de_Tela_2016-08-18_a%CC%80s_11.24.19.png""></p><ul><li>Idade: 22 anos. </li><li>Altura: 1.70 </li><li> Peso: 69 Kgs. </li><li> Graduação: Faixa Azul. </li></ul><p>Principais Conquistas: </p><ul><li>Campeã Paulista 2014.</li><li>Campeã Curitiba Open 2016.</li><li>Campeã Belo Horizonte Open 2016.</li><li>Campeã Belo Horizonte No-Gi Open 2016.</li><li>Vice-Campeã SP BJJ-Pro 2016.</li><li>Campeã Gramado No-Gi Open 2016. </li><li>99 colocada no ranking mundial IBJJF.
 (dados atualizados em Agosto/2016). </li></ul><p>Próximas competições: </p><ul><li>20/08 - Curitiba Winter International Open 2016. </li><li> 17/09 - São Paulo International Open 2016. </li><li> 08/10 - Floripa International Open 2016. </li><li> 05/11 - Rio BJJ Pro IBJJF Championship 2016. </li><li> 26/11 - Sul-Americano de Jiu-Jitsu 2016. </li><li> 03/12 - Brasilia International Open 2016.
 (dados atualizados em Agosto/2016). </li></ul><p style=""text-align: center;""><img src=""https://s3-sa-east-1.amazonaws.com/cdn.br.catarse/uploads/redactor_rails/picture/data/62826/Captura_de_Tela_2016-08-18_a%CC%80s_11.24.28.png""><br></p><p><strong><br></strong></p><p><strong>Apoio e Patrocínio </strong></p><p>É sabido a falta de apoio e incentivo que atletas em geral sofrem em nosso país. Ter condições apropriadas
para treinar, estar presente nas principais competições e viver do esporte é um desafio complicado e
a mais que o atleta brasileiro convive. </p><p>A academia Pedro Martinez consegue oferecer a estrutura necessária para treinamento diário em 3
períodos para seus atletas. O auxílio financeiro é feito através de ações locais como rifas e seminários,
além de apoios e patrocínios da iniciativa privada, proporcionando assim os recursos necessários para que seus
principais atletas estejam sempre presentes nas principais competições. </p><p>Com o compromisso de oferecer um plano de exposição e propaganda de seu negócio, a Academia
Pedro Martinez vem até você. Temos a preocupação em não só buscar um apoiador, mas sim um parceiro
para que o mesmo também ganhe em divulgação e visibilidade de sua marca, e concomitantemente isso lhe
traga novos clientes e possibilidades de negócio. </p><p>As possibilidades de exposição de sua marca são enormes, e as mostraremos a seguir: </p><p><br></p><p><strong>Exposição de sua Marca </strong></p><p><strong></strong></p><p><br></p><p style=""text-align: center;""><img src=""https://s3-sa-east-1.amazonaws.com/cdn.br.catarse/uploads/redactor_rails/picture/data/62827/Captura_de_Tela_2016-08-18_a%CC%80s_11.24.37.png""></p><p><br></p><p><strong>No kimono:</strong>
A forma mais convencional de exposição.
Os competidores carregam junto de si sua marca, expondo a
mesma em competições, treinos e nas mídias, onde tem suas fotos
constantemente compartilhadas. </p><p><br></p><p style=""text-align: center;""><img src=""https://s3-sa-east-1.amazonaws.com/cdn.br.catarse/uploads/redactor_rails/picture/data/62828/Captura_de_Tela_2016-08-18_a%CC%80s_11.24.42.png""></p><p><br></p><p><strong>Na Página e Site da Academia:</strong>
Apenas na Página do Facebook recebemos uma média de 1.300
visitas semanais. Suas Publicações chegam a alcançar de 3.500 à
5.000 pessoas semanalmente. A página conta com mais de 1.300
likes “não promovidos”, ou seja, um número alcançado sem
qualquer tipo de compra de promoões ou impulsionamento. Quem
segue a página são pessoas pontuais, que se interessam e a acompanham.</p><p style=""text-align: center;""><img src=""https://s3-sa-east-1.amazonaws.com/cdn.br.catarse/uploads/redactor_rails/picture/data/62829/Captura_de_Tela_2016-08-18_a%CC%80s_11.24.52.png""></p><p><strong>Nas Páginas das Entidades:</strong>
Juntas, apenas as páginas oficiais da Federação Internacional e Confederação Brasileira
somam mais de 750 mil seguidores, com um alcance de publicações semanais que
ultrapassam os 1,5 milhões de views, (números que chegam a triplicar em época de
competições importantes como o Pan, por exemplo).
Com atletas sempre figurando entre campeões, é rotineiro ver fotos e publicações de
nossos atletas nessas mídias, o que abre a possibilidade de sua marca aparecer em uma
foto no kimono de um deles, por exemplo. </p><p style=""text-align: center;""><img src=""https://s3-sa-east-1.amazonaws.com/cdn.br.catarse/uploads/redactor_rails/picture/data/62830/Captura_de_Tela_2016-08-18_a%CC%80s_11.24.48.png""></p><p style=""text-align: center;""><br></p><p><strong>Na Academia Pedro Martinez:
</strong>Com 200m², a Academia Pedro Martinez conta com amplo espaço
para comportar seus atletas, visitantes e também sua marca através
de comunicação visual com banners, folders, promotores e etc. </p><p><br></p><p style=""text-align: center;""><img src=""https://s3-sa-east-1.amazonaws.com/cdn.br.catarse/uploads/redactor_rails/picture/data/62831/Captura_de_Tela_2016-08-18_a%CC%80s_11.24.56.png""><img src=""https://s3-sa-east-1.amazonaws.com/cdn.br.catarse/uploads/redactor_rails/picture/data/62832/Captura_de_Tela_2016-08-18_a%CC%80s_11.24.28.png"" width=""242"" height=""250"" style=""width: 242px; height: 250px;""></p><p style=""text-align: center;""><br></p><p><strong>Nas Competições:</strong>
Além da exposição que sua marca terá nos quimonos dos atletas nas
principais competições, também há a possibilidade de expormos sua
marca através de banners, faixas e camisetas. </p><p><br></p><p><strong>Agradecimentos</strong> </p><p>Imaginamos o quão corrido é o seu dia, e gostaríamos de agradece-lo por nos receber e dispor de -
seu tempo para nos ouvir e ler nosso material. Este gesto já é muito especial para nós. </p><p>Esperamos que este seja o início de uma grande parceria, onde a reciprocidade seja compromisso
constante. Estamos a disposição para eventuais contatos e gostaríamos também de fazer o convite para
comparecer em nossa matriz na Estrada de Itapecerica da Serra, 3285, conhecer nossa página no facebook e
site, além dos perfis de nossos atletas.
Aguardamos ansiosamente por você!!
Nosso muito obrigado!<br></p>",marinanomundial,,,Esporte,21,https://s3-sa-east-1.amazonaws.com/cdn.br.catarse/uploads/project/uploaded_image/39935/marina-capa.png,https://s3-sa-east-1.amazonaws.com/cdn.br.catarse/uploads/project/uploaded_image/39935/project_thumb_thumb_marina-capa.png,https://s3-sa-east-1.amazonaws.com/cdn.br.catarse/uploads/project/uploaded_image/39935/project_thumb_small_marina-capa.png,https://s3-sa-east-1.amazonaws.com/cdn.br.catarse/uploads/project/uploaded_image/39935/project_thumb_large_marina-capa.png,https://s3-sa-east-1.amazonaws.com/cdn.br.catarse/uploads/project/uploaded_image/39935/project_thumb_video_cover_marina-capa.png,3.91573341686897956000,100.0,1,1,online,flex,published,"2017-04-26 02:59:59.999999","2017-04-25 23:59:59.999999","2016-08-18 15:25:32.775522","2016-08-18 12:25:32.775522",,t,f,t,250,"{""total"" : 212, ""unit"" : ""days""}","{""total"" : 37, ""unit"" : ""days""}",0,"{""city"" : ""São Paulo"", ""state_acronym"" : ""SP"", ""state"" : ""São Paulo""}","{""id"" : 622629, ""name"" : ""Witalo Rebouças""}",0,,f,f,0,f,f,f