project_id,id,user_id,name,headline,budget,goal,about_html,permalink,video_embed_url,video_url,category_name,category_id,original_image,thumb_image,small_image,large_image,video_cover_image,progress,pledged,total_contributions,total_contributors,state,mode,state_order,expires_at,zone_expires_at,online_date,zone_online_date,sent_to_analysis_at,is_published,is_expired,open_for_contributions,online_days,remaining_time,elapsed_time,posts_count,address,user,reminder_count,is_owner_or_admin,user_signed_in,in_reminder,total_posts,can_request_transfer,is_admin_role,contributed_by_friends
4024,4024,161475,"Mesa Branca","Em uma Mesa Branca tudo de inesperado pode acontecer.","O orçamento para projetos anteriores a 24/02/2015 normalmente pode ser encontrado na descrição acima.",8000.0,"<p>Projeto de curta-metragem elaborado, inicialmente, pelos estudantes de Cinema Edison Eduarddo, o roteirista, e Marina Rodriguez, a diretora, para uma disciplina em comum de Roteiro e Direção.</p>

<p>O curta vai mostrar os acontecimentos de uma tarde na vida de Victor, um rapaz simples que resolve reunir um grupo de amigos para realizar uma sessão de ”jogo do copo” com o objetivo de contactar sua mãe, falecida há 7 meses. Porém, os interesses divergentes das pessoas envolvidas mostrarão quem realmente elas são e o verdadeiro motivo de estarem ali. Segredos não serão poupados.</p>

<p>Pensado durante todo o ano de 2013, hoje, felizmente, o projeto toma proporções reais e maiores com o desejo contínuo de realizá-lo. O ensaio com os atores já foi iniciado.</p>

<p>De saída, o caixa deste projeto conta com 4 mil reais que é pouco para tudo o que precisa ser implementado. A princípio, serão destinados para figurino, principalmente para o da mãe de santo Dona Jô.</p>

<p>Para maquiagem e aluguel dos equipamentos, que ainda estão faltando, estabelecemos uma meta de 8 mil reais, que serão destinados às demais funções técnicas, como direção de arte, maquinaria/elétrica, sons que devem ser feitos na pós produção, edição e catering, indispensável.</p>

<p>Nós estamos bastante animados e temos como objetivo abranger toda a atenção e mídia possíveis para o apoio deste projeto. Certos de que produziremos um bom e inovador curta-metragem uma vez que grande parte da equipe está começando suas carreiras agora.</p>

<p>O nosso público-alvo são todas as pessoas de mente jovem e aberta, de qualquer idade, principalmente estudantes de cinema, publicidade ou apenas cinéfilos.</p>

<p>Esta é uma história que nos dá muito prazer em contar por ser diferente das que já estamos acostumados a ver. É ambientada em um set simples, porém com um tema central forte e peculiar. E, por fim, pensada com muito carinho, está sendo desenvolvida por pessoas dispostas a trabalhar firme em cima.</p>

<p>É um filme pensado e feito para você, espectador.</p>
",mesabranca,//player.vimeo.com/video/96738472,https://vimeo.com/96738472,"Cinema e Vídeo",13,https://s3-sa-east-1.amazonaws.com/cdn.br.catarse/uploads/project/uploaded_image/4024/031.JPG,https://s3-sa-east-1.amazonaws.com/cdn.br.catarse/uploads/project/uploaded_image/4024/project_thumb_thumb_031.JPG,https://s3-sa-east-1.amazonaws.com/cdn.br.catarse/uploads/project/uploaded_image/4024/project_thumb_small_031.JPG,https://s3-sa-east-1.amazonaws.com/cdn.br.catarse/uploads/project/uploaded_image/4024/project_thumb_large_031.JPG,https://s3-sa-east-1.amazonaws.com/cdn.br.catarse/uploads/project/uploaded_image/4024/project_thumb_video_cover_031.JPG,11.93750000000000000000,955.0,22,21,failed,aon,finished,"2014-07-16 02:59:59","2014-07-15 23:59:59","2014-06-05 22:01:04.371593","2014-06-05 19:01:04.371593",,t,t,f,40,"{""total"" : 0, ""unit"" : ""seconds""}","{""total"" : 40, ""unit"" : ""days""}",0,"{""city"" : ""Niterói"", ""state_acronym"" : ""RJ"", ""state"" : ""Rio de Janeiro""}","{""id"" : 161475, ""name"" : ""Marina Ferreira Rodrigues""}",0,,f,f,0,f,f,f