project_id,id,user_id,name,headline,budget,goal,about_html,permalink,video_embed_url,video_url,category_name,category_id,original_image,thumb_image,small_image,large_image,video_cover_image,progress,pledged,total_contributions,total_contributors,state,mode,state_order,expires_at,zone_expires_at,online_date,zone_online_date,sent_to_analysis_at,is_published,is_expired,open_for_contributions,online_days,remaining_time,elapsed_time,posts_count,address,user,reminder_count,is_owner_or_admin,user_signed_in,in_reminder,total_posts,can_request_transfer,is_admin_role,contributed_by_friends
40394,40394,625777,"Judô Futuro","Formando faixa preta, dentro e fora dos tatames.","<p>Para formar três turmas de 30 alunos cada , sendo 1 turma de terça e quinta a tarde e 2 turmas de quarta e sexta, manha e tarde, precisamos de investimento para: 90 kimonos custando 40,00 cada um totaliza R$ 3,600.00. Cesta básica para os alunos que obter notas boas e com melhor disciplina escolar. Professor mais ajudante de sala no período de 6 meses R$ 2.000,00 mensal , totalizando 12.000,00. Lanche no final do treino R$ 500,00 mensal , totalizando R$ 3000,00. </p><p>Para tornar isso realidade precisamos de R$ 18.600,00.</p>",18600.0,"<p><em>********** Veja as últimas notícias sobre o projeto na </em>aba NOVIDADES *********</p><p><em>Buscamos pessoas e empresas parceiras a fim de contribuir para o desenvolvimento da educação de crianças e adolescentes. Dessa forma, temos</em><em> a Educação/Esporte como foco principal de sua atuação, promovendo a cidadania, inserção social.</em></p><p>O Projeto nasceu
quando o Sensei Renato foi convidado para dar aulas para crianças carentes no projeto Tempo de Escola, era uma proposta de educação integral que
foi implantada pela Secretaria Municipal de Educação de São Bernardo. Em contato com os alunos,
Renato se apaixonou pela proposta. Viu a mudança em cada jovem
das suas classes, como Lucas. Mas os investimentos da
prefeitura acabaram.</p><p>Renato percebeu a
importância que o projeto
exercia na vida das crianças, e não ficou parado, decidiu começar algo semelhante. Com a ajuda e
investimentos pessoal conseguiu uma sala e equipamento  necessário para pratica do esporte no Clube CRE Fundação. Agora queremos dar mais um passo,  formar turmas de terças e quintas e quartas e sextas para crianças de escolas públicas com rendimentos baixos escolares. A proposta do
projeto é resgatar crianças que não tem estimulo escolar e notas abaixa da media,  assim Lucas ira para escola no período da manha e a tarde freqüentará o Judô
Futuro , onde proporcionara
desenvolvimento físico, psíquico e social de forma integrada.  </p><p>Cronograma</p><p>O nosso objetivo é transformar o ambiente da prática esportiva em um espaço acolhedor para todos, no qual o processo de aprendizagem seja cooperativo, contínuo, valorize e responda as diferenças humanas tendo como ideia ser permanente e  atingir o
maior número de alunos, formando judocas que possam participar de competições
profissionais  pelo mundo, mas para isso
precisamos dar o primeiro passo.</p><p>As aulas serão realizadas no DOJO (local onde se treina judô) montada pelo </p><p>CREF - Centro Recreativo e Esportivo Fundação em São Caetano do Sul</p><p>Rua Ceará, 509 Bairro Fundação.</p><p>Vamos começar com total de 90 alunos no período de 6 meses.</p><p>A equipe de professores serão formadas por 2 professores graduado faixa preta federado e com graduação e registro da FPJ (Federação Paulista de Judô)</p><p>Lembrando que Escola , Projeto e Família - Juntos teremos uma forte parceria!</p><p>Vamos buscar aproximação entre a escola e os familiares de nossos alunos, oferecendo momentos para encontros que promovam reflexões sobre temas relacionados à infância, à adolescência e/ou à vida escolar de nossos alunos, além de lazer e integração. É um espaço aberto em que educadores e familiares se reúnem para discutir, trocar experiências e idéias, no intuito de buscar caminhos em conjunto na missão de educar. Consideramos importante valorizar o vínculo entre escola e família, para que o processo educacional ocorra por meio de uma forte parceria. </p>",judo_futuro_7193,//www.youtube.com/embed/bhgzNVsF-bw,https://youtu.be/bhgzNVsF-bw,Esporte,21,https://s3-sa-east-1.amazonaws.com/cdn.br.catarse/uploads/project/uploaded_image/40394/Screen_shot_2016-08-11_at_5.20.28_PM.png,https://s3-sa-east-1.amazonaws.com/cdn.br.catarse/uploads/project/uploaded_image/40394/project_thumb_thumb_Screen_shot_2016-08-11_at_5.20.28_PM.png,https://s3-sa-east-1.amazonaws.com/cdn.br.catarse/uploads/project/uploaded_image/40394/project_thumb_small_Screen_shot_2016-08-11_at_5.20.28_PM.png,https://s3-sa-east-1.amazonaws.com/cdn.br.catarse/uploads/project/uploaded_image/40394/project_thumb_large_Screen_shot_2016-08-11_at_5.20.28_PM.png,https://s3-sa-east-1.amazonaws.com/cdn.br.catarse/uploads/project/uploaded_image/40394/project_thumb_video_cover_Screen_shot_2016-08-11_at_5.20.28_PM.png,13.17204301075268817200,2450.0,19,17,online,aon,published,"2016-10-25 01:59:59.999999","2016-10-24 23:59:59.999999","2016-08-25 19:57:09.59795","2016-08-25 16:57:09.59795",,t,f,t,60,"{""total"" : 29, ""unit"" : ""days""}","{""total"" : 30, ""unit"" : ""days""}",2,"{""city"" : ""São Caetano do Sul"", ""state_acronym"" : ""SP"", ""state"" : ""São Paulo""}","{""id"" : 625777, ""name"" : ""Renato Rodrigues""}",0,,f,f,2,f,f,f