project_id,id,user_id,name,headline,budget,goal,about_html,permalink,video_embed_url,video_url,category_name,category_id,original_image,thumb_image,small_image,large_image,video_cover_image,progress,pledged,total_contributions,total_contributors,state,mode,state_order,expires_at,zone_expires_at,online_date,zone_online_date,sent_to_analysis_at,is_published,is_expired,open_for_contributions,online_days,remaining_time,elapsed_time,posts_count,address,user,reminder_count,is_owner_or_admin,user_signed_in,in_reminder,total_posts,can_request_transfer,is_admin_role,contributed_by_friends
409,409,17764,"ABRINDO O RELICÁRIO","""Abrindo o Relicário” no Mapa Cultural Paulista 2011: Lembranças e sentimentos despertados num recorte imaginário entre a vida e a morte.","O orçamento para projetos anteriores a 24/02/2015 normalmente pode ser encontrado na descrição acima.",3500.0,"<p>Quem nunca guardou pequenas coisas que tinham um grande significado na sua vida!? Quem não possui lembranças e cheiros característicos da infância!? Este projeto busca despertar tudo isso no público, mas utilizando de recortes que passam diante de nossos olhos num momento entre a vida e a morte.</p>

<p>Este projeto é idealizado pelo Segundo Encontro Grupo de Teatro que é formado por quatro atores que se conheceram em um curso livre de teatro e resolveram se juntar para pesquisar as linguagens da cena, através do teatro, da dança, da improvisação e do texto dramatúrgico.
Este grupo começou em abril de 2010 e desde então está pesquisando estas diversas linguagens teatrais e dividindo com o público todo seu amor pelo teatro.</p>

<p>O primeiro desejo do grupo foi em trabalhar com a linguagem de teatro-dança. Como os atores já conheciam o trabalho dançarina Ana Clara Amaral, ela foi convidada para dirigir um espetáculo nesta linguagem.
Daí, depois de diversos estudos, conversas e experiências pessoais a temática da morte foi um consenso comum a todos. O desafio era arejar este tema, tratar da morte de forma poética.  Foi então que nasceu o espetáculo &quot;Relicário&quot;.</p>

<p>Dizem que as pessoas que vivenciaram uma experiência de quase morte, veem passar um trailer da sua vida diante de seus olhos. Assim, o espetáculo é uma mistura de memórias, desejos e delírios que são pendurados e retirados deste relicário na presença do público.</p>

<p>Então o espetáculo Relicário foi inscrito no Mapa Cultural Paulista 2011. Onde ele GANHOU a etapa Municipal, em Campinas. E, o espetáculo foi selecionado para representar Campinas na fase regional do Mapa Cultural 2011, que vai acontecer em outra cidade.
No entanto, para viabilizar o grupo a participar desta nova etapa será necessário levantar recursos para contratação de técnicos de luz, som e projetor, aluguel de espaço para ensaios e, principalmente, compra de  equipamentos como projetor, globo e materiais de cena, que são utilizados no espetáculo.
Este custo está estimado em aproximadamente R$3500,00. Por isso estamos buscando o apoio de todos vocês através do site do Catarse, que é um projeto muito bacana e consiste em captar recursos para diversos projetos, inclusive culturais.</p>

<p>Com a ajuda de vocês poderemos realizar este projeto e abrir, mais uma vez, nosso &quot;Relicário&quot; para o público.</p>

<p>Contamos com a ajuda de todos.
Obrigado,
Segundo Encontro Grupo de Teatro</p>

<p>visite o <a class=""alt-link"" target=""_blank"" href=""http://www.2encontro.blogspot.com"">nosso blog</a></p>
",abrindo-o-relicario,//player.vimeo.com/video/30979675,http://vimeo.com/30979675,"Teatro e Dança",19,,https://s3-sa-east-1.amazonaws.com/cdn.br.catarse/uploads/project/video_thumbnail/409/project_thumb_thumb_open-uri20131125-2-1ox2htv,https://s3-sa-east-1.amazonaws.com/cdn.br.catarse/uploads/project/video_thumbnail/409/project_thumb_small_open-uri20131125-2-1ox2htv,https://s3-sa-east-1.amazonaws.com/cdn.br.catarse/uploads/project/video_thumbnail/409/project_thumb_large_open-uri20131125-2-1ox2htv,https://s3-sa-east-1.amazonaws.com/cdn.br.catarse/uploads/project/video_thumbnail/409/project_thumb_video_cover_open-uri20131125-2-1ox2htv,103.1428571428571400,3610.0,44,42,successful,aon,finished,"2011-11-28 01:59:59","2011-11-27 23:59:59","2011-09-29 01:59:59","2011-09-28 22:59:59",,t,t,f,60,"{""total"" : 0, ""unit"" : ""seconds""}","{""total"" : 60, ""unit"" : ""days""}",1,"{""city"" : ""Rio de Janeiro"", ""state_acronym"" : ""RJ"", ""state"" : ""Rio de Janeiro""}","{""id"" : 17764, ""name"" : """"}",0,,f,f,1,f,f,f