project_id,id,user_id,name,headline,budget,goal,about_html,permalink,video_embed_url,video_url,category_name,category_id,original_image,thumb_image,small_image,large_image,video_cover_image,progress,pledged,total_contributions,total_contributors,state,mode,state_order,expires_at,zone_expires_at,online_date,zone_online_date,sent_to_analysis_at,is_published,is_expired,open_for_contributions,online_days,remaining_time,elapsed_time,posts_count,address,user,reminder_count,is_owner_or_admin,user_signed_in,in_reminder,total_posts,can_request_transfer,is_admin_role,contributed_by_friends
41125,41125,630755,"Livro Meu Nome é Se7e","Ano 2039, Thriller policial sombrio e perturbador. Nem sempre o futuro é como imaginamos.","<p><img src=""https://s3-sa-east-1.amazonaws.com/cdn.br.catarse/uploads/redactor_rails/picture/data/65671/JFGHFVHGDGVCGDG.jpg""></p><p>O orçamento do livro ""Meu Nome é Se7e"" se divide da seguinte maneira: </p><p><em>70% do dinheiro arrecado vai para os
custos de impressão do livro</em></p><p><em>13% de comissão para o catarse<br></em></p><p><em>7% para diagramação e design gráfico</em></p><p><em><span class=""redactor-invisible-space"">8% com custos de
envio</span><span class=""redactor-invisible-space""> </span><br></em></p><p><span class=""redactor-invisible-space""><em>2% para as demais recompensas.</em></span></p>",4200.0,"<p>Trata de uma
história de ficção, Thriller policial sombrio e perturbador ambientado em Salvador de 2039, uma era considerada como um dos períodos mais corruptos e violentos da história do país. Nem sempre o futuro é como imaginamos. A história vai leva-lo a diversos locais e situações a medida em que a trama se desenrola. Rico em personagens marcantes e de personalidades fortes, e eu os convido entrar nessa aventura.<br></p><p>DIgital:<img src=""https://s3-sa-east-1.amazonaws.com/cdn.br.catarse/uploads/redactor_rails/picture/data/65658/Livro_digital.jpg""></p><p>Se7e, um assassino sádico, desequilibrado, psicopata, frio e calculista. Seu nome enche do mais puro medo os sentimentos das pessoas que cruzarem seu aminho. Quando criança já torturara animais, roubava e cometia atrocidades. Já na fase adulta, contratado por um político para fazer o que mais gosta de fazer: matar.<br></p><p>Jeses Londo, policial órfão de pai e mãe desde sempre. Tem uma mente investigativa impressionante, habilidades ímpares no gatilho e poder de associação muito eficiente. Enfrenta uma crise existencial enquanto tenta desmascarar um grande esquema de atrocidade e corrupção, junto com sua parceira...</p><p><img src=""https://s3-sa-east-1.amazonaws.com/cdn.br.catarse/uploads/redactor_rails/picture/data/65660/Livro_impresso.jpg""></p><p>Emily Kovalski, sofre com doença terminal na família e que quer vingar o pai, ex-policial, que fora assassinado por uma máfia criminosa.</p><p>Franklin Nazan, político ambicioso que não mede esforço para alcançar seu objetivo principal, que é ficar no topo da pirâmide político independente do que tenha que fazer. Único laço que tem de amor é a filha que sofre de câncer.</p><p><img src=""https://s3-sa-east-1.amazonaws.com/cdn.br.catarse/uploads/redactor_rails/picture/data/65661/Livro_impresso1.jpg""></p><p>COMO COLABORAR</p><p>A
colaboração é espontânea e cada um ajuda com o que pode. Quanto maior o
investimento, maior a recompensa!</p><p>Selecione
uma das recompensas no canto superior direito dessa página, clique sobre ela, selecione
a forma de pagamento e finalize o processo. Simples! Qualquer dúvida vocês
podem entrar em contato pelo e-mail jefersonjunio@hotmail.com ou pelo WhatsApp
(71) 9 8789 6681.</p><p>Se
atingirmos o valor total do projeto no prazo estipulado, você terá sua
recompensa na data prevista (veja na recompensa), caso contrário todo dinheiro
será devolvido a vocês. Por isso, solicitamos também sua ajuda na divulgação
desta campanha! Compartilhem com seus familiares, em suas redes sociais,
amigos, vizinhos e amigos de amigos.</p>",livro_meu_nome_e_se7e_7c79,,,Literatura,20,https://s3-sa-east-1.amazonaws.com/cdn.br.catarse/uploads/project/uploaded_image/41125/1.jpg,https://s3-sa-east-1.amazonaws.com/cdn.br.catarse/uploads/project/uploaded_image/41125/project_thumb_thumb_1.jpg,https://s3-sa-east-1.amazonaws.com/cdn.br.catarse/uploads/project/uploaded_image/41125/project_thumb_small_1.jpg,https://s3-sa-east-1.amazonaws.com/cdn.br.catarse/uploads/project/uploaded_image/41125/project_thumb_large_1.jpg,https://s3-sa-east-1.amazonaws.com/cdn.br.catarse/uploads/project/uploaded_image/41125/project_thumb_video_cover_1.jpg,3.09523809523809523800,130.0,4,4,online,aon,published,"2016-11-04 01:59:59.999999","2016-11-03 23:59:59.999999","2016-09-04 16:35:02.303816","2016-09-04 13:35:02.303816",,t,f,t,60,"{""total"" : 39, ""unit"" : ""days""}","{""total"" : 20, ""unit"" : ""days""}",0,"{""city"" : ""Salvador"", ""state_acronym"" : ""BA"", ""state"" : ""Bahia""}","{""id"" : 630755, ""name"" : ""Jeferson Alcantara""}",0,,f,f,0,f,f,f