project_id,id,user_id,name,headline,budget,goal,about_html,permalink,video_embed_url,video_url,category_name,category_id,original_image,thumb_image,small_image,large_image,video_cover_image,progress,pledged,total_contributions,total_contributors,state,mode,state_order,expires_at,zone_expires_at,online_date,zone_online_date,sent_to_analysis_at,is_published,is_expired,open_for_contributions,online_days,remaining_time,elapsed_time,posts_count,address,user,reminder_count,is_owner_or_admin,user_signed_in,in_reminder,total_posts,can_request_transfer,is_admin_role,contributed_by_friends
413,413,26158,"Rica & Iowa Trio no Brasil","Um músico brasileiro, três norte-americanos e um italiano fazendo samba-jazz em SP. Entre nessa turnê com a gente! [Do this tour with us!]","O orçamento para projetos anteriores a 24/02/2015 normalmente pode ser encontrado na descrição acima.",24800.0,"<p>Comecei a cantar, tocar, compor e me apresentar ainda aos 13 anos. Desde 2007, quando vivi em Roma, estive envolvido com o intercâmbio sonoro entre ritmos do Brasil e de outras culturas. Em agosto de 2011, apresentei na Itália meu primeiro trabalho, “Em Casa”, totalmente independente, feito com a participação de três jazzistas norte-americanos. </p>

<p>[I started singing, playing, composing and presenting myself when I was 13. Since 2007, when I lived in Rome, I’ve been involved in exchanging sonorities among brazilian and other cultures rhythms. In august 2011, I presented in Italy my first work, “Em Casa”, totally independent and recorded with the participation of three jazzists from the US].</p>

<p>O compacto inclui “Domingo de Luz”, samba-jazz italiano composto em Sevilha durante um período de imersão na música flamenca, e “Mil Perdões”, releitura naturalista das palavras mordazes do compositor carioca Chico Buarque, que aliás ouviu e autorizou a venda do disco sem ônus.</p>

<p>[The single includes “Domingo de Luz”, an Italian samba-jazz composed in Seville during an immersion period in the Flamenco music, and “Mil Perdões”, a naturalist rereading of pungent words by the carioca composer Chico Buarque, who listened to the album and authorized it’s selling without any charge].</p>

<p>Agora quero reviver esse encontro entre samba e jazz, trazendo os amigos de Iowa pra tocar aqui na minha cidade. A ideia é realizar uma turnê paulistana, em janeiro de 2012, com os mesmos três jovens músicos dos EUA e o percussionista romano que tocou comigo na Itália. Mas não é só isso: durante a estadia deles no Brasil, a gente também quer completar o álbum, gravando em estúdio mais cinco composições minhas. </p>

<p>[Now I want to do a tour, in January 2012, here in São Paulo, with the same three American musicians, plus the Roman percussionist who played with me in Italy. We want to show this mix of samba and jazz in many places here in São Paulo and also record other 5 songs of mine, that are ready to go. By doing so, we will complete the album].</p>

<p>A casa, então, está aberta. E você é muito bem-vindo. Entre no site <a class=""alt-link"" href=""http://www.catarse.me"" target=""_blank"">www.catarse.me</a>, clique no projeto “Rica &amp; Iowa Trio no Brasil” e participe. Faça essa turnê com a gente. Compartilhe conosco essa emoção. </p>

<p>[So the house is open. And you are very welcome. Go on the website <a class=""alt-link"" href=""http://www.catarse.me"" target=""_blank"">www.catarse.me</a>, click on “Rica &amp; Iowa Trio no Brasil” project and join us. Let’s do this tour together. Share all of these emotions].</p>

<p>Clique aqui pra ouvir o compacto “Em Casa”, recentemente apresentado na Itália, em festivais, bares, festas, praças e também na rádio italiana Rai:</p>

<p>[Click on the link below to listen to the single “Em Casa”, recently presented in Italy, on festivals, bars, parties, squares and also on the italian radio Rai]:</p>

<p><a class=""alt-link"" href=""http://www.soundcloud.com/rica-emcasa"" target=""_blank"">www.soundcloud.com/rica-emcasa</a></p>

<p>Saúde!</p>

<p>[Cheers!]</p>

<p>Valor almejado?
R$ 24,8 mil </p>

<p>Como esse dinheiro vai ser gasto?
Com passagens, hospedagem e alimentação dos três músicos norte-americanos e do percussionista romano durante 20 dias em São Paulo, em janeiro de 2012. Além disso, os recursos serão investidos nas horas de estúdio necessárias para gravação, mixagem e masterização de 5 faixas.</p>
",rica-iowa-trio-no-brasil,//player.vimeo.com/video/31101407,http://www.vimeo.com/31101407,Música,16,,https://s3-sa-east-1.amazonaws.com/cdn.br.catarse/uploads/project/video_thumbnail/413/project_thumb_thumb_open-uri20131125-2-1eevla1,https://s3-sa-east-1.amazonaws.com/cdn.br.catarse/uploads/project/video_thumbnail/413/project_thumb_small_open-uri20131125-2-1eevla1,https://s3-sa-east-1.amazonaws.com/cdn.br.catarse/uploads/project/video_thumbnail/413/project_thumb_large_open-uri20131125-2-1eevla1,https://s3-sa-east-1.amazonaws.com/cdn.br.catarse/uploads/project/video_thumbnail/413/project_thumb_video_cover_open-uri20131125-2-1eevla1,100.08467741935483871000,24821.0,46,41,successful,aon,finished,"2011-12-13 01:59:59","2011-12-12 23:59:59","2011-10-14 01:59:59","2011-10-13 22:59:59",,t,t,f,60,"{""total"" : 0, ""unit"" : ""seconds""}","{""total"" : 60, ""unit"" : ""days""}",0,"{""city"" : ""São Paulo"", ""state_acronym"" : ""SP"", ""state"" : ""São Paulo""}","{""id"" : 26158, ""name"" : ""Ricardo Coen Pirani""}",0,,f,f,0,f,f,f