project_id,id,user_id,name,headline,budget,goal,about_html,permalink,video_embed_url,video_url,category_name,category_id,original_image,thumb_image,small_image,large_image,video_cover_image,progress,pledged,total_contributions,total_contributors,state,mode,state_order,expires_at,zone_expires_at,online_date,zone_online_date,sent_to_analysis_at,is_published,is_expired,open_for_contributions,online_days,remaining_time,elapsed_time,posts_count,address,user,reminder_count,is_owner_or_admin,user_signed_in,in_reminder,total_posts,can_request_transfer,is_admin_role,contributed_by_friends
41634,41634,293953,"3 em 1 – Os desafios do Triathlon","Liberdade, dedicação e aventura.","<p><font>O
valor arrecadado será utilizado na revisão, diagramação,
formatação do eBook, divulgação e pagamento da comissão do site
Catarse.</font></p><p><font><br><br></font></p>",7800.0,"<p>Escrito
de maneira leve, “3 em 1 – Os desafios do Triathlon"" é
um livro que tem como base a paixão da autora pelo esporte.
Gabriela Salgado Pilotto ama correr, pedalar e nadar. Na obra, ela
compartilha experiências e histórias relacionadas ao mundo das
corridas de rua, das maratonas, das corridas de aventura e dos
triathlons.<br></p><p>A leitura é oportuna para os apaixonados,
interessados ou curiosos sobre esse mundo, que algumas vezes parece
um pouco diferente e distante de quem não vive ou não tem ninguém
por perto que pratica.<br><br>As
histórias vividas por Gabriela podem contagiar e envolver qualquer
um. A diferença dos atletas ativos ou dos ainda não atletas é que
algumas situações contadas no livro serão novidades que poderão
despertar ainda mais o interesse em entrar nesse mundo de corridas e
triathlons, e já para os atletas, os mesmos podem se imaginar em
algumas situações semelhantes e se divertirem.</p><p><strong>A
autora</strong><br></p><p>Gabriela Salgado Pilotto é ex-bailarina clássica
que pendurou suas sapatilhas após 13 anos de dança no ano de 2002.
Cursou Administração de Empresas na FAAP e tem MBA em Marketing na
ESPM. Trabalhou mais de dez anos nas áreas comercial e marketing no
Brasil. Mora em Berlim desde 2014 e hoje executa projetos para trazer
empresas brasileiras para Alemanha. <br><br>Apaixonada por esportes,
desde de 2002 percorreu alguns países como Chile, Argentina e Costa
Rica fazendo corridas de aventura. Explorou também alguns cantos
especiais do Brasil e sua primeira Maratona foi no Rio de Janeiro em
2009. Participou de seu primeiro triathlon em 2011 no Brasil e seu
primeiro triathlon  de meia distância em 2016 na Alemanha.<br><br><strong>Como
colaborar?</strong><br><br>É
simples! Leia as recompensas oferecidas na coluna da direita dessa
página e escolha a que melhor atende. Clique sobre ela, selecione a
forma de pagamento e finalize o processo. É super rápido!<br></p><p>As recompensas serão enviadas a
partir de abril de 2017.<br><br>Esperamos
que tenham gostado do projeto. A concretização dele será um sonho
realizado!<br><br><strong>Metas
Adicionais</strong><br></p><p>Após atingirmos a meta inicial (R$ 7.800),
teremos novos desafios. Com eles, será possível melhorar o projeto
em vários aspectos e, principalmente, produzir também o livro no
formato impresso.<br><br>Uma vez alcançada a 2ª
meta (R$19.200), presentearemos todos que estão ajudando o projeto
com valores iguais ou superiores a R$30, também com um livro no
formato impresso + mais um marcador exclusivo. E eles serão enviados
gratuitamente para todo o Brasil (se o colaborador residir fora do
território nacional, os custos do envio serão por conta do
próprio).</p><p><i>Caso
o valor arrecadado fique entre R$7.800 e R$19.200, o valor excedente
ao necessário para a produção do eBook será utilizado no
aprimoramento do eBook e em doações para um ou mais projetos sociais ligados ao esporte.</i></p>",triathlon_8e9b,//player.vimeo.com/video/182665423,https://vimeo.com/182665423,Literatura,20,https://s3-sa-east-1.amazonaws.com/cdn.br.catarse/uploads/project/uploaded_image/41634/card_projeto.jpg,https://s3-sa-east-1.amazonaws.com/cdn.br.catarse/uploads/project/uploaded_image/41634/project_thumb_thumb_card_projeto.jpg,https://s3-sa-east-1.amazonaws.com/cdn.br.catarse/uploads/project/uploaded_image/41634/project_thumb_small_card_projeto.jpg,https://s3-sa-east-1.amazonaws.com/cdn.br.catarse/uploads/project/uploaded_image/41634/project_thumb_large_card_projeto.jpg,https://s3-sa-east-1.amazonaws.com/cdn.br.catarse/uploads/project/uploaded_image/41634/project_thumb_video_cover_card_projeto.jpg,95.12820512820512820500,7420.0,61,59,online,aon,published,"2016-11-04 01:59:59.999999","2016-11-03 23:59:59.999999","2016-09-15 00:14:51.579029","2016-09-14 21:14:51.579029",,t,f,t,50,"{""total"" : 39, ""unit"" : ""days""}","{""total"" : 10, ""unit"" : ""days""}",1,"{""city"" : ""Rio de Janeiro"", ""state_acronym"" : ""RJ"", ""state"" : ""Rio de Janeiro""}","{""id"" : 293953, ""name"" : ""Via Escrita Editora Ltda.""}",3,,f,f,3,f,f,f