project_id,id,user_id,name,headline,budget,goal,about_html,permalink,video_embed_url,video_url,category_name,category_id,original_image,thumb_image,small_image,large_image,video_cover_image,progress,pledged,total_contributions,total_contributors,state,mode,state_order,expires_at,zone_expires_at,online_date,zone_online_date,sent_to_analysis_at,is_published,is_expired,open_for_contributions,online_days,remaining_time,elapsed_time,posts_count,address,user,reminder_count,is_owner_or_admin,user_signed_in,in_reminder,total_posts,can_request_transfer,is_admin_role,contributed_by_friends
41916,41916,367338,"Documentário - Coração Viajante","Uma história que vale a pena ser contada!","<p>Será investido um total de R$ 6.000,00 incluindo todo o processo de produção, divulgação e exibição, além das taxas administrativas do Catarse e confecção de recompensas.</p>",6000.0,"<hr><p>Nossos olhos brilham quando falamos que estamos em processo de produção de um documentário sobre a caminhoneira Duda Nervis. </p><p>É uma história que nos encanta, uma personagem que nos fascina. No começo, era apenas uma boa opção para o nosso trabalho, mas encontramos uma história de vida única e uma grande oportunidade de produção.</p><p>O documentário é o nosso Projeto Experimental de conclusão  do curso de Jornalismo da Universidade Comunitária da Região de Chapecó - Unochapecó. Temos como orientadora a professora Ilka Goldschmidt.</p><hr><p><strong>A proposta é:</strong></p><p>Produção de um documentário que retrata a vida da caminhoneira Chapecoense
Duda Nervis. Há mais de dez anos ela largou uma vida considerada ""normal"" e
resolveu pegar a estrada sobre um caminhão. Foi a primeira motorista a tirar
CNH E em Chapecó-SC.
Além disso, a história de vida de Duda é surpreendente pois ela entrou na profissão após o término de um casamento de anos. </p><p>Aos 3 anos de idade ela
foi “roubada” da mãe, pelo próprio pai. Este fato abriu uma brecha de 8 anos na
história de mãe e filha. O reencontro é como uma história de novela, que a gente quase não acredita que seja realidade.</p><p>O documentário já está em processo de produção, e será concluído até o final de
outubro de 2016. Envolve diversas viagens, para registrar momentos e falas das
principais pessoas que fazem parte da história da caminhoneira, além de viagens
de caminhão, para registrar o dia-a-dia de Duda na estrada. </p><p>Assista um trecho do depoimento da dona Leonilda, mãe de Duda e sinta parte da emoção que o documentário irá transmitir:<iframe src=""//www.youtube.com/embed/YzJHohQKu84"" frameborder=""0"" allowfullscreen="""" style=""font-size: 14px; line-height: 1.6em; width: 500px; height: 281px;""></iframe>Serão mais de 1000 km rodados até a conclusão do projeto que passa pelo Rio Grande do Sul e Santa Catarina.</p><p>Precisamos muito da sua colaboração, pois ainda temos muito caminho pela frente e a grana está bem curta. Não queremos que isso comprometa todo o esforço que estamos demandando nesta produção.</p><p><img src=""https://s3-sa-east-1.amazonaws.com/cdn.br.catarse/uploads/redactor_rails/picture/data/68349/Imagem4.png""></p><p><br></p>",documentario_coracao_viajante_a998,,,Jornalismo,15,https://s3-sa-east-1.amazonaws.com/cdn.br.catarse/uploads/project/uploaded_image/41916/WhatsApp_Image_2016-09-12_at_13.27.08.jpeg,https://s3-sa-east-1.amazonaws.com/cdn.br.catarse/uploads/project/uploaded_image/41916/project_thumb_thumb_WhatsApp_Image_2016-09-12_at_13.27.08.jpeg,https://s3-sa-east-1.amazonaws.com/cdn.br.catarse/uploads/project/uploaded_image/41916/project_thumb_small_WhatsApp_Image_2016-09-12_at_13.27.08.jpeg,https://s3-sa-east-1.amazonaws.com/cdn.br.catarse/uploads/project/uploaded_image/41916/project_thumb_large_WhatsApp_Image_2016-09-12_at_13.27.08.jpeg,https://s3-sa-east-1.amazonaws.com/cdn.br.catarse/uploads/project/uploaded_image/41916/project_thumb_video_cover_WhatsApp_Image_2016-09-12_at_13.27.08.jpeg,15.58333333333333333300,935.0,30,28,online,flex,published,"2016-10-15 02:59:59.999999","2016-10-14 23:59:59.999999","2016-09-15 02:08:29.931715","2016-09-14 23:08:29.931715",,t,f,t,30,"{""total"" : 19, ""unit"" : ""days""}","{""total"" : 10, ""unit"" : ""days""}",0,"{""city"" : ""Chapecó"", ""state_acronym"" : ""SC"", ""state"" : ""Santa Catarina""}","{""id"" : 367338, ""name"" : ""Daniel e Vanessa""}",1,,f,f,0,f,f,f