project_id,id,user_id,name,headline,budget,goal,about_html,permalink,video_embed_url,video_url,category_name,category_id,original_image,thumb_image,small_image,large_image,video_cover_image,progress,pledged,total_contributions,total_contributors,state,mode,state_order,expires_at,zone_expires_at,online_date,zone_online_date,sent_to_analysis_at,is_published,is_expired,open_for_contributions,online_days,remaining_time,elapsed_time,posts_count,address,user,reminder_count,is_owner_or_admin,user_signed_in,in_reminder,total_posts,can_request_transfer,is_admin_role,contributed_by_friends
41962,41962,636871,Calvário,"Até quando vamos fingir que nada disso está acontecendo?","<p><img src=""https://s3-sa-east-1.amazonaws.com/cdn.br.catarse/uploads/redactor_rails/picture/data/67595/como.jpg""></p><p>       Nossas campanhas de crowdfunding para a produçao de CALVARIO  pretendem garantir uma criação artística livre e de alta qualidade, e permitir assim que o projeto finalizado tenha acesso a festivais nacionais e internacionais. Nosso objetivo é produzir um filme que dialogue com o publico adulto mais amplo e diversificado possivel, dentro e fora do Brasil.<br></p><p>Já contamos com a colaboração e o talento de uma equipe de profissionais motivados, um elenco forte e experiente e uma boa razão para contar essa história.</p><p>Agora, precisamos de sua ajuda financeira para realizar este projeto da pré a pós-produção.</p><p>Precisamos muito de sua ajuda para tornar este projeto uma realidade e atingir o maior número possível de pessoas no Brasil e no exterior. Você também pode nos apoiar compartilhando e divulgando o nosso projeto nas redes sociais!</p><p>Toda ajuda será bem-vinda! Obrigado por acreditar no projeto!</p><p><strong>How we’ll use the funds<br></strong></p><p>Our crowdfunding campaigns aim to give us professional 
conditions to create freely and launch the movie in national and 
international festivals. Our ambition is to produce a film that will 
establish a dialogue with the largest adult audience possible in Brazil 
and elsewhere.<br></p><p>We need your financial help to meet the costs of the entire filming process, from pre to post-production. And to thank you for your help, we propose several kinds of rewards that range from acknowledgement in the movie social media pages to the opportunity of an associate producer credit (See list). </p><p>You can also help us by disclosing our project on your social networks. Join us! Your support is vital for the project!<br></p><p><strong>Votre aide financière</strong></p><p>Nos campagnes de crowdfunding ont pour objectif de nous doter des 
meilleures conditions de création possibles et d’assurer le lancement de
 ce projet sur les festivals nationaux et internationaux.  Notre 
ambition est de produire un film qui puisse atteindre un public adulte 
diversifié.<br></p><p>Nous avons besoin de votre aide pour couvrir les coûts du tournage, de la pré à la post-production.</p><p>Pour vous remercier de votre aide nous offrons plusieurs options de récompenses, qui vont du remerciement nominal sur les réseaux sociaux du film à la possibilité d’en devenir producteur associé (voir liste).</p><p>Vous pouvez aussi nous aider en divulguant notre projet. Votre appui est indispensable pour que ce film puisse atteindre le plus grand nombre possible de spectateurs au Brésil et ailleurs!<br></p>",37500.0,"<p> <strong><em>English version below l Version française en bas</em></strong></p><p style=""text-align: right;""><strong>Primeira Campanha</strong><em></em><br><em></em><strong><br></strong></p><p style=""text-align: justify;""><strong>CALVÁRIO</strong> é um longa-metragem independente franco-brasileiro que aborda a questão da transfobia e da violência  contra as minorias sociais no Brasil.<br></p><p style=""text-align: justify;"">       Sob direção de Marcio Darocha, essa produção conta com profissionais envolvidos de forma colaborativa que acreditam no papel do cinema como força transformadora da sociedade e como instrumento de dialogo em tempos de conflitos sociais. <br></p><p style=""text-align: justify;"">Essa é a <strong>primeira campanha</strong> do projeto. Nossa estratégia de crowdfunding consiste em lançar <strong>várias campanhas consecutivas</strong>, com <strong>orçamentos  adaptados</strong> às necessidades das diferentes fases do filme, da <strong>pré à pós-produção</strong>. </p><p><strong><img src=""https://s3-sa-east-1.amazonaws.com/cdn.br.catarse/uploads/redactor_rails/picture/data/67593/Sinopse.jpg""><br></strong></p><p style=""text-align: justify;"">Cansada de uma vida na prostituição, Edith, uma transsexual no Rio de Janeiro, decide estudar Direito e dedicar mais tempo à familia. Neste processo de transição, ela recebe a visita de uma velha amiga, Pamela, prostituta trans a caminho  da Europa e dias melhores, talvez.</p><p style=""text-align: justify;"">As duas amigas saem para comemorar o reencontro e na orla de Copacabana são abordadas por dois homens que as convidam para uma festa de aniversário.</p><p style=""text-align: justify;"">Quando chegam ao destino, elas se deparam com uma mansão deslumbrante em um bairro nobre do Rio, mas logo descobrem que a festa é uma armadilha e que seus anfitriões são perigosamente insanos.</p><p><strong><img src=""https://s3-sa-east-1.amazonaws.com/cdn.br.catarse/uploads/redactor_rails/picture/data/67594/Move.jpg""><br></strong></p><p style=""text-align: justify;"">O Brasil ocupa o primeiro lugar no ranking mundial de países onde ocorrem mais assassinatos homofóbicos. Segundo ONGs como o Grupo Gay da Bahia, 2016 começou com um assassinato a cada 24 horas.</p><p style=""text-align: justify;"">A ascensão de setores reacionários da sociedade brasileira na cena politica e o crescimento das violências discriminatórias nos colocam uma pergunta simples porém ambiciosa:</p><p style=""text-align: justify;"">Como trazer ao publico de cinema uma síntese ao mesmo tempo real e metafórica desta situação e levar a audiência mais conservadora a reconsiderar suas idéias pré-concebidas?</p><p style=""text-align: justify;"">A proposta do filme é contar uma noite de calvário em que duas transsexuais são sequestradas e levadas aos limites de sua resistência fisica e  emocional. </p><p style=""text-align: justify;"">Seus torturadores são oriundos de três classes sociais diferentes mas complementares: Artur, empregado doméstico a serviço de Julio, um jovem advogado contratado para cuidar dos negócios de Isabelle, poderosa empresária engajada em projetos humanitários .</p><p style=""text-align: justify;"">A sessão de tortura tem dois objetivos: o primeiro é de expor preconceitos  comuns a todas as classes sociais; o segundo consiste em caricaturar as pretens<span class=""st""><em></em>õ</span>es de cura e ""normatização"" preconizados pelos segmentos mais reacionários da nossa sociedade. <br></p><p style=""text-align: justify;"" rel=""text-align: justify;"">Mas para além de uma den<span class=""st""><em></em>ú</span>ncia do fascismo brasileiro, o que procuramos contar é uma hist<span class=""st""><span class=""st"">ó</span></span>ria de coragem, a hist<span class=""st""><em></em>ó<em></em></span>ria de dois seres humanos que assumem - até as <span class=""st""> ú</span>ltimas consequências - a livre escolha de suas identidades.</p><hr><p><strong></strong></p><p><strong>Como nos ajudar?<br></strong></p><p style=""text-align: justify;"" rel=""text-align: justify;"">Para nos ajudar basta <strong></strong>escolher uma ou mais recompensas <strong><em>ao lado direito em cima nesta página</em></strong> (ou no menu <strong><em>recompensas</em></strong> caso você esteja acessando de um dispositivo móvel). Clique sobre sua escolha, selecione a forma de pagamento e finalize o processo. Rápido, prático e seguro. </p><p style=""text-align: justify;"">Uma outra grande forma de apoio é <em><strong>compartilhando</strong>, <strong>divulgando</strong> </em><strong><em>e mostrando</em></strong> esta página para seus amigos.<br><br>Assista abaixo ao vídeo que explica como apoiar o nosso filme:<br></p><iframe style=""width: 500px; height: 281px;"" src=""//www.youtube.com/embed/IthuNnmsvsk"" allowfullscreen="""" frameborder=""0""></iframe><p><br></p><hr><p><strong><em>English version</em></strong></p><p><strong>The project</strong></p><p style=""text-align: right;""><strong></strong><strong>First Campaign</strong></p><p style=""text-align: justify;""><strong></strong><br><strong>CALVARY</strong> is a Franco-Brazilian independent feature film on the subject of extreme violence against social minorities in Brazil.<br><br>Directed by Marcio Darocha, this production relies on the cooperation of professionals who believe in the transformative power of cinema and its use as a tool of dialogue in times of social conflicts. </p><p style=""text-align: justify;"">This is the <strong>first campaign</strong> of this project. Our crowdfunding strategy consists in  launching  <strong>several consecutive campaigns </strong> 
with <strong>different budgets</strong>, each one <strong>adapted</strong> to the needs of our movie from <strong>pre to post-production.</strong> </p><p style=""text-align: justify;""><strong>Synopsis</strong><br><br>Tired of her life under the red light, Edith, a transsexual in Rio de Janeiro, has decided to study law and take care of her family. In this process of transition, she’s visited by Pamela, an old trans friend on her way to Europe and better days. </p><p style=""text-align: justify;"">On their first night out, after years apart, they are seduced by two gentlemen who invite them to a birthday party. They accept and end up in a luxurious villa in an exclusive area of Rio. But soon they realize they have fallen into a trap and their hosts are dangerously insane. <br><br><strong>The project and its reasons</strong><br></p><p style=""text-align: justify;"">It is notorious how violent Brazil can be with its marginalized populations. The LGBT community offers a striking example of this reality. According to the latest reports from Brazilian NGOs, 2016 has started with one homophobic murder almost every 24 hours.  </p><p style=""text-align: justify;"">The recent political takeover by the most reactionary sectors of Brazilian society and the rise of discriminatory violence,  compelled us to ask ourselves how to offer an adult audience, a metaphorical but realistic synthesis of this situation. </p><p style=""text-align: justify;"">A simple and ambitious question is at the core of this project:  how to bring the most conservative spectators to reflect on their prejudices?<br> <br>We propose to tell the story of a night-long ordeal during which two transsexuals are abducted and taken to the edge of their emotionnal and physical resistance by three psychopaths from different social classes: Artur, handyman of a young lawyer, Julio, himself at the service of Isabelle, a wealthy philanthropist. </p><p style=""text-align: justify;"">In the construction of this portrait of transphobic and fascist madness, violence will be used as a tool to expose and caricature the perversion of prejudices that can be found across the entire social spectrum.  <br></p><p style=""text-align: justify;"">Beyond our point on  fascist violence in Brazil however, the true story we wish to tell is one of courage: the story of two human beings who will, at no moment, renounce what they believe to be.</p><p style=""text-align: justify;""><br></p><hr><p><strong><em>Version française</em></strong><br></p><p><strong>Le projet</strong></p><p><strong></strong></p><p style=""text-align: right;""><strong></strong><em><strong></strong></em><strong>Première Campagne</strong><em><br><br></em></p><p style=""text-align: justify;""><strong>CALVAIRE</strong> est un long métrage indépendant franco-brésilien, qui aborde  le sujet de  la violence contre les minorités sociales au Brésil.</p><p style=""text-align: justify;"">Réalisée par Marcio Darocha, cette production compte sur la collaboration de professionnels  qui croient au pouvoir transformateur du cinéma et à son importance stratégique en temps de conflit social.</p><p style=""text-align: justify;"">Ceci est la <strong>première campagne</strong> du projet. Notre stratégie de crowdfunding consiste à mener <strong>plusieurs campagnes consécutives </strong>avec des <strong>budgets différents</strong>, adaptés aux nécessités de toutes les phases de notre travail, de la <strong>pré à la post-production</strong>.  <br></p><p><strong>Synopsis</strong></p><p style=""text-align: justify;"">Edith, prostituée transsexuelle à Rio de Janeiro, décide de se lancer dans des études de Droit et de s’occuper de sa famille. Dans ce processus de transition,  elle reçoit la visite de Pamela, une vieille amitié trans, qui  se prépare à partir en Europe et rêve de jours meilleurs. </p><p style=""text-align: justify;"">La nuit de leurs retrouvailles,  les deux amies sont abordées  sur la promenade de Copacabana par deux hommes qui les invitent à une fête d’anniversaire. L’invitation est alléchante et elles partent pour une villa dans un quartier huppé de Rio. </p><p style=""text-align: justify;"">Les hôtes sont plaisants, le champagne coule à flots, mais c'est bientôt un piège qui se referme sur elles.     </p><p><strong>Le projet et ses raisons</strong></p><p style=""text-align: justify;"">La persécution des minorités sociales au Brésil est une constante historique et les souffrances de la communauté LGBT en sont  un exemple frappant. Le Brésil détient la première place dans le classement mondial des pays où l’on commet  le plus de meurtres homophobes . Selon les derniers rapports d’ONGs brésiliennes, toute les 24 heures une personne se fait tuer en raison de son homosexualité en 2016.</p><p style=""text-align: justify;"">La récente prise de pouvoir des secteurs les plus réactionnaires de la société brésilienne et l'augmentation des violences discriminatoires, nous a fait réfléchir sur les moyens de proposer, au public de cinéma, une synthèse à la fois réaliste et métaphorique de cette situation sociale. Une question aussi simple qu’ambitieuse est à l’origine de ce projet: comment amener le public le plus conservateur à prendre du recul sur ses préjugés? </p><p style=""text-align: justify;"">Notre proposition est de raconter une longue nuit de calvaire pendant laquelle deux transsexuelles sont enlevées et torturées à mort par les représentants psychotiques de trois classes sociales différentes mais complémentaires: Artur, homme à tout faire de Julio, jeune avocat au service d'Isabelle, riche femme d’affaires et philanthrope professionelle.</p><p>Dans la construction de ce portrait de la folie transphobe et fasciste, la violence  est un instrument pour caricaturer la perversion d'une mentalité réactionnaire que l’on retrouve dans toutes les classes sociales au Brésil.</p><p style=""text-align: justify;"">Mais au-delà d'une satire du fascisme brésilien, c’est  surtout une histoire de courage et de conviction que nous voulons raconter. Les dernières heures de deux êtres humains qui, à aucun instant, ne renonceront au choix de leur identité.</p><p style=""text-align: justify;""><br></p><hr><p><br></p>",calvario1,//www.youtube.com/embed/YYsGYW3-PgY,https://youtu.be/YYsGYW3-PgY,"Cinema e Vídeo",13,https://s3-sa-east-1.amazonaws.com/cdn.br.catarse/uploads/project/uploaded_image/41962/Untitled-1.jpg,https://s3-sa-east-1.amazonaws.com/cdn.br.catarse/uploads/project/uploaded_image/41962/project_thumb_thumb_Untitled-1.jpg,https://s3-sa-east-1.amazonaws.com/cdn.br.catarse/uploads/project/uploaded_image/41962/project_thumb_small_Untitled-1.jpg,https://s3-sa-east-1.amazonaws.com/cdn.br.catarse/uploads/project/uploaded_image/41962/project_thumb_large_Untitled-1.jpg,https://s3-sa-east-1.amazonaws.com/cdn.br.catarse/uploads/project/uploaded_image/41962/project_thumb_video_cover_Untitled-1.jpg,5.33333333333333333300,2000.0,11,9,online,flex,published,,,"2016-09-18 16:14:31.612297","2016-09-18 13:14:31.612297",,t,f,t,,"{""total"" : 0, ""unit"" : ""seconds""}","{""total"" : 6, ""unit"" : ""days""}",0,"{""city"" : ""Rio de Janeiro"", ""state_acronym"" : ""RJ"", ""state"" : ""Rio de Janeiro""}","{""id"" : 636871, ""name"" : ""EFATA Films""}",3,,f,f,0,f,f,f