project_id,id,user_id,name,headline,budget,goal,about_html,permalink,video_embed_url,video_url,category_name,category_id,original_image,thumb_image,small_image,large_image,video_cover_image,progress,pledged,total_contributions,total_contributors,state,mode,state_order,expires_at,zone_expires_at,online_date,zone_online_date,sent_to_analysis_at,is_published,is_expired,open_for_contributions,online_days,remaining_time,elapsed_time,posts_count,address,user,reminder_count,is_owner_or_admin,user_signed_in,in_reminder,total_posts,can_request_transfer,is_admin_role,contributed_by_friends
42146,42146,126865,"Pré-venda do livro ""Murici do Mato""","O blog Murici do Mato está prestes a virar livro. Faça parte, colaborando e recebendo seu exemplar.","<p>Veja no item acima <strong>ORÇAMENTO</strong></p>",5300.0,"<p><img alt="""" src=""https://s3-sa-east-1.amazonaws.com/cdn.br.catarse/uploads/redactor_rails/picture/data/67723/muricidomato1.jpg"" style=""display: block; margin: auto;""></p><p>O blog Murici do Mato (<a href=""https://muricidomato.wordpress.com"">https://muricidomato.wordpress.com</a>) surgiu como válvula de escape. Foi uma necessidade pessoal de colocar em palavras o que eu sentia e vivenciava com minha mudança de São Paulo para Mato Grosso em 2009. Desde então, escrevo crônicas, poesias e reflexões nesse blog. Foi partindo dessa minha necessidade pessoal - sem visar leitores - que percebi que o que escrevia atingia outras pessoas. </p>  <p>Foi sem querer querendo que comecei a levar mais a sério essa coisa de escrever, colaborando inclusive com jornais e sites. E nesse mesmo caminhar despretensioso mas cheio de intenção, que surge a proposta deste livro. Todos os textos contidos nele já estão publicados no blog. É só navegar e conferir um pouco do que tem ali!</p>  <p>Poder me debruçar sobre esses mais de cem textos do blog, selecionar, melhorar a escrita e revisar também é algo que estou em dívida com meus escritos. E algo que este projeto me permitirá fazer. Nessa compilação que pretendo, estariam os melhores textos mais amadurecidos.</p>  <p><img alt=""Rio Araguaia"" src=""https://s3-sa-east-1.amazonaws.com/cdn.br.catarse/uploads/redactor_rails/picture/data/67725/araguaia.png"" style=""display: block; margin: auto;""></p><p>De uma forma ou outra, meus textos narram minha trajetória através dos anos desde minha mudança de Campinas/SP para Mato Grosso. Primeiro em São Félix do Araguaia e depois em Nova Xavantina. Narram também minhas impressões sobre o que vem acontecendo no mundo nestes anos: de terrorismo a mudanças climáticas, de feminismo a redes sociais, de eleições a impeachment. Já dei pitaco sobre tudo.</p>  <p>Ao tornar vivências cotidianas em mote para escritos, trago à superfície a particularidade de situações - por exemplo, da vivência indígena e indigenista ao qual estou inserida - para a universalidade das reflexões - como tornar palpável a necessidade de respeito aos direitos indígenas.</p><p>Sendo honestamente um projeto pessoal, sem fins comerciais, resolvi 
criar esta campanha para aqueles que se interessem - assim como eu - na 
leitura deste livro. Agradeço desde já a colaboração de todos os que 
se envolvem neste projeto!<br></p><p class=""fontsize-large""><strong>ORÇAMENTO</strong></p><p><img src=""https://s3-sa-east-1.amazonaws.com/cdn.br.catarse/uploads/redactor_rails/picture/data/67802/gr%C3%A1fico.png""></p><p>A proposta é fazer uma pré-venda a preço de custo (cotado em R$ 22,00) mais 
preço de envio pelos Correios para quem optar por receber em casa 
(estimado 
em R$ 12,00 como carta registrada dos Correios para um livro e PAC para mais de um livro) e mais a taxa de serviço do Catarse (de 13 % do valor total). Também pode-se
 fazer a compra sem frete (e combinamos depois como o livro chegará até você, se está em Nova Xavantina ou São Paulo é mais fácil) ou a compra solidária: comprar seu
 livro e dar uma contribuição extra para que o livro possa chegar a outras pessoas que não
 tem recurso para comprá-lo.</p><p>A meta é chegar no valor previsto 
para 200 exemplares do livro a um custo total de cerca de R$ 4.190,00. A vontade é que o livro tenha cerca de 250 páginas, nas medidas de 14x20,5cm, brochura, miolo em
 papel alcalino 75g, capa colorida em papel couchê 240g fosco com 
orelha. Estimo um gasto de cerca de R$ 500,00 nos Correios para envio de quem quiser o livro com frete, chegamos ao custo total de R$ 4.690,00. Como o 
Catarse cobra 13% de taxa de serviço, temos mais R$ 610,00, chegando no 
valor total de R$ 5.300,00.</p><p>Este é o valor mínimo estimado para 
que o projeto vá adiante, mas é claro que havendo um recurso maior, 
podemos pensar em mais impressões ou um livro com acabamento melhor!</p><p>Fiz uma tabelinha com a composição dos preços de cada recompensa sugerida:</p><p><img src=""https://s3-sa-east-1.amazonaws.com/cdn.br.catarse/uploads/redactor_rails/picture/data/67957/recompensa.png""></p><p class=""fontsize-large"">Podemos combinar também o depósito em conta, caso você ache melhor, o que diminui a taxa da Catarse, ou reverte para o próprio projeto. Mande uma mensagem para combinarmos. </p><p class=""fontsize-large""><br></p><p class=""fontsize-large""><strong>CHEGANDO EM MATO GROSSO </strong></p>  <p>Os escritos começam com minha vinda para Mato Grosso em 2009. Vim morar em São Félix do Araguaia, cidadezinha de 10 mil habitantes no nordeste mato-grossense, às margens do rio Araguaia de frente para a Ilha do Bananal do povo Karajá. Vim trabalhar na Associação Nossa Senhora da Assunção (ANSA), fundada por Pedro Casaldáliga, Dona Irene e companhia. O trabalho era com recuperação de áreas degradadas através de sistemas agroflorestais junto a assentados.</p>  <p>A vida era tão boa que eu tinha que contar em palavras. As diferenças eram tão estranhas que eu tinha que contar em palavras. Os desafios e as engolidas de sapo também existiam e eu precisava contá-las em palavras. E assim, surgiu o blog Murici do Mato, homenageando a frutinha mais cerrado do cerrado brasileiro (veja o poema no fim deste texto!).</p>  <p>Em 2010, mudei para Nova Xavantina. Cidade de 20 mil habitantes no leste mato-grossense, às margens do rio das Mortes na beira da BR-158 aos pés da serra do Roncador. Vim trabalhar na Funai, aquele órgão indigenista federal precário que nos seus últimos suspiros ainda tenta realizar a tarefa constitucional do Estado de proteção aos direitos indígenas. Trabalho com o povo Xavante, nas suas mais diversas dimensões: segurança alimentar, proteção territorial, educação e cultura. Novas questões se colocaram com esta relação, mas mais que isso, muitos causos e situações que parecem inimagináveis em outro contexto. Em Xavantina, virei mãe e mais um novo universo se abriu para minha porta de observação e reflexão.</p><p>Percebi que escrevo o que vejo, o que vivo, com o colorido do meu ponto de vista. Mas a ficção, essa eu não sei lidar muito bem. Parece que o mundo real já tem elementos demais para que precise inventar algo. A realidade tem sido minha fonte, e meu território transita entre crônicas e outros gêneros que nem sei quais são.</p>    <p class=""fontsize-larger fontweight-semibold""><strong><br></strong></p><p class=""fontsize-large""><strong>QUEM SOU AFINAL<br></strong></p><p><img alt="""" src=""https://s3-sa-east-1.amazonaws.com/cdn.br.catarse/uploads/redactor_rails/picture/data/67732/20160602_162321.jpg"" width=""354"" height=""328"" style=""width: 354px; height: 328px; float: right; margin: 0px 0px 10px 10px;""></p><p>Maíra <br>Meio japonesa<br> Meio mineira<br> Mas sou paulistana<br> E estou xavantinense<br> Sou bióloga<br> Sou indigenista<br> Sou servidora pública<br> Sou brincante da cultura popular<br> Sou agitadora e produtora cultural<br> Sou militante<br> Sou de esquerda<br> Sou mulher<br> Sou mãe<br> Sou filha e irmã<br> Sou costureira<br> Sou pifeira, flautista e musicista de boteco<br> Sou plantadeira de quintal<br> Faço as vezes de jornalista por necessidade<br> Faço tudo ao mesmo tempo<br> Me faço de escritora nas horas vagas<br> E de tudo isso, saem os escritos do Murici do Mato</p><p><br></p>  <p class=""fontsize-large""><strong>MURICI DO MATO</strong></p>  <p style=""margin-left: 20px; text-align: right;"">                                                                              28 de outubro de 2010</p>  <p><br></p><p>a mangaba tem o leite<br> o buriti o azeite<br> do pequi, maciez<br> da cagaita, acidez</p>  <p>mas se o cerrado tem sabor<br> é no murici que se encontra<br> toda a sua natureza torta<br> em forma, medida e cor</p>  <p>o murici é rugoso e arenoso<br> é flor pro mel de jataí<br> ele é ácido e amargoso<br> o doce vem só depois do engolir</p>  <p>o murici é amarelo forte<br> concentrado suficiente<br> no seu pequeno porte<br> nem doce e nem infância<br> é puro aroma somente</p>  <p>se o fruto é pouco<br> que dirá o arbusto<br> raquítico e rouco<br> aguenta terra seca e alagada<br> folhas e tronco<br> aguentam mofo e queimada</p>  <p>Como o cerrado,<br> o murici contesta<br> não tem meio gosto<br> ou vicia ou detesta</p>",muricidomato,//player.vimeo.com/video/183241652,https://vimeo.com/183241652,Literatura,20,https://s3-sa-east-1.amazonaws.com/cdn.br.catarse/uploads/project/uploaded_image/42146/muricidomato.png,https://s3-sa-east-1.amazonaws.com/cdn.br.catarse/uploads/project/uploaded_image/42146/project_thumb_thumb_muricidomato.png,https://s3-sa-east-1.amazonaws.com/cdn.br.catarse/uploads/project/uploaded_image/42146/project_thumb_small_muricidomato.png,https://s3-sa-east-1.amazonaws.com/cdn.br.catarse/uploads/project/uploaded_image/42146/project_thumb_large_muricidomato.png,https://s3-sa-east-1.amazonaws.com/cdn.br.catarse/uploads/project/uploaded_image/42146/project_thumb_video_cover_muricidomato.png,1.88679245283018867900,100.0,3,3,online,flex,published,"2016-11-09 01:59:59.999999","2016-11-08 23:59:59.999999","2016-09-19 03:04:18.249706","2016-09-19 00:04:18.249706",,t,f,t,50,"{""total"" : 44, ""unit"" : ""days""}","{""total"" : 6, ""unit"" : ""days""}",0,"{""city"" : ""Nova Xavantina"", ""state_acronym"" : ""MT"", ""state"" : ""Mato Grosso""}","{""id"" : 126865, ""name"" : ""Maíra Taquiguthi Ribeiro""}",0,,f,f,0,f,f,f