project_id,id,user_id,name,headline,budget,goal,about_html,permalink,video_embed_url,video_url,category_name,category_id,original_image,thumb_image,small_image,large_image,video_cover_image,progress,pledged,total_contributions,total_contributors,state,mode,state_order,expires_at,zone_expires_at,online_date,zone_online_date,sent_to_analysis_at,is_published,is_expired,open_for_contributions,online_days,remaining_time,elapsed_time,posts_count,address,user,reminder_count,is_owner_or_admin,user_signed_in,in_reminder,total_posts,can_request_transfer,is_admin_role,contributed_by_friends
426,426,27393,"Conceito Periférico: vídeo clipe + CD virtual + site","Produza conosco o mais novo vídeo clipe do grupo de rap Conceito Periférico. Sua colaboração ainda viabilizará o cd e o site do grupo.","O orçamento para projetos anteriores a 24/02/2015 normalmente pode ser encontrado na descrição acima.",5000.0,"<p>Finalização (edição) do vídeo clipe da música “Ritmo e Poesia”, do grupo de rap Conceito Periférico, cuja letra retrata o dia a dia dos bairros de periferia de forma alegre e positiva. O vídeo terá duração de 4 minutos e será ambientado no bairro Vila Garrido, em Vila Velha - ES. O projeto também pretende divulgar o trabalho do grupo por meio de um site, onde os internautas poderão &quot;baixar&quot; o CD virtual e assistir o vídeo clipe, além de encontrar mais informações sobre o Conceito Periférico, como fotos, letras das músicas, notícias e outros vídeos do grupo.</p>

<p>Estética</p>

<p>A estética deste segundo clipe do Conceito segue a linha documental ao retratar o ambiente e algumas personagens do cotidiano de um bairro suburbano. No entanto, essa estética do real também terá elementos imagéticos, assim como o primeiro &quot;vídeo do grupo&quot;:<iframe src=""//player.vimeo.com/video/30847595.?title=0&byline=0&portrait=0"" width=""600"" height=""403"" frameborder=""0""></iframe> Por conta desses elementos imaginários que interagirão com o ambiente real é que precisamos de recursos para editar as imagens captadas em janeiro numa produtora de vídeo profissional.</p>

<p>Quem somos nos:</p>

<p>Conceito Periférico - um grup rap, cuja ideologia é divulgar a desigualdade social aliada a mensagens de positividade e soluções para os descaminhos, usando a linguagem dos morros e expressões típicas das comunidades pobres. Formado por John Conceito e JR Conceito, o grupo nasceu em 2005, na cidade de Vila Velha, no Espírito Santo.</p>

<p><a class=""alt-link"" target=""_blank"" href=""http://www.4shared.com/audio/Ua8uo0R8/Ritmo_e_Poesia.html"">Faça aqui o download da música “Ritmo e Poesia”, do grupo Conceito Periférico</a></p>

<p>Antônio Carlos Sant’ana - vulgo JR Conceito, deficiente físico, é membro do grupo Conceito Periférico e participa de projetos sociais. Formado num curso técnico de biblioteconomia, trabalha numa biblioteca de uma faculdade particular.</p>

<p>Jonatas Almeida - vulgo John C, é membro do grupo Conceito Periférico, é ator e cursa o segundo período do curso de graduação na área de Publicidade e Propaganda. Também participa do movimento negro independente como membro da Nação Zumbi Ojab e o grupo Negritude Ativa.</p>

<p>Luiz Eduardo Neves já dirigiu o primeiro clipe do grupo <a class=""alt-link"" target=""_blank"" href=""http://www.panela.tv/visualizarVideo/18/No%20Olho%20da%20Rua.html"">Conceito Periférico&quot;:<iframe src=""//player.vimeo.com/video/30847595?title=0&byline=0&portrait=0"" width=""600"" height=""403"" frameborder=""0""></iframe>, dirigiu e roteirizou o documentário &quot;No Olho da Rua</a>; o curta-metragem <a class=""alt-link"" target=""_blank"" href=""http://www.panela.tv/visualizarVideo/17/Bubblegum%20Black.html"">Bubblegum Black</a>; VTs publicitários, como o da <a class=""alt-link"" target=""_blank"" href=""http://www.panela.tv/visualizarVideo/19/Uma%20Nova%20Gera%C3%A7%C3%A3o.html"">Faculdade Novo Milênio</a>; e é diretor de conteúdo do site <a class=""alt-link"" target=""_blank"" href=""http://www.panela.tv/expediente."">Panela Audiovisual</a></p>
",conceito-periferico-video-clipe-cd-virtual-site,//player.vimeo.com/video/31177168,http://vimeo.com/31177168,"Cinema e Vídeo",13,,https://s3-sa-east-1.amazonaws.com/cdn.br.catarse/uploads/project/video_thumbnail/426/project_thumb_thumb_open-uri20131125-2-kti475,https://s3-sa-east-1.amazonaws.com/cdn.br.catarse/uploads/project/video_thumbnail/426/project_thumb_small_open-uri20131125-2-kti475,https://s3-sa-east-1.amazonaws.com/cdn.br.catarse/uploads/project/video_thumbnail/426/project_thumb_large_open-uri20131125-2-kti475,https://s3-sa-east-1.amazonaws.com/cdn.br.catarse/uploads/project/video_thumbnail/426/project_thumb_video_cover_open-uri20131125-2-kti475,3.70000000000000000000,185.0,5,5,failed,aon,finished,"2012-02-01 01:59:59","2012-01-31 23:59:59","2011-12-03 01:59:59","2011-12-02 23:59:59",,t,t,f,60,"{""total"" : 0, ""unit"" : ""seconds""}","{""total"" : 60, ""unit"" : ""days""}",0,"{""city"" : ""Vila Velha"", ""state_acronym"" : ""ES"", ""state"" : ""Espírito Santo""}","{""id"" : 27393, ""name"" : ""Luiz Eduardo Neves da Silveira""}",0,,f,f,0,f,f,f