project_id,id,user_id,name,headline,budget,goal,about_html,permalink,video_embed_url,video_url,category_name,category_id,original_image,thumb_image,small_image,large_image,video_cover_image,progress,pledged,total_contributions,total_contributors,state,mode,state_order,expires_at,zone_expires_at,online_date,zone_online_date,sent_to_analysis_at,is_published,is_expired,open_for_contributions,online_days,remaining_time,elapsed_time,posts_count,address,user,reminder_count,is_owner_or_admin,user_signed_in,in_reminder,total_posts,can_request_transfer,is_admin_role,contributed_by_friends
4789,4789,247746,"Só Pelo Amor Vale a Vida ","""SÓ PELO AMOR VALE A VIDA"" longa-metragem sobre a vida e obra de um dos maiores músicos e compositores brasileiros","O orçamento para projetos anteriores a 24/02/2015 normalmente pode ser encontrado na descrição acima.",39000.0,"<p>PARA ACESSAR O VÍDEO/TEASER, PALAVRA CHAVE quatro
  palavra chave    quatro</p>

<p><strong>Carlo Mossy</strong>, cineasta tradicional do cinema nacional há 45 anos, e com mais de 80 filmes produzidos, roteirizados, dirigidos e atuados, está realizando um longa-metragem documental/poético/musical , <strong>”SÓ PELO AMOR VALE A VIDA”</strong>, que versa sobre a obra e a intensa existência do genial compositor, músico e maestro <strong>Zequinha de Abreu</strong>. 
Já foram captadas riquíssimas imagens na paradisíaca região de <strong>Santa Rita do Passa Quatro</strong>, imagens correlatas à sua inigualável e inspiradora trajetória de cidadão musical santaritense, mantendo-se, no entanto, o mais fiel possível à sua incrível, rica e profícua passagem artística.
Para tanto, os papeis de Zequinha de Abreu, seu pai, José Alacrino Ramiro, sua mãe, Justina Gomes Leitão, sua jovem esposa Durvalina, e a bela menina Branca, são interpretados  por atores e atrizes consagrados no cinema nacional, como <strong>Leonardo Arena, Rossana Ghessa, Laddy Francisco, Tião D&#39;Ávila, Darlene Glória e Roberto Maia,Katia D&#39;Angelo</strong>.Entramos em contato também com <strong>Ana Paula Arósio</strong>, agora moradora de Santa Rita do Passa Quatro,pleiteando sua participação no filme(Ofício encaminhado em 29/05/2014) e aguardando resposta.
O** instituto Cravo Albin** – RJ<strong>, na pessoa de Ricardo Cravo Albin e o Historiador **Luiz Antônio de Almeida</strong>, primo-neto de Zequinha e pesquisador musical do Museu da Imagem e Som,  tornaram-se qualificáveis parceiros do projeto, assim como a <strong>Prefeitura</strong> e a Secretaria de Turismo e Cultura de Santa Rita do Passa Quatro.
1- Algumas geniais obras de Zequinha de Abreu serão especialmente tocadas para este filme pela <strong>Orquestra Sinfônica Brasileira</strong>,  no Teatro Municipal do Rio de Janeiro/São Paulo, sobretudo, <strong>Tico-Tico-No-Fubá</strong> e Pintinhos No terreiro, entre outras esmeradas  composições do compositor <strong>Zequinha de Abreu</strong>.
Músicos consagrados internacionalmente já foram convidados e aceitaram tocar com seus respectivos instrumentos.
2- Depoimentos de pessoas importantes e de familiares ligados a Zequinha de Abreu, assim como a de historiadores sobre a música contemporânea brasileira, fornecerão relevantes e inéditos depoimentos sobre o mesmo.</p>

<p>O dinheiro para esta inicial fase das filmagens (40%) já foi captado junto ao comércio da cidade. Contamos também para divulgação do referido filme os jornais da cidade e da região, além de jornais das grandes capitais, como Rio de Janeiro e São Paulo, emissoras de TV, e revistas especializadas. 
Necessitamos de <strong>R$ 39.000,00</strong> (já inclusos a intermediação deste site), a fim de reiniciar as filmagens deste importante projeto fílmico  – produção  independente.
O financiamento coletivo se faz necessário para que possamos dar prosseguimento e atingir o restante das filmagens. 
Devido à grandiosidade do projeto que trata de uma das músicas brasileiras mais tocadas no mundo, (“Tico Tico no Fubá”, insistentemente interpretada pelas Orquestras Filarmônicas internacionais).</p>

<p><strong>Recompensa aos apoiadores</strong>: </p>

<p>1- Doação de <strong>R$1.000,00</strong> (hum mil reais) -  terá seu nome inserido nos créditos de agradecimento no final do filme, assim como no rodapé do cartaz oficial, nos cartazetes e em todas as peças publicitárias gráficas, e pela Internet, quando esta for divulgada a este propósito, no Press Boook , nome/marca nas páginas do site do filme com link, nos rodapés dos enormes Banners que serão fixados às entradas dos cinemas que exibirão o filme e durante os Festivais nacionais e internacionais. Serão doados, ainda, 10 ingressos para assistir o filme nos cinemas, convite especial para quatro (4) pessoas para a estreia do filme no Brasil, (locais e cinemas ainda a serem definidos ), e, também, quatro (4) DVDs originais do mesmo.
2- Doação de <strong>R$ 2.000,00</strong> (dois mil reais), além de toda a inserção do item 1, terá seu nome ou marca no rodapé dos anúncios impressos em DESTAQUE  e em NEGRITO, assim como nos créditos do filme, igualmente em DESTAQUE E NEGRITO, mais seis (6) DVDs originais, dez (20) ingressos nos cinemas, e 06 (seis) convites para a estreia do filme - (local e cinema ainda a serem definidos).
3- Doação de <strong>R$ 5.000</strong> (cinco mil reais), inserção do nome/marca no início do filme e em destaque isolado: “Patrocínio Cultural Especial”, todas as inserções dos itens 1 e 2, mais um box com cinco títulos de filmes clássicos e de grande sucesso em DVDs, produzidos pela Mossy Filmes e dirigidos, atuados, roteirizados e produzidos pelo Carlo Mossy, igualmente diretor do filme em destaque, box de luxo lançado recentemente pelo Canal Brasil na Livraria da Travessa- Rio, que seria entregue  juntamente com um autógrafo personalizado nominalmente, pelo Carlo Mossy, se assim o doador preferir. 
4- Doação única e total de <strong>R$ 39.000,00</strong> (trinta e nove mil reais) -  Além de todas as inserções dos itens 1, 2 e 3, uma Inserção no início do filme com destaque para seu nome/marca, juntamente ao do produtor do filme.</p>

<p><strong>GASTOS COM A FILMAGEM</strong></p>

<p>EDIÇÃO &amp; MIXAGEM  – R$ 12.000
TRILHA MUSICAL ORIGINAL E ARRANJOS – R$ 6.000
PROJETO GRÁFICO  E IMPRESSÃO – R$ 4.500
TRADUÇÃO &amp; LEGENDAGEM  -  R$ 2.500
CATARSE – R$ 5.070
GASTOS DE PRODUÇÃO (passagens, hospedagens e alimentação da equipe)  – R$ 4.500
EQUIPE E ATORES (PAGAMENTO RESTANTE) – R$ 4.430
TOTAL – R$ 39.000</p>

<p>EQUIPE TÉCNICA E ARTÍSTICA DE “SÓ PELO AMOR VALE A VIDA” (trata-se do título de uma canção de Zequinha de Abreu)
ELENCO:  <strong>ROSSANA GHESSA, LEONARDO ARENA, LADDY FRANCISCO, LÚCIA ALVES, TIÃO D’ÁVILA, DARLENE GLÓRIA E ROBERTO MAIA,LADDY FRANCISCO</strong>.
DIREÇÃO DE ARTE E CONCEPÇÃO MUSICAL: LUIZ ANTÔNIO DE ALMEIDA E UBIRATAN JOSÉ TÓDARO FILHO.
FIGURINO E MAQUIAGEM: MIRELLA SPADON E HANNA DUARTE
PRODUÇÃO EXECUTIVA: CARLO MOSSY, MIRELLA SPADON, UBIRATAN JOSÉ TÓDARO FILHO E CHRIS 
CENOGRAFIA: UBIRATAN JOSÉ TÓDARO FILHO
DIRETOR DE PRODUÇÃO: CARLO MOSSY E MIRELLA SPADON
MONTAGEM: FABIANO LUSTOSA E HELDER MARTINS
DIREÇÃO MUSICAL: EDMUNDO SOUTO, PAULO SÉRGIO VALLE, E LUIZ ANTÔNIO DE ALMEIDA.
CONSULTORES MUSICAIS: RICARDO CRAVO ALBIN, LUIZ ANTÔNIO DE ALMEIDA E EDMUNDO SOUTO.
COREOGRAFIA: CARLO MOSSY 
CARTAZ: JOSÉ BENÍCIO OU ZIRALDO<br>
ASSITENTE DE DIREÇÃO: LEONARDO ARENA
DIREÇÃO DE FOTOGRAFIA : HELDER MARTINS
TÉCNICO DE ÁUDIO: MAURICIO ZANI</p>

<p><strong>DIRETOR</strong>
<strong>Carlo Mossy</strong> constitui-se um dos mais prestigiados e importantes cineastas do cinema nacional, tendo produzido entre longas, curtas e séries televisivas, mais de 70 (setenta) filmes ao longo de quase 50 anos, sendo que 28 dirigidos pelo mesmo. Seus filmes foram exibidos nos cinemas alcançando marcas recordes de público, hoje quase todos eles são exibidos há 15 anos ininterruptos, na grade do prestigiadíssimo Canal Brasil. 
Ganhador do prêmio máximo pelo conjunto da obra, Candango, no Festival de Brasília, insere Carlo Mossy como sendo um dos mais importantes cineastas/atores/diretores do cinema nacional.</p>

<p><strong>PRODUTORA</strong>
A <strong>Mossy Filmes</strong>, desde o início dos anos 1970, produz filmes de longa-metragem, curtas e séries televisivas, da mais alta qualidade e de grandes sucessos de bilheteria, sempre sob a administração/ orientação artística e técnica de Carlo Mossy, seu sócio diretor. 
A Mossy Filmes, através de seu sócio-diretor, Carlo Mossy,  é uma produtora fílmica de prestígio no cenário nacional e internacional, assídua partícipe na maioria dos festivais internacionais, sobretudo e principalmente, no Festival de Cannes, onde já participou inúmeras vezes, exibindo em seus stands, seus filmes e também de colegas cineastas, chegando a vender  muitos de seus filmes, para mais de 50 países.
SINOPSE 
Trata-se de um filme de longa-metragem de caráter, sobretudo, documental, sobre o genial compositor, músico e regente, Zequinha de Abreu, paradoxalmente mais conhecido no exterior do que no seu próprio país de Pindorama, filme esse, que pretende fugir às “convenções” deste gênero documental, ou seja, contradizer e se distanciar às primitivas regras tradicionais dos filmes do gênero, pois se propõe, ao inserir neste filme uma originalíssima contextualização fílmica, cujo conteúdo  artístico e cênico agregado  a uma profunda poesia musicada, de um intenso vivencial  romântico e uma certa dose de ficção mágica, lhe dará uma nova aura audiovisual.
Zequinha de Abreu ainda jovem, interpretado magistralmente pelo Leonardo Arena, interage no filme inteiro, como sendo uma serena entidade espiritual que revive assistindo seu glorioso e difícil passado, sem ser, no entanto, percebido pelos personagens ativos à trama.<br>
<strong>PROJETO</strong>
Talvez muitos perguntarão curiosos do por que que a Mossy filmes, uma produtora tradicional e de sucesso adentra no site da CATARSE,  a fim de pleitear doações para seu filme.
Primeiramente, Carlo Mossy,  produtor e diretor do filme em questão, aproveitando-se de seu prestígio na Indústria Cinematográfica, sobretudo entre técnicos e artistas, consegue angariá-los para o filme, lhes pagando um cachê simbólico, mas  lhes repassando um  percentual  do mesmo, tornando-os, coletivamente, sócios. 
O filme <strong>“SO PELO AMOR VALE A VIDA”</strong> , quando ao conhecer uma linda pessoa (Mirella Spadon), ilustre habitante da bucólica cidade de Santa Rita do Passa Quatro, igualmente  berço de Zequinha de Abreu, que me propôs a realização desse filme,rico em detalhes descobertos e inseridos no filme.Descortinar a vida e obra de quem eu pouco conhecia até então, o notável Zequinha de Abreu, fomentei em mim a vontade em realizar um longa metragem.
Quanta a grana pedida a vocês, virtuais parceiros,  entendam que,  diante de um momento difícil que atravesso como cineasta, me fora sugerida esta alternativa.
Quanto às captações oficiais que através da <strong>ANCINE</strong> e afins se concretizam beneficiando alguns poucos, saibam que é uma tarefa quase impossível,  visto que, a burocracia e a politicagem que emolduram os Editais, quase que todos de cartas-marcadas, tornam-se um obstáculo quase que intransponível. Mesmo sendo um cineasta respeitado, mas  como não pertenço nem faço parte de um grupinho de cineastas comumente premiados com os tais Editais, declaro-me, sem qualquer orgulho, incapaz de realizar um filme, hoje, que não seja independente, sem vínculos  oficiais, mas com  uma ajuda sensivelmente  coletiva . (Os meus filmes anteriores realizava  com recursos próprios).</p>
",ZequinhadeAbreu,//player.vimeo.com/video/87081234,http://vimeo.com/87081234,"Cinema e Vídeo",13,,,,,,5.41025641025641025600,2110.0,22,19,failed,aon,finished,"2014-06-11 02:59:59","2014-06-10 23:59:59","2014-05-05 11:44:51.77385","2014-05-05 08:44:51.77385",,t,t,f,36,"{""total"" : 0, ""unit"" : ""seconds""}","{""total"" : 36, ""unit"" : ""days""}",3,"{""city"" : ""Santa Rita do Passa Quatro"", ""state_acronym"" : ""SP"", ""state"" : ""São Paulo""}","{""id"" : 247746, ""name"" : ""Mirella Spadon""}",0,,f,f,3,f,f,f