project_id,id,user_id,name,headline,budget,goal,about_html,permalink,video_embed_url,video_url,category_name,category_id,original_image,thumb_image,small_image,large_image,video_cover_image,progress,pledged,total_contributions,total_contributors,state,mode,state_order,expires_at,zone_expires_at,online_date,zone_online_date,sent_to_analysis_at,is_published,is_expired,open_for_contributions,online_days,remaining_time,elapsed_time,posts_count,address,user,reminder_count,is_owner_or_admin,user_signed_in,in_reminder,total_posts,can_request_transfer,is_admin_role,contributed_by_friends
500,500,44647,"DVD Moda de Rock de Ricardo Vignini & Zé Helder","DVD Moda de Rock de Ricardo Vignini & Zé Helder com as participações de Pepeu Gomes, Kiko Loureiro e Os Favoritos da Catira","O orçamento para projetos anteriores a 24/02/2015 normalmente pode ser encontrado na descrição acima.",12000.0,"<p>Moda de Rock
Viola Extrema
Ricardo Vignini &amp;amp; Zé Helder
Em 2007, dois violeiros nascidos em 1973 e membros da banda Matuto Moderno, se
juntaram para tocar e adaptar clássicos do rock para viola caipira. A ideia inicial de
Ricardo Vignini e Zé Helder era mostrar a potencialidade do instrumento para seus
alunos e lembrar-se das diversões da adolescência que tinham essa música como
trilha sonora. O lançamento do CD “Moda de Rock &amp;amp; Viola Extrema” em 2011 se tornou um sucesso de mídia, vendas e de shows realizados em diversas regiões do Brasil e nos EUA. Transformando “In the Flesh do Pink Floyd em uma singela valsinha, Aces High do Iron Maiden e Master of Puppets do Metallica ganharam uma levada de pagode de viola. Além destas, o CD conta com faixas de Led Zeppelin, Beatles, Jimi Hendrix, Megadeth, Sepultura, Nirvana, Jethro Tull e Ozzy Osbourne executadas apenas com duas violas de forma instrumental. A faixa Aqualung, Jethro Tull, tem a
participação do também violeiro Renato Caetano e Kaiowas, Sepultura, tem o
palmeado e sapateado de catira de Edson Fontes dos grupos Os Favoritos da Catira e
Matuto Moderno.
O CD foi masterizado no Abbey Road Studios em Londres, estúdio que gravou 90% da
obra dos Beatles, Pink Floyd, Foo Fighters, Green Day. Produzido por Ricardo Vignini,
lançado pelo selo Folguedo, que é exclusivamente dedicado a música de viola “Moda
de Rock” tem a distribuição da Tratore.
Para 2012 está programado o lançamedo do primeiro DVD do “Moda de Rock” com as participações de Pepeu Gomes, Kiko Loureiro e Os Favoritos da Catira, as gravações aconteceram nos SESCs Pinheiros e Pompéia. E também a primeira turnê pela Europa e Estados Unidos.</p>
",dvd-moda-de-rock-de-ricardo-vignini-ze-helder,//player.vimeo.com/video/34948332,http://vimeo.com/34948332,Música,16,,https://s3-sa-east-1.amazonaws.com/cdn.br.catarse/uploads/project/video_thumbnail/500/project_thumb_thumb_open-uri20131125-2-1t7cwrs,https://s3-sa-east-1.amazonaws.com/cdn.br.catarse/uploads/project/video_thumbnail/500/project_thumb_small_open-uri20131125-2-1t7cwrs,https://s3-sa-east-1.amazonaws.com/cdn.br.catarse/uploads/project/video_thumbnail/500/project_thumb_large_open-uri20131125-2-1t7cwrs,https://s3-sa-east-1.amazonaws.com/cdn.br.catarse/uploads/project/video_thumbnail/500/project_thumb_video_cover_open-uri20131125-2-1t7cwrs,104.41666666666666666700,12530.0,125,115,successful,aon,finished,"2012-03-12 02:59:59","2012-03-11 23:59:59","2012-01-11 02:59:59","2012-01-11 00:59:59",,t,t,f,60,"{""total"" : 0, ""unit"" : ""seconds""}","{""total"" : 61, ""unit"" : ""days""}",1,"{""city"" : ""São Paulo"", ""state_acronym"" : ""SP"", ""state"" : ""São Paulo""}","{""id"" : 44647, ""name"" : ""Ricardo""}",0,,f,f,1,f,f,f