project_id,id,user_id,name,headline,budget,goal,about_html,permalink,video_embed_url,video_url,category_name,category_id,original_image,thumb_image,small_image,large_image,video_cover_image,progress,pledged,total_contributions,total_contributors,state,mode,state_order,expires_at,zone_expires_at,online_date,zone_online_date,sent_to_analysis_at,is_published,is_expired,open_for_contributions,online_days,remaining_time,elapsed_time,posts_count,address,user,reminder_count,is_owner_or_admin,user_signed_in,in_reminder,total_posts,can_request_transfer,is_admin_role,contributed_by_friends
506,506,6121,"Retratos de Nelson","Como Nelson, vamos remover as máscaras e revelar a nudez, mesmo que seja castigada, porque “todas as vaias são boas, inclusive as más”...","O orçamento para projetos anteriores a 24/02/2015 normalmente pode ser encontrado na descrição acima.",1500.0,"<p>Uma história fantasticamente plausível sobre os integrantes de uma família tipificada, que, surpreendida na intimidade de seu lar, revela suas relações quotidianas imersas em religisiodade, opressão, amor, pedofilia, desejo, repressão, incesto, obsessão e loucura. </p>

<p>Livremente baseada em “Álbum de família”, peça teatral escrita por Nelson Rodrigues em 1945, proibida no ano seguinte à sua publicação e somente liberada para apresentação vinte anos depois. Isso porque, segundo a censura da época, ela incita ao crime. </p>

<p>Então, por que montamos essa peça? Porque questionamos o poder de um retrato, de uma fotografia... Um objeto capaz de suspender o tempo, congelar os momentos e permitir que possamos refletir sobre eles, criticá-los ou consagrá-los. </p>

<p>Além disso, as obras de Nelson Rodrigues são uma inspiração irresistível. Como ele próprio declara: são “pestilentas, fétidas, capazes, por si só, de produzir tifo e malária na platéia”. Elas retratam a humanidade bem demais... </p>

<p>Assim, escolhemos “Álbum de família” como fonte de inspiração para homenagear o centenário do Mestre Nelson Rodrigues, porque ela foi fundamental, segundo ele próprio, para torná-lo um autor abominável. </p>

<p>Por que assistir essa peça? Porque ela desnuda a intimidade de uma família que se esforça para preservar as aparências, apesar de ser marcada por uma intrincada rede de obsessões, violentas paixões e perversões. E assim apresenta, de forma contundente e atual, os caminhos e descaminhos dos desejos reprimidos perfeitamente encontráveis no subconsciente dos lares contemporâneos. </p>

<p>Quer dizer, no lar do vizinho, claro... Não no nosso, nem no seu... Só no do vizinho... Que, aliás, é um perfeito hipócrita. </p>

<p>E por falar em hipocrisia... tratemos do vil metal: para fazer 05 apresentações de &quot;Retratos de Nelson&quot; (07 a 11 de fevereiro de 2012, no maravilhoso CENTRO CULTURAL IAB-RS, no Solar Conde de Porto Alegre, que fica na Rua General Canabarro, 363, na esquina com a Rua Riachuelo) precisamos da bagatela de R$ 1.500,00. </p>

<p>Além da nossa imensa e eterna gratidão, se você apoiar &quot;Retratos de Nelson&quot; e nos ajudar a colocá-la sob as luzes da ribalta, ofereceremos recompensas... </p>
",retratos-de-nelson,//player.vimeo.com/video/35259395,"http://vimeo.com/35259395 ","Teatro e Dança",19,,https://s3-sa-east-1.amazonaws.com/cdn.br.catarse/uploads/project/video_thumbnail/506/project_thumb_thumb_open-uri20131125-2-12nzl6v,https://s3-sa-east-1.amazonaws.com/cdn.br.catarse/uploads/project/video_thumbnail/506/project_thumb_small_open-uri20131125-2-12nzl6v,https://s3-sa-east-1.amazonaws.com/cdn.br.catarse/uploads/project/video_thumbnail/506/project_thumb_large_open-uri20131125-2-12nzl6v,https://s3-sa-east-1.amazonaws.com/cdn.br.catarse/uploads/project/video_thumbnail/506/project_thumb_video_cover_open-uri20131125-2-12nzl6v,10.66666666666666666700,160.0,8,6,failed,aon,finished,"2012-02-02 01:59:59","2012-02-01 23:59:59","2011-12-04 01:59:59","2011-12-03 23:59:59",,t,t,f,60,"{""total"" : 0, ""unit"" : ""seconds""}","{""total"" : 60, ""unit"" : ""days""}",2,"{""city"" : ""Canoas"", ""state_acronym"" : ""RS"", ""state"" : ""Rio Grande do Sul""}","{""id"" : 6121, ""name"" : ""Verônica Fernandez Mattos da Silva""}",0,,f,f,2,f,f,f