project_id,id,user_id,name,headline,budget,goal,about_html,permalink,video_embed_url,video_url,category_name,category_id,original_image,thumb_image,small_image,large_image,video_cover_image,progress,pledged,total_contributions,total_contributors,state,mode,state_order,expires_at,zone_expires_at,online_date,zone_online_date,sent_to_analysis_at,is_published,is_expired,open_for_contributions,online_days,remaining_time,elapsed_time,posts_count,address,user,reminder_count,is_owner_or_admin,user_signed_in,in_reminder,total_posts,can_request_transfer,is_admin_role,contributed_by_friends
515,515,46079,"Rodrigo Vilas Boas | Tua Vontade | Projeto Prensagem CD","O meu primeiro álbum, chamado ""Tua Vontade"", já foi gravado! Para poder lançar as primeiras 1.000 cópias deste CD, conto com você!","O orçamento para projetos anteriores a 24/02/2015 normalmente pode ser encontrado na descrição acima.",4000.0,"<p>Olá! Meu nome é Rodrigo Vilas Boas. Sou cantor de Rock Gospel e recentemente gravei meu primeiro álbum, que chama-se &quot;Tua Vontade&quot;. Este CD foi gravado no estúdio Virtual dB, no Rio de Janeiro, com o produtor musical Rico Azeredo (@ricoazzeredo). Este álbum tem 10 canções, todas de minha autoria, sendo duas destas com participações de outros autores. Basicamente é um CD de Rock, com influência do Folk, principalmente nas baladas. A banda que me acompanha nesta empreitada é formada por Rico Azeredo no baixo, Igor Guimarães na bateria, Robson Vieira nos teclados e Tiago Oliveira na guitarra solo.</p>

<p>Todos os recursos que a equipe envolvida no projeto tinha já foram investidos na pré-produção, horários de ensaio em estúdio, gravação, mixagem, enfim, em todo o processo de produção do CD, todavia, chegamos na fase de prensagem deste trabalho, infelizmente, sem fôlego financeiro necessário para a prensagem das primeiras 1.000 cópias a serem fabricadas.</p>

<p>É aí que entra você que chegou até aqui, seja através do meu site e de minhas mídias sociais, seja através da busca  por projetos dentro do próprio Catarse. Precisamos da sua colaboração para que este projeto se torne realidade!</p>

<p>O financiamento coletivo chegou para ficar! Cada vez mais projetos culturais são viabilizados através da contribuição de todos aqueles que se identificam com o projeto, que querem fortalecer movimentos culturais, muitas das vezes, independente. Eu acredito que esta ferramenta também pode ser aplicado a todo tipo de projeto musical, mesmo ele sendo um projeto de música Cristã.</p>

<p>Deus disse que não era bom que o homem vivesse só! O homem sozinho não é completo, e Deus entendeu que é nos relacionamentos que o homem seria completo. Quando estamos juntos, podemos realizar muito mais que sozinhos, isolados. É com esse espírito que peço que todos vocês apoiem este projeto, contribuindo com ele a partir de R$ 10,00 e recebendo o CD &quot;Tua Vontade&quot; como recompensa pelo seu engajamento, além de outras recompensas, dependendo no seu grau de colaboração. Juntos, podemos fazer com que este projeto se torne realidade.</p>

<p>Não se trata apenas do meu sonho de ver esse CD lançado. Existe algo muito maior, que é levar a mensagem do Evangelho através da manifestação cultural da música. Para que eu possa desempenhar esse papel, essa missão, preciso que você também tome essa missão como sua! Conto com todos vocês para que a prensagem deste CD possa acontecer!</p>

<p>Este é o primeiro projeto Gospel aceito pelo Catarse.me, segundo os seus organizadores. Isso me encheu de muito orgulho, e toda Honra e Glória são do Senhor! Gostaria muito que não fizéssemos feio aqui neste espaço, que abriu esta porta, concluindo esta campanha de financiamento coletivo com total êxito! Vamos juntos vencer mais este desafio! Conto com vocês!</p>

<p>Nosso projeto precisa de R$ 4.000,00 (quatro mil reais) para ter êxito. Precisamos arrecadar esta grana até o dia 15 de março de 2012, para que possamos manter o cronograma de lançamento para entre final de abril e início de maio deste ano! Se 400 pessoas colaborarem com o mínimo, já será possível tornar este sonho em realidade. Mobilize seus familiares, amigos, colegas da escola, do colégio, da faculdade, da academia, do clube, principalmente a galera da sua igreja!</p>

<p>Desde já, agradeço a todos que colaborarem! Que Deus continue abençoando a vida de cada um! Grande abraço a todos!</p>

<p>Acessem para maiores informações: <a class=""alt-link"" href=""http://www.rodrigovilasboas.com.br"" target=""_blank"">http://www.rodrigovilasboas.com.br</a>
Siga-me no Twitter: @rodrigvilasboas
Mande um e-mail para: <a class=""alt-link"" href=""mailto:contato@rodrigovilasboas.com.br"" target=""_blank"">contato@rodrigovilasboas.com.br</a></p>
",rodrigo-vilas-boas-tua-vontade-projeto-prensagem-cd,//player.vimeo.com/video/35221745,http://vimeo.com/35221745,Música,16,,https://s3-sa-east-1.amazonaws.com/cdn.br.catarse/uploads/project/video_thumbnail/515/project_thumb_thumb_open-uri20131125-2-1kfu281,https://s3-sa-east-1.amazonaws.com/cdn.br.catarse/uploads/project/video_thumbnail/515/project_thumb_small_open-uri20131125-2-1kfu281,https://s3-sa-east-1.amazonaws.com/cdn.br.catarse/uploads/project/video_thumbnail/515/project_thumb_large_open-uri20131125-2-1kfu281,https://s3-sa-east-1.amazonaws.com/cdn.br.catarse/uploads/project/video_thumbnail/515/project_thumb_video_cover_open-uri20131125-2-1kfu281,4.25000000000000000000,170.0,5,5,failed,aon,finished,"2012-03-17 02:59:59","2012-03-16 23:59:59","2012-01-16 02:59:59","2012-01-16 00:59:59",,t,t,f,60,"{""total"" : 0, ""unit"" : ""seconds""}","{""total"" : 61, ""unit"" : ""days""}",0,"{""city"" : ""Recife"", ""state_acronym"" : ""PE"", ""state"" : ""Pernambuco""}","{""id"" : 46079, ""name"" : """"}",0,,f,f,0,f,f,f