project_id,id,user_id,name,headline,budget,goal,about_html,permalink,video_embed_url,video_url,category_name,category_id,original_image,thumb_image,small_image,large_image,video_cover_image,progress,pledged,total_contributions,total_contributors,state,mode,state_order,expires_at,zone_expires_at,online_date,zone_online_date,sent_to_analysis_at,is_published,is_expired,open_for_contributions,online_days,remaining_time,elapsed_time,posts_count,address,user,reminder_count,is_owner_or_admin,user_signed_in,in_reminder,total_posts,can_request_transfer,is_admin_role,contributed_by_friends
5161,5161,244354,"Silêncio em NY","Nove dias caminhando em Nova York. Olhos, pés, ouvidos e cabeça, uma câmera e, quantos encontros, quantos acasos objetivos?","O orçamento para projetos anteriores a 24/02/2015 normalmente pode ser encontrado na descrição acima.",6500.0,"<p>O projeto <em><strong>Silêncio em NY</strong></em> se divide em dois momentos. Cada um deles irá gerar uma série específica de fotografias unidas por uma cidade. Fotografias documentais de rua em São Paulo e Nova York. </p>

<p>Primeiro, São Paulo, onde estão sendo produzidas fotografias expectantes por uma outra cidade, Nova York, onde nunca fui efetivamente. Nem tampouco fui aos EUA. Mas o que há de Nova York em São Paulo? Onde vejo NY aqui em São Paulo? Como se opera esta espécie de curto-circuito coincidente entre as duas metrópoles? Nova York, lugar do sonho, da busca pela realização mundana. Frenesi étnico multi-cultural, capital do planeta.</p>

<p>No filme <em>O Estado das Coisas</em>, do cineasta alemão Win Wenders, um de seus personagens diz que sua mente foi “colonizada” pela cultura norte-americana. Acho que a cidade ícone, a capital dessa colônia mental sempre foi uma Nova York imaginada. Desde criança com os olhos iluminados pelas salas escuras ou pela vibração da TV. Suas ruas profundas e emparedadas por edifícios magníficos. Suas pontes. Os prédios mais baixos em locais periféricos, de tijolinho aparente e escadas de incêndio metálicas. O Central Park. O som das ambulâncias e da polícia. Os táxis amarelos. A máfia. Os artistas em imensos galpões ou nas ruas. O metrô grafitado e a água circundando tudo, ilhando a liberdade em forma de estátua.</p>

<p><img src=""http://transit4.cargocollective.com/1/15/483379/7772268/pny__bruno_mitih_160x_o.jpg"" alt=""""/>
Avenida Paulista, São Paulo.</p>

<p>No segundo momento, Nova York. Viajo para aquela cidade inventada, lugar de Nasdaq, de Wall Street e da Broadway. Sou agora incorporado àquela realidade, passo a fazer parte da cidade neste encontro. Não é mais preciso imaginar, nem sonhar. Mas como num sonho, necessito buscar as marcas dessa realidade em imagens circundadas pelo corte de uma visão, pelo quadro bidimensional da câmera. Desse segundo momento, surge então uma coleção de fotografias de rua de Nova York. </p>

<p>Durante este processo de captação de recursos, as fotografias feitas em São Paulo serão divulgadas, pouco-a-pouco, no site <a class=""alt-link"" href=""http://www.cargocollective.com/silencio_ny"" target=""_blank"">http://www.cargocollective.com/silencio_ny</a>. Num prazo de até sessenta dias após o retorno dos EUA, será publicado um site para divulgar as fotografias feitas em Nova York.</p>

<p>Este é o meu site, para você conhecer um pouco do meu 
trabalho: <a class=""alt-link"" href=""http://www.cargocollective.com/bruno_mitih"" target=""_blank"">http://www.cargocollective.com/bruno_mitih</a></p>

<p>Sua colaboração é importante para a realização desse projeto. Os valores de contribuição começam em R$ 20,00 e vão até R$ 1.200,00.  Se não puder colaborar agora, mas puder ajudar na divulgação, também agradeço muito. O montante total arrecadado será utilizado para pagar o visto, passagens, estadia, alimentação e transporte em Nova York, impressão das fotografias para retribuição, correio e a porcentagem do site Catarse. </p>

<p>A captação de recursos para o projeto pode ultrapassar o valor estipulado, o valor excedente será usado para incrementar a produção das imagens em Nova York, como acesso a locais pagos e fotografia aérea, por exemplo. </p>

<p>(Caso os R$ 6.500,00 não sejam alcançados, o projeto será desativado e o dinheiro devolvido)</p>

<p>Muito obrigado!</p>

<p><em>Bruno Mitih</em></p>
",sny,//player.vimeo.com/video/93176876,https://vimeo.com/93176876,Fotografia,17,https://s3-sa-east-1.amazonaws.com/cdn.br.catarse/uploads/project/uploaded_image/5161/thumb_catarse_3.jpg,https://s3-sa-east-1.amazonaws.com/cdn.br.catarse/uploads/project/uploaded_image/5161/project_thumb_thumb_thumb_catarse_3.jpg,https://s3-sa-east-1.amazonaws.com/cdn.br.catarse/uploads/project/uploaded_image/5161/project_thumb_small_thumb_catarse_3.jpg,https://s3-sa-east-1.amazonaws.com/cdn.br.catarse/uploads/project/uploaded_image/5161/project_thumb_large_thumb_catarse_3.jpg,https://s3-sa-east-1.amazonaws.com/cdn.br.catarse/uploads/project/uploaded_image/5161/project_thumb_video_cover_thumb_catarse_3.jpg,103.3846153846153800,6720.0,34,32,successful,aon,finished,"2014-06-10 02:59:59","2014-06-09 23:59:59","2014-04-28 19:57:12.937569","2014-04-28 16:57:12.937569",,t,t,f,42,"{""total"" : 0, ""unit"" : ""seconds""}","{""total"" : 42, ""unit"" : ""days""}",9,"{""city"" : ""São Paulo"", ""state_acronym"" : ""SP"", ""state"" : ""São Paulo""}","{""id"" : 244354, ""name"" : ""Bruno da Cruz Leal Viana""}",0,,f,f,9,f,f,f