project_id,id,user_id,name,headline,budget,goal,about_html,permalink,video_embed_url,video_url,category_name,category_id,original_image,thumb_image,small_image,large_image,video_cover_image,progress,pledged,total_contributions,total_contributors,state,mode,state_order,expires_at,zone_expires_at,online_date,zone_online_date,sent_to_analysis_at,is_published,is_expired,open_for_contributions,online_days,remaining_time,elapsed_time,posts_count,address,user,reminder_count,is_owner_or_admin,user_signed_in,in_reminder,total_posts,can_request_transfer,is_admin_role,contributed_by_friends
5247,5247,13518,"Pra Ficar na Memória - Edição Noel Rosa","Esse projeto é Pra Ficar na Memória... Viaje conosco pelos versos de Noel.","O orçamento para projetos anteriores a 24/02/2015 normalmente pode ser encontrado na descrição acima.",1150.0,"<p>O QUE É O PROJETO?</p>

<p>O Projeto <strong>PRA FICAR NA MEMÓRIA - EDIÇÃO NOEL ROSA</strong>, traz à tona as influências da música produzida no Brasil desde os anos 30na atual Música Popular Brasileira. Trata-se de uma série de apresentações com autores diferentes. Para esta edição mostramos o Noel Rosa, apresentado na voz da cantora <a class=""alt-link"" target=""_blank"" href=""http//clube-ccac.ning.com/profile/denisedalmacchio."">Denise Dalmacchio</a> </p>

<p>Por meio de textos interpretados por um ator,vídeos,  e execuções musicais, uma parcela da obra do Noel será mostrada. O elenco musical é composto por um percussionista, um violonista sete cordas, um violonista seis cordas e um bandolinista. Concomitantemente, vídeos estarão em exibição em dois telões disponíveis no espaço escolhido para a realização do show. </p>

<p>A idéia é fazer com que haja uma completa interação entre a cantora, o ator e o público através das músicas e de histórias pitorescas do Noel em pequeníssimos textos que ilustrarão cada uma das 24 músicas a serem apresentadas em dois atos.</p>

<p>Este espetáculo musical com pequeno tempero cênico é fruto de meses de pesquisa bibliográfica em fontes diversas além da Internet, tais como dicionário Cravo Albim, João Máximo,  Carlos Didier, Almir Chediak, Houaism histórias narradas pelo jornalista Edson Rodrigues, além de extensa pesquisa fonográfica.</p>

<p>O repertório foi cuidadosamente selecionado, de forma a não mostrar simplesmente um show de sambas, mas sim, o quanto o samba de Noel influenciou o surgimento de outras correntes musicais. O Noel é o grande responsável pela simbiose entre a música do asfalto e o samba dos morros cariocas e a idéia é mostrar através dos arranjos e a partir da influência jazzística e, por que não dizer, “blueseira” da cantora Denise Dalmacchio estas possibilidades que se fazem tão presentes na música contemporânea. </p>

<p>É com este formato que o projeto pretende, além de proporcionar bons momentos para o público, levar a este um pouco da rica história de nossa música brasileira e seus representantes.</p>

<p>O QUE ESTÁ ENVOLVIDO EM TERMOS DE CUSTO?</p>

<p>Todo o dinheiro arrecadado será utilizado na produção de vídeos, Extended Play, programa do show, cartazes, ensaios, músicos, ator, som e luz, elementos estes que compõem o custo total de execução deste projeto, incluídas aí as taxas e impostos inerentes. Por isso contamos com você.. Vamos juntos? </p>

<p>Você colaborando entre R$1 e R$9 - receberá agradecimento em nossos sites Clube Capixaba de Artes e Cultura e na fan page do Projeto no Facebook</p>

<p>Entre R$10 e R$ 20,00 - agradecimentos em nossos sites Clube Capixaba de Artes e Cultura e na fan page do Projeto no Facebook e passe para assistir ao show (o passe só será válido se você confirmar realmente sua presença)...</p>

<p>Entre R$21 e R$30 - agradecimentos em nossos sites Clube Capixaba de Artes e Cultura e na fan page do Projeto no Facebook, passe para assistir ao show (o passe só será válido se você confirmar realmente sua presença)..e EP comemorativo com 8 músicas gravadas por Denise Dalmacchio...</p>

<p>Entre R$31 e R$ 60 - agradecimentos em nossos sites Clube Capixaba de Artes e Cultura e na fan page do Projeto no Facebook, passe para assistir ao show (o passe só será válido se você confirmar realmente sua presença)..e EP comemorativo com 8 músicas gravadas por Denise Dalmacchio, nome constando no programa como apoiador do Projeto.</p>

<p>Entre R$ 61 e R$ 100 - agradecimentos em nossos sites Clube Capixaba de Artes e Cultura e na fan page do Projeto no Facebook, passe para assistir ao show (o passe só será válido se você confirmar realmente sua presença)..e EP comemorativo com 8 músicas gravadas por Denise Dalmacchio, nome constando no programa como apoiador do Projeto, e link para seu site na seção apoiadores do Cluebe Capixaba de Artes e Cultura por 30 dias...</p>

<p>Acima de R$ 101,00 - agradecimentos em nossos sites Clube Capixaba de Artes e Cultura e na fan page do Projeto no Facebook, passe para assistir ao show (o passe só será válido se você confirmar realmente sua presença)..e EP comemorativo com 8 músicas gravadas por Denise Dalmacchio, nome constando no programa como apoiador do Projeto, e link para seu site na seção apoiadores do Cluebe Capixaba de Artes e Cultura por 60 dias.</p>

<p>NOTA: As recompensas fora do ambiente de internet serão entregues via correio, com frete  gratuito seja em âmbito nacional ou internacional, chegando ao endereço indicado pelo apoiador à nossa produção.</p>

<p>Contamos com você!!!</p>
",praficarnamemoria,//www.youtube.com/embed/OFSOUYlKOIw,http://youtu.be/OFSOUYlKOIw,Música,16,https://s3-sa-east-1.amazonaws.com/cdn.br.catarse/uploads/project/uploaded_image/5247/Cartaz_Tratado.jpg,https://s3-sa-east-1.amazonaws.com/cdn.br.catarse/uploads/project/uploaded_image/5247/project_thumb_thumb_Cartaz_Tratado.jpg,https://s3-sa-east-1.amazonaws.com/cdn.br.catarse/uploads/project/uploaded_image/5247/project_thumb_small_Cartaz_Tratado.jpg,https://s3-sa-east-1.amazonaws.com/cdn.br.catarse/uploads/project/uploaded_image/5247/project_thumb_large_Cartaz_Tratado.jpg,https://s3-sa-east-1.amazonaws.com/cdn.br.catarse/uploads/project/uploaded_image/5247/project_thumb_video_cover_Cartaz_Tratado.jpg,102.5217391304347800,1179.0,23,19,successful,aon,finished,"2014-05-26 02:59:59","2014-05-25 23:59:59","2014-05-05 12:19:45.192128","2014-05-05 09:19:45.192128",,t,t,f,20,"{""total"" : 0, ""unit"" : ""seconds""}","{""total"" : 20, ""unit"" : ""days""}",1,"{""city"" : ""Vila Velha"", ""state_acronym"" : ""ES"", ""state"" : ""Espírito Santo""}","{""id"" : 13518, ""name"" : ""Marcos de Assis""}",0,,f,f,1,f,f,f