project_id,id,user_id,name,headline,budget,goal,about_html,permalink,video_embed_url,video_url,category_name,category_id,original_image,thumb_image,small_image,large_image,video_cover_image,progress,pledged,total_contributions,total_contributors,state,mode,state_order,expires_at,zone_expires_at,online_date,zone_online_date,sent_to_analysis_at,is_published,is_expired,open_for_contributions,online_days,remaining_time,elapsed_time,posts_count,address,user,reminder_count,is_owner_or_admin,user_signed_in,in_reminder,total_posts,can_request_transfer,is_admin_role,contributed_by_friends
6001,6001,284963,"Cine Social 3.0","Para estar conectado e ser a conexão","O orçamento para projetos anteriores a 24/02/2015 normalmente pode ser encontrado na descrição acima.",25000.0,"<p><strong>O Que é?</strong></p>

<p>Já pensou o que dá uma mistura de plataforma crowdlearning e sistema de live streaming? Pois é, o <strong>CINE SOCIAL 3.0</strong> é o que vai dar. Uma plataforma para ciclo de oficinas online sobre cinema e sociedade onde o palestrante e o aluno rompem barreiras hierárquicas e estabelecem um novo tipo de conexão, o 3.0. Utilizando-se de conceitos da Educação 3.0 e da sociedade digital, o Cine Social 3.0 oferece uma colaboração de conhecimento no campo audiovisual com enfoque social, através de oficinas ministradas por profissionais da área e, transmitida virtualmente para jovens interessados por cinema e por mudanças, transmitido para todo o Brasil.
Serão mais de cinco oficinas por ciclo com temas escolhidos pelos próprios alunos. Nossa proposta do ciclo é ser continua, sendo realizada uma vez por ano no período correspondente a cinco meses. O Projeto conta com 05 profissionais especializados que irão debater temas como: Audiovisual e Sustentabilidade; A Cenografia Sustentável; Captação de Recursos Através de Plataformas Colaborativas; e Como realizar o Marketing para projetos cenográficos usando Mídias Sociais?; Como usar a ferramenta Streaming para desenvolver a Comunidade? Design de Produção Audiovisual e suas abordagens sociais; Como Usar Cinema em Salas de Aula, etc... </p>

<p><strong>Como esse treco vai funcionar?</strong></p>

<p>Para cada ciclo será aberta uma sala virtual com a capacidade de 50 internautas.  As inscrições serão feitas online e de forma gratuita pelo site <a class=""alt-link"" href=""http://www.cinesocial.in"" target=""_blank"">www.cinesocial.in</a> (O site ainda está em construção e quando estiver pronto disponibilizaremos a ficha de inscrição por lá. A comunicação será feita na aba Novidades, aqui do próprio Catarse), onde, também, será realizada a transmissão. A página contará com um layout bem moderno, oferecendo um player de vídeo, chat e slide para interação total dos alunos com os oficineiros. Os alunos poderão conversar entre si, a partir do chat, estabelecer novas conexões e terão a oportunidade de interagir com o oficineiro, comentando as oficinas, fazendo perguntando, preparando material em home para mostrar ao oficineiro, e caso se interessar, tiver um bom material, poderá também oferecer como oficina para um possível ciclo. As vagas são para os 50 primeiros inscritos indicados pelas ONG&#39;s .</p>

<p><strong>Nossas Intenções?</strong></p>

<p>Fornecer e fomentar conteúdo sobre cinema, audiovisual e suas possibilidades através de uma plataforma virtual segura, interativa e moderna para jovens em vulnerabilidade social. 
Transformar, através do interesse por cinema e suas diversificações, a sociabilidade do jovem diante da comunidade com recursos tecnológicos que permitam a troca de conhecimento e o compartilhamento de ideias.
Difundir a plataforma de Educação Colaborativa, a Educação 3.0, implementando-a com temas de transformação social através do cinema e vídeo dentro de comunidades que possibilitem a paixão pelo cinema ao jovem interessado.</p>

<p><strong>Quem são?</strong></p>

<p><strong>Cristiane Rodrigues</strong> -  Designer Social, Cenógrafa e Educadora Social e Fotografa. Atua como Educadora Social e Coordenadora de Projetos Educacionais há mais de 08 anos. É apresentadora do programa de entrevistas e entretenimento na internet CHÁ E POESIA (<a class=""alt-link"" href=""http://www.chaepoesia.com"" target=""_blank"">www.chaepoesia.com</a>) e também foi ganhadora do VI Prêmio Criando Asas com o documentário Video Verde – Preservando os Parques Municipais de São Paulo. </p>

<p><strong>Maycon Batestin</strong> - Cinegrafista e Editor de Vídeo com experiência em publicidade e propaganda. Formado em Cinema na UFMG. Técnico audiovisual responsável pelas campanhas da NIKE EKIN, Coca-Cola Fifa, Pearson, Intel e Itaú BBA. Ganhador do VI Prêmio Criando Asas com o projeto Vídeo Verde ao lado de Cristiane Rodrigues da Silva.</p>

<p><strong>Vinicius Brotto</strong> – Coordenador  Audiovisual e Técnico de Streaming, responsável pela Broadcast e WebTV’s da empresa INACLIVE TRANSMITION. Realizou transmissões para empresas como NIKE, DANONE, COCA-COLA e INTEL e presta serviços de consultoria para empresas privadas no campo audiovisual. Além disso é Produtor e Apresentador do programa de Canal de Youtube MSSORA (<a class=""alt-link"" href=""http://www.youtube.com/mssora"" target=""_blank"">www.youtube.com/mssora</a>).</p>

<p><strong>Ana Carolina Daniela</strong> - Cenografia e design de ambientes. Atuou na cenografia de eventos para entidades como SESC, SENAC, SENAI e  Associação Cultura Inglesa</p>

<p><strong>Para que precisamos do dinheiro?</strong></p>

<p>O orçamento é destinado a obtenção de recursos para a realização do projeto, recursos como notebook, câmera de vídeo, criação e manutenção da página de transmissão, equipamentos para suporte de transmissão. Em contrapartida, você que está nos ajudando, ganha o nosso coração e de 50 internautas que farão fila para lhe agradecer. Lógico, você também não vive só de gratidão, por isso ao lado você verá o que você pode estar ganhando por nos ajudar.</p>
",socialcine,//www.youtube.com/embed/Wp_AG5uMZBk,https://www.youtube.com/watch?v=Wp_AG5uMZBk,"Cinema e Vídeo",13,,https://s3-sa-east-1.amazonaws.com/cdn.br.catarse/uploads/project/video_thumbnail/6001/project_thumb_thumb_open-uri20140623-2-1oq0glk,https://s3-sa-east-1.amazonaws.com/cdn.br.catarse/uploads/project/video_thumbnail/6001/project_thumb_small_open-uri20140623-2-1oq0glk,https://s3-sa-east-1.amazonaws.com/cdn.br.catarse/uploads/project/video_thumbnail/6001/project_thumb_large_open-uri20140623-2-1oq0glk,https://s3-sa-east-1.amazonaws.com/cdn.br.catarse/uploads/project/video_thumbnail/6001/project_thumb_video_cover_open-uri20140623-2-1oq0glk,0.46000000000000000000,115.0,3,3,failed,aon,finished,"2014-08-31 02:59:59","2014-08-30 23:59:59","2014-07-01 22:09:46.368643","2014-07-01 19:09:46.368643",,t,t,f,60,"{""total"" : 0, ""unit"" : ""seconds""}","{""total"" : 60, ""unit"" : ""days""}",1,"{""city"" : ""São Paulo"", ""state_acronym"" : ""SP"", ""state"" : ""São Paulo""}","{""id"" : 284963, ""name"" : ""Maycon Cypriano Batestin""}",0,,f,f,1,f,f,f