project_id,id,user_id,name,headline,budget,goal,about_html,permalink,video_embed_url,video_url,category_name,category_id,original_image,thumb_image,small_image,large_image,video_cover_image,progress,pledged,total_contributions,total_contributors,state,mode,state_order,expires_at,zone_expires_at,online_date,zone_online_date,sent_to_analysis_at,is_published,is_expired,open_for_contributions,online_days,remaining_time,elapsed_time,posts_count,address,user,reminder_count,is_owner_or_admin,user_signed_in,in_reminder,total_posts,can_request_transfer,is_admin_role,contributed_by_friends
604,604,6566,"O Tempo do Meio","O Tempo do Meio, novo espetáculo da Esther Weitzman Cia de Dança, estreia no Espaço SESC. Venha conosco!","O orçamento para projetos anteriores a 24/02/2015 normalmente pode ser encontrado na descrição acima.",6900.0,"<p>A coreógrafa e bailarina Esther Weitzman retorna ao Mezanino do Espaço Sesc Copacabana com o espetáculo O Tempo do Meio, que estreia no dia 10 de Maio às 21h30. O trabalho é uma nova abordagem na paixão da coreógrafa por um tema que tem sido recorrente em sua longa e bem sucedida carreira: as implicações, desdobramentos e conflitos da relação humana com o Tempo.<br>
O Tempo do Meio é uma criação coletiva dos bailarinos, Alexandre Bhering, Frederico Paredes, Mônnica Emilio, Vandré Vitorino e Peter Mark que, a partir de experiências distintas no meio da dança contemporânea, uniram-se em torno de um objetivo comum proposto por Esther: o questionamento abstrato e lúdico de imaginar onde se encontra o meio do Tempo.
 Esther se baseou na leitura de autores notórios por sua preocupação em compreender o paradoxo da experiência temporal como Proust, Fernando Pessoa, T. S. Elliot e Deleuze para criar o que ela chama de &quot;células de movimento&quot;, além de formações de círculos e mandalas, com o intuito de comunicar ao público esse profundo sentimento de transitoriedade.  &quot;No início do trabalho comecei apresentando aos bailarinos uma série de perguntas, frases soltas, letras de música, fragmentos de poemas e verbos que nos remetem as contradições entre o tempo real e o subjetivo. Em seguida, pedi que eles se concentrassem no sentimento gerado por esses elementos para criar as frases coreográficas.”
 Esther explica que sua pesquisa coreográfica pensa o corpo do bailarino como instrumento de criação orgânica e espontânea. &quot;Meu objetivo é que os bailarinos utilizem o corpo como agente de reflexão ativa. Estou sempre em busca de capturar a passagem do Tempo como experiência sensorial.&quot; 
O espetáculo O Tempo do Meio contém inúmeras imagens e sensações de passagem do tempo. Uma das fontes de inspiração foram as montanhas de Saint Victoire pintadas por Paul Cézanne. Esther usou a palheta do pintor francês como base para o figurino, luz e cenografia.    Em 2010 a Esther Weitzman Companhia de dança foi contemplada pelo Prêmio Funarte Petrobrás de Dança Klauss Vianna: Circulação - Dança Adentro - do norte ao nordeste brasileiro.  No ano seguinte, o prêmio resultou na bem sucedida turnê dos espetáculos O Que Imagino Sobre a Morte e Presenças No Tempo por Manaus, Tocantins, Teresina, Fortaleza e interior do Ceará.   </p>

<p>O Tempo do Meio estreia no Mezanino do Espaço Sesc Copacabana no dia 10 de maio. O espetáculo permanece em temporada até o dia 3 de junho, com apresentações de quinta a sábado às 21h30 e domingo às 20h.   </p>

<p>Para complementar a produção e conseguirmos viabilizar uma divulgação de qualidade e o registro audiovisual do espetáculo, necessitamos do apoio de vocês no valor de R$ 6.900,00.</p>

<p>Contamos com vocês!</p>
",o-tempo-do-meio,,http://vimeo.com/39533248,"Teatro e Dança",19,,,,,,101.4492753623188400,7000.0,115,106,successful,aon,finished,"2012-05-10 02:59:59","2012-05-09 23:59:59","2012-03-11 02:59:59","2012-03-10 23:59:59",,t,t,f,60,"{""total"" : 0, ""unit"" : ""seconds""}","{""total"" : 60, ""unit"" : ""days""}",0,"{""city"" : ""Rio de Janeiro"", ""state_acronym"" : ""RJ"", ""state"" : ""Rio de Janeiro""}","{""id"" : 6566, ""name"" : ""Marcelo Diniz Cabanas""}",0,,f,f,0,f,f,f