project_id,id,user_id,name,headline,budget,goal,about_html,permalink,video_embed_url,video_url,category_name,category_id,original_image,thumb_image,small_image,large_image,video_cover_image,progress,pledged,total_contributions,total_contributors,state,mode,state_order,expires_at,zone_expires_at,online_date,zone_online_date,sent_to_analysis_at,is_published,is_expired,open_for_contributions,online_days,remaining_time,elapsed_time,posts_count,address,user,reminder_count,is_owner_or_admin,user_signed_in,in_reminder,total_posts,can_request_transfer,is_admin_role,contributed_by_friends
6130,6130,289843,"The Long Yesterday, segunda edição.","O detetive mais durão da Hollywood dos anos 40 está prestes a se tornar o detetive mais durão de todos os tempos... de novo. ","O orçamento para projetos anteriores a 24/02/2015 normalmente pode ser encontrado na descrição acima.",19800.0,"<p><img src=""http://1.bp.blogspot.com/-OfP5xCknuio/U8HJx4c9Q6I/AAAAAAAAAg0/ZqPAPPA8c9Q/s1600/titulo_1.jpg"" alt=""""/></p>

<p>Há pouco tempo atrás encontrei a entusiasmada resenha do Tujaviu:
<em>“Mesmo atrasado, tive a felicidade de conseguir um exemplar do quadrinho, recentemente. Há muito tempo, o procurava! The Long Yesterday tem estilo Ligne Claire que remete a clássicos de Daniel Torres (Rocco Vargas) e E.P. Jacobs (Blake e Mortimer) e tem todo aquele clima de filmes Noir dos anos 1940...
 Quem serão estes homens, todos com o mesmo rosto? Conseguirá Lace, deter a conspiração futurista que procura destruir seu passado? Você saberá de tudo isso e muito mais, conferindo esta maravilha.”</em> 
(leia inteira aqui: <a class=""alt-link"" href=""http://tujaviu.com/2014/01/voltamos-ao-ano-de-2005-relembrando-long-yesterday-hq-noir-e-futurista-de-osmarco-valladao-e-manoel-magalhaes.html"" target=""_blank"">http://tujaviu.com/2014/01/voltamos-ao-ano-de-2005-relembrando-long-yesterday-hq-noir-e-futurista-de-osmarco-valladao-e-manoel-magalhaes.html</a>  )
Ok, primeiro sinal. E muito obrigado, PH.
Pouco tempo depois o professor da UFRJ Hamilton Kabuna me convidou para falar com seus alunos sobre quadrinhos e comandou um pedido coletivo (intimação seria mais exato) por uma reimpressão.
Ok, entendi o recado. E muito obrigado Kabuna, Higor, João, Pedro, Priscila (1), Lorena e Priscila (2). Essa é para vocês. 
Publicado pela primeira vez em 2005, pela Comic Store, The Long Yesteday teve excelentes resenhas (Telio Navega para <em>O Globo</em>, Roberto Elísio dos Santos no <em>Omelete</em>, Marcio Massula Junior no <em>Urobouros</em>, entre outros - muito obrigado a todos) e 3 indicações para o HQ Mix com esta publicação. E até onde eu imaginava, era o fim da história... 
Mas será que uma história sobre viagens no tempo realmente acaba? </p>

<p><img src=""http://2.bp.blogspot.com/-tLgPU_X_lbg/U8HJx44lIBI/AAAAAAAAAhA/wB5Qv2oLsvw/s1600/titulo_2.jpg"" alt=""""/></p>

<p>Este projeto pretende financiar uma reedição de The Long Yesterday com a mesma qualidade elogiada da primeira edição (21 X 28 cm, colorido, papel couché 150 g, capa em cartão Supremo 300 g) e com o acréscimo das 8 páginas de “Belvedere Blues”, criada a convite de Sidney Gussman (obrigado, Sidão!), para a Wizard.
Confiram o preview aqui: <a class=""alt-link"" href=""http://issuu.com/osmarco/docs/preview"" target=""_blank"">http://issuu.com/osmarco/docs/preview</a><em>tly</em>izuu
E praticamente no mesmo preço. Além disso, criamos alguns itens com artes exclusivas sobre o detetive mais durão de todos os tempos e outras formas de agradecer aos apoios mais generosos.</p>

<p><img src=""http://4.bp.blogspot.com/-p60WA2_w8Y4/U8HJyKF_sFI/AAAAAAAAAg4/Emf6qRlGNl0/s1600/TLY+itens_layout_1.jpg"" alt=""""/></p>

<p>Espero que todos se divirtam lendo como eu e Manoel nos divertimos fazendo. E espero muito que a gente consiga, porque eu adoraria escrever na última página, na tradição dos filmes de James Bond: “Lace O’Malley will return.” </p>

<p>Abraços,
Osmarco Valladão.</p>
",thelongyesterday,//www.youtube.com/embed/_osFo8RiCrs,http://youtu.be/_osFo8RiCrs,Quadrinhos,7,https://s3-sa-east-1.amazonaws.com/cdn.br.catarse/uploads/project/uploaded_image/6130/imagem_catarse_3.jpg,https://s3-sa-east-1.amazonaws.com/cdn.br.catarse/uploads/project/uploaded_image/6130/project_thumb_thumb_imagem_catarse_3.jpg,https://s3-sa-east-1.amazonaws.com/cdn.br.catarse/uploads/project/uploaded_image/6130/project_thumb_small_imagem_catarse_3.jpg,https://s3-sa-east-1.amazonaws.com/cdn.br.catarse/uploads/project/uploaded_image/6130/project_thumb_large_imagem_catarse_3.jpg,https://s3-sa-east-1.amazonaws.com/cdn.br.catarse/uploads/project/uploaded_image/6130/project_thumb_video_cover_imagem_catarse_3.jpg,18.61111111111111111100,3685.0,78,78,failed,aon,finished,"2014-09-19 02:59:59","2014-09-18 23:59:59","2014-07-20 20:00:04.629395","2014-07-20 17:00:04.629395",,t,t,f,60,"{""total"" : 0, ""unit"" : ""seconds""}","{""total"" : 60, ""unit"" : ""days""}",3,"{""city"" : ""Rio de Janeiro"", ""state_acronym"" : ""RJ"", ""state"" : ""Rio de Janeiro""}","{""id"" : 289843, ""name"" : ""Osmarco Caetano Valladão Júnior""}",0,,f,f,3,f,f,f