project_id,id,user_id,name,headline,budget,goal,about_html,permalink,video_embed_url,video_url,category_name,category_id,original_image,thumb_image,small_image,large_image,video_cover_image,progress,pledged,total_contributions,total_contributors,state,mode,state_order,expires_at,zone_expires_at,online_date,zone_online_date,sent_to_analysis_at,is_published,is_expired,open_for_contributions,online_days,remaining_time,elapsed_time,posts_count,address,user,reminder_count,is_owner_or_admin,user_signed_in,in_reminder,total_posts,can_request_transfer,is_admin_role,contributed_by_friends
623,623,55356,Onírica,"Onírica é um curta-metragem que conta a história de Rafaela, uma menina que não sonha e todos os seus esforços em sonhar.","O orçamento para projetos anteriores a 24/02/2015 normalmente pode ser encontrado na descrição acima.",900.0,"<p>Onírica é um curta-metragem de aproximadamente 15 minutos que conta a história de uma menina que se chama Rafaela, e seu maior desejo que é o de sonhar. Sendo essa a sua meta, ela tenta bolar planos para conseguir ao menos um sonho, e não desiste mesmo tendo muitas tentativas frustradas. Até o dia em que algo inusitado acontece.</p>

<p>Este é um projeto que será realizado por alunos do 3º semestre do Centro Universitário SENAC, e foi um dos 4 selecionados por uma banca examinadora que avaliou 14 propostas a serem produzidas. Este projeto não tem qualquer tipo de fim lucrativo e é puramente um projeto acadêmico desenvolvido pelos alunos sob a orientação dos professores e coordenadores do Curso de Bacharelado em Audiovisual.</p>

<p>Porém, como em qualquer tipo de produção audiovisual, temos diversos custos que devemos arcar no processo de desenvolvimento deste projeto.
Estes custos incluem; transporte, alimentação, elenco, cenografia, figurino, maquiagem, equipamentos, e locações, além de muitos outros, e é por isso que a sua colaboração para este projeto é muito necessária.</p>

<p>A nossa equipe consiste de 11 integrantes que são;
Roteiro e Direção: Ludendorf Viana
Assistente de Direção: Carolina Sugiyama
Dir. de Produção: Bruna Nardelli
Ass. de Produção: Thaís Paiva
Dir. de Fotografia: Barbara Graves
Ass. de Fotografia: Lucas Maraal
Direção de Arte: Eduardo Bueno e Gabriela Serra
Ass. de Arte: Victoria Alba
Montagem: José Luiz Neto
Téc. e Edição de Som: Rafael Gastaldi</p>

<p>Contamos com a sua colaboração!</p>

<p>Se caso você queira conhecer um pouco mais sobre este projeto e seus realizadores, visite nossa página do Facebook: 
<a class=""alt-link"" href=""http://www.facebook.com/projeto.onirica"" target=""_blank"">http://www.facebook.com/projeto.onirica</a>
E aproveite para ajudar a divulgar nosso projeto.
Muito Obrigado!</p>
",onirica,//player.vimeo.com/video/39937335,http://vimeo.com/39937335,"Cinema e Vídeo",13,,https://s3-sa-east-1.amazonaws.com/cdn.br.catarse/uploads/project/video_thumbnail/623/project_thumb_thumb_open-uri20131125-2-1i84jn2,https://s3-sa-east-1.amazonaws.com/cdn.br.catarse/uploads/project/video_thumbnail/623/project_thumb_small_open-uri20131125-2-1i84jn2,https://s3-sa-east-1.amazonaws.com/cdn.br.catarse/uploads/project/video_thumbnail/623/project_thumb_large_open-uri20131125-2-1i84jn2,https://s3-sa-east-1.amazonaws.com/cdn.br.catarse/uploads/project/video_thumbnail/623/project_thumb_video_cover_open-uri20131125-2-1i84jn2,161.1111111111111100,1450.0,36,34,successful,aon,finished,"2012-05-12 02:59:59","2012-05-11 23:59:59","2012-03-13 02:59:59","2012-03-12 23:59:59",,t,t,f,60,"{""total"" : 0, ""unit"" : ""seconds""}","{""total"" : 60, ""unit"" : ""days""}",0,"{""city"" : ""São Paulo"", ""state_acronym"" : ""SP"", ""state"" : ""São Paulo""}","{""id"" : 55356, ""name"" : ""Eduardo Bueno""}",0,,f,f,0,f,f,f