project_id,id,user_id,name,headline,budget,goal,about_html,permalink,video_embed_url,video_url,category_name,category_id,original_image,thumb_image,small_image,large_image,video_cover_image,progress,pledged,total_contributions,total_contributors,state,mode,state_order,expires_at,zone_expires_at,online_date,zone_online_date,sent_to_analysis_at,is_published,is_expired,open_for_contributions,online_days,remaining_time,elapsed_time,posts_count,address,user,reminder_count,is_owner_or_admin,user_signed_in,in_reminder,total_posts,can_request_transfer,is_admin_role,contributed_by_friends
626,626,56297,"Turno da Madrugada","Turno da Madrugada, um seriado de terror brasileiro. Apoie o terror nacional e faça esse projeto acontecer!","O orçamento para projetos anteriores a 24/02/2015 normalmente pode ser encontrado na descrição acima.",3200.0,"<p>O Turno da Madrugada é o projeto de um piloto de seriado televisivo. Nós, os idealizadores, somos estudantes do último ano do curso de Midialogia, na Universidade Estadual de Campinas (UNICAMP), e o projeto caracteriza-se como um de nossos trabalhos de conclusão da graduação.</p>

<p>Embora o Turno tenha sido selecionado em banca interna à faculdade, receberemos uma verba muito inferior ao necessário para concretizá-lo da forma que idealizamos. Somos apaixonados pelo projeto e nosso maior objetivo é produzir um piloto apresentável e passível de continuidade.</p>

<p>O seriado teria como base narrativa uma dupla de vigilantes noturnos que passam suas madrugadas em uma guarita distante de contato humano. Para passar o tempo, os personagens contam histórias de terror um para o outro, mais objetivamente, uma por episódio. Esses contos evocam sua vivências, e evidentemente, o próprio folclore brasileiro (desde lendas urbanas a histórias regionais). Em termos de estrutura: cada episódio será iniciado e fechado na guarita, com os vigilantes, com a apresentação de um breve narrativa inspirada em uma lenda de terror.</p>

<p>O piloto do programa será uma história baseada na lenda do homem do saco. Nela, um garoto vê seu amigo sendo raptado e vai investigar o que aconteceu, descobrindo que seu inimigo, no final, não é somente o homem do saco.</p>

<p>Estamos em fase de pré-produção e para ajudar a financiar o piloto, gostaríamos de levantar pelo menos 3 mil reais. Aplicaríamos o dinheiro recebido em três eixos principais: Produção (transporte, alimentação da equipe, locações, serviços terceirizados, etc), Arte (construção de cenário em estúdio, construção de uma maquete, figurinos e maquiagem, etc) e fotografia (aluguel de equipamentos de luz e acessórios para a gravação, como câmeras e lentes).</p>

<p>Necessitamos do dinheiro até o dia 3 de Junho. Nosso orçamento total vai além desses 3 mil reais então contribuições ultrapassando esse valor serão benvindas e muito apreciadas!</p>

<p>Compartilhe com amigos, família e conhecidos. Apostamos na cultura colaborativa em apoio ao Terror Nacional!</p>

<p>Saiba mais sobre o Turno da Madrugada em:
<a class=""alt-link"" href=""http://www.facebook.com/turnodamadrugada"" target=""_blank"">http://www.facebook.com/turnodamadrugada</a></p>
",turno-da-madrugada,//player.vimeo.com/video/40436259,http://vimeo.com/40436259,"Cinema e Vídeo",13,,https://s3-sa-east-1.amazonaws.com/cdn.br.catarse/uploads/project/video_thumbnail/626/project_thumb_thumb_open-uri20131125-2-3i49t4,https://s3-sa-east-1.amazonaws.com/cdn.br.catarse/uploads/project/video_thumbnail/626/project_thumb_small_open-uri20131125-2-3i49t4,https://s3-sa-east-1.amazonaws.com/cdn.br.catarse/uploads/project/video_thumbnail/626/project_thumb_large_open-uri20131125-2-3i49t4,https://s3-sa-east-1.amazonaws.com/cdn.br.catarse/uploads/project/video_thumbnail/626/project_thumb_video_cover_open-uri20131125-2-3i49t4,101.5625000000000000,3250.0,54,53,successful,aon,finished,"2012-06-04 02:59:59","2012-06-03 23:59:59","2012-04-05 02:59:59","2012-04-04 23:59:59",,t,t,f,60,"{""total"" : 0, ""unit"" : ""seconds""}","{""total"" : 60, ""unit"" : ""days""}",1,"{""city"" : ""Campinas"", ""state_acronym"" : ""SP"", ""state"" : ""São Paulo""}","{""id"" : 56297, ""name"" : """"}",0,,f,f,1,f,f,f