project_id,id,user_id,name,headline,budget,goal,about_html,permalink,video_embed_url,video_url,category_name,category_id,original_image,thumb_image,small_image,large_image,video_cover_image,progress,pledged,total_contributions,total_contributors,state,mode,state_order,expires_at,zone_expires_at,online_date,zone_online_date,sent_to_analysis_at,is_published,is_expired,open_for_contributions,online_days,remaining_time,elapsed_time,posts_count,address,user,reminder_count,is_owner_or_admin,user_signed_in,in_reminder,total_posts,can_request_transfer,is_admin_role,contributed_by_friends
640,640,52574,"Segunda temporada da websérie ""Mulheres Pobres""","Ajude a realizar a SEGUNDA TEMPORADA DE MULHERES POBRES, doe quanto puder e verá como é facil fazer um pobre, ou melhor, 5 pobres felizes.","O orçamento para projetos anteriores a 24/02/2015 normalmente pode ser encontrado na descrição acima.",45000.0,"<p>MULHERES POBRES, é um projeto de uma websérie vinculada no site do youtube e divulgada nas redes sociais.
Foi realizada a primeira temporada independentemente. Agora querem produzir a SEGUNDA TEMPORADA, com cinco episódios, feito com a ajuda do internauta.
A websérie Mulheres Pobres, é um programa de reality show fictício que tem como objetivo mostrar com muito humor para os internautas a realidade brasileira de cinco mulheres consideradas desfavorecidas, que lutam a cada dia para sobreviver. A idéia surgiu, de uma crítica que o grupo “independente, mas de coração”, fez em relação ao programa vinculado na TV Bandeirantes chamado “Mulheres ricas”, onde mostra a vida real de cinco socialites que esbanjam dinheiro. 
A websérie é vinculada no site youtube e divulgada principalmente nas redes sociais. 
Mulheres pobres é produzida pelo grupo “Independente, mas de coração” e conta com alguns atores. Nesse projeto estão fixamente as atrizes Cecé Fialho, Daphne Bozaski, Fernanda Magnani, Flávia Strongolli, Jana Mundana e o ator Raphael Rocha que interpreta todos os personagens masculinos da trama. A cada episódio contamos com um ator convidado.</p>
",640-segunda-temporada-da-webserie-mulheres-pobres,//player.vimeo.com/video/40833061,http://vimeo.com/40833061,"Cinema e Vídeo",13,,https://s3-sa-east-1.amazonaws.com/cdn.br.catarse/uploads/project/video_thumbnail/640/project_thumb_thumb_open-uri20131125-2-14puuds,https://s3-sa-east-1.amazonaws.com/cdn.br.catarse/uploads/project/video_thumbnail/640/project_thumb_small_open-uri20131125-2-14puuds,https://s3-sa-east-1.amazonaws.com/cdn.br.catarse/uploads/project/video_thumbnail/640/project_thumb_large_open-uri20131125-2-14puuds,https://s3-sa-east-1.amazonaws.com/cdn.br.catarse/uploads/project/video_thumbnail/640/project_thumb_video_cover_open-uri20131125-2-14puuds,1.34444444444444444400,605.0,14,14,failed,aon,finished,"2012-06-23 02:59:59","2012-06-22 23:59:59","2012-04-24 02:59:59","2012-04-23 23:59:59",,t,t,f,60,"{""total"" : 0, ""unit"" : ""seconds""}","{""total"" : 60, ""unit"" : ""days""}",2,"{""city"" : ""São Paulo"", ""state_acronym"" : ""SP"", ""state"" : ""São Paulo""}","{""id"" : 52574, ""name"" : ""Marcelina Mendes Fialho""}",0,,f,f,2,f,f,f