project_id,id,user_id,name,headline,budget,goal,about_html,permalink,video_embed_url,video_url,category_name,category_id,original_image,thumb_image,small_image,large_image,video_cover_image,progress,pledged,total_contributions,total_contributors,state,mode,state_order,expires_at,zone_expires_at,online_date,zone_online_date,sent_to_analysis_at,is_published,is_expired,open_for_contributions,online_days,remaining_time,elapsed_time,posts_count,address,user,reminder_count,is_owner_or_admin,user_signed_in,in_reminder,total_posts,can_request_transfer,is_admin_role,contributed_by_friends
6515,6515,276059,"Cobrindo o Quilombo do Tereré","""Vem ajudar mais eu"",""Vem apoiar mais eu, mano meu"".","O orçamento para projetos anteriores a 24/02/2015 normalmente pode ser encontrado na descrição acima.",8520.0,"<p>Começamos com esse vídeo contando um pouco sobre o nosso projeto, quem é nosso principal mentor e qual o passo a passo pra nos ajudar. Agora vamos detalhar pra todos e todas como isso tudo começou, *<em>&quot;quem nunca viu, venha ver!&quot; *</em> </p>

<p><img src=""http://i.imgur.com/aWBb3DD.jpg"" alt=""""/></p>

<p><strong>“Bahia, manda seu axé pra mim, Bahia, manda seu axé pra mim!”</strong>
Olá, gente toda dos quatro cantos desse mundo!
Com certeza você já ouviu falar da Bahia, a velha Bahia de todos os Santos, cuja capital é Salvador, a primeira capital da nação brasileira. De um de seus principais pontos turísticos, o Elevador Larceda, é possível visualizar nossa terra mãe, a ILHA DE ITAPARICA, que abriga o projeto que apresentamos a vocês: a <strong>Associação Cultural Quilombo do Tereré.</strong></p>

<p>O que nos motivou a tornar esse projeto uma realidade foi a necessidade de termos um espaço, uma casa social que traga novos horizontes culturais e educativos que possam influenciar a perspectiva de vida da comunidade do Tereré, situado no bairro Ilhota, município de Vera Cruz, que forma com a cidade de Itaparica, a Ilha de Itaparica, no estado da Bahia. 
Fazemos parte de uma localidade de baixa renda, onde não existe nenhum aparato do poder público presente e atuante, de modo que falta tudo para nossa população local (desde um bom calçamento para chegar em suas casas, já que a maioria das ruas ainda é de terra, até posto de saúde, creche, uma simples praça ou parque entre tantas coisas...). </p>

<p>Este local é um sítio histórico, lugar de resistência negra, onde a população se formou de famílias vindas do Recôncavo Baiano (a maioria das cidades de Maragogipe, São Félix e São Filipe) que se instalaram nestas terras em torno de uma bica de fonte natural (a chamada Fonte do Tereré). </p>

<p>Ali, nascidos da mesma família, dois integrantes deste projeto - Reitel e Budião - vão ganhar o mundo sem nunca perder suas raízes, pois se envolvem no universo da Capoeira, do Maculelê, do Samba de Roda e de todos os ritmos, danças e músicas que habitam tais vertentes da cultura popular brasileira.
<img src=""http://i.imgur.com/furPUcM.jpg"" alt=""""/></p>

<p>Dos anos 80 para cá eles passaram por diversos trabalhos voluntários e sociais ligados à cultura, de alunos a dirigentes. Agora estão à frente desse trabalho agindo e desempenhando a função de professores.</p>

<p>No início a Casa de Farinha do Maragogipinho foi o local que abrigou todas as nossas atividades e ainda hoje, nos dias de chuva, é nossa salvação! 
Esse vídeo que editamos aqui pro Catarse é o material que fizemos na época que só tínhamos a casa de farinha: <div class=""video youtube""><iframe width=""600"" height=""403"" src=""//www.youtube.com/embed/oCgIC7udgfw?wmode=opaque"" frameborder=""0"" allowfullscreen></iframe></div></p>

<p>Desde 2011, com a doação do terreno por parte da família Conceição das Neves, foi possível iniciar a construção do Rancho da Associação Cultural Quilombo do Tereré. De lá pra cá, a fundação e as paredes já foram erguidas e agora precisamos do financiamento coletivo para COBRIR O TELHADO, colocar as portas e as janelas, iluminar e revestir os banheiros com o básico, de modo que o lugar passe a funcionar todos os dias, atendendo às diversas possibilidades que almejamos trazer para esse espaço como:
• Treinos, rodas e vivências de CAPOEIRA (cujo histórico vem da capoeira rural,  vivida no contato com a natureza e aprendida com os antigos no dia-dia);</p>

<p>• Oficinas e cursos de formação, desde musical à profissional;</p>

<p>• Reforço escolar com espaço para um biblioteca (a planta baixa do espaço já está traçada contando além da biblioteca com uma cozinha, uma sala de aula e dois banheiros masculino e feminino) entre tantos outros sonhos ligados à cultura e a educação.</p>

<p>Olha como faremos uso do dinheiro arrecadado.
<img src=""http://i.imgur.com/LlvGzlr.jpg"" alt=""""/></p>

<p>Aqui nesse vídeo, você pode ver uma conversa de Reitel com um jornalista francês que foi conhecer o projeto num dia de roda de frutas com as crianças. Foi tudo muito espontâneo e verdadeiro, que é o nosso jeito de fazer e ser no mundo.
<div class=""video youtube""><iframe width=""600"" height=""403"" src=""//www.youtube.com/embed/DgkoAiAafvw?wmode=opaque"" frameborder=""0"" allowfullscreen></iframe></div>  </p>

<p>A ideia é que essa casa seja para todos, sem restrição de grupos ou faixa etária, de modo que as pessoas possam se envolver e desenvolver o espírito de cultuar e de cultivar tudo o que envolver o processo da aprendizagem, de criação, como no proceder de renovação da vida: Vivendo e Aprendendo.</p>

<p>Para a concretização desse projeto contamos com a sua ajuda, pois quando este lugar estiver funcionando plenamente teremos além de um espaço da cultura, uma casa, um lar de convívio para o povo. Estamos construindo um território que vai abrigar as atividades que levem para educação, para a cidadania, para a política e para a sociedade, contribuindo de alguma forma com o nosso arredor.</p>

<p>Antes de fazer a doação aproveita pra curtir por aqui a nossa página no Facebook e veja como temos trabalhado até agora:
<a class=""alt-link"" href=""http://www.facebook.com/quilombotererereitel?ref=hl"" target=""_blank"">http://www.facebook.com/quilombotererereitel?ref=hl</a></p>

<p>Temos desde sempre contado com toda forma de apoio. A partir de agora vamos <em>contar com a sua colaboração</em>, e desse modo, seu rosto e seu nome (VEJA AS RECOMPENSAS) estarão para sempre vivos aqui na Bahia, no Rancho da Associação Quilombo do Tereré.</p>

<p><strong>Axé, gente, muito axé!</strong>
<img src=""http://i.imgur.com/uXjNqkL.jpg"" alt=""""/></p>
",quilomboterere,//www.youtube.com/embed/7xlABOAPuP8," http://www.youtube.com/watch?v=7xlABOAPuP8",Socioambiental,4,https://s3-sa-east-1.amazonaws.com/cdn.br.catarse/uploads/project/uploaded_image/6515/DSCN3967.JPG,https://s3-sa-east-1.amazonaws.com/cdn.br.catarse/uploads/project/uploaded_image/6515/project_thumb_thumb_DSCN3967.JPG,https://s3-sa-east-1.amazonaws.com/cdn.br.catarse/uploads/project/uploaded_image/6515/project_thumb_small_DSCN3967.JPG,https://s3-sa-east-1.amazonaws.com/cdn.br.catarse/uploads/project/uploaded_image/6515/project_thumb_large_DSCN3967.JPG,https://s3-sa-east-1.amazonaws.com/cdn.br.catarse/uploads/project/uploaded_image/6515/project_thumb_video_cover_DSCN3967.JPG,120.1056338028169000,10233.0,40,30,successful,aon,finished,"2014-10-27 01:59:59","2014-10-26 23:59:59","2014-08-27 11:12:40.336485","2014-08-27 08:12:40.336485",,t,t,f,60,"{""total"" : 0, ""unit"" : ""seconds""}","{""total"" : 60, ""unit"" : ""days""}",2,"{""city"" : ""Vera Cruz"", ""state_acronym"" : ""BA"", ""state"" : ""Bahia""}","{""id"" : 276059, ""name"" : ""Associação de Arte e Cultura Quilombo do Terere""}",1,,f,f,2,f,f,f