project_id,id,user_id,name,headline,budget,goal,about_html,permalink,video_embed_url,video_url,category_name,category_id,original_image,thumb_image,small_image,large_image,video_cover_image,progress,pledged,total_contributions,total_contributors,state,mode,state_order,expires_at,zone_expires_at,online_date,zone_online_date,sent_to_analysis_at,is_published,is_expired,open_for_contributions,online_days,remaining_time,elapsed_time,posts_count,address,user,reminder_count,is_owner_or_admin,user_signed_in,in_reminder,total_posts,can_request_transfer,is_admin_role,contributed_by_friends
6692,6692,315897,"Volei de Praia Sem Fronteiras","Não é porque Minas não tem praia, que não podemos disputar!","O orçamento para projetos anteriores a 24/02/2015 normalmente pode ser encontrado na descrição acima.",3500.0,"<p>Projeto Vôlei de Praia Sem Fronteiras visa arrecadar fundos para que possa conseguir arcar com as despesas de transporte de atletas de vôlei de praia, do estado de Minas Gerais, com a finalidade de disputa do Circuito Nacional Banco do Brasil de Vôlei de Praia, nas etapas de Campinas/SP e São José/SC.</p>

<p>O valor arrecadado vai suprir a necessidade das despesas como transporte aéreo da cidade de Belo Horizonte/MG à cidade de Campinas/SP e São José/SC, de dois atletas, bem como Hospedagem e alimentação. Os jogos ocorreram nas seguintes datas 16 a 19 de Outubro em Campinas e 06 a 09 de Novembro na cidade de São José/SC (link do calendário oficial - <a class=""alt-link"" href=""http://www.cbv.com.br/v1/praia/CALENDARIO"" target=""_blank"">http://www.cbv.com.br/v1/praia/CALENDARIO</a><em>DE</em>COMPETICOES<em>VOLEI</em>DE<em>PRAIA</em>2014<em>2</em>semestre.pdf).</p>

<p>Será divulgado a arrecadação de doações em rede sociais, rede de amigos desta quantia para que possamos conseguir atingir a nossa  meta.</p>

<p>Nossa equipe empenhada nesse projeto conta com a participação de 01 Técnico,01 auxiliar técnico, 01 preparador físico, 01 fisioterapeuta, 03 atletas de rendimento, além disso, academia e uma ótima estrutura física para treinamentos.</p>
",voleidepraiasemfronteiras,//www.youtube.com/embed/3C_bd4Vuo7Q,https://www.youtube.com/watch?v=3C_bd4Vuo7Q,Esporte,21,https://s3-sa-east-1.amazonaws.com/cdn.br.catarse/uploads/project/uploaded_image/6692/imagem_01.JPG,https://s3-sa-east-1.amazonaws.com/cdn.br.catarse/uploads/project/uploaded_image/6692/project_thumb_thumb_imagem_01.JPG,https://s3-sa-east-1.amazonaws.com/cdn.br.catarse/uploads/project/uploaded_image/6692/project_thumb_small_imagem_01.JPG,https://s3-sa-east-1.amazonaws.com/cdn.br.catarse/uploads/project/uploaded_image/6692/project_thumb_large_imagem_01.JPG,https://s3-sa-east-1.amazonaws.com/cdn.br.catarse/uploads/project/uploaded_image/6692/project_thumb_video_cover_imagem_01.JPG,0,0,0,0,failed,aon,finished,"2014-10-01 02:59:59","2014-09-30 23:59:59","2014-08-21 11:22:20.528484","2014-08-21 08:22:20.528484",,t,t,f,40,"{""total"" : 0, ""unit"" : ""seconds""}","{""total"" : 40, ""unit"" : ""days""}",0,"{""city"" : ""Betim"", ""state_acronym"" : ""MG"", ""state"" : ""Minas Gerais""}","{""id"" : 315897, ""name"" : ""THALES GUILHERME SILVA CAMPOS""}",0,,f,f,0,f,f,f