project_id,id,user_id,name,headline,budget,goal,about_html,permalink,video_embed_url,video_url,category_name,category_id,original_image,thumb_image,small_image,large_image,video_cover_image,progress,pledged,total_contributions,total_contributors,state,mode,state_order,expires_at,zone_expires_at,online_date,zone_online_date,sent_to_analysis_at,is_published,is_expired,open_for_contributions,online_days,remaining_time,elapsed_time,posts_count,address,user,reminder_count,is_owner_or_admin,user_signed_in,in_reminder,total_posts,can_request_transfer,is_admin_role,contributed_by_friends
6754,6754,317274,"Mais Bondade","Gestos de bondade que ajudarão milhões de brasileiros e animais.","O orçamento para projetos anteriores a 24/02/2015 normalmente pode ser encontrado na descrição acima.",5000.0,"<p><a class=""alt-link"" href=""http://www.maisbondade.com.br/"" target=""_blank"">http://www.maisbondade.com.br/</a></p>

<p>Criar nos brasileiros a cultura do voluntariado e do altruísmo. Com esta premissa, iniciamos este projeto inovador recém apelidado de &quot;Mais Bondade&quot;.</p>

<p>Esta é uma das muitas iniciativas empreendedoras da agência Artgo Marketing Digital, empresa especializada na criação de negócios online inovadores.</p>

<p>O projeto Mais Bondade consiste na formação de uma rede de voluntários convidados em todo país, onde o apelo não está em ajudar uma ONG específica, e sim toda e qualquer demanda social (carente) proveniente de uma instituição de caridade, animais ou pessoas necessitas.</p>

<p>O conceito se divide em 2 etapas que totalizam 10 estrelas, onde as 5 primeiras consistem na realização de 5 atividades do bem (doação, voluntariado, etc) em sua respectiva região (daremos uma lista de opções genéricas) e na segunda fase as 5 estrelas complementares, que consistem no colaborador convidar e engajar 5 pessoas no projeto para que repitam o mesmo ciclo de 10 estrelas.</p>

<p>Estimamos que graças ao sistema inovador de progressão geométrica e a legitimidade da causa (sem fins lucrativos), conseguiremos um amplo apoio da sociedade e teremos uma repercussão em diversas mídias em nível nacional como entrevistas em jornais, tv, rádio e outras mídias de grande visibilidade.</p>

<p>O número de pessoas beneficiadas com este projeto em 6 meses será de aproximadamente 50 a 100 mil pessoas, podendo ser maior de acordo com a repercussão midiática.</p>

<p>O custo básico &quot;econômico&quot; para iniciar o projeto base é de R$ 5.000,00 valor que envolve o desenvolvimento da programação do site, criação da identidade visual, video de apresentação do projeto e assessoria de imprensa simples.</p>

<p>Nossa meta real é a de arrecadar R$ 25.000,00, valor que será usado integralmente para envio de brindes aos voluntários, realização de eventos de divulgação, produção de diversos videos, material de apoio (flyers, banners, etc) e ampla divulgação nos veículos de imprensa.</p>

<p>A Artgo terá como papel principal o desenvolvimento do projeto e administração dos recursos doados, garantindo a efetividade total do projeto que pode mudar a vida de dezenas de milhares ou quem sabe milhões de brasileiros.</p>

<p>Em um segundo momento, de acordo com o sucesso do projeto, pretendemos exportar este conceito para diversos países, em especial aqueles que possuem uma população carente de recursos básicos para ter uma vida digna.</p>

<p>Contamos com o seu apoio! Estamos ansiosos para iniciar o projeto.</p>

<p><img src=""https://scontent-b-mia.xx.fbcdn.net/hphotos-xpf1/t1.0-9/10552497_1467506983505814_449935279161360652_n.jpg"" alt=""""/></p>
",maisbondade,//www.youtube.com/embed/swPLSLZJCCc,www.youtube.com/watch?v=swPLSLZJCCc,Socioambiental,4,https://s3-sa-east-1.amazonaws.com/cdn.br.catarse/uploads/project/uploaded_image/6754/quadrado.jpg,https://s3-sa-east-1.amazonaws.com/cdn.br.catarse/uploads/project/uploaded_image/6754/project_thumb_thumb_quadrado.jpg,https://s3-sa-east-1.amazonaws.com/cdn.br.catarse/uploads/project/uploaded_image/6754/project_thumb_small_quadrado.jpg,https://s3-sa-east-1.amazonaws.com/cdn.br.catarse/uploads/project/uploaded_image/6754/project_thumb_large_quadrado.jpg,https://s3-sa-east-1.amazonaws.com/cdn.br.catarse/uploads/project/uploaded_image/6754/project_thumb_video_cover_quadrado.jpg,2.00000000000000000000,100.0,1,1,failed,aon,finished,"2014-10-23 01:59:59","2014-10-22 23:59:59","2014-09-02 19:56:26.706424","2014-09-02 16:56:26.706424",,t,t,f,50,"{""total"" : 0, ""unit"" : ""seconds""}","{""total"" : 50, ""unit"" : ""days""}",0,"{""city"" : ""São Paulo"", ""state_acronym"" : ""SP"", ""state"" : ""São Paulo""}","{""id"" : 317274, ""name"" : ""Artgo Marketing Digital Ltda""}",0,,f,f,0,f,f,f