project_id,id,user_id,name,headline,budget,goal,about_html,permalink,video_embed_url,video_url,category_name,category_id,original_image,thumb_image,small_image,large_image,video_cover_image,progress,pledged,total_contributions,total_contributors,state,mode,state_order,expires_at,zone_expires_at,online_date,zone_online_date,sent_to_analysis_at,is_published,is_expired,open_for_contributions,online_days,remaining_time,elapsed_time,posts_count,address,user,reminder_count,is_owner_or_admin,user_signed_in,in_reminder,total_posts,can_request_transfer,is_admin_role,contributed_by_friends
6782,6782,264358,"Transição Agroecológica","CONTRIBUA PARA A CONSTRUÇÃO DE UMA CONSCIÊNCIA AGROECOLÓGICA DE CRIANÇAS E JOVENS. VAMOS APRENDER E ENSINAR BRINCANDO.","O orçamento para projetos anteriores a 24/02/2015 normalmente pode ser encontrado na descrição acima.",30000.0,"<p>Ao discutir AGROECOLOGIA, ficamos pensando como poderíamos fazer esse debate com crianças e adolescentes, buscando uma forma criativa para que pudessem aprender. É assim que surge a ideia de um jogo de tabuleiro infanto-juvenil onde os jogadores tem como tarefa SAIR DO USO DE AGROTÓXICOS para a TRANSIÇÃO AGROECOLÓGICA. </p>

<p>O jogo se dá em um tabuleiro, onde cada jogador usando um dado lança a sorte quantas casas deve percorrer, e assim inicia seu trajeto rumo a Transição Agroecológica, porém nesse trajeto existem &quot;perigos&quot; de contaminação que são representados por caveiras de agrotóxicos. Ao parar em cima de uma dessas caveiras, o jogador deverá responder a uma questão presente no cartão envenenado, se acertar avança, mas se errar deve retroceder. Da mesma forma, existem desenhos de um &quot;globo agroecológico&quot; que se o participante parar sobre ele deverá ler o Cartão Agroecológico que contém dicas sobre agroecologia e com isso poderá avançar algumas casas.</p>

<p>Já temos toda a ideia pronta, precisamos apenas contratar os serviços gráficos, e os custos com o trabalho dos profissionais que desenvolveram o jogo.</p>

<p>Esperamos que tal iniciativa seja um sucesso, pois pretendemos nessa primeira tiragem reproduzir 5 mil exemplares que serão distribuídos em escolas públicas de forma gratuita para as várias regiões do país, incluindo escolas urbanas e rurais. Depois dessa primeira produção,a ideia é buscar formas de continuar reproduzindo, pois poderá ser um instrumento pedagógico de extrema importância para professores que atuam com crianças e adolescentes.</p>

<p>O orçamento total do projeto é de 30 mil reais, mas acreditamos que todas aquelas pessoas que defendem a vida farão suas doações e chegaremos tranquilamente a esse valor.</p>

<p>Assim que terminamos a arrecadação no Catarse, em 30 dias teremos os jogos impressos e já prontos para envio por correio a nossos colaboradores.
Por trás desse projeto esta um conjunto de pessoas que acreditam e contribuem com o Fórum Nacional de Combate aos Agrotóxicos, com a Campanha Permanente Contra os Agrotóxicos e Pela Vida, com o Movimentos dos Pequenos Agricultores - MPA/ Via Campesina e com todas as iniciativas importantes no campo da Agroecologia, tais como a Articulação Nacional de Agroecologia - ANA e grupos de produtores Agroecológicos.</p>

<p>Desde já agradecemos pela vossa colaboração, pois sem ela é IMPOSSÍVEL que tal projeto seja concluído, e conclui-lo será algo muito importante para nossas crianças e adolescentes irem se conscientizando da necessidade de avançarmos com a TRANSIÇÃO AGROECOLÓGICA.</p>
",transicaoagroecologica,//www.youtube.com/embed/ts0u9WZymuI,https://www.youtube.com/watch?edit=vd&v=ts0u9WZymuI,Socioambiental,4,https://s3-sa-east-1.amazonaws.com/cdn.br.catarse/uploads/project/uploaded_image/6782/Cart_es_-_Transi__o.jpg,https://s3-sa-east-1.amazonaws.com/cdn.br.catarse/uploads/project/uploaded_image/6782/project_thumb_thumb_Cart_es_-_Transi__o.jpg,https://s3-sa-east-1.amazonaws.com/cdn.br.catarse/uploads/project/uploaded_image/6782/project_thumb_small_Cart_es_-_Transi__o.jpg,https://s3-sa-east-1.amazonaws.com/cdn.br.catarse/uploads/project/uploaded_image/6782/project_thumb_large_Cart_es_-_Transi__o.jpg,https://s3-sa-east-1.amazonaws.com/cdn.br.catarse/uploads/project/uploaded_image/6782/project_thumb_video_cover_Cart_es_-_Transi__o.jpg,7.88333333333333333300,2365.0,39,39,failed,aon,finished,"2014-11-05 01:59:59","2014-11-04 23:59:59","2014-09-05 22:47:58.944568","2014-09-05 19:47:58.944568",,t,t,f,60,"{""total"" : 0, ""unit"" : ""seconds""}","{""total"" : 60, ""unit"" : ""days""}",0,"{""city"" : ""São Paulo"", ""state_acronym"" : ""SP"", ""state"" : ""São Paulo""}","{""id"" : 264358, ""name"" : ""Cleber Folgado""}",0,,f,f,0,f,f,f