project_id,id,user_id,name,headline,budget,goal,about_html,permalink,video_embed_url,video_url,category_name,category_id,original_image,thumb_image,small_image,large_image,video_cover_image,progress,pledged,total_contributions,total_contributors,state,mode,state_order,expires_at,zone_expires_at,online_date,zone_online_date,sent_to_analysis_at,is_published,is_expired,open_for_contributions,online_days,remaining_time,elapsed_time,posts_count,address,user,reminder_count,is_owner_or_admin,user_signed_in,in_reminder,total_posts,can_request_transfer,is_admin_role,contributed_by_friends
702,702,55948,"A Almofada de Penas | Curta em Stop Motion","Curta em stop motion para adultos que mostrará o lado obscuro e retorcido da mente humana de um jeito que só a animação é capaz de oferecer.","O orçamento para projetos anteriores a 24/02/2015 normalmente pode ser encontrado na descrição acima.",8000.0,"<p>Teaser do filme:
<iframe src=""//player.vimeo.com/video/25523544?title=0&byline=0&portrait=0"" width=""600"" height=""403"" frameborder=""0""></iframe></p>

<p>Confira mais no facebook: <a class=""alt-link"" href=""http://www.facebook.com/AlmofadadePenas"" target=""_blank"">http://www.facebook.com/AlmofadadePenas</a></p>

<p>O curta é uma homenagem ao conto homônimo do escritor uruguaio Horácio Quiroga. A narrativa representa o conflito universal intrínseco às relações amorosas, mais especificamente àquelas que seguem o ideal das almas gêmeas que, por mais que insistam, nunca conseguem virar uma só: “Dois que nunca viram um”.</p>

<p>Jordão e Alicia protagonizam a estória. Recém-casados e com grandes expectativas sobre o que seria a vida a dois, o casal bate de frente com a realidade, que não corresponde às perspectivas construídas ao longo das suas vidas. Assim, vão surgindo pulsações do inconsciente em cada um deles, como resposta à desilusão. 
Este drama, carregado de suspense, segue a linha dos contos de Edgar Allan Poe (referencia direta de Quiroga), o que nos reserva uma estória submersa no mundo obscuro e retorcido da mente humana.</p>

<p>O que estou produzindo
Primeiro, gostaria de me apresentar. Meu nome é Joseph Specker, sou estudante de design gráfico na cidade de Florianópolis, e é com muito orgulho e alegria que venho lhes contagiar com o meu ambicioso projeto: um curta metragem em stop motion, com duração de aproximadamente 8 minutos, baseado no conto &quot;A Almofada de Penas&quot;. Sou apaixonado por animação desde pequeno, mas a minha fascinação pelo stop motion começou em 1993, com o filme “The Nightmare Before Christmas”. Hoje, depois de ter participado de workshops, baixado livros gringos sobre a técnica e de tê-la treinado no fundo do quintal, tenho o privilégio de estar criando o meu próprio curta! Sou muito consciente do tamanho do desafio, e é por isso que vou dedicar todo o meu ano ao projeto, que pretendo terminar até dezembro.</p>

<p>Stop Motion</p>

<p>Um dos meus objetivos principais é criar uma animação destinada a adultos, com uma trama intensa entre os personagens, que permita ao público brasileiro consumir animação de alta qualidade sem que seja necessária uma temática infantil e/ou de comédia, trazendo desta maneira ao espectador o lado expressivo e único que só o mundo da animação é capaz de oferecer.  </p>

<p>O stop motion consegue resultados visualmente muito ricos, mas para chegar até eles é preciso obstinada dedicação, paciência e principalmente loucura (entenda-se paixão).
E por mais antiga que esta técnica seja, ela continua a resurgir ano após ano (mesmo com o domínio do 3D digital), inclusive em grandes produções de Hollywood e da Europa, como “Chicken Run”, “Corpse Bride”, “Mary and Max”, “Paranorman”, “Coraline” etc.</p>

<p>O meu processo de criação vai ser inspirado nas grandes produções, em uma escala mais humilde, claro, mas sempre persistindo na qualidade. Como? Por meio da utilização de personagens com juntas mecânicas e sistemas de articulação bastante complexos, confeccionados em material resistente e maleável, visto que os modelos têm que durar meses, pois para cada segundo de filme são necessários aproximadamente 24 quadros (frames).</p>

<p>Para dar uma ideia do processo, vou contar brevemente como ele funciona:</p>

<p>Trata-se de uma produção multidisciplinar e muito artesanal. Uma vez finalizados os concepts dos personagens (ilustrados), eu modelo cada um deles em clay (massa de modelar) em escala real (de 28 a 35 centímetros). Em seguida, construo a estrutura interna dos bonecos (esqueleto de metal articulado, feito em um torneiro mecânico) para dar movimento e vida aos personagens. Da escultura de clay faço os moldes, que são então preenchidos com silicone (já com o esqueleto dentro), criando assim a “pele” dos personagens. As mãos e a cabeça são feitas a parte e, depois de finalizadas, juntam-se ao corpo. O rosto possui encaixes para cada umas das expressões necessárias para dar vida aos personagens e para todos os fonemas (a fim de que se consiga dar a impressão de que os bonecos estão falando). Posteriormente vem o figurino de cada um – ternos, camisas, gravatas, vestidos, etc –, seguido de cabelo e adereços. Os cenários do filme são quatro e, como os personagens chegam a 35 centímetros, devem superar os 120 centímetros de altura. Móveis de todo tipo, paredes, colunas, estátuas e portas são alguns dos elementos a serem desenvolvidos. </p>

<p>Vou parar por aqui para não me exceder, porque senão teria que detalhar todo processo de animação, iluminação, fotografia, edição, sonoplastia e trilha sonora, efeitos especiais... Mas se quiserem saber mais sobre o projeto, não deixem de acessar o meu blog e o facebook do projeto:</p>

<p><a class=""alt-link"" href=""http://www.almofadadepenas.tumblr.com"" target=""_blank"">www.almofadadepenas.tumblr.com</a> </p>

<p>E também ficarei feliz em receber seus e-mails! Sei o quão difícil é conseguir informação sobre este ramo, por isso estou aberto a trocar idéias e conhecimentos com qualquer pessoa interessada em stop motion: podem contar comigo! :) </p>

<p><a class=""alt-link"" href=""mailto:josephspecker@gmail.com"" target=""_blank"">josephspecker@gmail.com</a></p>

<p>Se você tiver interesse em conhecer mais sobre o meu trabalho, não deixa de visitar meu site:
<a class=""alt-link"" href=""http://www.josephspecker.com"" target=""_blank"">www.josephspecker.com</a></p>

<p>Por que preciso de ajuda?
O lançamento do curta-metragem está previsto para meados de dezembro deste ano, e a produção está a todo vapor! Roteiro prontíssimo, concepts dos personagens principais completados e as esculturas em clay estão quase finalizadas. 
Sei que ainda tenho muito trabalho pela frente, e que a quantidade de materiais que preciso é muito grande (8 personagens, 40 encaixes de testa, 80 encaixes de boca, 5 cenários), sem contar a mão de obra de apoio que vou precisar para poder terminar o projeto no prazo, o aluguel de equipamentos e o espaço de trabalho. É por estas razões que preciso da ajuda de vocês, e pela qual já sou muito grato.</p>

<p>Obrigado por acreditarem no meu trabalho e nos meus sonhos!</p>
",a-almofada-de-penas-curta-em-stop-motion,//player.vimeo.com/video/42764273,http://vimeo.com/42764273,"Cinema e Vídeo",13,,,,,,103.7625000000000000,8301.0,67,62,successful,aon,finished,"2012-07-24 02:59:59","2012-07-23 23:59:59","2012-05-25 02:59:59","2012-05-24 23:59:59",,t,t,f,60,"{""total"" : 0, ""unit"" : ""seconds""}","{""total"" : 60, ""unit"" : ""days""}",0,"{""city"" : ""Marechal Floriano"", ""state_acronym"" : ""ES"", ""state"" : ""Espírito Santo""}","{""id"" : 55948, ""name"" : ""Joseph Specker Nys""}",0,,f,f,0,f,f,f