project_id,id,user_id,name,headline,budget,goal,about_html,permalink,video_embed_url,video_url,category_name,category_id,original_image,thumb_image,small_image,large_image,video_cover_image,progress,pledged,total_contributions,total_contributors,state,mode,state_order,expires_at,zone_expires_at,online_date,zone_online_date,sent_to_analysis_at,is_published,is_expired,open_for_contributions,online_days,remaining_time,elapsed_time,posts_count,address,user,reminder_count,is_owner_or_admin,user_signed_in,in_reminder,total_posts,can_request_transfer,is_admin_role,contributed_by_friends
7069,7069,245560,"Livro Caminho a Semonkong","Acompanhe meus passos em caminhos não planejados na África, que me levaram a muitas descobertas","<p><img src=""https://s3-sa-east-1.amazonaws.com/cdn.br.catarse/uploads/redactor_rails/picture/data/46895/Captura_de_Tela_2016-05-05_%C3%A0s_16.16.09.png""></p>",25030.0,"<p>Imagine você em uma jornada de um ano pela África, com pouco dinheiro, uma mochila nas costas, e com a liberdade de seguir qualquer caminho. ""Caminho a Semonkong"" é o livro que conta a história de dois amigos que viajam para este incrível continente em busca de novas perspectivas para a vida adulta. É uma versão do que aconteceu naquele período; um esforço solitário pela memória romanceada.
Semonkong significa literalmente ""Lugar da fumaça"", provável referência ao vapor d'água da grande cachoeira Maletsunyane, que deixa de ser totalmente líquida para flutuar entre altas paredes do cânion. A fumaça sempre esteve presente nos rituais de transformação dos povos ancestrais, inclusive os africanos. Lancei-me ao caminho a Semonkong, um caminho de transformação e auto-descoberta.</p><p>Lanço a campanha no Catarse para viabilizar a impressão de 1000 cópias do livro ""Caminho a Semonkong"". Funciona como uma pré-venda dos livros, com algumas recompensas extras. Você escolhe uma recompensa e faz uma colaboração ao projeto. O dinheiro só será debitado da sua conta, caso todo o montante necessário seja alcançado. Ou seja, é tudo ou nada. Caminhemos juntos!</p><p>Abaixo seguem algumas imagens e pequenos recortes desta aventura.</p><p><img src=""https://s3.amazonaws.com/cdn.catarse/uploads/redactor_rails/picture/data/2005/_frica06600066.jpg""></p><p>Passei uma noite acampado aos pés desta cachoeira magnífica, encoberto por esta fumaça, purificado pelo som que estremecia as paredes ao meu redor. Naquele cantinho do mundo, vivi uma pequena eternidade entre o assombro incrível da beleza e do inusitado, e o medo do incerto e de ter tomado uma resolução equivocada. A chuva revezou a noite com o céu estrelado e fez o rio subir até quase minha barraca. No dia seguinte, não tinha mais como atravessar andando para o outro lado. Entre paredes intransponíveis e águas brancas caudalosas, esperei.</p><p><img src=""http://i.imgur.com/m0BiZHZ.jpg"" alt=""""></p><p>Foi depois do telefonema de um amigo que embarquei em um veleiro para a África e, passados 27 dias no mar, pisei pela primeira vez em um novo continente. Já não estava em praia Grande, ainda criança, olhando ao horizonte infinito do Atlântico, imaginando e sonhando com o que estava ali do outro lado. Por mais de um ano cruzei por muitas vezes as fronteiras de nove países do Sul da África, entre trabalhos como guia turístico ou voluntário em comunidade antroposófica para deficientes; entre caronas e visitas a comunidades tradicionais isoladas.
Histórias se formaram em minha cabeça curiosa de jornalista e em meus olhos atentos de fotógrafo.<span></span></p><p><br></p><p><img src=""https://s3.amazonaws.com/cdn.catarse/uploads/redactor_rails/picture/data/2068/CB_2004__frica_do_Sul-3.jpg""><img src=""https://s3.amazonaws.com/cdn.catarse/uploads/redactor_rails/picture/data/2006/_frica01100011.jpg""></p><p>Viaje comigo nesta aventura, onde virar uma página poderá te levar ao meio do oceano, timoneando um veleiro de 61 pés sob o céu de estrelas cadentes e parceiros albatrozes e sobre o mar de plânctons explosivos e peixes voadores; a caminhar por dias pelas praias centrais de Moçambique; ou a saltar de pára-quedas sobre o deserto da Namíbia. A cada página sinta-se um pouco mais africano, um pouco mais parte desta história. </p><p><img src=""http://i.imgur.com/F6T5XYH.jpg"" alt=""""> </p><p><em>Em um dia de marasmo, acampado em um espaçoso gramado em Lesoto, caminhei pela vila até encontrar esta simpática senhora preparando o jantar. A galinha, que fora escolhida para alimentar sua família, estava solta, parada submissa a seus pés.</em></p><p><img src=""http://i.imgur.com/KihjJwc.jpg"" alt="""">
<img src=""http://i.imgur.com/mY02Lq1.jpg"" alt=""""> <img src=""http://i.imgur.com/ah7GJmB.jpg"" alt=""""></p><p><em>Dormi naquela noite em um pequeno coberto de palha onde ficava esta rede, no centro do litoral moçambicano. O Sol não tinha nascido, e a maré estava no ponto certo para um grupo de homens que preparava o barco para a pesca daquela manhã. Segui na embarcação de madeira para conhecer um pouco sobre aquela rotina da pesca de arrasto.</em> </p><p><img src=""http://i.imgur.com/p3Vgi4r.jpg"" alt="""" =""""="""" ""="""">
</p><p>Gráfica; Design do livro; Edição do texto; Recompensas; 13% Catarse</p><p>Cláudio Belli é jornalista e fotógrafo. Trabalha atualmente no jornal Valor Econômico.</p><p><img src=""https://s3.amazonaws.com/cdn.catarse/uploads/redactor_rails/picture/data/2009/CB_2004__frica_do_Sul-237.jpg""></p><p>Foto que um novo amigo Alemão tirou de mim em Lesoto. Ele viajava pela África para aprender técnicas tradicionais de construção.</p><p><img src=""https://s3.amazonaws.com/cdn.catarse/uploads/redactor_rails/picture/data/2007/00001.jpg""></p><p><em>Meu diário foi aberto nesta noite, depois de uma longa jornada de carona pelas estradas da África do Sul. Iluminado pela lamparina, e ouvindo os sons do Rio Orange, a poucos metros de minha tenda, disputei espaço com os insetos para contar histórias que foram a base deste livro.</em></p><p><em><strong>RECOMPENSAS</strong><br></em></p><p><strong><i><span class=""redactor-invisible-space""><span class=""redactor-invisible-space""><em>Camisetas</em></span></span><br></i></strong></p><p><strong><i><span class=""redactor-invisible-space""><span class=""redactor-invisible-space""><em><br></em></span></span></i></strong><img src=""https://s3-sa-east-1.amazonaws.com/cdn.br.catarse/uploads/redactor_rails/picture/data/47940/arvores.jpg""></p><p><strong><i><span class=""redactor-invisible-space""><span class=""redactor-invisible-space""><em><img src=""https://s3-sa-east-1.amazonaws.com/cdn.br.catarse/uploads/redactor_rails/picture/data/47939/flores.jpg""><br></em></span></span></i></strong><br></p><p><br></p><p><br></p><p><strong>OPÇAO DE FOTO PARA QUADRO OU AMPLIACAO 1,20m X 0,46m - há também a opção 0,9m X 0,6m</strong><br></p><p><strong><br></strong></p><p><img src=""https://s3-sa-east-1.amazonaws.com/cdn.br.catarse/uploads/redactor_rails/picture/data/46901/AfricaQuadro2.jpg""></p><p><br></p><p><br></p><p><br></p>",CaminhoaSemonkong,//player.vimeo.com/video/125174784,https://vimeo.com/125174784,Literatura,20,https://s3-sa-east-1.amazonaws.com/cdn.br.catarse/uploads/project/uploaded_image/7069/CaminhoaSemonkong.jpg,https://s3-sa-east-1.amazonaws.com/cdn.br.catarse/uploads/project/uploaded_image/7069/project_thumb_thumb_CaminhoaSemonkong.jpg,https://s3-sa-east-1.amazonaws.com/cdn.br.catarse/uploads/project/uploaded_image/7069/project_thumb_small_CaminhoaSemonkong.jpg,https://s3-sa-east-1.amazonaws.com/cdn.br.catarse/uploads/project/uploaded_image/7069/project_thumb_large_CaminhoaSemonkong.jpg,https://s3-sa-east-1.amazonaws.com/cdn.br.catarse/uploads/project/uploaded_image/7069/project_thumb_video_cover_CaminhoaSemonkong.jpg,32.07351178585697163400,8028.0,77,77,failed,aon,finished,"2016-06-27 02:59:59.999999","2016-06-26 23:59:59.999999","2016-05-12 15:44:15.204303","2016-05-12 12:44:15.204303",,t,t,f,45,"{""total"" : 0, ""unit"" : ""seconds""}","{""total"" : 45, ""unit"" : ""days""}",10,"{""city"" : ""São Paulo"", ""state_acronym"" : ""SP"", ""state"" : ""São Paulo""}","{""id"" : 245560, ""name"" : ""Claudio Belli""}",5,,f,f,50,f,f,f