project_id,id,user_id,name,headline,budget,goal,about_html,permalink,video_embed_url,video_url,category_name,category_id,original_image,thumb_image,small_image,large_image,video_cover_image,progress,pledged,total_contributions,total_contributors,state,mode,state_order,expires_at,zone_expires_at,online_date,zone_online_date,sent_to_analysis_at,is_published,is_expired,open_for_contributions,online_days,remaining_time,elapsed_time,posts_count,address,user,reminder_count,is_owner_or_admin,user_signed_in,in_reminder,total_posts,can_request_transfer,is_admin_role,contributed_by_friends
718,718,68895,"Favela Brasil II","Comece agora a participar do novo DVD de Leandro Sapucahy. Você é o produtor, o músico, o ator e até pode cantar com ele no palco!","O orçamento para projetos anteriores a 24/02/2015 normalmente pode ser encontrado na descrição acima.",17000.0,"<p>Oi!</p>

<p>Eu sou o Leandro Sapucahy, e o meu trabalho você já conhece (<a class=""alt-link"" href=""http://www.leandrosapucahy.com.br/"" target=""_blank"">www.leandrosapucahy.com.br/</a>). </p>

<p>Agora quero convidar você para participar – mas participar MESMO, de corpo e alma – do meu novo projeto. </p>

<p><em>O que estamos fazendo?</em></p>

<p>O lance é o seguinte: no meu novo DVD não vamos ter aquele formato tradicional de show, nem ninguém cantando num palco. Serão 22 vídeos, um pra cada música, e cada um será uma cena, um pedacinho de uma narrativa. Estes vídeos, reunidos, “costurados” pelo roteiro e pelo trabalho dos atores, formarão quase um longa metragem, um passeio audiovisual pelo mundo do samba, narrando o cotidiano da cidade, seus personagens, a paz, a violência, os momentos de alegria, os becos e as vielas. Reunidos, os vídeos contarão uma história, composta de 22 &quot;cenas musicais&quot;.</p>

<p>O formato é uma inovação, totalmente diferente do que costuma ser um DVD musical, e é uma evolução natural do Favela Brasil, lançado em 2008 e que já envolvia cenários realistas, atores e elementos de palco dignos de uma peça de teatro. Você lembra como foi? Recorde aqui aquele tremendo espetáculo :</p>

<div class=""video youtube""><iframe width=""600"" height=""403"" src=""//www.youtube.com/embed/FG94H7WuacU?wmode=opaque"" frameborder=""0"" allowfullscreen></iframe></div>

<p><em>Por que estamos aqui no Catarse?</em> </p>

<p>Produzir um trabalho assim é caro e exige muito esforço, ainda mais quando se preza pela excelência em qualidade. Favela Brasil II (este ainda é um título provisório, quem sabe você também não me ajuda a encontrar o definitivo?) é uma idéia extremamente ambiciosa. </p>

<p>Por isso estou aqui no Catarse, um site que faz a ponte entre o projeto e quem quer participar junto com o artista! Além de levantar parte da grana para o projeto, a minha intenção ao colocar as músicas num site de financiamento coletivo é criar oportunidades para que meu público ajude a construir e pensar a obra junto comigo. Entre as recompensas que oferecemos, muitas dão a você a oportunidade de participar DIRETAMENTE da produção do DVD. </p>

<p>O projeto prevê um orçamento em torno de R$ 200 mil, e será totalmente independente. A Sapucahy Produções está investindo cerca de R$ 100 mil, em horas de estúdio e produção. Estamos contatando patrocinadores diretos e contamos (muito!) com apoiadores via Catarse para alcançarmos esta meta!</p>

<p><em>Como você pode participar e apoiar?</em></p>

<p>Veja aí ao lado uma lista de recompensas para cada forma de contribuição: entre CDs, camisetas, encontros comigo e participações no DVD e no show, temos prêmios especiais que vão desde seu nome nos agradecimentos até a participações NO PALCO, nos espetáculos do novo trabalho. A ideia é: VOCÊ DOA, MAS TAMBÉM GANHA!! Para fazer parte deste projeto junto comigo, você precisa clicar no botão “Quero Apoiar este Projeto” à direita do seu vídeo, e pronto, você já faz parte do grupo! </p>

<p>A primeira música que escolhemos para compartilhar com você é &quot;Tem pobre ligando pra mim&quot;, do grande Serginho Meriti. Para a gravação, queremos manter o clima descontraído, divertido e &quot;das ruas&quot; que você já conhece desde &quot;Favela Brasil”. Já imaginou você na telinha ao lado de Leandro?  </p>

<p>Clique no link abaixo e cante comigo &quot;Tem pobre ligando pra mim&quot;. Já dá para sentir como a música é boa e como você vai curtir participar da realização deste vídeo!</p>

<iframe src=""//player.vimeo.com/video/41426889?title=0&byline=0&portrait=0"" width=""600"" height=""403"" frameborder=""0""></iframe>

<p>Se você quiser ajudar a divulgar o projeto e a idéia, compartilhe com sua rede de amigos! Quanto mais gente nesta &quot;roda de samba virtual&quot;, melhor!</p>

<p>Conheça a letra da música</p>

<p>Tem pobre ligando pra mim</p>

<p>Se de repente a ligação cair, já sabe
É que meu crédito está no final, amigo 
Pra que esse papo não fique pela metade
Liga de volta que eu quero falar contigo</p>

<p>Eu não te abandonei nem pulei do bonde
É que a gente não mora,
A gente se esconde
Tá cada um no seu corre
Pouca comunicação
Ninguém se fala por falta de condição
Se tiver crédito no celular
Gaste um pouco comigo
Liga de volta que eu quero falar contigo
Mas tem um troço apitando, apitando aqui no meu ouvido
Essa ligação está correndo perigo
Tem poucos segundos pra gente falar
E o pior é que esse aparelho é do meu chegado
Que já tá vermelho, ficando bolado 
Aqui do meu lado 
E eu vou desligar</p>

<p>Bom, é isso!</p>

<p>Se você já está empolgado com a ideia, contribua, clicando ali no canto direito em “Quero apoiar esse projeto” e venha cantar conosco!!</p>
",favela-brasil-ii,//player.vimeo.com/video/42993202,http://vimeo.com/42993202,Música,16,,https://s3-sa-east-1.amazonaws.com/cdn.br.catarse/uploads/project/video_thumbnail/718/project_thumb_thumb_open-uri20131125-2-lluvn4,https://s3-sa-east-1.amazonaws.com/cdn.br.catarse/uploads/project/video_thumbnail/718/project_thumb_small_open-uri20131125-2-lluvn4,https://s3-sa-east-1.amazonaws.com/cdn.br.catarse/uploads/project/video_thumbnail/718/project_thumb_large_open-uri20131125-2-lluvn4,https://s3-sa-east-1.amazonaws.com/cdn.br.catarse/uploads/project/video_thumbnail/718/project_thumb_video_cover_open-uri20131125-2-lluvn4,5.17647058823529411800,880.0,23,21,failed,aon,finished,"2012-07-30 02:59:59","2012-07-29 23:59:59","2012-05-31 02:59:59","2012-05-30 23:59:59",,t,t,f,60,"{""total"" : 0, ""unit"" : ""seconds""}","{""total"" : 60, ""unit"" : ""days""}",0,"{""city"" : ""Rio de Janeiro"", ""state_acronym"" : ""RJ"", ""state"" : ""Rio de Janeiro""}","{""id"" : 68895, ""name"" : """"}",0,,f,f,0,f,f,f