project_id,id,user_id,name,headline,budget,goal,about_html,permalink,video_embed_url,video_url,category_name,category_id,original_image,thumb_image,small_image,large_image,video_cover_image,progress,pledged,total_contributions,total_contributors,state,mode,state_order,expires_at,zone_expires_at,online_date,zone_online_date,sent_to_analysis_at,is_published,is_expired,open_for_contributions,online_days,remaining_time,elapsed_time,posts_count,address,user,reminder_count,is_owner_or_admin,user_signed_in,in_reminder,total_posts,can_request_transfer,is_admin_role,contributed_by_friends
726,726,51743,"LUGARES POSSÍVEIS","Venha se encantar com uma belíssima história que ultrapassa montanhas e mares, tempos e olhares. Venha descobrir os lugares...possíveis. ","O orçamento para projetos anteriores a 24/02/2015 normalmente pode ser encontrado na descrição acima.",15000.0,"<p>Sobre o projeto Circo Arte Educação e Cidadania: </p>

<p>É um programa de ação sócio cultural educativo que consiste no uso das artes do circo como pedagogia complementar junto aos jovens de baixa renda e em situação de vulnerabilidade social em Ouro Preto, Minas Gerais. O programa vem atuando desde 2009, contribuindo para o empoderamento da juventude local no exercício ativo de sua cidadania. É um projeto de extensão da UFOP – Artes Cênicas em parceria com a OCA – Organização Cultural Ambiental - </p>

<p>MISSÃO 
Contribuir, através da arte/educação, para a formação integral de crianças e adolescentes, auxiliando na descoberta e no desenvolvimento de suas potencialidades. </p>

<p>• Em 2009 a Oca – Recebeu titulo de Utilidade Publica Municipal, Certificado do Conselho Municipal do Direito da Criança e Adolescente, Menção de Apoio da Câmara de Vereadores de Ouro Preto e Titulo de Cidadão Honorário ao dirigente do projeto pelo trabalho desenvolvido. 
• Em 2010 recebeu a Medalha do Aleijadinho. A homenagem é o reconhecimento a pessoas e entidades que se destacam na proteção e difusão da cultura e das artes em Ouro Preto. 
• Em 2011 – Selo Premio Itaú UNICEF - Educação integral: Experiências que transformam </p>

<p>O Projeto do Circo foi indicado como umas das 5 experiências mais significativas do Brasil de Arte-Educação e Cidadania no Congresso latino-americano e Caribenho de Arte/Educação 2009 , Encontro Nacional de Arte/Educação, Cultura e Cidadania em conjunto com 19º CONFAEB -Congresso Nacional da Federação de Arte/Educadores do Brasil. Este encontro foi instituído pelo Ministério da Educação (MEC) e pelo Ministério da Cultura (MinC) em parceria com a Organização dos Estados Ibero-americanos para a Educação, a Ciência e a Cultura (OEI). </p>

<p>Criação e apresentação de espetáculos 
A criação, organização, produção e apresentação de espetáculos é um dos mais preciosos indicadores do êxito do trabalho que é desenvolvido com os jovens, pois é o resultado da capacidade de trabalhar coletivamente, fortalecendo nos alunos a auto-estima, a responsabilidade coletiva, o sentimento de pertencimento, o respeito próprio e com o outro e propagando a força de transformação da arte por um mundo melhor. O espetáculo cria situações que propiciam às crianças o exercício do protagonismo juvenil. Cria-se um momento que vem concretizar o trabalho mostrando a todos que eles são capazes. Os ensaios e o clima de criação do espetáculo são catalisadores de emoções, ações, atitudes e crescimento para todos. 
Por meio de demonstração pública, o programa aponta resultados também na abertura de um diálogo entre a comunidade, familiares e crianças/jovens. </p>

<p>O Espetáculo &quot;Lugares Possíveis&quot; </p>

<p>A proposta é a criação de um espetáculo circense, resultado de um processo educativo transdisciplinar, onde o aprendizado das técnicas circenses dialoga de forma transversal com outras linguagens (literatura, dança, teatro, música e audiovisual), com a utilização de novas técnicas e tecnologias do espetáculo que nos auxiliem a contar uma história, que terá sua base na literatura. Estamos criando o espetáculo a partir de uma imersão de arte educação que promove o envolvimento direto dos alunos em sua criação, cerca de 40 adolescentes. Inspirados pela obra de Ítalo Calvino, “As Cidades Invisíveis” pretendemos discutir a temática dos “Lugares possíveis ou impossíveis”. Qual é o meu lugar? Como é o lugar onde vivo? É possível transformar este lugar? Qualquer lugar é lugar? É possível ir a outros lugares, ultrapassar limites, fronteiras? O lugar real, virtual. O lugar da fantasia. Vamos contar a história de Pólo, um viajante em busca do seu lugar e criar a partir de números circenses suas aventuras por cidades inventadas. A intenção é criar um espetáculo sensível, lúdico e divertido, que fale de identidade, memória, pertencimento e que seja uma experiência tocante para o espectador, o quanto está sendo e será para os que o fazem. O recurso que solicitamos é complementar ao orçamento total do projeto. Solicitamos a quantia de R$ 14.000,00 para arcar, principalmente, com os custos de cenário e figurino do espetáculo. Pretendemos levantar o recurso no prazo de 30 dias.</p>

<p>Para quem não é da cidade de Ouro Preto-MG, investir neste projeto é uma boa oportunidade para visitar esta maravilhosa cidade histórica das Minas Gerais, patrimônio cultural da humanidade, e se encantar com uma belíssima história que ultrapassa montanhas e mares, tempos, olhares. São apenas lugares... ...possíveis. </p>

<p>Ficha Técnica: 
Coordenador do Projeto: Eduardo França 
Direção Geral: Geuder Martins de Carvalho
Direção de cenas: Ellen de Paula, Renato Ribeiro, Thaíz Cantasini, Eliziane Monteiro
Direção Técnica: Cleiton Fernando, Wallison Dindim 
Iluminação: Bruno Cerezoli 
Fotografias: Léo Lopes 
Produção: Eduardo França e Ellen de Paula 
Vídeo/Animação: Geuder Martins, Léo Lopes e Henrique Manoel Oliveira 
Colaboração: Bárbara Carbogim, Panmella Ribeiro, Gabriel Machado </p>
",lugares-possiveis,//player.vimeo.com/video/43139710,http://vimeo.com/43139710,"Teatro e Dança",19,,https://s3-sa-east-1.amazonaws.com/cdn.br.catarse/uploads/project/video_thumbnail/726/project_thumb_thumb_open-uri20131125-2-gk7zu7,https://s3-sa-east-1.amazonaws.com/cdn.br.catarse/uploads/project/video_thumbnail/726/project_thumb_small_open-uri20131125-2-gk7zu7,https://s3-sa-east-1.amazonaws.com/cdn.br.catarse/uploads/project/video_thumbnail/726/project_thumb_large_open-uri20131125-2-gk7zu7,https://s3-sa-east-1.amazonaws.com/cdn.br.catarse/uploads/project/video_thumbnail/726/project_thumb_video_cover_open-uri20131125-2-gk7zu7,10.46666666666666666700,1570.0,31,31,failed,aon,finished,"2012-07-04 02:59:59","2012-07-03 23:59:59","2012-05-05 02:59:59","2012-05-04 23:59:59",,t,t,f,60,"{""total"" : 0, ""unit"" : ""seconds""}","{""total"" : 60, ""unit"" : ""days""}",1,"{""city"" : ""Rio de Janeiro"", ""state_acronym"" : ""RJ"", ""state"" : ""Rio de Janeiro""}","{""id"" : 51743, ""name"" : ""Geuder Martins de Carvalho""}",0,,f,f,1,f,f,f