project_id,id,user_id,name,headline,budget,goal,about_html,permalink,video_embed_url,video_url,category_name,category_id,original_image,thumb_image,small_image,large_image,video_cover_image,progress,pledged,total_contributions,total_contributors,state,mode,state_order,expires_at,zone_expires_at,online_date,zone_online_date,sent_to_analysis_at,is_published,is_expired,open_for_contributions,online_days,remaining_time,elapsed_time,posts_count,address,user,reminder_count,is_owner_or_admin,user_signed_in,in_reminder,total_posts,can_request_transfer,is_admin_role,contributed_by_friends
7360,7360,251006,Escravagina,"Seu sexo te escraviza ou te liberta?  Venha me decifrar .... ou te devoro.  Mostro-me por inteira para que você descubra quem você é.","O orçamento para projetos anteriores a 24/02/2015 normalmente pode ser encontrado na descrição acima.",25000.0,"<p>Este é um projeto que faz parte das comemorações de 30 anos da Companhia Rainha de 2 Cabeças. <strong>ESCRAVAGINA</strong> é um trans-monólogo especialmente escrito para a atriz Maite Schneider pelo autor Cesar Almeida, e neste espetáculo a atriz desnuda-se totalmente para a platéia em seu momento de maior intimidade e entrega, trazendo os seus segredos mais íntimos para o expectador. Ficção e realidade fundem-se neste experimento sensorial onde a platéia será levada a questionar sua própria sexualidade no mundo contemporâneo. Você pode saber mais conferindo a entrevista feita pelo jornalista Neto Lucon em <a class=""alt-link"" href=""http://www.nlucon.com/2014/09/maite-schneider-peca-monologo-escravagina.html"" target=""_blank"">http://www.nlucon.com/2014/09/maite-schneider-peca-monologo-escravagina.html</a></p><p>Para que ESCRAVAGINA possa nascer precisamos de sua ajuda e apoio. ESCRAVAGINA é um projeto independente feito por pessoas que acreditam na arte como libertação e como possibilidade de novas descobertas.</p><p>Criamos um projeto dentro do Catarse e você pode colaborar de diversas formas. Você pode doar a partir de R$ 30,00 (trinta reais). Para cada doação/participação você tem direito a recompensas conforme poderá ver no site, incluindo par de luvas para explorar e conhecer o corpo da atriz em cena e até mesmo ter o seu nome/logomarca tatuado no corpo de Maite Schneider. Olhe e confira as recompensas do lado direito nesta página mesmo.</p><p>O dinheiro arrecado será utlizado para pagamento da locação do teatro, locação de equipamentos, material publicitário, cachês da equipe técnica envolvida, 13% para o site Catarse e também na manufatura de algumas recompensas que serão entregues.</p><p>As recompensas serão entregues da seguinte forma:
1) Nome do apoiador no site até dia 30 de outubro ( podendo acontecer antes)
2) Nome no material publicitário: até dia 30 de outubro
3) Ingressos: serão deixados no dia do espetáculo para as pessoas que apoiarem, conforme o dia combinado.
4) Fotos (serão enviadas para quem adquirir, as fotos pequenas para escolha de sua recompensa)</p><p>CESAR ALMEIDA tem uma carreira sólida na cidade há 30 anos e possui três livros editados pela Fundação Cultural de Curitiba, contendo sua extensa obra. Seu facebook fica em <a class=""alt-link"" href=""http://www.facebook.com/cesar.almeida.12"" target=""_blank"">http://www.facebook.com/cesar.almeida.12</a></p><p>MAITE SCHNEIDER é criadora do maior e mais antigo portal sobre diversidade da Internet com 24 mil visitantes/dia. O portal pode ser visitado em http:<a class=""alt-link"" href=""http://www.casadamaite.com"" target=""_blank"">www.casadamaite.com</a> e seu facebook pode ser acessado por <a class=""alt-link"" href=""http://www.facebook.com/maitezinha"" target=""_blank"">http://www.facebook.com/maitezinha</a></p><p>Maite também já participou de vários programas de TV como entrevistada e você pode ver a entrevista dela para o Programa JÔ SOARES indo em <a class=""alt-link"" href=""http://www.casadamaite.com/node/13608"" target=""_blank"">http://www.casadamaite.com/node/13608</a></p><p>O Projeto será realizado em novembro/2014 no Teatro Guaíra. A temporada será de 07 a 30 de novembro - sexta a domingo - às 20horas. <strong>ESCRAVAGINA</strong> tem produção executiva de Fernando Cardoso, Serafim Cia Teatral (Conheça mais em <a href=""https://www.facebook.com/SerafimCiaTeatral/?pnref=lhc"">https://www.facebook.com/SerafimCiaTeatral</a>)</p><p>** A tatuagem no corpo da atriz, será feita em Curitiba, pelo profissional Billy Tattoo e será filmada a execução da tatuagem, que será feita com cores pretas num local que a atriz irá escolher. A data será marcada e avisada por site e também diretamente para a pessoa que escolher esta recompensa e a pessoa poderá ir junto no dia, se for moradora de Curitiba para acompanhar de perto o trabalho. </p><p>** O ensaio exclusivo de fotos será com tema sensual, envolvendo fetiches e fantasias e será feito pela profissional Ana Valério Caetano. Algumas das fotos podem conter cenas de nudez e expositivas. As fotos serão disponibilizadas em tamanho pequeno para que a pessoa apoiadora possa escolher as que deseja receber em tamanho maior em seu email.</p>",escravagina,//www.youtube.com/embed/tS_IWkvqu5Q,https://www.youtube.com/watch?v=tS_IWkvqu5Q,"Teatro e Dança",19,https://s3-sa-east-1.amazonaws.com/cdn.br.catarse/uploads/project/uploaded_image/7360/10590504_857134357637694_2126784828037767576_n__1_.jpg,https://s3-sa-east-1.amazonaws.com/cdn.br.catarse/uploads/project/uploaded_image/7360/project_thumb_thumb_10590504_857134357637694_2126784828037767576_n__1_.jpg,https://s3-sa-east-1.amazonaws.com/cdn.br.catarse/uploads/project/uploaded_image/7360/project_thumb_small_10590504_857134357637694_2126784828037767576_n__1_.jpg,https://s3-sa-east-1.amazonaws.com/cdn.br.catarse/uploads/project/uploaded_image/7360/project_thumb_large_10590504_857134357637694_2126784828037767576_n__1_.jpg,https://s3-sa-east-1.amazonaws.com/cdn.br.catarse/uploads/project/uploaded_image/7360/project_thumb_video_cover_10590504_857134357637694_2126784828037767576_n__1_.jpg,104.60400000000000000000,26151.0,256,251,successful,aon,finished,"2014-11-03 01:59:59","2014-11-02 23:59:59","2014-09-18 15:00:20.478638","2014-09-18 12:00:20.478638",,t,t,f,45,"{""total"" : 0, ""unit"" : ""seconds""}","{""total"" : 45, ""unit"" : ""days""}",2,"{""city"" : ""Curitiba"", ""state_acronym"" : ""PR"", ""state"" : ""Paraná""}","{""id"" : 251006, ""name"" : ""Fernando Cardoso""}",4,,f,f,8,f,f,f