project_id,id,user_id,name,headline,budget,goal,about_html,permalink,video_embed_url,video_url,category_name,category_id,original_image,thumb_image,small_image,large_image,video_cover_image,progress,pledged,total_contributions,total_contributors,state,mode,state_order,expires_at,zone_expires_at,online_date,zone_online_date,sent_to_analysis_at,is_published,is_expired,open_for_contributions,online_days,remaining_time,elapsed_time,posts_count,address,user,reminder_count,is_owner_or_admin,user_signed_in,in_reminder,total_posts,can_request_transfer,is_admin_role,contributed_by_friends
753,753,57637,"XXXIII Encontro Nacional de Estudantes de Comunicação Social - ENECOMDF2012","Por uma comunicação mais democrática, plural e participativa: a voz do oprimido está no ar.","O orçamento para projetos anteriores a 24/02/2015 normalmente pode ser encontrado na descrição acima.",5000.0,"<p>O XXXIII Encontro Nacional dos Estudantes de Comunicação Social (ENECOM) nasce: por uma comunicação que consiga estabelecer diálogo, interagir e mobilizar. Que busque uma coerência entre fins e meios. Que seja horizontalizada e cooperativa ao invés de vertical e desagregada, mesmo que por uma boa causa. Uma comunicação em que todos os interlocutores estejam buscando o bem coletivo e o bem coletivo acima dos interesses particulares.</p>

<p>O ENECOM 2012, organizado pela Executiva Nacional dos Estudantes de Comunicação Social (ENECOS), acontece entre os dias 13 e 20 na Universidade de Brasília - Distrito Federal (DF), e está sendo preparado para receber estudantes de todo o Brasil. Se você acha que o DF é só Brasília ou apenas o Congresso Nacional, prepare-se! A ideia do ENECOM é conhecer o Distrito Federal a partir de outro olhar, que não apenas a velha Brasília de políticos corruptos ou cidade burocratizada. Mas sim de um espaço que se estende para além do Plano Piloto, que abrange todo Distrito Federal, com suas ruas, praças, periferiais e gente misturada.</p>

<p>Além da integração com a cidade, há a integração estudantil, acadêmica e social. O ENECOMDF2012 será um ambiente propício à discussão, reflexão e ação sobre a Comunicação Social. O espaço se propõe à construção e à vivência de novas realidades sociais, históricas e culturais, reunindo artistas independentes do Distrito Federal, coletivos locais de arte, cultura e comunicação, assim como comunicadores populares e acadêmicos para complementação do espaço.</p>

<p>Para a realização do projeto precisamos custear o transporte, alojamento e alimentação dos mais de 700 envolvidos no Encontro, assim como necessitamos de apoio financeiro para custear a parte gráfica e cultural do projeto, que envolve a abertura de espaço para artistas locais, com eventos gratuitos na cidade. O ENECOMDF2012 não visa lucro, nem mesmo nenhum de seus organizadores recebe financeiramente por produzir o projeto. Qualquer margem de acúmulo financeiro é revertido para a organização da Executiva Nacional dos Estudantes de Comunicação Social (ENECOS). Site: <a class=""alt-link"" href=""http://www.enecos.org"" target=""_blank"">http://www.enecos.org</a> </p>

<p>A construção deste texto teve participação de estudantes, pesquisadores, professores, agentes sociais e comunicadores em geral. E é assim que estamos construindo a ideia deste Encontro: pelas misturas dos saberes acadêmicos, com os saberes populares e estudantis. 
Por uma comunicação mais democrática, plural e participativa: a voz do oprimido está no ar.</p>

<p>Você pode ter maiores informações sobre o projeto pelos sites:
<a class=""alt-link"" href=""http://www.enecom2012.com"" target=""_blank"">www.enecom2012.com</a>
<a class=""alt-link"" href=""http://www.enecos.org"" target=""_blank"">www.enecos.org</a> </p>
",xxxiii-encontro-nacional-de-estudantes-de-comunicacao-social-enecomdf2012,//player.vimeo.com/video/43567306,http://vimeo.com/43567306,Socioambiental,4,,https://s3-sa-east-1.amazonaws.com/cdn.br.catarse/uploads/project/video_thumbnail/753/project_thumb_thumb_open-uri20131125-2-17pgs6j,https://s3-sa-east-1.amazonaws.com/cdn.br.catarse/uploads/project/video_thumbnail/753/project_thumb_small_open-uri20131125-2-17pgs6j,https://s3-sa-east-1.amazonaws.com/cdn.br.catarse/uploads/project/video_thumbnail/753/project_thumb_large_open-uri20131125-2-17pgs6j,https://s3-sa-east-1.amazonaws.com/cdn.br.catarse/uploads/project/video_thumbnail/753/project_thumb_video_cover_open-uri20131125-2-17pgs6j,64.42000000000000000000,3221.0,60,58,failed,aon,finished,"2012-07-10 02:59:59","2012-07-09 23:59:59","2012-05-11 02:59:59","2012-05-10 23:59:59",,t,t,f,60,"{""total"" : 0, ""unit"" : ""seconds""}","{""total"" : 60, ""unit"" : ""days""}",0,"{""city"" : ""São Paulo"", ""state_acronym"" : ""SP"", ""state"" : ""São Paulo""}","{""id"" : 57637, ""name"" : """"}",0,,f,f,0,f,f,f