project_id,id,user_id,name,headline,budget,goal,about_html,permalink,video_embed_url,video_url,category_name,category_id,original_image,thumb_image,small_image,large_image,video_cover_image,progress,pledged,total_contributions,total_contributors,state,mode,state_order,expires_at,zone_expires_at,online_date,zone_online_date,sent_to_analysis_at,is_published,is_expired,open_for_contributions,online_days,remaining_time,elapsed_time,posts_count,address,user,reminder_count,is_owner_or_admin,user_signed_in,in_reminder,total_posts,can_request_transfer,is_admin_role,contributed_by_friends
757,757,71523,MUDA_Cidade,"Humanizando os espaços urbanos através de uma intervenção construída por estudantes de arquitetura e pela comunidade.","O orçamento para projetos anteriores a 24/02/2015 normalmente pode ser encontrado na descrição acima.",2000.0,"<p>Esse é o primeiro workshop do MUDA coletivo. O projeto nasceu da necessidade dos estudantes de arquitetura terem um contato mais próximo com a prática construtiva. Na faculdade, o aprendizado se dá meramente por meio da teoria - e para o aluno, aprender fazendo é fundamental para entender o processo de se conceber arquitetura dentro de um contexto específico, reconhecer o papel social do arquiteto e compreender aspectos construtivos; de maneira que a soma destes fatores resultem em um projeto.
Por meio do workshop, buscamos entender como o ensino pode despertar no estudante o papel social da arquitetura. Com essa oficina, o conhecimento produzido dentro da faculdade passa a ser externalizado: torna-se material, palpável; gera reflexões por parte dos estudantes, comunidade e professores; ocupa a cidade, apropriando-se dos espaços públicos, ajudando a transformá-los e criando espaços de maior qualidade.
Mas, para isso, a presença e colaboração da comunidade que usa e vive esse espaço diariamente é fundamental. É ai que entra outra questão abordada pelo projeto: a questão participativa. Quem melhor para saber quais as necessidades de um espaço do que quem o usa no dia-a-dia?
A aproximação do arquiteto com a comunidade é muito importante para que sejam gerados espaços com mais vida, mas é imprescindível que essa colaboração não se dê somente no campo das idéias. Para que essa intervenção tenha valor e seja cuidada pelas pessoas que usufruem desse espaço, é preciso que elas se sintam pertencentes e que tenham a noção de que sua casa não é só &#39;da soleira para dentro&#39;. Para isso, faz-se necessário que essas pessoas ajudem a construir essa instalação.
De modo a alcançarmos essa colaboração, fizemos uma parceria com o Movimento Boa Praça: um coletivo que busca revitalizar as praças da região de Pinheiros, além de promover o convívio entre os vizinhos, por meio de eventos periódicos, criando assim uma cidade mais humana (com espaços de mais valor, mais usados, e dessa forma, melhor apropriados pelas pessoas).
A intervenção será construída no dia 1° de julho, durante um dos piqueniques do Movimento Boa Praça, que será realizado na Praça Amadeu Decome, Lapa.
Para que isso aconteça, os alunos (estudantes da Escola da Cidade - Faculdade de Arquitetura e Urbanismo) terão 1 semana para se preparar, pensar o projeto que melhor se adapta às condições dadas (topografia da praça, necessidades dos moradores, potencialidades do lugar), para construí-lo e inaugurá-lo no dia do evento. O processo será registrado e com esse material faremos um vídeo de divulgação do trabalho final.
Para a compra e transporte dos materiais, assim como das ferramentas, e para a concretização desse projeto, precisamos de 2000 reais.
Se você acredita na transformação do ideal em real e na construção de uma cidade melhor, colabore com o nosso projeto e juntos vamos fazer acontecer!
Apoio: Escola da Cidade e Movimento Boa Praça
Logística: Dissudes</p>
",muda_cidade,//player.vimeo.com/video/43577190,http://vimeo.com/43577190,Socioambiental,4,,https://s3-sa-east-1.amazonaws.com/cdn.br.catarse/uploads/project/video_thumbnail/757/project_thumb_thumb_open-uri20131125-2-w599c3,https://s3-sa-east-1.amazonaws.com/cdn.br.catarse/uploads/project/video_thumbnail/757/project_thumb_small_open-uri20131125-2-w599c3,https://s3-sa-east-1.amazonaws.com/cdn.br.catarse/uploads/project/video_thumbnail/757/project_thumb_large_open-uri20131125-2-w599c3,https://s3-sa-east-1.amazonaws.com/cdn.br.catarse/uploads/project/video_thumbnail/757/project_thumb_video_cover_open-uri20131125-2-w599c3,102.0000000000000000,2040.0,27,26,successful,aon,finished,"2012-06-25 02:59:59","2012-06-24 23:59:59","2012-04-26 02:59:59","2012-04-25 23:59:59",,t,t,f,60,"{""total"" : 0, ""unit"" : ""seconds""}","{""total"" : 60, ""unit"" : ""days""}",0,"{""city"" : ""São Paulo"", ""state_acronym"" : ""SP"", ""state"" : ""São Paulo""}","{""id"" : 71523, ""name"" : ""Julia Junqueira Ribeiro Pinto""}",0,,f,f,0,f,f,f