project_id,id,user_id,name,headline,budget,goal,about_html,permalink,video_embed_url,video_url,category_name,category_id,original_image,thumb_image,small_image,large_image,video_cover_image,progress,pledged,total_contributions,total_contributors,state,mode,state_order,expires_at,zone_expires_at,online_date,zone_online_date,sent_to_analysis_at,is_published,is_expired,open_for_contributions,online_days,remaining_time,elapsed_time,posts_count,address,user,reminder_count,is_owner_or_admin,user_signed_in,in_reminder,total_posts,can_request_transfer,is_admin_role,contributed_by_friends
7822,7822,346456,"Tapume Educativo","Tapume Educativo. Transformando tapume de construção em carteira escolar. ","O orçamento para projetos anteriores a 24/02/2015 normalmente pode ser encontrado na descrição acima.",5800.0,"<p>Bom, você já conheceu um pouquinho do Tapume Educativo neste vídeo. O que você ainda não conheceu é quem está por trás dele: o Coletivo Criativo - Cole.
O Cole é um grupo multidisciplinar composto pela designer que desenvolveu a carteira, o engenheiro que pensou na sua ergonomia, o marceneiro que cortou o primeiro protótipo em sua CNC, o desenvolvedor do site, o editor do vídeo, ou seja, os profissionais que conseguiram colocar o Tapume Educativo de pé na raça, para que hoje você também possa participar dele através do financiamento coletivo.</p><p>A primeira carteira já está pronta. É esta aí em cima. O próximo passo é  fabricar mais 10 carteiras, com a sua ajuda pelo financiamento coletivo, e levar para as crianças da ONG Interferência.</p><p>A ONG Interferência trabalha pela educação e cultura, dando aulas de reforço para cerca de 140 crianças do Capão Redondo. <a class=""alt-link"" href=""http://onginterferencia.blogspot.com.br/"" target=""_blank"">http://onginterferencia.blogspot.com.br/</a> </p><p>Por meio do financiamento coletivo, vamos ter recurso para fabricar 10 carteiras escolares e assim poder equipar a sala de aula da ONG Interferência, dando melhores condições de estudo para seus alunos. </p><p>E para quem ajudar o Tapume Educativo, temos como recompensas algumas lembranças do nosso mascote, o Charles.</p><p>Adesivos do Charles.
<br>Camisas do Charles.</p><p>Ambos serão enviados pelos Correios com frete grátis.</p><p>Ah, e além das recompensas com o mascote Charles, temos duas outras. Personalização das carteiras, com seu nome ou foto. E poder participar da entrega das carteiras com os idealizadores na ONG. No quadro a sua esquerda você pode ver cada uma delas. </p><p>Cada carteira precisa de 2 à 4 chapas de tapume, dependendo da espessura da madeira, para ser fabricada. Fora esta necessidade, que supriremos com doações das construtoras, temos o custo operacional de fabricação, montagem e transporte das carteiras. Além do custo das recompensas.
A máquina de corte CNC que transforma o projeto em objeto, tem um custo de 200 reais a hora. E cada carteira demora em média 1 hora.
Temos também o custo de mão de obra da montagem, 100 reais por carteira. O transporte das 10 carteiras é outro importante custo, no caminhão baú de pequeno porte ficará em 500 reais. 
Já nas recompensas, temos os adesivos que custam 600 reais e camisas que custam 800 reais. O envio deles pelos correios, ficará em cerca de 300 reais.
Temos também o transporte de 10 pessoas que vão nos ajudar a entregar as carteiras no Capão Redondo, 300 reais. 
Somado a isso os 13% de taxa cobrado pelo Catarse, chegamos ao custo total de: R$ 5.800,00</p><p>As carteiras escolares do projeto Tapume Educativo serão entregues na festa de boas-vindas aos alunos em janeiro de 2015.</p><p>Ajude a gente a divulgar esta iniciativa! Obrigado. </p><p><a class=""alt-link"" href=""http://www.tapumeeducativo.org/"" target=""_blank"">http://www.tapumeeducativo.org/</a></p>",tapumeeducativo,//www.youtube.com/embed/j4qfdcDe15c,http://youtu.be/j4qfdcDe15c,Educação,31,https://s3-sa-east-1.amazonaws.com/cdn.br.catarse/uploads/project/uploaded_image/7822/designboom.jpg,https://s3-sa-east-1.amazonaws.com/cdn.br.catarse/uploads/project/uploaded_image/7822/project_thumb_thumb_designboom.jpg,https://s3-sa-east-1.amazonaws.com/cdn.br.catarse/uploads/project/uploaded_image/7822/project_thumb_small_designboom.jpg,https://s3-sa-east-1.amazonaws.com/cdn.br.catarse/uploads/project/uploaded_image/7822/project_thumb_large_designboom.jpg,https://s3-sa-east-1.amazonaws.com/cdn.br.catarse/uploads/project/uploaded_image/7822/project_thumb_video_cover_designboom.jpg,126.4137931034482800,7332.0,92,89,successful,aon,finished,"2015-01-03 01:59:59","2015-01-02 23:59:59","2014-11-03 12:00:22.079556","2014-11-03 10:00:22.079556",,t,t,f,60,"{""total"" : 0, ""unit"" : ""seconds""}","{""total"" : 60, ""unit"" : ""days""}",2,"{""city"" : ""São Paulo"", ""state_acronym"" : ""SP"", ""state"" : ""São Paulo""}","{""id"" : 346456, ""name"" : ""Saulo Carine Monjon""}",2,,f,f,4,f,f,f