project_id,id,user_id,name,headline,budget,goal,about_html,permalink,video_embed_url,video_url,category_name,category_id,original_image,thumb_image,small_image,large_image,video_cover_image,progress,pledged,total_contributions,total_contributors,state,mode,state_order,expires_at,zone_expires_at,online_date,zone_online_date,sent_to_analysis_at,is_published,is_expired,open_for_contributions,online_days,remaining_time,elapsed_time,posts_count,address,user,reminder_count,is_owner_or_admin,user_signed_in,in_reminder,total_posts,can_request_transfer,is_admin_role,contributed_by_friends
795,795,65126,"REVISTA CAFÉ ESPACIAL Nº.11","A Café Espacial busca financiamento para sua próxima edição. E você pode fazer parte disso!","O orçamento para projetos anteriores a 24/02/2015 normalmente pode ser encontrado na descrição acima.",5000.0,"<p>NOSSA TRAJETÓRIA 
Em 2007 nasceu a Revista Café Espacial, publicação de histórias em quadrinhos autorais, artigos sobre cinema, música, teatro, literatura, fotografia e design. </p>

<p>Com 10 edições publicadas e distribuídas sempre de forma independente, a Café Espacial conquistou o país com boas críticas, premiações nacionais e destaque internacional (já foi indicada duas vezes a prêmio no Festival de Angouleme na França, o maior festival de quadrinhos da Europa). A Café Espacial já participou de diversos eventos culturais, onde percorreu diversas cidades do país – inclusive representando o Brasil no exterior, como ocorreu na VI Semana del Comic, na Bolívia.</p>

<p>A Café Espacial, assim como os bons encontros, tem a colaboração de grandes e premiados artistas e profissionais da área, nacionais e internacionais. </p>

<p>O projeto se orgulha em fazer parte da história dos quadrinhos no Brasil e ainda quer continuar crescendo. E para que isso aconteça, prove um gole e apoie!</p>

<p>OBJETIVOS 
Publicar uma edição da Revista por meio do Catarse permite oferecer uma série de brindes e benefícios especiais para a ocasiāo. E juntos, quem edita, quem colaboradora e quem lê, estarāo engajados numa nova maneira de divulgar o projeto e fazer a Café Espacial acontecer.</p>

<p>São aproximadamente 20 profissionais por edição que contribuem com a Café Espacial por acreditarem no projeto tanto quanto você. Assim, convidamos os colaboradores, leitores e interessados em apoiar e contribuir a levantarmos fundos para a produção da próxima edição.</p>

<p>COMO CONTRIBUIR
O Catarse é uma plataforma de financiamento colaborativo de projetos criativos – ou seja, todo mundo ajudando em prol de um bem maior. Você pode contribuir clicando em QUERO APOIAR ESSE PROJETO. Você será direcionado ao site Moip e lá você fará a sua doação (cartão de crédito, débito, boleto e pagamento por celular, como achar melhor).</p>

<p>Colocamos uma meta, propositalmente baixa, de R$ 5.000,00 (valor destinado exclusivamente aos custos de impressão e transporte da gráfica) para ter certeza de que, mesmo com um pequeno grupo de pessoas, o projeto se realizará. Mas é claro que a gente quer que muitos outros leitores possam conhecer a Revista e compartilhar nossa paixāo pelas histórias em quadrinhos e artes afins.</p>

<p>Caso o valor total não seja atingido, o Catarse devolve para sua conta o que você doou. Ou seja, você só paga se o projeto tiver 100% de sucesso no prazo determinado. E será. Certo?</p>

<p>Observação: Se arrecadarmos além da meta do projeto, a verba será investida na próxima edição.</p>

<p>Gostou? Acesse nosso site e conheça mais nosso trabalho.</p>

<p>Acompanhe as novidades da Café Espacial nos seguindo no Twitter @CafeEspacial ou curtindo a página oficial do projeto: <a class=""alt-link"" href=""http://www.facebook.com/RevistaCafeEspacial"" target=""_blank"">www.facebook.com/RevistaCafeEspacial</a></p>

<p>Divulgue nosso projeto entre seus amigos, nas listas de e-mail e no Facebook. 
Faça a edição nº 11 da Revista Café Espacial acontecer!</p>
",revista-cafe-espacial-n-11,//player.vimeo.com/video/44829434,http://vimeo.com/44829434,Quadrinhos,7,,https://s3-sa-east-1.amazonaws.com/cdn.br.catarse/uploads/project/video_thumbnail/795/project_thumb_thumb_open-uri20131125-2-1lrksvx,https://s3-sa-east-1.amazonaws.com/cdn.br.catarse/uploads/project/video_thumbnail/795/project_thumb_small_open-uri20131125-2-1lrksvx,https://s3-sa-east-1.amazonaws.com/cdn.br.catarse/uploads/project/video_thumbnail/795/project_thumb_large_open-uri20131125-2-1lrksvx,https://s3-sa-east-1.amazonaws.com/cdn.br.catarse/uploads/project/video_thumbnail/795/project_thumb_video_cover_open-uri20131125-2-1lrksvx,112.4200000000000000,5621.0,122,117,successful,aon,finished,"2012-08-14 02:59:59","2012-08-13 23:59:59","2012-06-15 02:59:59","2012-06-14 23:59:59",,t,t,f,60,"{""total"" : 0, ""unit"" : ""seconds""}","{""total"" : 60, ""unit"" : ""days""}",13,"{""city"" : ""Marília"", ""state_acronym"" : ""SP"", ""state"" : ""São Paulo""}","{""id"" : 65126, ""name"" : ""Associação Café Espacial""}",0,,f,f,13,f,f,f