project_id,id,user_id,name,headline,budget,goal,about_html,permalink,video_embed_url,video_url,category_name,category_id,original_image,thumb_image,small_image,large_image,video_cover_image,progress,pledged,total_contributions,total_contributors,state,mode,state_order,expires_at,zone_expires_at,online_date,zone_online_date,sent_to_analysis_at,is_published,is_expired,open_for_contributions,online_days,remaining_time,elapsed_time,posts_count,address,user,reminder_count,is_owner_or_admin,user_signed_in,in_reminder,total_posts,can_request_transfer,is_admin_role,contributed_by_friends
797,797,72481,"Glau Piva Show (gravação do CD/DVD)","GLAU PIVA SHOW (GRAVAÇÃO DO CD/DVD), MAIS UM SONHO MEU A SER CONQUISTADO, DEPENDE SÓ DE VOCÊ!","O orçamento para projetos anteriores a 24/02/2015 normalmente pode ser encontrado na descrição acima.",13000.0,"<p>Até o dia 22 de agosto preciso do financiamento para que o projeto aconteça. O projeto é intitulado Glau Piva Show (Gravação do CD/DVD). Será realizado um show intimista (acústico) com Glau Piva acompanhada de 3 músicos. Na plateia conto com 25 fãs (convidados especiais). O repertório será composto por 2 regravações de cantores de renome, 4 faixas inéditas autorais, e mais 11 faixas dos meus cd’s anteriores, que agora vão ganhar um som num formato mais acústico (canções que já foram escolhidas por alguns fãs através de enquete). O valor a ser arrecadado é para pagar os custos com a gravação R$13.000,00 (áudio / vídeo). O local da gravação será o Espaço Multicultural Gambalaia em Santo André – SP, no dia 23 de setembro de 2012. </p>

<p>Glau Piva...
Paulista, Cantora, compositora e multiinstrumentista, ficou conhecida com a canção Entrega (cd Glau Pontto G), uma das músicas mais executadas entre 2008/2009 na rádio Nova Brasil FM e em mais de 150 rádios por todo o Brasil e o mundo.
Suas canções estão entre as mais pedidas no Sul do Brasil e na rádio Kalapalo no Japão.
Com uma voz suave e uma destreza única, que tem ao tocar seus violões, Glau encanta a todos os ouvintes.
Tem feito shows por todo o território brasileiro com muito sucesso e aberto shows de cantores e bandas de renome como Roupa Nova, Fábio Jr, Jerry Adriane, Luciana Mello, Zé Geraldo, 14 Bis, Zé Ramalho, Ira, entre outros.
Sua simpatia e musicalidade marcam seus 21 anos de experiência nos palcos.
Inaugurou a carreira solo em 2001 e de lá pra cá já gravou 4 CD’s (independentes). 
GLAU PIVA (2002) (Independente) - com a participação da voz de Oswaldo Montenegro em uma de suas composições;
AS MÚSICAS QUE EU MAIS CANTO (2006) (Independente) – CD de releituras contendo uma faixa de sua autoria (Solidão);
 GLAU PONTTO G (2008) (Independente)  – que contém a faixa Entrega, sucesso nas rádios de MPB por todo Brasil e mundo.
MEU SALTO É VOCÊ (2010) (Independente) – Seu mais novo trabalho, lançado no 2º semestre/2010 no Café Paon – SP.
E agora com a sua ajuda o mais novo trabalho de GLAU PIVA!!! GLAU PIVA SHOW (CD/DVD) (AO VIVO)!!!!</p>
",797-glau-piva-show-gravacao-do-cd-dvd,//player.vimeo.com/video/44734467,http://vimeo.com/44734467,Música,16,,https://s3-sa-east-1.amazonaws.com/cdn.br.catarse/uploads/project/video_thumbnail/797/project_thumb_thumb_open-uri20131125-2-1bi3dl,https://s3-sa-east-1.amazonaws.com/cdn.br.catarse/uploads/project/video_thumbnail/797/project_thumb_small_open-uri20131125-2-1bi3dl,https://s3-sa-east-1.amazonaws.com/cdn.br.catarse/uploads/project/video_thumbnail/797/project_thumb_large_open-uri20131125-2-1bi3dl,https://s3-sa-east-1.amazonaws.com/cdn.br.catarse/uploads/project/video_thumbnail/797/project_thumb_video_cover_open-uri20131125-2-1bi3dl,2.38461538461538461500,310.0,5,5,failed,aon,finished,"2012-08-23 02:59:59","2012-08-22 23:59:59","2012-06-24 02:59:59","2012-06-23 23:59:59",,t,t,f,60,"{""total"" : 0, ""unit"" : ""seconds""}","{""total"" : 60, ""unit"" : ""days""}",0,"{""city"" : ""Santo André"", ""state_acronym"" : ""SP"", ""state"" : ""São Paulo""}","{""id"" : 72481, ""name"" : """"}",0,,f,f,0,f,f,f