project_id,id,user_id,name,headline,budget,goal,about_html,permalink,video_embed_url,video_url,category_name,category_id,original_image,thumb_image,small_image,large_image,video_cover_image,progress,pledged,total_contributions,total_contributors,state,mode,state_order,expires_at,zone_expires_at,online_date,zone_online_date,sent_to_analysis_at,is_published,is_expired,open_for_contributions,online_days,remaining_time,elapsed_time,posts_count,address,user,reminder_count,is_owner_or_admin,user_signed_in,in_reminder,total_posts,can_request_transfer,is_admin_role,contributed_by_friends
809,809,63867,"Última Valsa - longa metragem","Um filme que mistura drama e suspense, e conta com partes musicais. É voltado principalmente para o público adolescente e jovem.","O orçamento para projetos anteriores a 24/02/2015 normalmente pode ser encontrado na descrição acima.",6500.0,"<p>&quot;Última valsa&quot; é um longa-metragem independente realizado por estudantes de cinema de São Paulo. O filme é destinado ao público adolescente e jovem, e se passa praticamente todo dentro de uma casa. É um drama/supense, com alguns momentos musicais. A nossa equipe é composta por 15 pessoas, todos jovens. </p>

<p>Sinopse: É feriado. O jovem Alexandre (18) convida quatro amigos para passar uns dias na casa de seu pai, que está viajando. São eles o casalzinho bonito formado por Raíssa (17) e Gustavo (19), o nerd Fernando (18) e a meiga Juliana (18), ex-namorada de Alê, que vai acompanhada de seu novo namorado, o misterioso Thomas (19). Ju se reaproxima de Alê, o que deixa Thomas com ciúmes. Ele se desentende com Alê por várias vezes. Os inusitados desdobramentos dessa trama apontam para uma tragédia anunciada. 
Elenco: Fabio Rabello, Gabriela Lopes, Vinicius Tardio, Vinicius Prates, Joana Rodrigues e Victor Sparapane. Participação especial: Natalia Cardoso.</p>

<p>Nosso orçamento é baixíssimo, por isso estamos recorrendo ao catarse para conseguir o mínimo necessário para realizar este filme. Nossas maiores despesas serão pagamento de atores, e gastos com transporte, alimentação e estadia das pessoas envolvidas. Nos ajude a tornar este filme uma realidade!</p>
",809-ultima-valsa-longa-metragem,,"http://vimeo.com/44582848 ","Cinema e Vídeo",13,,,,,,8.30769230769230769200,540.0,3,3,failed,aon,finished,"2012-08-21 02:59:59","2012-08-20 23:59:59","2012-06-22 02:59:59","2012-06-21 23:59:59",,t,t,f,60,"{""total"" : 0, ""unit"" : ""seconds""}","{""total"" : 60, ""unit"" : ""days""}",0,"{""city"" : ""São Paulo"", ""state_acronym"" : ""SP"", ""state"" : ""São Paulo""}","{""id"" : 63867, ""name"" : ""Cristiano Belderrain Calegari""}",0,,f,f,0,f,f,f