project_id,id,user_id,name,headline,budget,goal,about_html,permalink,video_embed_url,video_url,category_name,category_id,original_image,thumb_image,small_image,large_image,video_cover_image,progress,pledged,total_contributions,total_contributors,state,mode,state_order,expires_at,zone_expires_at,online_date,zone_online_date,sent_to_analysis_at,is_published,is_expired,open_for_contributions,online_days,remaining_time,elapsed_time,posts_count,address,user,reminder_count,is_owner_or_admin,user_signed_in,in_reminder,total_posts,can_request_transfer,is_admin_role,contributed_by_friends
824,824,57764,"“Fábrica Magno Mello apresenta Bia Marchese, no cd “Alegoria”.","Apoie este projeto que tem tudo para se tornar um dos mais interessantes de 2012","O orçamento para projetos anteriores a 24/02/2015 normalmente pode ser encontrado na descrição acima.",12800.0,"<p>O projeto “Fabrica Magno Mello apresenta Bia Marchese” é a união de um compositor que vem se afirmando como um dos mais criativos na nova cena independente da música brasileira e de uma cantora ainda pouco conhecida do público, mas que tem tudo para ser uma grande revelação vocal neste novo cenário musical. </p>

<p>Magno Mello é compositor, com mais de 80 canções gravadas no cenário independente, que investe alto no poder da palavra, sem deixar para trás a força e a magia da música. Consegue, como poucos, trazer à tona assuntos elaborados, de forma acessível e, especialmente, sensível; e a música continua lá, sempre, nas melodias diferenciadas e harmonias bem acabadas.</p>

<p>Magno representa a nova música brasileira. Mas segundo o jornalista e crítico musical Beto Feitosa, do importante site Ziriguidum: “Magno Mello apresenta um manifesto musical atemporal. É contemporâneo quando fecha os olhos para rótulos e não se preocupa em seguir cartilhas”. </p>

<p>Segundo Juarez Fonseca - Jornalista e um dos principais críticos de música do Sul do país -  “Magno Mello...sem dúvida, afirma-se como um dos melhores novos letristas brasileiros” – 2011.</p>

<p>Quanto à Bia Marchese, não é arriscado afirmar que trata-se de uma cantora de talento incomum;tem uma voz poderosa e, ao mesmo tempo, doce, super afinada, além de interpretação sensível e visceral. </p>

<p>Bia Marchese se diferencia de boa parte das cantoras de sua geração justamente por conseguir trafegar entre melodias suaves, incluindo canções de MPB, e o bom e velho rock and roll.</p>

<p>A cantora vem se apresentando eventualmente em bares e casas de show em São Paulo, sempre surpreendendo o público com suas performances explosivas e técnica impecável. E que já a ouviu ao vivo concorda: está mais do que na hora dessa grande artista, que parece já ter nascido cantando, atingir um número mais significativo de pessoas.</p>

<p>O projeto apresenta onze novíssimas composições de Magno Mello, além da regravação de Metade de Mim, presente no primeiro disco solo do compositor. As canções são muito bem acabadas, com belas e inusitadas melodias, letras urbanas que compreendem o cotidiano atrelado à existência e vice-versa, e batidas entre o pop e o rock – “bons grooves”. Tudo isso com um time de músicos de primeira e a cuidadosa produção de Alexandre Fontanetti.  </p>

<p>É um projeto que tem tudo para dar certo e você pode contribuir para que esse significativo encontro musical seja realizado.</p>
",824-824-fabrica-magno-mello-apresenta-bia-marchese-no-cd-alegoria,//player.vimeo.com/video/45322299,http://vimeo.com/45322299,Música,16,,https://s3-sa-east-1.amazonaws.com/cdn.br.catarse/uploads/project/video_thumbnail/824/project_thumb_thumb_open-uri20131125-2-m3jvr2,https://s3-sa-east-1.amazonaws.com/cdn.br.catarse/uploads/project/video_thumbnail/824/project_thumb_small_open-uri20131125-2-m3jvr2,https://s3-sa-east-1.amazonaws.com/cdn.br.catarse/uploads/project/video_thumbnail/824/project_thumb_large_open-uri20131125-2-m3jvr2,https://s3-sa-east-1.amazonaws.com/cdn.br.catarse/uploads/project/video_thumbnail/824/project_thumb_video_cover_open-uri20131125-2-m3jvr2,25.54687500000000000000,3270.0,34,32,failed,aon,finished,"2012-08-04 02:59:59","2012-08-03 23:59:59","2012-06-05 02:59:59","2012-06-04 23:59:59",,t,t,f,60,"{""total"" : 0, ""unit"" : ""seconds""}","{""total"" : 60, ""unit"" : ""days""}",0,"{""city"" : ""São Paulo"", ""state_acronym"" : ""SP"", ""state"" : ""São Paulo""}","{""id"" : 57764, ""name"" : ""Carlos Magno Mello Dias""}",0,,f,f,0,f,f,f