project_id,id,user_id,name,headline,budget,goal,about_html,permalink,video_embed_url,video_url,category_name,category_id,original_image,thumb_image,small_image,large_image,video_cover_image,progress,pledged,total_contributions,total_contributors,state,mode,state_order,expires_at,zone_expires_at,online_date,zone_online_date,sent_to_analysis_at,is_published,is_expired,open_for_contributions,online_days,remaining_time,elapsed_time,posts_count,address,user,reminder_count,is_owner_or_admin,user_signed_in,in_reminder,total_posts,can_request_transfer,is_admin_role,contributed_by_friends
857,857,82688,"Eletropoeteria em HD","A poesia pode voltar para dentro da rotina das pessoas, sair do papel e ganhar vida! Quer ajudar a Eletropoeteria a fazer isso acontecer?","O orçamento para projetos anteriores a 24/02/2015 normalmente pode ser encontrado na descrição acima.",2735.0,"<p>Em busca de uma nova forma de apresentar e representar a poesia, Lucas Reis Gonçalves (poeta) e Dado Vargas (músico e compositor) criaram o Eletropoeteria, um projeto de declamação poética que tem como objetivo trazer a poesia para dentro da rotina das pessoas e (re)adequá-la à contemporaneidade.</p>

<p>Para dar continuidade a esse objetivo, a Eletropoeteria busca, através do Catarse, um auxílio financeiro para a criação dos seus dois primeiros vídeos em alta definição, que deverão ser produzidos profissionalmente, conforme manda o figurino. Com esses vídeos, buscaremos levar a energia de uma poesia elétrica e eletrificada a outros que não podem acompanhar a Eletropoeteria de perto, conquistando novos espaços, descobrindo novas formas de poetar, e inovar. Afinal, a poesia não pode morrer. </p>

<p>O valor estipulado para arrecadação cobrirá todos os custos com a produção dos vídeos, pagamento da equipe e confecção das recompensas para os apoiadores, pois a Eletropoeteria vive de guitarra e poesia, e todo mundo sabe que cultura underground não vende... </p>

<p>Contamos com a sua colaboração para por esse pequeno sonho em prática e, de quebra, você ainda ajuda a poesia a sair do papel e ganhar vida.</p>
",eletropoeteria-em-hd,//player.vimeo.com/video/46153103,http://vimeo.com/46153103,Literatura,20,,https://s3-sa-east-1.amazonaws.com/cdn.br.catarse/uploads/project/video_thumbnail/857/project_thumb_thumb_open-uri20131125-2-1kxl1oq,https://s3-sa-east-1.amazonaws.com/cdn.br.catarse/uploads/project/video_thumbnail/857/project_thumb_small_open-uri20131125-2-1kxl1oq,https://s3-sa-east-1.amazonaws.com/cdn.br.catarse/uploads/project/video_thumbnail/857/project_thumb_large_open-uri20131125-2-1kxl1oq,https://s3-sa-east-1.amazonaws.com/cdn.br.catarse/uploads/project/video_thumbnail/857/project_thumb_video_cover_open-uri20131125-2-1kxl1oq,2.74223034734917733100,75.0,3,3,failed,aon,finished,"2012-09-12 02:59:59","2012-09-11 23:59:59","2012-07-14 02:59:59","2012-07-13 23:59:59",,t,t,f,60,"{""total"" : 0, ""unit"" : ""seconds""}","{""total"" : 60, ""unit"" : ""days""}",0,"{""city"" : ""São Paulo"", ""state_acronym"" : ""SP"", ""state"" : ""São Paulo""}","{""id"" : 82688, ""name"" : ""   ""}",0,,f,f,0,f,f,f