project_id,id,user_id,name,headline,budget,goal,about_html,permalink,video_embed_url,video_url,category_name,category_id,original_image,thumb_image,small_image,large_image,video_cover_image,progress,pledged,total_contributions,total_contributors,state,mode,state_order,expires_at,zone_expires_at,online_date,zone_online_date,sent_to_analysis_at,is_published,is_expired,open_for_contributions,online_days,remaining_time,elapsed_time,posts_count,address,user,reminder_count,is_owner_or_admin,user_signed_in,in_reminder,total_posts,can_request_transfer,is_admin_role,contributed_by_friends
874,874,24646,"ELKE MARAVILHA DO ""SAGRADO AO PROFANO'  ","ELKE MARAVILHA EM TEMPORADA COM O SHOW
""DO SAGRADO AO PROFANO"", EM SÃO PAULO.
","O orçamento para projetos anteriores a 24/02/2015 normalmente pode ser encontrado na descrição acima.",56000.0,"<p>ELKE MARAVILHA EM TEMPORADA
DO SAGRADO AO PROFANO EM SÃO PAULO</p>

<p>Olá Crianças, temos o desejo de realizar, ainda este ano, uma temporada com oito apresentações do nosso espetáculo musical, que eu adoro! Serão quatro semanas, 6as e sábados, em um teatro de São Paulo (por definir). Para isto, apresentamos nossa idéia e projeto aqui no Catarse, que é o máximo!</p>

<p>No espetáculo, eu, acompanhada dos músicos Leandro Ferro (percussão e bateria), Luiz Claudio Sousa (violão e guitarra) e Yuri Steinhoff (contrabaixo, bandolim e pianola), interpreto canções e textos em 5 idiomas. Passeamos por assuntos como sexualidade, aventura, idealismo, morte da alma, multitude da noite, forças da natureza, singeleza, guerra, amor, tirania, religiosidade, etc. No repertório temos músicas de Antonio Nóbrega, D. Progodine, Mikis Theodorakis, Villa Lobos, Falcão, Cezar Altai, Atahualpa Yupanqui, folclore Afro-Brasileiro, Mineiro e Alemão + textos de Konstantin Kavafis, Etienne de la Boetie, São João Evangelista e Carlos Drummond de Andrade.</p>

<p>Propomos uma abordagem dos temas Sagrado e Profano como espaços do conhecimento sem as velhas e antiquadas separações estabelecidas pelas rígidas muralhas dos moralismos e bélicas cercas dos maniqueísmos - Sem anjos com asas e auréolas versus demônios horrendos fedendo a enxofre; sem nos se servir das mistificações arquetípicas da literatura fantasiosa, o espetáculo propõe a simplicidade do aprendizado pela convivência que reconhece e respeita no outro a presença do sagrado e do profano.</p>

<p>Nós, do “Elke – do Sagrado ao Profano”, acreditamos que o grande amálgama humano é forjado no inconsciente individual e coletivo, onde cada um de nós, com sua particularidade cultural e genética, compõe a rica colcha de retalhos chamada de Humanidade. Tendo consciência disto, podemos seguir com mais união na construção de um mundo onde o respeito e o exercício do amor sejam a tônica e a direção desde já.</p>

<p>Sobre Elke: Artista precursora de um estilo inovador, ousado e único, e que durante toda a sua carreira (TV, Cinema, Teatro e Moda) vem abrindo possibilidades de caminho estético e comportamental. Possuidora de personalidade artística cujo carisma provoca forte identificação popular, Elke se revela mesclando exotismo, misticismo, alegria, inteligência e profundo conhecimento do humano. Sua vibração contagiante a faz mensageira de utopias e portadora de esperanças, tanto na imagem como na mensagem de alegria, inteligência e irreverência.  Obra de arte em constante metamorfose, Elke apostou e continua crendo no sonho possível, onde a soma das diferenças é que constrói e celebra a arte, a possibilidade do amor, a alegria, a pluralidade cultural e a convivência gratificante. </p>

<p>Para viabilizar a temporada em São Paulo, locação do teatro, pagamentos dos profissionais e equipe técnica envolvida, assessoria de imprensa, passagens de Elke (do Rio de Janeiro), confecção de material de divulgação e folder; precisamos arrecadar R$ 56.000,00 (cinqüenta e seis mil reais). Veja ao lado a lista de valores, com suas recompensas, e escolha com o qual poderá colaborar. Desde já agradecemos muito pela sua contribuição e por fazer parte de algo maior, a Arte!!!</p>

<p>É com alegria que comunicamos que 15% do valor arrecadado na bilheteria, durante a temporada, serão destinados ao apoio de projetos que estejam no site do Catarse. Assim, a gente vibra com a proposta do financiamento colaborativo e soma nesta rede de artistas, para realizações culturais.</p>

<p>Sintam-se todos beijados e amados!!!</p>

<p>FICHA TÉCNICA:</p>

<p>Duração: 01:30
Interpretação musical e atuação: ELKE MARAVILHA
Execução musical:
• LUIS CLÁUDIO SOUSA - violões, guitarra e voz;
• LEANDRO FERRO – percussão, bateria e voz;
• YURI STEINHOFF – contrabaixo, bambolim, escaleta e voz.
Direção e participação especial: RUBENS CURI
Cenografia: MARÍLIA CAVALHEIRO
Assistência de cenografia e apoio de palco: MANUELA RAMALHO
Figurino: ELKE MARAVILHA, BRENO BEAUTY e WALÉRIO ARAUJO
Iluminação: MAURÍLIO DOMICIANO
Técnica de som: SCOOBY/FLASH CAETANO
Criação/Projeto Gráfico: VINÍCIUS PRADO
Fotografia e vídeo: RONALDO DIMEROVIC
Preparação vocal Elke Maravilha: ANGELA HERZ
Produção: MAURÍLIO DOMICIANO
Assistente de Produção: JORGE MELLO
Assessoria de Imprensa: RECADO EM DESTAQUE</p>
",874-elke-maravilha-do-sagrado-ao-profano,//player.vimeo.com/video/46465403,http://vimeo.com/46465403,Música,16,,https://s3-sa-east-1.amazonaws.com/cdn.br.catarse/uploads/project/video_thumbnail/874/project_thumb_thumb_open-uri20131125-2-a295fo,https://s3-sa-east-1.amazonaws.com/cdn.br.catarse/uploads/project/video_thumbnail/874/project_thumb_small_open-uri20131125-2-a295fo,https://s3-sa-east-1.amazonaws.com/cdn.br.catarse/uploads/project/video_thumbnail/874/project_thumb_large_open-uri20131125-2-a295fo,https://s3-sa-east-1.amazonaws.com/cdn.br.catarse/uploads/project/video_thumbnail/874/project_thumb_video_cover_open-uri20131125-2-a295fo,1.14285714285714285700,640.0,8,8,failed,aon,finished,"2012-09-28 02:59:59","2012-09-27 23:59:59","2012-07-30 02:59:59","2012-07-29 23:59:59",,t,t,f,60,"{""total"" : 0, ""unit"" : ""seconds""}","{""total"" : 60, ""unit"" : ""days""}",1,"{""city"" : ""São Paulo"", ""state_acronym"" : ""SP"", ""state"" : ""São Paulo""}","{""id"" : 24646, ""name"" : ""Maurilio Domiciano""}",0,,f,f,1,f,f,f