project_id,id,user_id,name,headline,budget,goal,about_html,permalink,video_embed_url,video_url,category_name,category_id,original_image,thumb_image,small_image,large_image,video_cover_image,progress,pledged,total_contributions,total_contributors,state,mode,state_order,expires_at,zone_expires_at,online_date,zone_online_date,sent_to_analysis_at,is_published,is_expired,open_for_contributions,online_days,remaining_time,elapsed_time,posts_count,address,user,reminder_count,is_owner_or_admin,user_signed_in,in_reminder,total_posts,can_request_transfer,is_admin_role,contributed_by_friends
8942,8942,83517," A Caminho da Justiça","Vamos juntos construir um novo Batmóvel!","O orçamento para projetos anteriores a 24/02/2015 normalmente pode ser encontrado na descrição acima.",15000.0,"<p>Seria o Batman o mais famoso super-herói do mundo? Difícil dizer, mas sua simbologia tomou conta do planeta e é facilmente reconhecida. A tragédia de Bruce Wayne que o transformou num vigilante implacável emociona gerações, arrecada bilheterias exorbitantes no cinema e fatura milhões de dólares mensalmente com seus quadrinhos há exatos 75 anos. O Batman é uma figura que faz parte do consciente coletivo desde sempre e não cansa de se revolucionar para as novas gerações, seja em que mídia for.</p><p>Sou Felipe Morcelli, Analista de Sistemas e Programador Web há mais de 10 anos, e acompanho diariamente o Universo DC e seus personagens desde 2008 quando fundei o site Multiverso DC, há quase três anos rebatizado de Terra Zero e hoje o maior site sobre DC Comics em português. Graças a todo este esforço e ao grande sucesso que foi o projeto lançado por mim aqui no Catarse ano passado (o livro ""Fazendo o Homem Acreditar"", sobre o Superman), estou de volta para apresentar mais uma grande homanegem a um ícone imortal: o Batman.</p><p><img src=""http://www.terrazero.com.br/batman75/divisao-livro.png"" alt=""""></p><p>Escrevi e editei ""A Caminho da Justiça"" ao lado do bat-maníaco e bat-especialista Luís Alberto e do camarada Pablo Sarmento (ambos redatores do Terra Zero) para mostrar a todos os fãs e entusiastas brasileiros os motivos de o Batman ter chegado tão longe. Por que ele tem tanto apelo? Como ele se tornou imortal no consciente popular? Como ele evoluiu tanto e por quais mudanças passou para se tornar um ícone do folclore moderno que são os super-heróis? Através da mente de criadores tão imortais quanto o personagem, ""A Caminho da Justiça"" é uma viagem pela evolução do Batman como personagem dentro e fora do universo ficcional. Este é o primeiro livro no mundo a explorar o Batman desta forma, e ele foi criado 100% no Brasil - e não é só isso!</p><p>Para criar recompensas para o projeto, grandes artistas conhecidos mundialmente e ícones do mercado independente nacional pularam neste Batmóvel para fazer o projeto acontecer. Estão conosco:</p><ul>
<li>Daniel HDR (desenhista; Legião dos Super-Heróis, Smallville Season 11)</li>
<li>Rod Reis (desenhista e colorista; Aquaman, Liga da Justiça, C.O.W.L.)</li>
<li>Rodney Buchemi (desenhista; Hércules, Flashpoint: Legion of Doom)</li>
<li>Ton Messa (desenhista independente; Chacal)</li>
<li>Marcio Fiorito (desenhista; Robert Jordan's Wheel of Time: The Eye of the World, Warlord Of Mars)</li>
<li>Luciano Salles (quadrinista; O Quarto Vivente, L'Amour)</li>
<li>Diego Bachini Lima e Victor Bravo (designers)</li>
<li>Rafael Zoccoler (designer e ilustrador - diagramador do livro Fazendo O Homem Acreditar)</li>
<li>Júlio Ferreira (quadrinista; Batwing)</li>
<li>Joá (colaborador do Terra Zero e cineasta)</li>
<li>Laís C. Reis (ilustradora)</li>
</ul><p><img src=""http://www.terrazero.com.br/batman75/Recompensas_Posters(4).jpg"" alt=""""></p><p>A capa final, de Daniel HDR, será divulgada no decorrer da campanha. Fiquem ligados!</p><p>Especificações:
O livro medirá 21×28, tendo entre 120 e 140 páginas. O livro será 100% colorido! A capa será colorida, cartonada, com verniz e orelha. Esta é a versão final impressa que os colaboradores receberão. Pode haver uma pequena margem de erro na quantidade final de páginas, mas será pra mais e não pra menos. Lembrando sempre que o valor arrecadado será investido na impressão dos livros e dos pôsters. Eles também serão coloridos.</p><p><img src=""http://www.terrazero.com.br/batman75/Recompensas_Recompensas(5).jpg"" alt=""""></p><p><img src=""http://www.terrazero.com.br/batman75/divisao-posters.png"" alt=""""></p><p>Luciano Salles:</p><p><img src=""http://www.terrazero.com.br/batman75/poster-batman-luciano-salles.jpg"" alt=""""></p><p>Rod Reis:</p><p><img src=""http://www.terrazero.com.br/batman75/poster-batman-rod-reis.jpg"" alt=""""></p><p>Marcio Fiorito:</p><p><img src=""http://www.terrazero.com.br/batman75/poster-batman-marcio-fiorito2.jpg"" alt=""""></p><p>Rodney Buchemi:</p><p><img src=""http://www.terrazero.com.br/batman75/poster-batman-rodney-buchemi.jpg"" alt=""""></p><p>Ton Messa:</p><p><img src=""http://www.terrazero.com.br/batman75/poster-batman-ton-messa.jpg"" alt=""""></p><p>Diego Bachini / Victor Bravo:</p><p><img src=""http://www.terrazero.com.br/batman75/Mesa.png"" alt=""""></p><p>Rafael Zoccoler</p><p><img src=""http://www.terrazero.com.br/batman75/Poster_Zoccoler_Minimalista_31x44_v2.jpg"" alt=""""></p><p>Júlio Ferreira:</p><p><img src=""http://www.terrazero.com.br/batman75/batposterfinal_julio.jpg"" alt=""""></p><p>Joá:</p><p><img src=""http://www.terrazero.com.br/batman75/MORCEGA_peq.jpg"" alt=""""></p><p>Laís C. Reis:</p><p><img src=""http://www.terrazero.com.br/batman75/IMG-20150122-WA0009.jpg"" alt=""""></p><p>Arte Original Lucas Dametto:</p><p><img src=""http://www.terrazero.com.br/batman75/LucasDametto.jpg"" alt=""""></p><p>Arte Original Jean Sinclair:</p><p><img src=""http://www.terrazero.com.br/batman75/original-batman-jean-sinclair.jpg"" alt=""""></p><p>Arte Original Rodney Buchemi (página Smallville Season 11):</p><p><img src=""http://www.terrazero.com.br/superman75/smallville-rodney.jpg"" alt=""""></p><p>Camiseta Batman 75 Anos (por Ton Messa):</p><p><img src=""http://www.terrazero.com.br/batman75/camiseta-ton-messa.jpg"" alt=""""></p><p>Camiseta Dark Knight Zone (da Quadrim)</p><p><img src=""http://www.quadrimcast.com.br/wp-content/uploads/2014/11/dark_knight_preto.png"" alt=""""></p><p>Print de altíssima qualidade de ""Fazendo O Homem Acreditar"" autografado à mão por Daniel HDR.</p><p><img src=""http://www.terrazero.com.br/v2/images/capa.jpg"" alt=""""></p><p>Conteúdo Digital: Não só os autores da versão impressa do livro serão explorados. Haverá também um blog com conteúdo digital feito exclusivamente para os colaboradores. Cada colaborador receberá uma senha ao final do projeto para acessar este conteúdo exclusivo! Este material, que funciona como uma expansão do livro, explora brevemente os trabalhos de outros autores que não couberam na proposta da obra impressa, como Chuck Dixon, Peter Tomasi, Greg Rucka e Ed Brubaker.</p><p><img src=""http://www.terrazero.com.br/batman75/divisao-legais.png"" alt=""""></p><p>Aspecto legal: o livro tem, unicamente, fins jornalísticos, tratando o Batman como um ícone e uma propriedade da DC Entertainment/Warner Bros. Além dele, estão citados no texto outros personagens de outras editoras [Nota: copyright no rodapé do projeto], o que tornam esta obra única e exclusivamente uma divulgação destes personagem da cultura pop.</p><p>Ajudar este projeto é muito simples e muito significativo: basta colaborar com o valor que cabe no seu bolso e que tenha a recompensa mais bacana pra você. Acredite, TODA ajuda é válida! Colabore, COMPARTILHE, ESPALHE o projeto para seus amigos, grupos de quadrinhos, sites e fóruns. Mostre que todos juntos podemos alcançar a justiça! :D</p><p>Considerações Importantes: graças a todo o aprendizado do projeto ""Fazendo O Homem Acreditar"", o livro ""A Caminho da Justiça"" não deve passar por atrasos, com data prevista de lançamento para 3 meses após o término da campanha no Catarse.</p><p>Muito obrigado!
Felipe Morcelli</p><p>Possui alguma dúvida, sugestão ou crítica? Pode entrar em contato comigo diretamente através do email <a class=""alt-link"" href=""mailto:felipemorcelli@gmail.com"" target=""_blank"">felipemorcelli@gmail.com</a> =)</p><p>For journalistic purposes only. All characters trademarks and copyrights are the property of their respective owners (DC Entertainment, Marvel Comics, Image Comics etc).</p>",batmovel,//player.vimeo.com/video/112480482,https://vimeo.com/112480482,Quadrinhos,7,,https://s3-sa-east-1.amazonaws.com/cdn.br.catarse/uploads/project/video_thumbnail/8942/project_thumb_thumb_open-uri20141202-2-17diunb,https://s3-sa-east-1.amazonaws.com/cdn.br.catarse/uploads/project/video_thumbnail/8942/project_thumb_small_open-uri20141202-2-17diunb,https://s3-sa-east-1.amazonaws.com/cdn.br.catarse/uploads/project/video_thumbnail/8942/project_thumb_large_open-uri20141202-2-17diunb,https://s3-sa-east-1.amazonaws.com/cdn.br.catarse/uploads/project/video_thumbnail/8942/project_thumb_video_cover_open-uri20141202-2-17diunb,127.50000000000000000000,19125.0,263,249,successful,aon,finished,"2015-02-03 23:59:59.999999","2015-02-03 21:59:59.999999","2014-12-05 14:06:17.397785","2014-12-05 12:06:17.397785",,t,t,f,60,"{""total"" : 0, ""unit"" : ""seconds""}","{""total"" : 60, ""unit"" : ""days""}",28,"{""city"" : ""São Paulo"", ""state_acronym"" : ""SP"", ""state"" : ""São Paulo""}","{""id"" : 83517, ""name"" : ""Felipe Morcelli""}",9,,f,f,252,f,f,f