project_id,id,user_id,name,headline,budget,goal,about_html,permalink,video_embed_url,video_url,category_name,category_id,original_image,thumb_image,small_image,large_image,video_cover_image,progress,pledged,total_contributions,total_contributors,state,mode,state_order,expires_at,zone_expires_at,online_date,zone_online_date,sent_to_analysis_at,is_published,is_expired,open_for_contributions,online_days,remaining_time,elapsed_time,posts_count,address,user,reminder_count,is_owner_or_admin,user_signed_in,in_reminder,total_posts,can_request_transfer,is_admin_role,contributed_by_friends
8960,8960,369781,"Livro sobre empreendedorismo e inovação","Conheça histórias de sucessos e fracassos colhidas no mundo todo. Uma verdadeira fonte de inspiração!","O orçamento para projetos anteriores a 24/02/2015 normalmente pode ser encontrado na descrição acima.",20000.0,"<p><img src=""https://s3-sa-east-1.amazonaws.com/cdn.br.catarse/uploads/redactor_rails/picture/data/40198/banner-logo.jpg""></p><p>Leia um livro sobre <strong>empreendedorismo</strong> e <strong>inovação</strong> formatado a partir de experiências vivenciadas ao redor do mundo por um jovem empreendedor brasileiro.<br></p><p>""<em>Acredito que pessoas com <strong>grandes ideias</strong> podem e devem ter <strong>sucesso</strong> em seus projetos de vida. Através de <strong>experiências</strong>, relacionamentos e histórias com <strong>acertos e falhas</strong>. Reuni informações ricas e diferenciadas por meio de <strong>prática e teoria</strong>, tenho a certeza de que serão <strong>valiosas</strong> no desenvolvimento do seu <strong>sonho</strong>. #vamoslá?</em>""</p><p>Renato Ribeiro (autor da série de artigos Appreendedor e futuro livro)</p><p>Para apoiar o seu sonho em poder ajudar as pessoas, Ribeiro, começou a escrever uma série de artigos chamada Appreendedor, lançada em Janeiro de 2014 e desde então publicada semanalmente no portal <a class=""alt-link"" target=""_blank"" href=""http://macmagazine.com.br/author/renato/"">MacMagazine</a> . Inicialmente com foco no universo dos apps, o autor percebeu ao longo do percurso que grande parte dos assuntos abordados poderiam ser aplicados em qualquer área interessada em empreender de forma criativa e inovadora. Desta forma, em Outubro a série ganhou mais um meio de comunicação – <a class=""alt-link"" target=""_blank"" href=""http://startupi.com.br/author/renato-ribeiro/"">Startupi</a> –, portal especializado no mundo do empreendedorismo e startups brasileiras.</p><p>Não satisfeito em contribuir apenas através dos seus textos ricos e inspiradores, o autor criou durante o ano de 2014 um <a class=""alt-link"" target=""_blank"" href=""http://www.renatoribeiro.net/appreendedor/"">curso de imersão no Vale do Silício</a> . Promovendo experiência única e acessível a empreendedores brasileiros. Veja abaixo o video que define bem a essência do projeto Appreendedor.</p><iframe src=""//player.vimeo.com/video/99541013?title=0&byline=0&portrait=0"" width=""600"" height=""403"" frameborder=""0""></iframe><p>""Para falar sobre empreendedorismo e inovação, não basta relatar, você tem que vivenciar."" comenta Ribeiro, ao falar sobre a sequência de viagens que fez ao longo do ano em busca dessa experiência prática.</p><p>Estados Unidos, Dubai, Hong Kong e China foram alguns dos países visitados com a finalidade de colher informações para o curso de imersão. Foram dias e noites de muita dedicação em pesquisas e entrevistas, construindo histórias de pessoas e empresas reais alinhadas a sucessos e fracassos.</p><p>Com certeza, toda essa experiência e trabalho quando organizado em um livro se tornará uma excelente fonte de inspiração para pessoas que buscam e querem fazer a diferença independentemente da área de atuação.</p><p>Para isso, convidamos você a apoiar este projeto adquirindo um dos kits ao lado. <strong>Temos uma meta financeira para o livro se tornar realidade. Caso esta meta não seja atingida, o dinheiro será devolvido pelo Catarse a todos os apoiadores.</strong> Faça parte dessa história e compartilhe o projeto nas redes sociais. Desta forma, mais pessoas conhecerão sobre o projeto e, juntos, tornaremos o livro uma realidade. Falta você para isso!<br><br></p><p><img src=""https://s3-sa-east-1.amazonaws.com/cdn.br.catarse/uploads/redactor_rails/picture/data/40200/banner-depoimentos.jpg""></p><p><br></p><p><strong><img src=""https://s3-sa-east-1.amazonaws.com/cdn.br.catarse/uploads/redactor_rails/picture/data/40199/banner-autor.jpg""><br><br>Renato Ribeiro</strong>, trabalha com tecnologia desde 1995, atuando em diversos seguimentos, dentre eles Segurança da Informação. Especialista em produtos e soluções Apple, recebeu treinamento para instrutores dentro dos centros de formação Apple na Inglaterra, França e Estados Unidos. É fundador da <a class=""alt-link"" target=""_blank"" href=""http://www.ids.com.br"">IDS Tecnologia</a>, empresa autorizada a ministrar treinamento e consultoria Apple no Brasil. Tem forte experiência em eventos internacionais como Apple WWDC, Hong Kong Eletronics Fair e diversos hackathons, dentre eles o Evernote & Honda Hackathon 2013, no qual foi um dos ganhadores. Atualmente dedica seu tempo para a startup <em>Simply as</em> criando soluções simples e inovadoras a partir de oportunidades e problemas identificados no cotidiano.</p><p>Fique por dentro das novidades seguindo o autor nas redes sociais ( <a class=""alt-link"" target=""_blank"" href=""http://www.linkedin.com/in/deadrop"">Linkedin</a> e <a class=""alt-link"" target=""_blank"" href=""http://twitter.com/deadrop/"">Twitter</a> ).<br><br></p><p><img src=""https://s3-sa-east-1.amazonaws.com/cdn.br.catarse/uploads/redactor_rails/picture/data/40201/banner-faq.jpg""></p><p><strong>O livro terá o mesmo conteúdo dos artigos já publicados?</strong>
De forma alguma, o livro será formatado com conteúdos exclusivos e ricos em detalhes.</p><p><strong>Quando o livro será escrito?</strong>
Já tenho bastante conteúdo para o livro, falta a organização e formatação. Assim que atingida a meta financeira (R$ 20.000), inicio imediatamente a construção do livro. </p><p><strong>Em quanto tempo o livro será escrito?</strong>
Estipulei e reservei dois meses de trabalho intenso.</p><p><strong>Quando o livro será entregue?</strong>
O período de campanha é até 10/01/2015, ou seja, se a meta financeira for atingida próximo ao término da campanha, reservarei mais três meses – sendo dois meses escrevendo e um mês para revisão final e impressão. Desta forma, a data estipulada para entrega é início de Abril/2015.</p><p><strong>O livro digital (PDF e ePub) será entregue antecipadamente?</strong>
Não acho justo com quem comprou o livro impresso, ou seja, todos serão entregues no mesmo período.</p><p><strong>Consigo ler o livro digital no meu computador ou tablet?</strong>
Sim, o formato é compatível com qualquer dispositivo e sistema.</p><p><strong>Como o dinheiro arrecadado será aplicado?</strong>
13% comissão Catarse;
15% divulgação e produção;
30% recompensas e envio;
40% impressão do livro;
2% cafés e energéticos :D</p><p><strong>O que é o KIT WELCOME?</strong>
Esse kit foi elaborado para quem deseja apoiar o projeto e não tem interesse no livro digital ou impresso. Como forma de agradecimento – assim que finalizado o período de campanha –, o doador receberá instruções via email para acompanhar através de uma página web a construção dos 5 primeiros capítulos do livro.</p><p><strong>O que é o KIT E-BOOK?</strong>
Esse kit foi elaborado para quem deseja o livro e não se importa de ler em um dispositivo eletrônico. Como forma de agradecimento, o livro terá uma área especial contendo o nome de todas as pessoas que adquirirem o livro completo em seu KIT.</p><p><strong>O que é o KIT BIBLIOTECA?</strong>
Esse kit foi elaborado para quem deseja 1 livro impresso. Como forma de agradecimento, o livro terá uma área especial contendo o nome de todas as pessoas que adquirirem o livro completo em seu KIT. Além de acesso ao livro na versão digital (E-BOOK).</p><p><strong>O que é o KIT PRESENTE?</strong>
Esse kit foi elaborado para quem deseja 2 livros impressos e autografados. Como forma de agradecimento, o livro terá uma área especial contendo o nome de todas as pessoas que adquirirem o livro completo em seu KIT. Além de acesso ao livro na versão digital (E-BOOK). Também será enviado como brinde 2 adesivos exclusivos com o logo do Appreendedor.</p><p><strong>O que é o KIT EMPREENDEDOR?</strong>
Esse kit foi elaborado para o empreendedor que deseja receber 6 horas de mentoria a respeito do seu projeto (pode ser algo já implementado ou não). Caso seja do interesse, a história do projeto poderá ser avaliada pelo autor e entrar para o livro como um dos cases que serão apresentados (o critério de seleção é estar de acordo com os propósitos do livro). Este KIT inclui acesso ao livro na versão digital (E-BOOK), 3 livros impressos e autografados, 3 adesivos exclusivos com o logo do Appreendedor e nome no livro em área especial. Embora a data estimada de entrega do livro seja para início de Abril/2015, o empreendedor poderá agendar as horas de consultoria a qualquer momento após o término da campanha em 10/01/2015.</p><p><strong>O que é o KIT PALESTRA?</strong>
Esse kit foi elaborado para empresas ou grupos que desejam promover uma palestra do autor sobre o livro (não existe quantidade mínima ou máxima de participantes). Caso seja do interesse, a data e local da palestra poderá ser divulgada em um dos artigos da série Appreendedor. Este KIT inclui 15 livros impressos e autografados, 15 adesivos exclusivos com o logo do Appreendedor e nome da empresa ou grupo em área especial anunciada como patrocinadora. A data da palestra deverá ser agendada a partir de Abril/2015, de acordo com disponibilidade e no mínimo com duas semanas antes do evento.</p><p><strong>Problemas com cadastro ou transações financeiras podem ser resolvidas pelo email <a class=""alt-link"" href=""mailto:contato@catarse.me"" target=""_blank"">contato@catarse.me</a></strong></p><p><strong>Dúvidas e sugestões sobre o livro podem ser encaminhadas para o email <a class=""alt-link"" href=""mailto:appreendedor@simplyas.com"" target=""_blank"">appreendedor@simplyas.com</a></strong></p><hr><p>Agradecimentos especiais ao amigo <a class=""alt-link"" target=""_blank"" href=""http://twitter.com/_everaldo"">Everaldo Coelho</a> pela foto de capa.</p>",appreendedor,//player.vimeo.com/video/113472367,https://vimeo.com/113472367,Literatura,20,https://s3-sa-east-1.amazonaws.com/cdn.br.catarse/uploads/project/uploaded_image/8960/appreendedor-ponte-512x400.png,https://s3-sa-east-1.amazonaws.com/cdn.br.catarse/uploads/project/uploaded_image/8960/project_thumb_thumb_appreendedor-ponte-512x400.png,https://s3-sa-east-1.amazonaws.com/cdn.br.catarse/uploads/project/uploaded_image/8960/project_thumb_small_appreendedor-ponte-512x400.png,https://s3-sa-east-1.amazonaws.com/cdn.br.catarse/uploads/project/uploaded_image/8960/project_thumb_large_appreendedor-ponte-512x400.png,https://s3-sa-east-1.amazonaws.com/cdn.br.catarse/uploads/project/uploaded_image/8960/project_thumb_video_cover_appreendedor-ponte-512x400.png,109.75500000000000000000,21951.0,74,67,successful,aon,finished,"2015-01-11 01:59:59","2015-01-10 23:59:59","2014-12-11 02:00:21.899113","2014-12-11 00:00:21.899113",,t,t,f,30,"{""total"" : 0, ""unit"" : ""seconds""}","{""total"" : 30, ""unit"" : ""days""}",3,"{""city"" : ""Brasília"", ""state_acronym"" : ""DF"", ""state"" : ""Distrito Federal""}","{""id"" : 369781, ""name"" : ""Renato Ribeiro""}",0,,f,f,3,f,f,f