project_id,id,user_id,name,headline,budget,goal,about_html,permalink,video_embed_url,video_url,category_name,category_id,original_image,thumb_image,small_image,large_image,video_cover_image,progress,pledged,total_contributions,total_contributors,state,mode,state_order,expires_at,zone_expires_at,online_date,zone_online_date,sent_to_analysis_at,is_published,is_expired,open_for_contributions,online_days,remaining_time,elapsed_time,posts_count,address,user,reminder_count,is_owner_or_admin,user_signed_in,in_reminder,total_posts,can_request_transfer,is_admin_role,contributed_by_friends
92,92,827,"O que se passa na sua cabeça?","O primeiro videocirco do mundo? Ajude a transformar esta pesquisa em um movimento mundial de fusão entre a arte do circo e do vídeo!","O orçamento para projetos anteriores a 24/02/2015 normalmente pode ser encontrado na descrição acima.",1200.0,"<p>O que se passa na sua cabeça?</p>

<p>Contextualizando...</p>

<p>Você gosta de circo? Gosta de vídeo, de cinema? É provável que sim. Então, também é provável que se interesse por esta idéia: videocirco.</p>

<p>Sou Diego Esteves, coordeno o Núcleo de Estudos e Experimentações com Circo e Transversalidades – NECITRA. Dentro deste, temos o interesse em criações híbridas: circo com dança, com teatro de bonecos, teatro de objetos, artes visuais, enfim: transversalidades. </p>

<p>O projeto de videocirco começou há pouco mais de um ano e este vídeo específico há sete meses. Depois de algumas outras experimentações, consideramos este o nosso primeiro videocirco, por seu cuidado e detalhes. Mas o que é videocirco?</p>

<p>Conceituando...</p>

<p>Movimentos múltiplos ao quadrado: o encontro do circo com o vídeo. As referências da videodança e da videoarte. O circo e sua gama de técnicas, de aparelhos, que já não é só a  proeza, mas também dança, é poético e político, também representa e, principalmente, se apresenta. É o circo contemporâneo. E como seria esse circo na tela? Como registrar, como editar, como definir o foco, ângulos, a relação com os objetos, com o espaço, com a comicidade, com os momentos de tensão, de contemplação... O que registrar no vídeo, e como fazê-lo, a partir das variações que o circo contemporâneo manifesta? </p>

<p>Na prática...</p>

<p>Você será o financiador dos primeiros passos deste projeto. O Catarse nos disponibilizou a ferramenta, e com sua participação, dando crédito, teremos um indicativo de que o projeto está num caminho certo e que seu primeiro passo será firme e confiante. Neste vídeo de apresentação, que conta com trilha original criada por Yanto Laitano para o espetáculo Gestos e Restos, você pode conhecer a primeira parte dessa obra. As tomadas externas e a trilha original serão criadas nesta segunda etapa. Bem como nosso site, que hoje é um apeas um blog, mas que logo contará com mais e mais vídeos: <a class=""alt-link"" href=""http://videocirco.com"" target=""_blank"">http://videocirco.com</a>.</p>

<p>Participe desta primeira obra, colabore, receba sua recompensa, conheça também o NECITRA (<a class=""alt-link"" href=""http://necitra.com"" target=""_blank"">http://necitra.com</a>) e fique mais próximo do mundo do circo!</p>

<p>O que achou disso tudo? O que está pensando? Aliás, o que se passa na sua cabeça?</p>
",92-o-que-se-passa-na-sua-cabeca,//player.vimeo.com/video/20981957,http://vimeo.com/20981957,"Teatro e Dança",19,,https://s3-sa-east-1.amazonaws.com/cdn.br.catarse/uploads/project/video_thumbnail/92/project_thumb_thumb_open-uri20131125-2-eaqcnf,https://s3-sa-east-1.amazonaws.com/cdn.br.catarse/uploads/project/video_thumbnail/92/project_thumb_small_open-uri20131125-2-eaqcnf,https://s3-sa-east-1.amazonaws.com/cdn.br.catarse/uploads/project/video_thumbnail/92/project_thumb_large_open-uri20131125-2-eaqcnf,https://s3-sa-east-1.amazonaws.com/cdn.br.catarse/uploads/project/video_thumbnail/92/project_thumb_video_cover_open-uri20131125-2-eaqcnf,285.0000000000000000,3420.0,43,43,successful,aon,finished,"2011-05-17 02:59:59","2011-05-16 23:59:59","2011-03-18 02:59:59","2011-03-17 23:59:59",,t,t,f,60,"{""total"" : 0, ""unit"" : ""seconds""}","{""total"" : 60, ""unit"" : ""days""}",2,"{""city"" : ""Porto Alegre"", ""state_acronym"" : ""RS"", ""state"" : ""Rio Grande do Sul""}","{""id"" : 827, ""name"" : ""Diego Winck Esteves""}",0,,f,f,2,f,f,f