project_id,id,user_id,name,headline,budget,goal,about_html,permalink,video_embed_url,video_url,category_name,category_id,original_image,thumb_image,small_image,large_image,video_cover_image,progress,pledged,total_contributions,total_contributors,state,mode,state_order,expires_at,zone_expires_at,online_date,zone_online_date,sent_to_analysis_at,is_published,is_expired,open_for_contributions,online_days,remaining_time,elapsed_time,posts_count,address,user,reminder_count,is_owner_or_admin,user_signed_in,in_reminder,total_posts,can_request_transfer,is_admin_role,contributed_by_friends
94,94,1200,"Oficina Devoluções","Nas mãos de designers, objetos encontrados no lixo recebem novos usos.  Essa é a proposta do projeto Reconstruções.","O orçamento para projetos anteriores a 24/02/2015 normalmente pode ser encontrado na descrição acima.",7000.0,"<p>A cidade de Belém do Pará produz em média 420 mil toneladas de lixo por ano, e apenas 44% vem sendo depositado de maneira adequada em aterro controlado e sanitário. O depósito de entulhos e lixo doméstico em plena via pública é cena comum. Moradores tentam livrar-se do problema transportando resíduos de toda espécie de um bairro para o outro, ou simplesmente descarregando nos rios que cortam a cidade.</p>

<p>Porém, este cenário negativo pode propiciar novas oportunidades no campo do Ecodesign.</p>

<p>O Reconstruções tem a proposta de conceber novos produtos a partir da reutilização de objetos descartados. Para este reaproveitamento, propõe-se a realização de uma oficina com aplicação de uma metodologia própria. A partir da análise das funções do produto/lixo e de sua relação social e ambiental, um novo ciclo de vida é projetado, buscando a ressignificação do resíduo e a extensão da vida útil do material.</p>

<p>A oficina será ofertada para 20 profissionais e estudantes dos Cursos de Design, Arquitetura, Artes Visuais e áreas afins, com duração de um mês. Ao final da atividade, espera-se obter móveis, objetos e peças de moda, concebidos e construídos pelos participantes a partir da apropriação de resíduos coletados no centro urbano e nos rios que circundam a cidade de Belém.</p>

<p>O valor a ser arrecadado no Catarse contempla os itens necessários à realização da oficina, entre eles, a compra de materiais (tintas, lixas, solda, silicone, anti-ferrugem, massa plástica, entre outros); o transporte (frete de van para levar os participantes a lixões, sucatas e para a coleta de lixo nas ruas da cidade, e de um barco para a coleta de resíduos nos rios e mangues); o suporte técnico terceirizado (pagamento de diárias para costureira, eletricista e ferreiro); e a pós-produção (ensaio fotográfico dos produtos concebidos).</p>

<p>Custos operacionais relacionados à estrutura física como sala de aula e laboratório de modelos (marcenaria), são garantidos por outros parceiros do Reconstruções.</p>

<p>Contribuindo para a realização do projeto, você receberá como recompensa produtos exclusivos concebidos pelos participantes da oficina. Mas é preciso explicar uma coisa: o Reconstruções não restringe as idéias dos participantes da oficina, apenas direcionamos o projeto através das análises (aplicação da metodologia do projeto) e acompanhamos a produção. Dessa forma GARANTIMOS A QUALIDADE, mas não as características dos produtos. Os alunos podem desenvolver, por exemplo, produtos reutilizando uma embalagem, um capacete, um guarda-chuva, peças de carro, enfim, qualquer coisa que coletar. Nunca sabemos ao certo o que vai sair, e esse é o grande barato: atiçar a criatividade para conceber produtos exclusivos e inusitados!</p>

<p>Dessa forma, as doações pelo Catarse funcionarão como uma espécie de encomenda de produtos através das faixas de valores estipuladas ao lado. Dá uma conferida!</p>

<p>Para saber mais sobre o projeto e ver exemplos dos produtos que você pode levar como recompensa, visite <a class=""alt-link"" href=""http://www.reconstrucoes.com"" target=""_blank"">www.reconstrucoes.com</a></p>
",94-oficina-devolucoes,//player.vimeo.com/video/21027219,http://www.vimeo.com/21027219,"Design e Moda",9,,https://s3-sa-east-1.amazonaws.com/cdn.br.catarse/uploads/project/video_thumbnail/94/project_thumb_thumb_open-uri20131125-2-esuz4k,https://s3-sa-east-1.amazonaws.com/cdn.br.catarse/uploads/project/video_thumbnail/94/project_thumb_small_open-uri20131125-2-esuz4k,https://s3-sa-east-1.amazonaws.com/cdn.br.catarse/uploads/project/video_thumbnail/94/project_thumb_large_open-uri20131125-2-esuz4k,https://s3-sa-east-1.amazonaws.com/cdn.br.catarse/uploads/project/video_thumbnail/94/project_thumb_video_cover_open-uri20131125-2-esuz4k,11.00000000000000000000,770.0,19,18,failed,aon,finished,"2011-04-26 02:59:59","2011-04-25 23:59:59","2011-02-25 02:59:59","2011-02-24 23:59:59",,t,t,f,60,"{""total"" : 0, ""unit"" : ""seconds""}","{""total"" : 60, ""unit"" : ""days""}",1,"{""city"" : ""Belém"", ""state_acronym"" : ""PA"", ""state"" : ""Pará""}","{""id"" : 1200, ""name"" : ""Geyzislaine""}",0,,f,f,1,f,f,f