project_id,id,user_id,name,headline,budget,goal,about_html,permalink,video_embed_url,video_url,category_name,category_id,original_image,thumb_image,small_image,large_image,video_cover_image,progress,pledged,total_contributions,total_contributors,state,mode,state_order,expires_at,zone_expires_at,online_date,zone_online_date,sent_to_analysis_at,is_published,is_expired,open_for_contributions,online_days,remaining_time,elapsed_time,posts_count,address,user,reminder_count,is_owner_or_admin,user_signed_in,in_reminder,total_posts,can_request_transfer,is_admin_role,contributed_by_friends
945,945,88012,"Você tem Medo do Escuro?","Você tem medo do escuro? É uma pergunta que nada tem de inocente nesse espetáculo, por isso, convidamos você a experimentá-la conosco!","O orçamento para projetos anteriores a 24/02/2015 normalmente pode ser encontrado na descrição acima.",2700.0,"<p>O Projeto “Você tem Medo do Escuro” é o primeiro espetáculo desenvolvido pela “A Cia do Grito”, uma companhia de pouco tempo de surgimento que vem trabalhando para colocar seus projetos no circuito teatral da cidade, além de ter como um dos objetivos, resgatar a importância da inserção de novos talentos em um mercado contemporâneo de consumo cultural, que através dessa forma de manifestação artística, cria um exercício importante para suas futuras carreiras na arte. A busca pela realização desse trabalho visa criar material para ser apresentado em festivais, consolidando assim cada vez mais a “Cia” como profissional.</p>

<p>Você tem medo do escuro? É uma pergunta infantil que nada tem de inocente nesse espetáculo, talvez você não pense muito a respeito para respondê-la, mas é muito mais complexo do que se imagina. Um casal a beira do fim de um relacionamento enfrenta seus medos, angústias, incertezas e vontades até então não experimentadas. A trajetória da descoberta de si mesmo e do outro leva a muitos questionamentos e personagens enigmáticos. O espetáculo trata do amor, da confiança e dos medos, de uma forma drástica e poética, de sentimentos intensos e assustadores. Se você não tem certeza se tem medo do escuro, experimente a dúvida, queremos entrar no teu imaginário, queremos saber quem você é e o que veio fazer no mundo. Se a tempestade não quiser passar, dance na chuva e surpreenda-se.</p>

<p>É claro que a experiência dessa dúvida só poderá ser vivenciada após a realização do espetáculo, e para que você possa assistir à peça, nós precisamos atingir o orçamento necessário para realizá-la! 
Basta que você apoie nosso projeto com alguma das quantias propostas em troca de muitas recompensas. Nossa primeira temporada já tem prévia data marcada para estrear, sendo dia 01 de setembro e consiste em nove apresentações. Para a realização deste projeto temos um orçamento mínimo para montagem que está calculado em R$ 2.700. 
Com a sua ajuda pagaremos apenas a locação do teatro para esse período de temporada que irá durar dois meses, o restante dos equipamentos como cenário, figurinos, equipamentos de luz, divulgação (cartazes e flyers), espaço de ensaio e apresentação, conseguimos parceiros que nos apoiassem de alguma forma e o que não foi suprido, foi investimento dos próprios profissionais envolvidos. </p>

<p>O espetáculo propõe uma reflexão sobre o que move o ser humano e o que o leva onde está. Será a vontade dele? Será o acaso? Será a insatisfação ou será simplesmente destino? Tende a resgatar a sensibilidade de lidar com os sentimentos próprios e dos outros, convida a experimentar a dúvida desse escuro e não o medo que ele proporciona. Com um toque sensível e poético, as cenas convidam o espectador a dançar por esse mundo e descobri-lo junto com nossa protagonista, criando novas expectativas, sonhando novos sonhos, adquirindo novas obrigações e, porque não, criando novas dúvidas.
As perguntas movem o mundo? Temos todas as respostas? No final das contas, você tem medo do escuro? </p>

<p>Seja um patrocinador dessa história e ajude-nos a realizar um sonho que está se tornando realidade a duras penas e muito trabalho, mas com o único intuito de compartilhar essa história com todas as pessoas que pudermos alcançar e que precisam de arte e entretenimento em suas vidas.</p>
",945-voce-tem-medo-do-escuro,//player.vimeo.com/video/48122606,"http://vimeo.com/48122606 ","Teatro e Dança",19,,,,,,0,0,0,0,failed,aon,finished,"2012-10-01 02:59:59","2012-09-30 23:59:59","2012-08-02 02:59:59","2012-08-01 23:59:59",,t,t,f,60,"{""total"" : 0, ""unit"" : ""seconds""}","{""total"" : 60, ""unit"" : ""days""}",0,"{""city"" : ""Florianópolis"", ""state_acronym"" : ""SC"", ""state"" : ""Santa Catarina""}","{""id"" : 88012, ""name"" : """"}",0,,f,f,0,f,f,f