project_id,id,user_id,name,headline,budget,goal,about_html,permalink,video_embed_url,video_url,category_name,category_id,original_image,thumb_image,small_image,large_image,video_cover_image,progress,pledged,total_contributions,total_contributors,state,mode,state_order,expires_at,zone_expires_at,online_date,zone_online_date,sent_to_analysis_at,is_published,is_expired,open_for_contributions,online_days,remaining_time,elapsed_time,posts_count,address,user,reminder_count,is_owner_or_admin,user_signed_in,in_reminder,total_posts,can_request_transfer,is_admin_role,contributed_by_friends
946,946,89946,"O homem do principio ao fim."," Exclusivo!!!!!!!!
 Atores da cia Bará descobrem que Adão era gay e Jesus naturalista.","O orçamento para projetos anteriores a 24/02/2015 normalmente pode ser encontrado na descrição acima.",4000.0,"<p>Nós, integrantes da Cia. Bará -  cujo nome evoca a terra, o corpo, a vida - , e que vem desenvolvendo projetos culturais desde 2007 sob a direção de Diego Gonzalez, aqui estamos para pedir a colaboração de vocês para viabilizarmos nosso novo trabalho.
     Ele nasce de um texto feito com muitos textos, variado e amplo como nossos sonhos. 
     Diante dele, podemos perguntar:<br>
     Como fazer uma colcha de retalhos sem que se sobreponha a costura? Como fazer de retalhos, de recortes, um desenho poético? Como transformar o desenho poético em uma oferenda artística? 
     A Cia. Bará se apaixona por essa idéia. A colcha de retalhos é o texto de Millôr Fernandes, “O homem do princípio ao fim”. Nela o autor constrói seu próprio texto entrelaçando-o com o de diversos autores, com obras e personagens que fazem parte da nossa referência cultural. 
     A proposta é encenar brincando com a mágica de fazer desaparecer a costura, substituindo os fios pela música e pela poesia, tirando do trágico o quê de cômico ele possui; da seriedade, a irreverência; da sacralidade, a ironia e o sarcasmo. 
     A Cia. Bará foi acolhida pelo espaço do centenário Casarão da FESP para fazer do texto de Millôr Fernandes um desenho poético que procura tocar de alguma maneira cada um que percorrer conosco as salas, as escadas, os corredores deste casarão. E que ao ser tocado, algo se transforme. Que seja possível o riso, onde parecia não caber o humor; a emoção, onde tudo estava endurecido; o movimento, onde só dava para ver inércias. 
     O que temos é um espaço que nos acolheu e o trabalho dos atores que preparam a colcha com os fios de seus corpos. Não podemos cobrar ingressos. Não temos nenhum recurso além do que estamos podendo disponibilizar. Você pode sonhar esse sonho conosco. Nossa aposta  agora é aqui, no Catarse. Participe!  Sua ajuda chegará para nós somente se captarmos pelo menos 100% do valor proposto.  Nossa aposta é que você pode ser também uma parte deste desenho. Nós necessitamos de dinheiro para pagar toda a parte técnica da montagem do espetáculo. Que o nosso convite chegue até você. Somente com a sua colaboração este projeto poderá se realizar!</p>

<p>Temporada: 27 e 28/10,  3,4,10,11,17,18,24 e 25/11, todos os sábados e domingos. Sábados 20:00, Domingos 19:00.
Local: R. General jardim, 522, Vila buarque, perto das estações Santa cecilia e república do metro.</p>
",946-o-homem-do-principio-ao-fim,//player.vimeo.com/video/44398675,http://vimeo.com/44398675,"Teatro e Dança",19,,https://s3-sa-east-1.amazonaws.com/cdn.br.catarse/uploads/project/video_thumbnail/946/project_thumb_thumb_open-uri20131125-2-3rdpx4,https://s3-sa-east-1.amazonaws.com/cdn.br.catarse/uploads/project/video_thumbnail/946/project_thumb_small_open-uri20131125-2-3rdpx4,https://s3-sa-east-1.amazonaws.com/cdn.br.catarse/uploads/project/video_thumbnail/946/project_thumb_large_open-uri20131125-2-3rdpx4,https://s3-sa-east-1.amazonaws.com/cdn.br.catarse/uploads/project/video_thumbnail/946/project_thumb_video_cover_open-uri20131125-2-3rdpx4,100.00000000000000000000,4000.0,17,16,successful,aon,finished,"2012-10-21 02:59:59","2012-10-20 23:59:59","2012-08-22 02:59:59","2012-08-21 23:59:59",,t,t,f,60,"{""total"" : 0, ""unit"" : ""seconds""}","{""total"" : 60, ""unit"" : ""days""}",0,"{""city"" : ""São Paulo"", ""state_acronym"" : ""SP"", ""state"" : ""São Paulo""}","{""id"" : 89946, ""name"" : """"}",0,,f,f,0,f,f,f