project_id,id,user_id,name,headline,budget,goal,about_html,permalink,video_embed_url,video_url,category_name,category_id,original_image,thumb_image,small_image,large_image,video_cover_image,progress,pledged,total_contributions,total_contributors,state,mode,state_order,expires_at,zone_expires_at,online_date,zone_online_date,sent_to_analysis_at,is_published,is_expired,open_for_contributions,online_days,remaining_time,elapsed_time,posts_count,address,user,reminder_count,is_owner_or_admin,user_signed_in,in_reminder,total_posts,can_request_transfer,is_admin_role,contributed_by_friends
948,948,90902,"DOIS PESOS E DUAS MEDIDAS","O filme mostra como a indústria do tabaco exerce sua influência até no Poder Judiciário, através da história de uma das vítimas do tabagismo","O orçamento para projetos anteriores a 24/02/2015 normalmente pode ser encontrado na descrição acima.",23900.0,"<p>“Dois pesos e duas medidas” é o título do projeto do documentário que mostra como o lobby de uma das maiores indústrias do Brasil e do mundo – a do tabaco – consegue exercer sua influência até no Poder Judiciário ao negar o direito à indenização para uma vítima do tabagismo que teve suas pernas amputadas por uma doença causada exclusivamente pelo cigarro, a tromboangeíte obliterante. O filme visa sensibilizar a população de que, no caso de vítimas do tabagismo, a Justiça vem utilizando pesos e medidas diferentes quando se fala em direito do consumidor.</p>

<p>O filme, um curta de 25 minutos de duração, conta a história do aposentado José Carlos Carneiro através de questões como dependência do cigarro, saúde, luta pelos direitos e expectativas para o futuro e traz também depoimentos de médicos e advogados especialistas em direitos humanos e direitos do consumidor.   José Carlos, que ficou conhecido ao ter sua imagem estampada nas advertências sanitárias dos maços de cigarros em 2004, é hoje, aos 65 anos, um símbolo nas campanhas antitabagismo. </p>

<p>O valor arrecadado para o projeto será utilizado para a produção do filme, assim como para a compra de uma cadeira de rodas motorizada para o Zé Carlos, campanha promovida pela ONG Aliança de Controle do Tabagismo (ACT) iniciada em 2011. 
O filme será disponibilizado gratuitamente para utilização em universidades, palestras, eventos e mídias sociais com o objetivo de engajar pessoas e alertá-las sobre as estratégias desta indústria que age de forma irresponsável para promover e defender seus interesses comerciais em detrimento da saúde pública, e fomentar o debate acerca do atual entendimento do Poder Judiciário que tem negado a responsabilidade civil de fabricantes de cigarros pelos danos causados aos seus consumidores e familiares.</p>

<p>A iniciativa é da ACT (actbr.org.br), ONG que atua há mais de cinco anos na promoção de políticas públicas de controle do tabagismo, em parceria com o cineasta Rodrigo Gontijo, professor do curso de Comunicação em Multimeios da PUC- SP e diretor de documentários como “Jaraguá – terra sem mal”, “Heliópolis – um lugar ao sol” e “Vila Guilherme – do pombo-correio ao email” integrantes do projeto História dos Bairros /TV Cultura, “Kuaray – a história de um brasileiro” financiado pelo ProAc – preservação da memória indígena e “O escasso ar de uma ilha” que recebeu dois prêmios no Festival de Gramado. </p>

<p>• Sobre as doações: esclarecemos que o Catarse é um dos primeiros portais de financiamento coletivo (crowdfunding) do Brasil e já viabilizou mais de 290 projetos. Se após o tempo estipulado para arrecadação das contribuições, o projeto que você apoiou não atingiu o valor final para a execução, você receberá o dinheiro de volta em créditos no Catarse para que possa apoiar outro projeto. Caso prefira receber o dinheiro de volta, pode solicitar o estorno. </p>
",doispesosduasmedidas,//player.vimeo.com/video/47304418,http://vimeo.com/47304418,"Cinema e Vídeo",13,,https://s3-sa-east-1.amazonaws.com/cdn.br.catarse/uploads/project/video_thumbnail/948/project_thumb_thumb_open-uri20131125-2-7unaye,https://s3-sa-east-1.amazonaws.com/cdn.br.catarse/uploads/project/video_thumbnail/948/project_thumb_small_open-uri20131125-2-7unaye,https://s3-sa-east-1.amazonaws.com/cdn.br.catarse/uploads/project/video_thumbnail/948/project_thumb_large_open-uri20131125-2-7unaye,https://s3-sa-east-1.amazonaws.com/cdn.br.catarse/uploads/project/video_thumbnail/948/project_thumb_video_cover_open-uri20131125-2-7unaye,100.00000000000000000000,23900.0,73,69,successful,aon,finished,"2012-10-17 02:59:59","2012-10-16 23:59:59","2012-08-18 02:59:59","2012-08-17 23:59:59",,t,t,f,60,"{""total"" : 0, ""unit"" : ""seconds""}","{""total"" : 60, ""unit"" : ""days""}",1,"{""city"" : ""Rio de Janeiro"", ""state_acronym"" : ""RJ"", ""state"" : ""Rio de Janeiro""}","{""id"" : 90902, ""name"" : ""Daniela Guedes""}",0,,f,f,1,f,f,f