project_id,id,user_id,name,headline,budget,goal,about_html,permalink,video_embed_url,video_url,category_name,category_id,original_image,thumb_image,small_image,large_image,video_cover_image,progress,pledged,total_contributions,total_contributors,state,mode,state_order,expires_at,zone_expires_at,online_date,zone_online_date,sent_to_analysis_at,is_published,is_expired,open_for_contributions,online_days,remaining_time,elapsed_time,posts_count,address,user,reminder_count,is_owner_or_admin,user_signed_in,in_reminder,total_posts,can_request_transfer,is_admin_role,contributed_by_friends
958,958,57764," “Fabrica Magno Mello apresenta Bia Marchese” (continuação)","Dê o seu apoio e participe dessa história!","O orçamento para projetos anteriores a 24/02/2015 normalmente pode ser encontrado na descrição acima.",6700.0,"<p>Olá amigos,</p>

<p>Esta é a continuação do projeto “Fabrica Magno Mello apresenta Bia Marchese”: a união musical de um compositor que nos últimos anos vem apresentando trabalho consistente e de uma cantora ainda pouco conhecida do público, mas que tem tudo para se tornar revelação neste novo cenário musical.</p>

<p>O projeto apresenta, em cd, onze novíssimas composições de Magno Mello, além da regravação de Metade de Mim, presente no primeiro disco solo do compositor. </p>

<p>As canções trazem melodias modernas e bem trabalhadas, letras urbanas que compreendem o cotidiano atrelado à existência e vice-versa, e batidas dançantes entre o pop e o rock. E conta com um time de músicos de primeira, além da cuidadosa produção de Alexandre Fontanetti (Rita Lee, Ana Cañas, entre outros).</p>

<p>O cd já está gravado, em fase de finalização, e precisamos de seu apoio para terminar as mixagens e a masterização.</p>

<p>Para ouvir mais nosso trabalho acesse: <a class=""alt-link"" href=""http://www.myspace.com/magnomello"" target=""_blank"">www.myspace.com/magnomello</a></p>

<p>Dê o seu apoio e participe dessa história!</p>

<p>Sobre o compositor e a cantora:</p>

<p>Magno Mello é compositor, com mais de 80 canções gravadas no cenário independente, que investe alto no poder da palavra, sem deixar para trás a força e a magia da música. Consegue, como poucos, trazer à tona assuntos elaborados, de forma acessível e, especialmente, sensível; e a música continua lá, sempre, nas melodias diferenciadas e harmonias bem acabadas.</p>

<p>Magno representa a nova música brasileira. Mas segundo o jornalista e crítico musical Beto Feitosa, do importante site Ziriguidum: “Magno Mello apresenta um manifesto musical atemporal. É contemporâneo quando fecha os olhos para rótulos e não se preocupa em seguir cartilhas”.</p>

<p>Segundo Juarez Fonseca – Jornalista e um dos principais críticos de música do Sul do país – “Magno Mello…sem dúvida, afirma-se como um dos melhores novos letristas brasileiros” – 2011.</p>

<p>Quanto à Bia Marchese, não é arriscado afirmar que trata-se de uma cantora de talento incomum;tem uma voz poderosa e, ao mesmo tempo, doce, super afinada, além de interpretação sensível e visceral.</p>

<p>Bia Marchese se diferencia de boa parte das cantoras de sua geração justamente por conseguir trafegar entre melodias suaves, incluindo canções de MPB, e o bom e velho rock and roll.</p>

<p>A cantora vem se apresentando eventualmente em bares e casas de show em São Paulo, sempre surpreendendo o público com performances explosivas e por tantas vezes, sensíveis. E quem já ouviu ao vivo concorda: está mais do que na hora dela atingir um público maior...</p>
",958-958-fabrica-magno-mello-apresenta-bia-marchese-continuacao,//player.vimeo.com/video/48717860,http://vimeo.com/48717860,Música,16,,https://s3-sa-east-1.amazonaws.com/cdn.br.catarse/uploads/project/video_thumbnail/958/project_thumb_thumb_open-uri20131125-2-13nuwns,https://s3-sa-east-1.amazonaws.com/cdn.br.catarse/uploads/project/video_thumbnail/958/project_thumb_small_open-uri20131125-2-13nuwns,https://s3-sa-east-1.amazonaws.com/cdn.br.catarse/uploads/project/video_thumbnail/958/project_thumb_large_open-uri20131125-2-13nuwns,https://s3-sa-east-1.amazonaws.com/cdn.br.catarse/uploads/project/video_thumbnail/958/project_thumb_video_cover_open-uri20131125-2-13nuwns,100.00000000000000000000,6700.0,32,31,successful,aon,finished,"2012-09-24 02:59:59","2012-09-23 23:59:59","2012-07-26 02:59:59","2012-07-25 23:59:59",,t,t,f,60,"{""total"" : 0, ""unit"" : ""seconds""}","{""total"" : 60, ""unit"" : ""days""}",0,"{""city"" : ""São Paulo"", ""state_acronym"" : ""SP"", ""state"" : ""São Paulo""}","{""id"" : 57764, ""name"" : ""Carlos Magno Mello Dias""}",0,,f,f,0,f,f,f