project_id,id,user_id,name,headline,budget,goal,about_html,permalink,video_embed_url,video_url,category_name,category_id,original_image,thumb_image,small_image,large_image,video_cover_image,progress,pledged,total_contributions,total_contributors,state,mode,state_order,expires_at,zone_expires_at,online_date,zone_online_date,sent_to_analysis_at,is_published,is_expired,open_for_contributions,online_days,remaining_time,elapsed_time,posts_count,address,user,reminder_count,is_owner_or_admin,user_signed_in,in_reminder,total_posts,can_request_transfer,is_admin_role,contributed_by_friends
975,975,86306,"Sombras de Um Rio","A ausência de luz causada por uma barragem","O orçamento para projetos anteriores a 24/02/2015 normalmente pode ser encontrado na descrição acima.",52667.0,"<p><img src=""http://www.sombrasdeumrio.com/logo.jpg"" alt=""""/></p>

<p><img src=""http://www.sombrasdeumrio.com/a.jpg"" alt=""""/></p>

<p>Sombras de Um Rio é um documentário curta-metragem que retrata a luta e o futuro incerto de milhares de pessoas que vivem a margem do Rio Xingu, na Amazônia Brasileira, devido a construção da usina Hidrelétrica (UHE) de Belo Monte, a terceira maior usina hidrelétrica do mundo.
 Em 2011, fizemos duas viagens para a região do Xingu. Na primeira, visitamos a cidade de Altamira e as comunidades de Belo Monte, Santo Antonio e Vila Nova, localizadas em áreas que serão diretamente afetadas pela UHE. Gravamos relatos e depoimentos de pescadores, moradores e representantes de movimentos sociais e participamos de uma reunião com os pescadores, liderada pelo Movimento Xingu Vivo para Sempre, na comunidade de Vila Nova.
 Na segunda viagem, presenciamos o seminário Territórios, ambiente e desenvolvimento na Amazônia: a luta contra os grandes projetos hidrelétricos na bacia do Xingu também em Altamira. Esse seminário contou com participação das populações atingidas e resultou na ocupação do canteiro de obras pelos seus participantes.</p>

<p>Entrevistamos também pesquisadores em Belém e outras cidades da região com o intuito de entender um pouco mais o que está acontecendo.
 A partir do material bruto captado durante esses momentos, estamos produzindo um documentário que não tem a pretensão de falar pelos povos da floresta, mas de falar com eles: fazer eco às suas reivindicações e tentar mostrar como a UHE de Belo Monte é pensada por aqueles que sofrerão diretamente com sua construção.</p>

<p>Queremos mostrar a luta e o pensamento dessas pessoas, mas também sua relação com nosso principal personagem, o Rio Xingu. São as narrativas, a convivência e a interação das pessoas da região com o rio que nos dão nosso fio condutor e nosso centro emotivo. A natureza da relação dos povos da floresta com o Xingu, passa pelo seu cotidiano e sua subsistência, mas também pela
 sua mitologia. E, assim, precisamos recorrer a linguagens alternativas, como a animação, que vem sendo cada dia mais explorada em suas potencialidades documentais.</p>

<p>Atualmente, estamos vendo, revendo e estruturando nosso material bruto. Colocamos nosso projeto e intenções aqui no Catarse com o intuito de conseguir parceiros que acreditem em um projeto como esse e que contribuam para que possamos editar as imagens, fazer a animação e finalizar nosso documentário. Até agora todos os custos referentes às viagens e filmagens foram inteiramente bancados com recursos próprios que, contudo, não são capazes de cobrir essa última etapa de elaboração do filme. E, para isso, precisamos da sua ajuda!</p>

<p><img src=""http://www.sombrasdeumrio.com/cartaz.jpg"" alt=""""/></p>

<p><img src=""http://www.sombrasdeumrio.com/d.jpg"" alt=""""/></p>

<p>A construção da UHE de Belo Monte tem sido objeto de debate e conflito por mais de 20 anos entre a sociedade civil organizada e representantes do governo e empresários. Com a licença de instalação, emitida pelo IBAMA, a região afetada pela obra passa por um processo de grande transformação, com altas dos preços, invasão de terras, aumento do número populacional, etc.
 É um momento importante na história da região e é dentro desse contexto que o documentário se insere.</p>

<p>A obra, irá inundar permanentemente uma área de mais de 600km2. A vazão da água acima do barramento do rio, em Volta Grande do Xingu, será reduzida e o transporte fluvial até o Rio Bacajá, um dos afluentes da margem direita do Xingu, será interrompido.
 O Rio Xingu, um dos mais importantes da Amazônia, garante a subsistência de 25 mil indígenas de 24 etnias, milhares de ribeirinhos, extrativistas, agricultores e inumeráveis espécies de plantas e animais. A Bacia do Rio Xingu é o maior mosaico de áreas protegidas do Brasil, incluindo terras
 indígenas e unidades de conservação.
 A alteração do fluxo rio, além afetar o modo de vida das populações locais, altera todo o ciclo ecológico da região, implicando na morte de espécies nativas, na migração de mais de 100 mil pessoas para a região e no deslocamento forçado de mais de 20 mil pessoas.</p>

<p>O caso de Belo Monte envolve a construção de uma usina sem reservatório e que dependerá da sazonalidade das chuva. Por isso, para alguns críticos, em época de cheia, a usina deverá operar com metade da capacidade, mas, em tempo de seca, a geração pode ir um pouco abaixo de 4,5 mil MW, o que somado aos vários passivos sociais e ambientais coloca em xeque a viabilidade e legitimidade do projeto.
 O que está acontecendo na região hoje lembra o que ocorreu nas décadas de 1970 e 1980 com a construção das usinas hidrelétricas de Tucuruí (PA) e Balbina (AM). Comunidades foram desalojadas, enormes extensões de terra foram inundadas e a fauna e flora das regiões foram destruídas.
 A contrapartida, que era o abastecimento de energia elétrica da população local, não foi cumprida. Cientistas, pesquisadores, comunidades e movimentos sociais questionam a relação custo-benefício da obra, o destino da energia a ser produzida e a inexistência de uma política energética para o país que privilegie energias alternativas.</p>

<p><img src=""http://www.sombrasdeumrio.com/b.jpg"" alt=""""/></p>

<div class=""video youtube""><iframe width=""600"" height=""403"" src=""//www.youtube.com/embed/sbcZmJcauig?wmode=opaque"" frameborder=""0"" allowfullscreen></iframe></div>

<p><img src=""http://www.sombrasdeumrio.com/c.jpg"" alt=""""/></p>

<p><em>FERNANDA BRITO</em> é uma de nossas diretoras. Paraense, sempre brincou com imagens. Desde meados da década de 1990, trabalha com fotografia e artes visuais, mas estende suas experimentações também pro vídeo e pra película cinematográfica. Foi, durante muitos anos, assistente de câmera em produções de longa e curta-metragens, publicidade e vídeoclips. Nos últimos cinco anos, fez a direção de fotografia de diversos filmes e, atualmente, soma a esses trabalhos a direção de algumas produções.</p>

<p><em>LOU SPINELI</em> é também diretora de Sombras de um rio. Formada em Sociologia pela University of Central Florida, com vasta experiência em gestão de projetos culturais, sociais e ambientais, adquirida ao longo de 20 anos de trabalhos realizados com ONGs nacionais e internacionais com foco sempre voltado para a Amazônia. Trabalhou em institutos como The Nature conservancy,
 Woods Hole Reaserch Center, Fundacion Des Del Chaco, PNUD, Fundação Odebrecht, Instituto de Pesquisa Ambiental da Amazônia, entre outras. É sócio gerente da Girândola Cultural, produtora de nosso filme, empresa especializada em produção de documentários sociais.</p>

<p><em>DANIEL MANZINI</em> é o Diretor de Arte e responsável pela identidade visual de nosso filme. Estudou Artes Plásticas na UNESP e, desde o início dos anos 2000, trabalha em agências de design e propaganda como diretor de arte. Desenvolve investigações no campo das artes visuais e, simultaneamente, trabalha com animação e motion graphics.</p>

<p><em>VITOR GRUNVALD</em> é fotógrafo e videomaker. Nascido também em Belém, estudou Jornalismo e Ciências Sociais na PUC-Rio e, após mestrado no Museu Nacional, desenvolve, atualmente, um projeto de Doutorado em Antropologia Visual na USP. Possui formação em Direção Cinematográfica pela Academia Internacional de Cinema e é integrante do Laboratório de Imagem e Som em Antropologia (LISA/USP). Nos últimos anos, conjuga a produção audiovisual e o trabalho de formação de novos documentaristas. Foi responsável pelas Oficinas de documentário oferecidas em 2011 e 2012 no Centro de Preservação Cultural também da USP e, para o nosso filme, trabalha como montador.</p>

<p><a class=""alt-link"" target=""_blank"" href=""https://docs.google.com/open?id=0B6CWbFgaLF0QY2Rvb0g2eEVNdzg"">ORÇAMENTO</a></p>

<p><a class=""alt-link"" target=""_blank"" href=""https://www.facebook.com/SombrasDeUmRio"">FACEBOOK</a></p>

<p><a class=""alt-link"" target=""_blank"" href=""https://twitter.com/SombrasdeumRio"">TWITTER</a></p>

<p><a class=""alt-link"" target=""_blank"" href=""http://www.sombrasdeumrio.com"">NOSSO SITE</a></p>
",sombrasdeumrio,//player.vimeo.com/video/49137719,http://vimeo.com/49137719,"Cinema e Vídeo",13,,https://s3-sa-east-1.amazonaws.com/cdn.br.catarse/uploads/project/video_thumbnail/975/project_thumb_thumb_open-uri20131125-2-12qhxsl,https://s3-sa-east-1.amazonaws.com/cdn.br.catarse/uploads/project/video_thumbnail/975/project_thumb_small_open-uri20131125-2-12qhxsl,https://s3-sa-east-1.amazonaws.com/cdn.br.catarse/uploads/project/video_thumbnail/975/project_thumb_large_open-uri20131125-2-12qhxsl,https://s3-sa-east-1.amazonaws.com/cdn.br.catarse/uploads/project/video_thumbnail/975/project_thumb_video_cover_open-uri20131125-2-12qhxsl,3.53162321757457231300,1860.0,25,25,failed,aon,finished,"2012-11-01 01:59:59","2012-10-31 23:59:59","2012-09-02 01:59:00","2012-09-01 22:59:00",,t,t,f,60,"{""total"" : 0, ""unit"" : ""seconds""}","{""total"" : 60, ""unit"" : ""days""}",1,"{""city"" : ""São Paulo"", ""state_acronym"" : ""SP"", ""state"" : ""São Paulo""}","{""id"" : 86306, ""name"" : ""aparecida de lourdes spineli""}",0,,f,f,1,f,f,f