project_id,id,user_id,name,headline,budget,goal,about_html,permalink,video_embed_url,video_url,category_name,category_id,original_image,thumb_image,small_image,large_image,video_cover_image,progress,pledged,total_contributions,total_contributors,state,mode,state_order,expires_at,zone_expires_at,online_date,zone_online_date,sent_to_analysis_at,is_published,is_expired,open_for_contributions,online_days,remaining_time,elapsed_time,posts_count,address,user,reminder_count,is_owner_or_admin,user_signed_in,in_reminder,total_posts,can_request_transfer,is_admin_role,contributed_by_friends
983,983,91416,"A GRANDE OBRA","O projeto tem como objectivo despertar nas pessoas a autoconfiança, faze-las acreditar em si mesma.
nos acreditamos no proximo!","O orçamento para projetos anteriores a 24/02/2015 normalmente pode ser encontrado na descrição acima.",2000.0,"<p>O Curta - Metragem &quot; A GRANDE OBRA&quot; faz parte do projeto final do curso Lanterna Mágica da escola de Cinema Digital Melies.</p>

<p>Já estamos em processo deProdução, o curta conta a historia de Oleno,
um rapaz extremamente sensível que tem um talento extraordinário para as artes, porém sua arte não é compreendida e ele acaba por não acreditar que pode vencer com sua arte.</p>

<p>&quot; A GRANDE OBRA&quot;é um filme que está mexendo com toda a equipe, queremos fazer uma grande obra, e pra isso estamos trabalhando com carinho na fotográfia, trilha sonora, direção de arte e elenco, todos os detalhes da produção estão sendo divulgados via email, facebook e you tube.</p>

<p>Estamos no Catarse para arrecadar o valor necessário para cobrir gastos das filmagens, como: alimentação do elenco, transporte, aluguel de locação e objetos de cena, o valor que estamos solicitando será somado ao que já temos para a conclusão do curta.</p>

<p>O projeto tem como objectivo despertar nas pessoas a autoconfiança, faze-las acreditar em si mesma, me ao mesmo tempo lança uma luz sobre a sociedade para a importância do respeito e a tolerância com todos que estão ao nosso lado.
Assim como Oleno, precisamos de ajuda para divulgar a nossa arte e fazer o cinema brasileiro acontecer .</p>
",agrandeobra,,http://vimeo.com/49344901,"Cinema e Vídeo",13,,,,,,10.50000000000000000000,210.0,4,4,failed,aon,finished,"2012-10-30 01:59:59","2012-10-29 23:59:59","2012-08-31 01:59:59","2012-08-30 22:59:59",,t,t,f,60,"{""total"" : 0, ""unit"" : ""seconds""}","{""total"" : 60, ""unit"" : ""days""}",0,"{""city"" : ""São Paulo"", ""state_acronym"" : ""SP"", ""state"" : ""São Paulo""}","{""id"" : 91416, ""name"" : ""Bruno Morais""}",0,,f,f,0,f,f,f